Ⅰ．景気の現状に対する判断理由等,,,,,
,,□,テーマパーク（職員）,来客数の動き,・ロシアへの経済制裁で世の中全体がインフレ傾向にある。消費者物価が上昇傾向となれば、消費は全体的に悪化していく。
,,□,競輪場（職員）,単価の動き,・今月の客単価は1万4130円で、３か月前の1万4623円から微減となっているが、大きな変化はない。
,,□,美容室（店員）,単価の動き,・単価自体は変わらないが、来店周期は人によってばらつきがある。
,,□,住宅販売会社（経営者）,販売量の動き,・建築資材などについては、調達価格の上昇と納期の遅れが続いている。
,,□,住宅販売会社（経営者）,お客様の様子,・コロナ禍の出口は感じられるものの、今のところ劇的に回復したとは言い難い。
,,□,住宅販売会社（従業員）,お客様の様子,・新築分譲マンションの販売に関しては、集客が順調に継続しており、専有面積の広い高額物件が人気を集めている。全体の契約率も高い状態が続いている。
,,□,その他住宅［展示場］（従業員）,来客数の動き,・住宅展示場への来場者数は、相変わらず前年比で１割減少という状況が続いている。
,,□,その他住宅［情報誌］（編集者）,お客様の様子,・年末から不動産の販売状況には減速感があったが、年度末にかけて横ばいとなっている。ただし、急速なコストアップが発生しており、今後の価格上昇が大きな懸念材料である。
,,▲,一般小売店［事務用品］（経営者）,販売量の動き,・コロナ禍に加えて、様々な材料の値上げに伴って価格が変わるほか、ウクライナ危機の影響で石油に由来する製品の生産調整が始まっているなど、供給に関する課題が多い。
,,▲,百貨店（企画担当）,販売量の動き,・12月の売上は前年比で20％台の増加率であったが、３月は25日現在で10％台前半となっている。ただし、前年の３月は緊急事態宣言の解除により、回復が大きく進んだ月であったため、それを踏まえると数字は悪くない。
,,▲,百貨店（宣伝担当）,お客様の様子,・まん延防止等重点措置が解除され、来客数は回復したものの、売上が伴っていない。世界情勢の悪化や原油価格の上昇、株安などの様々な要因から、客の財布のひもがかなり固くなっていると感じる。
,,▲,スーパー（企画担当）,お客様の様子,・様々な原材料や商品が値上げ対象となっているが、競合店もあるなかで、そのまま販売価格に転嫁することは難しい。大手企業との戦いはますます厳しくなっている。
,,▲,スーパー（社員）,競争相手の様子,・コロナ禍の拡大による内食需要の高まりで、食品スーパーは２年にわたって好調な売上が続いていた。現在はこの反動を徐々に受けており、一時は緩やかであった競争も、再び厳しい状況となっている。
,,▲,衣料品専門店（経営者）,来客数の動き,・来客数が低迷している。一部は戻ってきているが、全体的には低調である。
,,▲,家電量販店（店員）,来客数の動き,・ロシアのウクライナ侵攻により、世の中の流れが不安定になり、来客数が減少しているような気がする。原油価格の高騰もあり、現状は厳しい。
,,▲,家電量販店（企画担当）,来客数の動き,・新生活商戦が始まっているが、シングル用の家電購入を目的とした来店が減っている。携帯電話やスマートフォンを購入する学生の来店も限定的で、例年以上に来客数が減っている。
,,▲,その他専門店［ガソリンスタンド］（経理担当）,販売量の動き,・原油価格の高騰が社会や経済に与える影響は大きい。また、新型コロナウイルスの新規感染者数はピークアウトしたものの、減少ペースは予想よりも鈍い。
,,▲,その他小売［インターネット通販］（経営者）,来客数の動き,・新型コロナウイルスの感染症対策のため、外出が控えられており、来客数の減少が深刻である。
,,▲,その他飲食［自動販売機（飲料）］（管理担当）,販売量の動き,・まん延防止等重点措置が解除されても、大企業によるリモートワークは続くため、オフィス内での売上の増加は見込めない。
,,▲,都市型ホテル（管理担当）,来客数の動き,・まん延防止等重点措置でキャンセルが多数発生し、新規予約は鈍化するなど、業況は低迷している。
,,▲,通信会社（企画担当）,お客様の様子,・まん延防止等重点措置が解除されても、受注の勢いは感じられず、様子見の取引先が多い。デジタルシフトのニーズは高まっているが、前年のような勢いはなく、受注件数も金額も伸びていない。
,,▲,その他レジャー施設［飲食・物販系滞在型施設］（企画担当）,販売量の動き,・物販店やレストランの売上が低迷している。
,,▲,美容室（店長）,来客数の動き,・コロナ禍が続くなか、当店は高齢者の客が多いため、開店休業状態である。
,,▲,住宅販売会社（総務担当）,単価の動き,・ウクライナ危機により、資材の調達に時間が掛かるほか、価格が高騰している。
,,▲,その他住宅投資の動向を把握できる者［不動産仲介］（経営者）,それ以外,・ロシアのウクライナ侵攻による物価の上昇で、景気の減速が進んでいると感じる。
,,▲,その他住宅［住宅設備］（営業担当）,販売量の動き,・半導体不足が報じられているが、当社もかなり影響を受けている。基盤以外にも配線ケーブルや各種スイッチなどの電材関係も入荷の予定が立たず、工事が先延ばしになっている。
,,×,一般小売店［呉服］（店員）,お客様の様子,・新型コロナウイルスの影響が続くなか、世界でいろいろなことが起きている。全ての物が値上がりし、客は買い控えをしている。
,,×,衣料品専門店（経営者）,来客数の動き,・今月は寒く、高齢者が今まで以上に買物に出掛けられなくなったため、売上が悪い。もちろん、まん延防止等重点措置や新型コロナウイルスの影響もある。
,,×,住関連専門店（店長）,それ以外,・まん延防止等重点措置は解除されたが、客の戻りが遅く、目立った回復の兆しもない。
,,×,都市型ホテル（管理担当）,来客数の動き,・３月21日まで、まん延防止等重点措置が適用されていたため、営業時間の短縮で収入は厳しい状況にある。
"企業
動向
関連

(近畿)",,◎,－,－,－
,,○,金属製品製造業（営業担当）,受注量や販売量の動き,・資源価格の値上がりを見越して、早めに在庫を確保する動きがある。
,,○,建設業（経営者）,受注量や販売量の動き,・受注は停滞していたが、ここへきて問合せや案件の依頼が増えつつある。
,,○,広告代理店（営業担当）,受注量や販売量の動き,・Ｗｅｂ媒体、紙媒体共に、広告売上は前年を少し上回っている。
,,○,広告代理店（営業担当）,受注量や販売量の動き,・まん延防止等重点措置も解除になり、４月以降のイベントなどの広告出稿が再開されつつある。
,,□,食料品製造業（営業担当）,取引先の様子,・まん延防止等重点措置が解除になっても、余り人の流れは変わらず、飲料水の売上も余り変わっていない。
,,□,パルプ・紙・紙加工品製造業（経営者）,受注量や販売量の動き,・３月は年度末であるが、取引先が在庫調整をしている。
,,□,出版・印刷・同関連産業（企画営業担当）,受注量や販売量の動き,・数か月前と比べても、受注量に変化は感じられず、厳しい状態が続いている。
,,□,化学工業（管理担当）,受注量や販売量の動き,・前年末までは自動車関連を中心に好調であったが、年明け以降は、出荷量が自動車、家電、建設土木関連共に減少している。
,,□,電気機械器具製造業（経理担当）,受注量や販売量の動き,・業態による格差があり、一概に良くなったとはいえない。また、半導体を始めとする電子部品の不足はまだ続いており、改善の兆しがみられない。
,,□,電気機械器具製造業（宣伝担当）,受注量や販売量の動き,・洗濯機や冷蔵庫、エアコンなど、大型の白物家電は前年を上回る動きとなっている。
,,□,建設業（経営者）,受注価格や販売価格の動き,・半導体などの不足により、給湯器やウォシュレットなどの納期が不確定で苦慮している。建設資材価格も急騰しており、工事の凍結や延期、縮小が増えている。
,,□,輸送業（営業担当）,取引先の様子,・学習机が売れるシーズンであるが、商品が入らず配達ができていない。
,,□,金融業［投資運用業］（代表）,それ以外,・コロナ禍の影響としか言いようがない。街を歩く人がマスクを着けているのをみると、いつまでも注意や自粛という心理が知らず知らずにはたらき、消費行動にも影響が出るのを感じる。
,,□,金融業（営業担当）,受注価格や販売価格の動き,・材料や商品が入ってこないため、建設関連では現場の工事が完了できず、資金繰りに支障が出ている。
,,□,その他サービス［自動車修理］（経営者）,取引先の様子,・コロナ禍の影響や物価の上昇により、良い方向には進まない。
,,□,その他サービス業［店舗開発］（従業員）,受注量や販売量の動き,・中旬以降、徐々に新型コロナウイルスの新規感染者数が減少し始めたため、駅構内の店舗の利用者数も徐々に増えた。まん延防止等重点措置の解除を待たずに、観光地の駅の乗降客は一気に増え始めたが、夕方以降の客足の引きは相変わらず早い。
,,□,その他非製造業［機械器具卸］（経営者）,受注量や販売量の動き,・受注量や見積量は、前年と比べてやや少なめで動いている。
,,□,その他非製造業［商社］（営業担当）,受注量や販売量の動き,・引き合いは増えてきたが、原材料の値上がりに対応し、製品価格を見直す必要がある。その影響がどう出るのかが、まだまだ分からない。
,,▲,食料品製造業（従業員）,受注量や販売量の動き,・まん延防止等重点措置が解除され、一部の商品は動き出しているが、全体的な荷動きは良くなっていない。
,,▲,繊維工業（団体職員）,受注価格や販売価格の動き,・原材料費や加工料の値上げが続いている。
,,▲,繊維工業（総務担当）,それ以外,・加工料や原材料の単価が上がってきている。商品価格への転嫁は難しく、利益の減少につながっている。
,,▲,プラスチック製品製造業（経営者）,受注量や販売量の動き,・世界的な半導体不足の影響で、受注はあるが、納期が２～３か月先の案件も出始めている。単純に１か月当たりの売上が減少している。
,,▲,窯業・土石製品製造業（管理担当）,それ以外,・売上はまず堅調に推移しているが、ロシアのウクライナ侵攻の影響で燃料費の高騰が避けられず、純利益の減少が予想される。ウクライナ情勢がこう着状態で、先行きの見通しがはっきりしないことも不安材料である。またコロナ禍については、新型コロナウイルスの新規感染者数が減少傾向であるものの、高止まりしており予断を許さない。
,,▲,金属製品製造業（経営者）,受注量や販売量の動き,・半導体不足や海外からの部品の入荷遅延で、自動車工場の稼働率が改善されていない。さらに、ここへきて鋼材価格や諸物価の上昇により、産業全体に減速感が出てきている。
,,▲,一般機械器具製造業（設計担当）,それ以外,・僅かながらも物価は上昇している。
,,▲,電気機械器具製造業（経営者）,受注量や販売量の動き,・前年は良好な環境が続き、今年も半導体関連業界は悪くないが、ロシアのウクライナ侵攻が始まり、核戦争の危機も高まっている。また、まん延防止等重点措置が解除されても、コロナ禍の完全な収束は見通せず、とにかく悪い材料が増えている。
,,▲,電気機械器具製造業（営業担当）,受注量や販売量の動き,・材料不足で電子部品の納期が延びているため、思うようには受注ができない。
,,▲,建設業（経営者）,受注価格や販売価格の動き,・資材価格などの上昇分を、販売価格に転嫁しきれない。
,,▲,金融業（副支店長）,取引先の様子,・まん延防止等重点措置は解除されたが、取引先からは、消費者の財布のひもは引き続き固いという声が出ている。
,,×,一般機械器具製造業（経営者）,受注量や販売量の動き,・コロナ禍の影響で受注が激減するなか、更にウクライナ危機の影響で引き合いが減っている。
,,×,不動産業（営業担当）,取引先の様子,・まん延防止等重点措置は解除されたが、人出は悪く、アパレル会社からは家賃の値下げ交渉がきている。それらの動きに伴い、ますます賃料は下がり、景気が悪くなってくる。
,,×,その他非製造業［電気業］（営業担当）,受注量や販売量の動き,・新型コロナウイルスの影響とウクライナ問題で、世界経済が混乱している。
"雇用
関連

(近畿)",,◎,－,－,－
,,○,人材派遣会社（役員）,求人数の動き,・求人の動きは引き続き堅調である。
,,○,人材派遣会社（営業担当）,求人数の動き,・３月の派遣依頼件数は、前々年の実績を超えている。
,,○,人材派遣会社（管理担当）,求人数の動き,・まん延防止等重点措置の解除前から求人数に動きがあり、更に解除後はより一層、動きが出てきている。徐々にではあるが活発になっている。
,,○,職業安定所（職員）,周辺企業の様子,・回復は顕著ではないが、周辺企業の話を聞くと、良くなる方向に向かっているケースが多い。
,,○,民間職業紹介機関（営業担当）,求人数の動き,・コロナ禍による特需関連の求人に加えて、通常の派遣求人数も増加している。
,,□,人材派遣会社（経営者）,求人数の動き,・年度末本来の慌ただしさがなく、淡々としたなぎ状態が続いている。新年度からの案件は、ほぼ３か月単位の短期が主流で、その後についてもコロナ禍やウクライナ問題で慎重にならざるを得ない。仕事量が増えるという感覚はなく、現状維持となる。
,,□,人材派遣会社（営業担当）,それ以外,・４月以降は多くの商品の価格が上昇する。今のところ、ウクライナ侵攻に伴うロシアへの経済制裁で、日本が受ける影響は不透明である。
,,□,新聞社［求人広告］（管理担当）,求人数の動き,・まん延防止等重点措置が解除され、飲食や旅行、観光業など、これまで大きなダメージを受けた業界の求人も戻ってくる。ただし、現時点では明らかに回復した様子は見られず、他の業界の求人にも目立った増加はみられない。
,,□,職業安定所（職員）,求人数の動き,・新規求人数は前年と比べると増加しており、飲食サービス業の求人数も徐々に持ち直している。
,,□,職業安定所（職員）,求人数の動き,・大阪の有効求人倍率は前月から0.01ポイント上昇したが、有効求職者数の減少幅が有効求人数を上回ったことが要因であり、回復に向けた力強さはみられない。産業別の新規求人数では、卸売・小売業が前年比で3.0％減少するなど、弱い動きが続いている。一方、新規求職では在職者数の増加が目立っており、副業希望者や転職希望者の動きが反映されたと考えられる。
,,□,民間職業紹介機関（営業担当）,採用者数の動き,・コロナ禍でも、学生の就職率に変化はみられない。
,,□,民間職業紹介機関（営業担当）,周辺企業の様子,・新卒採用市場では、３月は広報が解禁され、選考の最中となるため、求人広告メディアでは大きな動きはない。４月以降は早期内定組の結果が出た後なので、広告の増減が注目される。次年度の2024年卒の採用を見越したインターンシップ情報の広告掲載数は、前年並みかやや増加傾向であり、夏のインターンシップの募集に向けて、どれだけ増えるかが景気の判断材料となる。
,,□,学校［大学］（就職担当）,雇用形態の様子,・医療系の高等教育機関ということもあるが、国家資格を取得することが最優先となっている。資格の取得後に求職活動を行うが、医療施設は人手不足であり、えり好みをしなければ採用活動に成功する。ただし、求人数も多いものの、希望の水準を下げないため、結果が出ていないケースもみられる。
,,▲,人材派遣会社（支店長）,求職者数の動き,・人材の採用がうまくいかず、売上が伸びていない。
,,▲,新聞社［求人広告］（営業担当）,周辺企業の様子,・一見関係がなさそうな取引先であっても、ロシアのウクライナ侵攻で様々な影響が出ているという話をよく聞く。また、多くの企業が自社商品の値上げに踏み切っていることから、景気は悪くなっているように感じる。
,,▲,新聞社［求人広告］（担当者）,それ以外,・新聞広告の動きをみると、まん延防止等重点措置の延長もあり、回復の兆しが全くみえない。
,,▲,学校［大学］（就職担当）,周辺企業の様子,・現在の地政学的な問題が長引けば、ますます経済に与える影響が強くなる。採用活動には余り影響していないが、今後は不透明であり、先行きを注視する必要がある。
,,×,－,－,－
,,,,,
　９．中国（地域別調査機関：公益財団法人中国地域創造研究センター）,,,,,
,,,,,（－：回答が存在しない、＊：主だった回答等が存在しない）
分野,,景気の現状判断,業種・職種,判断の理由,追加説明及び具体的状況の説明
"家計
動向
関連

(中国)
",,◎,自動車備品販売店（経営者）,販売量の動き,・４月からの値上げで、駆け込み需要が思ったより多く、今月だけ見れば販売量がすごく良い。
,,◎,観光型ホテル（副支配人）,販売量の動き,・３か月前はまん延防止等重点措置で施設の休館があって客の動きは全くなかったが、３月に施設が開館して、今まで利用できなかった常連客の利用が急激に増えている。
,,○,一般小売店［眼鏡］（経営者）,販売量の動き,・前年同月と比べて売上が微増している。
,,○,一般小売店［印章］（経営者）,販売量の動き,・年度末の影響で人の動きが多少良くなっている。
,,○,一般小売店［靴］（経営者）,来客数の動き,・インターネット上での受注だけでなく、実店舗への来客数が微増している。
,,○,一般小売店［茶］（経営者）,お客様の様子,・春の陽気で、人の動きが出ている。残念ながら売上は上向いていないが、数か月先のイベント等の話も入ってきている。
,,○,百貨店（営業担当）,単価の動き,・店舗周辺環境の変化の影響もあるが、来客数は前年を割るなか、売上は前年を上回る。
,,○,百貨店（売場担当）,お客様の様子,・気温が少しずつ上昇し、人の動きも活発になってきている。売上が非常に悪かったトラベルバッグ関係は少しずつ復調の兆しが出てきた。
,,○,百貨店（外商担当）,お客様の様子,・３月に入り新型コロナウイルス新規感染者数が減少し、まん延防止等重点措置の解除に伴って来客数と売上が若干上向き傾向にある。
,,○,百貨店（営業企画担当）,お客様の様子,・２月は気温が低く降雪日も多かったので春物衣料品の売上が悪かったが、３月に入り気温の上昇とともに婦人衣料を中心に回復傾向にある。新型コロナウイルス感染者も横ばい傾向になり、イベントでの客動員は増えてきている。
,,○,スーパー（店長）,単価の動き,・まん延防止等重点措置が解除されて来客数は少しずつ増加し、客の購買単価も上昇している。
,,○,スーパー（販売担当）,それ以外,・客の購入点数が増加している。
,,○,スーパー（販売担当）,お客様の様子,・まん延防止等重点措置が解除されてから、売上が前年の92％、来客数が94％と、回復傾向にある。現在、新生活向けのキャンペーンを実施していることもあり、更なる回復が見込まれる。
,,○,コンビニ（副地域ブロック長）,販売量の動き,・人の動きが出てきており、グループで来店する客が増えているので、今まで低迷していた食品を中心に客の購入点数が増加している。
,,○,衣料品専門店（代表）,来客数の動き,・まん延防止等重点措置が解除されてから、客が少しずつ外出するようになっている。
,,○,家電量販店（企画担当）,来客数の動き,・まん延防止等重点措置が解除されて来客数が増加し、売上も上昇している。
,,○,乗用車販売店（営業担当）,来客数の動き,・３か月前と比較すると点検や新車購入の来客数が増加している。
,,○,自動車備品販売店（経営者）,販売量の動き,・４月からの値上げに伴い、仮需要が発生している。
,,○,その他専門店［和菓子］（経営者）,来客数の動き,・新型コロナウイルスの影響が薄れている。
,,○,その他専門店［土産物］（経営者）,来客数の動き,・地元客の動きが少し良くなったが、売上としてはまだまだ低く、盛り返すほどではない。ほとんどの客がゆっくり観光をするというよりは、必要なものを買ったらすぐに帰っている。
,,○,その他小売［ショッピングセンター］（管理担当）,お客様の様子,・週末土日の客が少しずつ増えている。ワクチン接種が進んでも新型コロナウイルスの新規感染者数はまだ多い状況であるが、外出の抑止効果は薄くなっている。３月に入って新生活への動きも見られるようになり、客も楽観視はしていないものの、購買意欲も高まりつつある。
,,○,高級レストラン（事業戦略担当）,販売量の動き,・まん延防止等重点措置が解除され、徐々にではあるが予約数が上向いている。
,,○,観光型ホテル（営業担当）,来客数の動き,・県民割の再開で予約数が増えているが、既存の予約数が少なかったため、予約状況としてはまだまだである。
,,○,都市型ホテル（企画担当）,来客数の動き,・新型コロナウイルスオミクロン株の新規感染者数の減少は緩やかであるが、まん延防止等重点措置の解除後、足元の人流が活発になっている。法人の宴会需要はいまだ伸び悩んでいるが、キャンセルや延期は減少しており、先行受注も徐々に回復している。宿泊はビジネス需要は安定しており、県民割も再開し、卒業シーズンに伴う宿泊需要も増加している。
,,○,旅行代理店（経営者）,お客様の様子,・新型コロナウイルスのまん延防止等重点措置が解除されて、良い方向に向かっている。
