Ⅰ．景気の現状に対する判断理由等,,,,,
,,○,コンビニ（店長）,来客数の動き,・まん延防止等重点措置の解除に伴って多少なりとも来客数、販売量は増えているが、本格的な回復にはまだ程遠く、新型コロナウイルス発生前の水準の80％程度で推移している。
,,○,コンビニ（店長）,来客数の動き,・まん延防止等重点措置の期間が終了して初めての土日は、前週以上に非常に混雑した。店舗のある駅でも、多くの利用客が見受けられた。
,,○,コンビニ（本部管理担当）,来客数の動き,・売上は速報値で前年比101.1％と平均値に回復した。まん延防止等重点措置の解除、株価上昇や良好な天候など小売業にとって好条件がそろい、３か月前と比べ期待感があるなかでの数値である。小売業にとっては非常に重要な指標であり、利益を確保できるほどマインドは確実に上がっている。
,,○,コンビニ（店員）,来客数の動き,・暖かくなってきて、来客数が増えてきた。まん延防止等重点措置が明けたのも影響しているように思う。
,,○,コンビニ（商品企画担当）,来客数の動き,・３月中旬以降は、平年と比較して暖かい日が続いたことから、まん延防止等重点措置の期間中であったものの来客数は増加傾向にあった。特に、レジャー・行楽需要に適したおにぎりやサンドイッチを購入する客が多くみられた。
,,○,乗用車販売店（経営者）,販売量の動き,・販売の方は、売れてはいるが生産が間に合わず納期がかなり遅れるため、どうしても受注に結び付かない場合が多い。受注残がかなり残っている状況である。
,,○,乗用車販売店（従業員）,お客様の様子,・問合せ件数が多く決めるまでの期間も早いため、全体的に流れとして良い。
,,○,乗用車販売店（営業担当）,販売量の動き,・まん延防止等重点措置の解除で特に変わった様子はないが、少しだけ客足が戻ってきた様子である。前月よりも順調に受注が上がってきた。商品の入荷遅延は変わらず、受注はできても即売上にはつながらない。
,,○,住関連専門店（営業担当）,販売量の動き,・住宅及びその他店舗、商業施設などでリフォーム、大規模改修物件の見積りや問合せが多くなってきた。
,,○,高級レストラン（経営企画）,来客数の動き,・新型コロナウイルス新規感染者数の減少で、まん延防止等重点措置の解除前から徐々に来客数が回復傾向にあった。特に年度末や季節の変わり目による祝い需要から、週末の来客数の回復が顕著にみられた。
,,○,一般レストラン（経営者）,来客数の動き,・まん延防止等重点措置が今月上旬に解除され、客の外出が増えるとともに来客数が増え、１月よりも来店頻度が多くなった。
,,○,都市型ホテル（従業員）,来客数の動き,・外国人客の宿泊も始まった。
,,○,都市型ホテル（経営者）,販売量の動き,・一棟貸しの借上げ需要の減少が不安である。
,,○,都市型ホテル（総支配人）,来客数の動き,・まん延防止等重点措置が解除され、若干だがレストランが動き出した。
,,○,旅行代理店（経営者）,来客数の動き,・まん延防止等重点措置が解除されたため、やや良くなっている。
,,○,旅行代理店（経営者）,お客様の様子,・まん延防止等重点措置も終わり、暖かくなって外出客も多くなってきている。一方、コロナ禍を通じて対面でなければ購入できない物以外は通販やネットでの購入が進んでおり、消費は、モノの購入からコト消費に変わりつつあるように見受けられる。
,,○,旅行代理店（経営者）,販売量の動き,・２年前から続いているコロナ禍だが、まん延防止等重点措置が解除され、春休みも重なって少し売上が伸びている。
,,○,旅行代理店（営業担当）,販売量の動き,・観光・旅行業は間違いなく新型コロナウイルスの感染状況に左右される。第６波が少しずつ収束傾向になりまん延防止等重点措置が解除されると、個人旅行を中心に旅行申込みが発生している。ただし、新型コロナウイルスオミクロン株の別系統や新しい新型コロナウイルス変異株で次の感染拡大の可能性があるため、また予約取消しが発生するのではとビクビクしながら営業している。
,,○,通信会社（サービス担当）,販売量の動き,・引っ越しシーズンに伴い、転居先での光回線への切替えや光回線を利用するテレビサービスの注文が増加している。また、ＡＤＳＬサービスの終了間近による光回線への変更や新規開局ビルの増加で、光回線の注文が増加している。
,,○,テーマパーク（職員）,来客数の動き,・積雪が多かったので、まだ雪遊びができる。
,,○,美顔美容室（経営者）,販売量の動き,・今年も人気のキャンペーンが始まった。例年購入してくれる客が今年も購入してくれている。
,,○,美容室（経営者）,来客数の動き,・春になりイベントなどが段々と復活してきたため、それに合わせて来客数も増えた。
,,□,商店街（代表者）,お客様の様子,・今月前半のまん延防止等重点措置が出ている間は人の流れもなく全く活気がなかったが、後半になりまん延防止等重点措置が解除されてからは一変した。今月トータルでみるとまだ景気は悪いが、少しだけ上向きになっている。
,,□,一般小売店［高級精肉］（常勤監査役）,販売量の動き,・新型コロナウイルスやウクライナ情勢の影響で不透明感がある。
,,□,一般小売店［結納品］（経営者）,販売量の動き,・新型コロナウイルスの感染拡大が収まらない限り、大変である。
,,□,一般小売店［書店］（営業担当）,販売量の動き,・年度末の予算消化が終盤に向かっているので、この３～４か月は増加傾向であったが、ここで一旦停滞から下降傾向になると思われる。
,,□,百貨店（計画担当）,お客様の様子,・コロナ禍の状況は変わらず、相変わらず感染状況によって来客数の上下が続いている。ただし、高額品の買上動向は比較的安定しており、富裕層の消費には特に減退は感じられない。
,,□,スーパー（経営者）,販売量の動き,・３か月前は初詣から毎年にぎわう頃だったが、１月中旬にまん延防止等重点措置が適用されて伸び悩んだ。現在は解除されて来客数も回復しつつある。
,,□,スーパー（店長）,来客数の動き,・物価の上昇に伴い表面上は良くみえるが、消費者の所得が変わっているわけではない。ウィズコロナのなかで来客数の増加も見込めない。
,,□,スーパー（店員）,単価の動き,・みかんも終盤になり売れる季節物が特にない割には、順調に売上があった。まん延防止等重点措置は解かれたが、人々の意識として余り出歩かない影響が出ているのか、夕方以降の客足が伸びない。
,,□,スーパー（販売担当）,それ以外,・77円均一セールから100円均一セールに変更した。良い物をお買い得にという施策だが、売上は横ばいである。
,,□,スーパー（営業企画）,お客様の様子,・３か月前と比べて、来客数や客単価に大きな変化はみられない。
,,□,スーパー（販売担当）,販売量の動き,・店舗への来客数は増えているが、購買の拡大には必ずしもつながっていない感じである。
,,□,コンビニ（企画担当）,販売量の動き,・まん延防止等重点措置が21日まで継続し、前月と同様な傾向が続いている。
,,□,コンビニ（エリア担当）,来客数の動き,・12月と比較すると、来客数は変わらないか、むしろ少ないが、今月は新型コロナウイルスによるまん延防止等重点措置が解除される動きとなり、月末に向かうにつれて春の行楽客や旅行客が少しずつ増え始めている。この影響で、米飯や飲料などの商品が月末に向けて上向きとなっている。
,,□,コンビニ（店長）,お客様の様子,・売上は前年比102％程度をキープしており、数か月前からの好調さを継続している。店舗近隣に住む高齢者世帯の旺盛な消費にも支えられているほか、専用アプリ利用者や電子マネー支払の客が急増していることも、好調の要因と判断している。
,,□,衣料品専門店（経営者）,お客様の様子,・まん延防止等重点措置が解除されても、年配客はすぐに外出して買物しようという気持ちにはならないように見受けられる。
,,□,衣料品専門店（売場担当）,単価の動き,・来客数は増えていて、家族連れ客の来店もかなり多かった。ただし、単価がいつもほど上がっていない。皆春でいろいろ金が掛かるということで引締めに懸かっていて、以前より金を使わなくなっている。単価が安い物が多かった。
,,□,衣料品専門店（売場担当）,お客様の様子,・引き続き必要最低限の物の購入のみで、以前のような高額品の購入には至っていない。
,,□,衣料品専門店（販売企画担当）,来客数の動き,・来客数もずっと少ないままで推移している。ファッション品は総じて厳しい状況が続いている。介護用品は、動きはあるが増えてはいない。
,,□,乗用車販売店（経営者）,お客様の様子,・新車の納品遅れ、ガソリン値上げや中古車市場の高騰など、車関係全体でのマイナス要素が多い。
,,□,乗用車販売店（従業員）,それ以外,・販売台数は前年並みで推移しているが、納車まで半年以上掛かる車がほとんどで、いつ納車できるか分からないような車を販売している。さらに、メーカーの生産がすぐに止まり予定納期が大幅に遅れることが多く、約束した客にも大変迷惑を掛けている。
,,□,乗用車販売店（従業員）,販売量の動き,・年度末の決算期であるにもかかわらず、例年のような市場の動きを全く感じることができなかった。店舗では新型コロナウイルス感染症対策を実施した上で営業しているが、やはり店内での活気を感じることはできない。今必要な用件が済めばよいと思っている客に新車の提案をしても、話に乗ってもらえない。
,,□,乗用車販売店（従業員）,販売量の動き,・いつもなら決算セールで盛り上がる月であるが、肝心の商品である新車が半導体や部品供給遅れの問題で入荷せず、厳しい状況になった。ただし、中古車市場は大盛況で、トータルでみると悪いながらも前年並みの実績を確保できており、ホッとしている。
,,□,その他専門店［書籍］（店員）,来客数の動き,・例年は忙しい時期であるが、学生たちは春休みに入り、まん延防止等重点措置が解除され新型コロナウイルスで我慢していた分レジャー代に流れる消費も多い。書籍販売は電子化で紙離れもあって厳しくなっている。
,,□,一般レストラン（従業員）,単価の動き,・新規感染者数が減らず、外食を控えている。
,,□,その他飲食［仕出し］（経営者）,販売量の動き,・まん延防止等重点措置が解除になり、ある程度上向きな傾向にある。
,,□,その他飲食［ワイン輸入］（経営企画担当）,販売量の動き,・まん延防止等重点措置の解除により、取引先の飲食店の利用客が増えている。歓送迎会も、人数を絞っての開催ではあるが予約が入っている。
,,□,都市型ホテル（営業担当）,来客数の動き,・まん延防止等重点措置の解除に伴い、レストラン、出張宿泊などは若干回復しているが、大幅な良化までは至っていない。全くなかった前月から比べると少し良くなった気がするが、大きな動きが出ていない。
,,□,旅行代理店（経営者）,販売量の動き,・ブロック県民割を期待する予約がある。ただし、政府が幾らブロック県民割を推進していても、当県の場合旅行代理店は県内旅行しか取り扱えないので、全く販売に結び付かない。地元県民が県内の旅行店で北信越や中部圏の旅行を予約できるようになれば販売が広がるので、消費者にも声を掛けやすい。県民割を推進するならば、県内旅行会社からの予約を推進してほしい。旅行会社経由でも最終的にはホテル・旅館に予約が入るのだから、３回目のワクチン接種を推進するなら、必ず旅行会社経由での予約にすべきである。
,,□,旅行代理店（営業担当）,販売量の動き,・旅行業収入としては１月から大きな変化はなく、出張関連の切符・宿泊のみで、観光要素のある旅行は皆無の状態である。
,,□,タクシー運転手,お客様の様子,・まん延防止等重点措置が解除され、夜の街は特にがらがらの状態だったのが、夜12～１時頃まで客が少しずつ戻っている状況になっている。
,,□,タクシー運転手,来客数の動き,・悪いまま戻らない。
,,□,レジャーランド（職員）,来客数の動き,・まん延防止等重点措置が解除されて来客が戻りつつあるが、３か月前の12月と比べると変わらない。
,,□,テーマパーク職員（総務担当）,来客数の動き,・まん延防止等重点措置が解除され、明るい兆しはある。
,,□,観光名所（案内係）,お客様の様子,・今月20日までは人出も少なかったが、21日過ぎからは人出が増えてきた。したがって、先が明るくなるのではないかと思う。
,,□,ゴルフ場（支配人）,来客数の動き,・３月の入場者数は、前年と比べほぼ変わりなく推移している。３か月前と比べると入場者数は良くなっているが、12月の降雪の影響を考慮すると、景気としては余り変わってないと判断する。
,,□,その他レジャー施設［鉄道会社］（職員）,来客数の動き,・３か月前と変わりなく、おおむね低調な状況で推移している。
,,□,美容室（経営者）,お客様の様子,・２年間の新型コロナウイルスの影響で、客は本当に外出を控え、皆我慢してパーマも毛染めも余りしなくなった。
,,□,その他サービス［介護サービス］（職員）,それ以外,・原価の高騰に尽きる。
,,□,住宅販売会社（経営者）,単価の動き,・売地が少なく、買主も少ない。土地の価格がなかなか下がらない状況で、先行きも不安である。
,,□,住宅販売会社（従業員）,販売量の動き,・コロナ禍も停滞させているが、販売は横ばいである。
,,□,その他住宅［不動産賃貸及び売買］（営業）,単価の動き,・まん延防止等重点措置が解除されたので期待はあるが、見当が付かない。
,,▲,一般小売店［贈答品］（経営者）,お客様の様子,・３月は決算月のため売上が伸びると予想していたが、12月の方が良かった。コロナ禍の終息を感じるほど新規感染者数が減っていた12月と増加傾向の３月を比べると、来客数や客の様子もどちらかというと厳しい状況にあり、３か月前と比べると少し悪くなっている。客自身が自粛をしており、付き合いの幅を狭めている状況である。
,,▲,一般小売店［酒類］（経営者）,販売量の動き,・まん延防止等重点措置が解除され、飲食店には少し客が戻ってきているが、飲料の販売は伸びていない。客は早めに帰る傾向にある。
,,▲,百貨店（総務担当）,お客様の様子,・まだまだ日によって寒の戻りがあり、春物衣料品が苦戦している。また、ガソリン価格の高騰によるのか、車での来店客が減っている。株価の大きな下落もあり資産効果といわれる富裕層の高額消費は低調で、春休みの行楽需要なども新型コロナウイルス新規感染者数が依然として高い水準のため低調である。
,,▲,百貨店（販売担当）,お客様の様子,・まん延防止等重点措置の期間中は客足が伸びず、22日の解除後も増えていない。目的買いが多く長居はせず、回遊している様子も余り感じられない。通常であれば家族連れの客でにぎわう時期であるが、この状況では厳しい。
,,▲,スーパー（店長）,販売量の動き,・まん延防止等重点措置が解除される前から週末や夜間の外食が増えてきており、内食需要が減少している。加えて商品、ガソリンの値上がりや電気代の上昇もあり、買上点数が減りつつある。
,,▲,スーパー（店長）,販売量の動き,・買上点数が減少している。
,,▲,スーパー（店員）,単価の動き,・前月に引き続き売上は前年超えをしているが、値上げによる客単価アップによるもので、来客数、買上点数に関しては引き続き前年割れの状況である。
,,▲,コンビニ（店長）,来客数の動き,・新型コロナウイルスの新規感染者数がなかなか減少せず、まだ外出をためらっている人が相当数いるようで、来客数がなかなか上がってこない。
,,▲,衣料品専門店（店長）,お客様の様子,・複数の客から、現在は忙しいが４月以降の仕事が決まっていないという話があった。
,,▲,家電量販店（店員）,販売量の動き,・例年３月は来客数が多く忙しいが、今年は少ない。前年に巣籠り需要で購入が進んだため、反動が出ている。
,,▲,家電量販店（フランチャイズ経営者）,来客数の動き,・３月に入って来客数が減少している。ウィズコロナといっても、命に関わる高齢の客は、経済活動より不安の方が勝っている。高齢の客のシェアが高い店ほど、厳しいのではないか。
,,▲,その他専門店［貴金属］（経営者）,来客数の動き,・まん延防止等重点措置が解除されたにもかかわらず、また、例年ならば春の陽気につられて人が出てくる頃であるが、商店街への人流が増えていない。
,,▲,一般レストラン（経営者）,それ以外,・まん延防止等重点措置が解除されたばかりで、景気状況としてはまだ動きが少ない。周囲の状況は、変わらないか、あるいはウクライナ情勢もあってやや悪くなっているようにも感じる。
,,▲,一般レストラン（経営者）,来客数の動き,・来客数が少ない。多くても３人、通常は１人という日がとても多い。
,,▲,バー（経営者）,お客様の様子,・コロナ慣れして、外出や外食をしなくてもいい状況にある。
,,▲,観光型ホテル（経営者）,来客数の動き,・３か月前は新型コロナウイルスの感染状況が落ち着きまん延防止等重点措置も緊急事態宣言もなかったため、非常に忙しい日々を送っていた。現在は、まん延防止等重点措置が解除された３月22日以降は徐々に戻っているが、３か月前の12月と比較するとまだまだで、やや悪くなっている。
,,▲,通信会社（企画担当）,販売量の動き,・引っ越しシーズンで毎年３月は解約件数が増えるが、例年にも増して解約が増えている。一方で転入による新規契約は例年をかなり下回っている状況である。
,,▲,通信会社（営業担当）,販売量の動き,・新規工事でも、機器未入荷のため遅れが発生している。
,,▲,通信会社（営業担当）,お客様の様子,・半導体不足も関係してか、機器の更改には慎重な姿勢がうかがえる。費用についても慎重になっている傾向がみられる。
,,▲,テーマパーク（職員）,お客様の様子,・まん延防止等重点措置は解除されても、新規感染者数が増えてきており、土日以外の来客数は少ない。
,,▲,パチンコ店（経営者）,販売量の動き,・来客数の動きから、やや悪くなっている。
,,▲,理美容室（経営者）,来客数の動き,・客が余り来てくれない。
,,▲,美容室（経営者）,お客様の様子,・やはり新型コロナウイルスの影響である。
,,▲,理容室（経営者）,それ以外,・いろいろと悪いことがありすぎる。
,,▲,設計事務所（経営者）,来客数の動き,・本来は年度末で例年ある程度忙しくなる時期だが、今年は違うようである。
,,▲,設計事務所（職員）,お客様の様子,・客からは景気が良くなる話は聞かない。
,,▲,住宅販売会社（従業員）,単価の動き,・建築材料の単価が上がり続けている。
,,×,一般小売店［生活用品］（販売担当）,販売量の動き,・例年３月はギフト需要などもあり年末に次いで売上の良い月であったが、まん延防止等重点措置の下で全く売上が伸びてこない。
,,×,百貨店（業績管理担当）,販売量の動き,・新型コロナウイルスオミクロン株の影響を受け、来客数、売上共に３か月前から減少した。
,,×,乗用車販売店（従業員）,販売量の動き,・新型コロナウイルスの影響で製造業の生産が止まっているため、もう何ともならない状態である。
,,×,観光型ホテル（支配人）,来客数の動き,・まん延防止等重点措置が解除されたとはいえ、法人客はもとより個人客も様子見なのか急激な予約増加とはなっていない。今回のまん延防止等重点措置は、本当に営業収入に大きく響いた。全社で悪かった前年を更に下回る見込みであり、食堂に至っては週１回の定休日を２回に増やさざるを得なくなってしまった。
,,×,旅行代理店（経営者）,販売量の動き,・今月は、新型コロナウイルスの影響で旅行の仕事は全くなかった。
,,×,その他レジャー［スポーツレジャー紙］（広告担当）,お客様の様子,・新型コロナウイルスに加え、ウクライナ情勢を始めとした要因で物価や資材が急騰している。
,,×,その他住宅［住宅管理］（経営者）,それ以外,・景気対策が進まず地域によっては経済の回復が遅れ、建設業、塗装業の２社が倒産、廃業した。同業者のなかでも生死が分かれつつある。体力のない会社は、ここに来て新年度が迎えられない。
"企業
動向
関連

(東海)",,◎,＊,＊,＊
,,○,化学工業（総務秘書）,それ以外,・まん延防止等重点措置の解除や春の到来により、街の様相は大きく変わり、外出を控えていた人々が街に出てきている。百貨店や飲食店は、感染防止対策の影響もあるが行列ができている光景をよく見掛けた。ウクライナ情勢は、我が国にとっても他人事ではない恐怖であるが、それが景況感には現れてはいない。
,,○,通信業（総務担当）,それ以外,・まん延防止等重点措置が全国的に解除になり、人流が戻ってきた。観光やホテル宿泊需要も回復しつつある。
,,○,金融業（従業員）,取引先の様子,・製造業に関しては今までとほぼ変わらない動きであるが、飲食店は、まん延防止等重点措置から解放されて営業時間が延び、店も客も比較的動きが活発化している。
,,○,不動産業（経営者）,受注価格や販売価格の動き,・法人、個人を問わず、投資物件の問合せが多い。
,,○,不動産業（経営者）,それ以外,・例年同様に晴れの日が多く、新型コロナウイルス新規感染者数も減少傾向にあり、外出や遠出する人が徐々に増加傾向となっている。売上は前年を上回る状況が継続している。
