Ⅰ．景気の現状に対する判断理由等,,,,,,
"家計
動向
関連

(南関東)",東京都,◎,百貨店（店長）,来客数の動き,・新型コロナウイルスの感染第７波の影響があった３か月前と比べると、人流が大きく改善したことで来客数が増加している。また、規制緩和以降、インバウンド売上が特選品を中心に堅調であり、全国旅行支援や自治体独自の旅行支援など行政の施策も効いている（東京都）。,
,東京都,◎,家電量販店（店長）,来客数の動き,・10月からの訪日外国人に対する入国制限緩和に伴い、街に外国人客が増加している。まだ中国人客がいないため、高額商材の動きは非常に少ないが、少額の土産物の売上は大幅に増加傾向にある（東京都）。,
,東京都,◎,旅行代理店（営業担当）,販売量の動き,・全国旅行支援のお陰でツアーの申込みが殺到している（東京都）。,
,東京都,○,商店街（代表者）,それ以外,・新型コロナウイルスの感染第８波が来ているが、今月まではまだ消費は好調である。来街者数も天候のお陰もあって順調に推移している。飲食店への新型コロナウイルスの影響もない。ただし、忘年会の前倒し的な需要もあるので、今月が良いとは一概には言えず、来月の数字を見てからの部分もある。クレジットカードの取扱高も好調である（東京都）。,
,,○,一般小売店［家電］（経理担当）,販売量の動き,・一般ユーザーの買物は今一つだが、企業向けのパッケージエアコンが動いている。省エネ、換気などの補助金の関係と思われる。,
,,○,一般小売店［印章］（経営者）,販売量の動き,・販売品目の中に印章、印刷の他に収入印紙がある。印刷については年賀状の準備で多少受注がある。また、収入印紙の売上が増えている。そのようなことから全体の売上が多少良くなっている。,
,,○,一般小売店［祭用品］（経営者）,販売量の動き,・新規事業もあり、徐々に良くなりつつある。,
,東京都,○,一般小売店［文房具］（経営者）,来客数の動き,・海外、国内を問わず、街に観光客の姿が多くなってきて、土産需要での文房具のまとめ買いも出始めている。自治体発行によるクーポンの取扱を始めたところ、少人数ではあるが利用客がいる。来客数も少しではあるが増加傾向である（東京都）。,
,,○,一般小売店［文具］（販売企画担当）,来客数の動き,・競合他社がどんどんなくなっていることもあり、残されたものの利益というか、当店では来客数が増え、利益も増加している。特に、最近書店が廃業したこともあり、手帳などを置いている店が余りないので、当店に集中している。そうしたことから来客数が増えており、やや良い。,
,東京都,○,百貨店（売場主任）,来客数の動き,・円安の影響を受け、免税売上が新型コロナウイルス感染症の発生前の2019年と比べて４％増加している。全体的な値上げにも、メインの対象顧客層には買い控えがみられず好調である（東京都）。,
,東京都,○,百貨店（総務担当）,来客数の動き,・来客数は順調で、インバウンド需要も少しずつだが戻ってきている（東京都）。,
,東京都,○,百貨店（広報担当）,お客様の様子,・夏頃よりも新型コロナウイルス感染症への懸念がやや弱まっているためか、来客数に大きな影響は出ていない。加えて、消費の２極化傾向が鮮明で、富裕層を中心とする購買力の高い層の消費意欲は緩やかながら好調が続いている。また、徐々にではあるがインバウンド需要も回復している（東京都）。,
,東京都,○,百貨店（営業担当）,来客数の動き,・来客数が徐々に回復しており、週末は家族連れの来店によりにぎわいを見せている。外国人観光客も増加しており、時計や化粧品などを中心に売上も増加傾向にある（東京都）。,
,東京都,○,百貨店（販売促進担当）,来客数の動き,・相変わらず宝飾品や時計、ラグジュアリーブランド等の高額品の売上が好調である。また、水際対策が緩和され、更に円安もあいまって外国人客の来店も増えている（東京都）。,
,東京都,○,百貨店（販売促進担当）,来客数の動き,・インバウンドが戻ってきている（東京都）。,
,,○,百貨店（店長）,来客数の動き,・来客数は、伸長していた３か月前を上回るペースで伸びている。季節商材を中心に買換えが増えているほか、ボジョレーヌーヴォーやクリスマス関連等、プラスアルファの購入目的が増えている。,
,,○,スーパー（経営者）,来客数の動き,・安売りへの反応が良くなってきたが、安価な物しか売れない。,
,東京都,○,スーパー（店長）,それ以外,・今月はキャッシュレス決済の買物での30％ポイント還元の効果が絶大で、売上は予算を大幅にクリアしている。大幅にクリアできたのはキャッシュレス決済の最大の効果である（東京都）。,
,,○,スーパー（ネット宅配担当）,単価の動き,・値上げによる１点単価の上昇と、来客数がやや増えていることから売上は増加している。ただし、電気代の高騰で利益が大幅に圧縮されている。,
,,○,スーパー（販売担当）,単価の動き,・新型コロナウイルスの感染第８波が来ており、依然として物価上昇も収まらないなか、食品を中心に客単価は前年同時期よりも３％上がっている。店頭販売よりもネットスーパーでの売上が２けた伸びており、この状況が今後も続く。,
,,○,コンビニ（経営者）,来客数の動き,・来客数が減っており不安な面もあるが、客単価は上がってきている。,
,東京都,○,家電量販店（経営企画担当）,販売量の動き,・11月に入り、新型コロナウイルス感染症の感染第７波が収まってきているなか、外国人の入国制限緩和に伴い、インバウンド消費が大きく伸びている。インバウンドを除く国内消費も堅調で、全体の売上をけん引している（東京都）。,
,,○,乗用車販売店（総務担当）,販売量の動き,・新車は在庫売りで、中古車市況は相変わらず堅調である。,
,,○,その他小売［ショッピングセンター］（統括）,販売量の動き,・当社施設自体が部分改装し、非常に好調である。その影響を差し引いても、全体的に上向き感がある。,
,東京都,○,高級レストラン（営業担当）,来客数の動き,・11月は全体として2019年比で77.1％である。９～10月は70％を超えることはなかったが、Ｇｏ　Ｔｏ事業や全国旅行支援の影響等もあり、緩やかな回復の兆しが見える。ただし、月後半は新型コロナウイルスの新規感染者数増加の報道等により、12月以降の予約キャンセルが増えている（東京都）。,
,東京都,○,高級レストラン（役員）,来客数の動き,・コロナ禍によりステイ状況であったイベントは、春から再開基調ではあったものの、秋からは本格再開の案件が増えてきて、イベントの多い時期でもある10月は、急激に依頼が増えている。また、レストラン予約も回復傾向にあり、海外客も増えてきて、店内外で受注が増加している。景況としてはコスト増加がより重くなってきているが、店内外共に来客数及び案件数の増加により上向いている（東京都）。,
,東京都,○,高級レストラン（仕入担当）,来客数の動き,・年末にかけて宴席受注数、個人利用客が増えている。ただし、新型コロナウイルス感染症を意識してか、大人数での利用はなく、規模を縮小しての開催が見受けられる（東京都）。,
,,○,一般レストラン（経営者）,来客数の動き,・３か月前と比べると新型コロナウイルス感染症が落ち着いたので、売上が幾らか伸びている。ただし、新型コロナウイルス感染症の影響がまだ少し残っているので、それがなくなれば少しずつ良くなっていく。,
,東京都,○,一般レストラン（経営者）,販売量の動き,・３か月前の８月１日から29日までの前年比は、売上251.9％、来客数221.1％である。今月11月１日から28日までの前年比は、売上111.8％、来客数100.8％である。新型コロナウイルス感染症の発生前の2019年11月１日から28日までと比べると、売上60.8％、来客数51.3％である（東京都）。,
,東京都,○,一般レストラン（経営者）,来客数の動き,・Ｇｏ　Ｔｏ　Ｅａｔや全国旅行支援も再開されて、新型コロナウイルスの感染第８波が来る前の、感染状況がやや落ち着いた時期なので、皆が消費意欲を見せているような感じがする（東京都）。,
,東京都,○,一般レストラン（経営者）,来客数の動き,・来客数は増えてきているが、新型コロナウイルスの新規感染者数も増えており、オペレーションが人員不足で補えない店舗が出ている。景気回復はとても良いことだが、その波に乗れるよう、今後の人口減少において、全社的に生産性を改善していくことが課題である（東京都）。,
,東京都,○,その他飲食［カフェ］（経営者）,来客数の動き,・新型コロナウイルス感染症がまたまん延し始めてはいるが、慣れなのか、客が激減することはなくなってきている（東京都）。,
,東京都,○,その他飲食［給食・レストラン］（役員）,販売量の動き,・新型コロナウイルス感染症の影響はあるものの、世の中的に自主規制は弱まっており、来客数、喫食数も年末に向けて若干伸びてきている（東京都）。,
,,○,都市型ホテル（経営者）,来客数の動き,・個人客を中心に全国旅行支援が始まり、来客数はかなり増えている。一方で、法人の宴会の回復遅れがずっと続いており、その部分だけが現在足かせになっている。３か月前と比べると新型コロナウイルスの新規感染者数がかなり増えているが、今は皆がさほど気にしていない状況になっており、全体的な動きはかなり回復している。,
,,○,都市型ホテル（スタッフ）,来客数の動き,・宿泊と、レストランの昼の時間帯はかなり客が戻ってきているが、夜の時間帯や宴会場に関しては、相変わらず厳しい状況である。,
,,○,都市型ホテル（スタッフ）,販売量の動き,・３か月前と比べて新型コロナウイルスの新規感染者数は増加傾向にあるものの、全国旅行支援などの支援策により宿泊の稼働率は高水準で推移している。レストランも週末中心ではあるが満席になる日が多く見受けられ、婚礼や宴会も延期案件の実施により販売量が確実に伸びてきている。,
,,○,都市型ホテル（スタッフ）,来客数の動き,・全国旅行支援の需要が継続している。周辺イベントによる需要も重なり、高稼働が続いている。,
,東京都,○,旅行代理店（従業員）,販売量の動き,・全国旅行支援効果で人流が活発になっている（東京都）。,
,東京都,○,タクシー運転手,それ以外,"・運賃引上げが14日からスタートした。乗り控えが懸念されていたが、改定前と変わりなく、まずは一安心といったところである。また、昨今では現金払が少なくなっているために値上がりを感じないということもあるようである。		（東京都）。",
,東京都,○,通信会社（社員）,お客様の様子,・イベントのスポンサーが増加している。ゲーム業界など、今までにない分野が伸びている様子が見受けられる（東京都）。,
,東京都,○,通信会社（管理担当）,販売量の動き,・直近２か月間は獲得顧客数が増加傾向にある（東京都）。,
,東京都,○,通信会社（管理担当）,お客様の様子,・電子帳簿保存法、インボイス制度対応などフックとなる要素があり、案件が増加している（東京都）。,
,東京都,○,観光名所（職員）,来客数の動き,・海外からのツアー客が戻ってきている（東京都）。,
,,○,ゴルフ場（経営者）,単価の動き,・自治体のキャッシュレス決済キャンペーンにより売上が伸びている。通常キャッシュレスの売上割合は25％だが、35％まで上昇している。,
,,○,ゴルフ場（経理担当）,来客数の動き,・閑散期の３か月前と比較すると、メンバーを中心に高稼働率を維持しており、季節的要因もあるが、新型コロナウイルスの感染第８波の影響は限定的である。第７波以前は高齢層を中心に感染を警戒してプレーを忌避する動きがみられたが、現下ではこのような動きは目立っていない。,
,東京都,○,その他レジャー施設［ボウリング場］（支配人）,お客様の様子,・大きな団体の動きはないが、小グループでの予約などが入ってきている（東京都）。,
,,○,設計事務所（経営者）,競争相手の様子,・民間の仕事は非常に厳しいが、行政の指名入札で仕事が取れている。社員が少なくなってしまっているので、人員不足で対応することが難しくなっているが、当事務所の景気は上向きである。,
,,□,商店街（代表者）,来客数の動き,・現状、商店街を行き来する客の数はそれほど悪い状況ではないが、来客数の伸びは今一つである。それに伴って、売上も大分良くなってきてはいるものの、新型コロナウイルス感染症の発生前の状況にはまだ届いていない。ただし、少しずつ回復していることは間違いない。,
,東京都,□,一般小売店［生花］（店員）,お客様の様子,・当店は花屋なので直接関係はないのだが、老人会や近所の人たちが旅行に行くようになり、国や自治体からの旅行支援策のお陰で自分の財布から出すお金が少なくて済んだと喜んでいる（東京都）。,
,,□,一般小売店［茶］（営業担当）,単価の動き,・お歳暮に向けて毎年行うセール期間の売上は前年同様である。今月は、来客数は横ばいであったが、客単価が低下し、売上が５％マイナスとなっている。,
,東京都,□,百貨店（総務担当）,お客様の様子,・新型コロナウイルス感染症に対する意識より物価高への危機感や警戒感の方に客の関心が高まっているように感じる。客の消費行動も慎重になってきており、今月の景気動向としては、良くも悪くもなく、横ばいである。比較的付加価値の高いブランド品等の動きは引き続き好調であるが、衣食住の基本商材に関しては、前年と比較しても良いとはいえない（東京都）。,
,東京都,□,百貨店（営業担当）,来客数の動き,・コロナ禍以降の購買意欲は継続して高く、来客数が増加し、結果として売上も好調に推移している。インバウンドも増え、体感として土日は久々に混雑した印象を持っている（東京都）。,
,東京都,□,百貨店（営業担当）,単価の動き,・ここ３か月間、消費は堅調である。購買人数は前年に比べて減少傾向にあるが、反面、１人当たりの単価は高い傾向にある（東京都）。,
,東京都,□,百貨店（経営企画担当）,販売量の動き,・服飾雑貨、宝飾品の堅調に加え、婦人、紳士アパレルの動きが良く、商品カテゴリー別では前年比で２けたの伸びを見せている一方、食料品についてはお歳暮ギフトが厳しく、ほぼ前年並みであり、商材ごとに好不調のばらつきがみられる。食料品の値上げも続き、環境も厳しい（東京都）。,
,,□,百貨店（企画宣伝担当）,来客数の動き,・新型コロナウイルスの新規感染者数が日ごとに増えるなか、来客数の伸びが鈍化している。,
,,□,スーパー（経営者）,来客数の動き,・このところいつも同じだが、やや悪い状態がずっと続いており、それが常態化しているので、なかなか良い方向には向かわない。先の見通しも良くない。,
,,□,スーパー（店長）,販売量の動き,・日によって気温差が大きいため、冬物商材の売行きが想定以上に伸びていない。また、値上げの影響により販売の売価によって売上が左右される場合がある。,
,東京都,□,スーパー（店員）,単価の動き,・調味料などの販売価格が若干上がっているなか、客単価は上がっているが、販売量は逆に５％くらい減っているように感じる（東京都）。,
,,□,スーパー（総務担当）,お客様の様子,・今月は、衣料、住まいの品、食品トータルで前年より１～２％悪い。単価は前年並みだが、来客数が若干落ちている。特に好調な商材は、簡便な食料品、服飾雑貨などの軽衣料である。逆に、素材関係の食品と、気温が高いために重衣料が不調となっている。,
,,□,スーパー（総務担当）,お客様の様子,・いろいろな物が値上げになり、家計を圧迫している。,
,東京都,□,スーパー（営業担当）,単価の動き,・１品当たりの単価は確実に上がっているが、販売量並びに来客数はそれと反比例するように鈍化しているのが現状である（東京都）。,
,,□,スーパー（仕入担当）,販売量の動き,・値上げの波により販売点数が減少している。電気料金が３割ほど値上げされ、利益を圧迫している。,
,,□,コンビニ（経営者）,単価の動き,・そのときの気温によって多少売れる数が増えたりはするが、１週間トータルで考えると余り変わらない。,
,東京都,□,コンビニ（商品開発担当）,来客数の動き,・今月前半は全国旅行支援の効果もあり、来客数が着実に増えてきたが、後半に入ると新型コロナウイルスの感染再拡大もあり、低調になってきている（東京都）。,
,,□,コンビニ（従業員）,来客数の動き,・来客数の動きから、景況は良くも悪くもなっていない。生活にかかわる商材の販売ということで、安定した来客数、販売数といった感じである。逆に言えば、すごく良くなる可能性も、すごく悪くなる可能性も、余りないかもしれない。ただし、周りの環境変化には敏感であり、近くにコンビニ、スーパーができたなど、景気以外の外的要因で来客数が一気に減少してしまうかもしれない。とはいえ、今でも近くにコンビニ、スーパーがないわけではないので、新たに増えることも考えにくい。,
,,□,衣料品専門店（経営者）,販売量の動き,・暖かい日が続き、防寒衣料の動きは悪いが、軽衣料は前年よりも良い。全体では前年より若干悪い。,
,,□,衣料品専門店（役員）,販売量の動き,・諸物価高騰の影響が出ている。衣料品購入はどうしても食費や光熱費等よりも後回しになる。,
,,□,家電量販店（店長）,来客数の動き,・来客数は余り増えていないが、家族での来店者は増えている。消耗品が値上がりし、高くなったという声もよく聞く。商品選びは慎重になっている。,
,,□,乗用車販売店（経営者）,販売量の動き,・自動車の整備は順調に入っているが、販売が余り芳しくなく、前年度比で５割減少している。,
,,□,乗用車販売店（経営者）,販売量の動き,・新車の納期の遅れは徐々に回復してきているが、受注量は前年並みである。,
,,□,乗用車販売店（営業担当）,販売量の動き,・今までにないくらいに販売が低迷している。,
,東京都,□,乗用車販売店（販売担当）,お客様の様子,・客は新車を買いたいが、納車に大変時間が掛かるため、自分の車を車検に出すが、新型コロナウイルス感染症の影響で余り距離を走っていないために車検代金は少し安くなっている。新型コロナウイルス感染症の影響で半導体がそろわず、新車が欲しくても新車が入ってこない。距離を走っていないので車検費用は安く、ディーラーとしてはジレンマに陥っている。全体的には景気は変わらない。将来的にもまだまだ変わる状況にない（東京都）。,
,,□,乗用車販売店（渉外担当）,販売量の動き,・自動車生産について安定化のめどが立たない。,
,東京都,□,乗用車販売店（営業担当）,来客数の動き,・特に変わっていない（東京都）。,
,東京都,□,住関連専門店（店員）,単価の動き,・週ごとに物価が上がっている（東京都）。,
,,□,その他専門店［ドラッグストア］（経営者）,販売量の動き,・これといった動きがないので、前月と同じということである。,
,東京都,□,その他専門店［貴金属］（統括）,来客数の動き,・新型コロナウイルス感染症の影響によって来客数が変化することは少なくなり、徐々に回復してきている（東京都）。,
,東京都,□,その他小売［ショッピングセンター］（統括）,お客様の様子,・以前に比べて新型コロナウイルスの新規感染者数増加に伴い経済活動が停滞することはなくなってきたようである（東京都）。,
,東京都,□,一般レストラン（経営者）,それ以外,・外国人観光客が少し目立つようになったが、インバウンド効果はまだまだである（東京都）。,
,,□,一般レストラン（経営者）,お客様の様子,・３か月前と比べて、やはり客がシビアになっている気がする。電気代や物価が上がり過ぎて、所得が追い付いていかない状態が続いている。何とも言いようがない。,
,東京都,□,一般レストラン（経営者）,来客数の動き,・全く宴会が入らないというわけではなく、会社の集まりも少しは入ってくるし、家族の集まりで利用してくれる人も増えている。ただし、新型コロナウイルス感染症にり患してしまっての予約キャンセルが多々ある（東京都）。,
,東京都,□,その他飲食［居酒屋］（経営者）,来客数の動き,・１週間の来客数をみると、週末など、日によって満席の日や来客数が多い日もあるが、逆に４～５人という極端に少ない日もあり、１か月トータルでは必ずしも売上が伸びているとはいえない（東京都）。,
,,□,旅行代理店（経営者）,販売量の動き,・全国旅行支援でクーポン券も発券されるようになってきているが、客もまだ新型コロナウイルス感染症が完全に終息していないので、希望と一致するところがなかなかないようである。全体的には上向いているとは思うが、当社にとってはなかなか思うようにいっていないのが現状である。,
,,□,旅行代理店（従業員）,お客様の様子,・全国旅行支援が始まったものの、新規案件が発生することもないため、変化はない。煩雑な手続が増えた分、負担が増している。,
,,□,旅行代理店（営業担当）,お客様の様子,・物価は高騰しているが、旅行業界全体としては３か月前と比べても客の様子に変わりはない。全国旅行支援といった政府の施策もあるが、夏の需要と比較してもさほど変わらない。,
