Ⅰ．景気の現状に対する判断理由等,,,,,,
,,▲,スーパー（店長）,販売量の動き,・今月に入り、食品の買上点数が前年比でマイナス３％と減少傾向にある。特に広告を打った当日は、通常は買上点数が増えるが、広告商品のみを購入する客が目立つ。値上げラッシュにより、客の買物の仕方が慎重になっている。,
,,▲,スーパー（店員）,来客数の動き,・まだ値上げの動きが続いており、チラシへの掲載品か値引き品ぐらいしか売れない。,
,,▲,コンビニ（店員）,来客数の動き,・夏の繁忙期よりも来客数は少なくなっているが、前年と比べると増えているように感じる。,
,,▲,コンビニ（店員）,単価の動き,・物価がどんどん高くなり、常連客が以前よりも購入商品を減らしていると感じる。,
,,▲,乗用車販売店（経営者）,お客様の様子,・円安やコロナ禍の影響で、一部の輸出企業の業績だけが良くなっているが、全体的には物価の上昇などで消費は冷え込んでいる。,
,,▲,その他専門店［スポーツ用品］（経理担当）,販売量の動き,・急激な円安は一段落したが、景気に反映されるのは半年以上先になる。政府によるガソリン価格の抑制策などが終われば、物価上昇の動きは落ち着かない。,
,,▲,その他小売［インターネット通販］（オペレーター）,販売量の動き,・受注や問合せの電話がかなり減少している。,
,,▲,その他小売［ショッピングセンター］（総括）,来客数の動き,・３か月前と比べ、来客数が５％前後減少している。,
,,▲,旅行代理店（従業員）,販売量の動き,・物価の上昇により、消費マインドが低下している。,
,,▲,通信会社（社員）,販売量の動き,・円安が地方経済にも大きな影響を与え始めている。なかなか新しいサービスに乗り換える動きが見られない一方、契約のキャンセルは増加が止まらない。,
,,▲,住宅販売会社（経営者）,単価の動き,・建築資材などの相場が安定せず、今後の仕入価格が読めない状態である。,
,,▲,住宅販売会社（従業員）,お客様の様子,・新築分譲マンションの販売は好調であったが、一部で販売が立上げ時から厳しい物件が出始めている。物件を厳選する客の目が厳しくなっている。,
,,×,百貨店（商品担当）,販売量の動き,・11月に入り、売上は明らかに悪い傾向に変化している。,
,,×,衣料品専門店（経営者）,お客様の様子,・来客数が少なく、ショッピングセンターは閑古鳥が鳴いている。特に、年配客の来店が少ない。,
,,×,家電量販店（店員）,来客数の動き,・気温が下がりきっておらず、エアコンや暖房器具の購入のための来店がない。,
,,×,家電量販店（店員）,お客様の様子,・緊急性が高ければ、購入の最大のポイントになるが、リフォーム関連は生活改善が目的のため、優先度が下がる傾向がある。,
,,×,家電量販店（店員）,来客数の動き,・円安や物価の上昇による影響で、来客数が前年比で85％と厳しい。新型コロナウイルスの新規感染者数も急増しているため、店舗でゆっくりと買物をすることも難しい。,
,,×,家電量販店（企画担当）,来客数の動き,・来客数が増えず、特に19時を過ぎた時間帯は顕著である。,
,,×,その他専門店［宝石］（経営者）,お客様の様子,・物価の上昇が景気の悪化につながっている。,
,,×,一般レストラン（店主）,来客数の動き,・キャンペーンの効果で客は増えており、外国人客も多くなっている。ただし、大型店や大型レジャー施設、特定の目的地に客が集中し、商店街は閑散としている。,
,,×,通信会社（役員）,それ以外,・携帯電話のキャリアショップを代理店として運営しているが、特定の通信キャリアでは、2025年度末までに全国で約700店舗の閉店が予定されている。これに伴い、代理店に支払われる各種手数料が大幅に削減される一方、代理店が負担する販売促進費の負担は増えている。,
,,×,競輪場（職員）,単価の動き,・今月の客単価は8550円で、３か月前の9575円からは1000円近く落ちている。,
,,×,その他レジャー施設［複合商業施設］（職員）,販売量の動き,・新型コロナウイルスの新規感染者数が急速に増えている。食料品やエネルギー価格の上昇も消費マインドを冷やしている。,
,,×,その他サービス［学習塾］（スタッフ）,お客様の様子,・お試し期間の参加者のうち、新規加入につながる人が、例年と比べて極端に少ない。,
"企業
動向
関連

(近畿)",,◎,－,－,－,
,,○,食料品製造業（営業担当）,取引先の様子,・少しずつ人の流れが増えつつある。新型コロナウイルスの感染対策を採りながら営業している飲食店では、客足がほぼ満席近くとなり、飲料水の売上も少し良くなっている。また、サッカーワールドカップの影響もあり、家飲み需要で飲料水の売上は少し上向いている。,
,,○,繊維工業（団体職員）,受注量や販売量の動き,・新型コロナウイルスの感染状況が徐々に拡大しているが、３年ぶりに規制のない年末年始を前に、受注量は増加傾向にある。,
,,○,化学工業（管理担当）,受注量や販売量の動き,・家電向けや車載向けの出荷量が増えてきたが、原材料である化学品の値上がりが続いている。製品価格への転嫁が遅れており、利益が伸びない。,
,,○,電気機械器具製造業（経理担当）,受注量や販売量の動き,・例年の動きには届かないが、前年や前々年と比べると好転している。ただし、電子部品関係の仕入れが伴わなければ、その先には進めない。,
,,○,電気機械器具製造業（営業担当）,受注量や販売量の動き,・売上が少し増えており、大型案件の引き合いも出てきている。,
,,○,広告代理店（営業担当）,受注量や販売量の動き,・紙媒体、Ｗｅｂ媒体共に、広告売上が前年を上回っている。,
,,○,経営コンサルタント,取引先の様子,・取引先の飲食店では来客数が戻りつつある。ただし、まだ客足には波があって一定しないほか、曜日による増減の傾向などで、過去の経験が通用せず、仕入れやパート従業員のシフトに苦労している。,
,,○,その他サービス業［店舗開発］（従業員）,受注量や販売量の動き,・一時的な動きと予想されるが、ターミナル駅を中心に人流が大幅に増えており、土産品や飲食店を中心に売上が伸びている。一方、ターミナル駅の間にあるような中間駅には、大きな変化はない。,
,,○,その他非製造業［衣服卸］（経営者）,受注量や販売量の動き,・店頭での販売数量の動きや、リピートオーダーの状況は厳しいが、法人向けの商品やイベント向けの動きが出てきている。また、単価が上昇傾向にあるため、トータルの売上は前年を10％程度上回っている。,
,,□,パルプ・紙・紙加工品製造業（経営者）,受注量や販売量の動き,・季節要因を考慮すると、受注量はやや少ない。,
,,□,プラスチック製品製造業（経営者）,受注量や販売量の動き,・特定の製品に対する注文件数は増えているが、全体的な案件数は減っている。,
,,□,窯業・土石製品製造業（管理担当）,受注量や販売量の動き,・一時に比べて少し落ち着いてきたが、円安による燃料費の高騰で経費は増加している。ただし、値上げ交渉はまずまず順調に推移しているほか、取引先が分散していることでリスクも分散され、３か月前と比べて大きな変化はない。,
,,□,金属製品製造業（経営者）,受注量や販売量の動き,・量的に余り大きな変化はなく、低位で安定している。ただし、製品の値上げを行ったことを考えれば、それほど落ち込んでいない。,
,,□,一般機械器具製造業（経営者）,受注量や販売量の動き,・日々、規模の小さな引き合いはあるが、業況の回復度は以前の３割程度である。どんどん悪化しているわけではないが、上向いているとはいえない。,
,,□,電気機械器具製造業（宣伝担当）,受注量や販売量の動き,・テレビや白物家電の実売台数が、前年割れの状況である。,
,,□,建設業（経営者）,取引先の様子,・相変わらず建設資材価格の高騰や仕入れ不足、納期の不安定化が続いている。取引先の予算や納期に合わないため、対応に苦慮している。,
,,□,建設業（経営者）,受注量や販売量の動き,・止まっていた案件に動きが出てきたほか、新規の問合せも続いている。,
,,□,金融業［投資運用業］（代表）,それ以外,・コロナ禍が収束しつつあると思えば、急激な物価上昇の影響が広がり、景気の改善する暇がない。政府主導で思い切った景気刺激策が導入されない限り、今後もこの状況が続く。,
,,□,金融業（副支店長）,取引先の様子,・取引先の受注状況をみると、コロナ禍の影響で回復していない。,
,,□,広告代理店（営業担当）,受注量や販売量の動き,・コロナ禍の影響がまた広がっており、年末年始に向けた広告の動きも、予想したほど回復していない。,
,,□,その他非製造業［商社］（営業担当）,受注量や販売量の動き,・来期の予算確保のための引き合いは増えてきたが、全体的な動きは鈍いままである。,
,,▲,食料品製造業（従業員）,受注量や販売量の動き,・当社ではまだ値上げは行っていないが、全般的に値上げが浸透している。それに伴い、商品の購買意欲が減退し、買い控えが発生している。,
,,▲,繊維工業（総務担当）,それ以外,・原材料価格や加工費の値上げが、販売価格に転嫁できていない。むしろ、販売価格は取引先からの値引き要請で10％低下するなど、利益が確保できておらず、新商品の開発が急務となっている。,
,,▲,輸送用機械器具製造業（役員）,受注量や販売量の動き,・新規設備投資計画の変更や縮小、中止が増えているほか、受注済み案件のキャンセルも増えている。,
,,▲,その他製造業［履物］（団体職員）,受注価格や販売価格の動き,・可処分所得が実質的に減っている状況では、衣料品にはなかなか消費が回ってこない。,
,,▲,建設業（経営者）,受注量や販売量の動き,・建築コストの高騰により、客の心理は慎重にならざるを得ない。,
,,▲,輸送業（営業担当）,取引先の様子,・商品や送料の値上げで、売上が落ちている。,
,,▲,金融業（営業担当）,それ以外,・コロナ禍の影響や、燃料価格などの上昇で、収益が悪化している。,
,,×,電気機械器具製造業（経営者）,それ以外,・円安は輸出にプラスとなっていたが、徐々に海外の業者が日本の製品を買い控えるようになり、効果が薄れてきた。さらに、国内での物価上昇が激しくなり、円安による悪影響が強くなっている。,
,,×,輸送業（経営者）,競争相手の様子,・運賃が上がらない一方、経費は引き続き増えている。同業他社は、既に採算割れの仕事から手を引き始めた。あちこちから新規の仕事の依頼があるが、採算割れとなる依頼が多く、引受けられないケースが多い。,
,,×,不動産業（営業担当）,取引先の様子,・新型コロナウイルス感染症の影響で撤退した店舗の空きが、なかなか埋まらない。また、アパレル関係は特にＷｅｂ経由で購入する客が多く、実店舗での販売が減少している。賃料が下がり、空室率が上がっているなど、景気が悪化している。,
,,×,その他非製造業［電気業］（営業担当）,受注量や販売量の動き,・新型コロナウイルス感染症やウクライナ危機の影響もあり、非常に困難な状況のなかで、新たな経済政策を打ち出せていない。,
"雇用
関連

(近畿)",,◎,人材派遣会社（支店長）,求人数の動き,・需要の拡大で売手市場となっており、人材不足が顕著である。,
,,○,人材派遣会社（役員）,求人数の動き,・求人数は３か月前や前年と比べて、増加傾向にある。,
,,○,人材派遣会社（管理担当）,求人数の動き,・新型コロナウイルスの感染拡大への不安は残るが、海外からの訪日客の入国規制が緩和され、国内でも行動制限がないことから、ホテルや観光業界も活気を取り戻しつつある。それに伴い、求人数も増加傾向にある。,
,,○,職業安定所（職員）,周辺企業の様子,・求人数は増加しており、円安や物価上昇の影響はそれほど出ていない。,
,,○,民間職業紹介機関（営業担当）,求人数の動き,・この秋から冬にかけて、2024年卒の学生を対象にしたインターンシップや企業セミナーの合同説明会が開催されているが、前年よりも出展企業数は多く、学生の動員も良い。ただし、動員は良いが、人気のある企業とない企業の差が例年以上に大きく、学生による企業選定の傾向が感じられる。,
,,□,人材派遣会社（経営者）,求人数の動き,・前月と同様、どの業種からもオーダーは入ってきている。ただし、その一方でマッチングに非常に苦労しているのが現状である。テレワーク等の普及で人材は集めやすくなっているが、条件の問題もあり、東京周辺に雇用が流れるケースがみられる。一方、先行きの不透明感から、求職者は正社員志向に変わってきている。,
,,□,人材派遣会社（営業担当）,求人数の動き,・求人数が増え続けている一方、求職者は50代が多い状況が続いている。,
,,□,人材派遣会社（営業担当）,求人数の動き,・年末に向けて短期案件や単発案件が増えているが、案件数の伸びに求職者数が追い付いていない。,
,,□,新聞社［求人広告］（管理担当）,求人数の動き,・求人は主に介護や運輸、建設、飲食など、慢性的な人手不足業界に限られる。ウィズコロナの浸透で回復傾向にある飲食業界の求人がやや伸びているものの、他の業界の求人数に大きな変化はみられない。,
,,□,職業安定所（職員）,求人数の動き,・全体の新規求人数は前年比、前月比共に10％台の減少となった。業種別には宿泊・飲食サービス業が大きく落ち込んだ。全体の減少については、物価の上昇や円安の影響により、企業が求人に慎重になったことが原因とみられる。,
,,□,職業安定所（職員）,求人数の動き,・新型コロナウイルスの新規感染者数の再増加が懸念される。,
,,□,職業安定所（職員）,求人数の動き,・全体的には新規求人数は前年比でプラスとなっているが、業種によってはマイナスとなっている業界が増えつつある。,
,,□,学校［大学］（就職担当）,それ以外,・国内の観光客は増加しているが、まだまだ駅周辺の活気は感じられない。また新型コロナウイルスの新規感染者数が増えている。,
,,□,その他雇用の動向を把握できる者,求職者数の動き,・求人数は全体的に堅調に推移しており、企業の採用意欲は高い。仕事量の回復や、行動制限のない状態への移行が進むなか、客足の回復を見込んだ求人もみられる。その一方、コロナ禍で離職した従業員の補充が進まないという声も多い。求職者は減少傾向が続き、応募件数や採用件数も前年度を下回っているなど、雇用市場には停滞感がある。,
,,▲,新聞社［求人広告］（担当者）,それ以外,・関西の地元企業による新聞広告出稿の実績をみると、前年を下回る推移が続いている。,
,,▲,新聞社［求人広告］（営業担当）,それ以外,・ロシアのウクライナ侵攻や米国の利上げによる、円安の進行や物価の上昇、新型コロナウイルスの感染第８波などのマイナス要因が重なり、３か月前と比べても問題がますます複雑化している。,
,,▲,民間職業紹介機関（支社長）,それ以外,・景気後退局面では、選考プロセスでの歩留りが悪化するが、それに近いような低下傾向がみられる。,
,,▲,民間職業紹介機関（営業担当）,求人数の動き,・コロナ禍による特需の求人が減っているほか、求職登録者数もかなり減っている。ただし、例年この時期は求人が減るため、特需関連の変動を除けば、求人数の減少は例年どおりである。,
,,▲,学校［大学］（就職担当）,求職者数の動き,・新卒採用では二極化が進んでいる。内定のない学生はまだ動いておらず、何もしていないように感じる。,
,,×,－,－,－,
,,,,,,
　９．中国（地域別調査機関：公益財団法人中国地域創造研究センター）,,,,,,
,,,,,（－：回答が存在しない、＊：主だった回答等が存在しない）,
分野,,景気の現状判断,業種・職種,判断の理由,追加説明及び具体的状況の説明,
"家計
動向
関連

(中国)",,◎,一般小売店［眼鏡］（経営者）,単価の動き,・単価が少し上がり、今までは売れなかった高額商品が売れるようになってきている。,
,,◎,スーパー（店長）,販売量の動き,・物価上昇が続く状況で、ディスカウントという業態が有利に働いていることもあり、３か月前と比べ、来客数や販売量が大幅に増加している。,
,,◎,観光型ホテル（営業担当）,来客数の動き,・全国旅行支援の効果により、ほぼ毎日満室の日々が続いており、景気は上向いている。,
,,◎,観光型ホテル（副支配人）,販売量の動き,・全国旅行支援の影響で宿泊の予約が順調に入っており、利用人数、売上共に３か月前を大幅に上回っている。,
,,◎,都市型ホテル（総支配人）,来客数の動き,・県民割の発表後から来客数が伸びてきて、全国旅行支援で更に勢いが増している。,
,,◎,都市型ホテル（総支配人）,来客数の動き,・例年11月は観光のトップシーズンであることに加え、全国旅行支援による追い風もあり、宿泊客数、客単価共に堅調に推移している。,
,,◎,テーマパーク（業務担当）,お客様の様子,・来客数は伸び悩んでいるが、周辺の様子から判断すると、景気は活発になっている。,
,,○,商店街（理事）,来客数の動き,・11月初めに市や商店街のイベントが開催され、かなりの人出があった。,
,,○,商店街（代表者）,来客数の動き,・政府の全国旅行支援の効果や新型コロナウイルス感染症に関する規制が緩くなったことなどから、観光客や地元の消費者の動きが活発になってきているが、業種によってはまだまだ戻っていない。,
,,○,一般小売店［茶］（経営者）,来客数の動き,・周辺に人の動きが出てきたが、商品の動きはまだ余りない。国内外から社会的貢献の依頼が来るようになり、テレビの取材なども増えている。自分自身の仕事は忙しくなっており、会社の売上に結び付いてくれることを望む。,
,,○,一般小売店［洋裁附属品］（経営者）,お客様の様子,・最近、通りがにぎやかになり、来客数が増加している。,
,,○,一般小売店［食品］（経営者）,販売量の動き,・新型コロナウイルス感染症対策での移動規制がなくなり、前年より販売量が増加している。加えて値上げにより売上も前年を上回っている。,
,,○,一般小売店［印章］（経営者）,来客数の動き,・年末年始に向かい、人の流れが良くなっている。,
,,○,百貨店（営業担当）,来客数の動き,・全国旅行支援や近隣施設の観光ＰＲ等の後押しにより、来客数は前年を上回っている。年末年始の催事や行事等での需要も復調傾向である。,
,,○,スーパー（店長）,来客数の動き,・前月までは来客数が僅かに前年を下回っていたが、今月に入って前年を上回っている。また、商品の値上げによる単価の上昇で、売上が大幅に増加している。,
,,○,スーパー（店長）,来客数の動き,・来客数は前年比101％で進行している。特に週末の来客数の増加が大きい。今までコロナ禍でできていなかった抽選会などの店舗イベントの開催が来客数増加の大きな要因となっている。,
,,○,コンビニ（副地域ブロック長）,単価の動き,・販売数量は伸びていないが、全体的に10％程度の商品の値上げを行っているため、売上は新型コロナウイルス感染症発生前に戻りつつある。,
,,○,コンビニ（支店長）,来客数の動き,・週末を中心に人流を感じる。,
,,○,家電量販店（販売担当）,単価の動き,・来客数は減少しているが、単価が上がっている。,
,,○,乗用車販売店（統括）,販売量の動き,・11月の販売量は前年比108％と徐々に良くなっている。,
,,○,その他専門店［和菓子］（経営者）,来客数の動き,・新型コロナウイルス感染症の影響が薄れている。,
,,○,その他専門店［土産物］（経営者）,お客様の様子,・全国旅行支援のクーポンで客がいつもより多く買物をしており、景気はやや上向きになっている。,
,,○,都市型ホテル（企画担当）,来客数の動き,・全国旅行支援の効果や、インバウンド団体の受入れ拡大もあって宿泊の団体需要が増加している。秋の観光シーズンでもあり、週末には駅周辺の土産物店、飲食店がにぎわっている。今まで中止や延期になっていた宴会案件が復活し、大型の周年記念などのパーティーの受注が増加している。,
,,○,都市型ホテル（企画担当）,来客数の動き,・全国旅行支援の効果で３か月前よりも来客数が増加している。,
,,○,タクシー運転手,お客様の様子,・新型コロナウイルスの新規感染者数が増加しつつあるが、今までのような行動規制をする様子は今のところなく、街中には活気がある。また、観光の予約も順調に増えつつある。,
,,○,タクシー運転手,販売量の動き,・新型コロナウイルスの新規感染者数が増加しているが、売上への影響は少ない。,
,,○,通信会社（企画担当）,お客様の様子,・コロナ禍の社会体制は継続しているが、ネット需要は伸びている。外向けの社会活動が戻っていくところで、併せてネットサービス商品への引き合いも増えてきている。,
,,○,住宅販売会社（営業担当）,来客数の動き,・新型コロナウイルスの新規感染者数は増加傾向にあるものの、人出は多くなっている印象を受ける。,
,,□,商店街（代表者）,来客数の動き,・商店街に来る人の流れが鈍っており、各店舗の来客数も減っている。一部の店舗ではＳＮＳを使った集客で効果が出ている。,
,,□,商店街（代表者）,お客様の様子,・新型コロナウイルスの新規感染者数が増加しているため、来客数の減少が続いている。,
,,□,商店街（代表者）,来客数の動き,・新型コロナウイルス感染症が完全に終息していないため、消費が増加していない。,
