Ⅱ．景気の先行きに対する判断理由,,,,,
,,,,,
　景気の先行きに対する判断の理由について、その主だったもの及び特徴的と考えられるものを取りまとめると以下のとおりであった。,,,,,
,,,,,
,,,,,
　１．北海道（地域別調査機関：（株）北海道二十一世紀総合研究所）,,,,,
,,,,（－：回答が存在しない、＊：主だった回答等が存在しない）,
分野,,景気の先行き判断,業種・職種,景気の先行きに対する判断理由,
"家計
動向
関連

(北海道)",,◎,－,－,
,,○,一般小売店［土産］（店員）,・今後、偽装表示問題の影響で生産中止となっていた菓子が発売再開すると、最初のうちは苦戦するかも知れないが、徐々に販売量も増えて以前のような数字になってくる。現状でプラスあるいは現状維持をキープできていれば、問題となった菓子が販売再開された際には、その分、売上に上乗せできることになる。現場でも、客が当該菓子の販売再開を早く望んでいるという声をよく聞いている。,
,,○,百貨店（販売促進担当）,・地元球団の優勝セールに期待している。セールでの直接的な売上だけでなく、街全体への人出が増加することによる間接的な効果も見込める。また市民の気分が高揚し、財布のひもが緩みそうである。,
,,○,家電量販店（経営者）,・地上デジタル放送の開始に伴うＡＶ商品の販売増が見込まれ、年末に掛けてもその流れが続く。,
,,○,家電量販店（地区統括部長）,・10月から地方都市の地上デジタル放送が始まるため、今年の歳末商戦は、薄型テレビ、ＤＶＤレコーダーを中心としたＡＶ機器の需要が伸びることが予想される。,
,,○,観光型ホテル（経営者）,・団体観光客の動きが良くなりつつあることから、宿泊客数は回復に向かうことが見込まれるが、その反面、宿泊単価が低下傾向にある。総体としては、天候等の不測の事態がなければ好転する。,
,,○,旅行代理店（従業員）,・高額商品の申込が目立っており、今後についてはやや良くなる。,
,,□,商店街（代表者）,・天候やイベントの開催、店舗の新規開店、既存店舗の閉店などの要因での変化はあっても、中心街への来街者の消費動向は大きくは変わらない。,
,,□,商店街（代表者）,・冬物の最盛期となるが、このまま高めの気温で推移し、冬の訪れが遅くなると、コートや防寒衣料の動きの出足が悪くなることが見込まれるため、現時点では、何とも言えない状況にある。,
,,□,商店街（代表者）,・観光客の入込が前年よりも良く、また気温も高いために地元客が買物に来る回数が多いこと、固定客数が多くなったことなどから、今後についても変わらずに推移する。,
,,□,百貨店（売場主任）,・暖冬になることが考えられるので、コート類の動きが心配される。また、景気の動向も厳しく、客の買い方の面からは高額商品の動きも心配される。,
,,□,スーパー（店長）,・前年比の動きをみると、食品、生鮮品が底を打ち緩やかながらも上昇軌道に乗りつつある。急速な回復は望めないものの、今後についても変わらずに推移する。,
,,□,スーパー（店長）,・依然として好況への材料感が乏しいが、長期的な創業イベントセールに期待が持てる。,
,,□,スーパー（役員）,・９月は来客数の増加に伴い売上も増加したが、これは例年よりも気温が高く、また農作物の収穫期であることによる、一時的な影響であり、今後も売上の増加が続くとは考えられない。,
,,□,その他専門店［医薬品］（経営者）,・冬場に向かって医薬品業界はやや活性化していくものだが、現在の状況を考えると、現状維持がやっとであると見込まれる。,
,,□,その他専門店［ガソリンスタンド］（経営者）,・今冬も原油高騰の影響で暖房用の灯油価格が高値にて推移する。,
,,□,旅行代理店（従業員）,・先行き不透明感が漂い、予想できない面もあるが、景気が良くなる要因は見当たらない。,
,,□,旅行代理店（従業員）,・原油高があらゆる面に影響しており、今後、海外旅行が好転することは困難であると見込まれる。,
,,□,タクシー運転手,・利用客が減っている状況の中、札幌では新規参入するタクシー会社も出ているので、これからもまだまだ売上が減っていく。,
,,□,観光名所（役員）,・観光入込客数が増加する動きはあるものの、増減の幅が大きく、非常に不安定な海外客需要に頼る部分が多く、先行きに不透明感がある。,
,,□,その他レジャー施設（職員）,・季節的な増加要因はあるものの、前年比では増加が望めそうになく、むしろ悪くなる可能性もある。ただ、無料イベントを実施する予定があるため、利用者が一時的に増え、しばらくはその余波で利用者増が見込める。,
,,□,美容室（経営者）,・灯油を使う季節になってくるが、客には灯油が値上げされる不安感があるようであり、今後、消費意欲が好転する雰囲気は感じられない。,
,,▲,スーパー（企画担当）,・税金の実質負担増、年金問題に象徴される将来不安、原油価格高騰に伴う冬場の暖房費の値上がりに対する懸念、原材料価格の上昇に伴う食品、日用雑貨などの値上げ圧力など、客の買物行動へのマイナスの影響が懸念される。,
,,▲,コンビニ（エリア担当）,・ビールなどでケース単位の買物が減少している。また、安いビールを購入する人が増えている。遠隔地の行楽地へ出掛ける人が減っている。パチンコ店周辺の店でのたばこの売上の減少がある。これらのことから、ガソリン代の値上げ、税負担感などから消費抑制の動きが感じられ、今後についてはやや悪くなる。,
,,▲,コンビニ（エリア担当）,・第１次産業の不振の影響が大きくなってくる。特に漁業、農業ともに不振であるエリアでの売上減少が懸念される。都市部では工事需要の減少、消費者金融の貸し渋りの影響で、若年層、非正社員層の購買力低下が懸念される。,
,,▲,コンビニ（エリア担当）,・原油の高騰が続き、これから冬期に向けてハウス農家などの経営が厳しくなってくる。前年同様に離農者が増える話もあり、農業地帯での売上減少が続く。,
,,▲,衣料品専門店（店長）,・北海道はこれから寒くなるが、客は衣料品にお金が掛かることや灯油が高くなることを心配している。医療費の値上げもマイナスに影響してくる。,
,,▲,一般レストラン（スタッフ）,・今後も原材料等の値上げが予想されるが、販売価格の値上げは難しい状況であり、収益面での悪化が予想される。,
,,▲,観光型ホテル（経営者）,・個人客の動きは比較的安定しているが、このところ団体客が減少傾向にあり、今後もこの傾向は変わらない。,
,,▲,旅行代理店（従業員）,・航空会社の料金値下げ競争が激化する中、直販が脅威である。団体旅行については、経済が低迷している中、企業旅行の需要はなかなか見込めない。,
,,▲,タクシー運転手,・最近の灯油の値上がり傾向から、北海道は冬期間に向けてなお一層の節約ムードとなる。,
,,▲,その他サービスの動向を把握できる者,・シーズンオフに入るが、原油や石油製品、食料品の値上げなどから観光マインドは一層低下することが見込まれ、良くなる要素は見当たらない。,
,,▲,設計事務所（所長）,・ユーザーの関心が価格に突出する傾向が顕著であり、仕事をしても利益が出ないという状況がますます多くなりそうである。,
,,▲,設計事務所（職員）,・建設業界のとどまるところを知らない低価格受注、談合等の不祥事に端を発する建設会社の営業停止や指名停止処分が、北海道の景気にボディーブローのように効いてくる。,
,,▲,住宅販売会社（従業員）,・原油高騰による物価の上昇により、生活に掛かるお金が増加し、住宅ローンに対する資金のねん出が減ってくることが見込まれる。,
,,×,コンビニ（エリア担当）,・鉱物資源、商品価格等の値上げに拍車が掛かり、今後、消費者の買物行動はより厳しさを増してくる。さらに、競争相手の価格低下が進み、競争も厳しくなる。,
"企業
動向
関連

(北海道)",,◎,＊,＊,
,,○,通信業（営業担当）,・近い将来の受注予測数が当初計画より上ぶれの数字となっており、今後については、今よりやや上向いてくる。,
,,□,家具製造業（経営者）,・受注請負物件の需要が減少しつつあり、今後については変わらないまま推移する。,
,,□,輸送業（営業担当）,・燃料は高止まりで、トラック部門のコストを押し上げている。なかなか荷主に価格転嫁できない状況であり、社内では経済速度での運行を励行することで、燃料の消費量を抑えている状況であり、今後についても変わらないまま推移する。,
,,□,金融業（企画担当）,・企業収益が厳しいことから冬のボーナスも抑制が予想されるなど、個人消費は弱めの動きとなる。建設関連は官、民工事とも減少傾向に変わりなく、厳しさが続く。観光関連も端境期となるほか、土産品菓子の偽装表示問題の影響が懸念される。総じて景気に大きな変化はないものとみられる。,
,,□,その他サービス業［建設機械リース］（支店長）,・取引の主力である建設、運送業界に今後良化する要因が見当たらないため、今後についても変わらないまま推移する。,
,,▲,出版・印刷・同関連産業（役員）,・原材料、運送費などの経費が増えているが、競争が厳しいため、簡単に価格に転嫁できず、今後についてはやや悪くなる。,
,,▲,輸送業（支店長）,・農産物等の季節商材は増加が見込めるものの、鋼材、木材、建設資材等の物資については、荷動きが大きく落ち込むことが予想される。,
,,▲,その他非製造業［鋼材卸売］（従業員）,・前向きな見通しもあるものの、下期の受注見通しが見えていない状況にある。本州物件の道内への発注も第４四半期以降との見方もあり、良くなる要因に欠ける。,
,,×,－,－,
"雇用
関連

(北海道)",,◎,－,－,
,,○,＊,＊,
,,□,人材派遣会社（社員）,・企業の採用の動き、就業者の動き共にあまり活発には感じられない。,
,,□,職業安定所（職員）,・新規求人数が前年から減少しており、今後についても変わらないまま推移する。,
,,□,職業安定所（職員）,・８月までの累計月間有効求人倍率は0.45倍となっている。前年からは0.03ポイントのマイナスで推移しており、改善の兆しが見えてこない状況にあり、今後についても変わらないまま推移する。,
,,□,職業安定所（職員）,・新規求人数が３か月連続で前年を下回っており、足踏み感が強まっている。,
,,▲,人材派遣会社（社員）,・秋から冬にかけては、特に目立った人材の需要は起こっていない。また、道内企業の９月中間決算の状況を踏まえると、企業が経費削減に動くことが予想され、道内の景気にはマイナス要因となる。,
,,▲,求人情報誌製作会社（編集者）,・大企業、道外資本、間接業種の求人がプラスに寄与している一方で、大半を占める中小零細の求人が思わしくなく、今後の動向が心配される。,
,,▲,職業安定所（職員）,・事業主都合による離職者が増加する一方、求人の増加が見込めなく、今後の求職者の滞留が想定される。,
,,×,－,－,
,,,,,
　２．東北（地域別調査機関：（財）東北開発研究センター）,,,,,
,,,,（－：回答が存在しない、＊：主だった回答等が存在しない）,
分野,,景気の先行き判断,業種・職種,景気の先行きに対する判断理由,
"家計
動向
関連

(東北)",,◎,百貨店（経営者）,・秋物衣料の不振を招いた今月の気候は異常であったと考えており、また、競合の状況も落ち着いてくることから、今現在のように悪いままの状態ではない。ただし、良くなるとは言っても、あくまで今の悪い状況に比べればの話である。,
,,◎,家電量販店（店長）,・今後は閉店処分セール、オープンセールと続き、また、地上デジタル放送の開始も控えていることから、売上は増加する。,
,,◎,住宅販売会社（従業員）,・見込み客からの受注が順調であり、見通しが良くなっている。また、新しい展示場のオープンを控えており、集客が見込める。,
,,○,一般小売店［カメラ］（店長）,・秋の新製品の発売があり、デジタルカメラの販売は好調を維持する。また、国体の特需が期待できる。,
,,○,コンビニ（経営者）,・競合する店との差が無くなり客が戻りつつあるため、このままの推移でいけばやや良くなる。,
,,○,乗用車販売店（経営者）,・中越沖地震の復興需要、東京モーターショーの開催、新型車投入など効果は不透明ながらも好材料がそろっており、少しは上向く。,
,,○,乗用車販売店（経営者）,・10月に主力小型車のモデルチェンジが予定されており、集客力が向上する。,
,,○,その他専門店［化粧品］（経営者）,・朝晩が涼しくなり、秋物商材に動きが出てきたことから、政治など社会が安定すれば景気がやや上向く。,
,,□,商店街（代表者）,・販売が上向く気配が無く、悲観的な意味で今後も変わらない。,
,,□,商店街（代表者）,・イベントやセールなど商店街全体で集客し、ある程度の成果を上げているが、セール前の買い控えもあり１か月のスパンでみるとあまり変化が無い。このような状況が今後も続く。,
,,□,一般小売店［書籍］（経営者）,・パイの増大が期待できなければ、自店の販売努力が大きなかぎと言うしかない。商材もあまり期待できず、先行きは厳しい。,
,,□,一般小売店［医薬品］（経営者）,・中心市街地では秋のイベントが多くなるが、見物客は多くても繁華街で飲み食いをする人は少なく、景気は上向かない。,
,,□,百貨店（広報担当）,・明るい材料が見当たらず、生活防衛意識が働く状態が続く。,
,,□,百貨店（経営者）,・10月以降はガソリン価格が更に上昇するとともに、食料品など商品価格の値上げが相次いでいるため、景気回復のためには条件が厳しい。,
,,□,スーパー（経営者）,"・米の仮渡し金が60キログラム当たり15,000円から10,000円に低下するなど、農業県である新潟にとっては農業所得の減少が厳しい状況を継続させる要因となる。また、新規の大型店出店もあり競争が激化することから、流通業では楽観できる状況にない。",
,,□,スーパー（店長）,・政局が不安定であることに加え、あらゆる商品価格が上昇しているため購買行動には慎重さがみられ、今後も楽観はできない状況が続く。,
,,□,スーパー（店長）,・７月に競合店が出店して以降は、来客数の減少と１品単価の低下が進んでいる。各社の特売チラシが増えており、客が買い回りしている様子がみられるが、この状況はしばらく変わらない。,
,,□,スーパー（店長）,・地場産業の衰退で雇用情勢も悪化してきており、今後の消費動向はこのままの状態で推移する。,
,,□,スーパー（店長）,・客単価の変化が少ないため、今後の売上は来客数の動向にかかってくるが、今のところ大きく変化する様子は無い。,
,,□,スーパー（総務担当）,・10月からは食品メーカーの卸価格の値上げ、ガソリンの値上げ、電気料金の値上げなどがあり、消費環境は良くない。製造業の好調は末端の消費者まで行き渡っておらず、今後も消費の拡大、売上の改善は進まない。,
,,□,スーパー（企画担当）,・チラシによる販促に対しての客の反応が非常に敏感であるため、当社としても販促の見直しに取り組むが、全体的に厳しい見通しは変わらない。,
,,□,コンビニ（経営者）,・買上点数、客単価が堅調に推移していることで望みは持てるが、来客数の減少に歯止めが掛からないため当面は苦戦が続く。店舗近隣でのビル建設や大型工事の予定も無く、その需要も見込めない。今後は大型商品も出てくる時期ではあるが、競合他店でも同様であり、現状維持が精一杯である。,
,,□,コンビニ（エリア担当）,・２、３か月のスパンでは、景気が良くなる、あるいは悪くなる理由が見当たらない。この夏のように天候要因で変わることはあるが、それ以外の部分では不透明である。,
,,□,衣料品専門店（総務担当）,・次シーズンの商品を投入しているが、客の消費動向は活発になっておらず、早めに準備するというような動きがみられない。このような状況が今後も継続する。,
,,□,家電量販店（店長）,・地上デジタル放送が年末から始まるため、ＡＶ関係は持ち直しが見込まれるものの、これまでの推移からして、全体的な流れは変わらない。,
,,□,住関連専門店（経営者）,・地域特有の三隣亡の年回りに当たり住宅着工が前年より少なくなっていることもあり、住宅関連商品の消費も年内は伸びない。新内閣の景気浮揚策に期待する。,
,,□,住関連専門店（経営者）,・仕入価格の上昇分を販売価格になかなか転嫁できずにいるものの、売上は上下の波を繰り返しており、この先も変わらない。,
,,□,その他専門店［呉服］（経営者）,・問屋の話では「他の店でも売上は良くない」とのことであり、景気が良くなる要素が見当たらない。,
,,□,その他専門店［酒］（営業担当）,・年末は酒の動きが良くなる時期であるが、飲食店の状況は下げ止まっていないため、あまり期待はできない。,
,,□,その他専門店［ガソリンスタンド］（営業担当）,・ガソリンなどの石油製品は10月も仕入価格が上がるため、販売量の低迷と粗利益の減少傾向は改善が見込めない状況が続く。今冬の天候、寒さの程度が今後の販売状況を大きく左右する。,
,,□,スナック（経営者）,・涼しくなって人の動きが出てくることや、企業によっては異動があり歓送迎会需要があるなど、季節的には良くなる面もあるが、基本的には変わらない。,
,,□,都市型ホテル（スタッフ）,・挙式場を今月リニューアルオープンし、告知に努力しているが、申込や問い合わせは来春以降になるものが多い。年内は一般宴会、忘年会、宿泊含みの職場旅行などの営業を徹底する。,
,,□,旅行代理店（従業員）,・最近は職場の慰安旅行が少なくなり個人旅行が中心となっているが、子どものいる家庭では出費も大きくなるため、家族旅行ができる人は限られている。,
,,□,旅行代理店（従業員）,・月ごとにばらつきがあり、先行きは不透明である。,
,,□,タクシー運転手,・新規参入した会社が半年で廃業するなど、景気が良くなる要因が無い。,
,,□,通信会社（営業担当）,・各キャリア（携帯電話事業者）が端末の販売体系を11～12月にかけて変えるとの情報もあり、買い控えが予想されるため先行きが非常に不安である。,
,,▲,一般小売店［茶］（経営者）,・所属する団体でマイバッグ運動を展開しており、市内の小売店を回っているが「運動に参加するほど客がいない」という店も目立つ。景気が良い話は聞かれず、家電の大型店も閉店するなど、春先の状況と比べても景気は悪い方向に向かっている。,
,,▲,一般小売店［酒］（経営者）,・大型店ができたため、商圏が変わってしまう。何の商売でもつぶされてしまう。,
,,▲,一般小売店［雑貨］（企画担当）,・天候に左右される面はあるが、個人消費の動向は、収入の伸び悩み、年金問題、税負担の増加などにより手控え気分が高まっている。,
,,▲,百貨店（営業担当）,・秋以降には周辺で再開発工事が予定されており、一時的にせよ周辺に「シャッター街」が発生するなど、来客数、来街者数の減少傾向が急速に回復するとは考えられない。現場からは単価ダウンの声も聞かれ、かなりの苦戦が予想される。,
,,▲,百貨店（販促担当）,・10月下旬には県内最大規模のモール形式の量販店が近郊に出店するため、エリア間の競合が更に厳しくなってくる。,
,,▲,スーパー（店長）,・郊外に新規の商業集積地が形成されているため、市内の商圏が大きく変化する。中心市街地から郊外への客の流出が更に進み、既存店の売上に影響する。,
,,▲,スーパー（店長）,・秋冬へと季節が移行するが、原油価格の高騰が灯油価格や様々な商品価格の上昇という形で影響し、消費は倹約ムードが高まる。,
,,▲,スーパー（店長）,・秋冬物商材の出遅れに加え、競合するディスカウントストアでは通常の半額近い安値で攻勢をかけているが、対抗するための原資が無く、利益が出ずに苦戦する。,
,,▲,コンビニ（店長）,・原油価格の高騰が続き、灯油代などでこの冬の家計を圧迫するであろうという悲観的な観測が消費者の心理を暗くしているため、消費行動は積極性を欠いている。,
,,▲,衣料品専門店（経営者）,・輸入品が主体の大きな催事を予定しているが、ユーロ高の影響で全体的に２割程度価格が高くなっているため、あまり期待できない。,
,,▲,乗用車販売店（経営者）,・自動車メーカー各社から新型車が発売されているものの、豪雨により農作物に被害が出たことからくる心理的影響、及びガソリン価格の再々値上げなどの経済的影響から、今後も大きな市場の伸びは無い。,
,,▲,乗用車販売店（経営者）,・秋田県は米の作柄が全国で唯一「やや良」ということで期待していたが、米の仮渡し金は思ったより安く、県経済に明るさは感じられない。会社は経費の節減などで、なんとか生き延びていくしかない。,
,,▲,乗用車販売店（経営者）,・今後しばらくは新型車の出る予定も無く、決算期でもなくなるため需要の大きな変動はみられない。客からも原油高、物価高、金利高と先行きを不安視する声が多く出ている。,
,,▲,住関連専門店（経営者）,・気候的には涼しくなってきたものの来客数が回復してこないことから、この先は非常に心配である。,
,,▲,その他専門店［ガソリンスタンド］（営業担当）,・10月も石油卸価格は値上げが予定されている。この１年間でガソリンなどの価格は大きく上昇したため、消費者は不安や不満を持っており、その影響でこの業界は悪い方向に進む。,
