Ⅱ．景気の先行きに対する判断理由,,,,
,,□,百貨店（購買担当）,・前月同様、少し早めに秋物を投入して、クリアランスの商材不足を補充しているが、秋物の動きも鈍く先行きがみえてこない。また７月のイベントも予想以上に集客につながらなかったため、９～10月に大きなイベントを予定しているが、苦戦を強いられる懸念が大きい。
,,□,スーパー（店長）,・ガソリン代の更なる値上げや一部食料品の値上げ、また紙類の値上げなど、取り巻く状況にマイナス要因が多い。また、新規ディスカウントストアオープンによる価格競争の激化も考えられ、厳しい状況が続く。
,,□,スーパー（店長）,・ここ数か月、販売点数も来客数も前年比102～103％と推移しているので、２～３か月先もこのままの状態が続く。
,,□,スーパー（店長）,・この夏の猛暑予測が平均気温程度と変わり、季節商材について１品単価の下落が予想される。
,,□,スーパー（店長）,・客が収入と支出のバランスを食費で調整している傾向が見受けられる。税の問題・ガソリンの問題・食材の値上げの問題等で、食費の構成比が上がるということは考えられない。
,,□,スーパー（総務担当）,・ちょっと上のランクの商品が売れないため、客単価が上がらない傾向は続く。衝動買いが減って目的の物しか買ってもらえない。
,,□,スーパー（管理担当）,・３か月前から価格強化の販促を組み、３か月前と比べて来客数が120％と伸びたことで売上金額も伸びているが、ここ最近伸び幅がなくなってきている。
,,□,スーパー（販売担当）,・お盆用の商品は伸びると思われるが、中国産などの食品の安全に対して客の目が大変厳しく、購入には非常に慎重になっており、相殺して変わらない。
,,□,コンビニ（エリア担当）,・後半は出店の予定も若干はあるが、全般的には売上等があまり回復していない。今後もこのままの状態が続く。
,,□,コンビニ（エリア担当）,・競合店の出店が続く予定であり、売上の伸びが期待できない。
,,□,コンビニ（エリア担当）,・今月は前半は悪かったが、後半は暑くなり盛り返した。しかし根本的に売上状況は悪く、１人当たり売上点数や客単価のダウンはこれからも続く。
,,□,衣料品専門店（地域ブロック長）,・今後は気温も上がってくるとは思うが、バーゲン期に入り一気に単価が低下するので、全体的には売上が増加しにくい状況になる。
,,□,乗用車販売店（経営者）,・原油価格、ガソリン価格の高値も引き続くようであり、選挙後の政局も不安定なような感じを受け、良くなる要素が見当たらない。
,,□,乗用車販売店（サービス担当）,・メーカーの支援策、新型車両の投入、モデルチェンジ等の良くなってくる材料が今のところ見当たらない。
,,□,自動車備品販売店（経営者）,・来客数は低調であるとは言え、タイヤ、オイル、バッテリー等の補修商品や高額品のナビ等は堅調に動いており、今後には期待できる兆しもあるが、当面は現状水準の維持が精一杯である。
,,□,高級レストラン（スタッフ）,・９月の予約はまだまだ少なく、10月に入ってやっと少し予約が増加しており、月によってかなり差がある状況になっている。
,,□,一般レストラン（経営者）,・前月今月と前年をクリアしていないが、夏休みに入ってからの数字は前年比100％をクリアしており、全体的には今後もあまり変わらない。
,,□,一般レストラン（店長）,・今のところ、予約件数・来客数の動きをみても横ばい状況なので、何か大きなイベント等ない限り、このまま横ばいの状況で推移する。
,,□,観光型ホテル（経理総務担当）,・夏休みに入り、家族旅行や各種レジャーには、ある程度のお金を使うものと思われるが、大きな期待はできない。地方は、首都圏や大企業のような好況感はない。
,,□,タクシー運転手,・客の話は、年金と介護保険の不安ばかりであり、これはこれからも続きそうである。
,,□,タクシー運転手,・客単価が伸びない状態が、ここ１年来続いている。７月は各種イベントがあったので、それがプラス要因になったが、将来的にもイベントが多くないと、タクシー業界は厳しい。
,,□,通信会社（企画担当）,・商品単価の下げ止まりもあるかも知れないが、サービス内容の吟味をして、購入に時間が掛かる傾向は続く。
,,□,テーマパーク（業務担当）,・夏から秋にかけて大規模イベントを控えており、春から続いている前年比での回復傾向が、今後もしばらくは続く。
,,□,設計事務所（経営者）,・まとまった物件は大手が取るので、我々中小企業は仕事量も少ない状況がこれからも続き、景気が上向く気配はない。
,,□,設計事務所（経営者）,・原材料価格が値上がりしている中、少しずつ製品の価格も高くなってきているため、建築主からの発注もしばらく様子見となる。
,,□,住宅販売会社（販売担当）,・展示場イベントへの来場数も前年比と増減無く、また売上も、あまり増加しておらず、この状態が続く。
,,▲,商店街（代表者）,・商店街や一般小売店は、大型店に客をとられ、空き店舗になっている。中小小売業は廃業に追い込まれる店が多く回復の見込みはない。まちづくり３法が実施されるが、遅すぎる。
,,▲,商店街（代表者）,・郊外にショッピングモールができ、商店街のなかで高齢化が進んでおり、いずれにしても大変良くない状況が続いている。中小零細の小売業はこれからどうしようもなくなる。
,,▲,一般小売店［酒店］（経営者）,・同業者や飲食店関係の取引先などの状態をみても好転の材料がない。購買意欲が低調なため、今後、お盆の帰省客などで一時的には活発化しても、８月中旬以降は急速に冷え込む。
,,▲,百貨店（販売促進担当）,・９月には郊外ショッピングセンターが倍に増床してオープンする。市内の個人商店も現店舗を閉店しショッピングセンターへ出店する店もでており、ますます、中心市街地の空洞化が進む。更に全体の消費が上向いてくるとは考えづらい。
,,▲,百貨店（売場担当）,・ヤングキャリアゾーンの売上が悪く、前年２けた伸ばしたブーツの売上は、今年は取りきれない。原油高、円安と中国の人件費増が商品単価を跳ね上げ、客の目に見える形で秋物に現れる。
,,▲,百貨店（販売担当）,・駅構内に新たな商業施設が入り、メンズ・レディースの人気ブランドが導入されるため、来客数に一時的な影響を受ける。
,,▲,スーパー（店長）,・食品の原料偽装、中国製品からの客離れ、原油の高騰など、食品を扱う立場としては現在のところ良くなる材料が見当たらない。
,,▲,スーパー（財務担当）,・原価の引上げ等があり、販売価格に転嫁出来にくい状況で利益率の低下がある。
,,▲,コンビニ（エリア担当）,・競合の出店及びドラッグストアの出店により、更に客足は遠のく。既にオーバーストア状況になっており、しのぎを削らなければならない状態である。
,,▲,コンビニ（エリア担当）,・住民税・ガソリン高騰など個人消費に逆風の要因があまりに大きい。
,,▲,衣料品専門店（販売促進担当）,・値段が安いからといって購入する客さえも減少しており、本当に必要なものしか購入しない、無駄なものは一切買わないという客が増えている。この状況はしばらく続く。
,,▲,家電量販店（店長）,・例年に比べて気温も不安定であり、競合店の動きもあり、この先、厳しい状況が続く。
,,▲,家電量販店（店長）,・薄型テレビ等、デジタル家電の伸び悩み、白物の販売不振はまだまだ続く。
,,▲,乗用車販売店（統括）,・顧客である地域の中小企業の社長たちとの懇談でも、ほとんどの人がこれからも厳しいと言っている。
,,▲,乗用車販売店（統括）,・ガソリン代の値上げや食料品などの値上げなどにより、買い控えが起こったり、値引きを要求されたりで、これからもあまり良い商売ができない状況が続く。実際、自分でも大きな買物には消極的になる。
,,▲,住関連専門店（広告企画担当）,・地方のマーケットでは、高額単価の商品を購入する客の数が圧倒的に少なく、これからも厳しい状況が続く。
,,▲,その他専門店［布地］（経営者）,・地方は所得が増加していないのに、ガソリン代を始め、いろいろな物価が値上がりし、売上にまともに響いており、この状態が続く。
,,▲,その他専門店［スポーツ］（経営企画）,・値上げ商品がこれから増えてくると、更に買上点数の減少につながる。
,,▲,一般レストラン（店長）,・ファミリー層の減少が響いている。さらに、原油高で仕入れコストも徐々に上がってきており、利益も圧迫している。今後もコスト高は避けられない。
,,▲,都市型ホテル（経営者）,・前年同期との比較で、予約率が低くなっている。
,,▲,通信会社（通信事業担当）,・近くに大型電器量販店が開店したため、タイアップして様々な販促の手段をとる大手のサービスへの乗換えが増加し、新規客もそちらへ流れる可能性がある。
,,▲,通信会社（販売企画担当）,・夏商戦期も終わり、これから新商品の発売等の目立ったトピックスもない。
,,▲,美容室（経営者）,・同業者同士で話し合っても、この夏の売上が伸びないと、この先見通しが暗いという話ばかりである。
,,▲,住宅販売会社（従業員）,・原材料の値上げ傾向、受注件数及び金額の減少傾向が見受けられ、しばらく続く。客の動きも今一歩積極的でない。
,,×,スーパー（店長）,・改装中の近隣の商業施設のリニューアルオープンが、11月初旬の予定となっているため、あと数か月は商圏として来客数が減少し続け、厳しい状況が続く。
"企業
動向
関連

(中国)",,◎,輸送用機械器具製造業（経営者）,・クライアントからの受注が、９～10月にかけて増強の要請があり、景気は良くなると予想される。
,,○,輸送用機械器具製造業（経理担当）,・次の新製品については、大型の受注がある。
,,○,輸送業（統括）,・急激には回復しているとは思えなが、少しずつは良くなっており、当面はこのような状態が続くと思われる。
,,○,その他サービス業［清掃具レンタル］（情報管理担当）,・夏を迎え、今年は水の味に関心を持つ客が増えてきているので、浄水器関連が伸びる。
,,□,窯業・土石製品製造業（総務経理担当）,・新規引き合い案件も入っており、現在の生産量は今後も確保できる。
,,□,鉄鋼業（総務担当）,・継続して自動車、造船、産業機械向けの好調な需要を受け、フル生産が継続している。しかしながら、中国の鋼材輸出拡大や米国経済の先行不透明感などの憶測も流れており、注視が必要である。
,,□,鉄鋼業（総務担当）,・ガソリン等物価も上昇基調にあり、コスト増につながっている。製品値上げでカバーしきれない状況が続く。
,,□,金属製品製造業（総務担当）,・２～３か月先は現在と同様の高水準な状況（フル生産）で推移すると予想され、特段大きな変化は見られない。また得意先からの増産要請と工作機械や造船業界の強い需要が決定要因となり、中長期的な観点から大規模の設備投資を決定し、来年５月の工事完了予定で進めている。不安要素としては、鉄原料を中心とした価格の高騰がある。
,,□,電気機械器具製造業（総務担当）,・自動車関連は、先行き相変わらず好調な受注が入っており、多忙の状況が続きそうである。携帯関連は、秋モデルまで少し落ち着いた状況となっている。
,,□,建設業（経営者）,・発注者が官も民もい縮しているようで、仕様変更を命じておきながら、適切な設計変更に応じないというような状況が多く起こっている。これが、下請、孫請けにまで影響して、非常に厳しい状況が今後も続く。
,,□,通信業（営業企画担当）,・インターネットアクセス回線を利用した企業ネットワークなどの実態が見えない。営業訪問先からの情報においても、その顧客に最適な商品については決め手を欠いているといった状況が続いており、通信業界全体の苦戦は当面回復見通しが立たない。
,,□,通信業（部門長）,・芳しい業績があったという客の声を聞かない。自動車製造業が好調であるが、海外市場に依存しており、関連企業も特需の意識はなく、好景気とはいえない状況が続く。
,,□,金融業（営業担当）,・不動産は動く気配が出てきている。山口市・宇部市の工場団地の進出の話も毎月のように出ているが、単なる流通拠点というだけで、地元が潤うような企業進出にはなっていない。地元での雇用、受注が拡がる話は全く出ておらず、当分今の状態が続く。
,,□,金融業（業界情報担当）,・米国経済の鈍化懸念はあるが、欧州・アジア圏の好調から世界景気はおおむね良好が続くとみられ、当面は高水準の受注が続く見込みである。
,,□,広告代理店（営業担当）,・地場企業経営者の話には『地方は当分変われない』とのあきらめ感のようなものが漂っている。また選挙後の動向が見えず、当面変わりようがない。
,,▲,食料品製造業（総務担当）,・食品関係の様々な事件が起こっており、それが関係しているのか、単価が不安定であり、しばらく続きそうである。
,,▲,一般機械器具製造業（経営企画担当）,・特に北米を中心とした海外向けの自社製品の売上に陰りが見え始め、減少傾向にある。
,,▲,電気機械器具製造業（広報担当）,・これからの受注が十分確保できる見通しになっていない。
,,▲,輸送用機械器具製造業（総務担当）,・受注量・生産高共に横ばいの状況が続く。しかし、原材料価格の値上がりや金利負担の増加・社会保険料の負担増などコストアップ要因が多く、非常に厳しい。
,,▲,その他製造業［スポーツ用品］（総務担当）,・原油が高止まりした状態で何とか保っていたが、再度の値上げで、材料メーカーや海外取引先からの値上げ要請が後を絶たず、ある程度の受け入れざるを得なくなってきている。価格の値上げも難しい情勢であり、今後の利益の大幅な圧縮が見込まれる。
,,▲,会計事務所（職員）,・建設業の不振は、今後もまだ続くとみる経営者は多い。さらに、燃料費の増加により物流コストがアップしているため、一部には材料費の値上げを提示されているところもあり、状況が好転するとは思えない。また製造業は堅調だが、自動車メーカーの意向次第ではどうなるか判らない面もあり、先行きは必ずしも安泰ではない。
,,▲,コピーサービス業（管理担当）,・紙価格の高騰が、これからいよいよ利益を圧迫してくる。
,,×,＊,＊
"雇用
関連

(中国)",,◎,－,－
,,○,求人情報誌製作会社（担当者）,・秋以降に新卒採用説明会を開催して欲しい旨の要望の声等がある。
,,○,職業安定所（職員）,・学卒求人の受理状況をみると、製造大手数社が好調であることから、関連企業からも求人が増加している。現段階で求人受理件数は変わらないものの、求人数については既に前年度の合計数をはるかに超えている。
,,○,職業安定所（職員）,・求人数は増加しており、多少景気回復の兆しがみえてきている。しかし求人内容を見ると、非正社員求人やパート求人が多いため、就職者数はあまり変わらない。
,,○,職業安定所（雇用開発担当）,・労働市場における新規求人は前年同月比で微増、新規求職は微減となっている。対前月でみると、新規求人・求職共に減少しており、例年の傾向以上に求職者側の動きが鈍くなっている。これは、労働市場が停滞期に入ったものでなく、夏季ボーナスの支給前(支給済事業所も多いとは思うが)には採用を抑えがちになるため、今後はその反動で求職者側の動きが活発になるその前触れとも言える状況である。また、管内事業所においては、通年商品に加え秋冬等の季節商材の製造に拍車が掛かり、スポット的な雇用確保も必要になるとの情報も聞いている。このため８月盆明けから９月へかけて、求人・求職に大きな動きがある。
,,○,学校［短期大学］（就職担当）,・企業に応募期間の延長、２次募集等するケースが増える傾向にある。
,,□,人材派遣会社（営業担当）,・更に中小企業の人材不足感は高まり、企業からの依頼は増加する可能性があるが、一方で派遣業界にとっては登録スタッフの確保が更に深刻な問題となってくる。
,,□,職業安定所（職員）,・一向に上向かない景気の影響で、多くの業種で解雇等事業主都合離職者の発生事例が相次いでおり、求人面でも都会地とのギャップが際立っている。
,,▲,＊,＊
,,×,－,－
,,,,
　９．四国（地域別調査機関：四国経済連合会）,,,,
,,,,（－：回答が存在しない、＊：主だった回答等が存在しない）
分野,,景気の先行き判断,業種・職種,景気の先行きに対する判断理由
"家計
動向
関連

(四国)",,◎,＊,＊
,,○,スーパー（店長）,・野菜の相場が上昇しており、売上増加の追い風になる。
,,○,乗用車販売店（従業員）,・新型車効果により、数か月は好調を維持できる。中越沖地震による工場ストップの影響が懸念されたが、自動車の生産は順調に回復しており、思ったほどの生産ダウンは避けられた。メーカーも国内販売のてこ入れに本腰を入れ始めており、各県の販売も期待できる。
,,○,通信会社（管理担当）,・新料金サービス等の発表により、今後客の動向が活性化する。また、携帯電話業界全体においても同様の動きがあることから、景気がやや上向きになる。
,,○,ゴルフ場（従業員）,・順調に予約が入っている。
,,○,設計事務所（所長）,・工場や倉庫など、業務用施設の計画が増えている。
,,□,商店街（代表者）,・多少来街者が増えているが、景気が良くなるほどのことはない。
,,□,商店街（代表者）,・夏物バーゲンがかなり厳しい。２～３か月後には秋物の販売も始まるが、なかなか回復しない。
,,□,百貨店（営業担当）,・クリアランスでは、まとめ買いは無く目的商品のみ購入していた。お中元商戦においても、法人は下げ止まるかと思われたが予想以上に件数が減少し苦戦した。宝飾品、美術品なども動きが鈍い。
,,□,百貨店（売場担当）,・売上は前年を若干下回ることが多く、今後も消費が回復する材料はなく、期待できない。
,,□,スーパー（店長）,・客に、所得が増える様子がなく、食費等は節約する。
,,□,スーパー（企画担当）,・原油高騰による商品原価の上昇が、店頭価格にも影響し始めている。
,,□,衣料品専門店（経営者）,・夏物セールに勢いがない。秋物の早期立ち上げが予想されるが、年々必要なものしか買わない傾向が強くなってきており、残暑が長引くようだとあまり期待が持てない。
,,□,家電量販店（営業担当）,・１点買いの客が増え、それ以上勧めることが難しくなっている。買い控えも進んでおり、プラス要因は少ない。
,,□,乗用車販売店（営業担当）,・軽自動車は非常に良いという見方をされていたが、この１～６月、連続して前年割れである。また、７月も大きく前年割れの見込みであり、良くなるとは思えない。
,,□,住関連専門店（経営者）,・販売量が予想より伸びない。
,,□,一般レストラン（経営者）,・客数が予想よりかなり少なかった。
,,▲,スーパー（統括担当）,・定率減税の廃止が大きい。サラリーマンの手取りが減ったということが大きくマイナスに働く。
,,▲,衣料品専門店（経営者）,・台風の後の動きをみる限り、もっと盛り上がってくるのかと期待していたが、なかなかそういう兆しがみえず、今後も、やや弱い感じが続く。
,,▲,乗用車販売店（従業員）,・毎月のようにガソリン価格が上昇し、小型車クラスのユーザーには影響が非常に大きい。
,,▲,都市型ホテル（経営者）,・予約状況が今までと比べて悪い。また、建設会社の破産等が続いているため、全体的に沈滞ムードが漂っている。
,,×,衣料品専門店（経営者）,・市民税の増税による家計の圧迫や年金問題など、先行きの不安感により、間違いなく買い控えが見られる。
,,×,美容室（経営者）,・増税等家計に厳しい状態が続いており、消費意欲が弱い。
"企業
動向
関連

(四国)",,◎,－,－
,,○,繊維工業（経営者）,・小売店でも、品ぞろえの良い店舗は活況である。
,,○,電気機械器具製造業（経営者）,・円安により企業業績は好調で、個人消費も拡大する。
,,○,広告代理店（経営者）,・首都圏中心であったフリーペーパーの受注が地方にも広がってきている。
,,□,一般機械器具製造業（経理担当）,・一部の地方ではクレーン稼働の一服感が見られるものの、関西地区では駅前開発や弱電メーカーの大型設備投資が話題にのぼるなど、都市圏を中心に順調な稼働が続く。
,,□,一般機械器具製造業（経理担当）,・民間のユーザーの動きが依然として悪い。官公庁の受注にも力を入れる必要がある。以前にもまして厳しさが増してくる。
,,□,輸送業（支店長）,・８月も燃料が値上げされるため、現状で推移する。
,,□,通信業（営業担当）,・営業先の商店で、男性用衣料品の売上が伸びたとの声が聞こえない。また、目玉商品、バーゲンの値札が客の店内に目立っている。
,,□,金融業（融資担当）,・公共工事の減少で、県内の主要産業である建設土木業は引き続き厳しい状況が続いている。また、小売・卸も、売上・利益共に減少傾向にある。
,,□,不動産業（経営者）,・一般消費者の、土地や家に対する需要は低迷している。ただ、一部の企業に設備投資意欲は若干ある。全般的には低迷している。
,,□,広告代理店（経営者）,・新規客獲得による広告増加と既存客の広告費減少で、売上及び粗利益は横ばいで、今後の予測も変わらない。
