Ⅱ．景気の先行きに対する判断理由,,,,,
,,□,化学工業（経営者）,・相変わらず値上がりし続ける原料価格に対して、いまだに販売価格に転嫁できないユーザーが多い。,
,,□,金属製品製造業（経営者）,・鉄の原料不足が報じられているが、まだ不足感は出てきていない。,
,,□,電気機械器具製造業（営業担当）,・先の仕事の予定が安定的に決まっている。,
,,□,電気機械器具製造業（宣伝担当）,・ＡＶ関連商品の堅調な荷動きは今後も続くほか、そのほかの商品の荷動きも現状と大幅に変わることはない。,
,,□,建設業（経営者）,・官庁関係の工事の減少により、競争が一層激しくなる。民間企業からの工事は増えつつあるものの、価格競争が厳しいほか、今後は建設資材の高騰や技能労務者不足でコストが上昇する。また、建築確認申請に要する期間が延びたことで、今は工事が止まっているものの、再び動き始めた場合の技能労務者不足も懸念される。,
,,□,金融業（支店長）,・残暑で秋物衣料の売行きが悪いなか、今後の気候次第では冬物衣料の販売価格にも影響が出る。,
,,□,金融業（営業担当）,・自動車部品製造業では原材料高騰分の販売価格への転嫁が進む一方、ホームページ作成などの宣伝広告業者では今後も減収減益が続く。,
,,□,不動産業（営業担当）,・サブプライムローン問題により、不動産ファンドの購入が目立っていた市場が少し冷めてきている。今までは東京の土地を始めて価格の上昇が続いていたが、外資系ファンドによる購入が少なくなれば、価格は横ばいか将来的には下がってくる。,
,,□,広告代理店（営業担当）,・今後も、広告を増やす企業とそうでない企業の比率は変わらない。,
,,□,司法書士,・今月は客からの相談が若干寄せられている。相談だけで終わることもあるものの、仕事につながる可能性もあり、現状よりも悪くはならない。,
,,□,その他非製造業［民間放送］（従業員）,・引き続き、スポット広告需要は大きく伸びない。,
,,▲,食料品製造業（従業員）,・原材料、資材の仕入先のほか、商品の販売先も寡占化が進んでいる。仕入先からは値上げが多いものの、我々のような中小メーカーが販売先に値上げ要請をできる状況ではない。販売先は意地でも値上げを受け入れない姿勢であり、この状況では先行きが良くなることはない。,
,,▲,食料品製造業（経理担当）,・原材料が高止まりしており、利益が出ない。,
,,▲,一般機械器具製造業（経営者）,・当社の事情で受注量が減少しているものの、取引先の旺盛な投資意欲はまだまだ続く。,
,,▲,電気機械器具製造業（企画担当）,・住宅着工件数の減少が続くなど、年内は厳しい状況となる。,
,,▲,新聞販売店［広告］（店主）,・インターネットや携帯電話の情報媒体に客を奪われており、新聞の無読率が上昇している。,
,,▲,経営コンサルタント,・輸入材料の価格高騰により、食品メーカーによる値上げが起こっている。大型小売店では早々と価格据置きを宣言するところもある一方、中小小売店ではコスト上昇を流通システムで吸収することができず、価格転嫁せざるを得なくなっている。,
,,▲,その他非製造業［機械器具卸］（経営者）,・ここ２、３か月は問い合わせ件数も減っており、このままでは売上の減少につながる。,
,,×,繊維工業（総務担当）,・供給過多による在庫調整か、販売不振によるものかは判断が難しいものの、取引先からの受注量が減少している。,
,,×,化学工業（企画担当）,・原料価格が低下する気配がない。,
,,×,一般機械器具製造業（経営者）,・先の受注が減少している。,
,,×,その他製造業［履物］（団体役員）,・原油価格の高騰のほか、安価な輸入製品との競争により厳しい状況が続いている。,
"雇用
関連

(近畿)",,◎,－,－,
,,○,職業安定所（職員）,・有効求人倍率は５か月連続で上昇し、事業主都合離職者も前年比で再び減少していることから、当面の雇用失業情勢については改善傾向が続く。一方、正社員の有効求人倍率は２か月連続で前年を下回り、全体の有効求人倍率とかい離がみられるなど、懸念すべき状況となっている。,
,,○,民間職業紹介機関（職員）,・堺市への誘致が決まった、大手電機メーカーの新工場の建設工事が話題に上っている。,
,,○,学校［大学］（就職担当）,・学生の内定率は前年よりも上昇している。採用予定数が未充足の企業は長期戦になっても確保を目指しており、採用活動を継続している。,
,,□,人材派遣会社（経営者）,・企業からの派遣需要は、今後も引き続き微増で推移する。,
,,□,人材派遣会社（支店長）,・求職者の新規確保は苦戦が続くことから、受注残が減ることはない。,
,,□,新聞社［求人広告］（担当者）,・企業による合同説明会の来場者については、人数、質共に、出展企業からの評価は良好であった。新卒来場数数も前年を上回るなど、冬に向けて準備中のイベントに対する好材料となる。,
,,□,新聞社［求人広告］（担当者）,・求人の原稿サイズが全体に小さくなってきており、大きな注文もないことから、２、３か月先も見通しは暗い。,
,,□,職業安定所（職員）,・人手不足の状況が続いているものの、運輸業の一部の事業所では求人募集の賃金が低下している。管内の求人の賃金状況を説明して賃金のアップを打診しても、慎重な事業所が多い。,
,,□,職業安定所（職員）,・９月に入って求人の動きに改善の傾向がみられる。,
,,□,職業安定所（職員）,・新規求人数、新規求職者数共に減少傾向であるものの、大きな動きにはつながらない。,
,,▲,求人情報誌製作会社（営業担当）,・企業収益は堅調に推移しているが、従業員への利益還元よりも内部留保を増やす傾向がみられる。また、企業間格差、業種間格差が拡大傾向にある。,
,,▲,新聞社［求人広告］（担当者）,・下期の新聞広告の受注状況も悪く、前年実績を上回ることは難しい。,
,,×,新聞社［求人広告］（営業担当）,・企業のインターネット広告へのシフトが進んでおり、ますます若年層の求人広告を集めるのが難しくなってきた。出来高量も極端に落ちてきている。,
,,,,,
　８．中国（地域別調査機関：（社）中国地方総合研究センター）,,,,,
,,,,（－：回答が存在しない、＊：主だった回答等が存在しない）,
分野,,景気の先行き判断,業種・職種,景気の先行きに対する判断理由,
"家計
動向
関連

(中国)",,◎,衣料品専門店（地域ブロック長）,・残暑で動いていない客が、これから涼しくなって動き始める。,
,,◎,テーマパーク（広報担当）,・地元で大型のコンベンションがあり、大幅な来県者数の増加が期待できる。,
,,○,商店街（代表者）,・12月には、商店街の核となる建設中の食品スーパーがオープンする。,
,,○,百貨店（営業担当）,・景気の悪くなっている原因は、気温によるところが大きいので、気温が下がってくれば消費も活発になる。,
,,○,百貨店（販売促進担当）,・気候が良くなり、近隣の競合店の影響が落ち着けば良くなる。,
,,○,百貨店（販売担当）,・今月末にリモデルを終了する食品コーナーに客の来店が期待できる。また、気温の低下に伴い、今まで買い控えられていた商品の売上が上がってくる。,
,,○,家電量販店（店員）,・新商品も出そろい、地上デジタル放送のエリアも広がるので、その効果がある。,
,,○,家電量販店（予算担当）,・前年は暖冬であり、暖房器具関連が不振となったため元々のハードルが低い。同時にＰＣもここ数か月動きが活発になるなど、明るい材料はそろってきた。あとは何かきっかけがあれば、大きく売上が伸びる。,
,,○,観光型ホテル（スタッフ）,・紅葉シーズンへ入るので、単価、販売量共に増えていく。しかし、温暖化の影響は不明だが、紅葉のシーズンがずれてきているように思われるのがやや不安である。,・紅葉シーズンへ入るので、単価、販売量共に増えていく。しかし、温暖化の影響は不明だが、紅葉のシーズンがずれてきているように思うのがやや不安である。
,,○,タクシー運転手,・８～９月は暑さのせいか動きがあまりなかったが、10～11月と観光の予約がかなり入ってきている。ただし、夜の客については依然財布のひもは固く、乗車距離も時間も短く、またマイカー等の利用などでタクシーの利用が激減しているので、こちらは期待できない。,
,,○,通信会社（販売企画担当）,・冬の商戦期に向けて主力商品の新発売が予定されており、市場が活性化される。,
,,□,商店街（代表者）,・９月は残暑で秋物が悪かったが、涼しくなれば今より良くなり平年並みにはなる。,
,,□,一般小売店［酒店］（経営者）,・秋のイベント、観光客などに期待するが、良くて変わらない程度である。,
,,□,百貨店（営業担当）,・夏から秋を飛び越えて、いきなり冬に突入する気配がある。例年どおりの冬であれば良いが、また異常気象になれば通常の販売戦略の展開は困難となる。,
,,□,百貨店（売場担当）,・暖冬になる予想と厳冬になる予想と２通りあり、それ次第である。身の回り品は気温に応じて売場変更できるが、アパレルは難しく今の時点で先行きの見通しは立たない。,
,,□,百貨店（売場担当）,・これから先景気が良くなる要因がないのと、館のイベントが９月で終了するので、10月以降厳しくなりそうである。,
,,□,百貨店（購買担当）,・例年だとこの時期秋物の動きが良くなり、ヒットアイテムというものが必ず出てくるものだが、今年に限っては天候に左右されたせいか、いまだにカットソー・Ｔシャツの動きが良く、秋物商材が全く動かない状態が続いていた。しかし、最近やっと少し涼しくなったので、これらの商品が良くなる。後は客の財布のひもが緩むのを待つばかりである。,
,,□,スーパー（店長）,・現状の価格競争は今後も続き、売上・利益の確保が大変難しい状況が続く。,
,,□,スーパー（店長）,・来客数・販売量共に、前年比101～102％という数字がここ１年近く続いている。３か月先も同じ状態で推移する。,
,,□,スーパー（店長）,・客の話を聞くと、石油関連商品の価格の高止まり、また年金生活者の不安等により、当面現状のままで推移しそうである。ただし食品等の値上がりが予想されるため、その時の影響がどのように出てくるか心配である。,
,,□,スーパー（経理担当）,・消費等、このまま横ばい状態が続く。公共事業の削減で、土木関連の事業は厳しく、消費の動向も含めて当面は変わらない。,
,,□,スーパー（管理担当）,・年末に向かって集客・販売単価増を見込みたいところだが、市内店舗を中心に販売単価の低下が続いている。買上客数の持ち直しはあるものの、客単価は前年をやや下回っており、状況が好転するとは考えられない。,
,,□,スーパー（販売担当）,・涼しくなってくるので、食料品の購入額は伸びると思うが、物価上昇に伴い、客も慎重に選んで購入するので全体では変わらない。,
,,□,コンビニ（エリア担当）,・定番商品が若干下げ気味であるが、新規商品や改装による売出し等のため、全体としては変わらない。ただ、年末にかけての商談があまりうまく進んでいないのが気がかりである。,
,,□,コンビニ（エリア担当）,・競合状況や客の様子を見ても、この先景気が良くなることはない。,
,,□,コンビニ（エリア担当）,・８月、９月と気温が高めで、アイスクリーム・飲料等が良く売れたが、全般的に他の商品の動きは芳しくないので、今後もこの状態が続いて景気回復とまではいかない。,
,,□,家電量販店（店長）,・10月にイベントがあり、売上が伸びる。冬商戦の前哨戦として頑張りたい。,
,,□,乗用車販売店（経営者）,・原油の価格が落ち着かないため、先行き良くなる要素が見当たらない。,
,,□,乗用車販売店（サービス担当）,・新車需要が増えて、客の動きが活発になる気配が感じられない。,
,,□,乗用車販売店（営業担当）,・周りに影響されての衝動買いが少なくなり、自分のライフステージに合った車を見つけようとする傾向がこれからいよいよ強くなる。今まで以上に客の動向をつかむ活動を強化していかねばならない。,
,,□,乗用車販売店（販売担当）,・新商品の導入で多少店頭は活気付いてきているが、継続的なものではない。,
,,□,自動車備品販売店（経営者）,・前年の記録的暖冬の翌年だけに今年の冬商戦は期待しているが、来客数及び販売金額の動きから見れば、現状の動きが続く。,
,,□,自動車備品販売店（店長）,・客単価の動きが良くなっているが、元々需要期ということもあるので、来月以降はあまり変わらない。,
,,□,高級レストラン（スタッフ）,・予約状況は前年より少し落ちているが、目立って落ち込んでいるというほどではなく、当面変わらない。,
,,□,一般レストラン（店長）,・今のところ予約の数も変化なく、来客数増加につながるイベントや催物がない限り、客足も伸びてこない。,
,,□,一般レストラン（店長）,・客単価は下がってきているのに、全仕入業者からは値上げを言われている。依然厳しい状況が続く。,
,,□,その他飲食［ハンバーガー］（経営者）,・売上の上昇傾向は続いており、今後も様々なプロモーションを用意しており、しばらくは下落要因は見つからない。,
,,□,都市型ホテル（従業員）,・オンシーズンに入る10月からの予約の伸びがやや鈍くなっており、前年に比べて厳しい状況に変わりはない。,
,,□,都市型ホテル（スタッフ）,・現在の予約状況から見て、客単価が下がっていく傾向は今後もしばらく続く。,
,,□,都市型ホテル（総務担当）,・秋口以降の受注状況は増加傾向にあるものの、依然として不透明な状況には変わりない。政局は不安定であり、地方においても地価もいまだ上昇しないし、また、これと言った景気回復となる要因も感じられないため、これからも伸び続けるとは考えられない。,
,,□,通信会社（総務担当）,・今年に入っての新規契約者数の推移から予測すると、大きな伸びは期待できず、横ばいの状況が続く。,
,,□,テーマパーク（業務担当）,・秋から冬の行楽シーズンを迎え、例年好調な季節に入る。前年同時期より徐々に回復傾向がみられており、今年も引き続きその傾向がある。,
,,□,美容室（経営者）,・毎月計画を立てて数字を出して主力商品の目標を決めたり、ＤＭ・チラシを出したりしているが、なかなか思うような結果が出てこず、これから先が見えてこない。,
,,□,住宅販売会社（従業員）,・来客数は減少し、また客の購買意欲も減退しているように思うので、この状態が続いていく。,
,,□,住宅販売会社（販売担当）,・土地、建売住宅の販売は９月に入って動き出したが、まだ前年比プラスになっていない。,
,,▲,商店街（代表者）,・最近、商店街に出店している地元の文具卸会社が閉店し、商店街の会員数も今後、増える見込みがない。また商店街そのものに暗いイメージが付きまとっている。,
,,▲,一般小売店［紙類］（経営者）,・環境の変化で来客数が減少しているうえ、石油価格等の問題で仕入単価が上昇し、売価設定が難しくなる。またこれからの客の動きが把握できない。,
,,▲,一般小売店［印章］（営業担当）,・会社設立等の前向きな注文があまりみられない。,
,,▲,百貨店（営業担当）,・石油価格の高騰による原材料の値上げが製品にも反映されるようになり、生活に必要な食料品への支出も増えてくるので、衣料品にとってますます厳しい状態が続く。,
,,▲,百貨店（販売促進担当）,・先般郊外のショッピングセンターが１次オープンし、10月上旬には店舗面積倍増、売上50％増の計画でグランドオープン予定である。１次オープン以降についても集客面で影響が出てきているため、グランドオープンによる中心市街地への集客等を含めた影響が、大きな懸念材料となっている。,
,,▲,スーパー（店長）,・競合店が２店舗出店する。全体的に少なからず影響を受ける。,
,,▲,スーパー（店長）,・原油価格高騰や農産物の価格値上がり傾向の中で、消費の拡大は期待できない。,
,,▲,スーパー（店長）,・当店の扱い品目では、衣装ケースなど、ポリプロピレン・プラスチックを原材料としている商品は、石油の高騰の影響で10月から一斉に値上げされる。こういった状況は客の購買意欲の低下を招くことになり、先行きに不安を抱えている。,
,,▲,スーパー（総務担当）,・地方は雇用状態が悪く、30歳過ぎの男性でもパートやアルバイトの人が多く、購買力が弱い。また、来店客も近ごろ高齢者の割合が多くなり、購買量自体が少なく競合でというより高齢化による客単価の下落が大きいなど、地域的な問題が大きくこれから良くなる方向が見いだせない。,
,,▲,スーパー（財務担当）,・今後原価の引上げが予想されるが、販売価格はなかなか上げられない状況となる。,
,,▲,コンビニ（エリア担当）,・競合店の出店が加速し、異業種の影響もじわじわと出てくる。客が店を選んで買う傾向も強くなるため、単価が低下してくるのではと懸念される。,
,,▲,衣料品専門店（地域ブロック長）,・秋物衣料の販売期間が短くなり、夏物同様に例年より早く値下げが必要となり、売上に響いてくる。,
,,▲,衣料品専門店（販売促進担当）,・商圏内に大型店舗がどんどん進出しているため、客の買い回りが多くなる。また必要な時に必要な物しか購入しないので、依然、厳しい状況が続く。,
,,▲,家電量販店（店長）,・商圏内に家電量販店が６店舗あり、なおかつ10月に新たに１店舗オープンする予定である。オーバーストア状態が更に強くなり価格競争に拍車が掛かる。,
,,▲,家電量販店（店長）,・前年は当社の改装等のイベントがあり、地上デジタルの需要もあったが、今年はそれもないので景気はやや悪くなる。,
,,▲,観光型ホテル（経理総務担当）,・10～11月にかけて、宴会部門の入込が極端に悪い。件数、売上額とも、前年を大きく下回っており、新規予約も低調である。あわせて、婚礼の予約も前年比で約50％の状況である。,
,,▲,都市型ホテル（経営者）,・前年同時期との比較では、低い水準で予約が推移しており、この状態が続く。,
,,▲,通信会社（通信事業担当）,・パソコンなどの販売時に、大手回線業者の契約を前提に割引をするという手法が取られているが、近所に大型家電量販店が開店するので、販促合戦が非常に激化し、そのあおりを受ける。,
,,▲,美容室（経営者）,・毎年９月の売上を見て、11月、12月の予想がつくのだが、今年は９月の売上が悪いので今後が気掛かりである。,
,,▲,設計事務所（経営者）,・建築基準法の大改正による混乱はしばらく続きそうなので、これからも業務の停滞がある。,
,,▲,設計事務所（経営者）,・建築確認は年内受理されない状況が予測されるので、着工件数は確実に減少する。,
,,▲,設計事務所（経営者）,・今年度後半に向けても県、市とも財政悪化のため緊縮財政となり、建設投資の計画は、全く見えてこない。,
,,×,商店街（代表者）,・デフレ・少子化・オーバーストアという三重苦にあえぐ上に、温暖化の影響からか天候が不順で薄物需要が多く、単価も低下している。この先も暗い状態が続く。,
,,×,商店街（代表者）,・消費者の動向や街の活力からして、良い方向に向きようがない。,
,,×,百貨店（売場担当）,・前年10月中旬までブーツが絶好調の売上であった影響もあるが、このままで行くと前年比60％の推移となる。ブーティーなどもトレンドサイクルが短く、売上を大きく引っぱるアイテムにならない。,
,,×,衣料品専門店（経営者）,・ここ10年商店街の競売にかかる店舗のペースが落ちたことがなく、この状況が続く。,
,,×,その他専門店［書籍］（従業員）,・現在の競合店との厳しい競争は続く。,
,,×,スナック（経営者）,・先日、飲酒運転罰則の強化があり、客の動きが大変少なくなった。岡山では、郊外の居酒屋の店主が経営に行き詰まり自殺などもあり、この状況は変え様がない。,
"企業
動向
関連

(中国)",,◎,輸送用機械器具製造業（経営者）,・クライアントからの受注が３か月後もまだまだ多く、人材さえ確保できれば売上も右肩上がりになる。,
,,○,一般機械器具製造業（総務担当）,・受注量や販売量の動きが良い。,
,,○,電気機械器具製造業（広報担当）,・受注が確保できる見通しにある。,
,,○,輸送用機械器具製造業（経理担当）,・今期の目玉新製品群の第２弾が、３か月後にはフル生産に近い状況となる。,
,,○,輸送業（統括）,・新規業務が10月から３件と、来年１月から１件の業務開始が決まった。来期の予定も、提案を検討中の顧客ができたことから良くなる。,
,,○,通信業（部門長）,・景気低迷の底打ち感がある。主要自動車関連会社の設備投資が一段落し、次のランクである売上高100億円以下の企業に、ＩＴ設備投資への動きが出てきている。,
,,○,金融業（業界情報担当）,・米国向けの需要はやや伸び悩んできたが、欧州・アジア圏では引き続き需要好調で、当面は高水準の受注が続く見込みである。,
,,□,化学工業（総務担当）,・物流費や原燃料費高騰の影響はあるものの、当面現状を維持する。,
,,□,窯業・土石製品製造業（総務経理担当）,・次月以降も、今月の生産水準は同程度で推移する。各所から注文が続々入り、高い水準が維持できる。しかし、原材料が高騰しており、製品価格への転嫁がなかなか進まず、収益的には悪化する。,
