Ⅱ．景気の先行きに対する判断理由,,,,
,,□,都市型ホテル（総務担当）,・宿泊部門と宴会部門の集客は続いているが、今夏も厳しい暑さが予想されていることもあり、レストランの集客は苦戦が強いられる。
,,□,都市型ホテル（フロント）,・当地域への旅行客が減少しているのか、間際予約が増えているのか、夏休みの動きが非常に鈍い。周辺ホテルの販売価格も大きく下がっている。
,,□,都市型ホテル（客室担当）,・各方面の値上げの影響から、宿泊費などへの出費が抑えられる傾向が続く。今後は徐々に上向いているようにみえる中国の動きに期待している。
,,□,都市型ホテル（販売促進担当）,・現在は円安の状況から、インバウンドの宿泊需要が多い。地域的にはベトナムやタイといったアジアに加え、最近は米国からの団体客も多いなか、今後の予約状況も同様の動きが予想される。一方、国内客の動きは変わらないか、あるいは若干の減少となっている。
,,□,都市型ホテル（客室担当）,・８月の予約が非常に落ち込んでいるほか、７月の稼働率の見込みは80％超となっている。
,,□,旅行代理店（店長）,・円安や物価上昇の動きが急激に正常化するとは考えられず、しばらくは今の状況が続く。
,,□,旅行代理店（役員）,・今後２か月は夏休みに伴う需要により、国内旅行は現状の動きがしばらく続く。海外旅行は、円安の影響が少ないアジア方面の予約や問合せが徐々に増えているが、単価が上がらない。当面は、海外旅行の停滞を国内旅行でカバーしていく状態が続きそうである。
,,□,旅行代理店（支店長）,・パリオリンピックなどの大型イベントで巣籠り需要が高まるなか、夏休みの旅行については、間際予約にも期待できない。
,,□,通信会社（役員）,・人口の減少やオンライン販売の増加に加え、携帯電話の買換えサイクルの長期化や端末価格の高騰により、キャリアショップ全体の端末販売数は右肩下がりとなる。
,,□,通信会社（営業担当）,・このまま景気が良くなるとは考えられない。
,,□,観光名所（企画担当）,・インバウンド客の比率が若干上がりつつあるが、全体としては前年度並みであるため、２～３か月先も大きな変化はない。
,,□,遊園地（経営者）,・賃上げや定額減税の効果が出ることを期待している。
,,□,競艇場（職員）,・全国発売のＳＧ、Ｇ1競走の売上は、コロナ禍の収束後はほぼ横ばいで推移している。特にインターネット投票が安定しており、高水準を維持しているため、しばらくは大きな変化はない。
,,□,その他レジャー施設［イベントホール］（職員）,・イベントは順調に開催される予定であるが、以前よりも経費の削減意識が高くなっている。
,,□,その他レジャー施設［複合商業施設］（職員）,・賃上げによる一定の効果には期待できるが、急激な円安に歯止めがかからなければ、輸入コストの上昇による生活の圧迫が続く。一方、秋の米国大統領選挙の結果次第で、日本経済にも大きな影響が出てくる。
,,□,その他レジャー施設［球場］（経理担当）,・プロ野球の交流戦は終わったが、人気球団の主催試合が８試合予定されているほか、人気アイドルグループのコンサートが複数開催されるため、多くの来場を予想している。
,,□,その他レジャー施設［飲食・物販系滞在型施設］（企画担当）,・インバウンドは今後も堅調に推移する一方、観光バスの不足や夏の猛暑で国内の団体客の動きは鈍化するため、全体的には変わらないと予想される。
,,□,美容室（店員）,・トリートメントなどの付加価値の高いオーダーは、見合わせる客も出てきている。
,,□,住宅販売会社（経営者）,・地価は高止まりしており、低下の動きがみられない。
,,□,その他住宅投資の動向を把握できる者［不動産仲介］（経営者）,・特別な金融政策もないため、大きな変化はない。ただし、今後も円安が進めば、景気は悪くなると予想される。
,,□,その他住宅［展示場］（従業員）,・資材価格や建築単価の高騰による消費者マインドの低下傾向は、当面続くと予想される。
,,□,その他住宅［住宅設備］（営業担当）,・定額減税は一時的な所得の増加であり、浮かれている場合ではない。物価の上昇は相変わらずであり、家計の財布のひもが緩むわけではない。ただし、今春の賃金のベースアップがまずまずの額であったため、来月の夏季ボーナスの増加に期待したい。
,,□,その他住宅［情報誌］（編集者）,・円安の影響も含めて、新築物件価格の上昇は続くと予想されるため、現在の景況感が続く。
,,▲,一般小売店［花］（経営者）,・光熱費やガソリン代などの経費の増加で利益が減少するほか、今年の猛暑により、仕入価格にも影響が出そうである。
,,▲,一般小売店［衣服］（経営者）,・今後も物価の上昇が続くなか、生活必需品ではない衣料品の購入は後回しになると予想される。足元も販売量が伸び悩み、１人当たりの購入金額も減少するなか、数か月先に景気が少しでも良くなるとは考えられない。
,,▲,百貨店（売場主任）,・今後も商品価格の上昇が当面続くと予想される。郊外店である当店は、高齢者の年金世帯が主要な客であり、収入が変わらないなかでの物価上昇となる。客の節約志向が続くことから、当面は苦戦が予想される。
,,▲,百貨店（マネージャー）,・今秋には、近隣の商業施設で増床オープンが計画されているため、厳しい状況が予想される。
,,▲,百貨店（特選品担当）,・夏休みの海外旅行は円安で低調となるなか、国内旅行もオーバーツーリズムによる値上がりや混雑で、低調な動きとなりそうである。それに伴い、衣料品を中心とした外出関連需要が減少するほか、猛暑関連やパリオリンピック関連の需要も食品が中心であり、規模も小さなものとなりそうである。前年の８月から10月は在阪球団の応援フィーバーがみられたが、今期は不調であるため、盛り上がりに欠けそうである。
,,▲,スーパー（販売促進担当）,・円安傾向による、海外との調達競争での競り負けや、国産原材料の争奪戦の激化により、仕入価格の上昇が止まらず、燃料や資材にまで広がっている。値上がり構造が改善する材料が見当たらないため、今後も厳しい傾向が続くと予想される。
,,▲,スーパー（開発担当）,・円安によって物価が上昇する一方、賃金は増えない。これでは景気は良くならない。
,,▲,スーパー（社員）,・競合店が増えるなか、イベントやチラシを増やして来客数の確保を進めているが、他社との客の奪い合いが多く、なかなか来客数は増えない。当面は現状の動きが続きそうである。
,,▲,衣料品専門店（店員）,・需要の閑散期に入るため、今後は悪くなると予想される。
,,▲,家電量販店（店員）,・この先も物価の上昇に歯止めがかからない。消費者による節約傾向も強く、景気の回復は厳しいと感じる。
,,▲,家電量販店（人事担当）,・今年も酷暑となる見込みであり、屋外での活動よりも屋内での活動が多くなる。それに伴い、実店舗への来客数の減少が見込まれる。
,,▲,乗用車販売店（経営者）,・客の購買意欲は低いままであり、自動車に対するイメージも悪いなど、先行きの見通しは暗い。
,,▲,乗用車販売店（販売担当）,・予約注文数が前年比でかなり減少している。結果的に同じ販売量となっても、予約注文数の差は、販売の減少につながりやすい。
,,▲,一般レストラン（経営者）,・今年の夏は猛暑の予想であり、特に高齢者は気象予報をよくみているため、外食の機会が減少する。
,,▲,一般レストラン（店員）,・当店の前に、同じような業態の店がオープンしたため、客が減少している。
,,▲,観光型ホテル（経営者）,・７月以降は間際の予約が多いため、まだ見通しは不透明であるが、先行予約の状況は今一つである。当地区のほかのホテルからも、余り良い話は聞こえてこない。
,,▲,観光型旅館（経営者）,・景気が悪くなっており、旅行需要も減っている。
,,▲,旅行代理店（従業員）,・これ以上の円安の進行は、海外旅行の需要の更なる減少につながる。
,,▲,通信会社（経営者）,・今後も円安による悪影響が懸念される。
,,▲,通信会社（社員）,・競合他社がより安価なサービスを販売しているため、客の減少傾向は続くと予想される。
,,▲,ゴルフ場（支配人）,・予約状況から判断すると、状況は今一つ良くない。対策を講じても、目標に届くかどうかは不透明である。今までの勢いは薄れているため、今後はやや悪くなると予想される。
,,▲,その他サービス［学習塾］（スタッフ）,・退会者の数が入会者を上回りつつある。入会した幼児の退会が予想以上に増えるなか、今後は中学生による塾へのシフトも予想される。
,,▲,住宅販売会社（総務担当）,・賃金の上昇よりも、食品や電気、ガソリンなどの価格の上昇が目立っており、買い控えの傾向が高まる。
,,×,一般小売店［貴金属製品］（従業員）,・電気代やガソリン代の高騰による影響が懸念される。
,,×,一般小売店［花］（店員）,・来客数が減っているほか、物価の上昇による買い控えも想定されるため、売上は今後も減少すると予想される。
,,×,衣料品専門店（経営者）,・物価の上昇で消費が減っており、客は最低限必要の物しか購入しない。
,,×,衣料品専門店（経営者）,・消費者は衣料品の購入に不安になっているため、販売が増えない。税金や社会保険料の負担が増え、物価も上がっているため、衣料品を購入している場合ではない。
,,×,家電量販店（店員）,・リフォーム商材を扱っているが、関連の補助金はそれなりに余裕のある客向けである。検討客は増えているが、補助金額を伝えると、期待していた金額ではないといった理由で保留になるケースも増えている。
,,×,その他飲食［ジャズバー］（店員）,・物価の上昇で需要が伸びない。
,,×,競輪場（職員）,・インバウンドの増加で経済が活性化している一方、物価の上昇は続いており、実質的な収入に変化はないか、減少している人が大半であるため、今後良くなるとは考えられない。
,,×,住宅販売会社（経営者）,・コストアップが続くなかで、短期金利が上がる雰囲気もあるなど、徐々に良くなる要素がなくなっている。
"企業
動向
関連

(近畿)",,◎,－,－
,,○,木材木製品製造業（経営者）,・ここへきて円安ドル高傾向が更に強まり、１ドル160円も目前である。輸入販売業にとっては為替の影響が１番大きく、今後いつ販売価格を上げるかが焦点となる。販売数量は安定しているが、円安で利益が抑えられる分、更に販売量を増やす必要がある。
,,○,化学工業（経営者）,・受注額が前年並みには戻っていないが、ようやく２年前のレベルに戻ってきたため、多少は良くなる。
,,○,プラスチック製品製造業（経営者）,・小口の案件が増えている。すぐに大きな利益にはつながらないが、将来への種まきができている。
,,○,金属製品製造業（営業担当）,・新規案件の引き合いが、少しずつ増えている。
,,○,建設業（経営者）,・東京都知事選挙などの外部要因もあるが、少し良くなっていくと予想している。
,,○,輸送業（経営者）,・運賃の値上げが認められることになり、新規採用での給与を増やすことができる。これで採用の応募者が増えるため、これまで受けられなかった仕事も受注できるようになる。
,,○,輸送業（商品管理担当）,・これから暖かくなるにつれて、酒類の販売が多くなる。
,,○,広告代理店（営業担当）,・前月はＷｅｂ媒体、紙媒体共に、広告売上が前年を下回ったが、今年になって前年を上回る状態が続いているため、先行きには期待している。
,,○,経営コンサルタント,・商店街ではまだまだ観光客は増えると予想され、自治体とともにオーバーツーリズム対策を検討し、試行している状態である。
,,○,その他非製造業［衣服卸］（経営者）,・定額減税の効果がこれから出てくると期待している。４人家族であれば16万円の臨時収入となるため、ある程度は外食などに回ってくる。
,,□,パルプ・紙・紙加工品製造業（経営者）,・増産に関する情報が全くない。
,,□,化学工業（管理担当）,・取引先の分野次第で出荷量の予測にばらつきがあり、先が読めない。
,,□,化学工業（企画担当）,・食品原材料では販売価格への転嫁が進み、適正な利益が確保できている。酷暑による食品の需要減少が予想されるものの、インバウンド需要の増加によって相殺される。
,,□,窯業・土石製品製造業（管理担当）,・米国との金利差が縮まらない限り、円安基調は変わらない。大企業だけでなく、中小企業にも賃上げムードが波及しているものの、物価の上昇で実質賃金は減少しており、まだ十分とはいえない。定額減税の効果も一時的であるため、景気の実感は変わらない。
,,□,一般機械器具製造業（経営者）,・ここ数か月の受注見通しは、従来と変わらない。
,,□,電気機械器具製造業（経営者）,・世界市場に対する日本の貢献度が高くないため、先行きは読みにくい。
,,□,電気機械器具製造業（宣伝担当）,・更なる円安の進行など、先行きが不透明な状況に変化はない。
,,□,電気機械器具製造業（営業担当）,・今後も材料価格の高騰が続く。
,,□,電気機械器具製造業（営業担当）,・受注量は増えず、引き合い件数も少ないなど、改善する兆しがない。
,,□,輸送用機械器具製造業（経営者）,・３か月程度では変化はないが、足元の円安による販売価格の変化がどう影響するかは不透明である。
,,□,建設業（経営者）,・官庁関係の工事では、週休２日が工期に反映されつつある。民間関係の工事でも理解されつつあるが、まだまだ実情は厳しい。国が最初で、次に県、市、民間工事という順で対応が進むため、早く世間一般での理解を求めたい。
,,□,輸送業（営業担当）,・家具が売れにくい時期に入るが、イベントの予定もないため期待できない。
,,□,輸送業（営業担当）,・ドライバーの労働時間や賃金が減るなど、労働条件には悪化がみられるが、我慢できる範囲である。
,,□,通信業（管理担当）,・減税効果が余り出ないなど、景気の上向く要素が見当たらない。
,,□,金融業（営業担当）,・今後も円安トレンドに変化はないため、２～３か月先の景気にも好転する気配はない。
,,□,金融業（営業担当）,・まだまだ円安に歯止めがかからないため、景気の改善には時間を要する。
,,□,広告代理店（営業担当）,・秋口までは回復の兆しはみられない。
,,□,司法書士,・相続登記の増加以外は余り変化がなく、現状維持となっている。
,,□,その他サービス［自動車修理］（経営者）,・物価が上昇している割に、売上の全体的な押し上げがないため、状況は厳しい。
,,□,その他非製造業［機械器具卸］（経営者）,・値上げの了承を得てからの販売となるため、それから会社の売上を増やす努力を進めて、実績を上げていきたい。
,,▲,食料品製造業（従業員）,・輸入原材料が多いせいもあり、円安による原材料価格の上昇が止まらない。国産の原材料も、産地での不作や利益率の高い海外取引に回っている影響で、手に入りにくくなっている。
,,▲,繊維工業（総務担当）,・夏場に向けて販売が減少する傾向となる。物価や光熱費の上昇が、購入意欲の足かせとなる。
,,▲,繊維工業（総務担当）,・円安による利益率の低下に歯止めがかかっていないほか、更なる円安が追い打ちを掛ける状況が続いている。
,,▲,金属製品製造業（経営者）,・鉄鋼各社による材料価格の値上げに伴い、土木、建材部品やその他の材料で輸入品の利用が増え、市場に悪影響が出ている。
,,▲,その他製造業［履物］（団体職員）,・円安に伴うインフレが続く状況では、個人消費が伸びるわけがない。
,,▲,建設業（経営者）,・公共工事には小規模な物件が多いほか、予算も物価の上昇や人件費の増加に追い付いていないため、魅力に欠ける。このままでは入札への参加を見合わせざるを得ない。
,,▲,不動産業（営業担当）,・１階の店舗からアパレル関係の撤退が続いている。こうした動きは今後も続くと予想され、景気は悪くなる。
,,×,金融業［投資運用業］（代表）,・ガソリン価格や物価の上昇、円安の継続に加え、インバウンド効果も期待したほどではない。電気やガス、水道料金は高いほか、ありえないほどのステルス増税も進んでいる。年金給付年齢の先延ばし案をみても、残念ながら先行きに明るい兆しはみられない。
,,×,その他非製造業［電気業］（営業担当）,・効果的な経済対策が見当たらず、今後の成長が見込めない。
"雇用
関連

(近畿)",,◎,－,－
,,○,人材派遣会社（管理担当）,・現状の動きがしばらく続くと予想される。
,,○,人材派遣会社（支店長）,・下半期に向けて、需要が高まると予想される。
,,○,職業安定所（職員）,・受注の増加などで、製造業では今期の後半から来期に向けて利益の増加を見込む事業所があるため、夏頃からの求人提出の動きがみられる。
,,○,民間職業紹介機関（営業担当）,・大阪・関西万博関連の求人が出てくると予想される。
,,○,民間職業紹介機関（営業担当）,・雇用情勢やインバウンドの動きから、先行きはやや良くなると感じる。
,,□,人材派遣会社（管理担当）,・夏休み期間となるため、動きは一旦止まると予想される。
,,□,人材派遣会社（営業担当）,・60代、70代の求職者による応募は増加傾向にある。その一方、働き方の多様化の動きに、企業が追い付いていない。
,,□,人材派遣会社（営業担当）,・関西全体の時給の底上げには、企業業績の改善が求められる。社員全体の賃上げを行わない限り、新規求人の時給が改定されることはない。
,,□,新聞社［求人広告］（営業担当）,・賃上げや定額減税などが、現状の物価上昇に対して効果的であるとは考えにくいが、円安やインバウンド関連で潤っている企業も多いため、全体として大きな変化はない。
,,□,新聞社［求人広告］（担当者）,・関西の地元企業のプロモーション予算に大きなものはなく、今後２～３か月も同様の動きと予想している。
,,□,職業安定所（職員）,・５月の新規求職者数は前年比で減少となった。45歳未満は増加したが、45歳から54歳までが減少し、55歳以上も減少となった。雇用保険受給者も１割強の減少となっている。
,,□,職業安定所（職員）,・景気が好転する材料に乏しい。
,,□,職業安定所（職員）,・業績の良い企業はあるものの、横ばいの企業も多く、肌感覚として１～２か月で良くなるとは考えられない。
,,□,民間職業紹介機関（営業担当）,・今後も求人の掲載や求人紹介の依頼は、途切れることなく続くことが予想される。
,,□,学校［大学］（就職担当）,・学生は積極的に就職活動を進めており、企業の採用意欲も高いが、新卒採用に苦慮している企業が多い。
,,□,学校［大学］（就職担当）,・慢性的な人手不足は変わらないが、離職率の上昇が気掛かりである。うまく転職できればよいが、収入の増加につながらないケースもある。
,,□,その他雇用の動向を把握できる者,・円安の状況が変わらないなか、円安の進行をマイナスと捉える企業が増えている。
,,▲,人材派遣会社（役員）,・人手不足が解消できないほか、物価の上昇に加えて、日本銀行による利上げの可能性もある。その一方、所得水準の上昇は限定的であり、経済活動は力強さに欠けている。さらに、ウクライナや中東情勢の悪化に加え、米国大統領選挙の結果にも大きな影響を受ける可能性があり、先行きは楽観できない。
,,▲,学校［大学］（就職担当）,・円安傾向や物価の上昇が進むなか、景気回復の恩恵を受けていない学生や保護者が多数を占めている。
,,×,－,－
,,,,
　９．中国（地域別調査機関：公益財団法人中国地域創造研究センター）,,,,
,,,,（－：回答が存在しない、＊：主だった回答等が存在しない）
分野,,景気の先行き判断,業種・職種,景気の先行きに対する判断理由
"家計
動向
関連

(中国)",,◎,設計事務所,・計画案件が増えてきているため、実施に移行する案件も増えるとみられる。
,,○,商店街（代表者）,・直近では１店舗開店し、来月には飲食店の開店も予定されており、現在商店街で不足している業種が出店するため、今後のにぎわいに期待している。
,,○,コンビニ（副地域ブロック長）,・今後も公共工事は増える傾向にあり、夏場の猛暑も予測されているため、来客数が増えていくと予想する。酷暑への売場の対応も必要になってくる。
,,○,コンビニ（支店長）,・今後の動きをしっかり注視する必要があるが、定額減税による消費拡大が期待できる。
,,○,衣料品専門店（経営者）,・新型コロナウイルスの感染状況が落ち着き、着物を着て出掛ける機会が増えているため、今後は景気がやや良くなる。
,,○,家電量販店（店長）,・定額減税、ボーナスの支給、気温上昇によるエアコン需要の高まりで、景気は前年より良くなる。
,,○,家電量販店（販売担当）,・景気は夏の暑さ次第である。
,,○,乗用車販売店（営業担当）,・大手自動車メーカーの不正問題の影響による生産停止等の問題が解決すれば、景気は例年並みに回復する見込みである。
,,○,乗用車販売店（営業担当）,・今後の状況に期待は持てるが、安心はできない。気の抜けない状況は変わらない。良くなることを期待しての数値である。
,,○,乗用車販売店（店長）,・大手自動車メーカーの不正問題の解決や人気車種の販売開始で活性化してくると予測する。
,,○,その他専門店［土産物］（経営者）,・旅行代理店からの問合せが増えてきおり、観光需要を見込んでいる。
