Ⅰ．景気の現状に対する判断理由等,,,,,
,,▲,観光型旅館（経営者）,来客数の動き,・今月の売上は、2019年度比で90％となっている。前年、前々年は全国旅行支援の影響で良かったが、今年度は良くなく、リベンジ消費はもうみられなくなっている。
,,▲,都市型ホテル（管理担当）,販売量の動き,・３か月前と比べると販売の勢いが鈍化しており、宿泊の予約キャンセルが増えている。
,,▲,都市型ホテル（フロント）,単価の動き,・６月は年間で１番の閑散期であるが、４月から５月が好調であったため、今年は特に落差が大きくなっている。単価を下げれば予約数は伸びる一方、収入は大きく減少する。
,,▲,旅行代理店（従業員）,販売量の動き,・円安による物価の上昇ムードで、個人消費は抑えられている。
,,▲,旅行代理店（支店長）,お客様の様子,・長引く円安や物価の上昇により、客の可処分所得が減少している。いよいよ余暇に使うお金を節約しなければ、生活に支障が出るといった話も増えている。
,,▲,通信会社（経営者）,お客様の様子,・原材料費や燃料費の増加により、利益が圧迫されている。
,,▲,通信会社（社員）,販売量の動き,・既存客による解約が増加している。新規客よりも解約の方が増える傾向にあるため、利用客数は純減となっている。
,,▲,通信会社（営業担当）,来客数の動き,・円安の進行や光熱費の高騰の影響で、買い控えの動きが広がっており、問合せが減っている。
,,▲,住宅販売会社（経営者）,お客様の様子,・建築資材価格などの高騰で、新築、リフォーム価格が上がっており、徐々に客がついていけない雰囲気になっている。
,,▲,住宅販売会社（総務担当）,販売量の動き,・物価の上昇に賃金が追い付いていない。
,,×,衣料品専門店（経営者）,来客数の動き,・ショーウィンドウをのぞく客はみられるが、店には入ってこない。
,,×,衣料品専門店（経営者）,来客数の動き,・来客数が前年比で10％から30％の減少となっており、高額な商品は売上が増えない状況が続いている。
,,×,家電量販店（店員）,それ以外,・他社の見積りと比較する際、明らかに費用を上乗せした金額と判断される内容が増えている。商品価格と工事費用が区別しやすくなったため、経費項目で調整を図っていると考えられる。
,,×,家電量販店（店員）,来客数の動き,・６月からの電気代や水道代、食品価格などの高騰により、不必要な商品の購買意欲が低下している。４万円の定額減税くらいではなかなか厳しい。
,,×,観光型旅館（経営者）,来客数の動き,・一般客向けのホテル、高級ホテル共に、本当に動きが悪い。
"企業
動向
関連

(近畿)",,◎,電気機械器具製造業（経営者）,受注量や販売量の動き,・半導体の微細化が進めば進むほど、当社の加工技術の高さが活かされる。市場からの需要が高まり、当社製品の市場性も上がる。
,,○,輸送業（経営者）,取引先の様子,・交渉が長引いていた新規案件が具体化してきたほか、運賃の値上げも確約できている。
,,○,経営コンサルタント,取引先の様子,・取引のある商店街は全国にあり、特に観光地にある商店街には、大勢のインバウンドが押し寄せている。
,,□,繊維工業（総務担当）,競争相手の様子,・催事での値引きが目立つなど、業者間での価格競争が利益の減少要因となっている。利益の出ない商売は断っているため、売上の減少が進むなか、オリジナル商品については利益を確保している。
,,□,パルプ・紙・紙加工品製造業（経営者）,受注量や販売量の動き,・受注量がなかなか戻ってこない。月末に近づくと在庫調整が行われ、食品メーカーでも今月から在庫を調整する動きが出てきている。
,,□,化学工業（管理担当）,受注量や販売量の動き,・車載用電装分野はやや受注が減少した一方、民生用基板関連は若干増えるなど、産業用途は好調となった。分野によって景気はまだら模様となっている。
,,□,プラスチック製品製造業（経営者）,受注量や販売量の動き,・安定した受注はみられるが、納期は短いため、やり繰りが大変である。今後も現状のまま推移しそうである。
,,□,窯業・土石製品製造業（管理担当）,取引先の様子,・歴史的な円安と相変わらずの物価上昇が続いている。６月の定額減税で一時的に給与は増加するものの、効果は限定的であり、大きな変化はない。
,,□,金属製品製造業（経営者）,受注価格や販売価格の動き,・建築、土木関連の荷動きが悪く、回復基調にあった自動車部品関連も、大手メーカーの不正問題によって回復期待が薄れている。
,,□,一般機械器具製造業（経営者）,受注量や販売量の動き,・景況は余り変わらない。
,,□,電気機械器具製造業（宣伝担当）,受注量や販売量の動き,・エアコンの販売は前年を上回る状況であるが、冷蔵庫や洗濯機などの大型家電の荷動きは鈍化気味である。
,,□,建設業（経営者）,受注量や販売量の動き,・年度初めから比べると、動きは落ち着いており、問合せも一段落している。
,,□,建設業（経営者）,受注価格や販売価格の動き,・計画段階での予算と実態の価格がかい離している。一部の建設資材や工賃の上昇に加え、技能労務者不足などにより、受注できない案件もある。
,,□,輸送業（営業担当）,取引先の様子,・家具の売行きが悪いため、配達件数が減少している。
,,□,金融業（営業担当）,取引先の様子,・大阪・関西万博の開催まで１年を切ったが、景気が良くなっているとの話は少ない。為替も円安傾向が続いており、仕入コストが上昇しているといった話が多い。
,,□,その他非製造業［機械器具卸］（経営者）,受注量や販売量の動き,・前年から続いている商品の値上げが、いまだに続いている。値上げを要請し、取引先の了承を得てからの値上げとなる。一連の動きが落ち着くまでは販売に集中できないため、難しい部分が大きい。
,,□,その他非製造業［衣服卸］（経営者）,受注量や販売量の動き,・春物商材の荷動きが悪いため、チェーンストアでは店頭在庫が増加するなか、盛夏商材の投入時期が後倒しになっている。それに伴い、全体的な荷動きが停滞気味となっている。
,,▲,食料品製造業（従業員）,受注量や販売量の動き,・値上げの影響で、家庭用製品の買い控えが増え、出荷が大幅に落ち込んでいる。業務用製品は何とか販売を維持しているが、全体にはマイナスとなっている。
,,▲,電気機械器具製造業（営業担当）,受注量や販売量の動き,・売上が低迷している。
,,▲,その他製造業［履物］（団体職員）,取引先の様子,・秋冬商材の受注状況が低迷している。
,,▲,建設業（経営者）,受注量や販売量の動き,・住宅の建築確認申請が減っている。見学会の予約や問合せも、目に見えて減少傾向にある。
,,▲,金融業（営業担当）,受注価格や販売価格の動き,・円安による仕入価格の上昇が続くなかで、販売価格の上昇が追い付かないため、景気の回復が遅れている。
,,▲,不動産業（営業担当）,取引先の様子,・都市部の主要な通り沿いといった、立地の良い場所でも、１階のアパレル店舗の撤退が続いている。
,,▲,広告代理店（営業担当）,受注量や販売量の動き,・Ｗｅｂ媒体、紙媒体共に、広告売上が前年を少し下回っている。
,,▲,広告代理店（営業担当）,受注量や販売量の動き,・年度末の前後は、交通広告の発注は好調であったが、このところは足踏み状態である。
,,×,金属製品製造業（営業担当）,受注量や販売量の動き,・住宅向けの出荷や売上は、かなり厳しい状態が続いている。
,,×,輸送用機械器具製造業（経営者）,受注量や販売量の動き,・製品単価の上昇によって消費者の購入意欲が低下し、販売数量が伸びていない。
,,×,金融業［投資運用業］（代表）,それ以外,・様々な業種において、倒産件数は過去最高を更新中である。コロナ禍の余波に加え、無利子無担保融資の返済、中小零細企業の厳しい税負担など、商売をする上で悪い材料が増えている。特に、低所得者や小規模事業者にとって、景気の良さが感じられる状況ではない。
,,×,その他非製造業［電気業］（営業担当）,受注価格や販売価格の動き,・物価の上昇が落ち着かず、工事費や人件費が増加している。
"雇用
関連

(近畿)",,◎,－,－,－
,,○,人材派遣会社（支店長）,求人数の動き,・例年ほどではないものの、３か月前よりも上向いている。
,,○,人材派遣会社（管理担当）,求人数の動き,・各観光地が人であふれるなか、対応する人材が不足している。それに伴い、求人数が増加している。
,,○,民間職業紹介機関（営業担当）,求人数の動き,・新卒の採用活動が長期化、通年化しているため、途切れる時期がない一方、ピークの時期もなく、求人の掲載や紹介依頼が続いている。
,,□,人材派遣会社（役員）,求職者数の動き,・求職者の動きは依然として活発であるが、前月までとほぼ同じ水準である。
,,□,人材派遣会社（営業担当）,求職者数の動き,・求職者の動きは鈍化傾向にある一方、高年齢化が進んでいる。派遣求人への60代の応募が日常化するなか、70代の動きも散見される。
,,□,人材派遣会社（営業担当）,求人数の動き,・新規募集時の時給が、以前と変わらないケースが多い。既に就業している社員とのバランスもあり、新規募集だけ時給を改定することができないようである。
,,□,新聞社［求人広告］（営業担当）,それ以外,・インバウンドの増加といったプラス材料はあるものの、円安や物価の上昇といったマイナス材料も多く、どちらに振れるか微妙な状況である。
,,□,新聞社［求人広告］（担当者）,それ以外,・新聞広告への出稿状況をみると、ほぼ３か月前と同水準であり、大きな変化がない。
,,□,職業安定所（職員）,求人数の動き,・５月の新規求人数は前年比で増加となった。特に増加した業種は、不動産・物品賃貸業、サービス業、運輸業・郵便業などである。有効求人倍率も前年比で27か月連続の上昇となっている。
,,□,職業安定所（職員）,周辺企業の様子,・中小企業には人手不足感があるものの、賃上げや原材料価格の高騰によるコストの増加で、求人が出せないといった声もあり、全体的な景気の上昇がみられない。
,,□,職業安定所（職員）,求人数の動き,・新規求人数はやや減少したものの、有効求人数は微減にとどまるなど、変化が余りみられない。
,,□,学校［大学］（就職担当）,それ以外,・初任給の引上げや各種手当の付与など、雇用条件を見直す動きが出てきたものの、これが少数派である限り、景気が上向くとまではいえない。
,,□,学校［大学］（就職担当）,それ以外,・企業の採用の早期化に対応するため、低学年次から就職活動を進める学生が増え、会社説明会にも積極的な参加がみられる。
,,□,学校［大学］（就職担当）,採用者数の動き,・医療業界での人手不足が続いている。就職希望者はほぼ全員が内定を得て卒業したが、この世代はコロナ禍で現場での臨床実習ができていないため、離職しないか心配である。
,,□,その他雇用の動向を把握できる者,周辺企業の様子,・前月と同様、物価上昇の影響で厳しいという企業の声が多い。
,,▲,職業安定所（職員）,求人数の動き,・３か月前や前年の求人数と比べると、いずれも減少している。
,,▲,民間職業紹介機関（営業担当）,求人数の動き,・例年どおりの動きであるが、求人がやや減少しており、それに伴って求職者も減少している。
,,×,－,－,－
,,,,,
　９．中国（地域別調査機関：公益財団法人中国地域創造研究センター）,,,,,
,,,,,（－：回答が存在しない、＊：主だった回答等が存在しない）
分野,,景気の現状判断,業種・職種,判断の理由,追加説明及び具体的状況の説明
"家計
動向
関連

(中国)",,◎,競艇場（企画営業担当）,販売量の動き,・今月、記念レースのＧ１競走が開催されたため、十分な売上が確保できた。
,,◎,設計事務所,お客様の様子,・これまで計画の相談は多かったが、実際に動き出すものは少なかった。今月からは正式な依頼になるものが増えている。
,,○,商店街（代表者）,それ以外,・商店街への空き店舗について、問合せが増えてきている。
,,○,一般小売店［洋裁附属品］（経営者）,お客様の様子,・今までの客の動きと比べると、休日や祝日の人出が増え、売上につながっている。
,,○,百貨店（営業担当）,販売量の動き,・半数以上のブランドで、前年より早く、プレクリアランスセールが始まり、売上が増加した。来客数や販売数量も増加しており、月末になっても、売上は前年と比べ、10％増加している。
,,○,百貨店（売場担当）,販売量の動き,・前年の実績は超えなかったが、100万円を超える美術品やブランドのジュエリーなどが売れた。
,,○,スーパー（店長）,来客数の動き,・今月は父の日商戦があったが、父の日は売上を前年比117％と大幅に伸ばすことができた。定額減税のタイミングと重なった効果も多少あるとみられる。月間トータルでも、来客数は前年比104％と伸びている。
,,○,コンビニ（副地域ブロック長）,来客数の動き,・平日の売上が改善傾向で、公共工事も増え、朝夕の来客数が増えている。また、県外からの出張者も多くなっているようである。
,,○,衣料品専門店（経営者）,お客様の様子,・６月の展示会に多くの客が来ており、景気は以前よりかなり良くなっている。
,,○,家電量販店（販売担当）,販売量の動き,・エアコンの販売台数が伸びている。
,,○,乗用車販売店（営業担当）,来客数の動き,・客に新型車の事前情報が入ったことで、来客数や問合せが増えている。ボーナスも支給され、商談数や販売台数も３か月前と比べると増加している。
,,○,乗用車販売店（営業担当）,販売量の動き,・市場の動きが戻るにつれて、来客数が上向き、販売状況もかなり良くなっており、期待が持てる状況である。
,,○,その他専門店［時計］（経営者）,単価の動き,・要因は分からないが、月の中盤から高単価の商品が販売できた。
,,○,その他専門店［土産物］（経営者）,来客数の動き,・観光バスやインバウンドが徐々に戻りつつある。まだ良いとまではいえないが、来客数が少しずつ増えてきている。
,,○,その他小売［ショッピングセンター］（支配人）,来客数の動き,・梅雨入りが大幅に遅れ、気温が上がったことで夏物商材が好調に推移した。
,,○,一般レストラン（経営者）,来客数の動き,・金曜日に定期的に上場企業の飲み会が入り、売上を維持している。また、週末も気温の急激な上昇で、ファミリー層の利用がランチ、ディナー共に増加し、特にランチの客単価が上昇している。
,,○,バー（経営者）,来客数の動き,・まだ安心できないが、徐々に来客数が増加している。
,,○,通信会社（工事担当）,お客様の様子,・新型コロナウイルス感染症に関する制限の緩和により、景気はやや良くなっている。
,,○,通信会社（企画担当）,お客様の様子,・物価が上昇しているものの、新型コロナウイルス感染症が終息し、周囲の社会情勢が落ち着いたため、客が購買に比較的前向きになっている。
,,○,設計事務所（経営者）,来客数の動き,・客からの問合せ及び来客数が増えており、接客頻度も上がり、契約者数の上乗せに結び付いている。
,,□,一般小売店［食品］,来客数の動き,・来客数は３か月前とほとんど変わらないが、客単価の上昇により売上は前年比微増となっている。
,,□,一般小売店［茶］（経営者）,お客様の様子,・輸出の売上は前年と比べ少しずつ上昇しつつあるが、国内の売上は前年と比べ減少し続けている。国内消費の減少は人口減少の影響か、消費者の財布のひもが固くなっているためか分からないが、いずれにしても不安である。都会はインバウンドの影響で好調のようだが、地方ではインバウンドの恩恵が全くなく、残念である。
,,□,一般小売店［印章］（経営者）,販売量の動き,・例年と比べても大きな変化が認められない。
,,□,百貨店（広報担当）,来客数の動き,・新型コロナウイルス感染症の感染症法上の位置付けが５類に引き下げられて１年経過したが、来客数や売上に大幅な増減がない。
,,□,百貨店（広報担当）,来客数の動き,・人出が多く、来客数が増え、売上も伸びているが、商材による差は激しい。客が何に金を使うかを厳しく選択しているようである。
,,□,百貨店（営業担当）,お客様の様子,・直近３か月、来客数は前年を下回っている。売場が来店アプローチを掛けることで来店する客はいるが、フリーの客が来店していない。
,,□,百貨店（売場担当）,お客様の様子,・婦人服については、年齢の少し若い商品群の売上が厳しく、その年齢層の県外流出が続いている。
,,□,百貨店（外商担当）,単価の動き,・宝飾品などの外商関連の商品は好調であるが、店頭での衣料品販売が苦戦している。
,,□,スーパー（店長）,販売量の動き,・現状の数値から判断すると、停滞といった状況、良くなってもいないが、悪化もしていないという低水準での横ばいである。高単価商品の動きが悪く、客が低単価商品を求める傾向となっており、週末や割引日に客が集中し、まとめ買いするといった状況である。また、食品の値上がりが継続しているため、買上点数の増加につながらない状況である。
,,□,スーパー（店長）,来客数の動き,・来客数はほぼ前年並みだが、売上は商品単価の上昇もあり、前年を僅かに上回っている。
,,□,スーパー（業務開発担当）,単価の動き,・前年の売上が前年比５ポイント強の伸びだったのに対し、本年の売上は、来客数が前年並みであるものの、買上点数が前年割れとなっているため、前年比２ポイント程度の増加にとどまっている。
,,□,スーパー（販売担当）,販売量の動き,・客が必要最低限な商品をセールや特売日にしか購入しない状況で、買物を楽しむマインドに至っていない。
,,□,スーパー（販売担当）,来客数の動き,・前年比を見ると、５月よりも悪くなっている。
,,□,コンビニ（支店長）,来客数の動き,・梅雨入りが遅れたことで、前年より売上が好調である。
,,□,衣料品専門店（経営者）,お客様の様子,・中小企業の景気が良くない。
,,□,家電量販店（店長）,来客数の動き,・来客数は天候に左右されるため、何ともいえないが、値上げラッシュの状況で、客に少し諦めている様子がある。
,,□,家電量販店（副店長）,販売量の動き,・夏需要に支えられ、エアコンの販売台数が前年を上回っているが、テレビやパソコンの販売台数は前年割れしており、販売量は平均すると前年並みといった感じで推移している。
,,□,乗用車販売店（統括）,販売量の動き,・６月の販売量は前年比85％と大変厳しい状況である。
,,□,乗用車販売店（業務担当）,販売量の動き,・物価上昇など様々な問題があり、販売量は上向き傾向にはない。
,,□,乗用車販売店（リース担当）,来客数の動き,・来客数が余り多くなく、今後も増加しない。
,,□,自動車備品販売店（経営者）,販売量の動き,・円安による輸入品の物価高で経費が高騰しているため、売上が上昇しても、利益は増えない状態である。
,,□,その他専門店［和菓子］（経営者）,来客数の動き,・Ｇ７広島サミットの影響が今年はない。
,,□,その他小売［ショッピングセンター］（管理担当）,お客様の様子,・来客数に余り変化はないようであるが、好景気に向かっている実感はない。商品の値上げやガソリンなどの価格の高止まりなど、家計がじわじわと圧迫されている状況である。高額商品の購入やまとめ買いは少なく、余り金を使わず休日を過ごそうという家族連れが多くなっているように感じる。
,,□,高級レストラン（事業戦略担当）,来客数の動き,・昼の集客に苦戦している。
,,□,一般レストラン（経営者）,単価の動き,・若干インバウンドが減ったようで、インバウンドのお陰で景気が良いと感じさせられている部分がある。
,,□,一般レストラン（店長）,来客数の動き,・３か月前と比べても来客数の伸びはそれほど変わらない。６月に入り新しく配属された新卒の来店客もいるが、一方で、転勤で異動したのか見かけなくなった常連客も多い。
,,□,観光型ホテル（副支配人）,来客数の動き,・宿泊客数は例年並みか僅かに減少しているようだが、昼間の宴会利用は増えてきている。経費が増加したため、宴会の料金を少し上げたが、客の理解を得ているようである。
,,□,都市型ホテル（総支配人）,来客数の動き,・円安の影響もあり国内旅行の需要が堅調に推移し、また、インバウンド需要も円安により微増となる。
,,□,旅行代理店（経営者）,お客様の様子,・景気が良くなっているように感じているが、物価の高騰には追い付いていけない。
,,□,旅行代理店（支店長）,販売量の動き,・国内個人については前年度より若干減少、団体についても大幅な伸びはなく、特に海外旅行については個人、団体共に厳しい状況が続いている。教育旅行については６月は繁忙期であり、好調に推移している。
,,□,タクシー会社（営業所長）,来客数の動き,・インバウンド需要の多かった５月と比較し、大幅に落ち込んだ。季節性もあるとみているが、他県と比較しても落ち込みが大きいようである。昼間、夜間共に前年よりやや減少している。
,,□,通信会社（総務担当）,お客様の様子,・解約が増えてきている。
,,□,放送通信サービス（総務経理担当）,お客様の様子,・客の利用料の延滞状況、督促による回収状況に大きな動きはない。
,,□,通信会社（営業担当）,お客様の様子,・景気浮揚の実感がなく、インフレに収入が追い付いていないことから、客が日常的な支出を控えている傾向がある。
