Ⅱ．景気の先行きに対する判断理由,,,,
,,○,住宅販売会社（従業員）,・株高、賃金上昇の影響により、徐々にだが景気が良くなっていくのではないか。
,,□,商店街（代表者）,・最近、35度以上の猛暑日が毎日のように続いていることで、人出にかなり影響が出ており、商売の方でも思うような数字が取れていない。天候がもう少し落ち着いてくれば、また商売も頑張らなければと考えるが、なかなか今はそのような状況ではない。
,東京都,□,商店街（代表者）,・徐々に新型コロナウイルスの新規感染者数が増えてきている。今年の猛暑がどのくらい続くかにもよるが、若干マイナス要素がある。それがなければ、今のリベンジ景気はしばらく良い状態をキープしそうである（東京都）。
,東京都,□,一般小売店［家具］（経営者）,・これから先の景気だが、まず良くなる見込みはない。８月に入ってもパリオリンピックが続くし、高校野球もある。選挙の年でもあり、景気が上向く要素はない（東京都）。
,,□,一般小売店［印章］（経営者）,・この先も残暑が長引くのではないかと予測している。路面の独立店舗で、近くにアーケード街のようなものもないため、客が足を向けてくれることがなかなか難しい。厳しい状況がずっと続くのではないか。
,,□,一般小売店［祭用品］（経営者）,・需要と供給が追い付かず、販売したくても在庫がない状態が続く。
,,□,一般小売店［眼鏡］（経営者）,・正直なところ、このまま円安が続き、仕入価格、人件費が上がれば、値上げしなくてはならない。厳しい状況が続く。
,東京都,□,一般小売店［茶］（営業担当）,・世間ではボーナスが支給されたというニュースを耳にするが、当社の社員は一向にピンとこない。ここ10年もらったことがないためである（東京都）。
,東京都,□,一般小売店［書店］（営業担当）,・円安の影響による買い控えが今後も続く（東京都）。
,東京都,□,百貨店（売場主任）,・夏休みに入り全国からの来客数増加などを期待したいが、昨今の商材値上げなどの影響もあり、客の多くは冷静な購買行動になっているため、余り大きな変化はない（東京都）。
,東京都,□,百貨店（総務担当）,・前年と同様、８月の新型コロナウイルスの感染状況が懸念材料である。連日気温が高く熱中症の危険があるということで、外出を控える傾向が徐々に強くなっているが、しばらくはこの状況が続く（東京都）。
,東京都,□,百貨店（総務担当）,・訪日外国人が急速に減少することは考えにくいが、肝心の一般消費者の消費行動が継続的に上向き、景気が良くなるという環境ではないとみている。景気の上向き感は、今後の経済環境の良化次第である（東京都）。
,東京都,□,百貨店（広報担当）,・国内客、インバウンド共に向こう数か月で現状の高い水準からもう一段上がっていくような材料、逆に減退していく材料、どちらも見当たらない（東京都）。
,東京都,□,百貨店（営業担当）,・インバウンドの好調はまだ継続するとみられるが、それ以外に景気を左右する材料は見当たらない（東京都）。
,東京都,□,百貨店（営業担当）,・セールはそれほど好調でもなく、店頭の９割は秋の新作や一部冬物を並べている。定価でも気に入った物を買おうという心理はあるように見受けられる（東京都）。
,東京都,□,百貨店（営業担当）,・インバウンド実績の構成が全体の２けたで、月を追うごとに拡大している。引き続きインバウンドは好調に推移するであろうが、インバウンドを除いた実績の伸び悩みが不安要素である。特に、食品関連の売上が鈍化している（東京都）。
,東京都,□,百貨店（販売促進担当）,・けん引するのはインバウンドである。当店はしばらく改装が続き売場が縮小するため、売上を作るのが難しい立場だが、競合店、街全体の集客状況は変わらないと予測している（東京都）。
,,□,百貨店（販売促進担当）,・しばらくは物価上昇の影響が続く上、８月は猛暑による外出自粛も加わることで、しばらく景気は変わらない。
,東京都,□,百貨店（販売促進担当）,・４月以降、物価高による家計節約傾向は継続しており、ハレの日以外の平時の消費に対する財布のひもは固い。秋物商戦においても、近年の気候からみて、残暑により秋物への衣替えが活発化することは考えにくい（東京都）。
,東京都,□,百貨店（販売促進担当）,・円安の影響により変わらない（東京都）。
,東京都,□,百貨店（販売促進担当）,・直近の傾向からみて変わらない（東京都）。
,,□,百貨店（企画宣伝担当）,・季節や時期に合った商材を提案しながらも、目新しさがなければならないが、展開する商材に客がどのように反応するのか、現段階では分からない。
,東京都,□,百貨店（管理担当）,・前年にも増して気温が高く、購買意欲の減退が予想される。秋物の需要も年々減少している（東京都）。
,,□,百貨店（店長）,・秋に向けて行楽ニーズへの期待はあるが、暑さの継続が予測されるなか、供給する商材と客のニーズがマッチするかが不透明である。
,,□,スーパー（経営者）,・店舗により良しあしの温度差があり、前年は自治体のキャッシュレスキャンペーンの恩恵にあずかったという事情もある。競合店が近くにできるため、今後は厳しくなる。いろいろな与件があるものの、基調的には変わらない。
,,□,スーパー（経営者）,・生活必需品の価格上昇はいまだ続いている。所得の増加幅との差が縮まらない。
,東京都,□,スーパー（経営者）,・現状ではやや増えているが、これ以上良くなるとは考えられない（東京都）。
,,□,スーパー（店長）,・一部の商材については秋以降にも値上げが予定されているため、売上への影響が懸念される。
,東京都,□,スーパー（店長）,・値上げの影響で売上は伸びているものの、消費者には節約志向が依然として根付いている。価格に敏感な状況が続いている間は同様の状況が続く（東京都）。
,東京都,□,スーパー（営業担当）,・単価の上昇がまだ続くとみられるが、一方で、販売数並びに来客数は落ち込んだままとみている（東京都）。
,,□,スーパー（仕入担当）,・来月のお盆休みは９連休となるところが多いが、円安のため海外旅行は控え、食料品、光熱費等の値上げにより節約志向が高まっている。
,東京都,□,スーパー（食品担当）,・近隣にマンション建設や新規テナント入店など好与件がある（東京都）。
,,□,スーパー（販売担当）,・定額減税効果が薄れてくる。
,,□,コンビニ（経営者）,・今は夏場でソフトドリンクやアイスクリームが売れているが、３か月先は気候も落ち着いて変わらない。
,東京都,□,コンビニ（経営者）,・物価が上昇している（東京都）。
,,□,コンビニ（経営者）,・最近、低価格の商材が増えてきたので、客の認知度が高まれば、多少来客数の増加に期待を持てるが、今のところ厳しい状況は変わらない。
,,□,コンビニ（経営者）,・売上は前年を上回る予定だが、要因が定額減税だとしたら、年末頃には効果がなくなる。そのため、３か月程度は変わらない状況が望ましい。今後は最低賃金の上昇が予定されており、人件費が増加する。その収支を上回る販売量の増加を期待したい。
,東京都,□,コンビニ（経営者）,・夏場の若干の好調が秋口まで続きそうである（東京都）。
,東京都,□,コンビニ（エリア担当）,・８月以降も高温傾向が続く予報であることから、今の売上トレンドが継続しそうである（東京都）。
,,□,コンビニ（エリア担当）,・物価に見合った給与水準になり、原油価格高騰が落ち着かないと、現状のままで変わらない。
,東京都,□,コンビニ（エリア担当）,・高温が続くことで飲料や冷凍食品などの売上が伸び、売上につながることが想定される。ただし、余りに高温となると、在宅勤務の推奨など、客の流動そのものが減少する恐れもあることから、良くなるとはいい切れない（東京都）。
,,□,コンビニ（従業員）,・景気自体が良くなっているわけではないので、飽くまで夏休み中の一時的な客の動きで今後も続くわけではないと考えている。世の中の景気が良くなれば根本的な販売量も増えてくる。
,,□,衣料品専門店（経営者）,・年金生活者の生活防衛意識は強く、安さを求めている。
,東京都,□,衣料品専門店（店長）,・特に、地球温暖化による気候変動が主力事業に与える影響が大きい。また、物価上昇が今後も続くことが予測され、消費者の生活防衛意識は依然として高く、財布のひもが固い状態が続くものとみている（東京都）。
,,□,衣料品専門店（役員）,・食料品、光熱費の値上げが続くようなので、まだまだ衣料品には厳しそうである。
,,□,家電量販店（店長）,・米国の経済状況にも左右されるとみられるが、大統領選挙など大きなイベントがあるため、株式市場や為替などネガティブな情報が先行すると消費活動に影響が出る。
,,□,家電量販店（店長）,・物価上昇がまだ続いているため、現状のまま変わらない。
,,□,乗用車販売店（経営者）,・自動車の整備は順調に入っているが、販売は余り芳しくない。例年なら７月は夏のボーナス支給で台数が伸びるのだが、余り伸びていない。
,,□,乗用車販売店（営業担当）,・半期決算を迎えるが、主力車種が微妙である。
,東京都,□,乗用車販売店（販売担当）,・異常な円安により輸入価格が相当上がってきていることもあり、国内の景気自体はそれほど良くない。外国人観光客が結構来ているためサービス業は多少潤うだろうが、全体的な流れのなかではほとんど変わらない。今後、円安から円高になって輸入製品が安価になるなどの動きがあれば良くなるが、現状では良くなるとは考えにくい（東京都）。
,,□,乗用車販売店（渉外担当）,・自動車の出荷体制に依然として不透明な要素がある。
,,□,乗用車販売店（営業）,・販売できる車種が限られてしまっており、偏った販売活動になっている。
,東京都,□,住関連専門店（営業担当）,・住宅省エネ2024キャンペーン事業の需要喚起効果は当面継続するものとみている（東京都）。
,,□,その他専門店［ドラッグストア］（経営者）,・10月から最低賃金が上がるため、少し購買に回るとよい。
,,□,その他専門店［ドラッグストア］（経営者）,・景気が良いような感じもするが、商材が余り動いていない。
,東京都,□,その他専門店［貴金属］（統括）,・商材の単価を上げると販売量が減少する。その結果、全体的な売上は増加も減少もしないという傾向はしばらく続くとみられるため、２～３か月後の景気は変わらない（東京都）。
,東京都,□,その他小売［生鮮魚介卸売］（営業）,・猛暑が秋の商材の入荷にも影響するのではないか（東京都）。
,,□,その他小売［ショッピングセンター］（統括）,・猛暑のなかショッピングセンターに足を運ぶ回数が減ることが予想されるが、それは前年も同じである。
,東京都,□,高級レストラン（営業担当）,・当面は、客単価は上昇しているものの来客数の回復には至っていない状況がしばらく継続するものとみている（東京都）。
,東京都,□,高級レストラン（経理担当）,・３か月後の予約分はおおむね一杯となっている。新型コロナウイルス感染症の第11波が懸念材料だが、その行方は分からないため、変わらない（東京都）。
,東京都,□,一般レストラン（経営者）,・猛暑の影響はインバウンドには余り関係ないようである。近隣のほとんどのホテル、民泊は相変わらず外国人観光客であふれている（東京都）。
,,□,一般レストラン（経営者）,・景気が良くなるような経済対策もなく、ただ光熱費を何％下げられるくらいで、３か月後も今と変わらない。
,東京都,□,一般レストラン（経営者）,・材料価格が上がっているので、秋頃から宴会の料理なども全体的に値上げをしていく予定である。それにより客がどう動くか、今のまま来店してくれるか、他店へ行ってしまうのか、こちらも手探りだが、経営的には値段を上げていくしかない（東京都）。
,東京都,□,その他飲食［居酒屋］（経営者）,・夏休みに入り、人の動きが活発になることが予想される（東京都）。
,,□,都市型ホテル（経営者）,・この夏休みに宿泊部門がどのくらいまで回復するかだが、今のところ回復状況は余り芳しくない。近隣大型コンベンション施設でのイベントの縮小傾向が続いていることが影響している。９月以降は新しいイベントなども入ってきているようなので、期待したい。
,,□,都市型ホテル（スタッフ）,・戦争の状況、原材料費の値上げがいつまで続くのか、人件費がどこまで上昇するのかなどにより大きく変わってくるので、この先はなかなか見通しにくい。
,,□,都市型ホテル（スタッフ）,・先々の予約にばらつきが目立ち、繁忙期である11月の動きがかなり厳しい状況ではあるものの、その他の月は比較的順調に受注できているため、プラスマイナスゼロというイメージである。新型コロナウイルス感染症の拡大が気になるが、可もなく不可もない状態が継続する。
,,□,旅行代理店（経営者）,・現状、いろいろな物が値上がりしており、客も考えているような状態である。客が安心して生活できるような様子にはみえないため、現状維持が精一杯ではないか。
,東京都,□,旅行代理店（従業員）,・円安が続いており、１人当たりの商品単価が低下傾向にある（東京都）。
,,□,旅行代理店（従業員）,・旅行に行きたいという需要はあるものの、物価高により費用面から抑制傾向がみられる。
,東京都,□,旅行代理店（営業担当）,・円高に進まない限りは、基本的に良くならない（東京都）。
,東京都,□,旅行代理店（営業担当）,・物価上昇により、生活重視となり、高額商品の売上は伸びなさそうである（東京都）。
,東京都,□,通信会社（経営者）,・機器の受注及び工事等が増加傾向にないため、この先２～３か月先も身の回りの景気は変わらない（東京都）。
,東京都,□,通信会社（社員）,・引き合いが続いているが、採算ベースまでにはもう少し必要である。次の四半期まで気を抜かず営業活動の継続が必要となる。予断を許さない状況である（東京都）。
,,□,通信会社（営業担当）,・景気の好転が望めないなか、消費を抑える傾向がしばらく続くとみている。
,東京都,□,通信会社（局長）,・応募して入社する派遣社員がいても、育成に時間が掛かるため、しばらくは厳しい状況のまま変わらない（東京都）。
,東京都,□,通信会社（経営企画担当）,・案件増加の兆しが不透明である（東京都）。
,東京都,□,通信会社（営業担当）,・世の中の販売価格等が変わらない限り、景気に変化はない（東京都）。
,,□,通信会社（経理担当）,・客は関心があることや遊び以外は、何か買う時に熟慮して財布のひもが固くなるため、賃金と同様に遊ぶ時間が増えないと景気は早々に変化しない。
,東京都,□,通信会社（管理担当）,・市場や提供商品など営業環境に変化がなく、芳しくない状況は続くと認識している。新サービスのエリア追加を待っている（東京都）。
,東京都,□,通信会社（管理担当）,・ＢｔｏＣの手数料条件改定による変更点もあり、その影響を加味しても、状況に大きな変化はないものとみている（東京都）。
,東京都,□,観光名所（職員）,・ずっと横ばいで推移しており、減少も増加もなく、急激に増加するとは考えられない（東京都）。
,,□,パチンコ店（経営者）,・周辺地域でのイベント効果に期待しつつも、猛暑のなかでの人の動きに予測が付かず、足踏み状態が続いていく。
,,□,競輪場（職員）,・遊びとしての質を、来場する客よりもインターネットでの客に集中しなければならないところがある。好調な企画を打っていても、肝心のインターネット側を使いやすいものに変更しなければ、状況は変わらない。
,東京都,□,その他レジャー施設［ボウリング場］（支配人）,・新型コロナウイルス感染症の第11波と言われ始めていることが不安材料である（東京都）。
,東京都,□,その他レジャー施設［複合文化施設］（財務担当）,・米国大統領選挙の行方が不透明である（東京都）。
,東京都,□,その他レジャー施設［総合］（経営企画担当）,・株安や為替変動による景気への一時的な影響は考えられるが、引き続き外国人観光客の動きは活発であり、景気に左右されやすいレジャー関連消費への影響は限定的とみている（東京都）。
,,□,その他サービス［立体駐車場］（経営者）,・新型コロナウイルス感染症が完全に終息するまでは景気は良くならない。
,東京都,□,その他サービス［フィットネスクラブ］（エリア統括）,・円安、個人消費の伸び悩みなどプラスの材料が乏しい（東京都）。
,,□,設計事務所（経営者）,・今、非常に困っていることは、過去最高の受注数ではあるものの、その仕事をこなす社員がいないことである。そのために、客に納品の関係で大変な迷惑を掛けている。仕事が増えているが、対応できないことが非常にマイナスになっている。
,,□,設計事務所（経営者）,・受注状況に変化はない。民間に期待は持てないため、当分現状のままで推移する見込みである。
,,□,住宅販売会社（従業員）,・客の来場はかなり減っているものの、展示場から別の情報ルートの拡大を積極的に進めている。新商品の発売も控えているため、景気は悪いなりに底堅く推移するのではないか。
,,□,住宅販売会社（従業員）,・今後の受注は横ばいとみている。
,,▲,一般小売店［家電］（経理担当）,・今の忙しさは猛暑によるところが大きいため、秋口には収まる。
,,▲,一般小売店［酒類］（経営者）,・良くなる要素が見当たらない。
,東京都,▲,百貨店（総務担当）,・新型コロナウイルス感染症の５類移行による反動が一巡したこともあり、国内客の売上の伸びが食品中心に落ち着いてきている（東京都）。
,東京都,▲,百貨店（営業担当）,・為替の影響により、輸入食材の値上げは今後も継続することが予想される。また、国内についても人件費増加による価格への転嫁が続く（東京都）。
,東京都,▲,百貨店（営業担当）,・インバウンドは、足元では弱含みの兆候が出てきており、円高反転リスクも懸念されるなか、国内消費の回復が見通せないことなどから、現状よりもやや悪くなるとみている（東京都）。
,,▲,スーパー（経営者）,・当社は食品スーパーである。競合店ができたこともあるが、長きにわたり来客数が減少し、１人当たりの買上点数も減っている。商品単価は上がっているが、売上は減少している。販売経費は増加しており、営業赤字の状態である。過疎地域でもあり、可処分所得が増えないことには、この傾向は変わらない。
,,▲,スーパー（ネット宅配担当）,・９月以降の大幅な値上げが決まっており、節約志向は更に高まる。
,,▲,コンビニ（経営者）,・現在のような天候不順が続くと、来客数の減少を止められない。ましてや時給の大幅アップが予定されているなか、経営環境の悪化は避けられそうにない。
,,▲,コンビニ（経営者）,・夏が過ぎて、夏の売れ筋商品が売れなくなり、それに替わる物が売れるという予測がつかないくらい、他の商材が売れていない。
,,▲,コンビニ（経営者）,・店舗は、基本的には余りインバウンドと関係のない住宅地若しくはロードサイドにある。このあたりは、まだ来客数が戻らないというよりは、物価が上がっているなかで賃金が上がっていないため、来店頻度が下がっているのではないか。店としても苦しい状況である。
,,▲,衣料品専門店（経営者）,・円安の影響で、繊維関連産業では原材料価格が上がっている。いろいろな商材で、コロナ禍で静かであったものが正常化しつつあるが、急には戻らないため、納期等が遅れ、価格も上がっており、非常に困っている。加えて、職人の廃業や転職により、特に縫製の人手が不足しているため、今後どうなるのか注視している。
,,▲,衣料品専門店（統括）,・暑さが続き、秋物需要に影響があるとみている。
,,▲,衣料品専門店（従業員）,・ここ最近、新型コロナウイルスの新規感染者数が多くなっていることに加え、今年も猛暑が続くと予想されるため、景気に悪い影響があるとみている。
,東京都,▲,乗用車販売店（経営者）,・お盆休みも入るため、世の中のスピードが減速する（東京都）。
,,▲,乗用車販売店（総務担当）,・新型車効果が薄れたこともあり、客の購入意欲が低下している。
,東京都,▲,その他専門店［ガソリンスタンド］（団体役員）,・高値水準が続く限り、買い控えが続くとみている（東京都）。
,東京都,▲,その他小売［ショッピングセンター］（統括）,・賃金上昇が物価上昇に追い付かず、家計が厳しくなっている（東京都）。
,東京都,▲,高級レストラン（仕入担当）,・個人利用は法人利用に対して芳しくない。依然として商材の値上がりが続いており、物価上昇のあおりを受けて動きが鈍いことがうかがえる。明るい材料に乏しく、景気の後退が予想される（東京都）。
,,▲,タクシー運転手,・物価の上昇はとどまるところを知らない。新型コロナウイルス感染症があちこちでまた増えてきており、検査や治療薬の自己負担もある。世の中に良いことがほとんどないため、かなり厳しくなる。
,東京都,▲,タクシー運転手,・今の利用客の増加は暑さに起因しているため、２～３か月先に暑さが落ち着くと、売上も落ち着く。肝心の景気が良くなっているという実感は余りない（東京都）。
