Ⅱ．景気の先行きに対する判断理由,,,,
,東京都,○,その他専門店［雑貨］（営業担当）,・外国人観光客による土産物の購買が依然として好調である。円安が続く限り、売上も伸び続けると予測している（東京都）。
,東京都,○,高級レストラン（役員）,・客からの予約や問合せなどが上向きつつあり、販売量、売上共に増加傾向である。経営、採算的には、原価高や人手不足などの傾向は変わらないものの、売上としては上向き傾向にある（東京都）。
,,○,一般レストラン（経営者）,・３か月後の景気は少しずつだが良くなる。今までは新型コロナウイルス感染症の影響でなかなかパーティーやケータリングはなかったが、３月頃から少しずつ入り始めて、４月、５月とケータリングが増えてきている。よほどのことがない限りケータリングはずっとあると思うので、少しずつ良くなっていく。
,東京都,○,その他飲食［カフェ］（経営者）,・原材料費の高騰が厳しい状況が続いている。何もかもが値上がりしているので、売上は伸びているものの、利益が上がっていない可能性が高く、生産性向上が課題になっている。賃上げができてくると景気は良くなる（東京都）。
,,○,都市型ホテル（スタッフ）,・夏季は団体需要も増えるので期待したい。
,,○,旅行代理店（経営者）,・諸物価が上昇しているなかでも、格安で提供している店等を探して、多少なりとも余裕ができるようになるとみている。客は、多少予算オーバーしても構わないから家族皆で有意義に過ごしたいと話している。
,東京都,○,タクシー運転手,・これからどんどん暑くなる。昼夜かなり暑い予想のため、かなりタクシー利用が増えそうな気配がある（東京都）。
,東京都,○,タクシー運転手,・今年も暑くなる見通しである。例年、タクシーの利用者が増えるため、今年も夏場に向かって客が増えるのではないか（東京都）。
,東京都,○,通信会社（社員）,・インバウンドが続く限り、都心や観光地の景気は上向いていく。観光客向けのジャポニズムが、映え目当ての若年層に受けて消費を伸ばしている（東京都）。
,東京都,○,通信会社（経営企画担当）,・客の様子から、今後、案件増加の兆しが見込まれる（東京都）。
,東京都,○,通信会社（営業担当）,・ボーナス月でもあるので、回復を期待している（東京都）。
,東京都,○,通信会社（営業担当）,・業務削減及び獲得トレンドの良化による（東京都）。
,,○,ゴルフ場（経営者）,・値上げの影響による来場者数の減少がどこまで続くか、なかなか先は見えないが、徐々に回復傾向にあるため、現状よりは良くなる。
,,○,競輪場（職員）,・現状の良さをどれだけ継続、維持することができるかが重要である。ネクストステップの半年は企画が目白押しである。
,東京都,○,その他レジャー施設［ボウリング場］（支配人）,・大型の予約や飲食を伴う予約の問合せが増えてきている（東京都）。
,東京都,○,その他レジャー施設［総合］（経営企画担当）,・円安による国内客の海外旅行の手控えと、インバウンドの好調により、夏休みは国内旅行がより一層盛り上がる（東京都）。
,東京都,○,その他サービス［フィットネスクラブ］（エリア統括）,・定額減税に伴う個人消費の伸びに期待している（東京都）。
,,○,設計事務所（経営者）,・新型コロナウイルス感染症やインフルエンザなど、いろいろなことがあったが、各々の会社が頑張っている。何とかしなくてはいけないというなかで、今まで培ってきた営業力など足元を見直して、少しずつ上向いている。
,,○,住宅販売会社（経営者）,・国内ホテルの稼働率及び宿泊料金は上昇しつつあり、ホテル業界は良くなる。しかし、中小企業はまだ厳しい環境のなかにあり、賃上げができない。政府には中小企業への景気対策をお願いしたい。
,,○,住宅販売会社（従業員）,・資料請求件数に変動がない。
,,○,住宅販売会社（従業員）,・大手企業はもちろんだが、当社のような中小企業の賃金も上昇傾向にある。物価も上がってはいるが、賃上げにより消費が増えていけば、現在より景気は上向きになるのではないか。
,,□,商店街（代表者）,・客が買物に非常に慎重になっていることは間違いないが、それ以上に、諸物価が上がっていることもあり、着物はぜいたく品とみなされている。なくてはならない物ではないため、できれば節約したい様子が見受けられる。もう少し景気が良くなってくれると有り難い。
,東京都,□,商店街（代表者）,・緩やかな微増が続いている。ただし、その伸びにコロナ禍からの回復期より勢いがみられなくなっている。世の中の景気マインドが落ち着いてきたのかもしれない。イベントの参加者数は増えているものの、夜の引けが早かったりする（東京都）。
,,□,一般小売店［家電］（経理担当）,・これからは天候次第のところもあるが、前年も猛暑なのにエアコンが売れなかったので、予想が付きにくい。早々に安売りをしているが、期待はできない。
,東京都,□,一般小売店［家具］（経営者）,・これから先もほぼ変わらない。物を売るのは非常に難しい時代になってきている。内装関係もしているため、仕事は何とか維持していくことはできるが、景気そのものはこれからも変わらない（東京都）。
,,□,一般小売店［印章］（経営者）,・今はほとんどの会社にパソコンが導入されており、当社の扱っているゴム印等の消費量は非常に少なくなっている。これからますますパソコン等のシェアが広がることで、ゴム印等の需要は減り、徐々に衰退していく商材である。
,,□,一般小売店［祭用品］（経営者）,・需要に対して供給が追い付かないため、すぐに良くなることはない。
,東京都,□,一般小売店［米穀］（経営者）,・消費者物価指数、諸物価が上昇傾向である。これから夏に向けて電気料金も気になるところである。消費者の堅実な動きがみられる（東京都）。
,東京都,□,一般小売店［生花］（店員）,・３か月後の８月は旧盆になるので、仏花が売れる。５月の母の日は余り芳しくなかったが、それよりは多少売れるのではないか（東京都）。
,東京都,□,一般小売店［茶］（営業担当）,・販売量、来客数共にまだすぐに良くなるような状況ではない。円安も影響している（東京都）。
,東京都,□,百貨店（売場主任）,・インバウンドの売上に占める割合は全体の２割と変わらず堅調である。団体より個人需要が多いことも、今後も変わらないとみている。円安で価格が上がり過ぎて仕入れを中断している輸入品なども多く、円安がこのまま続くと更に展開できないアイテムが増えていくとみており、売上に影響が出ることを懸念している（東京都）。
,東京都,□,百貨店（総務担当）,・インバウンドについては堅調に推移するものの、国内に目を向けると円安、原材料費の値上げ等により商材価格が値上がりする一方、賃金上昇が追い付いておらず、将来に備えて節約志向が強まっている。特に、電気・ガス価格激変緩和対策事業費補助金の終了は家計に更に大きな影響を及ぼすため、当面、この傾向が続く（東京都）。
,,□,百貨店（総務担当）,・改装工事が秋頃まで続くため、現状が継続する。
,東京都,□,百貨店（総務担当）,・今後、特別な事情がない限り、訪日外国人による消費活動はある程度期待ができる。しかし、国内の一般消費者の動向については、引き続き物品の値上がりなどにより予断を許さない状況であることに変わりはない。楽観的な見通しでの判断は難しい（東京都）。
,東京都,□,百貨店（総務担当）,・今後、円安が更に進むことにより物価上昇が賃上げ率よりも高まれば景気悪化の懸念があるが、現時点では不確定な要素が多い（東京都）。
,東京都,□,百貨店（広報担当）,・インバウンド消費の力強さは健在だが、現在より一段基調を押し上げるほどの影響力はない。また、国内消費は特段上がる要素も下がる要素もない（東京都）。
,東京都,□,百貨店（営業担当）,・値上がりの影響により国内客の消費が落ち込む一方で、円安によりインバウンド消費がそれを上回って伸びている。この状況はまだしばらく継続する（東京都）。
,東京都,□,百貨店（営業担当）,・あらゆる品目が値上がりしているため、コスト増加による負担が大きくなっている。夏休みに向けて買物方法や出費の更なる見直しを考える客が増えそうなので、来店頻度、購入点数の減少が予想される。当分は外国人観光客の購買拡大に期待する（東京都）。
,東京都,□,百貨店（営業担当）,・円安が続く限り、外国人客で好調な現状が継続する。現在は、例年より中国人客が来ていないが、こちらはすぐに増えるとは言い難い状況である（東京都）。
,,□,百貨店（販売促進担当）,・今後、物価や光熱費の上昇などが想定されていることから、客の消費意欲にも影響し、景気はしばらくは変わらない。
,東京都,□,百貨店（販売促進担当）,・新年度以降、物価上昇の影響で景気の潮目が明らかに変わっている。レジャーやハレの日には出費するが、その前後は強く引き締めるメリハリ消費が顕著である。夏休みに向けて、レジャー費は使っても日常消費は引締め傾向となることが予見される。月を通してインバウンド以外の日常消費は前年並みにとどまることが見込まれる（東京都）。
,東京都,□,百貨店（財務担当）,・賃金上昇による効果が今後加速すると想定する一方、円安による輸入物価の上昇が景気を押し下げる可能性がある（東京都）。
,東京都,□,百貨店（管理担当）,・今夏も暑くなる予報が出ている。高齢客の多い当店では、暑さで外出を見合わせる客が多くなることが見込まれる。インターネット販売に対応できる客は少ないため、減収になる可能性がある（東京都）。
,,□,百貨店（店長）,・アパレル、雑貨は暑い夏に対応した品ぞろえが計画されており、ニーズにこたえられるとみているが、食料品に関しては天候や値上げに左右されるため不透明であり、上向くとまでは期待できない。
,,□,スーパー（経営者）,・今月前半は割と良かったが、後半になって鈍化している。来月もそれ程は良くはないのではないか。また、競合店が出店してくるなど、６月以降いろいろな予定が増えているので、当社としては先行きはそれほど良くない。全体的には現状よりやや落ちるのではないか。
,,□,スーパー（経営者）,・可処分所得が増えていない。
,東京都,□,スーパー（経営者）,・良くも悪くもならず、こう着状態である（東京都）。
,,□,スーパー（店長）,・競合店が増えているとともに、今まで異業種とされていたドラッグストア等も生鮮品を手掛けてきていることもあり、加工食品を中心とした価格競争が発生している。商材によっては値上げ前の特売価格で販売するなど、異業種も巻き込んだ価格競争が続く。
,東京都,□,スーパー（店長）,・消費者には節約志向が依然として根付いており、値上げの影響で単価は上昇しているものの、購買意欲が上向いているわけではないので、当面の間は同様の状態が続く（東京都）。
,東京都,□,スーパー（営業担当）,・単価の上昇傾向、販売量並びに来客数の下降傾向は変わらないとみている（東京都）。
,,□,スーパー（仕入担当）,・円安はまだまだ続きそうで、輸入品を中心に原材料価格が上がり、それにつられて国産品の値上がりも続く。
,東京都,□,スーパー（食品担当）,・光熱費の値上げ、金利上昇により景気、消費は横ばいとなる（東京都）。
,,□,コンビニ（経営者）,・スタッフの声からも、厳しい状況は変わらない。
,,□,コンビニ（経営者）,・やはり商品単価の上昇が売上が伸びない最たる理由ではないか。
,東京都,□,コンビニ（エリア担当）,・価格の高止まり、出社や観光等での外出の継続が見込めるため、現状と同じ水準で推移するのではないか（東京都）。
,東京都,□,コンビニ（商品開発担当）,・円安が続いており、まだまだ先行きが不透明である（東京都）。
,,□,衣料品専門店（経営者）,・客は年金生活の高齢者が多いため、節約志向が続く。衣料品は低価格商材の競争が激化する。
,,□,衣料品専門店（経営者）,・これから忙しくなる時期だが、円安の影響で輸入価格が上がって全てが値上がりしているなかで、商材の値上げはなかなかできない。また、職人が辞めたり廃業したりしているために、加工品の納期が遅れており、できないものも増えてきている。そうしたことから、今後どうなるのかやや不安である。
,東京都,□,衣料品専門店（店長）,・人気キャラクターとのコラボ浴衣は好調に推移するとみているが、ドレス事業のステージフェアが、計画に対し90％ともう一歩の状況であり、全体では現状と変わらない（東京都）。
,,□,衣料品専門店（役員）,・諸物価の上昇が衣料品需要の低下に大きく影響している。
,,□,家電量販店（店長）,・電気・ガス価格激変緩和対策事業費補助金が終わり、エネルギー関連の価格上昇や、関連した値上げラッシュが想定されるなか、景気が良くなる未来が想像できない。
,,□,家電量販店（店長）,・まだまだ物価上昇が続き、この先も回復の期待はできない。
,,□,乗用車販売店（経営者）,・自動車の整備は順調に入っているが、販売が余り芳しくない。客の来場は結構あるものの、なかなか成約に結び付いていない。
,東京都,□,乗用車販売店（経営者）,・３か月では変わらない（東京都）。
,,□,乗用車販売店（営業担当）,・このまま新型車との相乗効果を期待したい。
,東京都,□,乗用車販売店（販売担当）,・円安の影響で輸入物価が大幅に上がっている。海外に行ったときに、円換算すると物が高くみえると客が話している。やはり、円安を何とか改善すること、賃金が上がること、ロシアとウクライナの戦争などが終わらないことには、今後も悪い状況が続く（東京都）。
,,□,乗用車販売店（渉外担当）,・販売量に減少傾向がみられる。
,東京都,□,乗用車販売店（営業担当）,・物価上昇に賃金上昇が追い付いていない（東京都）。
,,□,その他専門店［ドラッグストア］（経営者）,・世間一般で値上がりが続いており、当社の商売でも値上がり傾向が出ているため、消費が増えない。
,東京都,□,その他専門店［貴金属］（統括）,・定額減税など景気にプラス要素となる政策も実施されるが、物価上昇などのマイナス要素もあるため、２～３か月では変わらない（東京都）。
,東京都,□,その他専門店［ガソリンスタンド］（団体役員）,・国内の大多数を占める中小零細企業においては、賃上げの実現、あるいは上げ幅が非常に厳しい状況のなか、働く従業員の可処分所得は今と変わらないと予測できる（東京都）。
,東京都,□,高級レストラン（営業担当）,・例年、売上作りに苦戦する夏場の閑散期をどのように乗り切るかがポイントで、これが年間の数字を左右してくる（東京都）。
,東京都,□,高級レストラン（経理担当）,・資源価格の高騰や為替相場などにより、法人の業績見通しについて楽観できないことから、法人客の需要は、減少に転じるまではいかないものの、伸びることは想定できない（東京都）。
,東京都,□,一般レストラン（経営者）,・円安などの影響で観光客の増加が止まらない。街のにぎわいも衰える気配がない（東京都）。
,東京都,□,一般レストラン（経営者）,・原材料費の上昇分をどこまで価格転嫁できるか不安である。全てがインバウンド効果で対応できるものではないので、今後も価格の高騰が続くようなら、来客数の減少も想定する必要がある（東京都）。
,東京都,□,一般レストラン（経営者）,・レストランなので、ゴールデンウィーク中は忙しかったが、今は中だるみである（東京都）。
,東京都,□,その他飲食［居酒屋］（経営者）,・会社負担での宴会は増えている一方、フリーの客は減っている（東京都）。
,,□,都市型ホテル（経営者）,・前年は新型コロナウイルス感染症が５類に移行し、客が一気に戻ってきて、全国旅行支援もまだ残っていた状況であったが、今年はそれがないこともあり、売上は横ばいではないか。夏の猛暑も予想されるが、６月からは電気・ガス価格激変緩和対策事業費補助金が終了すると報道されている。そのため、水道光熱費負担が大幅に増えるのではないかと危惧している。政府には状況を見ながらその対策を是非お願いしたい。
,,□,都市型ホテル（スタッフ）,・この先の宴会予約の動きがかなり悪いため、少し悪い流れが続く。
,,□,都市型ホテル（スタッフ）,・円安の影響で食材、水道光熱費、人件費など全てが上がっており、販売価格を見直さざるを得ない状況が続いている。全ての客が許容してくれているわけではないので、ベースとなる売上は確保できても、それ以上は利用控えなどによりプラスにはなっていない。
,東京都,□,旅行代理店（営業担当）,・円安等も含めて先行き不透明なところが非常に気になる（東京都）。
,東京都,□,旅行代理店（営業担当）,・物価の上昇が止まらない（東京都）。
,,□,タクシー運転手,・昔と違って、夜から深夜の仕事が少なくなってきており、昼間に利用が集中している。それでいて、売上は良いため、運転手としては楽である。夜は、客が飲み屋に足を運ぶのを待つしかないが、飲み屋に活気がない。
,東京都,□,通信会社（経営者）,・機器の納品、工事等が増加傾向になっていないため、２～３か月先の景気は変わらない（東京都）。
,東京都,□,通信会社（社員）,・周年記念行事など、イベントが期待できる状況が続いている。明るさはあるものの、自信は持てない（東京都）。
,,□,通信会社（営業担当）,・景気を大きく好転させる材料が乏しいので、しばらくは現状が続く。
,東京都,□,通信会社（営業担当）,・円安等が改善されない限り、変わらない（東京都）。
,,□,通信会社（経理担当）,・値上げのニュースの際に、報道する側が景気の悪そうな人の意見を多めにクローズアップすると、全体が暗くなる。メディアは影響力がある。
,東京都,□,通信会社（管理担当）,・顧客数の減少はしばらく継続するとみている。新たなインフラ商材へのシフトのために新設エリアへの取組を行っているが、インフラ投資には時間が掛かるため即効性は低い。長期的な展望を持った対応が求められている（東京都）。
,東京都,□,通信会社（管理担当）,・円安等の影響が今後も続く可能性があり、現状維持と予想している（東京都）。
,東京都,□,観光名所（職員）,・来客数について現状維持が数か月続いている（東京都）。
,東京都,□,その他レジャー施設［ボウリング場］（従業員）,・変化をもたらすような要因がみられない（東京都）。
,東京都,□,その他レジャー施設［映画］（営業担当）,・現状でも景気は十分に悪く、短期間にこれ以上悪化するとは考えにくい（東京都）。
,,□,その他サービス［立体駐車場］（経営者）,・新型コロナウイルス感染症発生前に戻らないと、景気は良くならない。
,,□,その他サービス［保険代理店］（経営者）,・現状を打破できない。
,,□,設計事務所（経営者）,・官庁案件の入札が始まったので、ほぼ例年並みに推移するとみている。民間案件には余り期待できない。
,東京都,□,設計事務所（職員）,・急激に悪くなる傾向ではないとみているが、建築業界の慢性的な課題が解決する見込みもなく、社会情勢にも明るい話題はない（東京都）。
,,□,住宅販売会社（総務担当）,・実質賃金が上昇しないことから、住宅取得への刺激がみられない。金利上昇局面も不安要素である。
,,▲,一般小売店［酒類］（経営者）,・近々電気料金が上昇することで、ますます消費が落ち込んでいくのではないか。
,東京都,▲,一般小売店［書店］（営業担当）,・円安の影響が引き続きあり、輸入商材を中心に販売量が伸びないとみている（東京都）。
,東京都,▲,百貨店（営業担当）,・インバウンド需要は引き続き好調であることが予測されるが、エネルギーや原材料コストの上昇による各種値上がりの影響からか、比較的堅調であった母の日などのハレの日需要が食料品を中心に非常に苦戦したことなどからも、今後の国内消費は鈍化していく（東京都）。
,東京都,▲,百貨店（営業担当）,・インバウンドは引き続き前年実績の倍以上で堅調に推移する。一方で、国内消費は物価高、円安、金利上昇などの影響から購買意欲が低下し、人出や購入点数の減少、客単価の低下が続く（東京都）。
,東京都,▲,百貨店（販売促進担当）,・直近の傾向や、世の中の情勢から、やや悪くなる（東京都）。
,,▲,百貨店（企画宣伝担当）,・競合店出店の影響を半年くらいは受ける。
,,▲,スーパー（ネット宅配担当）,・エネルギー価格の上昇とともに、為替の影響による値上げが増える。
,,▲,コンビニ（経営者）,・売上等に変化はないが、アルバイトの時給を大幅に上げているため、利益はほぼゼロという状態が今後も続いていく。
,,▲,コンビニ（経営者）,・観光地等の店舗ではインバウンド等で売上が伸びる可能性はあるが、既存の住宅街やオフィス街、ロードサイドに立地する店舗においては、やはり来客数が増えていかない現状を変えていかないといけない。それにはやはり可処分所得が上がっていくことが先決である。
,,▲,コンビニ（経営者）,・６月は定額減税もあり、販売量アップを見込みたいが、客からは、減税分は貯蓄に回すという声が多い。したがって、この先も厳しい状況が続く。
