Ⅱ．景気の先行きに対する判断理由,,,,
,,□,その他レジャー施設［球場］（経理担当）,・夏休み期間となり、８月にはプロ野球の人気球団の試合が６試合開催されるほか、人気グループのコンサートもあるため、前年並みの来場者数を期待している。　
,,□,その他レジャー［スポーツ施設］（業務担当）,・金利が0.25％に引き上げられたことで、どのような影響が出るかを注視したい。
,,□,美容室（店員）,・更なる単価の上昇や、高額商材の販売が見込めるわけではないため、状況は大きく変わらない。
,,□,その他住宅投資の動向を把握できる者［不動産仲介］（経営者）,・金利の上昇で景気がどの程度減速するかにもよるが、大きな変動要因はないため、景気の変化はないと予想される。
,,□,その他住宅［住宅設備］（営業担当）,・今月の給与明細には定額減税として１万円が記載されていたが、手取額の増加はそれほど実感できず、生活が楽になることはない。
,,□,その他住宅［情報誌］（編集者）,・新築住宅におけるコストの上昇や、土地価格の高騰の動きは続く見込みであるが、海外からの需要や富裕層の動きなどで、現状からの大きな落ち込みはないと予想される。
,,▲,一般小売店［事務用品］（経営者）,・各地での災害級の豪雨で、交通機関にも影響が出るなど、全国的に問題が増えている。さらに、お盆や夏休みの関係で、余計に商品の動きは悪くなる。
,,▲,一般小売店［花］（店長）,・暑さで外出を控える動きが増える。
,,▲,百貨店（企画担当）,・８月も値上げが続く見込みである。一部の製造業などでは大幅な賃上げもあるが、大多数の企業では、物価の上昇を上回るような賃上げはできていない。消費者が生活防衛に動くのは当然であり、今後も小売業の苦境は続く。
,,▲,百貨店（外商担当）,・日米間の金利差が縮小する見込みであるため、円高の進行につながる。それに伴い、インバウンド売上もかなり落ち着くことが予想される。
,,▲,百貨店（売場統括）,・免税売上の前年比伸び率が鈍化するなか、日本の金利上昇や米国での前大統領の再登板などで、更に円高が進むことが予想されるため、更なる免税売上の減少が懸念される。
,,▲,百貨店（商品担当）,・平均気温の上昇で、９月、10月の秋物衣料の販売が年々厳しくなっている。今年の猛暑では、その傾向が一段と進んでいる。さらに、メーカー各社が在庫を持たなくなっていることで、数少ない売れ筋商品の欠品が予想されるほか、需要喚起策の効果も薄い。ひとまずは食品イベントを強化し、売場の鮮度を維持したい。
,,▲,百貨店（宣伝担当）,・これまで当県に集中していたインバウンド需要が、オーバーツーリズムの影響で周辺地域に分散することが予想される。それに伴い、広域での集客に取り組んでいるが、すぐに効果は出ることはない。また、国内客の獲得も課題であるが、市場の縮小が続くなかで厳しい状況が続く。
,,▲,スーパー（開発担当）,・中小企業の多い当地域は賃金の上昇が見込めず、景気が良いとはいえない。
,,▲,スーパー（社員）,・生鮮品価格の上昇もあり、１人当たりの買上額は何とか前年並みを維持しているが、今後は買い控えが進み、買上額の減少が予想される。
,,▲,コンビニ（経営者）,・例年７月、８月は忙しいが、９月になると一気に売上が減るため心配である。現状の好調が続くことを祈っている。
,,▲,コンビニ（店員）,・夏休みのシーズンが終わるため、旅行客が減る。
,,▲,家電量販店（店員）,・今後も良くなることはないが、円安がどこで止まるかによって、景気の回復が望める可能性はある。ただ、先行きの見通しが立たないのが現状である。
,,▲,家電量販店（企画担当）,・旅行や帰省に関する消費が増えるため、猛暑は続くとの予報であるが、家電の消費は止まると予想される。
,,▲,家電量販店（人事担当）,・酷暑に伴う気温の上昇で、外出を避ける動きが出始めたため、来客数の減少が懸念される。
,,▲,乗用車販売店（経営者）,・賃上げ効果は予想したほど出ておらず、むしろ物価上昇の影響で、個人消費が減退傾向にある。
,,▲,乗用車販売店（経営者）,・米国大統領選挙の行方や、長引くウクライナやロシアの紛争、イスラエルのガザ地区での紛争など、世界的な不安要素が解決しなければ消費の気運は高まらない。米国や日本の株価は高いが、経済の実態とはかけ離れている。
,,▲,乗用車販売店（販売担当）,・生産台数が減少している。
,,▲,住関連専門店（店長）,・当社の事業は、経済政策や為替相場の変化の影響をダイレクトに受けるため、日本銀行による金利の引上げという大きな変化が、消費者にどのような影響を及ぼすのかを注視している。特に、増えつつあった富裕客の消費に水をささないか心配している。
,,▲,観光型旅館（団体役員）,・需要の最盛期である夏が終わると、かなり閑散とする傾向となる。
,,▲,旅行代理店（従業員）,・物価の上昇により、国内旅行を控える傾向にある。
,,▲,タクシー運転手,・政府が経済対策を打ち出しているが、個人の所得が増えるようなアイデアが求められる。
,,▲,通信会社（経営者）,・今後も原価の上昇が予想される。
,,▲,通信会社（役員）,・キャリアショップの運営は、通信キャリアの設定する代理店手数料で状況が大きく変わる。直近は第２四半期以降の手数料施策が厳しく、客の購買動向よりも大きな影響を受けている。
,,▲,ゴルフ場（支配人）,・現状の入込客数は徐々に減少しており、今後もやや悪くなると予想される。
,,▲,その他サービス［学習塾］（スタッフ）,・今は中学生の受講が多いが、次のテストの結果次第では塾に移行する家庭が増えそうである。現状は掛け持ちの生徒も多く、３教科だけの受講で、割高感のある当サービスが削られると予想される。
,,▲,住宅販売会社（経営者）,・地価の上昇に調整が入るなど、市場の動きが少し冷めてくると予想される。
,,▲,住宅販売会社（従業員）,・金利の引上げによる住宅ローン金利の上昇で、返済負担の増加につながるため、消費マインドの低下が懸念される。
,,▲,住宅販売会社（総務担当）,・所得の増加が、予想したほど進んでいない。
,,▲,その他住宅［展示場］（従業員）,・建築単価の上昇傾向により、消費マインドの低下が更に加速する。
,,×,百貨店（売場主任）,・急激な円安に歯止めがかかり、インフレもやや後退しそうであるが、一旦値上げした商品が値下がりするとは考えにくい。年金受給層の客が多い、郊外店である当店では、当面は厳しい局面が続くと予想される。
,,×,衣料品専門店（経営者）,・実質賃金が減っているため、購買意欲が低下している。
,,×,衣料品専門店（経営者）,・旅行や食事会のために、服を買うゆとりがなくなっている。
,,×,家電量販店（店員）,・全体的に商品の価格が高騰するなか、やはり購入の検討期間が長期化している。
,,×,その他飲食［ジャズバー］（店員）,・暑さの影響で外出が減っているほか、物価の上昇もあって悪くなる。
,,×,住宅販売会社（経営者）,・売上の減少とコストアップの二重苦となり、先行きの見通しは明るくない。
"企業
動向
関連

(近畿)",,◎,輸送用機械器具製造業（経営者）,・取扱商品の季節特性で、人の移動が増える９月頃には需要が増える。
,,○,繊維工業（総務担当）,・日本銀行が金利を上げる方向に政策転換する期待感から、円高方向に徐々に動くことが期待される。
,,○,木材木製品製造業（経営者）,・今まで木質チップとともに、木質燃料の輸入販売も10年前から続けてきた。ただし、いつも製造業者が途中で事業を継続できなくなるなど、供給が非常に不安定で困っていたが、最近は真面目な業者が出てきた。量的にも当社が希望する数量の供給が可能であるなど、事業が安定に向かうことを期待している。後は為替の動向が大きな問題となっている。
,,○,出版・印刷・同関連産業（企画営業担当）,・イベント関連の問合せが引き続き入っているため、受注は増加が続くと予想される。
,,○,化学工業（経営者）,・業況の厳しい取引先が多いことに変わりはないが、一部の取引先では持ち直しの兆しがみられる。
,,○,化学工業（企画担当）,・食品の需要が減る時期であり、今年は特に酷暑の状況であるが、販売量は減少していない。秋の需要期には、更に販売が活発になると予想される。
,,○,広告代理店（営業担当）,・Ｗｅｂ広告、紙広告共に、売上が前年を上回る状態が続いている。
,,○,広告代理店（営業担当）,・10月以降は良い話も出てきているなど、少し改善が進むことが予想される。
,,○,経営コンサルタント,・オーバーツーリズムによる弊害をいかに防ぐかが課題であるが、観光客の消費やそれを狙う企業の投資は更に活発化している。
,,○,その他サービス業［店舗開発］（従業員）,・猛暑は例年のことであり、消費者には慣れがみられる。それに伴い、駅ナカ店舗も客足は落ちておらず、夏物商材が10月初旬までは売れると予想される。
,,□,食料品製造業（従業員）,・今後は再値上げを予定しているが、値上げが浸透しているなかで、影響は少し出ると予想されるが、現状維持は可能である。
,,□,食料品製造業（営業担当）,・連休に伴うインバウンド効果で、飲料の売上増加が期待できる一方、平日の購入は余り良くないため、全体としては変わらない。
,,□,繊維工業（総務担当）,・消費動向次第で好転が期待されるが、商品の差別化や販売方法の見直しを更に進めなければ、落ち込みを防げないため、新商品の開発に注力している。
,,□,化学工業（管理担当）,・取引先の発注見込みなどから、やや好調な状況が続くと予想される。
,,□,プラスチック製品製造業（経営者）,・市場は新規案件への移行時期でもあり、しばらくは様子見となるため、現状維持が続く。
,,□,窯業・土石製品製造業（管理担当）,・今春は賃金のベースアップが実施されたが、円安傾向のなかで物価の上昇も続いている。業界での人手不足対応も喫緊の課題となるなか、身の回りの景気は変わらないと予想される。
,,□,一般機械器具製造業（経営者）,・直近の引き合い状況は活発さに欠けるなど、景況が好転するような気配はない。
,,□,一般機械器具製造業（設計担当）,・物価の上昇が落ち着かなければ、景気動向の見極めは難しい。
,,□,電気機械器具製造業（経理担当）,・季節的に良くなる要素がないほか、消費も落ち込むことはなく、底固い印象を受ける。
,,□,電気機械器具製造業（宣伝担当）,・９月から政府の補助で電気料金が値下がりとなるが、一時的なものであるため、財布のひもは固いままとなる。
,,□,電気機械器具製造業（営業担当）,・何もかもが値上がりしており、良いことが全くない。
,,□,電気機械器具製造業（営業担当）,・大型案件がないほか、引き合い件数も少ないため、受注全体が増えていない。
,,□,建設業（経営者）,・しばらくは現状が続きそうである。
,,□,建設業（経営者）,・一部の建設資材価格の高騰や、不安定な納期、技能労務者不足が深刻な問題である。大阪・関西万博の建設工事も本番となり、国家プロジェクトとして優先的に建設資材や技能労務者が集められる可能性もある。
,,□,輸送業（経営者）,・今以上の大きな注文が入っていないため、余り変化はないと予想される。
,,□,輸送業（営業担当）,・商品の値段が下がらなければ、売れなくなっている。
,,□,輸送業（営業担当）,・お中元の運賃の値上げに伴い、商品が価格の安い物に変わった客からは、今後お中元などの贈答をやめるという声が出ている。
,,□,通信業（管理担当）,・毎月のように行われる商品の値上げで、買い控えにつながっている。ただし、気温の上昇で総菜が売れるなど、若干上向く傾向にも期待される。
,,□,金融業（営業担当）,・為替が若干円高に向かっているものの、１ドルが150円以下となるには時間を要するなど、今後も景気が良くなる見込みは乏しい。
,,□,司法書士,・変動要因が見当たらないため、状況は変わらない。
,,□,その他サービス［自動車修理］（経営者）,・物価の上昇で材料費が上がっている一方、工賃は上がらないため、厳しい状況となっている。
,,□,その他非製造業［機械器具卸］（経営者）,・いまだに商品の値上げが続いているため、値上げが落ち着くまでは、景気が前向きに動き出すことはない。
,,▲,金属製品製造業（経営者）,・自動車関連、建築土木関連共に、回復の期待が薄れている。
,,▲,電気機械器具製造業（経営者）,・半導体業界は今後も発展が予想されるが、国際情勢は先が見通せないほど不安定であるため、先行きには確信がもてない。
,,▲,建設業（経営者）,・労働時間が減少する一方、人件費は上がるという厳しい経営環境のなか、設備投資の意欲が高まるとは考えられない。
,,▲,輸送業（商品管理担当）,・夏は酒の販売が落ち着くため、売上は減少していく。
,,▲,不動産業（営業担当）,・１階の物販店舗などの撤退が続いている。ネット通販などの影響が今後も増えるなか、景気の悪化が予想される。
,,×,金属製品製造業（営業担当）,・主な原材料である、鋼材価格の値上げは認められたが、その他の労務費や資材コストの上昇については、なかなか価格転嫁が進まない。特に、自動車業界では単価の1.5％までしか転嫁を認めないという、根拠が不明な規準が横行している。このままでは実際の半分程度しか転嫁できず、採算の悪化が進む。
,,×,その他製造業［履物］（団体職員）,・インフレによる買い控えが影響し、市場の動きが鈍い。
"雇用
関連

(近畿)",,◎,人材派遣会社（支店長）,・大阪・関西万博関連の求人が、徐々に動き出している。
,,○,人材派遣会社（管理担当）,・少なくとも大阪・関西万博までは、現状が継続する。
,,○,人材派遣会社（支店長）,・下期に入れば、状況は少し変わると予想している。
,,○,人材派遣会社（営業担当）,・お盆明けには求人に動きが出てくることで、求職者も動きそうである。
,,○,職業安定所（職員）,・７月の求人の申込数が、前年の２割近く増えている。
,,○,民間職業紹介機関（営業担当）,・秋冬のインターンシップ等のプログラムに向けた動きが増える時期となるため、イベントの出展や広告掲載が増えると予想される。
,,□,人材派遣会社（役員）,・政局が景気に影響する可能性があるが、その時期はもう少し先になりそうである。
,,□,人材派遣会社（営業担当）,・事務系の求職者数は多いが、企業からの求人は少ない。その一方、スペシャリスト求人はこれから給与が増加し、求人も増えていくと予想される。
,,□,新聞社［求人広告］（営業担当）,・米国大統領選挙やパリオリンピックなど、大きなイベントがあることで世界的に景気が不安定になっている。一方、国内ではインバウンド需要の増加が最高潮となっている。それ以外に上向き要素は見当たらないが、インバウンドが減少しない限り、特に３か月後も状況は変わらないと予想される。
,,□,新聞社［求人広告］（担当者）,・関西企業からの新聞広告やデジタルメディアへの出稿は、現状とほぼ変わらない水準を見込んでいる。
,,□,職業安定所（職員）,・６月の新規求職者数は前年比で減少となった。ただし、配置転換や就労時間の変更、体調不良などで転職を検討する、在職中の新規登録者が増えている。
,,□,職業安定所（職員）,・企業の人手不足感は依然として強い。高齢者による就職への意欲は強いが、企業の需要と合わないミスマッチの状況が続いており、採用にはつながらない。
,,□,職業安定所（職員）,・一定の求人数はあるものの、求職者数が減らないため、状況の変化はないと予想される。
,,□,民間職業紹介機関（職員）,・厳しい人手不足から求人数が増える可能性はあるが、受注の動きが鈍い傾向は続きそうである。
,,□,学校［大学］（就職担当）,・企業の早期採用気運は感じられるが、採用者数は大きく変わっていないため、景気に特段の変化はない。
,,□,学校［大学］（就職担当）,・企業の人手不足は深刻であり、２～３か月程度では変わらない。
,,▲,学校［大学］（就職担当）,・新型コロナウイルス感染症のワクチン接種にかかる費用負担がばかにならない。高齢者の負担は大変であり、政府の新型コロナウイルス感染症対策も再構築が求められる。
,,▲,その他雇用の動向を把握できる者,・政策金利の上昇により、企業の借入れコストに影響が出る。
,,×,＊,＊
,,,,
　９．中国（地域別調査機関：公益財団法人中国地域創造研究センター）,,,,
,,,,（－：回答が存在しない、＊：主だった回答等が存在しない）
分野,,景気の先行き判断,業種・職種,景気の先行きに対する判断理由
"家計
動向
関連

(中国)",,◎,＊,＊
,,○,一般小売店［洋裁附属品］（経営者）,・今より少し涼しくなれば、外出する人が少しずつ増加する。
,,○,百貨店（広報担当）,・高額品の動きが引き続き堅調であり、夏ボーナス、今春の賃上げ効果が徐々に出てきていると見受けられる。また、８月から10月には政府による電気・ガス代の補助金が再開するため、景気はやや良くなるとみられる。
,,○,百貨店（売場担当）,・秋からの行楽や外出シーズンは、前年より良い状態で迎えられると予想する。大手米国紙で行きたい街として選ばれ、良いシーズンを迎え、ますます人流が活性化する。
,,○,スーパー（業務開発担当）,・季節要因が大きく、暑くなれば、調理に時間を掛けない総菜や冷麺・そうめん類、水分を多く含むスイカなどが前年より早く伸びてくる。
,,○,家電量販店（店長）,・季節商材と旅行関連の動きが良い。
,,○,乗用車販売店（営業担当）,・生産停止の解除、商品改良、新型車発売など、景気に関する前向きな要素が増えている。
,,○,乗用車販売店（営業担当）,・ここ数か月の景気の状況が良かったため、現在は逆風を受けているが、策を打って乗り切りたい。今後の市場の景気状況に期待している。
,,○,高級レストラン（事業戦略担当）,・予約状況が良い。
,,○,一般レストラン（経営者）,・夏のボーナス支給後は少し景気が良くなると考えられるが、物価高もあるため、良い状況は長くは続かない。
,,○,バー（経営者）,・景気が徐々に回復している傾向がみられる。
,,○,都市型ホテル（宿泊担当）,・レジャー客の動きが活発になる見込みであり、インバウンドの増加に期待している。
,,○,都市型ホテル（総支配人）,・夏場の猛暑予想により足元は伸び悩むが、例年10月以降はＭＩＣＥのシーズンを迎え、先行予約も堅調に推移している。また、来年秋のテレビドラマの主人公が当地にゆかりのある人物に決定したため、今後の露出の高まりによる観光需要の増加を期待する。
,,○,旅行代理店（支店長）,・団体旅行は国内を中心に若干受注が増加する見込みだが、個人旅行の秋需要回復に期待する。
,,○,テーマパーク（営業担当）,・猛暑で閑散期に入るが、中学生以下の無料化開始で平年以上を見込む。
,,○,テーマパーク（業務担当）,・秋からアウトドアシーズンに入り、週末の予約は上々である。雨予報が出ない限り、来客数は前年並みとなる。
,,○,観光名所（観光振興担当）,・９月から３か月間イベントをする。
,,○,設計事務所（経営者）,・来場者数の増加が見込めるため、景気は少し良くなる。
,,□,商店街（代表者）,・商店街に出店問合せが増えてきている。新しい業種や商店街になかった年齢層の集客につながる店舗が増えると街の雰囲気も変わるかもしれない。最近、飲食店の開店があったので、それに期待する。
,,□,商店街（理事）,・天候不順が続き、景気が良くなる材料が余りないため、厳しい状況が続く。
,,□,一般小売店［食品］,・販売数量と来客数は減少しているが、単価が上昇しているため現状維持の状況が続くとみられる。
,,□,一般小売店［茶］（経営者）,・先行きは不安である。
,,□,百貨店（広報担当）,・特に景気が改善する要因が見当たらない。
,,□,百貨店（営業担当）,・メーカーは売上がかなり増えないと、多くの商材を製造できない。期間限定で開設される店で一時的に売上が増加しても、既存ブランドの売上が増加しないため厳しい。
,,□,百貨店（営業担当）,・物価高の影響もあり、しばらくの間、景気に回復の見込みはないとみられる。本当に必要な商品しか購入しないという客の意識は変わらない。
,,□,百貨店（営業担当）,・景気に明るい兆しがみえない。
,,□,百貨店（外商担当）,・今後も特に大きな変化はなく、前年並みで推移する。
,,□,百貨店（売場担当）,・減税やボーナス支給などで、消費マインドが高まる方向になるはずだが、客単価や販売金額になかなか反映していない。当面はこの傾向が続く。
,,□,百貨店（総務・経理担当）,・現段階で景気が良くなる特殊要因は見当たらない。
,,□,スーパー（店長）,・ようやく来客数が前年を上回ったが、今後は現状を維持するのが精一杯である。
,,□,スーパー（店長）,・秋にパート賃金の上昇があるが、物価上昇もあり景気が回復するとは考えにくい。
,,□,スーパー（店長）,・前年よりは、回復傾向となる見通しもあるが、基本的な部分の来店頻度は変わらないとみられる。猛暑による影響がどちらに転ぶかは不明だが、大幅に回復する要因は現状では見当たらない。購入が低単価の商品に集中しても、点数の増加にはつながらないとみられる。
