Ⅱ．景気の先行きに対する判断理由,,,,
,,▲,スーパー（店長）,・まだまだ商品値上げに関する要請があり、消費者の生活防衛意識が更に高くなる。
,,▲,スーパー（店員）,・担当カテゴリーでの商品値上げを控えている。
,,▲,スーパー（店員）,・円安の影響で７月から値上げする品数が多く、例えばバナナの仕入価格も上がる。夏野菜は梅雨の影響をどう受けるか予測しづらい。景気にとって良い材料を探すことが難しい。
,,▲,スーパー（総務）,・円安の影響が１番大きい。
,,▲,コンビニ（エリア担当）,・電気・ガス価格激変緩和対策事業費補助金など根本的な改善には至らない施策では現在の停滞感は拭い去れず、消費活発化にはつながらない。
,,▲,コンビニ（店長）,・原材料価格の高騰や円安が続けば物価高も継続し、節約志向がより高まる。ただし、飛び抜けて高単価か低単価の商品は、影響を受けず好調が見込まれる。
,,▲,家電量販店（店員）,・高単価な商品の比率が落ちてきている。
,,▲,乗用車販売店（販売担当）,・円安が進んでおり車両価格も値上げが続いている。買い控える客がかなり増えている。
,,▲,乗用車販売店（営業担当）,・新型車種の発表を控えているが、車両生産が再開して供給されるのが３～４か月先で、その間の売上が立たない。また、飽くまで予定のため、今までの例もあり実際に生産が開始されるまで不安は拭えない。
,,▲,一般レストラン（経営者）,・洋酒等が品不足で、店頭にあってもとても購入できる価格ではなくなっている。このまま円安が続けば、更にひっ迫する。
,,▲,その他飲食［仕出し］（経営者）,・目先の明るい材料がないと、生活防衛策で買い控えが続く可能性が高い。
,,▲,観光型ホテル（経営者）,・夏休みで国内消費や旅行がどれだけ盛り上がるかに懸かっているが、予約状況をみる限り余り良くならないと予測する。何らかの景気対策がなければ落ち込んでいく。
,,▲,都市型ホテル（従業員）,・予約数からやや悪くなると判断する。
,,▲,通信会社（企画担当）,・インフレの進行もあるが、明るい未来を予感できる社会や政治でなければ、景気も良くなっていかない。
,,▲,テーマパーク（職員）,・円安の止まる兆しがないため、飼料など外国産に頼っている物が高くなる。
,,▲,理美容室（経営者）,・客の話から、徐々に物価が上がって生活が苦しくなっている様子がうかがえる。
,,▲,その他サービス［介護サービス］（職員）,・福祉用具レンタル商材の仕入れにおいて、主力メーカーより秋から値上げの案内があった。介護保険サービスの福祉用具貸与では上限価格が定められているため、こうした値上げに対しては身を削るしかなくなっている。
,,▲,設計事務所（職員）,・円安に対する対応が全くできておらず、先の見通しが立たない。
,,▲,住宅販売会社（従業員）,・高齢で仕事量の減少を機に廃業する下請職人が増えたら、要望される仕事ができなくなる可能性が出ている。
,,▲,その他住宅［住宅管理］（経営者）,・建築材料の値上がりがこの先は落ち着くのか、まだ高騰が続くのか分からない。仕事は取りたいが、人件費も上がっているため薄利多売ともいかない。なかなか経済がうまく回っておらず、先行きが心配である。
,,×,コンビニ（店長）,・新たに近隣でドラッグストアが２店鋪できる予定である。過当競争は免れない。
,,×,住宅販売会社（経営者）,・住宅ローンの金利が上がると毎月の支払額が大きくなり、売行きが悪くなる。
"企業
動向
関連

(東海)",,◎,－,－
,,○,電気機械器具製造業（企画担当）,・人手不足感があり収入も増えていく期待がある。ただし、外国人労働者を増やして人件費が抑えられるようならば、消費が伸び悩んで景気は回復しないのではないか。
,,○,輸送業（エリア担当）,・高齢化が進み、取扱分野の配送需要はまだまだ伸びていく。しかし、燃料単価の上昇や物価上昇に対して配送単価を見直す仕組みがまだできていない。
,,○,金融業（従業員）,・円安がますます進みインバウンドが増えて、日本人よりも外国人が経済を回す印象が強い。特に観光地や飲食店では、外国人相手の商売で景気が良くなる動きがこの先も数か月は続く。
,,○,不動産業（経営者）,・今後は曇りや雨の日が多くなりそうであるが、外出や遠出をする人は少しずつ増加していく見込みである。今後の売上は増加し、前年を上回る状況になっていくと予測する。
,,○,会計事務所（職員）,・夏のボーナス支給額が前年と比べ増額している。
,,○,その他非製造業［ソフト開発］（経営者）,・円安の進展が話題になっているが、怖がる必要はなく我が国の競争力が高まると考える。円安はそのうちに収束する。当面は海外への投資に高い税率を掛け、金の流れを抑制する必要がある。
,,□,パルプ・紙・紙加工品製造業（顧問）,・円安が更に進むと、諸物価も更に高騰して全ての業界に大きく影響する。悪い景気のまま変わらず推移する。
,,□,化学工業（営業担当）,・半導体向け電子材料薬液は緩やかな回復傾向にある。２か月から３か月後も同水準の見込みである。
,,□,化学工業（総務秘書）,・特段景気に悪影響のある要因はない見通しである。人手不足で採用は売手市場となるなか、高卒の採用も増えており、労働市場も良い方向に進んでいるようにみえる。
,,□,窯業・土石製品製造業（社員）,・新しい伸びを感じる要素はないが、大きな落ち込みも取引先にはなく、現状維持が続きそうである。
,,□,金属製品製造業（従業員）,・今年度はしばらく発注が活発化しないとの話を聞く。そのなかで受注時に原材料の価格転嫁が進むかどうかが業績の鍵となる。
,,□,一般機械器具製造業（営業担当）,・有望な引き合いは少なくないが、引き合いから受注に至るまでの時間が長くなっており、この傾向が改善する兆しはみられない。
,,□,一般機械器具製造業（経営管理担当）,・受注量や販売量の見込みによる。
,,□,電気機械器具製造業（営業担当）,・しばらくは現況が続くと見込まれる。
,,□,電気機械器具製造業（経営者）,・新規問合せ等もなく、受注量は横ばいが続いている。
,,□,輸送用機械器具製造業（品質管理担当）,・材料価格の高騰と人材を募集しても集まらない２つの問題がある。
,,□,輸送業（経営者）,・足元の物価高に加え、将来への不安から日用品から自動車や住宅まで幅広く消費が上向いていない。
,,□,輸送業（従業員）,・物価上昇を肌で感じ、その影響で実質賃金の減少が続くなか、景気が上向く感触はない。
,,□,輸送業（従業員）,・このところ同業他社の廃業をよく聞く。燃料代、各資材費や人件費等の上昇で利益率が良くなる材料はない。業界内ではしばらく淘汰が続きそうである。
,,□,輸送業（エリア担当）,・受注の変化などが見込めない。
,,□,輸送業（エリア担当）,・物の流れとして、原材料が動き始めて生産過程に入り、中間消費財を経て最終的に消費者の手元へ届く商品となるまでには時間が掛かる。現時点で生産材料が動いていないところをみると、経済が活性化するとは考えられない。
,,□,通信業（法人営業担当）,・円安は止まらず、インバウンド向けのスポット商売ばかりが潤い、地に根を張る産業は衰退傾向にある。地に根を張りつつ海外市場に打って出られるコンテンツを持った企業しか、業績は伸ばせない。
,,□,通信業（法人営業担当）,・庶民の生活に、物価高は統計上の数字よりもかなり大きな負担となり厳しくのしかかっている。仕事の上でも影響している。
,,□,金融業（従業員）,・夏休みシーズンに向け、観光客の動きは活発化する。
,,□,金融業（企画担当）,・大手企業だけでなく中小企業も含めて広く賃上げが浸透しないと、個人消費の伸びも限界があり、景気は良くならない。
,,□,広告代理店（制作担当）,・今年の夏も猛暑になるという予報もあり、夏からの各イベント企画に余り積極的ではない企業も出てきている。
,,□,公認会計士,・電気・ガス代への補助金などが再開予定で、原材料価格高騰の抑制にやや効果が見込まれ一時的に回復傾向となる。梅雨入りが遅く天候の影響も少ないことが予想されるため、個人消費も引き続き活発であると予想される。しかし、円安や金融政策の影響で金利上昇により、借入に対する利息の支払が増える中小企業も多くなると予想される。
,,▲,食料品製造業（営業担当）,・受注量、販売量共に減少傾向にある。
,,▲,電気機械器具製造業（経営者）,・客先業界の特徴で、お盆過ぎは一時的に設備投資が減り年末に向けて再び回復する。９月から10月は需要が少なく売上が落ちる。
,,▲,輸送用機械器具製造業（管理担当）,・円安やガソリン代の高騰が続き、減税効果もなくなって景気は悪化する。
,,▲,建設業（役員）,・７月から８月は夏休みで行楽が優先され、時季的にも梅雨と猛暑で客の動きが鈍くなり集客が厳しい。成約は伸びない見込みである。
,,▲,建設業（経営者）,・景気の良しあしは、日本をひっぱるリーダーに懸かっている。
,,▲,建設業（営業担当）,・今年度内の予算は決まったなかで増えることはない。それ以外で、世の中で景気が良くなって新たな何かが出てくるような状況は全くみえない。
,,▲,通信業（総務担当）,・定額減税が開始されたが、手取り増加分のインパクトが全くないため、景気を上向かせる発端にならなかった。７月以降は所得税減税はないため、住民税減税のみでは景気対策としては焼け石に水であり、全く購買意欲が奮起されない。
,,▲,行政書士,・現状が続く見込みである。
,,▲,会計事務所（職員）,・円安が再び加速し物価が更に高くならないか不安視する。商材によっては以前と比べ1.5倍から２倍になっており、これ以上値上げが続いても販売価格には転嫁し切れず、利益が削減される状況となる。
,,×,鉄鋼業（経営者）,・良くなる要因がない。賃上げ幅や額を大企業が公表することで中小零細企業では人材の離職率が上がる。人手不足が更に進めば、受注減もあいまって零細企業はいよいよ立ち行かなくなる。
,,×,金属製品製造業（経営者）,・引き合いの減少が続いており、今後更に落ち込むことが予想される。
,,×,一般機械器具製造業（経営者）,・夏までは現状のまま悪く、秋冬からの回復に期待したい。
,,×,新聞販売店［広告］（店主）,・折込チラシの値上げをしたが、受注量が減って売上の増加に寄与していない。
"雇用
関連

(東海)",,◎,－,－
,,○,新聞社［求人広告］（営業担当）,・自治体が中心となる大型催事が予定されているため、県内企業にとっては期待感がある。
,,□,人材派遣会社（社員）,・夏季イベントの予約が好調である。
,,□,人材派遣会社（営業担当）,・ふだん生活するなかで景気が良くなると期待できるような話題が見当たらない。
,,□,人材派遣会社（営業担当）,・周辺メーカーの採用について、40代を採用するなど採用基準の拡大がみられ、設計開発の領域での人材ニーズは底堅い。
,,□,アウトソーシング企業（エリア担当）,・大手自動車メーカーの不正問題の影響が残り、確定計画比ではマイナスとなる。人気車種の生産は６月中旬に再開されたが、部品製造各社においては稼働日が少ないため、生産停止による台数減少の影響が大きい。
,,□,新聞社［求人広告］（営業担当）,・夏に向けて電力などエネルギー価格の高騰が予測され、企業においては対応が求められそうである。今後の景気は現在の状況と余り変わらないと考える。
,,□,職業安定所（所長）,・大手自動車メーカーの不正問題や物価高騰の影響により企業業績は好調とはいえないものの、悪化するほどではない。
,,□,職業安定所（職員）,・定額減税は実施されたものの、景気回復の兆しはみられない。物価高騰による生活者への影響や中小企業においては原材料価格の高騰等で厳しい経営のなか人手不足も継続しており、まだしばらくは様子見の状態が続く。
,,□,職業安定所（職員）,・企業の採用意欲は高いが、特に給与や休暇など求職者側の求める条件でミスマッチが続いている印象を受ける。
,,□,職業安定所（職員）,・円安の動きがどこまで加速するかによる。景気に対する影響が総合的にプラスかマイナスのどちらに振れるか判断が難しい。
,,□,職業安定所（雇用開発担当）,・円安等が継続し、当面は足元の状況が続く見込みである。
,,□,民間職業紹介機関（窓口担当）,・会社としては、来年の大阪・関西万博へ向けての動きも活発になり、多方面での事業のうち派遣業以外は軒並み好調であるが、派遣業については大きな変動がない時期である。
,,□,民間職業紹介機関（営業担当）,・有用な人材獲得への企業側の投資はより活性化する。個人の動きには大きな変化は見込めないが、賃上げ等による給与改善により応募求人の選別は一層色濃くなると推察する。
,,□,学校［専門学校］（就職担当）,・県内では前年より早期化していた医療系の採用状況も一段落し、２次、３次募集も落ち着いている。前年以上に早い内定事情はあるが、トータルの採用人数にはさほど変化はなかった。
,,□,学校［大学］（就職担当）,・新卒求人については年度で計画を立てているケースが大部分であり、２～３か月のスパンでは計画数に変動がない。
,,▲,人材派遣業（営業担当）,・定額減税や電気・ガス代への補助金の効果は実感されることはなく、消費につながる可能性は少ないと見込んでいる。
,,▲,人材派遣会社（営業担当）,・人材派遣では求人要件を満たす人材が不足しているため、採用数は減少傾向にある。
,,▲,職業安定所（職員）,・有効求人数は前年同月比で２か月連続増加したものの、増加要因は主に官公需に関する清掃や警備などサービス業の求人で、製造業や運輸業等では増減を繰り返している。飲食業、宿泊業や卸売・小売業では減少がみられる。
,,×,人材派遣会社（社員）,・人材の集客難を解消できる材料が見つからない。
,,,,
　７．北陸（地域別調査機関：一般財団法人北陸経済研究所）,,,,
,,,,（－：回答が存在しない、＊：主だった回答等が存在しない）
分野,,景気の先行き判断,業種・職種,景気の先行きに対する判断理由
"家計
動向
関連

(北陸)",,◎,－,－
,,○,商店街（代表者）,・能登半島地震からクローズ状態であった美術館が６月22日に再開した。観光のキラーコンテンツの復活によって、多くの日本人観光客が戻ることを期待したい。
,,○,百貨店（売場主任）,・新紙幣の発行により各家庭のタンス預金が流通し、消費に回ると見込んでいる。本年のお盆休み期間は最大９連休となるが、円安により国内旅行を計画する人が増える見込みである。
,,○,コンビニ（店舗管理）,・現状が異常値だとみているため、ここまで悪い状態がこのまま続くとは考えにくい。
,,○,衣料品専門店（経営者）,・今まで控えていた投資が多少回復傾向にあり、今後の施策に弾みがつくと考える。
,,○,衣料品専門店（経営者）,・売上増加を見込める店舗数が徐々に増えている。
,,○,乗用車販売店（総務担当）,・夏のボーナスの時期が定額減税の実施と同時期となり、一時的に消費者の消費意欲が刺激されるとみている。
,,○,その他小売［ショッピングセンター］（統括）,・購買率も上昇しており、直近２～３か月先までの購買行動には期待が持てる。ただし、水道光熱費や生活必需品の値上げ等、生活に係るコスト変動の影響については継続して注視していく。
,,○,パチンコ店（経理）,・パリオリンピックの開催で気持ちが高揚することや、定額減税によって僅かではあるが手取りが増える人も出てくることから、やや良くなると考える。
,,○,競輪場（職員）,・定額減税により可処分所得の増加が見込まれる。
,,□,商店街（代表者）,・高層マンションの建設など街中の定住人口の増加を期待していたが、売行きは芳しくないようである。ホテル建設に変更の動きも出てきているが、街の観光地化が進んでいくのか疑問である。
,,□,商店街（代表者）,・大きなイベントもないため人通りは少なく、週末の駐車場の空きが目立っている。
,,□,一般小売店［精肉］（店長）,・ここ３か月はデイリー商材については、ほぼ横ばいである。仕入価格が上がっているため、売価も上げなければならない状態が続いており、この状態がずっと続くのではないかと考える。
,,□,一般小売店［書籍］（従業員）,・このところずっと良くなる要素がない。
,,□,百貨店（販売促進担当）,・猛暑や夏休みなど集客企画に工夫が必要だが、帰省客を対象としたランドセルの早期予約企画や、富裕層向けにラグジュアリーブランド企画の誘致など、良品や高額品といったものは衣食住それぞれで反応があるため、継続していくつもりである。
,,□,百貨店（販売担当）,・セールが始まり、価格面では１年ほど前の定価に匹敵する価格になるため、購入の増加を期待しているが、当面はギフトも含め購入には慎重になるとみている。さらに、来月以降も衣料や雑貨商材の値上げが続く。旅行需要の増加は期待しているが、旅行商品の購入が増えることで、衣料やバッグなどの事前の商品購入は期待薄だと考える。当面、やや厳しい状況が続くとみている。
,,□,スーパー（店長）,・買上点数の変化もなく、客単価は物価高で勝手に上がっている状態であり、それほど変化はないとみている。
,,□,スーパー（仕入担当）,・販売単価の高騰は長期間続くとみている。現在の相場状況が続くとみられ、今後、利益確保のため価格で対応することは考えにくい。
,,□,スーパー（経営企画）,・物価高騰による節約志向のマインドが続くとみている。
,,□,衣料品専門店（経営者）,・食品の値上げなどが続いている。実質賃金の低下は生活防衛の心理的な重しにつながっている。
,,□,家電量販店（店長）,・電気代への不安から必要な分の購入しかしないとみている。買換えもせず、渋い販売数となりそうである。
,,□,家電量販店（本部）,・気温による影響が大きく、暑さが長引くことを期待している。電気代の補助も復活していれば、景気は悪くなることはないが、良くなることもないと考える。
,,□,乗用車販売店（経営者）,・地方都市では給与が増えたとの話は余り聞かない。消費そのものがしばらくは増えないとみている。
,,□,乗用車販売店（従業員）,・購入に対して慎重になっているようでなかなか販売につながらず、大きな変化はない。
,,□,乗用車販売店（役員）,・売上が急に増える状況ではない。
,,□,住関連専門店（役員）,・政治不安、社会不安など総合的に見れば決して安心はできず、まだまだ厳しい状態が続くと考える。
,,□,その他専門店［酒］（経営者）,・円安が続いており、我が国の経済力が弱まった状態が続いていると考える。日本全体がそのような状態であり、自分の周囲の経済も引き続き良くならない。
,,□,高級レストラン（スタッフ）,・能登半島地震からの復興や支援を目的としたメディアの特番や、人気の店や商品の紹介などでの露出が増えたこともあり、県外からの旅行客が増加している。ただし、地元客は減少しているため、景気が良いというわけではない。
,,□,一般レストラン（店長）,・北陸新幹線の延伸効果も余りなく、劇的に良くなる要因がない。
,,□,一般レストラン（統括）,・円安、物価上昇、天候不順による農作物不作のための価格高騰など、悪条件が多くある。
,,□,スナック（経営者）,・物価が上昇し、年金生活者や経営者などにますます影響が出てくるとみているが、当店では恐らく現状維持だと考える。
,,□,観光型旅館（経理）,・営業再開時期は未定である。
,,□,都市型ホテル（スタッフ）,・宿泊部門は国内の団体旅行客が回復していない。レストラン部門もメニュー単価の上昇で来客数が伸びない。
,,□,旅行代理店（従業員）,・忙しい割に金額的には変わらない状況である。2024年問題とインバウンド急増の影響で貸切バスやホテルなどを探すのに苦労している。
,,□,タクシー運転手,・北陸新幹線が敦賀まで伸びたため、観光客が増えている。インバウンドもまだ増えると考える。
,,□,タクシー運転手,・タクシー台数が少ないということで、従業員を増やすなど対策したものの逆に利用者が減っている。物価高のあおりを受け、乗り控えが出始めている模様である。
,,□,通信会社（職員）,・変化する要素が見当たらない。
,,□,通信会社（営業担当）,・来客数、販売量共に大きな変化がみられない。景気が良くなる要因が見当たらない。
,,□,通信会社（営業担当）,・ここ２～３か月は今の状況が続くとみている。
,,□,通信会社（役員）,・ここ数か月続いているが、競合他社との競争が激しく、今後２～３か月先も同様に契約者数が前年同期と比べて若干下回る数字で推移するものと考える。
,,□,通信会社（役員）,・景気が変動する要因が見当たらない。
,,□,テーマパーク（役員）,・３か月先の予約状況をみても前年並みに推移しており、変わらない状況が続くと考える。
,,□,その他レジャー施設［スポーツクラブ］（総支配人）,・世の中は値上げラッシュで、生活が楽になりそうだと思える状況が客の様子から見られない。
,,□,美容室（経営者）,・６月から始まった定額減税の話題が、客との会話でほぼ出なくなっている。
