Ⅱ．景気の先行きに対する判断理由,,,,
,,▲,コンビニ（エリア担当）,・実質賃金の低下、金利のある世界の到来により景気の悪化が予想される。コンビニ経営者は、最低賃金が50円上がることによって月５万円ほど負担が増して苦しくなる。
,,▲,衣料品専門店（販売企画担当）,・余りの暑さで、出足が悪くなっている。
,,▲,家電量販店（営業担当）,・季節商材が落ち着いて、パリオリンピック等のイベントもなくなるため、今月と比べれば悪くなる。
,,▲,乗用車販売店（経営者）,・大手自動車メーカーの不正問題で納期の遅れや受注停止などが起きており、販売動向や客対応にも影響が出てくる。
,,▲,乗用車販売店（経営者）,・法改正に対応するため再び生産が一時的に止まる。ＣＭもいまだ流れておらず、厳しい状況は続く。
,,▲,乗用車販売店（従業員）,・年末までは人気車種の多くで販売できない状況が続く。円安の影響でメーカーが国内生産の車を海外向けに回しているうちは、国内販売量は増加しない。
,,▲,乗用車販売店（販売担当）,・新型車種がデビューしたが、車両本体価格も大きく上がっており、ローン金利も高くなっているため客への販売促進が余りうまくできていない。
,,▲,乗用車販売店（営業担当）,・新型車発売の情報が公式に出ているにもかかわらず、新規の来客数が増えていない。例年受注の落ちる８月から新型車が発売される秋までは、厳しい状況が続きそうな気配である。
,,▲,その他飲食［ワイン輸入］（経営企画担当）,・前年の春から値上げを行ってきたが、今年９月にも値上げを行う。今度の値上げは消費者の買い控えを招くのではないかと危惧している。
,,▲,観光型ホテル（経営者）,・９月、10月の予約状況をみると、団体客の動向が今一つ伸びていない。人件費や資材、仕入価格上昇分の価格転嫁が進んでおらず企業の業績が余り芳しくないことから、団体旅行の需要が停滞気味であると考える。
,,▲,都市型ホテル（従業員）,・予約数から判断した。
,,▲,旅行代理店（営業担当）,・給与所得が増えない以上、我慢も限界に近づいている。今後、自然災害や感染症流行等の外的要因が新たに発生すると、旅行需要が減少又は激減する可能性がある。円安でインバウンドは好調だが、減少要因の発生で一気に展開が変わる可能性がある。
,,▲,観光名所（案内係）,・まだ値上げが続くようで、決定的な痛手になりそうである。
,,▲,パチンコ店（経営者）,・収入が余り変わらない一方で支出が多い。増税が控えているという話もあり、財布のひもも固くなる。新紙幣の対応にかなりの設備投資をしてきたが、すぐに回収できるわけもなく、長期間の我慢が強いられる。
,,▲,理美容室（経営者）,・客からは物価ばかりが上がり給料は増えないという声を聞く。
,,▲,美容室（経営者）,・最近再び新型コロナウイルスの新規感染者数が増加していることで、客足が遠のいている。
,,▲,その他サービス［介護サービス］（職員）,・仕入先より10月からの値上げ案内が届き始めた。福祉用具貸与事業に関する介護報酬は今年４月に上限価格が引下げ改定されている。利益確保に一層苦労する見込みである。
,,▲,設計事務所（経営者）,・現時点で新規の案件依頼は来ていないため、先は見えない。
,,▲,設計事務所（職員）,・為替相場の動向が影響する。景気が良くなるような話はない。
,,▲,住宅販売会社（経営者）,・建築資材の値上がりと暑さが大きな要因である。
,,▲,住宅販売会社（従業員）,・夏枯れの時期である。イベントによる来場者は増えるが、契約は厳しくなる見込みである。
,,▲,その他住宅［住宅管理］（経営者）,・今年も花火大会の手伝いをしたところ、なかなか寄附金が集まらず地場産業の深刻さがうかがえる。このところ経済格差が感じられるようになり、この先の地元産業が心配である。
,,×,コンビニ（商品企画担当）,・秋以降、円安や異常気象等による原材料の値上げに伴い商品単価の更なる値上げが避けられない状況となる。想定を大幅に上回る販売価格の設定は避けられず、消費が冷え込むと予想する。
,,×,一般レストラン（経営者）,・物価高が大きく影響する。
,,×,住宅販売会社（従業員）,・大手だけでなく中堅の工務店や建材問屋も表情が暗い。
"企業
動向
関連

(東海)",,◎,－,－
,,〇,窯業・土石製品製造業（社員）,・生産能力を増加できたため積極的に拡販活動を行っており、徐々に成果が出始めている。
,,〇,一般機械器具製造業（営業担当）,・北米での半導体製造への投資は盛んに行われているため、電子部品への設備投資も増えてくると予測する。
,,〇,不動産業（経営者）,・今後は前年同様に晴れの日が多くなる予報で、外出や遠出をする人は増加する見込みである。今後の売上は増加し前年を上回る状況と予測する。
,,〇,その他非製造業［ソフト開発］（経営者）,・少し円高に向かい、多くの人がホッとしている。このまま１ドル120円までいけばよいが、なかなか安心はできない。バブル景気末期のように金利が高くなって国内景気がダウンしないよう、国の経済対策に期待する。
,,□,食料品製造業（経営企画担当）,・猛暑後に残暑が長引くことで、秋冬商材への移行がスムーズに行われるか懸念している。
,,□,パルプ・紙・紙加工品製造業（顧問）,・円安が止まらず物価は上昇し続けている。自動車関連の動向も心配な状況であり、景気は今の悪い状態のまま推移する。
,,□,化学工業（営業担当）,・半導体向け電材需要は、年内の大きな需要回復は見込めない。米国大統領選挙の結果によっては貿易摩擦等が発生するリスクがあり、先行きが不透明である。
,,□,化学工業（総務秘書）,・円安が一服し、金利がある世の中に向かっていることは、直ちに景気への影響があるわけではないが、少なくとも悪化要素ではない。全国的な賃上げの実現が心理的に寄与している。
,,□,金属製品製造業（従業員）,・慌ただしい状況が続くのか、それとも落ち着いてくるのか、業者間でも見方が分かれている。少なくとも好転していくとまでは思えない。
,,□,一般機械器具製造業（経営管理担当）,・受注量、販売量の見込みから判断した。
,,□,電気機械器具製造業（企画担当）,・現在の社会状況が続けば、業績は安定して推移する。
,,□,電気機械器具製造業（経営者）,・物価の上昇が目立ち収入はそれに伴っておらず、景気は落ち込む見込みである。ただし、若干海外向けの動きはあるため、３か月先は微妙な時期になる。
,,□,輸送用機械器具製造業（管理担当）,・酷暑は続き、物価も上がり家計に余裕がない。
,,□,建設業（役員）,・住宅に関しては、国の省エネ基準であるＺＥＨなどが今後厳しくなるためコストアップにつながる。販売価格がますます上がるため、客の購入意欲への影響が心配である。
,,□,輸送業（経営者）,・消費者の節約志向は継続する。
,,□,輸送業（従業員）,・同業他社の経営状況に関して余り良くない話が入ってくる。荷量は思ったほど伸びておらず、2024年問題、燃料価格の高騰や人手不足など、特に中小の運送業者にとっては余り良い雰囲気ではない。先行きが不透明である。
,,□,輸送業（従業員）,・これといった景気対策がない。実質賃金も下がり、個人消費は低迷したままである。
,,□,輸送業（エリア担当）,・国内外を問わず経済的に上向きになりそうな指標が見当たらない。それに加えて日々の業務に携わるなかでも大きなプロジェクトや新規の案件がほとんどない。
,,□,輸送業（エリア担当）,・運送単価は２年ほど前に１度若干上がったが、１度上げたことで荷主は今後上げる意思がないと感じる。同業他社が安値でも引き受けるため、運賃値上げは賃上げのようにはなかなか進まない。
,,□,通信業（法人営業担当）,・地元では国道バイパス工事など、若干好景気とみられるところもあるが、住宅着工数が少ないなどいろいろな面でまだ景気は今一つと実感する。生活者の様子は物価の動きに非常に敏感で、家計に関わる景気の悪化がうかがえる。
,,□,広告代理店（制作担当）,・秋に向けてのイベント等は、暑さが和らげば問題なさそうだが、再び少しずつ新型コロナウイルスの新規感染者数が増え始めているのが気になる。
,,□,行政書士,・現状維持である。
,,□,公認会計士,・人手不足や利上げなど、企業が投資を控える要因がまだ続く。猛暑や物価高騰により、個人消費もしばらくは停滞が予想される。政府による光熱費補助金施策が家計へプラスに働く要素もあるが、大幅な改善はされない。利上げが続くと、借入れを行っていた中小企業などのキャッシュフローへの影響も予想される。
,,□,会計事務所（職員）,・春の賃上げと夏のボーナス支給が終わり、お盆休みを経て消費は一旦落ち着く見込みである。
,,▲,食料品製造業（営業担当）,・受注量、販売数共に減少している。
,,▲,輸送用機械器具製造業（品質管理担当）,・中小企業に勤めていると、賃金上昇が物価上昇に追い付いていないため、どんどん生活が苦しくなっていると実感する。
,,▲,通信業（総務担当）,・先行きを明るくする要因が何もない。生活費のみ上昇して家計を圧迫している。生活費は今後も上昇していくと警戒している。
,,▲,通信業（法人営業担当）,・経済が上向く要素が見当たらない。第２次ベビーブーム世代の雇用者が定年に近づき、昨今の景気低迷から非正規雇用や失業のリスクと直結する。少子化や経済低迷で税収は減り続けるのに、生活保護費など行政の支出はこれまで以上に増えていく。既に止まらない負のスパイラルにあると感じる。
,,▲,金融業（従業員）,・取引先の様子では、景気悪化についてかなり深刻な話しぶりであり、足元のやや悪い状況から更に悪化するとみる。
,,▲,金融業（従業員）,・日本銀行の利上げ決定でプラスマイナス両面があるといわれているが、景気にとっては悪い面が目立ちやすい。
,,▲,新聞販売店［広告］（店主）,・新聞購読者数の減少と折込チラシの減少は続いているため、厳しい見通しは変わらない。
,,▲,会計事務所（職員）,・物価高の影響か、財布のひもが一段と固くなっている。商品の質は落とさずになるべく安く手に入れたい傾向がみられ、同業他社との比較で優位に立たなければ、なかなか購入してもらえない。結果として利益を削るか、仕入価格の見直しが必要となるが、仕入価格も高騰しており実際には難しい状況である。
,,×,鉄鋼業（経営者）,・良くなる要因がない。見積依頼なども含めて先の話が出てこない。
,,×,金属製品製造業（経営者）,・引き合いが減少している。原材料価格や加工品価格の上昇もあり、利益が減少する。
"雇用
関連

(東海)",,◎,－,－
,,〇,－,－
,,□,人材派遣会社（営業担当）,・40代の採用などメーカーの採用基準が拡大している傾向からも、設計開発の領域では人材ニーズが底堅い。
,,□,人材派遣会社（営業担当）,・最低賃金の大幅な改定などもあったが、効果は限定的である。
,,□,アウトソーシング企業（エリア担当）,・大手自動車メーカーの不正問題で一部車種が８月も生産停止状態である。以前は人材不足であったが、最近は派遣労働者が余り気味である。
,,□,新聞社［求人広告］（営業担当）,・円安のままであれば状況が良くなることはなく、現状維持の見込みである。
,,□,新聞社［求人広告］（営業担当）,・消費が回復しない限り、景気が上向いている実感は得られない。
,,□,職業安定所（所長）,・最低賃金を見越した賃金の引上げ等はあるものの、求人の動きに変わりはない。
,,□,職業安定所（職員）,・原材料費、燃料費や電気料金等の高騰と円安が継続しており、経営の先行きに不透明感が強まっている。
,,□,職業安定所（職員）,・物価高や原材料価格の高騰等が続いており、特に中小企業における人手不足も継続しており、いまだ景気回復の兆しはみられない。
,,□,職業安定所（職員）,・為替相場の状況や商品価格上昇の影響がどのように働くか、長期的に注視する必要がある。
,,□,職業安定所（雇用開発担当）,・製造業を中心として、事業主都合の離職者が増加している。円安、原材料価格等の高騰や価格転嫁の困難さなど先行きに不透明感がある。
,,□,民間職業紹介機関（営業担当）,・大手企業の採用は引き続き活況を帯びているが、求職者の活動意欲はお盆までは減退する。今後は年末や年度末の転職を狙いとした求職者が増えてくると想定する。
,,□,民間職業紹介機関（窓口担当）,・大手企業の業績好調を反映し求人数は増加しているが、求職者数が頭打ちである。スタッフ稼働数としての伸びは求人数に比例せず、景気上昇までは期待できない。
,,□,学校［大学］（就職担当）,・新卒採用については年度計画で動いているケースが大部分を占めており、２～３か月先に現状から大きな変化はない。
,,▲,人材派遣業（営業担当）,・自動車産業を始め各産業でコスト高の影響による利益率の下降や納期の遅れが今後も継続し、消費者への影響も継続する。
,,▲,人材派遣会社（社員）,・夏季シーズンが終わると別のイベントが予定されているが、現時点の予約状況は余り良くない。
,,▲,人材派遣会社（営業担当）,・派遣求職者数は減少傾向にあり、採用者数も減少していくと予想する。
,,▲,職業安定所（職員）,・雇用保険適用事業所数が前年同月比では７か月連続減少するなど、事業所の廃止等が続いている。
,,▲,職業安定所（職員）,・新規求人数が減少している。
,,×,人材派遣会社（社員）,・例年７月から８月にかけては求職者の動きが低調となる。加えて、事態が好転する要因が見当たらない。
,,,,
　７．北陸（地域別調査機関：一般財団法人北陸経済研究所）,,,,
,,,,（－：回答が存在しない、＊：主だった回答等が存在しない）
分野,,景気の先行き判断,業種・職種,景気の先行きに対する判断理由
"家計
動向
関連

(北陸)",,◎,都市型ホテル（役員）,・市内の近くにあるホテルで販売価格が上昇している。足元では新型コロナウイルス感染が広がるが、夏のレジャーシーズンに向けた宿泊需要への影響はみられず、２名での利用を中心とした販売価格の上昇により、前期を上回る売上獲得を見込んでいる。
,,○,商店街（代表者）,・少しずつ円高傾向になり始めたことで、どのような影響が出てくるか不安である。特に日本人の需要は周りを見ても冷えている感じがする。
,,○,百貨店（売場主任）,・インバウンドや富裕層による旺盛な消費の動きはしばらく続くと見込んでいる。
,,○,衣料品専門店（経営者）,・買い控えしている現状から、今後は買換え需要に移行するとみている。
,,□,商店街（代表者）,・マスコミで北陸新幹線の話題が取り上げられる機会もめっきり減り、注目度も落ちてきている。２か月足らずで新幹線効果が薄れてきているのは残念である。
,,□,商店街（代表者）,・休日以外は人通りが少ない。また、最近の傾向として宝飾品や高級服を扱う商店の売上が伸びていないようである。
,,□,一般小売店［精肉］（店長）,・今は豚肉の売上が高い状態が続いている。引き続きこの状態が続き、牛肉の高価格帯商材における購買がなかなか進まないとみている。
,,□,一般小売店［事務用品］（店長）,・この先もネット通販が主となる状況が続くとみている。
,,□,一般小売店［書籍］（従業員）,・良くはならない。景気の底はついたようだが、まだ悪くなる可能性もある。
,,□,百貨店（販売担当）,・夏休みの旅行客、帰省客のほか、祭りなど、街への集客は高めで推移するが、物品購買は当面、慎重になるとみている。店内でも友人や家族と過ごす飲食店などは比較的好調で、客単価が高価格になっている分、衣料や雑貨の節約にとどまらず、生活必需品も低価格商材に流れる傾向がある。定価品を扱う当店としては、苦しい状況が続くと考える。
,,□,スーパー（店長）,・経済の状況が何も変わらないため、景況も変化がないと考える。
,,□,スーパー（仕入担当）,・相場状況も落ち着きを見せ、販売単価の維持は可能になってくるとみているが、販売数量の回復は見込めない。イベント、催事の再開もあり、来客数の回復は期待できる。
,,□,コンビニ（店舗管理）,・景気が好転する材料が見当たらない。
,,□,衣料品専門店（経営者）,・今後は景気が改善していくとは考えられず、厳しい状態が続きそうである。
,,□,衣料品専門店（経営者）,・季節に影響を受けるアパレル業界は残暑が続くと秋物が売れにくい。
,,□,家電量販店（店長）,・パリオリンピックが終わり、テレビなどの映像関連商品の販売が落ち込むとみている。
,,□,家電量販店（店長）,・天候の影響もあるが、家計の出費を抑える傾向がみえ、前年と比較して客単価が下がっている。
,,□,家電量販店（本部）,・補助金がなくなり、季節要因もなく、パリオリンピックも終わった状況で景気が上がることは考えにくいが、足元の来客数が回復傾向なので、期待はしている。
,,□,乗用車販売店（経営者）,・給与も多少上がったようだが、物価がそれ以上に高くなっている状況では、しばらくは景気は変わらないと考える。
,,□,乗用車販売店（役員）,・今年の売上が急に増える状況ではない。
,,□,自動車備品販売店（役員）,・新車販売の低迷と維持費の高騰、昨今の降雪量減少もあり、冬季関連商品の販売は厳しい状況である。飲食店関係の値上げも身近で多くなり、更なる消費減退が続くと考える。
,,□,住関連専門店（役員）,・来客数が伸びる要素がない。そのための材料を自分たちで作って継続していかないと、景気の回復は見込めない。
,,□,その他専門店［酒］（経営者）,・良くなる材料が全く見当たらない状態である。このままの状態でいけば商売をやめなければならないときが、すぐそこにやってくるようにみえる。
,,□,その他小売［ショッピングセンター］（統括）,・個人消費の動向は依然として厳しく、景気が良くなる要素は少ない。
,,□,高級レストラン（スタッフ）,・能登半島地震に対する復興支援の意味合いもあり、県外団体客の顕著な利用や受注が続いているが、物価高などにより、地元客による高単価な飲食店の利用は低調である。
,,□,一般レストラン（店長）,・平均して、来客数が前年より順調に推移している。
,,□,一般レストラン（統括）,・現状から、好調を維持するとみている。新型コロナウイルスの感染状況と、物価高や円安の継続が気になるが、現時点ではこの状態を維持できると考える。
,,□,スナック（経営者）,・先々が不透明な状態である。自然災害や物価高などで、期待ができない。
,,□,観光型旅館（経営者）,・８月以降も順調に予約が入っている。宿泊客数は減少しているが、宿泊単価は上がっており売上も上がっている。
,,□,観光型旅館（経理）,・営業再開までにまだかなりの期間を要するため、状況は変わらない。
,,□,都市型ホテル（スタッフ）,・８月は宿泊予約の入りが弱く、回復の勢いが弱い。北陸新幹線延伸の効果はみられない。９月は宿泊、宴会共に、予約が戻りつつあり、期待している。
,,□,旅行代理店（従業員）,・宿泊単価や交通費の増加傾向を考えると、良くも悪くもならないとみている。
,,□,タクシー運転手,・暑さの影響でタクシーの利用は引き続き多くなるとみている。また、観光客も好調に推移すると考える。
,,□,タクシー運転手,・前年のタクシー運賃改正に伴い、一般客の乗り控えが続き、上がる予定だった運賃収入が横ばいで、先行きは厳しい。
,,□,通信会社（職員）,・好材料が特に見当たらない。
,,□,通信会社（営業担当）,・前年と比較し販売量に大きな変化がみられない。景気が大きく変化する要因が見当たらない。
,,□,通信会社（役員）,・競合他社との競争が激しく、解約数が前年より増える状況が２、３か月後も続くと考える。また、契約者数も前年同月を若干下回る数字で推移するとみている。
,,□,通信会社（役員）,・現時点では、景気変動の要因が見当たらない。
,,□,テーマパーク（役員）,・前年同月と比べると、個人客の旅行動向がやや鈍さを感じるなかで、法人、団体旅行がやや増加傾向にあり、全体としては横ばいで予約状況が推移すると考える。
,,□,その他レジャー施設［スポーツクラブ］（総支配人）,・会員の微増により、若干会費収入の上乗せが見込めるが、それ以上に経費増加の負担が大きい。
,,□,美容室（経営者）,・国内外の政情不安で前向きな気持ちになれない。唯一、パリオリンピック、大リーグの日本人選手の活躍だけが明るい気持ちにさせてくれるが、これも一時の気休めにしかならないため、大きな変化はない。
,,□,住宅販売会社（従業員）,・物価上昇に賃金上昇が追い付いていないなかでは、短期金利の上昇が懸念されるという状況も住宅購入の強い追い風にはならず、もう少しこのままの状況が続くとみている。
,,□,住宅販売会社（従業員）,・建築資材価格が不安定で、景気回復の兆しがみえない。
,,□,住宅販売会社（営業）,・景気が変わる要素がない。建設コストの上昇に改善がみえなければ、景気が下振れする可能性もある。
,,▲,百貨店（販売促進担当）,・10月頃まで暑さが厳しく、秋物衣料の売上は伸びないとみている。そのため、夏のセールを早めに切上げ、８月には売場を秋物に切り替えることで販売期間を延ばし、売上の確保とかさ上げをしたいと考えている。
