Ⅱ．景気の先行きに対する判断理由,,,,
,,,,
　景気の先行きに対する判断の理由について、その主だったもの及び特徴的と考えられるものを取りまとめると以下のとおりであった。,,,,
,,,,
,,,,
　１．北海道（地域別調査機関：（株）北海道二十一世紀総合研究所）,,,,
,,,,（－：回答が存在しない、＊：主だった回答等が存在しない）
分野,,景気の先行き判断,業種・職種,景気の先行きに対する判断理由
"家計
動向
関連

(北海道)",,◎,一般小売店［土産］（店員）,・愛知万博も終了し、また知床の世界自然遺産登録等もあり、北海道観光へシフトしてくるような流れがこれから現れる。去年が景気の底と考えれば、ここ数か月間は売上、来場数、来客数が増えているので、これから３か月先についてはかなり期待している。
,,◎,家電量販店（地区統括部長）,・来年、札幌市及び近郊地域において地上デジタル放送が開始されるのに先立ち、ますますデジタル家電の需要が加速していく。
,,○,商店街（代表者）,・ここに来て冬物のトレンドがみえてきたことから、ファー物や防寒コートがコンスタントに出れば、売上も上がってくる。
,,○,スーパー（店長）,・食品は単価要因、競合要因等があり、現状のままのトレンドで推移すると予測できるが、衣料品、住居用品は季節商材の動向が良く、前年比が100％を超過している現状のトレンドを年末まで維持できる。
,,○,衣料品専門店（店長）,・近くに大型店の出店計画があるため、地域的に客足が増えることで自店へのプラス効果が期待できる。
,,○,乗用車販売店（営業担当）,・物販の量が前年に比べて増えてきている流れから、今後についても期待できる。
,,○,観光型ホテル（経営者）,・愛知万博の閉幕に伴い、道外からの観光客、特に団体客の増加が期待される。ただし、宿泊単価は、いくぶん強気で出せるが、付帯収入が伸び悩むことが予想される。自社アンケートでは、売店に欲しい商品がないという回答が増加しつつあり、景気よりも企業努力の問題になってきている感がある。
,,○,旅行代理店（従業員）,・選挙後の来店数や申込件数の増加から旅行客の動きが活発になっており、景気が上向いていることを感じる。一方、価格志向の動きが強く、販売商品の工夫をしなければ、良くなってきた波に乗るのが難しい。
,,○,旅行代理店（従業員）,・選挙が一段落し、将来への不安解消が緩和してくるムードになれば、旅行等の余暇にお金を使う傾向が出てくる。海外旅行の動きが活発である。
,,○,観光名所（役員）,・ロープウェイ、レストラン等の予約状況が改善されつつあることから、今後は良くなる。
,,○,設計事務所（職員）,・知床の世界自然遺産登録で、観光入込客数が増加しており、宿泊施設の客入りも、周辺の網走、川湯周辺まで波及する形で増大している。また、室蘭では大手鉄鋼メーカーなどの大企業がフル操業で、経済効果が生まれ始めている。そうした状況のなか、知床周辺の宿泊施設や室蘭市内の事業投資施設の設計依頼が増加傾向にある。
,,□,一般小売店［酒］（経営者）,・９月は天候要因や新規取引先の増加など、たまたま良い材料があって売上が良かったが、来月以降もこういう状態が続くとはまだ判断できない。
,,□,百貨店（役員）,・全体的に季節商材の動きが悪く、客の購入意欲も感じられないものの、特定客を対象にしたイベントを企画し集客を図ると、来客数、売上とも確保できる。現状では先行きの判断が非常に難しい。
,,□,スーパー（店長）,・早くも灯油価格の上昇が話題になっているが、これから需要期に入る北海道としては非常に厳しいものがある。
,,□,スーパー（店長）,・販売量でみると、９月は前年比101.5％と若干伸びているが、このところの売上高の低迷を考えると、景気の足踏み状態はもうしばらく続く。
,,□,コンビニ（エリア担当）,・客数は前年とほぼ同じ数で推移している。しかしながら同じような商品であれば安い商品を買う傾向が続いている。こうした動きが年内に変わるとは思えない。
,,□,コンビニ（エリア担当）,・企業業績が上向きになっているとの報道があるが、原油高、豊作による農作物の価格下落のほか、増税の話も出ており、消費者の買い控えが続く。
,,□,衣料品専門店（店長）,・例年より人出も良くなく、売上ももちろん減少している。これから寒くなるが、石油製品の値上げもあり、決して良くはならない。
,,□,住関連専門店（従業員）,・冬物商材がどう動くかが不鮮明なのではっきりしない。
,,□,高級レストラン（スタッフ）,・観光客は道内客ではなく本州客が多く、特に半分以上が中部圏からの観光客である。愛知万博が閉幕した反動で秋冬にかけて観光客に来道してもらうことができれば、わずかでも期待は持てる。
,,□,観光型ホテル（経営者）,・愛知万博が９月で終了したので、10月以降は多少悪くても今までのようなことにはならない。予約状況から判断しても客数は多少増えるが、前年比でみれば同等か若干下がる見通しである。
,,□,タクシー運転手,・３年前の規制緩和以降、札幌では毎月タクシーの台数が増えている。10月からは寒くなっていくに連れて、タクシーの利用が少しずつ増えてくる時期であるが、今年の今までの状況から判断すると、タクシーの利用客が増える見込みはなく、タクシーの台数が増えているだけに、１台当たりの売上はますます厳しくなっていく。
,,□,タクシー運転手,・タクシー業界は、特に天候に左右される業種であるが、降雪期までの少しの間、まだ上昇は期待できない。
,,□,住宅販売会社（従業員）,・住宅業界においては、戸建て志向がかなり遠のいている状況にある。抜本的な改革がないことには、この状況はなかなか脱皮できない。
,,▲,商店街（代表者）,・石油製品の値上げの問題があり、灯油などは段々と価格が上がってきているので、当然、客は財布のひもを締める方向へ動く。このことから判断して、先の景気はなかなか厳しい。
,,▲,百貨店（売場主任）,・原油価格上昇の悪影響が様々な分野で出始めた。冷静に考えて、このことだけを取っても良い方向に動くとは思えない。
,,▲,百貨店（売場主任）,・ウォームビズでの動きが期待できる反面、暖冬が予想されることでコート関連の動きが厳しいことも懸念されるので、やや厳しい状況となる。
,,▲,百貨店（売場主任）,・北海道はこれから暖房費用がかかるが、原油高の影響が懸念される。また自動車等での遠出など自動車の利用自体も少なくなる。
,,▲,スーパー（企画担当）,・原油価格の高騰が続き、水道光熱費の値上げ圧力の高まり、特に北海道の場合は冬の暖房費の高騰も予想されるところから、この冬にかけて客の購買行動は更に慎重になることが予想される。
,,▲,コンビニ（エリア担当）,・原油の高騰により、主である漁業等で経費の圧迫が進み、利益が出なくなっている。基本的に当地域は第一次産業が多いため、この影響が非常に大きくなる。消費者に対する収入が減少することも含め、今後も消費については向上は望めない。
,,▲,コンビニ（店長）,・最近、競合する全国ナンバーワンのチェーン店で、スーパーとの垣根を外すために、飲料等の価格格差をなくして安く売ろうという動きがある。当店もやはり追随していくとなると、更に単価の下落につながるのではないかと懸念している。
,,▲,乗用車販売店（従業員）,・前年と比べて、かなり厳しい状態になっている。他の販売店も良くないと聞いているので、今後については厳しい。
,,▲,旅行代理店（従業員）,・今後の年金改正、消費税率改正の動きが取りざたされており、先行きに不安感があるようだ。少しでも安く、又は不要な買物はしないなどの話が多い。
,,▲,設計事務所（所長）,・来年の物件の出足が良いのだが、中国景気、原油高に加えて、先日のハリケーンなど、建設費高騰の要因が多く、実際にじりじりと上がってきている。それらが原因となって一時的に失速する。
,,×,＊,＊
"企業
動向
関連

(北海道)",,◎,－,－
,,○,その他サービス業［システムハウス］（経営者）,・下期の案件が早めに出てきている。人手不足になってきており、外注の確保が難しくなっている。
,,□,金属製品製造業（経営者）,・秋に向かい、灯油や原油の値上がり傾向が輸送コスト等に影響を大きく及ぼし、大変心配な状況にある。特に北海道は燃料需要が今後増大するため、その点についても心配である。
,,□,金融業（企画担当）,・原油価格の高騰で灯油、ガソリン価格が上昇している。所得環境が改善しない中で、需要期になる灯油価格の上昇は家計を圧迫する。ガソリン価格の上昇も運輸業など各業界にとっては痛い。原材料価格も上昇しており、大半の企業は価格転嫁が不十分で収益面にマイナスとなる。雇用が改善しているが、総じて見れば景気先行きは変わらない。
,,▲,輸送業（支店長）,・物流量でみると、年内はそれほど大きな落ち込みはないと思うが、物流量が減少し始める11月以降、燃料費のアップが価格に転嫁できないということと相まって、企業収益は大きく落ち込むことと想定される。経営環境の悪化も懸念される。
,,▲,輸送業（営業担当）,・船会社の値上げ要請は待ったなしの状態にもかかわらず、荷主には受け入れてもらえない状態が続いているため、今後についても最悪の状態が続く。
,,▲,司法書士,・土地価格が底値と言われているが、それでも土地の売買が少なく、土地売買に伴う住宅新築件数も少ない。
,,▲,その他非製造業［機械卸売］（従業員）,・下期にかけて、道内の新規建築工事、土木関連工事とも低調に推移しているため、金属加工業全般にわたって、下期の受注見込みが低迷しており、消耗資材、生産材とも上期からは13～15％の減少となる見通しとなっている。
,,×,建設業（経営者）,・受注がほぼ一巡し、今後、新規の受注がほとんど見込めない。手持ち工事も完了する物件が出てきて、活動が徐々に低調になる。
"雇用
関連

(北海道)",,◎,－,－
,,○,求人情報誌製作会社（編集者）,・楽観視はできないが、運輸・物流業界を除いたほぼ全ての業種で上昇傾向がみられる。
,,○,学校［大学］（就職担当）,・現在も企業からの求人が届いており、就職活動が続いている。
,,□,求人情報誌製作会社（編集者）,・基幹産業の農業は堅調であるが、建設関連の求人広告が大幅に減少している。求人広告が入っても本州方面への請負が多いのが実情である。
,,□,求人情報誌製作会社（編集者）,・年末商戦に向け、小売、飲食の求人は引き続き好調が続く。
,,□,求人情報誌製作会社（編集者）,・現在は、アルバイト、パート、契約社員、派遣社員などの臨時雇用の求人が盛んであり、正社員の求人が伸びていない。今後、景気が良くなるためには正社員の求人が伸びることが必要である。
,,□,職業安定所（職員）,・新規求人数が４か月連続で前年を下回っている。求人の大部分は欠員補充であり、増員による求人がみられない。
,,□,職業安定所（職員）,・新規求人数は前年比で８か月連続で増加しているが、増加しているのは業務請負業の期間雇用の求人であり、求職者の約９割を占める地元での常用雇用を希望する者の雇用環境は依然として厳しい状況が続いている。
,,□,職業安定所（職員）,・８月の月間有効求人倍率は0.49倍で前月及び前年より改善されているが、全道平均を下回っており、依然として厳しい状況が続いている。
,,▲,＊,＊
,,×,－,－
,,,,
　２．東北（地域別調査機関：（財）東北開発研究センター）,,,,
,,,,（－：回答が存在しない、＊：主だった回答等が存在しない）
分野,,景気の先行き判断,業種・職種,景気の先行きに対する判断理由
"家計
動向
関連

(東北)",,◎,－,－
,,○,百貨店（売場担当）,・10月は、秋のファッションバザールなど催事が多く、購入に結びつくケースが増える。スポーツ用品や旅行用品などを求め、秋冬を楽しもうという客が多く見受けられ、財布のひもも緩む。ボーナス払いなどカード決済での購入もある。
,,○,衣料品専門店（経営者）,・今の客の流れをみていると、今後天候が寒くなるにしたがって、秋物から冬物にスムーズに移行すると期待される。冬物のコート、ジャケット等の単価増が期待され現状より少し良くなる。
,,○,乗用車販売店（経営者）,・新型のコンパクト車の投入で、需要が喚起されるものと期待される。しかし、新型車効果も以前に比べ長くは続かず、その点で一部不安材料になっている。
,,○,その他専門店［白衣・ユニフォーム］（営業担当）,・わりと暑さが長引いたことが影響し、冬物はまだまだこれから先、もう少し時間をかけて売上が伸びてくる。年末に向けてこれから人もお金も動く。
,,○,高級レストラン（支配人）,・インターネットによる宿泊予約が増加傾向にあり、レストランの売上も増加している。婚礼、一般宴会が伸び悩んでいる。ビジネスホテルが乱立し、激戦区になっているが、差別化を図ることで客が増加している。
,,○,観光型ホテル（経営者）,・現時点で来客数は前年と変わらないが、他県からの団体客の占める割合が高く、特に関東方面が多い。全国的規模の会合が出てきており、農業関係が目立つようになっている。
,,○,観光型旅館（経営者）,・今年度の決算締めくくりの時期である。10、11月の予約は順調に入っている。予約の確認を徹底し、間際の目減りを減らし、更なる純増を目指す。
,,○,観光型旅館（経営者）,・紅葉シーズンであり、行楽へのマインドが高くなる中、愛知万博も終わり県外の予約増が期待できる。
,,○,通信会社（営業担当）,・当地域は農村地帯が中心なので稲の刈取りが終わり11月ごろから上向く。
,,□,商店街（代表者）,・このままどんどん上昇するのではなく、現在のように少しずつ良くなる状況がまだ続く。商品全体に価格が下がってきて、お買い得感により購入意欲が増している。
,,□,商店街（代表者）,・これからの時期、例年、米の収穫がアナウンス効果として消費動向に影響してくるが、今年は前年並みの収穫が予想され、年末まで商店街の売上に大きな変動を与えるような材料はない。
,,□,一般小売店［スポーツ用品］（経営者）,・先日､子供の運動会に行ってきたが、以前は運動会というと父兄には必ず新しいシューズやトレーニングウェアを着ている人がいたが､誰もそういう人がいないのにびっくりした。
,,□,一般小売店［医薬品］（経営者）,・問屋やメーカーの話では、街を歩くと薬屋がなくなって、大きなドラッグストアだけが残っている。非常に寂しい状況にあり、これでは景気は良くならない。街が変わってきてしまったということである。
,,□,百貨店（売場主任）,・今後、集客力の大きい大型催事があるため、来客数、売上ともに期待したい。市内で他店の閉店があり何らかの影響がある。重ね着ルックが主流になっており、売上単価の大きいコートの動きは期待できない。
,,□,百貨店（販促担当）,・郊外店の出店攻勢がボディーブローのように効いており、来客数の減少傾向が続いている。好転はしないが、特選ラグジュアリー、婦人服、化粧品等の好調アイテムで今後カバーしていくことになる。
,,□,スーパー（経営者）,・依然として購買に迫力がない。県内は大型店舗の閉鎖が相次いで発表されているので個人消費の停滞感は否めない。
,,□,スーパー（経営者）,・来客数増加は続きそうだが、前年は10月に新潟県中越地震が発生しており、休業店舗もあったものの、地震による特需もある程度はあったはずなので、今年はそれがなくなる。
,,□,スーパー（経営者）,・全体的な景気動向については、多少好転の兆しがみえる展開になっているが、食料品を含めた消費支出については堅実な消費態度は今後も続くし、１品単価の下落に歯止めがかかっていない。競争の激化も含め、食料品を取り巻く環境は好転せず、現状のまま推移する。
,,□,スーパー（店長）,・競合店の相次いでの出店や時間延長等オーバーストアにますます拍車をかける要因が多く、景気が良くなる要因はない。
,,□,スーパー（総務担当）,・景気の明るさが広く言われているが、小売にはその恩恵が感じられない。また仕入れでは原油高の影響が量目減少等実質値上げになって来た。年金制度や医療制度等将来への不安が解消しないと消費は伸びない。電気料金、暖房費等家計への影響はじわじわ拡大してくる。パート、アルバイトの採用拡大は進んでも、１世帯当たりの所得が減っているので、企業の業績が拡大しても、一般客の財布のひもの固さは続く。
,,□,スーパー（総務担当）,・競争の収れんが進まない限り、互いにシェアをつぶし合う形が続く。
,,□,コンビニ（店長）,・石油の価格が上昇しているのでかなり懸念されるが、９月は天候が良かったので、前年をクリアしており、今のところ我々末端の小売には影響しておらず、このまま変わらない。
,,□,衣料品専門店（経営者）,・今後の構造改革次第で経済が活性化するかどうかが決まる。増税がなされれば、消費は低迷し、特に小売業にとっては痛手である。
,,□,家電量販店（店長）,・少し液晶テレビが出始めたので、少しだけ良くなってきた部分があるが、代わりに冷蔵庫など他のものが良くない。
,,□,乗用車販売店（経営者）,・新潟県中越地震からの復興、新型車の市場投入等プラス要素と、車選びに直結するガソリン高騰などの不透明要素がある。最近２か月のショールーム来場者数も前年から伸びていない。前年の水害・地震等で需要の先取りをした影響も考えると、良くて横ばい程度で推移する。
,,□,乗用車販売店（経営者）,・各車種ともマイナーチェンジが多く、新規来客数の増が見込まれる。
,,□,住関連専門店（経営者）,・地方は景気が上向いているという実感がない。住宅着工も前年よりも落ちている状況であるので、家具の売上は厳しく、前年と変わらず推移する。
,,□,その他専門店［酒］（営業担当）,・今後、選挙等の行事があるが、あまり目立って良くなる又は悪くなる要素は見当たらない。ある程度持ち直す傾向が期待できるが、酒は一気に需要が増えることはなく、このまま横ばいで推移する。
,,□,その他専門店［ガソリンスタンド］（営業担当）,・冬場に向けて、燃料の高値安定が進み、消費者の節約志向が強まる。また、暖房用灯油の価格が高くなっていることで消費量の減少がより進み、ガソリンスタンドにとっては更に厳しい状況になる。
,,□,高級レストラン（経営者）,・あまり良くなる要素はないが、株高をみると少し期待される。
,,□,その他飲食［弁当］（スタッフ）,・当社では２回にわたる希望退職を実施し、来年１月には１店舗を閉店する予定である。県内では大型スーパーの撤退が相次いで表明されていることなどからこの悪い状態が続く。
,,□,都市型ホテル（経営者）,・今後２～３か月は、大きな大会が数件入っており、一般宴会の予約状況も少しは良くなっているが、婚礼が相変わらず減少傾向にあり、全体的には変わらない。
,,□,都市型ホテル（経営者）,・他社の動きも含め相対的には若干良くなりつつあるが、予約のスパンが短いので現在の受注状況では変わらない。
,,□,都市型ホテル（スタッフ）,・９月の中間決算の時期にあって、勝ち組、負け組、業界の格差がはっきりと今まで以上に色分けされている。選挙後における景気の動向が年末までの３か月に大きく影響する。
,,□,都市型ホテル（スタッフ）,・狭い市場での過当競争や、30年間市の中心部にあった大手スーパーが11月に撤退することを決定する等行政も困惑する状況で、急激な景気回復は見込めない。
,,□,タクシー運転手,・新聞紙上では、景気が上向いているということだが、我々末端業者にはその傾向が現れていない。
,,□,テーマパーク（職員）,・秋の観光シーズンに期待をしているが、予約の入込状況が、前年比68％と良くない。
,,□,観光名所（職員）,・愛知万博が終了し、客の関心が東北地方に向くことを期待している。
,,▲,商店街（代表者）,・いろいろな商品が高くなる懸念があり、仕入価格をすぐに販売価格に反映できないことから、各店が苦労する。
,,▲,スーパー（店長）,・灯油の需要期に入るが、灯油価格高騰の影響が買物動向にも必ず現れる。
,,▲,スーパー（企画担当）,・９月以降、県外企業による新規出店が続く計画があり、顧客の分散が見込まれる。
,,▲,スーパー（企画担当）,・原油が高くなっているので、これから冬に向かって、灯油の値上がりが見込まれる。原油関連製品の値上げの影響で景気が悪くなる。
,,▲,コンビニ（経営者）,・現在、前年比108％と好調であるが、今後３か月後は例年悪くなる時期である。近隣のマンションの建設やビルの解体工事がプラス要因で、３か月続いたキャンペーンが今月で終了することがマイナス要因である。当店の場合200メートル四方に、他社が３店あるので、キャンペーン終了による差別化がなくなり競争が激しくなる。
,,▲,衣料品専門店（店長）,・商品本位で購入する優良客の立ち上がりが遅れている点を考慮すると、実売期から処分期にかけても苦戦することが予想される。
,,▲,その他専門店［ガソリンスタンド］（営業担当）,・原油高がこのまま進めば、これから寒くなり、灯油の買い控えが出て、売上が伸びなくなる。
