Ⅱ．景気の先行きに対する判断理由,,,,
,,□,繊維工業（総務担当）,・トレンド商品と呼べる新たな企画商品が出てこない｡また、現在好調な商品にも陰りが出てきた｡
,,□,繊維工業（団体職員）,・産地として最需要期を迎えるが、定番品や大量生産品は輸入品で賄われ、多品種小ロット生産への対応を余儀なくされることから、生産量の減少とコスト増加が起こる。
,,□,金属製品製造業（経営者）,・中国製品を中心に二極化が進み、自動車部品などの高級な商品は中国向けに輸出し、中国で生産できる標準品については中国から輸入するというような極端な動きとなる。
,,□,金属製品製造業（総務担当）,・中堅以下のゼネコンで、まだまだ不安定な動きが見受けられる。
,,□,一般機械器具製造業（経営者）,・取引先の設備投資の計画は活発に行われているが、技術と価格の競争が激しく、当社が受注できるとは限らない。このため、業界としては上向きであるが、当社としてはあまり多くは期待できない。
,,□,一般機械器具製造業（経営者）,・特に新規の注文、引き合いはないが、現在の受注案件は来年も引き続き受注できる。
,,□,建設業（経営者）,・これ以上悪くなるとは思わないが、同業者の破綻の噂が絶えないなど不安要素は多い。
,,□,建設業（経営者）,・民間工事は勝ち組企業による発注量が増えるが、中身は厳しいものとなる。また、石油価格の高騰がどの程度まで進むのかが不安材料である。
,,□,輸送業（営業所長）,・年末にかけて荷物の動きが良くなるのは確実だが、燃料費の高騰によって利益が圧迫されていることを客に分かってもらえない状況が続く。
,,□,不動産業（経営者）,・分譲マンション、分譲住宅などの素地の取得意欲は依然として旺盛であり、素地価格も上昇傾向にあるが、なかには販売価格に転嫁できない地域もある。
,,□,不動産業（営業担当）,・開発業者による購入は増えているが、実際に消費者がマンションを買ったり事務所に入ったりする際の賃料は上がっていない。
,,□,広告代理店（営業担当）,・依然として取引先の業界に偏りがあり、新たな業種が増えていない。
,,□,その他非製造業［民間放送］（従業員）,・当面のスポット需要は前年の水準をやや下回ることが予想される。ただ、視聴率は微増の兆しが出てきており、将来的にスポット在庫の増加につながる動きとなっている。
,,▲,食料品製造業（従業員）,・原料や資材の値上げの交渉が多くなっている。今まで何とか努力して利益を出してきたが、製品安の原料高という状況で今後は利益が少なくなる。
,,▲,食料品製造業（経理担当）,・石油製品の値上がりにより、原材料の価格が上がってきている。単価の低い製品の製造業は厳しい状況である。
,,▲,繊維工業（総務担当）,・流通業者への販売が続くなかで、新しい展開がみえてこない。現状は20％の生産超過で需給バランスが取れていないため、新作商品をユーザーへ直接アピールできる方法を模索する必要がある。
,,▲,化学工業（経営者）,・ここ数年続いてきた年１回の大型案件が海外へシフトする話が出ており、いくつかの問題を残してはいるものの予断を許さない状況になってきている。また、これまで利益をけん引してきた商品の売上に陰りがみえることから、売上の全体的な回復感が相殺されて、やや悪くなる。
,,▲,電気機械器具製造業（企画担当）,・客からコストダウンばかり要求され、商品を生産しても採算の合わない状況になっているので、非常に厳しい。
,,▲,輸送業（営業担当）,・所有しているトラック３台が排出ガス規制をクリアしていないので、買換えなければならない。
,,▲,輸送業（営業担当）,・燃料費の高騰が長期化する気配で、下請企業からは車両借入費用の値上げ要求がある。荷主に対してどこまで価格転嫁できるかが不安材料である。
,,▲,広告代理店（営業担当）,・先行きが不透明で、年末に向けて厳しい状況であるという声がクライアントからも聞こえてくる。
,,×,＊,＊
"雇用
関連

(近畿)",,◎,人材派遣会社（社員）,・派遣だけでなく正社員の引き合いが多い。
,,○,人材派遣会社（経営者）,・夏場が過ぎ、９月には年末特有の慌ただしさがみられるなど、企業は年末に向けて経理などの需要が徐々に高まっている。ただ、依頼案件が出てきているのは間違いないが、派遣会社は人材不足で頭を悩ませている。
,,○,人材派遣会社（社員）,・新卒者の求人などで求職者不足が発生し始めている。来年度の新卒者については売手市場となっている。
,,○,人材派遣会社（営業担当）,・新規求人数が前年比で２けたの増加となる状況が続く。新規求職者数の伸びが鈍化する傾向にあるため、このミスマッチをいかに解消するかが問題であるが、今後も受注は増加する。
,,○,新聞社［求人広告］（担当者）,・良いトピックスはないが、これ以上の落ち込みは考えにくく、必ず新聞にもクライアントが戻ってくる。
,,○,職業安定所（職員）,・原油の高騰による原材料費や輸送費の増加は注視する必要があるものの、現在のところ求人の動きに大きな影響を与えるまでには至っていない。
,,○,職業安定所（職員）,・パート求職者と常用求職者の就職件数に明確な違いがある。常用求職者の就職が増加し、パート求職者の就職が減少する動きが顕著になっている。
,,○,学校［大学］（就職担当）,・秋採用企業が増加している。採用終了企業からは、来年度の採用についてのアプローチが増えている。
,,○,学校［大学］（就職担当）,・就職部では追加求人アンケート調査を行い、多くの企業から情報収集をしている。内定辞退などもあり、依然として未充足の企業が多く、採用活動を継続しているとの回答が多く寄せられている。長期戦になっても人材確保を目指す企業側の強い採用意欲がうかがえる。
,,□,新聞社［求人広告］（担当者）,・８月ごろから求人数が減ってきている。景気は上向きと言われているが、求人雇用とは直結しておらず、今後数か月の間も大きな変化はない。
,,□,新聞社［求人広告］（営業担当）,・広告会社の情報では、下期の新聞広告の営業活動では苦労するとの声が聞かれる。
,,□,職業安定所（職員）,・公務員給与が引き下げられる予定であるが、それが多くの中小企業の賃金にも影響するため、買い控えなどの行動が懸念される。ＩＴ関連企業の業績大幅アップが顕著である一方、個人では高所得者と低所得者に二極化している。
,,□,職業安定所（職員）,・新規求職者数は前年の水準を若干上回っているが、これは当所における平日の職業紹介業務が７月から２時間延長となったほか、今月から土曜日は開庁となったことが影響している。また、新規求人数は増加しており、今後もこの状況が持続する。
,,□,民間職業紹介機関（職員）,・一時期の求人増の勢いがやや衰えており、先細り感もあるが、好転、悪化ともに判断材料がない。
,,▲,求人情報誌製作会社（営業担当）,・企業での人材の需給バランスが保たれず、仕事量の増加に対する人員補充ができていないほか、それを改善する対策も行われていない。
,,▲,新聞社［求人広告］（営業担当）,・どの広告媒体も求職者の集まりが悪いので、企業が広告を控える傾向にあり、受注が苦しくなってきた。
,,▲,職業安定所（職員）,・有効求職者数が前年比で28か月ぶりに増加に転じた。また、規模の大きな企業の整理が数件予定されている。
,,×,－,－
,,,,
　８．中国（地域別調査機関：（社）中国地方総合研究センター）,,,,
,,,,（－：回答が存在しない、＊：主だった回答等が存在しない）
分野,,景気の先行き判断,業種・職種,景気の先行きに対する判断理由
"家計
動向
関連

(中国)",,◎,家電量販店（店長）,・デジタル家電の動きがこれから加速すると思う。
,,◎,一般レストラン（店長）,・予約がたくさん入ってきている。内容は企業がほとんどであるが、今後企業から家庭へと利用が広がる。
,,◎,都市型ホテル（スタッフ）,・広島では大型観光キャンペーンの時期に入るので、個人・団体と宿泊予約が順調である。伸び悩んでいた客単価も上がっているようだ。
,,◎,競艇場（職員）,・12月18日から開催される全国の場外発売は、１年の中で最も大きなレースで、集客及び発売金額が見込める事と、加えて年末レースでも同様に良い結果が見込める。
,,○,百貨店（販売促進担当）,・消費の向上トレンドと秋冬物の販売が本格化する。
,,○,百貨店（販売担当）,・気温の低下とともに秋冬物、特にコートなどの高額商品の動きが出てくる。
,,○,スーパー（店長）,・前年の９月以降、売上が前年比を上回っている。ここ数か月は106％、107％という状況が続いている。特に概況の変化は何もない中で、売上が伸びていることは将来も良くなっていく期待が持てる。
,,○,スーパー（店舗運営担当）,・客の動きなどから見て、今月後半から上向いてくる。
,,○,衣料品専門店（地域ブロック長）,・ウォームビズが浸透して、洋品カジュアルとインナーが動く。
,,○,衣料品専門店（地域ブロック長）,・気温の低下にもよるが、秋冬物の動きが出てきている。今後は良くなっていく傾向と見受けられる。
,,○,百貨店（営業担当）,・顧客の興味や好奇心をそそる販促企画を提供できれば、かなりの来店が期待できる。
,,○,乗用車販売店（統括）,・下期の新型車投入による需要の喚起が見込まれる
,,○,乗用車販売店（販売担当）,・コンパクトカーの新型車の発売が10月、11月にあり、販売台数の増加を見込んでいる。
,,○,乗用車販売店（総務担当）,・販売車種は軽より小型の方が動きが良くなっているようなので、良くなる。
,,○,自動車備品販売店（経営者）,・高額品の動きが良くなっている現状から、今後は良くなる。客数の動きも前年を上回る推移となっていることも裏づけとなっている。
,,○,その他小売（営業担当）,・台風の被害も少なく、広島県の大型キャンペーンの影響もあり、当地を訪れる客数の伸びが期待できる。
,,○,スナック（経営者）,・来月になると、国体も秋の大会があるのと色々な全国大会が岡山で開催されるので、大変期待している。３か月先の12月は以前ほどではないにしても、年末の忘年会の流れが期待できる。
,,○,都市型ホテル（従業員）,・年末年始にかけてのクリスマス、正月商品の納品先の動きが活発になっており、景気回復による需要増を予想する販売店が増加している。
,,○,タクシー運転手,・これまでで一番はっきり３か月先の景気が上向いていると確信できる状況である。というのも、国体の開催があり、また映画館付きのショッピングセンター等の設備投資が様々な場所でみられるためである。乗客の話からも接待等が増加している傾向が見受けられる。
,,○,通信会社（企画担当）,・商品単価で、より高い商品への移行の傾向がみられる。
,,○,通信会社（販売企画担当）,・新商品が登場することで販売は上向きになる。
,,○,テーマパーク（財務担当）,・秋からクリスマスにかけて、ターゲットを絞った企画を実施することと、愛知万博終了による関西方面からの集客もある程度見込まれるため、多少良くなる。
,,○,テーマパーク（広報担当）,・万博が閉幕したことと、行楽シーズンを迎えることで、回復が期待できる。
,,○,テーマパーク（業務担当）,・９月下旬からようやく行楽シーズンへの受け入れ体制も整い、冬期までは良化を見込める。
,,○,美容室（経営者）,・来客数が飛躍的に伸びているという現象から考えて、さらに販売増につなげる手の打ち方はあると思う。
,,○,住宅販売会社（経理担当）,・新規物件の事前内覧会を実施したところ、モデルルームへの来場者が週末の３連休で毎日10組近く予想を上回っており、正式契約が始まる来月以降も順調に契約が進む。
,,□,商店街（代表者）,・季節に変わりなく、来店客数が軒並み減少している。
,,□,商店街（代表者）,・特に山陰が、非常に景気が落ち込んだままで、景気の良くなりつつある大都会の波及効果が当分及んでこない。また製造業の少ない島根県等では公共事業等の費用の削減が非常に影響し消費にも影響している。
,,□,商店街（代表者）,・大型スーパーの撤退や地元大手企業の様子をみてもあまり良い状況ではない。やはり、沈滞ムードが続く。
,,□,商店街（代表者）,・原油の価格はあらゆる商品に影響を与え、消費者は財布のひもを締める。
,,□,百貨店（営業担当）,・原油の高騰など、家計に響く不安材料もあり、冬に向け灯油など生活により身近な消費の冷え込みが起こって他のものに波及しないか心配である。
,,□,百貨店（販売促進担当）,・景気が上向いてくる要因は見つからない。11月には、大型ショッピングセンタ－のオ－プンも控えてきている。今後は、低価格商品の拡大を実施していき、新しい顧客開拓につなげて行くしかない。
,,□,百貨店（売場担当）,・前年の10月も大きく台風の影響を受けており、台風が来なければ前年実績でしのげる状況である。10月上旬から気温が下がれば、何とか前年と変わらない数字がとれる。
,,□,百貨店（売場担当）,・ヤング層のファッション関連については、このまま堅調に推移すると思う。ただし、ミセス及び紳士服関連については、まだまだ厳しい状況が続くと思う。ウォームビズが取り沙汰されているが、当店としては先行き不透明である。
,,□,百貨店（購買担当）,・このまま暖冬が続くようであれば、コートなどの重衣料や単価の高い商品が厳しくなると思う。顧客は今必要な物しか購入しないという傾向は変化しておらず、秋・冬ともにそれぞれの季節の気温にならないようであれば、百貨店側としてはイベント等をしかけていかないと、顧客の足が遠のいてしまう。
,,□,スーパー（店長）,・石油製品の相次ぐ値上げ、公共事業の大幅な減少の続くなかで、客数確保のための価格競争がより強まり、顧客の必要な物しか購入しない傾向のなかで、原単価の下落による客単価の減少も起こる。
,,□,スーパー（店長）,・チラシを見て、目玉商品を買い回る顧客が増加しているので、必要な物しか買わない購買行動がよく見受けられ、今後２、３か月もこのトレンドが継続する。
,,□,スーパー（店長）,・１品単価の下落に歯止めがかからない。
,,□,コンビニ（エリア担当）,・現状では、顧客の商品購買のシビアさが変わるとは思われない。
,,□,コンビニ（エリア担当）,・秋口の新商品の導入が進んでいるが、昔に比べて新商品の動きが鈍く、客数は増加しているが、この先も必要な物しか購入しない傾向は続く。
,,□,衣料品専門店（経営者）,・メーカーの話や同業者の話にも変化の兆しがみられない。
,,□,家電量販店（店長）,・我々が扱っている電気製品は原油にかかわる商品が多く、その高騰により今後の価格に影響がないか不安がある。
,,□,家電量販店（店長）,・各商品群にとっても、これといった売上を期待できる商品がない。テレビも大型テレビは顕著に良好だが、全体的には売上の悪い部門の方が多いので、景気はあまり変わらない。
,,□,家電量販店（予算担当）,・単価の下落は今後も続くと思う。客数は増加傾向にあるので単価下落のカバーにはなる。
,,□,乗用車販売店（サービス担当）,・ちょうど冬のボーナス商戦だが、状況が夏と同様であまり変化がない。
,,□,住関連専門店（営業担当）,・若干の低迷期にある。マンションの建築がだいたい終了したこともあるが、特にこれから落ちるということもなく、前年同様で動くと思う。来客数は３か月前よりは減少しているが、これから先、特に下がる要因もないので、現状維持になる。
,,□,その他専門店［スポーツ］（店長）,・このまま平年より気温が高い状態が続きそうなのでアパレルの動きが悪い。
,,□,その他専門店［書籍］（従業員）,・好調な状態を維持しているが、開店景気も一段落した。この状態がしばらく続く。
,,□,一般レストラン（店長）,・年末の忘年会シーズンを迎えるにあたり、宴会コースの開発に取り組んでいるが、低価格のコースを何とか見栄え良くしたいが、仕入価格の高騰で厳しい。また牛肉の仕入価格が確実に上がる。
,,□,その他飲食［ハンバーガー］（経営者）,・売上自体の上昇傾向は続くと思うが、収益力は弱くなってきている。
,,□,都市型ホテル（経営者）,・若干上向きの傾向にあり、愛知万博も閉幕した事もあり12月以降もこの秋同様に前年を上回ることが期待できるため､９月並みの成績が見込める。
,,□,都市型ホテル（総務担当）,・宿泊、一般宴会の受注状況は増加傾向にはあるものの、婚礼受注が今一歩であり、今後２～３か月の短期間で好転するとは感じられない。
,,□,通信会社（経営者）,・客の反応も厳しいままであり、好転の兆しはみえないまま、推移している。良くなる兆候もみえない。
,,□,通信会社（社員）,・顧客からの注文状況より、当面変動が見込まれない。
,,□,通信会社（通信事業担当）,・新規の加入は、何かインターネットを利用するための、はっきりとした目的が無い場合は難しい。今後もこのような状況は続く。
,,□,通信会社（管理担当）,・市場が盛り上がりに欠けている。
,,□,設計事務所（経営者）,・現状の収入改善が見込めないため大きな変化はない。
,,□,設計事務所（経営者）,・今後の景気の動向をみても、建設業関係はまだまだトンネルから抜けない状態が続く。
,,□,設計事務所（経営者）,・悪徳リフォームやアスベスト問題等、建築工事に対する社会的なイメージが悪い。増築やリフォームが新築に変わって主な工事となりつつある中で、消費者の動きも悪くなっている。
,,□,住宅販売会社（販売担当）,・展示場、イベント等への来場者数が少なく、増えない。
,,▲,商店街（代表者）,・顧客は価格にも厳しく、また今まで以上に価格に対しての付加価値を求めていて、販売量・販売数ともに減少の一途をたどっている。このままでは、子供服という物販が成り立たないように思う。衣料・繊維に関しては各所でそのような傾向が続いている。
,,▲,商店街（代表者）,・来店者が少ないことに加え、デフレの影響で購入単価が低下している。
,,▲,百貨店（電算担当）,・過去６か月間来客数が前年同月比３％減で推移している。来客数が減ると、食品売上に響き、さらに店に活気がなくなって非常に厳しい状態である。消費者が何を求めているかわからないので手のうちようもない。その中にあって、ゲルマニウムブレスレットなど健康に関することは、関心が高い。
,,▲,スーパー（店長）,・このまま原油の高騰が続いた場合、消費者の家計を直撃し、その影響で食費を抑える状況になりかねない。
,,▲,スーパー（店長）,・石油製品の値上がりによる売価のアップ、事業者用ゴミ袋の経費アップ等が発生して、非常に苦しい経営状態である。顧客に関しても、買い控え・購入単価の低下等がみられるので、このまま苦しい状況が続く。
,,▲,住関連専門店（広告企画担当）,・ぜいたくな品と思われているからか、価値観が変わってきていて、家具にお金をかけたくない風潮が進んでいる。使うなら家具より高価な家電に使い、残りはもったいないから使わないという雰囲気が出ており、その傾向は今後も進んでいく。
,,▲,高級レストラン（スタッフ）,・一般の宴会は順調に推移しているが、婚礼については10、11月には非常に厳しい状況である。
,,▲,一般レストラン（経営者）,・７、８月と夏のフェアとステーキフェアを実施したが、夏のフェアが好評であった。９月はステーキフェアだけを行ない、客単価も上昇し、売上にもつながったが、10月はステーキフェアが終了するので、売上増は期待出来ない。
,,▲,旅行代理店（経営者）,・現在のところ11月から２月までの受注量が非常に低迷している。これから受注がくるかどうか不透明であり、低迷が続く。
,,▲,住宅販売会社（従業員）,・受注においても増える要因はあまり見当たらないが、原価コストは微弱ながらアップしてきており利益を圧迫してくる。
,,×,スーパー（総務担当）,・税込み単価が本体への単純上乗せから、総額で値頃感を出せるよう端数を丸める等の影響で単価が１円～２円下がって実質値下がりしているものの、販売量が伸びない。
"企業
動向
関連

(中国)",,◎,＊,＊
,,○,農林水産業（従業者）,・水温の上昇からか、エチゼンクラゲの発生が出てきて、特に巻網・定地網で影響があるようで憂慮しているが、沖合い底引き網がこれから寒くなると最盛期を迎え水揚が期待できる。
,,○,窯業・土石製品製造業（総務経理担当）,・大口注文の生産に着手し、生産量も増加の予定である。
,,○,電気機械器具製造業（総務担当）,・今後、３か月の受注も好調に入ってきており、また次世代用の試作案件も活発の様相を呈しており好調さは続く。
,,○,輸送業（統括）,・10月から既存顧客の新規の業務が予定されており、収入の増が見込まれている。
,,○,金融業（営業担当）,・原油高・運賃等の増加が若干気になるが、物は動いているし、生産・建設関係のリースも稼働率が上昇している。基本的には、今から公共工事も含めて工事が出るものと期待がみなぎっている。当市においてはマンション建設がまだまだ盛んで、他の都市からの受注ではあるが、下請ということで、地元の業者も工事は確保できている。
,,□,化学工業（総務担当）,・物流費や原燃料費高等の影響はあるものの当面現状を維持する。
