Ⅱ．景気の先行きに対する判断理由,,,,
,,,,
　景気の先行きに対する判断の理由について、その主だったもの及び特徴的と考えられるものを取りまとめると以下のとおりであった。,,,,
,,,,
,,,,
　１．北海道（地域別調査機関：（株）北海道二十一世紀総合研究所）,,,,
,,,,（－：回答が存在しない、＊：主だった回答等が存在しない）
分野,,景気の先行き判断,業種・職種,景気の先行きに対する判断理由
"家計
動向
関連

(北海道)",,◎,一般小売店［土産］（店員）,・これから本格的な観光シーズンを迎えるに当たり、修学旅行生は愛知万博にかなり取られていると感じるが、国内旅行に関しては、一部北海道に流れてきている。特に高齢者層の小団体が増えてきていると感じる。法人需要の部分では、依然として落ち込みがあるが、店での購買状況をみると個人旅行や個人消費ではメンタル的にも回復していると感じることができる。
,,○,商店街（代表者）,・秋物商戦はどうなるのかはいまいち見えてないが、夏商戦が早めに終わることで、秋の立ち上がりが早くなり、高額のものが動き出す。
,,○,商店街（代表者）,・人が動くようになり、消費の購買力もついてきた。所得も３か月前より、かなり良くなっていると感じる。その影響で街中や観光地へ出かける機会も多くなっている。
,,○,百貨店（役員）,・気温の上昇もあるが、衣料品のまとめ買いや高単価の商品の動きが目立つようになっている。衣料品の売上は、若干ではあるが、前年を上回る状況になってきた。
,,○,スーパー（店長）,・５月よりは若干販売量が落ちているが、前年比でみると、販売量は３％ほど伸びている。
,,○,衣料品専門店（店長）,・北海道の夏物の販売期間は全国と比べて短いにもかかわらず、ここ２～３か月、販売量が継続して増加傾向にあることから、上向いている傾向が感じられる。
,,○,衣料品専門店（店員）,・現在、現金での買上率が上がってきているので、クレジットカードで利用できる金額の枠にも余裕が生まれ、今後はカードを利用しての買物も出てくる。
,,○,その他専門店［造花］（店長）,・２～３か月後はクリスマス商品が動き出す時期であるが、客の様子から前年よりも上向くことが期待される。
,,○,一般レストラン（スタッフ）,・客単価が１年ぶりに前年の水準まで戻ってきている。領収書の発行枚数も増えてきて、法人の利用が伸びてきている。
,,○,旅行代理店（従業員）,・沖縄直行便が９月に再就航すること、また機材も大型のものに変更されることによって、熟年や20～30代の需要喚起が期待できる。
,,○,美容室（経営者）,・客の会話の中でレジャーや買物に関する内容が増えてきた。
,,□,商店街（代表者）,・６月に入って少しずつ売上も上昇気運になってきているが、抜本的に景気が良くなってきているとはまだ考えられない。先行き不安に対する問題が多すぎるので、なかなか景気が上向くところまではいっていない。
,,□,一般小売店［酒］（経営者）,・今月の売上をみると幾分良くなってきているのかと見受けられるが、天候等不確定要素が多く、３か月先まではこのまま良い状態が続くとは楽観できない。
,,□,百貨店（売場主任）,・郊外型量販店の増加や市内中心部でも競争が激しくなっており、同じような商品なら単価の安いものをという客が郊外店に出向いているケースが非常に多くみられる。商売が分散されていて、今後もその状態が続く。
,,□,スーパー（店長）,・これからピークを迎えるお中元の出足をみても、前年を大きく割り込んでおり、先行きの景気の明るさはなかなか見えない。
,,□,コンビニ（エリア担当）,・デフレの状況がしばらく続く。
,,□,コンビニ（エリア担当）,・市町村の予算は前年比較で更に減額されていることと、増税の話が出ていることから、将来的に景気が良くなる要素は見当たらず、消費が増加するとは考えられない。
,,□,衣料品専門店（店長）,・年配の客が多いので、年金を心配しており、この先も消費の回復は見込めない。
,,□,家電量販店（地区統括部長）,・前年は猛暑による季節商材と、オリンピック需要によるＡＶ商品が大きく寄与した。現状はデジタル家電が依然として好調を維持しているため、全体的には大きな変動はないと思う。
,,□,乗用車販売店（従業員）,・これから新型車が出る様子もなく、このままの状態が続く。
,,□,乗用車販売店（従業員）,・一般客の中で景気が良くなったという話はないため、販売台数は増えない。
,,□,高級レストラン（スタッフ）,・予約状況は良いが、客単価が下がっており、売上増は望めない。天候状況の良さや景気の悪くない道外企業の動きはみられるが、ランチの客層から判断すると、道内企業の厳しさもうかがえ、景気が良くなってくるとは予想しにくい。
,,□,スナック（経営者）,・少しずつ観光客が入り、客も増えているように感じられるが、地元の景気が悪いので地元客のリピーターが減っている。なかなか景気が回復する感じにはならない。
,,□,スナック（経営者）,・これから夏祭りで人が出てくる機会が多いが、ポケットマネーで飲みに来る人は限られる。
,,□,観光型ホテル（経営者）,・一気に夏型気候に突入し、旅行代理店からの引き合いは例年並みにあるが、実際の送客となると予定数が確保できていない。先の予測ができない状況であり、来客数の減少は必至である。
,,□,観光型ホテル（スタッフ）,・現時点における予約状況を前年同日で比較すると、８月は前年並み、９月は若干強含みとなっている。
,,□,旅行代理店（従業員）,・現在の状況から、景気が上向きになる要素はあまりなく悪化を防ぐのが精一杯である。
,,□,タクシー運転手,・規制緩和により札幌市内のタクシーの台数は増え続けており、利用客が減少傾向にあるので、これからますます厳しくなっていく。
,,□,タクシー運転手,・夏場の天候次第であるが景気が大きく変わる材料は見当たらない。
,,□,観光名所（職員）,・タクシーの空車状況が依然として目立つ。おそらくこのまま変化がないと思う。
,,□,その他レジャー施設（職員）,・変わらないというよりも不明である。地元球団やクラブの成績次第で、成績が悪ければ極端に下がり、成績が良ければ極端に盛り上がる。
,,□,住宅販売会社（従業員）,・デフレ現象が顕著に現れているので、メーカーとして単価を下げることが必要となるが、この部分の難しさから表面的には変わらない状況が続く。
,,▲,商店街（代表者）,・総体的な景気からみると、消費を抑制するような要因が薄く、消費者心理もやや安定している。しかし当エリアの大型店の存続が不透明であることから集客力が落ちており、中心市街地離れに歯止めがきかない状況である。
,,▲,家電量販店（経営者）,・大手百貨店の撤退など、悪いニュースばかりで、ますます停滞ムードが助長されている。
,,×,－,－
"企業
動向
関連

(北海道)",,◎,－,－
,,○,家具製造業（経営者）,・景気の先行指標である百貨店の家具売上が、前年より良い月が増えつつあり、住関連産業には明るい兆しが見えてきた。
,,○,建設業（経営者）,・受注面でピークを越し、人、物、金の動きが活発になる。ただし採算面では依然として厳しい状態が続く。
,,□,輸送業（支店長）,・建築資材の値上がり等にもよるが、道内は秋口くらいまで頭打ちになる。道外向けについては、当分の間、物件も順次受注できているため継続が見込まれる。ただし建築資材等については、道内外の物件ともに現在以上に良くなるということは考えられない。
,,□,輸送業（営業担当）,・原油高騰の現状が続けば、配船の遅れや、引き受け料金の見直し等が生じて厳しい状態となる。
,,□,通信業（営業担当）,・ここ２か月程度景気の上昇感が感じられるが、ここから更に上昇するには要因、起爆剤不足の感じを受ける。このため良い意味での横ばいである。
,,□,金融業（企画担当）,・大きなウエイトを占める建設業は公共投資の削減により厳しさが続く。また比較的底堅く推移してきた札幌市内のマンション建設も頭打ちとなってきた。最盛期を迎える観光業は愛知万博との競合もあり、大きな期待はできない。
,,□,司法書士,・現在の状況から判断すると希望は持てない。特定企業の回復ではなく、土木建築業など広い範囲での影響力を持っている企業の回復がポイントとなる。
,,□,その他サービス業［建設機械リース］（支店長）,・取引先が設備投資に慎重である。
,,□,その他サービス業［建設機械リース］（営業担当）,・今後も受注活動における厳しさに変わりはない。
,,▲,輸送業（経営者）,・燃料の高騰から、輸送関係や運輸関係は今後も相当収益への影響が見込まれる。
,,▲,その他非製造業［機械卸売］（従業員）,・主要顧客の下期の受注量が減少しており、資材の購入及び機械設備の更新を手控えている。
,,×,－,－
"雇用
関連

(北海道)",,◎,－,－
,,○,求人情報誌製作会社（編集者）,・非常用、つまり正社員の求人が微増している。また地域基幹産業である農業、畜産、酪農の動きが安定している。
,,○,求人情報誌製作会社（編集者）,・アルバイト、パート、派遣等の間接雇用に関しては、今年に入って順調に求人件数が伸びており、これといってブレーキになる要因が見当たらない。
,,○,学校［大学］（就職担当）,・予定の新採用者数を確保できなければ、秋採用及び通年採用が続く。
,,□,人材派遣会社（社員）,・有効求人倍率は改善傾向という話を聞くが、当社の求人も増加傾向ではあるものの、求める内容は高いレベルの即戦力の人材であり、少数の高レベル求人と繁忙に伴う単純作業系の求人に二分化されているように見える。さらにそれ以外は派遣、パートの活用ということになり、業績の悪化を経費面で調整しているように見え、景気回復にはいまだ至っていない。
,,□,求人情報誌製作会社（編集者）,・求人件数が落ち着いてきており、今後も大きな変化はみられない。
,,□,求人情報誌製作会社（編集者）,・大きな動きは予想されない。地域活性化の見通しが不透明である。
,,□,職業安定所（職員）,・建設業において、工事受注の遅れから従業員の雇用も遅れている。大手百貨店の閉店が発表され、雇用面での影響も懸念される。
,,□,職業安定所（職員）,・増えている求人は、派遣や業務請負、パート等の非正規型求人であり、求職者の約９割を占める管内常用就職を希望する者の雇用環境は依然として厳しい状況が続いている。
,,▲,＊,＊
,,×,－,－
,,,,
　２．東北（地域別調査機関：（財）東北開発研究センター）,,,,
,,,,（－：回答が存在しない、＊：主だった回答等が存在しない）
分野,,景気の先行き判断,業種・職種,景気の先行きに対する判断理由
"家計
動向
関連

(東北)",,◎,＊,＊
,,○,一般小売店［書籍］（経営者）,・夏の繁忙期に入る。ヒット作に貢献する映画等のメディアも多く予定されており、売上増が期待される。
,,○,一般小売店［カメラ］（店長）,・取引件数の増加が今後に繋がる。これから、行楽・レジャーシーズンに入るので更に期待できる。愛知万博や各種イベント、新製品などもあるので前年より期待できる。
,,○,衣料品専門店（経営者）,・今の状況でいくと大分夏らしく暑さを取り戻してきた。前年同様暑さが続くという想定のもと品ぞろえの見直しを図っている。前年は早期切上げした夏物を８月いっぱい継続する計画である。前年同様、残暑が厳しくなればそこそこの売上は確保できる。
,,○,衣料品専門店（店長）,・暦通りに気候が推移し、夏物商材が活発に動いていることやクールビズ効果でアダルトからシニア層がシャツ中心に色物、柄物等着こなしの幅を広げている状態が今後も続く。
,,○,乗用車販売店（経営者）,・前年は集中豪雨や新潟県中越地震などで非常に厳しい状態であったが、本年度はこの復旧作業で土木・建設ともにかなり忙しい状態である。
,,○,高級レストラン（支配人）,・夏の東北の祭りの期間の観光客、特に関西方面からの客の出足は早く、昼食団体は、既に現段階で８月６日～８日まで予約で満席となっており、今後に期待できる。
,,○,都市型ホテル（スタッフ）,・婚礼減少の対策として、年齢層を絞りクラシカルムードを前面に出し、昔ながらの和装挙式やブライダル専門学校の学生による演出を取り入れたブライダルフェアの効果か、７～10月の受注件数は前年比200％を超えている。アンケート結果から当地ではハウスウェディングブームは意外に早く終わる気配である。
,,○,住宅販売会社（従業員）,・展示場来客数は少ないが、確実に受注確約が取れている。
,,□,商店街（代表者）,・なんとなく数字が改善されていることが感じられているが、商店街全体で消費がこれから先良くなっていくのかというと、まだ大きな変化はなく、緩やかな上昇基調が続けば御の字である。
,,□,商店街（代表者）,・地区内の大型店では、お中元セールで活況を呈しているが、前年比をクリアすることに四苦八苦している。個々の中小の店ではいまだお中元セールという感じが見られない。
,,□,一般小売店［医薬品］（経営者）,・これから七夕やお盆の時期は人だけはたくさん出るが、売上にはつながらないと飲食店のオーナーは話している。
,,□,一般小売店［雑貨］（企画担当）,・夏季のボーナス、社会保険、個人の税金が可処分所得の減少につながることから、個人消費のしっかりした伸びがつづくとは考えづらい。
,,□,百貨店（売場主任）,・クリアランスセール自体は、売上、来客数も含め大いに期待できるが、必要なもの以外は買わないという傾向はますます強くなり、単価ダウンは免れない。
,,□,百貨店（企画担当）,・真夏に向けてお中元商戦とクリアランスの動きが大きなポイントとなる。浴衣、水着の動きは現状では厳しい。
,,□,百貨店（売場担当）,・衣類では、ニットの半袖等の売れ行きが悪く問屋に発注しにくい状況にあり、２、３か月後に秋物を早めに展開し、客の目を引き付けたいが未知数である。天候によっても変わる。
,,□,百貨店（販促担当）,・５月、６月とマイナス幅が徐々に縮小し、お中元商戦の立ち上がりも前年と同じ売上推移である。しかし、６月下旬からのクリアランスセールの集客力が年々落ちてきている。
,,□,百貨店（経営者）,・６月は天候に恵まれ、夏物の動きが良くなってきた。しかし、社会、経済状況を見ると必要なものは購入するが、個人消費がどんどん増えるとは想定できない。
,,□,スーパー（経営者）,・一個当たりの商品単価は、ほぼ横ばいである。来客数と買上個数はわずかながら上昇傾向が見られる。東北全体の流通業の売上高としては、前年比マイナスで推移しているのに対して当社は若干プラスで推移している。異常気象の推移によるがこのまま変わらない。
,,□,スーパー（経営者）,・新潟県中越地震に関わる復旧工事で土木建築が活況であり、これが全体を支えている。１、２年は続くと思う。
,,□,スーパー（経営者）,・今の状況が急速に好転するとは考えられない。客の動向、販売点数の動きからは、楽観的予測はできない。農作物の安値、ガソリンの値上がり等が家計に及ぼす影響は少なくなく、今後の消費動向については厳しい状況が続く。
,,□,スーパー（店長）,・超目玉品のような価格、ポイントを倍にするセール等に反応する客はいるが、その他の施策には無反応の客が多く苦戦が続く。
,,□,スーパー（店長）,・例年であればボーナスで消費の拡大を期待するが、支給額の減少、社会保険の天引き等で手取りが少なくなり、消費が進まない。
,,□,スーパー（総務担当）,・消費の景況は依然として同じ傾向が続いているが、競合店と商圏の食い合い競争が今後ますます増えて行くものと考えているので、企業としての真価が強く問われるようになると予想される。
,,□,スーパー（企画担当）,・客単価が低下していた傾向に加え、来客数の減少が続いている。客の購買の引き締めは依然として強く、今後も大きな変化は見込めない。
,,□,衣料品専門店（経営者）,・２～３か月先は秋物の時期となる。期待しているが、現在、歩行者や来客数の減少が続いており、その時に増加傾向に回復するかは不安である。慎重に想定すれば変わらず悪いままである。
,,□,乗用車販売店（経営者）,・新型車の動きは良いものの、大半を占めている既販車の動きが鈍く、全体の販売量としては前年並みに推移する。
,,□,乗用車販売店（経営者）,・新型車効果も一段落し、震災復興による買換えも一巡する。継続して好況は期待できるが、現在の伸び以上にならない。
,,□,乗用車販売店（経営者）,・新型車導入によるＣＭ効果は期待できるが、以前のように即決するケースは少なく契約までに時間がかかっている。新型車導入により急激に契約台数が伸びるのではなく、一台ずつの積み重ねで計画が達成される。
,,□,住関連専門店（経営者）,・まだまだ耐久消費財の需要の掘り起こしは望めない状況である。年度後半に景気回復するという見方があるが、家具関係の重要は伸び悩みである。
,,□,その他専門店［ガソリンスタンド］（営業担当）,・原油価格が高値安定で推移しており、高値が今後しばらく続く見通しである。消費の減少は続きそうで需要の回復が早急には望めない。価格の転嫁も苦戦が予想され、収益の落ち込みと、販売数量の減少とが景気の足を引っ張る。
,,□,スナック（経営者）,・来客数を見ると、どんどん団体客が少なくなっている。１～２人の客が多く、会社の飲み会も減っている様子を見ると当分はこのままである。
,,□,その他飲食［そば］（経営者）,・現在来客数、単価ともにほとんど変化はない。６月下旬から始めた夏向けのメニューが好調なので７月に向けて期待しているが様々な状況を考えると難しい。
,,□,その他飲食［弁当］（スタッフ）,・売上は、前年から95％で推移し、弁当、惣菜などの特別提供品の広告などいち早く実施しているがあまり効果は現れず、この傾向は３か月後も変わらない。
,,□,観光型旅館（経営者）,・行政のバックアップのおかげで、道路の真中に出来た足湯やオープンカフェとその前庭の足湯等、そぞろ歩きの楽しい温泉地づくりは着々と進み、評判が良い。当社としても、来客数を増やすために、忘年会の企画など早め早めの対応につとめていく。
,,□,都市型ホテル（経営者）,・１月から６月までの婚礼の実績は前年を大きく下回っているが、来月以降、年度の後半は組数も増加し、予約状況は前年並みまで回復できる見込みである。一般宴会も今までは低調であったが、10～11月と全国大会等の大口需要を控えているのでなんとか前年並みまで回復できればと予測するが、あくまで単発的なものであり、依然として地元企業は元気がなく、個人利用も低調であり、全体的な回復感はない。
,,□,通信会社（営業担当）,・設備投資案件の動きがかなり鈍くなっている。天候等の不安定要素による農作物関係の業態からの期待と失望感が高くなっている。
,,□,美容室（経営者）,・マスメディアの宣伝効果、ニュース等での情報が、消費者に景気が良いというイメージを与えている。地元企業としては状況に変化はないが、消費者側に底上げの意識がある。
,,▲,百貨店（売場主任）,・ガソリン価格が急上昇しており、消費マインドに水を差す。
,,▲,百貨店（広報担当）,・紳士服等に買換え需要、衣替え需要による若干の改善が見られるが、慎重な個人消費がより一層慎重になることが予想される。税負担に対するサラリーマン層の不安は看過できない状況にある。
,,▲,スーパー（店長）,・空梅雨で野菜の今後の動向が危惧される。野菜が高騰すれば、買上全体に及ぼす影響は大きい。
,,▲,衣料品専門店（店長）,・クールビズの影響で、軽量衣料、特にスラックス、シャツ、下着の動きが良くなっているが、秋以降このような特需がなくなり、売上の期待ができない。
,,▲,住関連専門店（経営者）,・都市間競争又は都市の中でも地域の格差、特に郊外型と中心街における客の流れが相当変化している。
,,▲,その他専門店［酒］（営業担当）,・これから先、通常では飲食店が期待される。お中元では酒は期待できない。飲食店は天候が順調であれば期待できるが、現在のように天候不順であると落ち込むことが想定される。
,,▲,観光型ホテル（スタッフ）,・これまでの状況判断の大きな要素は客単価の低減であったが、最近はこれに加えて、来客数の減少がみられている。
,,×,コンビニ（エリア担当）,・先行きの不透明感が、売上、来客数、客単価に現れている。客の財布のひもは固い。夏の気候によって期待できる部分はあるが、瞬間的な事象であり、総体的には良い方向に向かわない社会情勢にある。
,,×,衣料品専門店（経営者）,・本来、夏物のジャケット、ワイシャツ、ネクタイを取り揃えて販売しているが、クールビズの影響でバランスが崩れており、悪い方向に向かっている。
,,×,衣料品専門店（店長）,・クールビズの影響で、ジャケット等に目を向けるよりも今のままで我慢するというように、スーツの需要が減っていき、苦戦すると想定している。
