Ⅱ．景気の先行きに対する判断理由,,,,
,,□,都市型ホテル（スタッフ）,・宿泊とレストランの通常営業はほぼ前年並みを見込んでいる。レストランウェディングの受注状況は好転しているが、婚礼宴会は受注状況に回復感があるものの前年を下回っており、加えて一般宴会の受注状況が一進一退となっているため、全体では前年を下回る見通しである。
,,□,タクシー運転手,・タクシー増車の動きは運転手が確保できないため、ほとんど止まった。しかし、タクシーの稼働台数は減らず、利用客は増えないため、今後の状況は変わらない。
,,□,テーマパーク（職員）,・愛知万博という大きなイベントが終了したものの、客の旅行需要が先食いされた形である。予約状況をみても、前年比で今月と同様の厳しい数字となっている。
,,□,競輪場（職員）,・入場者数は若干減少しているが、１人当たり売上高はここ２、３か月横ばいであり、当面はこの傾向が続く。
,,□,住宅販売会社（総務担当）,・企業努力で話題を盛り上げても、税制改正などの外部要因により客の購入意欲がそがれる。
,,▲,一般小売店［事務用品］（営業担当）,・販売量の減少や販売価格の下落など厳しい状態が続いているが、現状の引き合いや見込みからみて更に悪化する。
,,▲,百貨店（営業担当）,・冬物も前倒しが予測されるが、今年は重衣料のコートのトレンドが特に聞かれず、また前年に比べてコートからジャケットへのシフトが進んでいる。この結果、客単価が低下し、売上実績は伸び悩む。
,,▲,スーパー（店長）,・競合店の出店やガソリンの値上げ等により、利幅が縮小する。
,,▲,スーパー（総務担当）,・ガソリンの値上げ、社会保険料の増加などの影響を受けて、客の購入量が減少する。
,,▲,コンビニ（経営者）,・ここ数か月の傾向をみると、周辺アパートの居住者の減少が続いているため、来客数が落ちている。８、９月は天候に恵まれたが、これから寒くなると、この人口減がもろに影響し、来客数が更に減少する。
,,▲,衣料品専門店（経営者）,・本来であれば秋物の売上が上昇する時期であるが、商店街の再開発による大型ショッピングセンターの工事が進み、通行客、来客数ともに減少するため、売上は今後も伸びない。
,,▲,タクシー運転手,・タクシーの燃料費の高騰が経営の圧迫要因となっているが、競争が激しいため、その分をタクシー料金に転嫁することができず、先行きは厳しい。
,,▲,パチンコ店（店員）,・遊技機がマンネリ化し、人気台が登場しないことから、先行きは悪化する。
,,×,商店街（代表者）,・当地区における中心街の地価の下げ幅は一段落した模様であるが、下げ止まったわけでなく、商店主は将来に悲観的である。
"企業
動向
関連

(北陸)",,◎,一般機械器具製造業（経営者）,・受注量・販売量、受注価格・販売価格などが好調に推移している。特にツーリング（切削工具）が入手困難になっており、工作機械の稼働率のさらなる向上がうかがわれる。
,,○,繊維工業（経営者）,・新しい企画商品が消費者のニーズにマッチすれば、株価の上昇が追い風となり、販売量の増加が期待できる。
,,○,電気機械器具製造業（経理担当）,・在庫調整は終了しているため、徐々に注文が増加する。
,,○,輸送業（配車担当）,・原油価格の高騰によるコスト高の懸念はあるが、株価の上昇などを背景に物量は持ち直しており、増加の期待感がある。
,,○,通信業（営業担当）,・事業所用の光回線ＩＰ電話の引き合いが出てきている。今までの電話番号がそのまま利用でき、かつコスト削減につながるためと思われる。一般家庭用の光回線ＩＰ電話については、ショッピングセンターなどのイベントで申込が増加しており、明るい兆しがみえる。
,,□,繊維工業（経営者）,・繊維業界では受注の先行きがますます不透明であるうえ、石油値上げの影響で企業収益の苦しい状況が続く。
,,□,金属製品製造業（経営者）,・２、３か月先の注文の入り具合は現状と変わらない。
,,□,通信業（営業担当）,・携帯電話の販売台数は減少傾向が続き、また月額使用料については下げ止まる傾向にある。
,,□,金融業（融資担当）,・これまで有利子負債圧縮に重点を置いていた大手製造業も今後の設備投資に対しては積極姿勢に転換しており、設備投資の増勢はしばらく続く。
,,□,司法書士,・子会社の吸収合併のような事業の整理や多重債務の相談も相変わらず多く、必ずしも景気が上向きとは判断できない。
,,▲,プラスチック製品製造業（企画担当）,・原油の更なる値上げで、先行きは一層苦しくなる。
,,▲,精密機械器具製造業（経営者）,・眼鏡の年内受注予測は年末にかけ下降気味である。各社では新商品開発に努力しているものの、受注につながるのは年明け以降になる。
,,▲,建設業（経営者）,・12月工期の工事を完成させるために、それなりに忙しくなるが、不採算工事が多いため、冬季ボーナスの資金もままならない。
,,×,－,－
"雇用
関連

(北陸)",,◎,－,－
,,○,人材派遣会社（社員）,・派遣社員、正社員を問わず、営業担当の求人が目立っており、先行きに明るさがみえる。
,,○,職業安定所（職員）,・求職者に占める在職者の割合が増加している。これは、現在の仕事より好条件のところを求めているためで、特に非正規型から常用への転職を希望する求職者が目立つようになった。学卒求人の提出状況からみると、近い将来、製造業の受注状況が安定し、常用求人が増加する。
,,□,求人情報誌製作会社（編集者）,・製造業の雇用はやや拡大しつつあるが、飲食・サービス関連業では求人の増加がみられない。
,,□,職業安定所（職員）,・新規求人は増加傾向にあるが、増えているのは派遣・請負求人であり、求職者の労働条件等が良くなっているわけではない。
,,□,民間職業紹介機関（経営者）,・工作機械、自動車関連などの好調企業は現状のまま推移していく。
,,▲,職業安定所（職員）,・事業の縮小や廃止により、人員整理を行う企業が増加傾向にある。
,,×,－,－
,,,,
　７．近畿（地域別調査機関：りそな総合研究所（株））,,,,
,,,,（－：回答が存在しない、＊：主だった回答等が存在しない）
分野,,景気の先行き判断,業種・職種,景気の先行きに対する判断理由
"家計
動向
関連

(近畿)",,◎,通信会社（経営者）,・案件数が増えている。
,,◎,競輪場（職員）,・12月は、競輪で一番競走グレードの高い特別競輪Ｇ１を開催するほか、年末という時期もあり、売上などがかなり伸びる。
,,○,商店街（代表者）,・商店街自体への来客は目立って少ないものの、天候にも恵まれて、早くから立ち上げた秋物は売行きが好調である。また、来客数も前年比で８％増加した。
,,○,一般小売店［酒］（経営者）,・ボジョレーヌーボーの予約販売がとても好調なので、今後に期待できる。
,,○,一般小売店［衣服］（経営者）,・月の半ばから秋物が売れ始めたので、この状態が続けば売上は伸びる。
,,○,百貨店（売場主任）,・改装効果に期待しているほか、紳士服関連はウォームビズの導入で新たな需要が期待できる。
,,○,百貨店（経理担当）,・株価次第ではあるものの、今のような上昇傾向が継続すれば、上位の客の購買意欲は今後も衰えることはない。特に、生活必需品以外の消費は活発になる。
,,○,スーパー（企画担当）,・若干客単価の上昇があって売上が伸びているほか、前年の異常気象からみて、今後は売上が前年比で増加する。ただ、１月前後については暖冬が予想されるなど、客の動向がどうなるかは分からない。
,,○,スーパー（経理担当）,・今までのように安いだけでなく、体に良い物やし好品などに客が流れている。
,,○,コンビニ（店長）,・現在の店頭の販売量は比較的堅調に推移しているほか、今年は前年９～10月の天候不順の反動増がある。
,,○,衣料品専門店（営業・販売担当）,・スーツだけの注文に終わらず、ベスト、シャツ、ネクタイなどを追加で購入する客が増加している。
,,○,乗用車販売店（経営者）,・新車の売行き、車検台数も好調で、予約も多い状況が続く。
,,○,乗用車販売店（営業担当）,・今年は東京モーターショーがある年なので、客は新車を見に来る。ガソリンが高騰しているのでコンパクトカーにシフトすることも予想されるが、全体には良くなっていく。
,,○,住関連専門店（経営者）,・客の様子が、必要な物は購入するという姿勢に変化してきている。
,,○,その他飲食［コーヒーショップ］（店長）,・京阪神では在阪球団の優勝が波及効果をもたらす。一時的ではあるが、景気が上向いている時期での優勝効果は大きく、３～４か月は好調が続く。
,,○,観光型ホテル（経営者）,・10、11月は年間を通じた旅行需要のトップシーズンであるが、愛知万博が終了したこともあり、グループ客、団体客を中心にまずまずの予約状況である。総販売量で前年の水準をなんとかクリア若しくは若干オーバーできる。
,,○,観光型旅館（団体役員）,・愛知万博が終わり、地域間競争の大きなネックが解消されたと同時に、秋の受注のペースが好転している。
,,○,都市型ホテル（スタッフ）,・愛知万博にシフトしていた客が、旅行代理店を中心に下期は関西へシフトする動きもある。また、ビジネス客の動向も活発化してきている。
,,○,旅行代理店（経営者）,・年末年始の旅行の受付が前年を上回っている。
,,○,タクシー運転手,・距離を問わず客の乗車機会が増加しているのは確実であり、企業の利用も今後回復傾向となる。
,,○,タクシー運転手,・これから京都は紅葉で客が増えるが、夜の飲み屋街は依然として悪いものの、昼間は良くなる。
,,○,通信会社（店長）,・冬の商戦を前に高額商品が発売されることで、冬のボーナスを見込んでの購入が増加する。
,,○,観光名所（経理担当）,・今月で愛知万博が終了し、旅行会社からの引き合いや申込、パンフレットの請求などが増えてきた。来客数や売上も少し回復し始めている。
,,○,ゴルフ場（経営者）,・10、11月の予約状況は、前年の水準を相当上回っている。
,,○,美容室（店長）,・セット販売を行っている化粧品で新商品が出るため、売上が増加する。
,,○,その他サービス［生命保険］（営業担当）,・ここ数年来高水準だった解約件数は完全に落ち着き、回復基調となっている。さらに、介護、医療保障など第３分野商品の販売が堅調に推移する。
,,○,その他サービス［ビデオ・ＣＤレンタル］（エリア担当）,・次世代型店舗の出店が増える。
,,○,住宅販売会社（従業員）,・これまでさほど多くなかった投資案件としてのマンション購入層が増えており、新たな市場が開拓されつつある。この市場が成熟するまでには、まだ需要を吸収する余力がある。
,,○,その他住宅［展示場］（従業員）,・アンケートの内容では、建築予算の多い１年以内の計画者が増えている。一方で、予算が少ない層も増えており二極化している。
,,□,一般小売店［時計］（経営者）,・近隣の大型ショッピングモールの新館がオープンし、年末には大規模なセールを行うことが懸念されるが、ショッピングモールで目当ての商品がなかった客が流れてくるという効果もある。
,,□,一般小売店［衣服］（経営者）,・10月から年末商戦にかけて非常に心配している。現時点から更に悪化すると、持ちこたえられない状態になる。
,,□,一般小売店［精肉］（営業担当）,・客の会話を聞いても、景気の良い話は全く出てこないし、先がみえてこない。
,,□,一般小売店［野菜］（店長）,・９月後半になっても全く購買力が伸びない。
,,□,一般小売店［コーヒー］（営業担当）,・新規参入店舗が健闘しているが、既存店舗との客の取り合いになっており、楽観視できない。
,,□,百貨店（売場主任）,・高額品の売上が苦戦する傾向は今後も続く。特に、年末にかけての最大の商戦であるクリスマスでも、買い控え傾向や単価の下落が起こる。一方、季節商材の衣料品は堅調であり、大きなヒット商品は見当たらないものの、百貨店の売上の下支えになっている。
,,□,百貨店（売場主任）,・百貨店の入店動向については、気温の低下に対してそれほど変化がないので、この秋シーズンについても厳しい。
,,□,百貨店（営業担当）,・地域的ににぎわっていくものの、ブランド品は他社との競争が更に激しくなる。
,,□,百貨店（営業担当）,・受注においては、客の方からの希望はなく、ニーズのありそうな物を提案していけばある程度の受注が見込めるが、まだ景気が上向きとはいえない。
,,□,スーパー（経営者）,・前年は相次ぐ台風の影響で農産物が高騰したことから、今年はその反動が心配される。しかし、鮮魚では近海物の良い商品を出すと確実に売れるなど、割合はまだまだ低いが高単価の物が売れ始めている。牛肉も和牛支持が拡大しており、品ぞろえ次第では単価の下落傾向に歯止めがかかる兆しが現れている。
,,□,スーパー（店長）,・競合店がまだ出店する傾向で、消費者の買い回りが予想される。年末商戦の結果で年明けからの状況が分かる。
,,□,スーパー（経理担当）,・気温がようやく平年並みとなり、秋から冬型の売場に合ってきた。また、ジンギスカンなどの羊肉が売れるなど、新しい鍋商材の売れ筋を予感させる動きもみられる。
,,□,コンビニ（経営者）,・コンビニエンスストア、ディスカウントスーパーなどを使い分けた購買傾向が顕著になるなかで、低価格化が進み、余分な買物はなくなりつつある。近い将来、ディスカウント業界は利便性、販売価格などの点でスーパー、コンビニとの競争に敗れて減少するが、まだ先の話で、今すぐには当店の販売増加につながらない。
,,□,コンビニ（経営者）,・客がマイペースに物を買うようになっているので、今より売上が落ちることはない。
,,□,衣料品専門店（経営者）,・９月も残暑が厳しく、秋物の出足に苦戦している。これから気候が定まり、例年は順調に売上が伸びる時期であるが、天候次第である。
,,□,住関連専門店（店長）,・依然として安い時期しか買わないという客の様子に変わりない。
,,□,その他専門店［宝石］（経営者）,・ガソリンの値上げで客の消費意欲にブレーキがかかっている。それ以外にも要因はあるが、現在の状況は変わらない。
,,□,その他専門店［医薬品］（経営者）,・業種の特徴として、天候や気候に左右される部分が大きい。秋口の気候が良く、過ごしやすければ、医薬品やドリンク類の動きが鈍くなるほか、長袖などの露出部分の少ない服装になるので、ダイエット食品を含む健康食品は夏ほど動かない。
,,□,その他専門店［印鑑］（店長）,・個人客の増える雰囲気がない。
,,□,一般レストラン（スタッフ）,・飲食業からみると、消費者の財布のひもは緩んでいない。これから先も、現状の横並びから変化はない。
,,□,都市型ホテル（支配人）,・愛知万博に流れていた宿泊客の動向はまだ把握しきれていないが、宴会予約の入りが悪い。
,,□,都市型ホテル（役員）,・宿泊及び宴会の２～３か月先の予約状況は、前年を上回る好調であるが、レストランについては周辺飲食店との競争が激しく低調である。ただし、ホテル全体としては現状を維持できる。
,,□,都市型ホテル（営業担当）,"・宿泊に関しては、９月までは非常に好調に推移していたが、10、11月の予約状況があまり伸びていない。特に、10月の修学旅行の予約数が例年になく少なく、団体予約もキャンセル率が高くなっている。ただ、愛知万博も終わって、個人の動きが間近になって動くことから、今後の伸びに期待している。
・宴会に関しては、一般宴会の10、11月の予約が悪く、下期も苦しい展開であるが、中宴会場を改装した効果もあって、婚礼が10、11月と前年より大幅に増えてきており、ほぼ前年並みとなる。"
,,□,旅行代理店（広報担当）,・今年の年末年始の日並びは長期連休を取りにくいものの、年末年始をはさんで３連休が２回あるので、温泉旅行やカニ目当ての国内旅行への需要が増加する。
,,□,タクシー会社（経営者）,・交際費、交通費の節約が続いている。公共交通機関、徒歩、自転車など、タクシーに代用できる部分は代用し、節約する傾向が続く。
,,□,通信会社（経営者）,・市場が飽和しているほか、画期的な新商品の投入が期待できない。
,,□,観光名所（経理担当）,・愛知万博も終わり、中部地区への営業活動を再開するが、来場者数の維持が精一杯である。
,,□,その他レジャー施設［イベントホール］（職員）,・新規の客のほか、既存客からの紹介もあるなど、良い兆候がみられる。
,,□,住宅販売会社（経営者）,・各種不動産の流通状態が安定期に入っているほか、相場も下げ止まったことから、短期的には良くも悪くもならない。
,,□,住宅販売会社（経営者）,・年末商戦に向けて期待感はあるが､市内への流入者数に変化は起こらない。また、未着工のインフラが多い。
,,□,住宅販売会社（従業員）,・分譲マンション業者、不動産ファンド共に土地仕入目標があり、土地価格が上昇しても購入せざるを得ない。
,,□,住宅販売会社（総務担当）,・土地価格の下落が止まり、一部の地区で好転しているが、駅が近いといった利便性のある物件のみで、全体の底上げにはならない。
,,▲,百貨店（企画担当）,・前年比での来客数の増加は見込まれるものの、競合他社の新店舗のオープンによる集客効果が一段落してくる。
,,▲,スーパー（経営者）,・競合店がオープンしたが、地域の人口は変わらないので競争が一段と激しくなる。
,,▲,コンビニ（経営者）,・競合店による飲料価格値下げの影響で売上が減少する。市場全体が飽和状態にあるなかで価格戦争に突入するようなことがあれば、収益面を考えると撤退も視野に入れざるを得ない。
,,▲,家電量販店（経営者）,・デジタル放送の開始が刺激となり、年末にかけて少し上向きとなる。
,,▲,タクシー運転手,・タクシーの台数が多過ぎて、客の取り合いになっている。
,,▲,タクシー運転手,・ここ２、３か月は価格競争が安定してきたが、先日テレビで、ある大手グループが初乗り料金を500円に値下げするという特集が組まれていた。もしこれが現実になると、第２次価格戦争が起こる。
,,×,一般小売店［精肉］（管理担当）,・米国産牛肉の輸入解禁が遅れているほか、国内の牛肉需要に供給が追いつかず、相場が高騰したままである。今後年末に向けて、お金を出しても商品がないという状態になる。
,,×,百貨店（店長）,・地域の経済が沈んでいて、顧客数が減っていることから、今後も厳しい。
,,×,その他レジャー施設［球場］（経理担当）,・プロ野球シーズンが終了したが、フランチャイズ球団が４位になったため日本シリーズの開催もない。この時期は、企業イベントや社会人野球など、集客があまり見込めないイベントが主となる。
"企業
動向
関連

(近畿)",,◎,金属製品製造業（管理担当）,・超大型案件の受注が決まったものの、納期対応のための人員の確保が難しい。
,,◎,建設業（経営者）,・商品やサービスの付加価値を高めようという意識が強まっている。そのために多少コストがかかっても取り組むという、戦略的な企業が増えている。
,,○,木材木製品製造業（経営者）,・受注量が前月までの水準と比べて格段に増加しており、今まで以上に業績が改善する。
,,○,出版・印刷・同関連産業（情報企画担当）,・得意先のなかで景気の悪い業界がはっきりしており、住宅でも戸建業界はいまだに悪いほか、製薬会社の統合も進んでいる。これらの勝ち組、負け組を見極めたうえで、安定成長している業界との関係を拡大すれば、厳しい状況を乗り切ることができる。
,,○,金属製品製造業（営業担当）,・自動車関係の取引先が増産を計画している。
,,○,電気機械器具製造業（経営者）,・原油価格の高騰、資源価格の高騰などの懸念があるほか、中国やアメリカの動きによる影響があるなかで、デジタル機器、自動車関連は動きが良くなる。
,,○,電気機械器具製造業（宣伝担当）,・12月には東北地方にも地上デジタル放送のエリアが広がるなど、地上デジタル放送対応の薄型テレビの需要に期待できる。
,,○,電気機械器具製造業（企画担当）,・家電照明などの商品は引き続き調子が良く、年末の最盛期に向け売上が増加する。
,,○,建設業（経営者）,・戸建分譲用の土地仕入価格が非常に高騰している。入札物件が非常に多く、なかなか購入できないのが現状である。今後、一般客にもその情報が伝わり、早く購入しないと価格が上がるというような環境になってくる。
,,○,建設業（営業担当）,・都心部の不動産価格の高騰により依然として先行きに不安は残るが、景気に明るさがあり、客にも投資意欲が感じられる。
,,○,新聞販売店［広告］（店主）,・折込広告がここ半年ほど良いので、各業種の景気は上向いている。
,,○,広告代理店（営業担当）,・年末に向けての企画がかなり出てきている。取引先による予算の配分も多い時期なので期待できる。
,,○,経営コンサルタント,・受注活動が上向き傾向で、良くなる傾向が顕著にみられる。
,,○,コピーサービス業（従業員）,・在阪球団の優勝に伴い、様々なイベントやセールが行われている。２年前の優勝に比べると経済効果は小さいものの、各業態とも主だったモチベーションが見当たらないなか、優勝の便乗セールが増加することから、多少の景気回復効果がある。
