Ⅰ．景気の現状に対する判断理由等,,,,,
,東京都,○,一般小売店［家具］（経営者）,来客数の動き,・今年に入ってからずっと来客数が少なかったが、６月中旬を過ぎた辺りから少しずつ客が来店するようになっている。景気が良くはなっていないが、幾らか来客数が増えてきている（東京都）。
,,○,一般小売店［食料雑貨］（経営者）,来客数の動き,・客の消費意欲が上がっている。
,,○,一般小売店［祭用品］（経営者）,来客数の動き,・祭りの人出は、新型コロナウイルス感染症発生前にほぼ戻っている。
,東京都,○,一般小売店［文房具］（経営者）,単価の動き,・例年８月は売上の落ちる月ではあるが、今年に関しては前月より売上が増加している。また、レジ通過客数は１割強の増加にとどまっているが、客単価が２割程度増加しているため、総売上としては増加傾向にある（東京都）。
,,○,一般小売店［酒類］（経営者）,来客数の動き,・マスクをしている人が減少し、客の行動が活発になっている。
,,○,一般小売店［眼鏡］（経営者）,来客数の動き,・メガネは、１年で８月が最も売れる時期である。新型コロナウイルス感染症発生前ほどではないが、ここ数年の来客数、売上より伸びてきている。
,,○,一般小売店［茶］（営業担当）,販売量の動き,・前月のお中元ギフトは減少したが、今月は暑中見舞いや残暑見舞いのギフト需要があり、売上が増加している。
,東京都,○,百貨店（売場主任）,お客様の様子,・夏休み期間で、家族連れ、海外からの団体客も多く来店しており、来客数、買上点数は新型コロナウイルス感染症発生前の2019年度を超える動きになっている。特に、円安のため、海外からの観光客は高級ブランドを自分用に何点か購入している（東京都）。
,東京都,○,百貨店（総務担当）,販売量の動き,・外国人旅行者の増加により、免税売上が化粧品を中心に大きく伸長している。また、食料品は値上げによる価格の上昇に加え、来街者数の増加により堅調に推移している（東京都）。
,東京都,○,百貨店（総務担当）,お客様の様子,・猛暑ではあるものの、客の購買行動は堅調である。前年と比較して、紳士、婦人共にファッション関連商材の動きが良い。それに訪日外国人の増加に伴う売上が加わり、全体として売上は良い傾向である（東京都）。
,東京都,○,百貨店（広報担当）,お客様の様子,・夏休みということもあり、外出や対面の機会が増加しており、それに伴う関連消費が引き続き上向きに推移している。特に、高付加価値な提案について、買物自体に体験としての価値を見いだす動きやインバウンド需要が下支えしている（東京都）。
,東京都,○,百貨店（営業担当）,販売量の動き,・今月は降雨が少なく、記録的な猛暑が続くなか、来客数が大きく伸長しており、前年比２けたの伸びを示している。夏季休暇による人流も活発であり、それに伴い手土産需要が好調である。生活必需性の高い商材を中心に値上がりが相次いでおり、買上点数の減少などの支出抑制は継続してみられる（東京都）。
,東京都,○,百貨店（営業担当）,来客数の動き,・この20数か月、来客数は前年を超え続けている。その結果として売上も連動し、新型コロナウイルス感染症発生前に届く月も出てきている（東京都）。
,東京都,○,百貨店（営業担当）,来客数の動き,・７月後半から、８月のお盆を含めた帰省客及び家族連れでの国内旅行増加の影響により、来客数の伸びが顕著になっている（東京都）。
,東京都,○,百貨店（販売促進担当）,来客数の動き,・インバウンドが増えてきている（東京都）。
,東京都,○,百貨店（財務担当）,販売量の動き,・インバウンドの売上が拡大し、景気を押し上げている（東京都）。
,,○,百貨店（企画宣伝担当）,来客数の動き,・来客数は確実に増加している。
,東京都,○,百貨店（管理担当）,販売量の動き,・食品だけでなく、衣料品のセールや身の回り品も売れている（東京都）。
,,○,スーパー（経営者）,販売量の動き,・今回良くなった理由はひとえに天候に恵まれたからである。暑さと、お盆商戦に台風が重なる心配はあったが、台風の進路がそれたため非常に動きが良かった。ただし、天候なので一過性のものかもしれない。県独自のキャッシュレス決済キャンペーンがまた始まったことも好調要因である。
,,○,スーパー（総務担当）,お客様の様子,・県独自のキャッシュレス決済キャンペーンがあるから、今のうちに買っておこうという雰囲気が大きい。
,東京都,○,スーパー（営業担当）,単価の動き,・猛暑のため夏物商材の売行きが好調である。今まで単価上昇に伴う販売量の減少、来客数の減少で相殺されていた部分が、夏物商材の好調により、販売量が少し回復傾向になっている（東京都）。
,東京都,○,コンビニ（経営者）,来客数の動き,・販売量が少し増えている（東京都）。
,,○,コンビニ（経営者）,来客数の動き,・天候に恵まれ、近隣のプールからの客が前年比120％となっている。
,,○,コンビニ（経営者）,来客数の動き,・これだけの猛暑のなかで、コンビニへの来店頻度が上がっている。ただし、商品の値上げ幅より売上が伸びている感じではないというのが現状である。
,東京都,○,コンビニ（商品開発担当）,来客数の動き,・確実に人流が活発になってきており、特に週末は動きが更に高まっている。人流に伴う売上増加も数値に表れている（東京都）。
,東京都,○,家電量販店（経営企画担当）,来客数の動き,・８月に入ってからの猛暑による季節商材等、耐久消費財の売行きや、地域、期間限定のキャンペーンの効果が大きくけん引している。また、インバウンド需要も順調に推移しており、物価高などの負の影響等、消費者の節約志向を上回る結果で推移している（東京都）。
,東京都,○,高級レストラン（役員）,お客様の様子,・秋に向け、イベントシーズンになり、予約数が徐々に増加し、規模も拡大しており、売上に期待できる（東京都）。
,,○,一般レストラン（経営者）,来客数の動き,・新型コロナウイルス感染症が５類に移行してから客の安心感が増して、３か月前と比べて出歩くようになっている。まず観光などから大分盛んになっている。
,東京都,○,一般レストラン（経営者）,単価の動き,・客単価は高位安定している。来客数は落ちていないので、売上も高水準で推移している（東京都）。
,東京都,○,その他飲食［居酒屋］（経営者）,来客数の動き,・予約数、来客数共に増えている（東京都）。
,東京都,○,その他飲食［カフェ］（経営者）,来客数の動き,・観光地の店舗では、新型コロナウイルス感染症の収束で前年より来客数が増え、戻りが早いが、都心の店舗は戻りが鈍い。状況としては良い方向に向かっている（東京都）。
,東京都,○,その他飲食［給食・レストラン］（役員）,単価の動き,・給食事業については、取引先の協力で、４月以降、委託費、食事単価が引き上がったことから、この３か月の収益は前年比で大幅に改善している（東京都）。
,,○,都市型ホテル（経営者）,来客数の動き,・夏休みを迎え、近隣の大規模コンベンション施設での大規模ライブ、フェスなどが予定どおり開催されたこともあり、宿泊は新型コロナウイルス感染症発生前に近い状態まで戻ってきている。総体的には、宴会等は夏なので入っていないが、回復傾向はみられる。
,,○,都市型ホテル（スタッフ）,来客数の動き,・夏季の旅行シーズンなので５月と比べればやや良くなっているが、新型コロナウイルス感染症発生前ほどの動きにはなっていない。
,,○,タクシー運転手,お客様の様子,・暑い日が続いていることで、昼間の利用が良い。アプリ配車の利用も増えており、１日を通して利用が増えている。
,東京都,○,タクシー運転手,来客数の動き,・このところの法人タクシーの乗務員減少、個人タクシーの台数減少に加えて、今夏は異常なほど暑い日が続いているため、利用者も多くなり、特に忙しい（東京都）。
,東京都,○,タクシー運転手,お客様の様子,・リモートワークがやや減少し、会社のタクシー利用が増えている。また、猛暑の影響で近距離の利用客が大分増えている（東京都）。
,,○,タクシー（経営者）,来客数の動き,・例年より暑いことが追い風となっている。
,,○,タクシー（団体役員）,来客数の動き,・タクシーの稼働台数が減っているため、乗客の総数は増えていないが、車両の供給不足により現在の稼働車両の運送収入は新型コロナウイルス感染症発生前に戻っている。
,東京都,○,通信会社（社員）,それ以外,・旅行や遊興費などのし好消費が旺盛になっている。オプション契約の伸びがみられる。休暇中の旅行先は、近隣から海外や遠方への長期滞在が増加している。飲食店の在客時間も深夜に及んでいる（東京都）。
,,○,通信会社（営業担当）,お客様の様子,・暑い日が続いたこともあり、家で過ごす時間が増え、インターネット環境をより高速なプランに切り替える客が例年より増えている。
,東京都,○,通信会社（管理担当）,お客様の様子,・電子化の動きが堅調であるため、法人向けは上向いている（東京都）。
,,○,ゴルフ場（経営者）,来客数の動き,・２か月前と比べると３％ほど来場者数が伸びているが、異常な暑さのため、夏休みでの増加は思ったほどではない。
,,○,競輪場（職員）,お客様の様子,・夏の期間にイベントを行ったところ、通常の３倍ほど集客が増加した。また、企画のターゲットを変更し、飲食を大人向け、縁日を子供向けと振り切ったことが功を奏したとみている。
,東京都,○,その他レジャー施設［総合］（経営企画担当）,来客数の動き,・法人団体の宴席や宿泊旅行等が３か月前と比較して確実に上向いている。また、インバウンドの動きも引き続き好調である（東京都）。
,,○,住宅販売会社（従業員）,販売量の動き,・今月の販売量は目標数字の約75％となり、やや悪い。ただし、３か月前と比べると約118％とやや良くなっている。当社の半期決算ということでキャンペーン展開を行ったが、販売は苦戦している。夏季休暇があったにもかかわらず集客、商談数も目標を達成することができていない。
,,○,住宅販売会社（従業員）,販売量の動き,・３か月前と比べれば新築アパートの売行きも良く、景気は良くなっているが、８月は夏休みということもあり、問合せや反響が少なく、若干落ち込んでいる。
,,□,商店街（代表者）,来客数の動き,・最近の暑さの影響がかなり出ている。商店街の歩行者数も若干減っているように感じるし、店に入ってくる客も、暑さのためか若干少なくなっている。
,,□,一般小売店［和菓子］（経営者）,来客数の動き,・新型コロナウイルス感染症に伴う規制が緩和されて初めてのお盆で、帰省土産は順調に売れたが、連日の猛暑で来客数が激減し、トータルすると余り良くない。
,,□,一般小売店［家電］（経理担当）,販売量の動き,・暑さの割にはエアコンの動きは静かである。他の商品の動きもそこそこある。祭り関係の電気工事や、省エネ型給湯器の工事などが多い。
,,□,一般小売店［傘］（店長）,お客様の様子,・客は必要な物を必要なときに購入するスタンスなので、セールをしても飛び付かない。
,東京都,□,一般小売店［生花］（店員）,それ以外,・３か月前の６月頃は、母の日も終わり、お盆やお彼岸でもなく、ちょうど谷間の時期である。８月はお盆があったが、東京は７月盆の方が多少売行きが良く、飛び抜けて８月が良かったということもないため、変わらない（東京都）。
,東京都,□,一般小売店［茶］（営業担当）,販売量の動き,・相変わらず販売数が伸びず、新規受注も増えずに苦戦している。決して営業努力を怠ってはいないのだが、世の中にさほど良いことがないのが要因の１つかもしれない。当社の取扱商材はどちらかというと夏向きではなく、寒い時期の方が良いのではないか（東京都）。
,東京都,□,百貨店（営業担当）,来客数の動き,・インバウンドは堅調であるものの、国内客の消費が鈍化しており、景気が上向いているとは言い難い状況が続いている（東京都）。
,,□,百貨店（販売促進担当）,お客様の様子,・前年比で売上は伸長しているものの、猛暑や台風、ゲリラ豪雨など、天候による影響を受けている。何より物価上昇の影響が大きくなり、特に、食品は影響が大きい。
,東京都,□,スーパー（経営者）,来客数の動き,・相変わらず来客数の回復が思わしくない。したがって、全体の売上も伸びない（東京都）。
,,□,スーパー（店長）,それ以外,・お盆を過ぎても暑い日が続いているため、飲料やアイス等の夏物商材の売行きが好調を維持している。値上げの影響もあるため、賞味期限間近や品質劣化による見切り品の購入を目的に来店する客が、開店時を中心に増えている。
,東京都,□,スーパー（店長）,販売量の動き,・来客数は前年並みを維持している。一方、値上げの影響もあり客単価は上がっているものの、買上点数は前年割れが続いている（東京都）。
,東京都,□,スーパー（店員）,お客様の様子,・気候の変化、気温の上昇等により、売れ筋に変化はあるものの、全体的な売上は横ばいである（東京都）。
,,□,スーパー（仕入担当）,来客数の動き,・今月も１品単価の上昇により前年を超えているが、来客数はやっと前年を上回るという状態である。買上点数も減っており、節約志向が続いている。
,,□,スーパー（販売担当）,来客数の動き,・営業的には、猛暑、新型コロナウイルス感染症の５類移行、外出機会の増加と、販売のチャンスは多数あり、来客数も増加している。ただし、商品価格の上昇や来店におけるガソリン代を考慮すると、先行きは不透明である。
,東京都,□,スーパー（食品担当）,来客数の動き,・食料品は値上げにより単価が上昇している。衣料品などは前年のコロナ禍の反動により販売額が上がっているが、ガソリン価格の高騰から来店頻度は減少傾向にある（東京都）。
,,□,コンビニ（経営者）,販売量の動き,・来客数及び売上が前年を大きく割っている。
,東京都,□,コンビニ（エリア担当）,販売量の動き,・盛夏期の売上の伸びが新型コロナウイルス感染症発生前の水準に戻っている。お盆時期は台風の影響で客足が遠のいたものの、全体としては前年比で高い水準を維持している（東京都）。
,東京都,□,衣料品専門店（店長）,販売量の動き,・着物事業における浴衣需要が一段落し、ドレス事業、和装カジュアル事業の秋商戦に移行しつつある。しかし、全国的な残暑により秋物の動きが鈍く、夏物セールと着物事業の顧客招待展示会で前年売上を確保している（東京都）。
,,□,家電量販店（店長）,来客数の動き,・夏休みやお盆で帰省する人が増え、地域柄、若い世帯が多いため、帰省して戻ってくる数より出ていく数が多く、来客数が想定より減っている。また、夏の催しの影響か、週末でも極端に来客数が少ない日がある。
,,□,家電量販店（店長）,来客数の動き,・来客数に大きな変化はなく、繁忙期の忙しさは少なかった。値上がりも続いているため、現状がまだ続く。
,,□,乗用車販売店（経営者）,販売量の動き,・自動車の整備は順調に入っているが、販売は余り芳しくない。客の来客はあるものの、なかなか成約に結び付いていない。
,,□,乗用車販売店（経営者）,来客数の動き,・連日の猛暑の影響で新車購入の来客数は減少しているが、整備部門の来客数は増えているため、前年並みである。
,東京都,□,乗用車販売店（販売担当）,お客様の様子,・新車の売行きが落ちていることと、整備代を減らしたいのか整備に関する注文が減っていることがある。ガソリン代や諸物価が上昇しており、客としてはどうしても削れるものから削っていきたいということで、車検も基本的な点検項目だけで良いというような依頼が多い（東京都）。
,,□,その他専門店［ドラッグストア］（経営者）,それ以外,・７月末から始まった県独自のキャッシュレス決済キャンペーンが非常に好調で、新規客が増えている。
,,□,その他専門店［ドラッグストア］（経営者）,販売量の動き,・販売量がやや少なく、動きが余り芳しくない。
,東京都,□,その他専門店［貴金属］（統括）,お客様の様子,・海外からの一般客が増加し、店舗はにぎわいを見せているが、実際の購入にはつながっていない（東京都）。
,東京都,□,その他専門店［ガソリンスタンド］（団体役員）,販売量の動き,・原油価格の上昇によって、今後も元売りからの仕切価格が上がってくることが予想される。その分のコスト転嫁がスムーズにできるのか、消費者は買い控えをするのではないかという懸念がある（東京都）。
,東京都,□,その他小売［ショッピングセンター］（統括）,お客様の様子,・物価の上昇については実感があるものの、賃金上昇は追い付いていない（東京都）。
,東京都,□,その他小売［生鮮魚介卸売］（営業）,お客様の様子,・毎日暑いため、客の買い控えが続いており、売上が伸びない（東京都）。
,東京都,□,高級レストラン（営業担当）,来客数の動き,・８月単月の実績は、前年比170.6％、2019年比87.6％となっている。前月までの2019年比は70％台であった。新型コロナウイルス感染症発生前から年間を通じて２月、８月は閑散期に当たる（東京都）。
,東京都,□,高級レストラン（仕入担当）,来客数の動き,・春から景気は高止まり感がある。一方、商材の価格改定はガソリンを始めこれまで同様に続いており、これが経済活動を鈍化させる要因にならないか、一抹の不安はある（東京都）。
,東京都,□,高級レストラン（経理担当）,販売量の動き,・夏場で販売量が落ち込んでいるが、過年度との比較においては、３か月前との傾向は大きく変わっていない（東京都）。
,東京都,□,一般レストラン（経営者）,来客数の動き,・外国人観光客の増加が依然として続いている。裏通りの同業各店にも外国人客が目立つようになっている（東京都）。
,東京都,□,一般レストラン（経営者）,販売量の動き,・３か月前の５月１日から29日までの前年比は、売上111.9％、来客数96.7％である。今月８月１日から29日までの前年比は、売上98.8％、来客数92.1％である（東京都）。
,東京都,□,一般レストラン（経営者）,来客数の動き,・飲食店では８月は売上が減少することが多いが、今年は猛暑のなか、ランチでも客がかなり来店している。週末も家族連れが予約を取って来店することが多い（東京都）。
,,□,一般レストラン（経営者）,来客数の動き,・飲食業部門については売上が伸びているが、これは業態がインド料理店で、暑さで食欲が鈍るものの、スパイシーな料理は需要が増える傾向にあるためではないかと考えている。食品輸入業については、円安が原因で値上げした影響が出ているのか、ほぼ横ばいである。
,,□,旅行代理店（経営者）,お客様の様子,・質問や問合せが余りなくなっている。物価高のために皆二の足を踏んでいる状態である。
,,□,旅行代理店（従業員）,お客様の様子,・新型コロナウイルス感染症の影響による案件の延期や中止はほぼなくなっている。例年の案件も徐々に戻ってきており、今後の推移を注視している。
,東京都,□,旅行代理店（営業担当）,お客様の様子,・客との商談から、変わらないと感じる（東京都）。
,東京都,□,通信会社（経営者）,販売量の動き,・少しずつ受注数が増加しているものの、機器等の値上がりにより利益は変わっていない（東京都）。
,東京都,□,通信会社（社員）,お客様の様子,・イベントが復活し、司会の引き合いが増加しているが小規模で、金額が以前のレベルにはなっていない（東京都）。
,東京都,□,通信会社（社員）,お客様の様子,・端末をフックにした契約は伸びてはいるが、短期での解約が多い（東京都）。
,,□,通信会社（営業担当）,販売量の動き,・住民移動が前年同月比で横ばいであること、お盆の時期に外出する人が増え不在が多かったこともあり、固定インターネットの契約数は若干の増加にとどまっている。
,東京都,□,通信会社（局長）,販売量の動き,・インターネットやモバイルの契約数は増加しているものの、ＣＡＴＶや固定電話は鈍化しており、純増ベースではほとんど変わらない傾向にある（東京都）。
,東京都,□,通信会社（経営企画担当）,お客様の様子,・案件、商談数共に余り変化はみられない。商談数の増加を期待している（東京都）。
,東京都,□,通信会社（営業担当）,来客数の動き,・３か月前と比べると、加入希望の問合せが半分に減っている。景気に左右されてなのかは分からないが、人の反応が鈍化してきている（東京都）。
,東京都,□,通信会社（経営企画担当）,販売量の動き,・前年度に比べて収入実績が減少している（東京都）。
,,□,パチンコ店（経営者）,来客数の動き,・人の動きが活発になる一方、温暖化や気候変動により外出を控える向きもある。
,東京都,□,その他レジャー施設［ボウリング場］（従業員）,来客数の動き,・新型コロナウイルス感染症の５類移行時の勢いはなく、前年とは違い、客の滞在時間は長くなり、来客数も多いものの、３か月前から変化はない（東京都）。
,,□,美容室（経営者）,来客数の動き,・新型コロナウイルス感染症の影響かもしれないが、高齢の客の来店頻度がいまだに鈍っている。
,,□,その他サービス［保険代理店］（経営者）,お客様の様子,・全般的に変化はないが、景気の上向き感がややみられる。
