Ⅰ．景気の現状に対する判断理由等,,,,,
,,□,乗用車販売店（経営者）,販売量の動き,・ようやくメーカーのテレビＣＭが解禁になったが、春先に発売予定だった新型車は未定のままである。厳しい状況は続いている。
,,□,乗用車販売店（従業員）,お客様の様子,・明らかに異常な気候、ロシアによる戦争や原発処理水の問題など負の話があまりにも多過ぎて、国民は不安を感じている。
,,□,乗用車販売店（従業員）,販売量の動き,・客との会話から、生活に係る支出増加の負担を余り感じていない人と負担を切実に捉えている人の２極化が進んでいる。やはり生活に余裕を持つ人でないと新車購入の話は現実味を持たないし、販売店が勧める新しい買い方にも関心を寄せてもらえない。
,,□,乗用車販売店（従業員）,お客様の様子,・客との会話で１番多いのはガソリン価格である。この地方は自動車がないと不便極まりないため、家計に厳しいという声が多い。燃費の良いハイブリッド車や電気自動車の話題も出るが、価格が以前より上がっており、こちらもメリットが少ないとの話である。来客数も前年と比べると半減しており、厳しい状況が続いている。
,,□,乗用車販売店（従業員）,単価の動き,・人気の国産高級車は海外でも人気があってリセール価格がかなり高いため、リセール目的で買う客が増えている。高級車のため利益率も高いが、すぐにオーダーストップか長納期になってしまう。
,,□,乗用車販売店（販売担当）,お客様の様子,・これまでは車検を機に買換える客が多かったが、ここ最近は買換えではなく車検を通して乗り続ける客がかなり増えている。将来の不安があるためではないかと推測する。
,,□,その他専門店［貴金属］（経営者）,来客数の動き,・８月は例年来客数が減少する傾向にあるが、今年は酷暑やゲリラ豪雨のせいか、更に悪化した。
,,□,一般レストラン（スタッフ）,来客数の動き,・今月は酷暑であったが、雨が続くような悪天候になるケースが少なかったため、集客の様子は良かった。
,,□,一般レストラン（従業員）,来客数の動き,・夏のイベントが終わり、消費も少し収まる。
,,□,その他飲食［仕出し］（経営者）,お客様の様子,・物価が上がっている割に賃金の上昇が少なく、追い付いていない。
,,□,旅行代理店（経営者）,販売量の動き,・全国旅行支援もほとんど終了し、新型コロナウイルス感染症の影響も少なくなり、秋口から団体旅行の受注も入っているが、まだ以前ほどではない。
,,□,旅行代理店（経営者）,お客様の様子,・お盆休み明けより、10月から３月の問合せも徐々に増えている。まだ旅行代金の値上がりや海外旅行での価格高騰の認知度が低く、新型コロナウイルス感染症発生前の代金では旅行に行けないため、旅行代金を聞いて見直す客も多い。決して手軽ではないが久しぶりに出掛けた海外旅行はとても楽しかったという声も多い。
,,□,タクシー運転手,来客数の動き,・客の動きに変化がみられない。
,,□,通信会社（企画担当）,販売量の動き,・新規契約者数や解約数をみると前年より多少は良いものの、トータルでみると動きは鈍い。
,,□,通信会社（営業担当）,単価の動き,・機器の値上がりは落ち着いたが、ガソリン代や人件費の値上がりにより工事費の価格改定が実施され、客の予算に合わず見送られることがある。
,,□,テーマパーク職員（総務担当）,来客数の動き,・７月は目標に比して85％、前年比では89％で、４月から７月累計でも目標に比して81％、前年比78％と良くなってはいない。４月から５月と比べれば良くなっているものの、前年比では２割程度入園者数が減っている。
,,□,ゴルフ場（支配人）,来客数の動き,・今月も入場者数は前年と比べ伸び悩んでいる。お盆時期の台風、猛暑や後半での雨の影響が大きい。４月以降、前年より入場者数の減少が続いているため、３か月前と同様景気は良くないまま変わらない。
,,□,住宅販売会社（従業員）,販売量の動き,・大きな変化はない。新型コロナウイルス感染症の分類が５類感染症に移行したが、再び周りでも感染者が発生する傾向にある。
,,□,その他住宅［不動産賃貸及び売買］（営業）,来客数の動き,・広告への反響数は新型コロナウイルス感染症発生前とほとんど同じになってきたが、単価が下がっている。
,,▲,商店街（代表者）,お客様の様子,・ロシアの内政問題やガソリン価格高騰の影響で、少し景気が悪くなったと皆が言っている。
,,▲,一般小売店［酒類］（経営者）,販売量の動き,・飲食店の客は金の使い方がますますシビアになっている。客の多くが食前から食後まで飲物のオーダーはせず長時間滞在する。
,,▲,百貨店（売場主任）,お客様の様子,・インバウンドの来店があり、日本人よりインバウンドの方が購入客は多い。日本人は散歩がてら涼みに来て少し話して帰る年配者は多いが、購入客は少ない。
,,▲,スーパー（店長）,お客様の様子,・お盆前までは、来客数は減少しているが値上げによる客単価上昇や帰省などの手土産等の売行きも良く、売上は前年を超えていた。お盆明けは、反動で一気に買い控えが進み、買上点数が大幅に減って売上が減少傾向にある。
,,▲,スーパー（店員）,販売量の動き,・中旬はお盆商戦の手応えが全くなかった。墓参り用の切り花は順調だったが、帰省や手土産など贈答用果物の売上が全く伸びなかった。やはり暑さが影響していたのか、昼から夕方にかけての来客数は減少が続いた。
,,▲,スーパー（総務）,単価の動き,・１人当たりの買上単価が下落している。
,,▲,衣料品専門店（店長）,お客様の様子,・客単価が下降続きである。できるだけ支出を減らそうという意識がある。仕事がないため地方に出稼ぎに行ったり、利益率の低い仕事を請け負う客が増えている印象を受ける。
,,▲,衣料品専門店（売場担当）,単価の動き,・価格が高くなっており、安い品を求める客がかなり増えている。葬儀のために礼服が必要だがそれほど着る機会がないため、安い物が欲しいという客が増えている。以前は良い物を長く着る人もいたが、今は着る回数が少ないため安い物でよいという客が多い。
,,▲,乗用車販売店（従業員）,単価の動き,・全体的に問合せも販売量も少ない。全くないわけではないためそれほど悲観はしていないが、もう少しあってもよいと考える。３か月前と比較すると良くない。
,,▲,一般レストラン（経営者）,お客様の様子,・ガソリン価格の高騰が大きい。助成延長という話だが、いつまで続くか分からない。ガソリン価格の税制度を根本的にもう少し何とかしてもらえれば、市民からも良くなったという声が聞こえてくると考える。
,,▲,一般レストラン（経営者）,それ以外,・アルコール類や食品の全てにおいて値上げがあり、当店のような小さな飲食店では、価格への上乗せが厳しい。
,,▲,その他飲食［ワイン輸入］（経営企画担当）,販売量の動き,・様々な物価が上がるなか、購入量を控える動きが出てきており、販売量は前年を５から10％下回っている。
,,▲,観光名所（案内係）,それ以外,・メディアでいわれているほど人の動きは多くない。特に、富士登山をする人は、外国人団体客は多いが日本人は少ない。
,,▲,パチンコ店（経営者）,販売量の動き,・来客数の動きから、やや悪くなっていると判断する。
,,▲,理美容室（経営者）,来客数の動き,・８月は忙しくなる月であるが、客が余り来ない。
,,▲,美容室（経営者）,お客様の様子,・この暑さで客が日中は外出しなくなった。
,,▲,その他サービス［介護サービス］（職員）,それ以外,・物品調達、ガソリン等運営コストの上昇や、次期介護保険の改正による影響から徐々に利益への影響が出てきている。
,,▲,設計事務所（経営者）,来客数の動き,・２～３か月前からかなり暇な状態が続いている。新規の案件がかなり少ない。
,,▲,設計事務所（職員）,お客様の様子,・客からは景気の良くなる話は全く聞かない。
,,▲,住宅販売会社（従業員）,販売量の動き,・契約のための見積りは17件提出したが３件の成約に終わった。検討はしたが最終的に慎重に判断する客が多い。物価上昇が止まらないなか、勢いでの購入はできない人が多い。住宅は高額な購入であるが勢いも不可欠である。購買マインドが上がらない世情を実感する。
,,▲,住宅販売会社（従業員）,お客様の様子,・住宅販売会社の対応が悪くなっている。会社の問題なのか営業担当者の問題なのか、会社にゆとりがなくなり、契約後の対応が悪くなっているという話を聞く。
,,▲,その他住宅［住宅管理］（経営者）,お客様の様子,・物流倉庫の管理、内装工事を担当しているが、ファッション系の衣料、靴、雑貨の物量が増えている。関係者に聞くと、人海戦術で時間とコストが掛かり利益が上がらないが、荷物全体が減っているなか衣料品関係の伸びに助けられているようである。どの企業も、コストが上がり苦戦している。
,,×,商店街（代表者）,それ以外,・原料資材の価格高騰により利益が減っている。その分を価格に反映して売りたいが、価格競争が厳しくなかなか値上げができない。非常に厳しい状況である。
,,×,スーパー（店長）,来客数の動き,・来客数が前年比95％前後で推移している。
,,×,美容室（経営者）,それ以外,・今月は新型コロナウイルス感染症や暑さの影響で客の入りが悪かった。
,,×,住宅販売会社（経営者）,来客数の動き,・気温が上がり過ぎ、暑くて客が外出しないため来客数が減少した。異常事態である。
"企業
動向
関連

(東海)",,◎,－,－,－
,,○,食料品製造業（経営企画担当）,受注量や販売量の動き,・夏物商戦が比較的好調に推移している。春先に実施した価格改正は、マーケットにおける理解を得られつつある。出荷量ベースにおいても前年実績に近づいてきた。
,,○,輸送用機械器具製造業（品質管理担当）,取引先の様子,・今まで中止していた業界の展示会などが再開し始めた。
,,○,通信業（総務担当）,それ以外,・各地で夏休みイベントが開催され、人流が発生して物やサービスが消費されている。地元町内でも盆踊りが開催され、予算を使って大量に景品の購入と配布を実行した。消費が膨らむことが景気を支えている。
,,○,不動産業（経営者）,それ以外,・例年同様に晴れの日が多く、新型コロナウイルス感染症に対する不安も解消していることから、前月同様に外出や遠出をする人が増加傾向になっている。外出の増加に伴い、今月の売上は前年を上回る状況となっている。
,,○,その他非製造業［ソフト開発］（経営者）,受注量や販売量の動き,・大手自動車メーカー関連の生産が上向き、全体的には好調に推移している。ただし、大きな案件は出ていない。当社では多忙な状態が続いている。
,,□,パルプ・紙・紙加工品製造業（顧問）,受注量や販売量の動き,・猛暑、物価高や買い控え等のためか、受注量、販売量が全般的に伸びず横ばいであり、景気は３か月前と余り変わらない。
,,□,化学工業（総務秘書）,それ以外,・酷暑が厳しい夏季であったが人出は多く、厳しい季節感を久しぶりに味わっているようにも見える。アフターコロナを満喫したいという消費者マインドは、１～２年は続くのではないか。良好な景気は継続すると見込む。
,,□,窯業・土石製品製造業（社員）,受注量や販売量の動き,・お盆休み前の駆け込み受注があったが例年のことであり、特に３か月前と販売量は変わらない。
,,□,金属製品製造業（従業員）,受注量や販売量の動き,・引き続き受注量はエリアを問わず多く、仕事をこなすのが精一杯だが、価格転嫁が進まないことと固定費など経費増加のため、利益は減少傾向が続く。
,,□,電気機械器具製造業（経営者）,受注量や販売量の動き,・新型コロナウイルス感染症の収束に伴い、客先業界ではやや良い状態が３月から８月まで続いている。お盆前はある程度受注があったが、８月後半は今のところ少ない。この２～３か月の受注量は変わらない。
,,□,電気機械器具製造業（営業担当）,受注量や販売量の動き,・新製品が出ているものの、大きな変化はない。
,,□,建設業（役員）,受注量や販売量の動き,・夏休みも終わりに近づき、この１週間で客の動きが良くなっている。商談の件数というより、真剣に検討する客が増えている。
,,□,建設業（営業担当）,取引先の様子,・受注はあっても必要な部材が入らないため、作業が滞る状況が変わらない。見積りを出しても、部材が高くなっているためなかなかゴーサインは出ないが、年度末頃になれば出てくると考える。
,,□,輸送業（従業員）,受注量や販売量の動き,・荷量は回復した。仕事量だけは新型コロナウイルス感染症発生前に戻ったといえる。ただし、燃料を始めとした各種経費は増大している。賃金を上げたくても運賃が上がらないとできないが、荷主もそう簡単には受け入れられない。
,,□,輸送業（従業員）,受注量や販売量の動き,・企業間の輸送物量が鈍化している。2024年問題があるものの、現実には物量の減少に伴い価格の大幅値引きが横行している。
,,□,輸送業（エリア担当）,受注価格や販売価格の動き,・１トン当たり単価の動きを月次でみると、月ごとに運賃値上げ幅が縮小している。会社の営業努力で客から適正運賃を収受する流れで動いているが、その動きが低迷し運賃アップにつながっていない。一巡したということもあるかもしれないが、客の理解がなかなか得にくい状況にある。
,,□,通信業（法人営業担当）,それ以外,・公的年金の運用は株高と円安により安定しているようだが、ガソリン価格の高騰や食料品の値上げが家計を圧迫していることが心配である。
,,□,金融業（従業員）,それ以外,・原油価格の上昇が家計を圧迫しているという声を多く聞くようになった。また、物価の上昇も続いている。
,,□,金融業（従業員）,取引先の様子,・現在の景気は以前と比べると良くなっているようにみえるが、やはり物価高やガソリン価格の高騰などで将来への不安があり、必要な物だけを購入する風潮がある。
,,□,金融業（企画担当）,取引先の様子,・原材料高は変わりなく、販売価格に転嫁できない企業は引き続き厳しい。中小企業では賃金が上がっておらず、個人消費も厳しい状況が続いている。
,,□,不動産業（開発担当）,受注価格や販売価格の動き,・当地域のマンション分譲価格や売行きには変化がない。
,,□,広告代理店（制作担当）,取引先の様子,・人の動きがかなり増え始めたこともあり、交通関係の広告出稿が増えている。
,,□,公認会計士,取引先の様子,・取引先の売上推移をみると、前年よりは回復傾向だが３か月前とは余り変わっていない。また、業種によって大きな差がある。国内消費は少しずつ戻っているが、海外と取引している業種は、円安の影響で売上こそ多少回復傾向にあるものの利益ベースではほぼ変わらない状態である。
,,□,会計事務所（職員）,取引先の様子,・夏のボーナス額は前年とほぼ同じか少し増えている。しかし、ガソリンや食品の値段が相当上がっていることを考えると増額の効果は相殺される。
,,▲,化学工業（営業担当）,受注量や販売量の動き,・半導体向け電子材料薬品の需要が低調である。特に中国向けが減少している。また、８月は稼働日の影響で容器の出荷量が減少した。
,,▲,一般機械器具製造業（営業担当）,受注量や販売量の動き,・引き合いは減っていないが、設備の価格競争が一段と厳しくなっており、なかなか受注につながらない。
,,▲,電気機械器具製造業（経営者）,受注量や販売量の動き,・５月以降、前年比30％程度生産量が減少している。
,,▲,輸送用機械器具製造業（管理担当）,それ以外,・ガソリン代の高騰が止まらない。通勤には直接の打撃であり何とかしてほしい。その他でも値上げが続いており、良くなる気配はない。
,,▲,輸送業（経営者）,受注量や販売量の動き,・製造業を中心に出荷量が落ちている。特に住宅などの建材系での落ち込みが激しい。また、燃料コストの上昇や人手不足が続き利益を押し下げている。
,,▲,通信業（法人営業担当）,競争相手の様子,・値引き競争が激化して参入者がほぼ固まっていたビジネス利用のネットワーク回線市場に、新たな競合が参入してくるという情報がある。当社が抱える大規模顧客は既にターゲットとなっており、一層の値引きを武器とした営業を受けているという。新参者がほぼ飽和状態のビジネス回線市場に斬り込むメリットは、長期間安定的な収入を得られるところにある。各社が利益を削ってでも収入を確保しなければならない状況は、各社のキャッシュフローの苦しさに起因すると察する。
,,×,鉄鋼業（経営者）,受注量や販売量の動き,・受注量が前月比で２割ほど落ち込んだ。
,,×,金属製品製造業（経営者）,受注量や販売量の動き,・受注量が減少している。材料価格が低下傾向にあるため、引き合いの価格が低下している。
,,×,新聞販売店［広告］（店主）,受注量や販売量の動き,・折込広告が受注できない。
"雇用
関連

(東海)",,◎,－,－,－
,,○,アウトソーシング企業（エリア担当）,周辺企業の様子,・自動車製造各社においては、工場稼働停止もなくなり年間計画達成に向けた通常の生産体制が戻ってきており、部品生産関係の仕事は毎日フル操業の状態が続く。ただし、人手不足問題が出始めている。
,,○,新聞社［求人広告］（営業担当）,周辺企業の様子,・街中の人出や店のにぎわいなどが、前のように戻ってきている。
,,□,人材派遣会社（社員）,求人数の動き,・主にリゾート関連での求人が増えた。
,,□,人材派遣会社（営業担当）,周辺企業の様子,・引き続きメーカーを中心とした各社でのエンジニア採用熱は高い状態である。
,,□,人材派遣会社（営業担当）,求職者数の動き,・求人数は増加しつつも、求職者数が伸びないため、採用数は変わらない。
,,□,人材派遣会社（営業担当）,それ以外,・ガソリン代など物価高騰が目立つ。
,,□,新聞社［求人広告］（営業担当）,それ以外,・県内で開催された大型イベントの効果によるにぎわいはあったが、一時的な状況と考える。
,,□,職業安定所（所長）,求人数の動き,・有効求人数及び有効求人倍率は前年を上回り人手不足の状態は続いている。将来を見据えた人材確保の動きも変わりはないが、このところ増加傾向にあった新規求人数が前年比でやや減少傾向にある。とりわけ、建設業、卸売業、小売業、運輸業で新規求人数の減少幅が大きい。
,,□,職業安定所（職員）,求人数の動き,・求人数は、３か月前と比べ自動車関連製造業、卸売業、小売業、宿泊業で増加したが、飲食サービス業では減少がみられた。自動車製造業では徐々に活気が戻っている感があり、宿泊業も、夏休みは海外からの観光客の増加により求人数が増加した。一方、猛暑日が続くなか外出を控える傾向があったためか、飲食店等の求人数が減少した。
,,□,民間職業紹介機関（営業担当）,求職者数の動き,・夏季休暇前の時期には、活動意欲の強い転職希望者の動きは落ち着いていたが、徐々に年度内の転職を目指して潜在層が動き始めている。
,,▲,人材派遣業（営業担当）,周辺企業の様子,・値上げラッシュの影響が、中小企業を中心に重く伸し掛かっている。仕入コストの増大が続き、利益率が低い状況で稼働せざるを得ない工場もみられる。
,,▲,人材派遣会社（社員）,求職者数の動き,・採用にコストが掛かる人材紹介をこれまで避けてきた企業から、人材確保ができないため相談を受けるケースが増加している。
,,▲,職業安定所（職員）,求人数の動き,・飲食・宿泊業以外の業種では求人が減り始めており、特に製造業での求人減少が長期化しつつある。
,,▲,職業安定所（職員）,周辺企業の様子,・運輸業では改善基準告示に伴う2024年からの業務見直しが必要とされており、拠点や従業員の増加を計画している事業所がある。受注は安定しているもののガソリン代高騰やトラック部品が前年比20％ほど値上がりしており、荷主との交渉は難しい状況である。エアコン部品を製造する事業所では、前年は猛暑で需要が高まったが、今年は在庫を抱えている。
,,▲,職業安定所（職員）,求人数の動き,・求人数は、物価高騰の不安要素などから製造業を中心に緩やかな減少傾向が続く一方、求職者数は、緩やかな増加傾向が続いている。この状況が長期化している。
,,×,－,－,－
,,,,,
　７．北陸（地域別調査機関：一般財団法人北陸経済研究所）,,,,,
,,,,,（－：回答が存在しない、＊：主だった回答等が存在しない）
分野,,景気の現状判断,業種・職種,判断の理由,追加説明及び具体的状況の説明
"家計
動向
関連

(北陸)",,◎,コンビニ（店長）,来客数の動き,・来客数は横ばい若しくは微増だが、単価の上昇により売上は増加している。これをもって景気が良いとみるのは難しいが、前年売上との比較で10％強増えており、好調に推移している。経営面では、単価の上昇以上に経費の高騰があり大変厳しい状況で、特に人件費や光熱費が前年とは比較にならないほど急騰している。売上が増加しているのに事業が成り立たず、倒産するというケースが身近で起こる危険性がある。
,,◎,タクシー運転手,来客数の動き,・お盆を中心に３年ぶりの帰省客や観光客で街中がにぎわい、タクシーの利用も増加している。
