Ⅱ．景気の先行きに対する判断理由,,,,
,,,,
　景気の先行きに対する判断の理由について、その主だったもの及び特徴的と考えられるものを取りまとめると以下のとおりであった。,,,,
,,,,
,,,,
　１．北海道（地域別調査機関：（株）北海道二十一世紀総合研究所）,,,,
,,,,（－：回答が存在しない、＊：主だった回答等が存在しない）
分野,,景気の先行き判断,業種・職種,景気の先行きに対する判断理由
"家計
動向
関連

(北海道)",,◎,家電量販店（地区統括部長）,・アテネオリンピックというビッグイベントがあるため、ＡＶ商品を中心に盛り上がってくることが予想される。
,,○,百貨店（売場主任）,・株価が上がったことで、自然と商品の作り込みなども良くなっており、客の反応も良くなってきている。このまま株価が上がっていくと予想されているので、今後もこうした傾向は継続する。
,,○,観光型ホテル（経営者）,・道外客については、首都圏を中心とした大手エージェントの新商品開発・拡販が見込まれるほか、東南アジアからの海外客も増員の見込みがある。道外では景況の明るい見通しに支えられているが、地元客の動きに明るい材料はない。
,,○,観光型ホテル（スタッフ）,・前年のＳＡＲＳ等の影響によるマイナス要因もなく、予約も前年の同日時点に比べてかなり上回っている。
,,○,旅行代理店（従業員）,・道内の冷え込んだ状況に変化はないが、本州方面の景気回復基調によって道内旅行客の増加が期待できる。また、桜前線が例年になく早まり、客の行楽も早めに活発化すれば、業界としては販売期間が長くなり有利になる。
,,○,観光名所（役員）,・３月末までの来客数や、レストラン・売店などの動きも、やや増加基調にあり、４月の予約状況にも改善傾向がみられる。
,,○,美容室（経営者）,・客は、以前より商品の説明を求めるようになってきて、気に入ったものは買う傾向が出てきている。
,,□,商店街（代表者）,・株高や景気回復に伴う消費回復などの報道がされているが、街中の実態は回復の兆しがみえない。地方では春はまだ先のようである。
,,□,百貨店（販売促進担当）,・来客数、客単価とも、大きな変化がみられず、動向は変わらない。
,,□,スーパー（企画担当）,・消費税総額表示に関連して、小売業者側の対応が直前になって二転三転しており、混乱を極めている。導入後については、同種類の商品価格の表示が何種類も存在することで、客の価格に対する信頼感が損なわれ、購買行動にマイナスの影響を及ぼすことが想定される。
,,□,コンビニ（店長）,・特に明るい材料もなく、天候が極端にでも良くなってくれない限りは、別に変わらない。下げ止まりというところが見えたので、これ以上は悪くはならないと思うが、良くなる材料も取り立ててない。
,,□,乗用車販売店（従業員）,・来客数が前年より少なくなる傾向にあり、売上も減少している。
,,□,住関連専門店（営業担当）,・年金問題やＢＳＥ・鳥インフルエンザなど食品の不安、消費税総額表示の実施による値上がり感で、景気の回復のプラスとなる要因がみられない。
,,□,その他専門店［医薬品］（経営者）,・客は前年以上に財布のひもを締めている。
,,□,一般レストラン（スタッフ）,・当店のメインターゲットである航空機の乗降客は、前年から減少が続いている。特に団体観光客の入込がこの半年、前年比80％台で推移している。
,,□,観光型ホテル（経営者）,・大都市圏では景気が回復していることになっているが、大都市圏から北海道への観光客の流入増という形にはなっていない。また、２～３か月で際立って改善するだろうという要素も見当たらない。
,,□,旅行代理店（従業員）,・団体旅行の低迷もあり上昇傾向とはいえない。発団体の減少と低価格からの収益減少傾向は一層強まるだろう。個人グループへの流れは、一定量を保ちそうだが、海外旅行の不透明感が不安材料となる。
,,□,旅行代理店（従業員）,・４月以降の受注状況は芳しくないが、海外旅行はＳＡＲＳなどからの回復がみられ、前年比は良化しつつある。
,,□,観光名所（職員）,・タクシーの空き具合が以前と変わらない。まだまだ、好転の兆しはみえない。
,,□,住宅販売会社（従業員）,・客の動向の鈍さというのは、所得の低下が要因しているように強く感じる。
,,▲,スーパー（店長）,・４月からスタートする消費税総額表示に伴い、売価に対する割安感が薄れる。ますます売上不振につながるように思う。
,,▲,スーパー（店長）,・競合環境の激化に伴い価格競争が一層進行している。また、消費者における無駄遣いの排除、節約意識の浸透が進むとともに、ＢＳＥ・鳥インフルエンザといった外的要因による畜産物の消費低迷が予想される。
,,▲,スーパー（店長）,・消費税総額表示が始まるが、価格に消費税分をそのまま上乗せすることができないため、実質的な値引きとなり、売上が減少する。
,,▲,コンビニ（エリア担当）,・来月に大型ショッピングセンターの出店が予定されており、全体的な競合店との競争が今以上に厳しくなってくる。また、工事需要など公共工事に関する需要は増加が見込めず、今以上に消費が回復するということはみられない。
,,▲,衣料品専門店（店員）,・今後ますます、Ｔシャツなどの低単価商品中心の動きになることが予想される。安く済むものは安く済ませるという感じであり、ぜいたく志向の客は少なくなっていく一方である。
,,▲,乗用車販売店（従業員）,・良くなる要素が全くない。公共事業も悪く、当管内においては、たばこ産業も３月末でなくなるので、良い話が出てくる様子は一向にない。
,,▲,高級レストラン（スタッフ）,・ゴールデンウィークである４～５月の予約状況が悪い。ＢＳＥ問題で牛肉が値上がりしているため、輸入が再開されなければ、人気のあるステーキ類を提供できなくなり、売上減少は免れない。
,,▲,スナック（経営者）,・企業全体が不景気であり、締めるところは経費・交際費となっている。飲食店が先にあおりを受けることになり、先行きが不安である。
,,▲,旅行代理店（従業員）,・大型ショッピングセンターのオープンに伴い、人の流れが市中から郊外へと変化する可能性が大きく、来客数の減少を懸念している。
,,▲,タクシー運転手,・道南はどの業種ということなく悪く、特に土建業・運輸業は生き残るのが大変だというような話を聞いている。道南で最大手である土建業者の一つも、銀行に借金を免除してもらい再建を図っていることもあり、これから、良くなっていくという材料は全く見当たらない。
,,×,コンビニ（エリア担当）,・客の使う金額が減っており、それを回復する要因が見つからない。
,,×,コンビニ（エリア担当）,・前年末のボーナスの可処分所得が減っているうえ、入学シーズンでお金が必要になる。また企業では昇給が期待できないことから、悪いまま変わらない。
"企業
動向
関連

(北海道)",,◎,－,－
,,○,食料品製造業（経営者）,・米国のＢＳＥ問題・鳥インフルエンザの発生が、水産物に対してはやや追い風となると想像される。
,,○,食料品製造業（団体役員）,・水産物の生鮮加工品に対する受注が増えており、先行きの消費需要が期待できる。
,,○,金属製品製造業（統括）,・関西地域での販売量の増加が期待でき、北海道地域でも前年並みの受注量が見込める。
,,○,輸送業（営業担当）,・中国の経済活況が原料の品薄感や海上運賃の高騰を呼び、取引先は原料を前倒しで買い付けたり、安定輸送にやっきとなっている。デフレ基調を脱却した感が出てきた。
,,○,通信業（営業担当）,・価格重視の交渉から、ここ数年少なかった機能・付加価値・新規性といった積極的な投資姿勢が感じられる商談が増加してきた。
,,○,通信業（営業担当）,・現状はコスト削減のための一時投資が多いが、逆にいうと一時投資自体を手控えていた時期は脱却した感もある。全ての客とはならないだろうが、徐々に上向くような気がしている。
,,○,広告代理店（従業員）,・全国的な新撰組ブームにあやかり、４～５月と函館でも、新撰組関連のイベントなどが組まれている。関連施設への観光客の来館も増えている。
,,○,その他サービス業［システムハウス］（経営者）,・偏った顧客についてであるが、短期見通し・長期見通しの両方について、具体的な話が出てきている。ただし、顧客全般については、あまり明るいとは言いきれないところもある。
,,□,金融業（企画担当）,・雇用所得環境が改善されず、個人消費は上向かない。また、観光シーズンに入るが、宿泊料金・土産品などの価格低下から、観光関連業種の収益は厳しいままである。
,,□,その他サービス業［建設機械リース］（支店長）,・大企業の業績回復基調は明るい材料であるが、地方の中小企業に波及するまでには至っておらず、マインドは依然として低いままである。
,,▲,食料品製造業（社員）,・消費税総額表示に伴い、販売先での仕入価格が下落し、業者が痛手を受ける。中国景気に沸いている鉄鋼についても先行きに不透明感がある。
,,▲,輸送業（支店長）,・景気回復をけん引する業態が道内にはほとんどなく、原油も含めて、原材料のアップを価格に転嫁できないため、本州の景気回復とは裏腹に、道内は悪化が見込まれる。
,,×,＊,＊
"雇用
関連

(北海道)",,◎,－,－
,,○,求人情報誌製作会社（編集者）,・求人件数は順調に伸びをみせている。業種全般を押し上げるような景気の良さは、まだ感じられないが、小売業を始めとして少しずつ堅固になってきている印象があり、大型ショッピングセンターのオープンで、求人市場は活発化してきている。
,,○,職業安定所（職員）,･コールセンターの誘致が予定されており、大幅な雇用需要が見込まれる。
,,□,人材派遣会社（社員）,・道内の企業においては、この春のベースアップも期待できず、連動してボーナスにも期待感は薄い。飲食業も流通業も建設業もハウスメーカーも、どの業界も微増の可能性はあるものの、景気を目に見える形で押し上げる要因は見当たらず、変化はないものと思われる。昨年のような札幌駅前の大型複合商業施設の効果もあまり期待できない。
,,□,人材派遣会社（社員）,・求職者が増えており、新卒者の登録も前年に比べ多かったものの、新年度に向けての求人が思っていたよりも動きが少なかった。
,,□,求人情報誌製作会社（編集者）,・求人広告件数の受理の伸びが見込まれるものの、アルバイト・パートの有効求人倍率だけが高く、常用の求人件数に変化がみられない。
,,□,求人情報誌製作会社（編集者）,・飲食店の求人件数が減ってきている。一方で、建設業は、求人件数が前年よりも５％アップしており、長期間続いた下落傾向に歯止めがかかった感がある。
,,□,職業安定所（職員）,・正社員の求人が少なく、また、条件の良い求人も少なくなっている。
,,□,職業安定所（職員）,・新規求人などは持ち直しの傾向にあるものの、公共事業の縮減など先行き不透明感が強く、依然として慎重な雇用動向となっている。
,,▲,－,－
,,×,－,－
,,,,
　２．東北（地域別調査機関：（財）東北開発研究センター）,,,,
,,,,（－：回答が存在しない、＊：主だった回答等が存在しない）
分野,,景気の先行き判断,業種・職種,景気の先行きに対する判断理由
"家計
動向
関連

(東北)",,◎,－,－
,,○,百貨店（売場担当）,・常にファッションやカラー等のトレンドを的確に早く察するよう、全館各フロアで努めている。また催事等でも客の興味を引くような展開を続けており、シャワー効果も期待できる。また価格帯も買いやすい商品をそろえており、客の財布のひもも緩む。
,,○,スーパー（経営者）,・マクロ的には、今年の賃金の上昇は一定のものがあり、多少のインフレの気配も出てきているが、生活に密着した食料品などを販売している業態では、今般の消費税総額表示が、どれほど消費を抑制するか分からない。
,,○,スーパー（総務担当）,・今のところ現実には、給与等の所得が増えているわけではないが、マスコミの報道によりマインドが上がってきている。
,,○,コンビニ（エリア担当）,・競争小売店の出店ベースもかなり落ち着いてきており、今より競争が激化することは無い。
,,○,コンビニ（店長）,・株価が回復傾向にあり、年金問題の一本化等が本格的に議論され始め、将来のビジョンが明確化されつつあり、こうしたことで消費マインドが上がりつつある。
,,○,乗用車販売店（経営者）,・輸入車の販売では、景気回復の気配と共に購入意欲が出てくる。ニューモデルが出ている会社は勢いがあり、出ていないディーラーは苦戦する。
,,○,スナック（経営者）,・最近、当店が入居している貸ビルや近隣の貸ビルの空き店舗に店が入り始めている。客を集める力が出てくるし、出店者も将来見通しを持ってのことだと考える。
,,○,観光型ホテル（経営者）,"・４～５月の予約数は前年を多少上回り、特に６月は20％ほど増加している。
・税別料金では気にしなかった端数処理が、税込みでは必ず切捨てが話題になる。
・客は週末の金、土、日曜日に集中している。"
,,○,観光型旅館（経営者）,・希望的観測もあるが、４月は予約が先行しており、５月は少し読みづらいが、６月はさくらんぼ絡みでそこそこ行きそうである。５月の数字をどれだけ挙げるかで、来年度前半の状況が決まる。
,,○,通信会社（営業担当）,・固定電話から携帯電話へ発信する通話は、携帯電話会社の収入であったが、４月から固定電話会社の収入となるため、通話の取り込みが可能となり、通話料収入が増えていく。
,,○,住宅販売会社（経営者）,"・展示場来場者数は、前年比175％と客の動きがとても良くなっており、これが受注に結び付くと期待している。
・このところキャンセルが増えていることがマイナス要因として懸念される。キャンセル理由は、土地問題や融資の問題等である。"
,,□,商店街（代表者）,・当市中心街への人出は、今年に入り少なくなっており、今後も変わらない。
,,□,商店街（代表者）,"・全体的に個店差が大きくなっている。天候の変化に速やかに対応できる店は効果をあげている。
・４月からの消費税総額表示については、一時的に消費を抑制するものと懸念している。"
,,□,商店街（代表者）,・消費税総額表示への変更が、消費者にどう受け止められるかにかかっているが、値上がり感を持つ可能性が高い。まだまだ倹約している消費者が多い。
,,□,一般小売店［書籍］（経営者）,・売上構成比の高い雑誌が依然苦戦しており、一般書で売上をカバーし前年実績確保体制を取っている。
,,□,百貨店（広報担当）,・安定した回復基調といった様子は見受けられず、好調、不調を繰り返す状況が依然続いている。外的要因であるが年金問題や雇用の問題等、個人消費を抑制するような政治政策が解決しなければ、根本的な回復はしない。
,,□,百貨店（販促担当）,・ニュー、オンリー、先行販売、限定商品等といったキーワードの商材しか、客は目を留めないのが現状であるため、それを提案し続けることが必要である。
,,□,スーパー（経営者）,・客の数は戻ってきているが、客単価はまだ下降状態にあり、その分売上が悪いという状態が続いている。
,,□,スーパー（経営者）,・当地域の場合は４～６月は良い季節で、例年であれば消費が活発になるが、消費税総額表示の問題や、大型店舗の進出等があるため、今の厳しい状況が続く。
,,□,スーパー（店長）,・１品単価が前期比100％と持ち直してきている。しかし１人当たり買上点数が前期比97％と大きく減少しており、この傾向はまだまだ続く。
,,□,スーパー（店長）,・今後も更に競合が激しくなり、淘汰が進む。無くなる店、出てくる店、居抜き出店もある。いかに安く、より良い商品を提供していくかが課題である。また消費税総額表示による人件費増加をどうやってカバーするかも問題となってくる。
,,□,スーパー（総務担当）,"・消費税総額表示が施行されるが、高い、単価が上がったという印象が持たれ、買い控えが起きると懸念している。
・デフレ傾向は収まりつつあるような単価の動きではあるが、地場企業を含め景気が良いという話は聞かない。雇用についても去年より良いという話は聞かない。"
,,□,スーパー（企画担当）,・限られた商圏の中では、客数の伸長にも限界があるため、商品や販売手法で競合店との差別化を行って単価アップを図り、現状のトレンドを確保する。
,,□,コンビニ（エリア担当）,・客数が少しずつ回復している一方で単価は回復していない。総合的に見れば２～３か月の期間で良くなる悪くなるの判断はしかねる。日用品を扱っている業種であるため、顕著な出方はしない。
,,□,衣料品専門店（経営者）,・４月からの消費税総額表示で、価格訴求力が従前より弱くなるため、客が購入に際して迷うと思われ、現在と変わらず悪くなる。
,,□,衣料品専門店（経営者）,・消費者は非常に不安定な状況で、特にファッションでは天候要因、経済面では年金問題等であり、これ以上に消費が変化するとは考えられない。
,,□,家電量販店（店長）,・４月、６月は例年販売量が落ち込む時期であり、カバーする要因もない。その後となれば、オリンピック需要や気温に左右されるがエアコン需要がプラスとなる。
,,□,乗用車販売店（経営者）,・新車並びに中古車販売では、今まで以上に競争の激化が予想される。法人需要が収益規模の縮小やアウトソーシング等により減車傾向にあるため、新車、中古車共に販売の大きな伸びは期待できない。
,,□,その他専門店［ガソリンスタンド］（営業担当）,・消費税総額表示では、石油業界では、端数切捨ての方向であり、かぶりが発生する。また、原油価格の上昇を価格転嫁するに当たり、消費税総額表示問題と絡み便乗値上げととられないように時期をずらすこと等、状況が不透明なところがあることなどから、石油業界では、消費税総額表示に伴う表示改訂費用等で見通しがつかないところがある。いろいろな指標では回復状況が言われているが、まだまだ、末端のスタンド業界には波及されておらず、ここ当面行ったり来たりの状況が続く。
,,□,高級レストラン（支配人）,"・宿泊の今後３か月間の予約状況は前年並みか多少下回る程度である。
・レストランでは、好、不調の差が明確化するが、ほぼ前年並みは確保できる。
・宴会では、婚礼の苦戦が続く見通しであるが、法人需要の回復が見込まれ、今とほぼ変わらない。"
,,□,その他飲食［そば］（経営者）,・客の様子から、単価が上がる兆しが見えず、このままの状態が続く。
,,□,都市型ホテル（スタッフ）,・去年と違い、春先に選挙等はないため状況は良いが、年末からの流れで消費が回復するとは思えず、ジリ貧の状況が続く。
,,□,都市型ホテル（スタッフ）,・企業間で二極化が進む中、客の判断も良い方に流れていく。総体の中では緩やかな回復傾向といわれているが、今後確実なものに発展するか腰折れとなるかは、ここ数か月の動きが重要である。年金問題等の抜本改革等により消費者のマインドを回復を図る等、いろいろな条件が重なってくる。
,,□,通信会社（経営者）,・商品やサービスの低価格化が依然として続いている。消費者としては歓迎であるが、企業の競争環境が厳しく、景気回復は企業中心の発想では、まだまだである。
,,□,テーマパーク（職員）,・桜の開花時期が早まり、ゴールデンウィーク前の客単価の低い時期の客が多くなり、売上が増えないという見通しになっており、このままではかなり厳しくなる。
,,▲,スーパー（経営者）,・この地域は地元建設業にかかわる住民が多いため、公共事業等の発注減や価格表示に伴う消費マインドの減退が予想される。
,,▲,スーパー（店長）,・消費税総額表示の開始で、割高感の解消と値ごろ感をうまく伝えていけるかという点で、客との感覚のズレをどう解消するかが課題である。
,,▲,スーパー（店長）,・消費税総額表示問題で、割高感が生じて消費が一時的に落ち込むことが心配される。通常商品の便乗値上げは少ないと思うが、特売価格の打ち出し方が難しくなっており、消費者の買い控えが懸念される。
,,▲,スーパー（店長）,・４月後半に、当店から２kmの場所に大型食品スーパーが開店する。商圏が重なっており、売上、客数共に１割減は避けられないと見ている。
,,▲,衣料品専門店（店長）,・４月から消費税総額表示が施行されるが、一部の客から割引に関する問い合わせがある。競合他社では割引を打ち出すところもあり、小売業はそうしたプレッシャーが強まって厳しくなる。
,,▲,乗用車販売店（経営者）,・夏ごろまでは、自動車のモデルチェンジも無く、コンパクト指向に拍車がかかり、単価低下は避けられない。景気回復といわれているが、その実感は乏しく、客の購買行動も活性化していない。
,,▲,その他専門店［酒］（経営者）,・４月から実施される消費税総額表示の影響が多く出てくる。小売業の多くでは事実上の値下げを余儀なくされており、ようやくデフレも止まりかけてきたのに逆行するような悪い政策である。
