Ⅱ．景気の先行きに対する判断理由,,,,
,,□,電気機械器具製造業（企画担当）,・販売台数は増加傾向にあるが、得意先からの値下げ要求が強い。その分販売価格のダウンがみられ、売上金額の伸びに期待が持てない。
,,□,その他製造業［事務用品］（営業担当）,・石油価格が高騰しており、売れ筋の商品を以前の原価で作ることができないことから、今後も厳しい状況が続く。
,,□,建設業（経営者）,・仕事量は増加傾向にあるが、収益面も比例して好転するかは疑問である。
,,□,建設業（経営者）,・当社で販売を開始した、駅から徒歩約８分という比較的立地条件の良い販売現場では、いざ販売を始めてみると、予想に反して結果が思わしくなかった。第三者的にみて希少価値がある分譲物件でも、このような状況であることから、今後も厳しい状況が続く。
,,□,輸送業（営業所長）,・年末になり多少の貨物の動きはあると思うが、燃料の度重なる値上げによって利益率は下がっていることから、厳しい状況が続く。
,,□,輸送業（営業担当）,・年明けは物流の動きが止まるので例年暇になるが、年末に取引先の新規出店が予定されているため、少し期待を持っている。
,,□,通信業（経営者）,・台風、新潟県中越地震などの影響が出てくるのではないかと考えられる。
,,□,金融業（支店長）,・大手商社からの、鉄鋼の納入価格の値上げ要請が年内にもう一度あるが、値上げ分を社内で消化するには、業況がこのままの水準で推移する必要がある。
,,□,コピーサービス業（従業員）,・新紙幣導入等での各種表示物、告知物といった印刷物の注文が出始めている。しかし、一般的な企業の傾向として、様々なドキュメント作成の内製化が加速しており、今冬も厳しい商戦となりそうである。
,,▲,食料品製造業（従業員）,・台風、新潟県中越地震の影響がどのように出るか未知数である。
,,▲,繊維工業（総務担当）,・今月から２、３か月先に向けて、例年であれば冬物商材を中心に売上高が上昇していくが、今年はその傾向がみられない。さらに、大手スーパーに対しての売上減が重なってくるとの予測から、先行きは厳しい状況である。
,,▲,金属製品製造業（営業担当）,・材料である鋼材の仕入価格の値上げに歯止めがかからないと思うが、販売価格への転嫁が思うように進まない。販売価格を上げると受注量が減るが、販売価格をそのままにしていると、利益が出ないどころか、売れば売るほど赤字にもなりかねない。
,,▲,輸送業（営業担当）,・運賃の見直し機運も高まり、燃料費の高騰、車両の改善基準のアップ等、物流業界は厳しい状態が続く。
,,×,電気機械器具製造業（経営者）,・当社の最大の得意先である液晶業界では既に生産過剰気味になっており、水処理関係の同業他社も厳しい価格競争を仕掛けてきていることから、先行きは悪くなる。
"雇用
関連

(近畿)",,◎,民間職業紹介機関（職員）,・災害復旧工事による求人増は、もう少し続くのではないかとの観測が優勢である。
,,○,人材派遣会社（営業担当）,・求人案件が増加したほか、売上の前年比も２けた増となり、年末に向けての大口受注もあるなど、先行きに期待感が持てる。
,,○,求人情報誌製作会社（編集者）,・12月以降の生産計画に基づき、新製品や増産の受注による請負の求人依頼が入っている。また、来年３月までの予定もあり、アルバイトやパートの求人数は好調に推移する。
,,○,新聞社［求人広告］（担当者）,・職安だけを利用していた企業も、職安からの紹介だけでは追いつかず、広告媒体を使うようになってきている。そのため仕事が少し忙しくなってきたことから、先行きに期待できる。
,,○,職業安定所（職員）,・新規求人を産業別にみると、製造業、運輸業、不動産業といった、これまで元気のなかった産業が増加している。これらの産業に元気があると、他の業界にも大きく影響を与えるのではないかと期待している。
,,○,職業安定所（職員）,・大型商業施設がオープン予定で、雇用の受け皿として期待できる。また、企業の雇用調整も一段落していることから、先行きに期待が持てる。
,,○,学校［大学］（就職担当）,・採用活動の動きが前年より早く、再来年３月卒業の求人票を持参する企業や郵送してくる企業が増えてきた。早く学生に採用情報をリリースして優秀な人材を確保したい様子である。前年より積極的な採用活動がみられ、先行きは大いに期待できる。
,,□,人材派遣会社（経営者）,・製造業における人員ニーズは充足され、一服感があるが、サービス業における人員ニーズが強くなってきている。足元の人員ニーズは景気の先行きに対する見方に影響される状況にあるが、米国大統領選挙、台風、新潟県中越地震などが国内景気にどう影響してくるかは、見極めが難しい。
,,□,新聞社［求人広告］（営業担当）,・正社員の広告は少し増えてきたものの、求人広告はフリーペーパーや、インターネットへ流れが変わってきていることから、今後も厳しい状況が続く。
,,□,職業安定所（職員）,・求人自体は依然好調に推移しているが、原油価格の高騰により、運送業あるいは製造業が厳しい状況になり、将来的に人員過剰になることが懸念される。
,,▲,民間職業紹介機関（支社長）,・関西の大手電機メーカーの採用意欲がやや減退傾向である。今後下請等の関連企業にも影響が出る可能性がある。ただし、それほど急激な変化ではなさそうである。
,,×,－,－
,,,,
　８．中国（地域別調査機関：（社）中国地方総合研究センター）,,,,
,,,,（－：回答が存在しない、＊：主だった回答等が存在しない）
分野,,景気の先行き判断,業種・職種,景気の先行きに対する判断理由
"家計
動向
関連

(中国)",,◎,一般レストラン（店長）,・団体の客が増えている。また帰り際に従業員と次はいつくるというような会話を交わす客が増えている。
,,◎,美容室（経営者）,・本来需要期である10月から客数が伸び悩んでいるので、12月に向かって、客数は必ずリバウンドで増加すると予測している。
,,○,百貨店（販売担当）,・現在、冬物商材を買い控えている顧客が、年明けのクリアランスセールには戻ってくる。
,,○,スーパー（総務担当）,・野菜の品薄で単価が高止まり、この状態は春野菜が出るころまで続くと見込んでいる。石油関連商品の値上がりで収益は圧迫されそうだが、客数、客単価、販売数などいずれも落ちていないので売上は高い伸びになりそうである。
,,○,コンビニ（エリア担当）,・長時間スーパーやコンビニ競合の出店もないことから、10月も好調に推移しており、お客様の戻りや客単価が高いことからも、財布のひもも今よりも少しずつゆるくなってきているのではないか。
,,○,家電量販店（予算担当）,・商品構成の高いパソコンが今月に入って回復基調にある。
,,○,乗用車販売店（営業担当）,"・９月決算月後の10月商戦は落ち込みが例年大きいが、今年は新商品の発表も相まって落ち込み幅が最小限に抑えられる見通しである。
・高額車の販売量が関西圏内でも上位に位置している。ただし、販売全体量は、安心出来るものではない。"
,,○,自動車備品販売店（経営者）,・客数の回復及び高額品の動きから最悪期は脱していると判断している。天候に大きく左右されながらも着実に回復基調にある。
,,○,その他専門店［スポーツ］（店長）,・今冬は前年ほどの暖冬でないと予測しており、前年動きの良くなかった厚手の重衣料が活発に動きだすと見込んでおり、やや良くなる。
,,○,旅行代理店（営業担当）,・自然災害の不安が払拭されれば良くなる。
,,○,競艇場（職員）,・12月に年間で一番大きなレースがあり、年末年始には他所開催レースの場外発売による売上も見込める。
,,□,商店街（代表者）,・商店街を通行する人の数は減少傾向にある。新たな店舗の開店や新規イベントなども今のところ予定がなく、現状維持が難しい。
,,□,商店街（代表者）,・分からないというのが実感であり、地震、台風などの影響が残りそうな雰囲気もある。
,,□,百貨店（購買担当）,・例年だとボーナス払いの客が現れる時期なのだが、今年はほとんどみられない。
,,□,百貨店（売場担当）,・親戚のタクシー運転手の話では、例年だと増える出雲大社の観光客が増えていない。また、バスや電車を利用して、タクシーを利用するものが少なくなっている。
,,□,百貨店（売場担当）,・来月以降、ヤングキャリアについては主力のブーツの販売量が延びるとはもはや考えられないが、気温が下がれば、その他の層にある客による購買が期待される。
,,□,百貨店（売場担当）,・地震と台風の影響でしばらくは客の目はファッション関係に向かない。
,,□,スーパー（店長）,・消費者が価格に敏感になっており、今後も消費税分の上乗せは難しいため客単価の回復は難しい。また、野菜も高値が続けは販売量の下落がひどくなる。
,,□,スーパー（店長）,・売上、客数は徐々に増加してきているが、石油関係を中心とするランニングコストが上昇してきており、最終利益は変わらない状況が続く。
,,□,スーパー（店長）,・付近は農業地区で客は農家が多く、米を中心に台風の影響が大きいため、先の見通しがつかない。
,,□,スーパー（店舗運営担当）,・台風のために野菜や鮮魚の価格などが高騰しており、この影響は年末あたりまで続くので、現状の好調の維持は困難である。
,,□,コンビニ（エリア担当）,・天候による来客数、販売量の変化を除けば、ここ数か月ほとんど横ばいの推移となっており上昇傾向も下降傾向も見られず、当面現状並みの景気が続く。
,,□,衣料品専門店（店長）,・客の二極化が進展し、先行きはますます見えなくなってきている。
,,□,衣料品専門店（地域ブロック長）,・二極化がはっきりし、高単価のものや、まとめ買いも増えていて、数量には変化がないが、安定した購入傾向にある。
,,□,衣料品専門店（販売促進担当）,・紳士物は、客数、売上ともに増加しているが、婦人物が、バーゲン待ちの客が増加してきて売上が伸び悩んでいる。バーゲン待ち客の多さが、今後の動きにおいて気がかりである。
,,□,家電量販店（副店長）,・いわゆる衝動買いが増えないかぎり、現状打破は難しい状況である。ただし、高額であっても本当に自分にとって良い商品であれば分割にしてでも購入するという傾向が見受けられることから、多少なりとも明るい兆しと判断してもよいのではないか。
,,□,自動車備品販売店（店長）,・客の様子から以前より購買意欲は上がっていると見受けられる。
,,□,一般レストラン（経営者）,・客単価が、ここ２、３か月前と比べ上昇しているが、台風の影響による野菜高値により、特にレタスを使用しているサラダの注文が増加したことによる。今後もこの傾向が続くが、上記天候与件のためであり、景気自身は変わらない。
,,□,観光型ホテル（スタッフ）,・忘年会、新年会の予約がやや低迷している。
,,□,都市型ホテル（経営者）,・宿泊関係は前年を上回る状況で２、３か月先も推移しているが、宴会関係が今後も前年を下回る状況であり、特に前年苦戦した忘年会が、それ以上に落ち込む見込みである。
,,□,都市型ホテル（総務担当）,・宿泊部門は堅調であるが、一般宴会、婚礼の受注状況が前年を下回っており、レストラン部門も前年を下回っており、増加の兆しがなかなか見えない。
,,□,タクシー運転手,・建設、土木関係の人が最もタクシーを利用するが、この業界の景気があまり良くない。またタクシー会社でも11月から任意保健強制加入になり、景気の良い話は聞こえてこない。
,,□,通信会社（企画担当）,・本年の後半期において、高単価なブロードバンド商品の動きに変化はなく、コンスタントな増加に終わっているが、当面その傾向に変わりはないと推測している。
,,□,通信会社（広報担当）,・新規市場の鈍化、競合他社の動きから、今後も変わらないと推測している。
,,□,テーマパーク（広報担当）,・相次ぐ台風や長雨で被害を受け、復旧作業に努めているが、来客数をばん回するには課題が多い。
,,□,その他専門店［カメラ］（地域ブロック長）,"・台風などの自然災害の影響が家計の中にどう現れてくるかが、大きな不安材料となっている。
・台風被害・地震被害が大きく出ている店舗もありうる。"
,,□,その他レジャー施設［温泉センター］（営業企画担当）,・年末にかけての宴会予約やホテル宿泊予約も、前年同時期に比べて早めの受注で若干期待がもたれるものとなっているが、日々の来館客動員状況を見ればまだまだ予断を許さない。また仕入れについて、生鮮野菜類の高騰を始め石油製品の価格引上げの連絡なども徐々に入り始め、コストの圧縮が更に厳しくなる。
,,□,住宅販売会社（従業員）,・来場者数、来場者の反応のにぶさが、受注量、受注金額にも反映されており、あまり芳しくない状況が続いていく。
,,▲,一般小売店［靴］（経営者）,・台風の被害による出費で、当分買物どころではない。
,,▲,一般小売店［茶］（経営者）,・とにかくムードが良くない。地震のニュースで更に雰囲気が暗くなっている。
,,▲,百貨店（営業担当）,・地震により不安感が広がり、暖冬が予想され、季節物主力商品のコートが苦戦する。
,,▲,スーパー（店員）,・台風で野菜が驚くほど高い。これ以上高くなれば誰も買わなくなるが、現状でも利益は出ていない。また震災地は野菜の大産地である長野県に近く、この影響も心配している。
,,▲,コンビニ（エリア担当）,・既存店の売上はそこそこ確保できそうだが、新規店の確保が出来ないため、年内は厳しい状況が続く。
,,▲,家電量販店（店長）,・野菜や石油価格が高騰し、消費が家電まで回ってこない状態が年末まで続く。
,,▲,都市型ホテル（従業員）,・台風に続く地震のせいかツアーの予約状況が低迷している。
,,▲,タクシー運転手,・当県は農業所得の比率が高いが農産物がこの台風で大打撃を受けたため、客の今後の収入に響いて利用が減る。また台風特需も期待できそうにない。
,,▲,通信会社（通信事業担当）,・新規加入キャンペーンを実施しているが、出足は悪く今後も苦戦しそうな状況である。
,,▲,住宅販売会社（経理担当）,・既存の大型物件については、ある程度の契約数は期待できるものの、例年の傾向として12月中旬以降は、モデルルームへの来場者はほとんどなくなり、契約数も落ち込むので全体的には低い契約数になる。
,,×,一般レストラン（店長）,・野菜の暴騰で葉物野菜が入手出来ない状況がしばらく続くという話もあり、それ如何では、たとえ集客増でも原価率の上昇で利益減は必至になる。
,,×,旅行代理店（経営者）,・沿岸部はほとんどの地域において台風の被害を受け、以前の活気はほとんど見られなくなり、いつ戻るか分からない。
,,×,通信会社（総務担当）,・予定されている基本料金の値下げにより、会社の収益が大幅減少になる。
"企業
動向
関連

(中国)",,◎,輸送用機械器具製造業（経理担当）,・既存製品の好調に加え、来年１月よりの新製品により大変な仕事量が予想される。
,,○,電気機械器具製造業（広報担当）,・携帯電話の受注が大量に入る見込みがある。
,,○,輸送業（統括）,・各金融機関はリスクを伴う仕事をアウトソーシングする動きがあり、この動きは一層強くなる。
,,○,会計事務所（職員）,・地元の自動車メーカーの業績が好調なためか、機械などにかかわる製造業の業績は順調に伸びてきている。
,,□,化学工業（総務担当）,・前月とほとんど変わりはない。経費節減や業務の合理化、効率化などの社内体制の整備により少し利益が出るようになったが、依然として物流費や原燃料費高などの影響を受け収益面での景気回復は厳しい。今後は、原燃料費については石炭税などが収益に影響することが考えられる。
,,□,鉄鋼業（総務担当）,・あらゆる分野で鋼材需要はひっ迫しており、国内、海外とも現在の状態はしばらく継続するものと見込んでいる。
,,□,金属製品製造業（総務担当）,・受注量は好調、原材料の高騰懸念という状況が、依然として続く。
,,□,一般機械器具製造業（経営企画担当）,・国内海外ともに自社製品の売上は順調であるが、原材料高騰による悪影響が今後も続く見通しである。
,,□,金融業（業界情報担当）,・足元の受注は高水準だが、米国、中国とも景気の減速感が強まる中で原油高、円高が輸出の足かせとなる懸念大である。今後数か月先の景況感は一段と不透明さを増している。
,,□,金融業（営業担当）,・４月以降機械の更新など設備資金がやや出ていたが小規模に留まり、今は途絶えている。また相変わらず仕事はなく機械関係では現在やや仕事はあるが先行きは不透明で、建設業を中心に将来に渡って受注のめどが立っていない。
,,▲,鉄鋼業（総務担当）,・原材料及び原油価格の高騰が気がかりである。
,,▲,繊維工業（統括担当）,・台風、地震などの天災、ビジネス状況の悪さ、政治を中心とした活性力のなさから好転するとは思えない。
,,▲,輸送用機械器具製造業（総務担当）,・材料の値上がりの一方で、価格の値引き要求には応じざるを得ない。
,,▲,その他製造業［スポーツ用品］（総務担当）,・現在原油高により関連材料などの値上げが進んでいるほか、台風の影響により野菜関連の高騰が続いており、消費者へのダメージは大きく出費がこちらまで回らない。一部大型店の進出はあるものの、活性化というにはほど遠い。
,,×,建設業（営業担当）,・建設関係の設備投資において、事業計画予算が段々厳しくなってきており、発注側と受注側の金額差が大きく、契約が成立しにくくなっている状況が続く。
"雇用
関連

(中国)",,◎,人材派遣会社（支店長）,・求人、採用、そして、定着など、人材の確保に関しては、大手企業ほど優秀な人材を今以上に質、量ともに多く確保できる優勝劣敗の傾向が見られ、人材マーケットはバブル期と似てきており、確実に良くなる。
,,◎,民間職業紹介機関（職員）,・人材採用するに際し、地元あるいは出身者を求めるケースがこれまで多かったが、不足感から、企業が求める人材を積極的に県外で探す傾向になってきた。
,,○,求人情報誌製作会社（支社長）,・引き続き、建築土木など一部業界を除き、サービス業を中心に全般的に、活発な求人採用活動を各企業が行っていくと十分予測できる。
,,○,職業安定所（職員）,・来春卒の高校生への求人が大幅に増加しており、雇用環境の改善が感じられる。
,,○,学校［短期大学］（就職担当）,・学生からの就職内定報告が徐々に出始め、大企業以外の中小企業においても来年度に向けた採用活動が本格化してきた様子がうかがえる。今後、年末あるいは年明けに向けて、求人の受理数と採用内定数が更に上向くことが予想され、多少の活況が見込まれる。
,,□,人材派遣会社（経営者）,・人材派遣の需要は、幅広い職種にわたって堅調であるが、それに十分こたえられるだけのスタッフを確保することが困難になっている。
,,□,職業安定所（雇用開発担当）,・現状ではあまり目立った動きはないが、徐々に正社員雇用が目立ってくるようになってきている。
,,□,職業安定所（職員）,・求人数は伸びているが、求職者数の減少はそれほどではない。
,,▲,民間職業紹介機関（職員）,・マンション業界で財務体質ではトップクラス企業からの正社員の求人が１年契約の契約社員の求人に変更になった。
,,×,－,－
,,,,
　９．四国（地域別調査機関：四国経済連合会）,,,,
,,,,（－：回答が存在しない、＊：主だった回答等が存在しない）
分野,,景気の先行き判断,業種・職種,景気の先行きに対する判断理由
"家計
動向
関連

(四国)",,◎,＊,＊
,,○,百貨店（売場主任）,・３か月先は、クリアランスセールも始まるので、今よりはやや良くなっていく。
,,○,家電量販店（店長）,・来客数、客単価ともに増加傾向にあり、また年末に向けてニーズにあった販促対策を計画しており、薄型テレビやＨＤＤ内蔵ＤＶＤレコーダーなどの付加価値商品の販売が期待できる。
,,○,乗用車販売店（従業員）,・主力車種のモデルチェンジに期待している。
,,○,通信会社（営業担当）,・新商品の発売、キャンペーンを予定しており、新たな需要の掘り起こしにつながる。
,,○,設計事務所（所長）,・遊休地の開発が少しずつ始まっている。
,,□,商店街（代表者）,・来街客数は、ほとんど底を打ったような気がする。客単価は上昇していないが、買上率も徐々に上昇しており、底を打った感はある。しかし、まだ上昇するにはほど遠い。
,,□,百貨店（総務担当）,・台風23号を境に、客の消費意欲が衰えており、すぐに良くなるとは思えない。
,,□,スーパー（企画担当）,・衣料品が前年比で10％ぐらい低下しているが、気温が低くなれば、ある程度の回復はある。しかし、商品単価の低下分までは補えない。
,,□,スーパー（財務担当）,・野菜の高騰、品不足が続いており、不安感が強い。また、７月から毎月発生した台風による店内浸水や早めの閉店等、売上機会ロスによる利益面への悪影響が懸念される。
,,□,コンビニ（店長）,・来客数は一定しているが、消費意欲に変化がみられず、客単価も伸びておらず、不況感を払拭する話題が非常に少ない。
