Ⅱ．景気の先行きに対する判断理由,,,,
,,□,一般レストラン（スタッフ）,・お盆など客がお金を使う時期には集客があるが、その後は反動がきつい。
,,□,スナック（経営者）,・年内は12月を除いてはあまり期待できない。街角は人出も少なく良い話は聞かれない。テナントの出入りも激しく、長年営業している店も閉めており不安である。
,,□,旅行代理店（従業員）,・何事も起きなければ変わらないが、台風の影響でキャンセルなどが相次ぐと、売上は大きく減少する。
,,□,タクシー運転手,・業界には良い材料はあまりない。当分この状態が続く。
,,□,通信会社（営業担当）,・景気が回復する材料は見当たらない。待ちの状況はもう少し続く。
,,□,テーマパーク（総務担当）,・過去３か月間では、来場者数、園内消費単価とも前年を下回っている。
,,□,観光名所（案内係）,・中高年やお年寄りは、外に出る人と出ない人に二分しており、外出したくても出られない人も増えている。
,,□,ゴルフ場（経営者）,・３か月先までの予約数は前年を下回っており、回復の兆しはない。東海３県下の来客数も前年を下回っている。
,,□,ゴルフ場（企画担当）,・季節的にはゴルフに良い時期であるが、客は安い金額を望んでいる。料金を極端に下げるゴルフ場も増えており、厳しい状態はまだまだ続く。
,,□,パチンコ店（経営者）,・客の様子をみていると、景気はまだ変わっていない状況である。
,,□,美容室（経営者）,・客の来店動機がしっかりしない限り、来店サイクルが長い状況は続く。
,,▲,商店街（代表者）,・客は必要不可欠な物は買うが、日常使う物、食べる物の出費には慎重である。
,,▲,一般小売店［酒］（経営者）,・客は、残業もなく給与が伸びていない中小企業関係者が多い。その上、ガソリン価格が上昇しているため、他商品の値上がりなどを見込んで消費を抑えるのではないかと懸念している。
,,▲,百貨店（売場主任）,・紳士靴は実用的で履きやすい商品が主流だが、今年になって、履きやすさに流行のデザインを加えた靴を選ぶ客が増えている。しかし両方を兼ね備えた商品が少なく、売上につながらない。
,,▲,百貨店（企画担当）,・夏物が不足した影響もあり店頭は秋物を中心に展開しているが、動きは鈍い。８月の商品動向により秋冬ファッション商材の売上が決まる年が多いため、今年の秋冬商戦を非常に不安視している。
,,▲,百貨店（販売促進担当）,・ビジネススーツの動きが悪く、中堅サラリーマン層の購買は進んでいない。また、一部の高級婦人服の動きは依然好調だが、本来の景気の良さではない。
,,▲,スーパー（店長）,・近隣への大型店出店から１か月が経つが、関連業種では３～４割の売上減という影響が出ている。
,,▲,家電量販店（店員）,・現在好調なのは天候要因が大きく、３か月後も同様とは考えにくい。
,,▲,家電量販店（店員）,・原油価格の高騰が様々な面に効いてくる。
,,▲,乗用車販売店（従業員）,・現在の好況は夏の暑さとオリンピックという特殊要因に支えられているが、今後は大きな行事も予定されていない。
,,▲,その他小売［貴金属］（経営者）,・依然として消費者の購買意欲は上がっていない。経済や社会の様々な不安定要因が影響している。
,,▲,その他小売［雑貨卸］（経営者）,・小売店では自社で在庫を抱えて販売しようとする動きがない。
,,▲,都市型ホテル（スタッフ）,・大口の予約が少ない。
,,▲,旅行代理店（経営者）,・10～12月の予約状況は前年よりもやや弱い動きになっている。オリンピック後の景気対策がないと景気は悪くなっていく。
,,▲,理美容室（経営者）,・消費者は本当に必要なときにしか金を使わなくなっている。
,,▲,設計事務所（経営者）,・規模の小さな案件が多いため、現在の仕事は２～３か月以内には終わってしまう。現時点で３か月先の実施設計につながる計画件数は少ない。
,,▲,住宅販売会社（企画担当）,・原油価格の高騰によりガソリン価格が上昇しており、その影響で下請の価格が上昇する。そのため、販売不振が続く。
,,▲,住宅販売会社（業務担当）,・原油価格高による資材の値上げを販売単価に転嫁できない。住宅着工数も、110万戸を割ると予想する人もいる。
,,×,＊,＊
"企業
動向
関連

(東海)",,◎,窯業・土石製品製造業（経営者）,"・窯業界の景気は２～３か月前の新規住宅着工件数の動向に左右されるが、４～６月の着工件数は301,649戸であり、直近と比較して約16％増加している。そのため10～11月の業績は大幅に改善される。"
,,○,電気機械器具製造業（営業担当）,・第１、第２四半期の売上が芳しくないため、それに比べれば第３四半期、第４四半期は良くなる。
,,○,輸送業（従業員）,"・新卒者や中途のドライバー採用が、景気がやや上向いている影響で以前より少し難しくなっている。
・その一方で原油価格の高騰が続いており、運輸業では経営への影響が大きい。また、石油関連製品の価格が上昇すると物流費の値下げを要請されることが見込まれ、心配である。"
,,○,輸送業（エリア担当）,・順調に景気回復しており、秋から冬にかけてのクリスマス商戦の貨物も増加する。
,,○,輸送業（エリア担当）,・集荷に回る客先のオフィス内には活気が出ており、景気は上向きになっている。
,,○,金融業（企画担当）,・物の動きが出ているが、それにつれてお金の動きも出てくるため、今後は良くなっていく方向である。
,,○,広告代理店（経理担当者）,・より広い範囲の客から問い合わせがある。また、広告を大きくしたり本数を増やしたりといった追加注文が増えている。
,,○,行政書士,・現在の仕事の状況が継続する。
,,□,食料品製造業（企画担当）,"・消費税総額表示の影響で、ギフト商品の高額品は販売不調であり影響が出ている。消費はまだ回復基調にはない。
・原油価格の高騰は材料価格を上昇させるが、消費の動きが鈍いため小売価格に転嫁できない。そのため企業収益にも影響が出てくる。"
,,□,一般機械器具製造業（経理担当）,・取扱商品によって受注量に波があり、短期的にみると景気は変わらない｡
,,□,電気機械器具製造業（経営者）,"・２～３か月先の国内販売は、今のところ大型物件の受注が見込めないことから、２～３か月前とほぼ同水準と予測している。
・最近の原油価格の高騰が長期化することになれば、収益面に影響してくる。"
,,□,電気機械器具製造業（経営者）,・家電製品の受注は、既存商品のリピートが中心で、しかも同数量の受注が続いているためほぼ横ばいである。
,,□,電気機械器具製造業（従業員）,・原材料業者では海外からの仕入価格が上昇傾向にあるようだが、販売価格に転嫁できず苦しんでいる。
,,□,輸送用機械器具製造業（経理担当）,・当業界の景気は数か月前から悪くない。これ以上の景気回復には他業種の回復が必要だが、まだ不透明感が残っている。
,,□,輸送用機械器具製造業（工務担当）,・１日当たりの生産高は高水準を維持している。
,,□,輸送用機械器具製造業（統括）,・主要取引先からの受注は厳しい状況にあるが、現時点でもかなり低いため、これ以上はそれほど落ち込まない。
,,□,建設業（経営者）,・受注機会はあるが、採算ベースからみると厳しすぎる状況が続いている。この状況は数か月先も同じである。
,,□,広告代理店（従業員）,・高品質の商品を自信を持って販売していこうという気概が感じられない。
,,□,広告代理店（制作担当）,・競合他社との価格競争が厳しいため、新規の受注予定はなかなか決まらず、現状維持である。
,,□,新聞販売店［広告］（店主）,・新聞販売量やチラシ受注量は今後も変化なく推移する。
,,□,公認会計士,・中小企業の経営者は多少の業績回復を感じてはいるものの、積極的に設備投資をしたり、従業員を雇用したりすることについては、まだまだ控えている。
,,□,経営コンサルタント,・名古屋では地価が上昇しているという話があるが、三重県では地価はまだ下がるという認識があり、土地の買い控えは続いている。
,,□,税理士,・関与先の中小企業では、原油や鋼材など原材料価格の値上がりを価格転嫁できない状況にある。中小企業では景気の回復はみられず厳しい。
,,□,その他サービス業［ソフト開発］（社員）,・今年度中の動きはある程度みえている。
,,□,その他非製造業［デザイン］（経営者）,・現在の引き合いが継続する見込みである。
,,▲,鉄鋼業（経営者）,・信用不安や、原材料不足などに関連した黒字倒産などが、鋼材を扱う業種で増加しそうな気配がある。
,,▲,一般機械器具製造業（経理担当）,・３か月後の受注はまだ出来ておらず、これからである。
,,▲,輸送業（エリア担当）,・輸送業者の生命とも言える燃料単価が65円から71円に9.23％も値上がりし、９月からは更に４円ほど値上がりする。石油製品などの値上がりも予想されとても心配である。
,,×,非鉄金属製品製造業［鋳物］（経営企画担当）,・引き合いが減っており、販売価格の低下は継続する。
"雇用
関連

(東海)",,◎,人材派遣会社（社員）,・愛知万博が近づいているが、募集しても運営スタッフが集まりにくい状況である。また製造業への派遣では自動車関連の需要が高く、人材の確保が困難になりつつある。
,,◎,求人情報誌製作会社（企画担当）,・愛知万博、中部空港関連の求人や、引き抜かれた労働力の補充があり、これから数か月の求人は相当の競合状況に入る。
,,◎,職業安定所（所長）,"・来春の新卒高校生向けの求人が８月15日現在で2,029人あり、前年より約500人、28.5％増加している。若年労働者に対する採用意欲が向上している。"
,,◎,学校［大学］（就職担当）,・自動車関連メーカー、同販売会社、機械工具関連商社、工作機械メーカー、段ボールメーカーの業績が好調で、求人意欲も旺盛である。
,,○,職業安定所（職員）,"・求人状況は、建設関連では引き続き公共事業縮小の影響があり、特に中小企業で厳しい。しかし、電気機械器具製造業、特に民生電気器具製造業の増加が著しく、輸送用機械器具製造業も好調を保っている。
・求人内容は、派遣、請負の求人が新規求人の４分の１を占めている。企業のアウトソーシング化が進む中で、雇用形態は変化しつつも、取り巻く環境は改善傾向がうかがえる。"
,,○,民間職業紹介機関（経営者）,"・求人数は、自動車業界の好景気に引っ張られ、高い水準を維持している。
・中途採用も、これまでは企業は新卒採用を優先させてきたため動きは鈍かったが、ここにきて採用活動が本格稼働し、増加し始めている。"
,,○,学校［専門学校］（就職担当）,"・半年前には、今春の新卒者や教員採用試験受験者、公務員試験受験者からの就職相談が多かったが今は見当たらず、どこかに就職できているようである。
・同業他社でも専門職の採用募集をしており、全体的に雇用の拡大傾向がみられる。"
,,□,人材派遣会社（社員）,・派遣受注は引き続き増加しているが、派遣スタッフが不足しており、需給バランスが悪い。
,,□,人材派遣会社（社員）,・この夏の特需であった電化製品関連メーカーからの受注は今後収縮していくが、自動車業界が依然として堅調であり、全体としては変わらない。
,,□,アウトソーシング企業（エリア担当）,・輸送用機器関連やＩＴ関連などの製造業は全般的に好調であり、多忙を極めている。そのため求人数は増加しているが、求職者数は伸びていないため、深刻な人手不足が１年ほど続いている。
,,□,新聞社［求人広告］（営業担当）,・一部の輸出依存型の製造業は引き続き好調に推移する。しかし、増産のなかでも短期雇用型の派遣、業務請負に依存する傾向は強まっており、正社員を大量に雇用する動きはない。
,,□,新聞社［求人広告］（担当者）,・求人広告は現在のやや好調な状況がしばらく続く。しかし営業広告は下降気味であり、求人だけが今後も更に伸びていくとは考えにくい。
,,□,職業安定所（職員）,・求人数は増加しているが求職者数は減少もしくは横ばいであり、求人求職のミスマッチは増加傾向にある。請負、派遣の求人が増加していることが背景にあり、ミスマッチはなかなか解消されない状況である。
,,□,職業安定所（職員）,・企業業績は回復基調にあるものの、企業が長期雇用を進め賃金条件なども改めない限り雇用不安は解消せず、景気回復は一部にとどまる。
,,□,職業安定所（管理部門担当）,・有効求人倍率は改善しているものの、求人求職のミスマッチは大きい。指標の動きは好調にみえるが、厳しい雇用実態は今後も続く。
,,□,民間職業紹介機関（職員）,・この業界では求人数が増加しており、引き続き同水準を保つ。
,,▲,求人情報誌製作会社（編集長）,・中途社員の募集ニーズに少しかげりが見えている。
,,×,－,－
,,,,
　６．北陸（地域別調査機関：（財）北陸経済研究所）,,,,
,,,,（－：回答が存在しない、＊：主だった回答等が存在しない）
分野,,景気の先行き判断,業種・職種,景気の先行きに対する判断理由
"家計
動向
関連

(北陸)",,◎,＊,＊
,,○,百貨店（営業担当）,・２か月続いた猛暑の影響で、客は秋のファッションを待ちこがれており、秋物需要が期待できる。
,,○,スーパー（店長）,・７、８月の販売量は前年実績をクリアしており、９、10月もこの状態で推移する可能性が高い。
,,○,コンビニ（経営者）,・たばこの売上が非常によい。酒を飲んだり遊びに行く場合に喫煙することが多いため、先行きは若干明るい。
,,○,乗用車販売店（総務担当）,・今月モデルチェンジした商用車、引き続き好調なコンセプトカー、10月にフルモデルチェンジする主力カーなどが寄与するため、今秋は売上高、販売台数ともに期待が大きい。
,,○,観光型旅館（スタッフ）,・前月までは９月から12月までの予約保有が前年を大きく下回っていたが、今月になって９月は前年比減少しているものの、10、11月は前年並みとなり、若干回復傾向にある。
,,○,通信会社（社員）,・通信料金の定額制の浸透により、携帯電話の販売台数が増加する。
,,□,商店街（代表者）,・低迷期が続いているが、再開発中の隣接商店街で新しい店の開店が続けば、人の流れが多少変わる。
,,□,百貨店（営業担当）,・現在の買上客数のトレンドからみて、今後２、３か月は変わらない。また、駅前再開発に伴う道路工事の影響で来客数が若干減少する懸念がある。
,,□,スーパー（店長）,・７月の福井豪雨や５か月経過した消費税総額表示に対して客の態度も落ち着いてきた。ここ２、３か月は来客数は微増、客単価は微減が続く。
,,□,スーパー（店長）,・３～８月の動きを見ると、単価は消費税総額表示の関係で低下しているが、来客数は前年の110％で推移し、売上も順調に推移している。この上向き傾向は下期も継続する。
,,□,スーパー（総務担当）,・気温の上昇で飲料等は売れているが、日用品にまでは波及せず、この状況が続く。
,,□,スーパー（副店長）,・来客数が増加しても、客単価の低下が続いている。客には商品をより吟味し、バーゲンでも必要量以上は買わないという態度が根強く続いている。
,,□,家電量販店（経営者）,・７月までは好調であった冷蔵庫、洗濯機、食器洗い乾燥機などの白物家電も単価の低下が激しく、数量は前年比で上回っているものの売上は下回っている。
,,□,家電量販店（店長）,・地元では10月から地上デジタル放送が開始されるため、関連商品が動く。また、近隣に新築物件が見られるので、この需要も見込める。
,,□,乗用車販売店（経営者）,・全体の景気は変わらないが、秋商戦、ニューモデルの影響で売上は多少上向く。
,,□,乗用車販売店（経理担当）,・福井豪雨の影響で車の買換え需要が生じたが、新車は増えたものの、中古車が減っているため、全体としては変わらない。
,,□,その他専門店［ガソリンスタンド］（経営者）,・原油価格は高騰しているが、石油業界の淘汰はまだ続いており、スタンドのマージン率は依然として低い。
,,□,その他専門店［医薬品］（営業担当）,・既存店の売上は前年比106％と伸びているにもかかわらず、利益額は前年並みという現状から判断して、厳しい競争が今後も続く。
,,□,都市型ホテル（スタッフ）,・来客数の減少が７月後半から８月も続き、今後の伸びが期待できない。
,,□,都市型ホテル（スタッフ）,・予約状況から見て、現状維持が精いっぱいである。
,,□,旅行代理店（従業員）,・海外ではテロ、国内では温泉の泉質問題があるため、９月以降の受注が非常に悪い。
,,□,タクシー運転手,・客の増加要因が特にない。一方でタクシーの台数は増えたままの状態で、客の奪い合いが続く。
,,□,通信会社（営業担当）,・ボーナス期が終わり、やや低迷する時期であるが、新機種の発売があるため、売上はあまり変わらない。
,,□,設計事務所（職員）,・受注に直結する計画の持ち合わせがなく、また引き合いや照会に多少の動きはあるものの、当面は期待できない。
,,▲,スーパー（営業担当）,・客の来店頻度や買上点数を見ると、必要な物以外は買わず、チラシ広告を見ての買い回りが続いている。販売する側よりも客の方が価格に詳しく、競争激化から単価は更に下がる。
,,▲,高級レストラン（スタッフ）,・夏休みと行楽シーズンの谷間に入るため、予約状況は明るくない。
,,▲,観光型旅館（経営者）,・今年は温泉表示問題、福井豪雨、原発事故など、非常に厳しい夏であった。予約のキャンセルは豪雨の影響だけにとどまったが、今後風評被害による予約の伸び悩みが心配である。
,,▲,住宅販売会社（従業員）,・７～８月にかけて暑い日が多く、展示場への来客数は約３割減少した。この影響が秋から冬にかけての販売数量の低下につながる懸念がある。
,,×,コンビニ（経営者）,・近隣の競合店の影響から、今後売上は減少する。
,,×,テーマパーク（職員）,・団体旅行、企画募集旅行の動きが大変鈍いため、向こう３か月の予約は前年同月比で10％以上減少している。また、個人、グループでも他地域の大型イベントの影響があり、全体的に悪くなる。
"企業
動向
関連

(北陸)",,◎,－,－
,,○,電気機械器具製造業（経営者）,・10、11月の売上は例年どおり推移するものの、12月以降の商談が増えており、先行きは改善する。ただ、品質維持やコストダウンについては相当な注意が必要である。
,,○,通信業（営業担当）,・他社の電話回線への参入が予想されるため、市場規模は膨らむが、厳しい状況になる。
,,□,繊維工業（経営者）,・先行きに若干の期待感はあるが、一方では原材料や原油の値上げなどコストを押し上げる要因があり、相殺される懸念がある。
,,□,化学工業（営業担当）,・大手医薬品メーカーからの受託製造案件が多くなっているが、４、５社のコンペ方式が多いため、低価格を出さない限り成約に至らない。
,,□,金属製品製造業（経理担当）,・企業サイドでは良い方向に進んでいるが、原油価格の上昇やアメリカの大統領選挙の行方など、未知数の部分がある。
,,□,一般機械器具製造業（経営者）,・８月は季節要因もあって、引き合い件数、引き合い金額とも若干勢いが落ちているが、前年比ではかなり強含みで推移しており、先行きはほぼ変わらずに推移する。
,,□,通信業（営業担当）,・携帯電話市場は料金競争が続くため、厳しい状態は変わらない。
,,□,金融業（融資担当）,・取引先では業種によって設備投資による増産体制をとる会社が増えているが、一方では中小企業の中で、特に卸売業者の廃業が目立つ。
,,□,司法書士,・不動産の購入や増資などを行う会社も一部に見られるが、全体の景気を押し上げる状態にない。
,,▲,金属製品製造業（経営者）,・先行きの注文量が減少している。
,,▲,精密機械器具製造業（経営者）,・例年は秋の眼鏡商戦を迎え、新型を含めて生産が増える時期であるが、新型の出荷があまり良くなく、また年末に向けて在庫調整が行われるため、各社の受注はかなり減っている。
,,▲,輸送業（配車担当）,・景気は多少上向き傾向にあるが、燃料代など経費の増大から悪影響が出る。
,,×,建設業（経営者）,・地元ではランクの高い工事が全くなく、これから毎月赤字が増えていく。同業他社でも２割が廃業を視野に入れている。
"雇用
関連

(北陸)",,◎,求人情報誌製作会社（編集者）,・先を見据え、積極的に求人を行う動きが企業側に見られる。
,,○,新聞社［求人広告］（担当者）,・４～８月の求人数は少しずつ安定して伸びている。
,,○,職業安定所（職員）,・求人は依然として請負や派遣が多いものの、求人の増加、求職者の減少が見られる。
,,□,職業安定所（職員）,・新規求人はサービス業、製造業で増えている。内容は派遣求人、請負求人であるが、仕事を探している人は正社員を希望しているため、就職がなかなか決まらない。
,,□,職業安定所（職員）,・卸・小売、食品関係で求人が低調である。また、非正規型求人が依然多い。
,,▲,－,－
,,×,－,－
,,,,
　７．近畿（地域別調査機関：りそな総合研究所（株））,,,,
,,,,（－：回答が存在しない、＊：主だった回答等が存在しない）
分野,,景気の先行き判断,業種・職種,景気の先行きに対する判断理由
"家計
動向
関連

(近畿)",,◎,一般小売店［酒］（経営者）,・９月後半に月間のグルメ情報誌に掲載されることもあり、良くなる。
