Ⅱ．景気の先行きに対する判断理由,,,,
,,□,コンビニ（エリア担当）,・天候次第であるが、競合他社の集中出店の影響もあり状況が上向くことは考えにくい。
,,□,住関連専門店（店員）,・生活用品の購買が後回しになっているのか、今春は例年に比べ出足が遅い。
,,□,高級レストラン（スタッフ）,・個人客は徐々に回復しつつあるが、法人客は低調である。経験上、好景気が飲食業界に波及するには時間がかかる。
,,□,スナック（経営者）,・飲食業は個人の消費が良くならない限り厳しいが、店舗の入れ替わりも早くどの店も生き残りに必死である。
,,□,スナック（経営者）,・３月の売上は送別会等の団体で多少増加しているが、例年並みの状況であり、上向きとまでは感じられない。
,,□,都市型ホテル（経営者）,・現在は周辺の設備投資関連で宿泊稼働率は高いが、事業が終了すると元に戻る。
,,□,都市型ホテル（従業員）,・予約数は例年並みである。
,,□,都市型ホテル（スタッフ）,・浜名湖花博の好影響は宿泊にとどまっており、集会、宴会の状況はあまり良くない。
,,□,タクシー運転手,・安定的に推移している。
,,□,通信会社（企画担当）,・消費税総額表示の影響がどう出るか判断が難しい。
,,□,通信会社（営業担当）,・携帯電話業界は飽和に近づいており、厳しいサービス競争は今後も続く。
,,□,通信会社（営業担当）,・まだまだ品質より価格に注目されており、値引き合戦は続いている。消費税総額表示の影響も懸念される。
,,□,パチンコ店（店長）,・店舗の大型化が一巡したため、来客数の激しい変動は出てこない。
,,□,理美容室（経営者）,・切り詰められるところは切り詰めている現状は変わらない。
,,□,設計事務所（職員）,・仕事量は減っているが何とかやっている状況である。大手は景気が良いが中小企業は１～２年は我慢しなくてはならない。
,,□,住宅販売会社（経営者）,・所得増加がなく、一般消費者は買い控えている。
,,▲,スーパー（店長）,・消費税総額表示の導入による値上がり感があり、購買意欲が低下する。また、ＢＳＥや鳥インフルエンザなど食品の安全性に対する不信感がある。
,,▲,スーパー（店員）,・消費税総額表示に切替えてから商品の動きが悪い。客が表示を見て高く感じるため、買い控えが起きている。
,,▲,スーパー（仕入担当）,・消費税総額表示で当店は円未満切捨ての方針であり、月単位では大きな減収になる。価格の末尾に端数が出る商品もあり、消費者の購買意欲に影響する。
,,▲,コンビニ（エリア担当）,・周辺にスーパーが新規開業し、今後は競合店となっていく。
,,▲,コンビニ（店長）,・消費税総額表示が消費に良い影響を与えない。
,,▲,乗用車販売店（従業員）,・３月までの駆け込み受注の反動と、法人需要が盛り上がりに欠けることもあり、今後の販売計画は厳しい。
,,▲,その他専門店［雑貨］（店員）,・２月のバレンタイン商戦も前年比を割ったが、前年10月からこの流れは続いている。
,,▲,その他飲食［仕出し］（経営者）,・消費税総額表示による割高感で若干の落ち込みがある。
,,▲,美容室（経営者）,・周囲の年配者は安い店へ流れている。客からも景気が良い話は聞かれない。
,,▲,設計事務所（経営者）,・今後の計画がなく、仕事が増加する見込みがない。
,,×,一般小売店［書店］（経営者）,・消費税総額表示以降も現在の売価をそのまま内税にするため、売上は５％減少する。
"企業
動向
関連

(東海)",,◎,－,－
,,○,化学工業（人事担当）,・各企業でリストラ等の基盤整備が一巡しているため、景気が良くなる態勢が整ってきている。
,,○,輸送用機械器具製造業（経理担当）,・新製品の売行きについて楽観視できる雰囲気がある。
,,○,輸送用機械器具製造業（工務担当）,・予想生産負荷は現在より高めに推移する。市場も前年比で高水準を維持する。
,,○,輸送業（エリア担当）,・プラント機械関係の荷動きが活発になってきている。
,,○,企業広告制作業（経営者）,・受注が増えている。
,,○,新聞販売店［広告］（店主）,・今年に入って流通業のチラシが伸びている。
,,○,その他サービス業［ソフト開発］（社員）,・自動車関係の好景気に支えられ、基幹以外のシステム開発に目が向いている。
,,□,食料品製造業（企画担当）,・食品業界では、ＢＳＥ、鳥インフルエンザや豚コレラなど安全性の問題や、原材料の高騰を販売価格に転嫁できない状況がある。
,,□,パルプ・紙・紙加工品製造業（総務担当）,・受注量が増加している部門もあるが全体的には変化がない。
,,□,窯業・土石製品製造業（経営者）,・窯業界の先行指数となる新規住宅着工件数は減少しているが、全体の景気が浮上しつつあるため上向きに転じる見込みがある。
,,□,金属製品製造業（従業員）,・生産量の増加が見込めるが、原材料価格の高騰で収益に影響が出てくる。
,,□,一般機械器具製造業（販売担当）,・具体的な設備投資計画件数は増加しているが、米国市場では円高のため価格競争力が低く、受注に結び付く可能性はさほど高くない。
,,□,一般機械器具製造業（経理担当）,・来半期の受注量は既に確保できている。
,,□,電気機械器具製造業（経営者）,・国内販売は年度末需要の終了に伴いやや落ち込むが、海外販売は北米、欧州で回復が見込まれる。しかし１ドル105円を長期間割り込む状況になれば業績に影響を及ぼす。
,,□,電気機械器具製造業（従業員）,・リピートオーダーが入ってきているが、年度末の影響か継続的なものかもう少し見守る必要がある。
,,□,電気機械器具製造業（従業員）,・新規引き合いの話があまりなく、横ばいが続く。
,,□,建設業（経営者）,・好転の兆しはないが受注機会は堅調である。
,,□,建設業（経営者）,・住宅着工戸数は増加しているが、安価なマンション建設がほとんどである。
,,□,輸送業（エリア担当）,・景気が良い客と良くない客の傾向が二極化しており、全体的な会社の業績が最終的に良くなるか予想できない。
,,□,輸送業（エリア担当）,・新年度を迎えるが活発な荷動きはまだ見られない。例年は見られる決算月の駆け込み需要も今年はない。
,,□,金融業（従業員）,・例年に比べさほど差を感じない。周りも同じ様な状況であり、ほぼ横ばいである。
,,□,金融業（企画担当）,・大企業には資金需要が出てきているが、中堅、中小企業の資金需要は乏しく、底堅い景気の回復までには時間がかかる。
,,□,広告代理店（制作担当）,・企業側に提案している印刷物などは半分は形になりそうだが、コスト面が厳しい。
,,□,その他非製造業［デザイン］（経営者）,・受注先企業の体力から判断して、このまま上向き傾向となることはない。
,,▲,金属製品製造業（従業員）,・プロジェクトの狭間の時期となり、仕事量が減る懸念がある。
,,▲,電気機械器具製造業（経営者）,"・鉄鋼メーカーの４月からの値上げ決定が影響している。社内のコストダウンで対応できる範囲を超えているが、客先にも転嫁できない環境が続いている。販売価格の調整が必要であるが、浸透するまで時間がかかる。
・急激な円高の影響も出てくる。"
,,×,非鉄金属製品製造業［鋳物］（経営企画担当）,・原材料の高騰にもかかわらず製品価格は低いままの状況は継続する。
"雇用
関連

(東海)",,◎,人材派遣会社（社員）,・取引先の業務量が増加し残業も発生しているため、人材派遣の追加オーダーが増加している。
,,◎,職業安定所（所長）,・製品開発や設計等、高度な技術を持った人に対する求人が増加している。
,,◎,民間職業紹介機関（職員）,・求人数、登録者数が増加している。
,,○,人材派遣会社（社員）,・突発的なイベントではあるが、万博関連などで雇用の盛り上がりが徐々に現れつつある。
,,○,人材派遣会社（営業担当）,・求職者数は減少しているが求人数は増加しており、うまくマッチングすれば売上は上昇してくる。
,,○,求人情報誌製作会社（編集者）,・アルバイトやパートだけでなく正社員の求人も増加しており、底固さがある。企業の好調な業績を反映している。
,,○,求人情報誌製作会社（企画担当）,・年度末の採用控えが危惧されたがそのような動きもなく、採用は順調に力強さを増している。
,,○,新聞社［求人広告］（営業担当）,・久しぶりにトラック乗務員の募集が出ている。
,,○,学校［専門学校］（就職担当）,・中途採用の募集をしても人材確保が難しいほど、雇用は上向きである。
,,□,人材派遣会社（社員）,・例年年度替わりの時期は派遣ニーズが落ち込むが、来月以降の受注残がかなりある。
,,□,アウトソーシング企業（エリア担当）,・製造業の派遣解禁によりマーケットは拡大しているが、労働者の絶対数が不足している。供給が需要に追いつかない。
,,□,求人情報誌製作会社（編集者）,・求人件数はここ数か月ほとんど変化がない。地元大手企業が大量の中途採用を予定しているが、それ以外では特に大きな変化はみられない。
,,□,新聞社［求人広告］（担当者）,・中堅製造業を中心に新卒採用を含め採用活動は活発していくが、派遣社員募集が多いため求人広告件数は横ばいである。
,,□,職業安定所（職員）,・求人数が増加し求職者数は減少しているが、中小企業では人員整理や倒産、大手企業ではリストラや企業規模の縮小が続いている。
,,□,職業安定所（職員）,・求人は増加しているが、臨時、パート、請負、派遣のような非正規社員の割合が高い。応募しても年齢や経験などハードルが高く、就職に結び付きにくい求職者も増加している。
,,□,職業安定所（管理部門担当）,・新規求人に占める派遣、請負求人の割合は３割と大幅に高くなっている。また、年齢制限などミスマッチも多く、就職率は8.65％と低い。
,,▲,民間職業紹介機関（経営者）,・東海地区の大手メーカーと全国の自動車メーカー、デジタル家電メーカーなどとの人材獲得競争が激化している。今後電気電子、機械系エンジニアの採用に影響が出てくる｡
,,×,－,－
,,,,
　６．北陸（地域別調査機関：（財）北陸経済研究所）,,,,
,,,,（－：回答が存在しない、＊：主だった回答等が存在しない）
分野,,景気の先行き判断,業種・職種,景気の先行きに対する判断理由
"家計
動向
関連

(北陸)",,◎,テーマパーク（職員）,・メディアを利用した広告宣伝関係の製作を相当行っており、この影響で来場者の増加が見込める。
,,○,百貨店（売場主任）,・３月末からお祝いギフトが非常に伸びている。天候の回復に伴い、カジュアルのジャケットなども動き始めており、この流れから祝日や土、日曜日の日数が多くなる４、５月は期待できる。
,,○,スーパー（店長）,・味の良さや買いやすい価格の新商品が店頭に並ぶと、確実に売れるような状態になっており、近い将来少しは上向きになる。
,,○,コンビニ（経営者）,・これから暖かくなるため、最近販売を開始した酒の動きが良くなる。
,,○,衣料品専門店（経営者）,・今年は例年より暖かく、春夏物の前倒し需要が期待できる。
,,○,家電量販店（経営者）,・白物家電がシングル需要の影響もあって、前年比で大幅に伸びている。また、エアコン商戦は天候に左右されるが、メーカーの新型商品に今までにないタイプが登場するため、大きく期待できる。
,,○,家電量販店（店長）,・今年はオリンピックの開催や地元でいち早く実施される地上デジタル放送などの効果が期待できる。
,,○,乗用車販売店（総務担当）,・現状の販売台数はやや悪いが、５月には新型車が登場し、夏を過ぎると主力車種のモデルチェンジが予定されているため、底上げにつながる。
,,○,その他専門店［医薬品］（営業担当）,・健康食品や酒の販売量が前年比大幅に増加しており、ドラッグストアでの買物内容に変化が見られる。
,,○,旅行代理店（従業員）,・上海便の特需が期待できる。
,,○,設計事務所（職員）,・まだ手探りの状態であるものの、自動車販売の店舗や懸案になっていた住宅関連の計画が少しずつ具体化しそうな気配がある。
,,□,一般小売店［鮮魚］（従業員）,・消費税総額表示が客の足を若干引っ張る。
,,□,百貨店（営業担当）,・春物ではヤング、ＯＬ層を中心にシャツにセーターなどを組み合わせる重ね着が流行しているが、３か月後にも同じような商品が動くため商品単価は若干上がる。しかし、消費税込みの消費税総額表示にどのような反応が返ってくるかは予想がつかない。
,,□,スーパー（店長）,・４月から消費税総額表示が義務づけられるが、当店では３月中旬から先行して実施している。その結果、予想したとおり客の消費傾向が若干落ちている。４月１日から全国一斉に足並みがそろった段階で、価格の見直しが必要となるかもしれない。
,,□,スーパー（店長）,・天候不順に加えて、バーゲン期にならないと商品を買わないという客の傾向がますます顕著になっている。
,,□,スーパー（総務担当）,・消費税総額表示により客は割高感を持つため、商品が売りにくくなる。
,,□,スーパー（総務担当）,・４月から始まる消費税総額表示によって、商品に割高感が生じ、消費が伸び悩む。
,,□,スーパー（営業担当）,・４月からの消費税総額表示に関して、客に買いやすい値ごろ感を出すため１品単価が下がり、厳しい状況になる。また、客の購買意欲が高まるとも思えない。
,,□,コンビニ（経営者）,・以前は天候の良し悪しによって来客数が変動したが、最近は天候に左右されることが少ない。
,,□,乗用車販売店（経営者）,・販売は低価格車に集中し、全体の台数では減少傾向にある。
,,□,乗用車販売店（営業担当）,・直前の土、日曜日に開催されたイベントの集客数や受注量は前年より悪化しており、このトレンドは４月以降も続く。
,,□,観光型旅館（スタッフ）,・４～６月の予約状況は前年並みで、７月は前年を下回っている。
,,□,都市型ホテル（スタッフ）,・前年５月に開催された大型学会に代わるものがないため、中小宴会を取り込んでいるが、売上は伸び悩んでいる。
,,□,タクシー運転手,・利用客の少ない中で、他社との競合が一層激しくなる。
,,□,競輪場（職員）,・２か月連続で客単価が若干低下したが、今月は各家庭で子供の卒業、就職、入学などの費用がかさんだ影響とみられる。
,,□,美容室（経営者）,・業界では客の来店サイクルが延びており、またここ数年は新規オープンの店が増えているため、来客数と売上が減少傾向にある。
,,□,住宅販売会社（従業員）,・住宅建築に慎重な態度を示していた人が、ようやく実施に踏み出すというケースが見られる。しかし、従来のように全部の取り壊しでなく、一部を残した大規模な改造が目立つ。
,,□,住宅販売会社（従業員）,・電話の問い合わせ内容は塗装や改装などリフォームが中心で、客はこれ以外に興味を示さない。
,,▲,商店街（代表者）,・客は消費税総額表示に戸惑う結果、消費は落ち込む。
,,▲,一般小売店［鮮魚］（店長）,・消費税総額表示は客に割高感を与えるため、買い控えが増え、消費は低迷する。
,,▲,百貨店（営業担当）,・現在好調をキープしているのは旅行かばんやキャスターケースなどの旅行関連商品と高級食材であるが、前者は前年の５割増しとなっている。しかし、一般衣料やその他の雑貨品については客の慎重な購買態度がより一層強くなる。
,,▲,スーパー（店長）,・４月から消費税総額表示が導入されると、客に割高感が生じるため非常に厳しくなる。売価の低下や利益の圧迫など企業としては苦しくなる。
,,▲,住関連専門店（店員）,・消費税総額表示の導入により客の買い控えが続き、景気の回復傾向にブレーキがかかる。
,,▲,観光型旅館（経営者）,・消費税総額表示から生じる割高感による購買意欲の減退と浜名湖花博の影響が不安材料である。
,,×,テーマパーク（職員）,・浜名湖花博など他地域での大型イベント開催のため、北陸や当地への旅行の設定が少なくなっている。予約状況も前年より鈍くなっており、また６月には参議院議員選挙があるため、今後は厳しくなる。
"企業
動向
関連

(北陸)",,◎,－,－
,,○,繊維工業（経営者）,・受注はボリュームゾーンからベター（中級品）ゾーンに移る傾向にあり、消費は上向きになる。
,,○,一般機械器具製造業（経営者）,・サプライヤーからの値上げがマイナス要因であるが、受注量が多くなったこと、価格の値戻しが始まったことがプラス要因である。
,,○,電気機械器具製造業（経理担当）,・電子、電気関係の部品業界は引き続きデジタル家電の好況に支えられ、好調に推移する。
,,○,輸送業（配車担当）,・当社は食品の取扱が多いため、新商品の登場、キャンペーンの実施、ゴールデンウィークなどが好材料となる。
,,○,通信業（営業担当）,・４月から固定電話から携帯電話への通話料金が値下げされるため、利用量の増大が見込める。
,,□,食料品製造業（企画担当）,・業界の中で消費意欲をかき立てる商材の開発が特に見当たらない。
,,□,化学工業（営業担当）,・消費者の購買意欲は依然として低く、客単価の増大は見込めない。
,,□,金属製品製造業（経営者）,・素材関係の業種では、商品価格が上がると見込んで在庫引き当てのため早めに注文をしている。しかし、製造する側はフル操業の状態になっており、当分はこれ以上増産できないため現状のままで推移する。
,,□,精密機械器具製造業（経営者）,・眼鏡業界の脅威となっていた中国製品の攻勢は品質問題などで一段落し、この分が日本製品に回帰している。これは一部の良いメーカーにとってプラスとなり、今後とも維持されると思うが、消費全体が伸びない中では、いまだに仕事の少ないメーカーの今後は厳しい。全体としては好調企業が現状を維持できれば良い方である。
,,▲,通信業（営業担当）,・携帯電話の料金値下げ競争が一段と激しくなり、収益が大幅に減少する。
,,×,建設業（経営者）,・例年５、６月は仕事の発注が出ない時期で手持ち工事が少なくなるが、特に今年度は悪く、当社の現場ではゴールデンウィークを11連休とした。今後は受注できたとしても、非常に採算の悪い工事になる。
"雇用
関連

(北陸)",,◎,－,－
,,○,求人情報誌製作会社（編集者）,・新年度に向けて求人予算を増額する企業が出始めている。
,,○,新聞社［求人広告］（担当者）,・この半年間は求人企画の売上が常時前年の100％を超え、その割合も少しずつ上昇している。今後の景気見通しは明るい。
,,○,民間職業紹介機関（経営者）,・徐々にではあるが、企業の求人が増加しており、雇用環境は回復傾向にある。
,,□,職業安定所（職員）,・求人の動きを見ると、不安定な雇用形態である派遣、請負、パートなど非正規従業員型が多くなる一方で、求職者は常用を望んでおり、このミスマッチは当分変わらない。
,,▲,－,－
,,×,－,－
,,,,
　７．近畿（地域別調査機関：りそな総合研究所（株））,,,,
,,,,（－：回答が存在しない、＊：主だった回答等が存在しない）
分野,,景気の先行き判断,業種・職種,景気の先行きに対する判断理由
"家計
動向
関連

(近畿)",,◎,コンビニ（経営者）,・販売単価が上がってきているので、先行きの見通しは明るい。
,,◎,通信会社（経営者）,・順調に新規案件が成約に向かっていることから、先行きの見通しは明るい。
,,◎,その他レジャー施設［球場］（企画担当）,・当球場のフランチャイズ球団の好調が続けば、今後も来場者増加の期待が持てる。また６月には在阪の人気球団の試合も予定されており、こちらの方も多くの観客が期待できる。
,,○,一般小売店［衣服］（経営者）,・街が新しくなって客が戻ってきており、客単価も上がってきていることから、先行きに期待できる。
,,○,一般小売店［精肉］（管理担当）,・米国牛の輸入解禁時期がわずかながらみえてきたことで、消費者の心理に良い影響を与えることが期待される。
,,○,百貨店（売場主任）,・高額品の動きは今後も堅調に推移すると期待される。ただし、現状は大阪市内の居住者より郊外や大阪の衛星都市圏の方が消費意欲が高いことから、本格的に消費が回復するかは今後の中流層の消費動向にかかっている。
,,○,百貨店（売場主任）,・買い控えの続くフリー客が夏物の購入に入ると予想される。また新しいトレンドアイテムやブランドが出てきており、前年とはかなり違った色、素材、購買傾向が出てくると期待される。
,,○,百貨店（売場主任）,・当百貨店の周辺は大型マンションや大型専門店などの建設が次々と予定されていることから、今後は地区のにぎわいが広がり、他方面からの集客力が高まることが期待される。
,,○,百貨店（企画担当）,・春物については比較的堅調にスタートした。初夏物商材についてはこれから実需期を迎えるが、気候、気温が安定さえすれば期待できる。
,,○,百貨店（営業担当）,・50万円前後の薄型テレビの販売が増えることにより、100万円までの商品に以前よりも割安感が持たれることで、消費に弾みがつくことが期待される。
,,○,コンビニ（店長）,・消費税総額表示の影響が懸念されるが、前年は気候が不安定であったことや、発泡酒、たばこの増税があったことなど特殊要因が多かったため、天候が順調であれば前年を上回ることが期待される。
,,○,家電量販店（店長）,・住宅事情の関係もあり今後は照明器具が落ち込むと予想されるが、オリンピック需要には期待が持てる。
