Ⅱ．景気の先行きに対する判断理由,,,,
,,,,
　景気の先行きに対する判断の理由について、その主だったもの及び特徴的と考えられるものを取りまとめると以下のとおりであった。,,,,
,,,,
,,,,
　１．北海道（地域別調査機関：（株）北海道二十一世紀総合研究所）,,,,
,,,,（－：回答が存在しない、＊：主だった回答等が存在しない）
分野,,景気の先行き判断,業種・職種,景気の先行きに対する判断理由
"家計
動向
関連

(北海道)",,◎,一般小売店［土産］（店員）,・前年は暖冬により降雪が遅れたことで、スキーツアーのキャンセルが相次ぎ、かなり影響を受けたが、今年は早い時期から山に雪が降っているので、スキー客が前年より前倒しで来道することになれば、観光客が増えることになり、前年より良くなる。
,,○,百貨店（販売促進担当）,・来客数が増加している。セールの強化によるところが大きいが、実売期に向けて期待が持てる状況である。
,,○,スーパー（店長）,・販売量の増加に伴い、売上も伸びてきている。目に見える大まかな景気の状況は変わらないが、少しずつ上向き状態になっている。
,,○,コンビニ（店長）,・９月30日よりクレジットカードの決済が可能となった。また、７月に導入した電子マネーによる決済も、地下街やスーパー、居酒屋等での導入が進んでおり、今後、現金以外による決済方法への認識が広まることで利用者も増える。
,,○,衣料品専門店（店員）,・客数が増加するとともに、客単価も上がってきている。以前と比べても客の購買意欲を感じる。
,,○,一般レストラン（スタッフ）,・単価の低下は続いているが、来客数が２か月連続で前年を上回っており、売上も回復傾向にある。
,,○,美容室（経営者）,・納得した商品であれば購入する気配を感じるようになった。
,,□,商店街（代表者）,・すでに防寒物の動きはみられているが、例年と比べて元々の単価はある程度こなれてのスタートなので、価格がダウンするセール時期には前年よりも単価がかなり低くなる。
,,□,商店街（代表者）,・先々景気が良くなるという要素があまり見当たらない。実際、物価が上がっている。台風や地震の影響等、色々な意味で先行きの景気が急激に良くなるとは、政治的にみても考えられない。
,,□,百貨店（売場主任）,・高額商品の動きがみえない。特にコートやジャケット等の防寒衣料を含めて厳しいと思われ、場合によっては単価が低下して、単価割れとなることも考えられる。
,,□,百貨店（役員）,・先行きに明るさが感じられず、将来に不安があるためか、買い控え、慎重な商品の選択など、生活防衛型のライフスタイルがうかがわれる。
,,□,スーパー（店長）,・今年の台風により農作物が受けた、例年にないほどの被害の影響で、高騰している青果物に対する買い控え等が懸念される。
,,□,コンビニ（エリア担当）,・道内の企業業績が若干上向きになっているので、冬のボーナスも若干増加する見込みがあり、景気は緩やかだが上昇する。
,,□,コンビニ（エリア担当）,・基幹産業や周辺の環境、銀行からの情報、メーカーからの情報を総合しても、何一つ良くなる要素はない。閉山した炭鉱従事者への特別給付も11月で終了し、さらに所得が減少する。地域では、今、元気の良い輸出産業を一つも抱えておらず、今後上昇する要素が一つもない。
,,□,衣料品専門店（店長）,・年金の心配や燃料の高騰、新潟地震への心配等、暗い話ばかりが客から聞こえてくるので、良くならない。
,,□,スナック（経営者）,・全体的に、会社自体が交際費を抑えている中、繁華街に出てくる人はポケットマネーを使うことになるため、自然と街に出てくる回数も減っている。
,,□,観光型ホテル（経営者）,・自然災害は噴火に地震が加わり、マスコミ等による不安感を増すような風評が広まると、景気どころではない。道外の大都市・人口集中地域での旅行控えや消費控えが始まると、この業界は更に厳しい状況になることを覚悟しなければならない。
,,□,旅行代理店（従業員）,・海外旅行の受注も落ち着き、国内旅行も回復の兆しがみられない。
,,□,旅行代理店（従業員）,・台風や地震の影響で旅行マインドが冷え込む恐れがある。
,,□,観光名所（職員）,・タクシーの空車率が依然として変わらない。人の動きも全然ない感じである。
,,□,設計事務所（職員）,・当社で設計した民間分譲マンションの売行状況は必ずしも悪くない。購入者の手付金支払も早いと聞いており、民需はまだ期待できる。
,,▲,商店街（代表者）,・商店街の核店舗である百貨店が、今後、親会社の産業再生機構入りでどうなるかが大きな問題である。消費動向、心理に与える影響は大きく、来年から支援策が報道される度にイメージダウンにつながる。
,,▲,百貨店（売場主任）,・台風による被害の修繕、農作物の未収穫に加えて、原油価格の上昇によるガソリン、灯油の値上がり等、マイナス要因が多く、これらが北海道の冬を圧迫する。車を運転していると、低価格を大胆に告知しているガソリンスタンド前に客が長い列を成している。
,,▲,スーパー（店長）,・全国ベースでの個人消費はやや明るさを示しているものの、北海道における改善の兆しはいまだに不透明である。原油高も大きく影響し、また冬季ボーナスの増額も不確定である。10月はプロ野球チームの優勝セールが大きく寄与し、前年を上回る見込みとなったが、11月以降のリバウンドによる売上低下が懸念される。
,,▲,スーパー（企画担当）,・野菜の高騰で足元の青果物の売上高は好調に推移しているが、急激かつ大幅な価格高のため、他の生活必需品の買い控え等、家計への圧迫が懸念される。
,,▲,コンビニ（エリア担当）,・公務員の燃料手当の減少の影響で、冬場の気温の低下とともに、消費者の購買力が鈍る可能性が強い。
,,▲,コンビニ（エリア担当）,・公共工事の予算が前倒しで発注されており、10月から極端に落ち込んでいる。年度が変わるまでは、この悪い傾向が続く。
,,▲,家電量販店（地区統括部長）,・競合店の地方出店で苦戦を強いられる。
,,▲,その他専門店［医薬品］（経営者）,・ありきたりなイベント訴求では購買には結び付かなくなっている。個々の興味をそそる新しい切り口が要求されている。
,,▲,高級レストラン（スタッフ）,・11月の予約は前年並みであるが、12月はかなりのマイナスとなっており、厳しい年末年始が予想される。
,,×,＊,＊
"企業
動向
関連

(北海道)",,◎,食料品製造業（経営者）,・企業業績が好況のため、ボーナス水準が高くなると予想されるので、年末に向けての食料品消費が盛り上がる。
,,○,家具製造業（経営者）,・買い控えていた耐久消費財においても、買換え需要が増えつつある。
,,○,その他サービス業［建設機械レンタル］（総務担当）,・各エリア担当者から未発注工事の執行がこれから出てくると報告を受けている。
,,○,その他サービス業［建設機械リース］（支店長）,・台風災害で公共事業が多少上向きであり、全体の景気も多少は良くなる。
,,□,通信業（営業担当）,・販売量に大きな上積みの様子もなく、今後数か月間、これといった大型案件もない。
,,□,金融業（企画担当）,・雇用、所得環境に明確な改善はみられず、年末・年始商戦も期待できない。
,,▲,食料品製造業（団体役員）,・加工原料の調達に不安定感が増大しており、販売価格の値上げを依頼しているが満足な価格を得ることができない。
,,▲,輸送業（支店長）,・道内工事物件向けの各種鋼材、木材等の資材の入荷もピークを過ぎ、物量面でいえば道内への入荷は、今後毎月、前年を下回る。また原油価格の上昇による、フェリーあるいは内航海運の運賃アップは、荷主に対し価格転嫁ができない中、物流業者の経営を更に圧迫する要因になると懸念される。
,,▲,輸送業（営業担当）,・原油の異常高騰により、海上運賃やトラック料金の値上げが必至である。荷主との料金改定を行う間の収支悪化が予測される。
,,×,建設業（経営者）,・手持ち工事は完了してくるものの、官、民とも新規の受注が見込めず、受注が大幅に落ち込み、単価の低下と併せて利益面で非常に厳しくなる。
"雇用
関連

(北海道)",,◎,求人情報誌製作会社（編集者）,・求人件数で小売業や飲食店等が前年から増加に転じた。個人消費の伸びが後押ししているように思う。
,,○,求人情報誌製作会社（編集者）,・今年に入って比較的伸びが小さかった小売や飲食の求人が、10月に入ってから大きな伸びを示しており、この勢いはまだ続く。
,,○,学校［大学］（就職担当）,・企業の採用状況は、通年採用、秋採用、追加採用等、色々な形態で採用は好転している。関東、又は中部に本社がある企業は業績も好調であり、北海道支社や札幌支店等での採用にも兆しが出てきている。北海道企業の採用枠は、この秋からの採用もあるが、来年度新規募集も計画しているようである。
,,□,求人情報誌製作会社（編集者）,・安定高収入の常用雇用の増加に期待が持てず、所得の変動による不安を払拭しない限り、現状のまま推移する。
,,□,職業安定所（職員）,・求人の就労地をみると、北海道外での求人が多く、地元での求人は動きが少ない。
,,▲,求人情報誌製作会社（編集者）,・年末に向けて、短期アルバイト雇用のニーズは出てくるが、逆に正社員雇用や長期アルバイト雇用は、この時期から低迷していく傾向にある。今年は、その割合が低迷傾向の比重が高くなっている。
,,×,－,－
,,,,
　２．東北（地域別調査機関：（財）東北開発研究センター）,,,,
,,,,（－：回答が存在しない、＊：主だった回答等が存在しない）
分野,,景気の先行き判断,業種・職種,景気の先行きに対する判断理由
"家計
動向
関連

(東北)",,◎,－,－
,,○,商店街（代表者）,・例年よりも年末のイベントやセールを早めに行う予定になっており、来街者が増える見込みである。
,,○,百貨店（企画担当）,・前年の冬物、特にコートについては新しい商品開発が無く、消費者の目からもそう感じられた。今年のコート類の入荷状況を見ると、素材、デザイン等バラエティに富んでおり、冬物商戦が活発化することを期待している。
,,○,衣料品専門店（経営者）,・少しずつ良くなっていくとは思うが、職種によりかなりばらつきが出る。製造業は好況であるが小売業は依然厳しい状況下にある。
,,○,住宅販売会社（経営者）,・展示場来場者は前年比15％増加しており、住宅ローン減税反動落ちもようやく落ち着き始めた感じがする。受注が増加へ転じると思う。
,,○,住宅販売会社（従業員）,・冬期間の受注減少期に入るが、展示会等での集客により、３か月先までの受注見込みが取れている。
,,○,その他専門店［白衣・ユニフォーム］（営業担当）,・これから年末にかけ、商品的には動くことが期待できるが、中越地震の影響が分からないため不安である。状況的にはあまり良くないような気がするが、年末への希望を込めて良くなってもらいたい。
,,□,一般小売店［書籍］（経営者）,・話題になった人気シリーズ第５巻もすっかり影をひそめ、店頭も落ち着いている。冬物（手帳、日記、カレンダー）の展開を繰り上げ、売上確保に努めている。
,,□,一般小売店［雑貨］（企画担当）,・中越地震によって不安になった部分や必要な商品を購入する客は増えると思うが、それが一巡すると、前年実績を割るという状況が続く。
,,□,百貨店（売場主任）,・景気を押し上げる好材料が見当たらず、冬物の中心アイテムであるコート類の出足が厳しそうである。
,,□,百貨店（売場主任）,・今後、クリアランス待ちという客が多くなると思うが、正月商戦には期待している。特に福袋等のこだわり商品、話題商品を提供し、衝動買いを促していきたい。
,,□,百貨店（広報担当）,・年間で最も売上シェアが大きくなる時期であるが、慎重な購買動向は相変わらずである。内外の人気ブランド品以外は、年々前倒しになっているバーゲン待ちが予測される。
,,□,スーパー（店長）,・これまで既存店で客数、客単価共に前年比100％を維持してきたが、９月に入ってから99％と微減ではあるが、２か月連続して前年割れを起こしており、今後更なる悪化が懸念される。
,,□,スーパー（企画担当）,・営業時間の拡大取り組み等で客数は獲得可能であるものの、今後も単価がアップすることは困難であり、特に既存店では厳しい流れが続く。
,,□,コンビニ（エリア担当）,・全国的だと思うが、市場には先行きに対する不安感がある。一部に勝ち組と負け組がはっきりしている状況であるが、そのため良い所はあっても、市場における一般的な客の家計状況は改善されていない。そのため当業界のように最寄り品を扱っている業界では単価が下がってきている。自分自身も含め、先行きに対する不安感が消費を抑制させる。
,,□,コンビニ（店長）,・変わらないということは、なかなか良くならないということである。消費者というより国民全体が、収入は多く、買う時は安くという貧乏症が染み付いている。よほどのアクションがないとこの状況は改善しない。
,,□,衣料品専門店（店長）,・コート、ニット、アウター等のシーズン商品の動きが、天候等の外部要因の後押しを受け、動きが活発にならない現段階においては、今後現状より大きく数字が変わるとは思えない。
,,□,衣料品専門店（店長）,・冬物処分期にあたり、例年にない値下げ競争が予測されるが、単価低下分の売上増加は見込めない。
,,□,衣料品専門店（総務担当）,・景気が上向きになっていると言われているが、小売業においてはまだまだである。客の動向を見ても、そう伸びているという感じがしない。
,,□,住関連専門店（経営者）,・洋服に関しては、トレンドの変化がほとんど無いため、購買意欲が上がらない状況が続く。
,,□,住関連専門店（経営者）,・耐久消費財を扱っている中、今のところ家計が厳しく、現状と変わらない。しかし被災者には申し訳なくお見舞い申し上げるが、災害による特需が発生してくれれば良い。
,,□,その他専門店［呉服］（経営者）,・当店は、地震の被害も無く助かったが、秋の収穫の悪さが響く。
,,□,その他専門店［パソコン］（経営者）,・平均的に、地方では一般消費者のサラリーが底上げになっていない。減給したまま、そして支給する会社にも利益が無いため市場の回転がまだ鈍く感じられる。
,,□,その他専門店［ガソリンスタンド］（営業担当）,・11月にも1.5から2.2円の値上げが予想されるため一層の消費の削減が予想される。また、灯油、ガスの値上げもあり一般家庭の消費節約、総じて家計の引き締めが予想される。燃料関係は真っ先に節約の目標にされやすいため、厳しい状況が予想される。寒波の状況次第で消費量が動くため、今後の推移で状況が変化する見込み。
,,□,一般レストラン（経営者）,・今とあまり状況は変わらない。予約状況では、結婚式等のイベントは入っているが、一般客が乏しい状況に変わりはない。遊びに付け加え台風や地震災害の影響もある。
,,□,観光型ホテル（経営者）,・今年は忘年会の予約が例年より早い。また会議を伴う客や、ゴルフを伴う客が戻りつつある。また小規模の婚礼の件数が大きく増加している。
,,□,観光型旅館（経営者）,・中越地震の影響はしばらく続くと思うが、地震見舞い先の三条で、羽越水害から３か月で旅行気分が出てきたという声を聞き、中越地震の影響は長くないように思う。またこの地域に１兆円を超える緊急公共投資が投入されることとなり、地域にとってはとても大きなことである。とにかく一日も早い復旧、また旅行する人達の気持ちの復活を祈っている。
,,□,テーマパーク（職員）,・台風、新潟の地震の影響で、11月分で約300名のキャンセルが出ている。
,,□,美容室（経営者）,・数字上で行けば、前年同等くらいの売上を見込んでいる。来客数は前年並みまで行くか分からないが、単価的には若干上回ってきて、総額的にはほぼ横ばいで推移する。ボーナスへの期待も東北ではあまりない。
,,▲,商店街（代表者）,・中越地震のような天変地異や、石油価格高騰等の不安材料が気になる。こうしたことがマイナスに作用するという予想が当たりそうである。
,,▲,商店街（代表者）,・11月は恵比寿講、12月は年末年始大売出しで抽選会等のイベントを企画しているがイベント費用も圧縮傾向にあり、あまり大きな効果は望めない。
,,▲,百貨店（経営者）,・台風や地震等、天候の部分で先行き不安感が大きくなっている。今後の天候にもよるがやや悪くなる。
,,▲,百貨店（売場担当）,・台風等があり観光地に行くのも考えたり、洋服にしても必要性が弱く、特に先日の地震の影響もあり、購買に走ることも少なく、景気は下がる。しかしこれから寒くなればどうしても欲しい需要品等が動き出すので、売上を伸ばす対策を実施する。
,,▲,百貨店（販促担当）,・特に被災地では、生活必需品や耐久消費財等の消費構造になる。今年は暖冬傾向で、冬物衣料特に高額なコート類は苦戦しそうである。
,,▲,スーパー（経営者）,・当地の場合は、米とラフランスの作柄や価格が景気に影響を与える。米もここ４～５日ではえぬきが余ったり、価格が伸びない等があり、ラフランスは数量が去年の２割減であっても、高価格は見込めず、あまり良くない。
,,▲,スーパー（経営者）,・今現在、この回答をしている27日段階で、23日に発生した中越地震の影響が今後どうなるか心配の種になっている。一部建設業界等では需要が発生するが、県全体としてはこの地震は大きなマイナス影響を及ぼす。当県経済にとって今回の地震は懸念材料であり、当県の経済が中越地区中心にどうなるか心配である。
,,▲,スーパー（店長）,・厚生年金等の負担増、ボーナスからの社会保険料天引きが大きく、消費に反映されず、また台風や地震等が景気に悪影響を及ぼす。
,,▲,スーパー（総務担当）,・台風、地震、原油高の影響が出始めた。食品用発泡トレー価格の上昇、レジ袋等石油原料の資材と業務車両のガソリン代、空調のガス代が上がり、年末年始にかけ電気料金も上がり、今月からは社会保険も上がり、競合店の出店も増え、収益環境は一層悪くなってきている。人件費コストを圧縮しないと生き残れない経済環境にある。各監督行政機関も規制を厳しくしてきているので、これを乗り越えられない企業は市場から退場しなければならない環境にあるようだ。我々凡人は「知恵無き者は汗を出して働く」というようなことで頑張って生きていこうというこ
,,▲,スーパー（企画担当）,・原油高が今後の景気に影響を与える。また今年は地震や台風等の天災が多く、その影響を強く受けている業界もあるので、今までよりは多少景気が悪くなる。
,,▲,コンビニ（エリア担当）,・この地域のコンビニエンスストアは、冬は雪の影響等があり客足が鈍くなる。平均客単価も低下しており、客数の減少とのダブルで影響を及ぼす。
,,▲,衣料品専門店（経営者）,・客数の動きを見ていると、ますます買い控え傾向が強まっている。客単価の低下がいまだに続いている中、客数ならびに通行量の減少が大きく影響するのではないかと危惧している。
,,▲,衣料品専門店（店長）,・客に最近の状況を尋ねると、天災や物価上昇等で客も苦戦しているということで、全体的に消費ムードが盛り上がってこないのではと心配している。
,,▲,乗用車販売店（経営者）,・低価格の新型車ならびに買い得感のある車両についてはまずまずの推移を示すが、市場全体を底上げするような量は確保できるはずもなく、今年全体を見ても前年実績をかなり割り込む。
,,▲,乗用車販売店（経営者）,・新潟県中越地震の影響が不透明。７月の水害と比べて規模も大きく、保険金も出ない地震被害のため、復旧に時間がかかり、購買意欲の減退は否めない。
,,▲,乗用車販売店（経営者）,・当県の場合、雪が遅れれば助かるが、初雪が降ると新規客の来場も販売も見込めない。来場客があったとしても来春の下見客がほとんどで、登録が激減する。
,,▲,住関連専門店（経営者）,・広告媒体、特にチラシ広告を出してもほとんど効果が無く、ムードが悪くなっている。
,,▲,その他専門店［酒］（経営者）,・台風や新潟の大地震等の自然災害の影響、原油価格の高騰等による消費マインドの低下傾向が更に拡大する。
,,▲,その他専門店［酒］（営業担当）,・これから酒類業界は、日本酒等の需要期と期待されるが、例年のような需要は期待できず、どちらかといえば停滞気味の需要しか想定できない。
,,▲,その他専門店［ガソリンスタンド］（営業担当）,・客自体が、買い控えしているというよりも、客が金を持っていないというのが現状である。原油がこれ以上値上げしたら、ますます買い控えに向かう。
,,▲,その他飲食［そば］（経営者）,・ガソリン、灯油の値上がりにより、その分食事にかける金額が減る。寒さに向かって更に厳しい状況が続く。
,,▲,一般レストラン（スタッフ）,・台風が来たり、地震があったりと、消費者の購買意欲は減退している。有事に備えて節約志向が強まる。
,,▲,観光型旅館（経営者）,・紅葉シーズンが終わる時期の予約が極端に減少している。急激に上向きになる要因が無い。台風や地震で直接のキャンセルが発生しているが、今後も被災地方からの集客は見込めない。
