Ⅱ．景気の先行きに対する判断理由,,,,
,,○,家電量販店（経理担当）,・今年はオリンピックイヤーであり、プラズマテレビなどの需要拡大などが期待できる。
,,○,乗用車販売店（経営者）,・ホテルの予約状況はほぼ満室であることから、先行きに期待される。
,,○,住関連専門店（経営者）,・店頭での販売は低迷しているが、ネットでの売上が増えつつあることから、先行きに期待できる。
,,○,スナック（経営者）,・周辺では閉店するところもあり、客が当店に戻ってきていることから、多少改善することが期待される。
,,○,都市型ホテル（スタッフ）,・宿泊は、例年の大型団体による予約がなくなったが、今年はＳＡＲＳ問題の影響がなく、航空会社の増便による客室乗務員の宿泊受注などのプラス要因があり、先行きは明るい。
,,○,都市型ホテル（副総支配人）,・宿泊の売上は前年より２割以上伸びており、一般宴会、ブライダル、レストランについても前年を上回る見込みであることから、先行きに期待できる。
,,○,旅行代理店（経営者）,・イラク戦争、ＳＡＲＳで苦しんだ前年と異なるのは当然だが、海外旅行の申込が確実に上向いていることから、先行きに期待できる。
,,○,遊園地（経営者）,・イベントの問い合わせや団体客の問い合わせが前年に比べて増えてきているので、全体的に上向き傾向になっている。
,,○,ゴルフ場（経営者）,・４月後半から、土日を中心にコンペの予約も順調に入ってきており、先行きの見通しは明るい。
,,○,美容室（店長）,・６月は１年でも集客が見込める時期であるが、４月から開店10周年キャンペーンを企画しているので好調が期待できる。
,,○,設計事務所（経営者）,・リニューアル物件が増えたほか、新店を出すクライアントも増えてきたことから、先行きに期待できる。
,,○,その他住宅［展示場］（従業員）,・ハウスメーカーからは客単価が落ちたという声があるものの、展示場での住宅相談件数や、住宅ローンなどの相談の増加をみると、今後ますます住宅取得熱は過熱する気配が感じられる。
,,○,その他住宅［情報誌］（編集者）,・新築マンションのマーケットは販売在庫の圧縮で、新規物件の発売が増加する傾向にある。また、今後の供給はますます大規模案件や超高層物件が増加する傾向にあるほか、希少な立地の物件や、規制で減少していた京都市内の供給が回復してくることなどから、エンドユーザーの購入意欲を高める可能性が高く、マーケットは活況に転じることが期待される。
,,□,一般小売店［時計］（経営者）,・近くの百貨店が閉店することもあり、客が他の地域に流れることが懸念される。
,,□,百貨店（売場主任）,・消費税総額表示による割高感からくる影響は予測できないが、一方では今年は春が長いと予想され、商品サイクルが長くなるという期待感がある。
,,□,百貨店（売場主任）,・ヒット商品の不足や、競合店との競争の激化もあり期待できない。
,,□,百貨店（担当者）,・婦人服の春物の動きが鈍く、この先売れるとは予想しにくい。婦人服が好調に売れていかないことには、全体の売上も上昇しない。
,,□,スーパー（経理担当）,・消費税総額表示は思ったよりコストや人手がかさむほか、他社も含めた価格表示は、税込み、税抜が混在し、消費者が戸惑う懸念が大きい。これによる当面のマイナス要因が売上の上向きトレンドを相殺することが懸念される。
,,□,コンビニ（経営者）,・高付加価値型の機能性飲料の売行きもやや落ち着いてきて、客単価引上げ効果も薄れてきた。高級おにぎり等もトータルで客単価を引上げるほどの効果は出ておらず、しばらくは現在の低い水準で推移しそうである。
,,□,衣料品専門店（経営者）,・求人数は増加傾向にあるものの、派遣、請負契約による短期的な就労等不安定な求人が多く、雇用面での不安が解消されるには至っておらず、まだ厳しい状況が続く。
,,□,衣料品専門店（経営者）,・これから春本番になり期待しているが、ヒット商品がない限り変わらない。
,,□,家電量販店（企画担当）,・アテネオリンピックなどイベントで期待感はあるが、４月１日からの消費税総額表示に消費者が値上がりしたイメージを持たれると、表示に慣れるまで買い控えが起こることが懸念される。
,,□,乗用車販売店（営業担当）,・３月の新車販売台数はほぼ前年並みで、時節からすればまずまずの結果だが、４月以降については全く不透明である。
,,□,通信会社（経営者）,・新規の需要拡大が限界にきており、既存顧客の買換え需要に頼るところが大きいほか、低価格で販売数を稼ぐ手法が限界にきている。今後は高価格での販売に移行するとともに、販売量そのものは減少することが懸念される。
,,□,競輪場（職員）,・グレード開催がなく、特別なプラス要因がない。
,,□,その他レジャー施設［イベントホール］（職員）,・東京に重点をおいて動く取引先も多く、大阪はこれから先もまだまだ厳しい状況が続くと懸念される。
,,□,その他サービス［ビデオ・ＣＤレンタル］（エリア担当）,・中心顧客層である若年者の就職状況等にもあまり変化があるようにはみられないことから、先行きは不透明である。
,,▲,一般小売店［精肉］（管理担当）,・鶏肉については、全体的な需要が減少し続けており、回復には時間がかかりそうである。また牛肉については、販売額に見合う仕入れがなかなかできないことから、米国産牛肉の部分的な輸入解禁があってもあまり影響はないと予想される。
,,▲,スーパー（経営者）,・消費税総額表示に伴うトラブルや、価格据置きによる本体価格の引き下げの影響が出てくる。同業他社も単価引下げが中心となっていることから、日常買い回り品の価格低下が続くことが懸念される。
,,▲,乗用車販売店（営業担当）,・古い車やディーゼル車等の買換えは進むと期待されるが、２月、３月のような水準にはならず、厳しい状況が続く。
,,▲,その他サービス［学習塾］（経営者）,・周辺に数か所の個人塾が開講したため、今後更に生徒の確保が難しくなる。
,,×,商店街（代表者）,・閉店したり、営業時間を短縮する店が増えていることから、今後どの程度回復するか予想できない。
,,×,衣料品専門店（経営者）,・主力商品の重衣料に関しては、エコスタイルの浸透による需要減少で打撃を受けていることから、先行きの見通しは厳しい。
,,×,通信会社（経営者）,・大手委託先からの契約解除があり、その他の取引先からも新しいニーズを引き出せない状況であることから、先行きの見通しは暗い。
"企業
動向
関連

(近畿)",,◎,金属製品製造業（経営者）,・一次産品の原料不足に伴って、全体的に供給不足による価格是正が起こることが期待される。
,,○,化学工業（経営者）,・新規の案件が出てきているほか、各得意先の話でも明るい話題が多くなってきたことから、先行きに期待が持てる。
,,○,一般機械器具製造業（経営者）,・大手製造業の今年度の生産見通しが上向いていることから、先行きの見通しは明るい。
,,○,電気機械器具製造業（経営者）,・しばらくは新製品の受注が安定し、ユーザーのモデル変更による受注量も安定的に推移することが期待される。
,,○,電気機械器具製造業（経営者）,・太陽電池、風力発電といった分野に対する投資の活発化が期待される。
,,○,電気機械器具製造業（従業員）,・８月のオリンピックを前に、大型の液晶テレビの需要が見込まれ、それに付随してＤＶＤレコーダーの荷動きも活発になることが期待される。
,,○,電気機械器具製造業（営業担当）,・価格の動向に不安が残るものの、見積や引き合いの件数が増加の傾向にあるので、期待はできる。
,,○,輸送用機械器具製造業（経営者）,・引き合い件数、見積件数が増加している。また、受注の可能性も以前より高くなっていることから、先行きに期待が持てる。
,,○,不動産業（経営者）,・東京と大阪の収益物件の利回りの格差が大きくなり、大阪の物件の優位性が高まり、大阪の市場に東京資本が流入してきていることから、先行きに期待できる。
,,○,新聞販売店［広告］（店主）,・折込チラシは、今まではパチンコ店やマンション等不動産関係ばかりが目立っていたが、最近は多種多様にわたって入るようになってきたことから、先行きに期待が持てる。
,,○,その他非製造業［民間放送］（従業員）,・オリンピックというビッグイベントが控えていることで、家電メーカーがデジタル家電を中心に広告出稿を増やしてくることが期待される。
,,□,出版・印刷・同関連産業（経営者）,・発注量等、得意先ごとに差があり、全体としてはまだまだ上向きではないことから、今後も今の状況が続く。
,,□,建設業（経営者）,・民間の設備投資は若干増えるかもしれないが、官庁関係は減少傾向が続く。この１か月で鉄筋、鉄骨が急激に値上がりして品不足の状況であるが、すでに契約済み工事については仕入れ価格の差額が問題になることが懸念される。
,,□,不動産業（経営者）,・事務所に関しては空室率が依然高く、まだ予断を許さない。
,,□,不動産業（営業担当）,・賃料や土地については、立地の良い地域は上がっているが、それ以外はまだまだ下がっている状態であり、まだ良くなるとは考えられない。
,,□,広告代理店（営業担当）,・現状は売上が前年比130％から140％の水準で推移しているが、先の注文が増えているわけではないので、今の状況が続く。
,,□,コピーサービス業（従業員）,・取引先各社の春夏の新商品等、今後の売上回復につながる企画等が見受けられないことから、厳しい状況が続く。
,,▲,繊維工業（経営者）,・消費税総額表示に関して、売値が上がったとの誤った印象を店頭で持ち、購入にブレーキを掛けている傾向が現在でも見受けられる。２～３か月先には更にこの傾向が強くなる。
,,▲,化学工業（経営者）,・船積み運賃の上昇、アメリカ穀物相場の上昇で原料価格の上昇は避けられないほか、４月からの消費税総額表示による影響が懸念されるなど、まだまだ厳しい状況が続く。
,,▲,輸送業（営業所長）,・春先から初夏にかけての見積、問い合わせ等が少なく、先行きが不透明である。
,,×,繊維工業（団体職員）,・原材料価格が高止まりしたままであり、受注量の減少幅が徐々に拡大していることから、先行きの回復には期待できない。
"雇用
関連

(近畿)",,◎,民間職業紹介機関（支社長）,・大手メーカーは新卒採用にパワーを結集し、中途の採用が一時ストップすると思われるが、それ以外の企業の中途採用活動が４月以降も勢いが落ちるとは思えない。
,,○,人材派遣会社（社員）,・来年度の新人採用数が増加傾向にあることが公表されるなど、取引先での人材確保が活発化してきている。派遣社員でも良い人材がいれば採用するという前向きな姿勢が展開しつつある。
,,○,新聞社［求人広告］（担当者）,・求人広告に対する反響が良くなってきている。これは雇用のミスマッチが解消されつつあるということで、今後良い方向に向かうことが期待される。
,,○,新聞社［求人広告］（担当者）,・１月～３月の３か月のスパンで求人数の動きをみると、中小企業からの募集が前年比110％で増加している。この３か月スパンでこのような数字はここ近年では珍しいことから、先行きに期待できる。
,,○,学校［大学］（就職担当）,・大手企業、中堅企業の大半が新卒採用数を増加するとしていることから、先行きに期待できる。
,,□,人材派遣会社（経営者）,・労働者派遣法改正による問い合わせ件数は増えているが、受注については結び付いていない。
,,□,職業安定所（職員）,・求人数は増加傾向にあるものの、派遣、請負契約による短期的な就労等不安定な求人が多く、雇用面での不安が解消されるには至っていない。
,,□,職業安定所（職員）,・全体としての求人数は増えてきているが、中小企業については本格的に増やしていく動きはないことから、今の状況が続く。
,,▲,新聞社［求人広告］（担当者）,・無料情報誌が街角に氾濫し、新聞の求人広告市場はますます厳しくなることが懸念される。
,,×,＊,＊
,,,,
　８．中国（地域別調査機関：（社）中国地方総合研究センター）,,,,
,,,,（－：回答が存在しない、＊：主だった回答等が存在しない）
分野,,景気の先行き判断,業種・職種,景気の先行きに対する判断理由
"家計
動向
関連

(中国)",,◎,一般レストラン（店長）,"・若い人の就職が決まって、そのお祝いの来店が非常に増加しており、若い人の就職増はこれからの客の増加につながる。
・高額商品が増加傾向にあり、財布のひもが、自分の好きな物に対して緩くなってきており、この傾向は、今後も続く。"
,,○,百貨店（販売促進担当）,"・天候が暖かめに推移しているので季節商材が早めに売れ始める。
・前年以来好調な、ブランド雑貨や化粧品がこれからもけん引役となる。"
,,○,スーパー（店長）,・消費税総額表示の価格に客が慣れてくれば、回復すると見込んでいる。
,,○,コンビニ（エリア担当）,・店舗のオリジナリティを出していけば、客は戻って来るし、その兆しは既に現れている。
,,○,家電量販店（店長）,・現在は前年並みの数字は確保できてはいないが回復傾向にはあり、４月、５月は上向きになる。
,,○,家電量販店（予算担当）,・消費税総額表示による落ち込みも落ち着き、アテネオリンピックによる映像関係の売上が徐々に上がってくる。
,,○,都市型ホテル（スタッフ）,・牛肉、鳥肉が敬遠されているためか、ホテル内にある魚料理専門レストランが好調で、前年を大きく上回っており、この状況がしばらく続く。
,,○,旅行代理店（営業担当）,・ＳＡＲＳ、テロ、鳥インフルエンザの影響が全くない現状の傾向が続けば、ますます旅行の需要が増大する。
,,○,住宅販売会社（従業員）,"・来場者の様子が良くなってきており、今後、受注量のアップにつながっていく。
・受注単価についても約１％上がっていることからも、来場者の様子が良くなっていることがうかがえる。"
,,□,商店街（代表者）,・客の商品の購入基準がますます高くなるなど、今後も厳しい状況が続くと予測している。
,,□,商店街（代表者）,・来街者が今後も増加しそうではないが、各店舗では売上が少し上がってきており、この傾向が今後も続くものと予測している。
,,□,一般小売店［靴］（経営者）,・季節物を求める客の動きは、少しずつ良くなっているが、消費税総額表示の影響が懸念される。
,,□,一般小売店［茶］（経営者）,・全国的景気回復の影響が地域に見られない上、さらに景気が厳しくなっており、今後もますます不安で不透明な状況である。
,,□,一般小売店［100円商品］（店員）,・消費税総額表示により、客の購買意欲がどう変化するのか、割高感が発生するのか、読み切れない。
,,□,百貨店（販売促進担当）,・ヤングゾーンの動きは堅調であるが、主力のミセス関連商品の動きが悪いので、全体としては、今後も大きな改善はみられない。
,,□,百貨店（購買担当）,・５月の母の日イベントに向けて、動員企画が動いているが、商品を勧めても必要以上のものは購入しないという状況は続く。
,,□,百貨店（売場担当）,・しばらくは現在の流れが続き、町に客は流れてくるが、リニューアルした他店へ流れて行ってしまうと見込まれる。
,,□,百貨店（営業担当）,・大規模店舗のオープンで客がお金を落とす反面、既存の店が売上を落としており、またそのインパクトは大きいが、継続は望めない。
,,□,スーパー（店長）,・消費税総額表示による、見た目の売価上昇が、消費者の購買意欲に影響を与えることも懸念され、また消費が上向く気配は感じられない。
,,□,スーパー（店長）,・消費税総額表示により、今後の客数動向が見えず、１品単価は引き続き低迷すると予測しており、客数減が売上減につながらないかと危惧している。
,,□,スーパー（店舗運営担当）,・今春は、例年みられた就職進学シーズンの買い控えの傾向がほとんどなく、既存店ベースでも順調に推移しており、この傾向が今後も続く。
,,□,スーパー（店員）,・消費税総額表示に慣れたら、客は戻ってくると予測されるが、小数点以下の端数切捨て、切上げ、四捨五入などの処理選択による、客動向や企業負担の結果が予測できない。
,,□,コンビニ（エリア担当）,・取引先の再開など、好材料がある上に、販売活動自身は順調に推移していることから、来月からは少し良くなっていく。
,,□,衣料品専門店（地域ブロック長）,・消費税総額表示により、商品が高く感じ、購買意欲が薄れる可能性もあるが、全体的には変わらない。
,,□,衣料品専門店（地域ブロック長）,・客数があまり増加する見込みはないが、単価がここ３か月上昇傾向であり、今後も上昇していく見込みである。
,,□,乗用車販売店（統括）,・４月は毎年厳しい販売台数で、今までの客の動きを見る限り今後も変わらない｡
,,□,乗用車販売店（統括）,・東京周辺で、商業車のディーゼルエンジン車特需があり、それが近畿圏、中京地区に及んでいるが、これが地方に来るまでは現状維持となる。
,,□,乗用車販売店（販売担当）,"・新車種攻勢による、新型車発表の谷間になることから、販売が厳しい状況が続く。
・消費税総額表示により、販売への影響が不透明であり、今の状況が続く。"
,,□,一般レストラン（店長）,・自店の周りでは好要因が増えているが、チェーン店全体では、２けたダウンの店が３分の１もあり、今後手放しで良くなるとはいえない。牛肉の輸入制限も、鉄板焼の店なので影響が大きい。
,,□,その他飲食［ハンバーガー］（経営者）,・食への不安環境が好転しておらず、回復までしばらく時間がかかりそうだ。
,,□,観光型ホテル（経理総務担当）,・グループのホテルの売却決定や、近隣競合老舗ホテルも経営難から大手ホテルより総支配人を招き経営再建を図るなどの動きがあることから、今後も厳しい状況が続く。
,,□,タクシー運転手,・乗車されたサービス業以外の、マンションや国体関連整備などの客の間に、「忙しくなった」という声はよく聞かれるようになったが、「もうかった」という言葉が、全く聞かれず、この様子ではタクシーなどのサービス業は苦戦していく。
,,□,通信会社（企画担当）,・販売量、同業者の動きなどを見れば、購入が手控えられ消費が抑制されている傾向にはもはや無い。しかし、今後膨らんでいく気配までは無い。
,,□,通信会社（社員）,・新規のサービスなどの提供で既存利用者からの乗り換えはあるが、新規利用者が少なく、今後も状況は変わらない。
,,□,テーマパーク（業務担当）,・利用に対する問い合わせ数など将来を期待させる情報は少なく、現状の利用も活発ではない状況が今後も変わらない。
,,□,その他レジャー施設［温泉センター］（営業企画担当）,・徐々に個人の客の動きが活発になっているが、日帰り温泉部門はまだまだ不安定な営業内容であり、また温泉ホテル部門も予約状況はまだ少なく、楽観に至らない。
,,□,美容室（経営者）,・１年間客単価、客数は変化しておらず、これからも変化するとは見込まれない。
,,□,設計事務所（経営者）,・建築資材の鉄骨関係が高騰しているため、客の購買意欲や販売量が低迷すると考えられ、今後も不況の状況は変わらない。
,,□,住宅販売会社（経理担当）,・新規の発売物件について、発売１か月ごろまでは比較的契約が進むが、それ以降はモデルルームへの来場者も減少し、契約も進まなくなる傾向が続く。
,,▲,一般小売店［書店］（経営者）,・街中にある店舗であり、近年、人の動きが郊外へという動きが加速しており、大型連休中はこの傾向が更に強くなる。
,,▲,百貨店（電算担当）,"・個人消費は、売上で前年比8.3％減、来店数９％減と冷え込んでおり、好調商品も少なく、この傾向が続く。
・消費税総額表示実施により、さらに悪影響を与えるかどうかが懸念される。"
,,▲,百貨店（売場担当）,・夏物商材については、中国などの海外生産が非常に増加し、価格破壊が更に進むと同時に、国内メーカーの不振が一層進んで店頭でのタイムリーな商品供給は難しくなり、客に売れる時期に売れる商品を提供することが困難になってきている。
,,▲,スーパー（総務担当）,・４月より消費税総額表示が実施されるため、割高感が出て購買意欲が落ちるのではないかと懸念している。当社では端数切捨てのため、売上額の減少となる。
,,▲,一般レストラン（経営者）,・来客数は前年と比べて回復してきている、しかし客単価は落ちている傾向にある。
,,▲,旅行代理店（経営者）,・海外旅行が依然として例年並みに戻っていないことと同時に、単価が下がってきているので、売上はやや悪くなる。
,,▲,ゴルフ場（営業担当）,・福岡地区や広島地区は料金単価がある程度回復しているが、山口地区では料金単価を下げないと、来客数が伸びない傾向が続く。
,,×,衣料品専門店（地域ブロック長）,・大型ショッピングセンター出店に伴い、現在、かなり売上が落ちており、今後も引き続いて悪くなる。
,,×,通信会社（通信事業担当）,・消費税総額表示で、表示上税金を添加しにくいサービス項目があり、実質５％の値引きをせざるを得ない。
"企業
動向
関連

(中国)",,◎,＊,＊
