II．景気の先行きに対する判断理由,,,,
,,□,一般機械器具製造業（設計担当）,・上向きの兆しがみえてきた感はあるが、賃金の上昇が僅かである状況は変わらない。
,,□,輸送用機械器具製造業（役員）,・取引先の次年度予算用の見積依頼が減少している。新規の見積依頼が減少し、修理や改善の見積依頼が増えている。
,,□,その他製造業［履物］（団体職員）,・大手企業を中心に、ボーナスの増加や昇給のニュースが聞かれるが、我々の業界にそのような話はなく、実感もない。
,,□,建設業（経営者）,・今後も、現在の好調が続くと予想している。外部要因についても、国の来年度予算や新制度の創設などで、追い風が吹きそうである。
,,□,建設業（経営者）,・年度末の完了工事は、相変わらず監理技術者や技能労務者が不足しており、受注しても工期面で厳しい状況が続いている。
,,□,建設業（営業担当）,・ホテルは高級、大型案件以外は下火になっているが、賃貸オフィス事業や、生産、研究、物流施設への新規の設備投資計画が続いている。一方、人手不足の状況も続いており、受注は増やせないため、このままの状況が続く。
,,□,輸送業（営業担当）,・学習机の準備が始まり、引っ越しシーズンに入るが、少子化や引っ越し時期の分散化で、売上の増加が見込めない。
,,□,輸送業（商品管理担当）,・消費税増税前に販売量が増えたので、年末年始の販売量が例年よりも減っている。
,,□,金融業［投資運用業］（代表）,・先行きは東京オリンピックの効果で、業績の見通しが明るい企業もあるが、一部に限られる。東京オリンピック後の反動が不安である。
,,□,金融業（副支店長）,・取引先との会話では、先行きの受注は前期並みとの回答が多い。
,,□,新聞販売店［広告］（店主）,・折込件数が増えたものの、年末特有の動きもあり、上向いているとはといえない。
,,□,広告代理店（営業担当）,・今期末までに、良い状況となる動きはみられない。
,,□,広告代理店（営業担当）,・紙媒体、Ｗｅｂ媒体共に、前年の売上を少し下回る状態が、今年に入ってから続いている。
,,□,司法書士,・消費税増税の影響は余り感じないが、企業の積極的な動きも感じられない。
,,□,その他サービス［自動車修理］（経営者）,・年明けも、それほど忙しくなさそうである。
,,□,その他サービス業［店舗開発］（従業員）,・年明け以降は、いよいよオリンピックイヤーとなり、ますますインバウンド効果が見込まれる。特に、東京オリンピックの開催期間を避け、春先〜初夏にかけて訪日観光客が増えそうである。
,,□,その他非製造業［商社］（営業担当）,・足元の引き合いへの対応だけで終わるのかどうか、まだ判断しにくい。
,,▲,食料品製造業（経理担当）,・自然災害の復旧の遅れに加え、政治に関する様々な問題も出てきており、先行きの見通しが悪い。
,,▲,繊維工業（総務担当）,・消費者向けの催事に工夫がないため、集客が減少している。今後は商品開発に力を入れていきたい。
,,▲,繊維工業（総務担当）,・通常の靴下の売行きが悪いため、取引先の戦略が、低価格の靴下を特価品として販売する方向に変わってきている。当社の経営方針とは異なる動きであり、特価品では適正利益の確保が難しいため、頭を痛めている。
,,▲,一般機械器具製造業（経営者）,・現在の受注が少ないため、数か月先はかなり景気が悪くなる。
,,▲,電気機械器具製造業（経営者）,・民主主義と共産主義の対立がひどくなっている上に、独裁的な指導者も増えている。個々の企業の努力も、役に立たないのではないかと懸念している。
,,▲,建設業（経営者）,・かねてからの人材不足に、働き方改革の影響が加わっており、受注があっても断らざるを得ない。従業員は働きたくても働けず、給与も下がるため、景気には悪影響である。
,,▲,通信業（管理担当）,・変動要因が見当たらないので、良くなるとは考えにくい。正月の消費でいえば、初売りで動くのは、一部の消費者だけである。
,,▲,広告代理店（企画担当）,・消費税増税により、大きな買物を控える傾向が続いている。
,,▲,経営コンサルタント,・年末商戦やクリスマス商戦が終わると、小売業では販売促進の工夫や人材育成などに注力する必要が出てくる。
,,▲,その他非製造業［機械器具卸］（経営者）,・小口の零細企業が廃業し始めており、今後も廃業の動きが続く見込みであるため、更に悪くなる。
,,×,化学工業（企画担当）,・食品は年末の最需要期であるにもかかわらず、販売量、価格共に伸びていない。過去にない傾向であり、今後は年が明けて需要が低迷するため、現状よりも悪化する。
,,×,不動産業（営業担当）,・消費税増税の影響に加え、銀行融資も厳しくなっている。今までは個人客への融資が厳しかったが、法人にも厳しくなり、不動産の検査済書がなければ融資が下りない事例が増えている。これはバブルの崩壊後と似た現象であり、不動産の価値の低下につながり、景気が悪くなってきている。
,,×,その他非製造業［電気業］（営業担当）,・先行きの経済が見通せない。
"雇用
関連

(近畿)",,◎,−,−
,,○,人材派遣会社（支店長）,・年度末の駆け込み需要に期待している。
,,○,人材派遣会社（営業担当）,・１〜４月の入社を目指す転職希望者の動きが、しばらく活発になる。
,,○,学校［大学］（就職担当）,・消費者の懐具合が少し良くなっていると感じるため、先行きに期待している。
,,□,人材派遣会社（役員）,・求人の減少傾向が続くと予想される。
,,□,新聞社［求人広告］（営業担当）,・求人の増える見込みがない。
,,□,新聞社［求人広告］（担当者）,・2020年への期待はあるが、関西の地元企業からの新聞出稿の推移をみても、さほど大きな動きはない。
,,□,新聞社［求人広告］（管理担当）,・東京オリンピックの開催年を迎えるが、関西方面での求人増につながるような動きはまだない。むしろ、いまだに不安定な米中貿易摩擦の結果次第で、状況は変わる可能性が高い。１月に予定されている合意がすんなりと進まなければ、株価などが下落し、悪影響が出ることも予想される。
,,□,職業安定所（職員）,・景気が悪くなったとの声が増えている一方、失業者数は歴史的な低水準にあり、人手不足感も高止まりしている。景況感と雇用、失業情勢が一致しない状況は今後も続く。
,,□,職業安定所（職員）,・今年度は新規求人も新規求職も横ばいの状況であるため、２〜３か月後も変わらない。
,,□,職業安定所（職員）,・新規求職者数も求人と同様に、月ごとに多少の増減がみられるものの、傾向としての変化は小さい。僅かに減少している程度であり、求人、求職の動きからは、変化の前兆はみられない。
,,□,民間職業紹介機関（職員）,・人手不足の影響で、企業が工事の受注を控える傾向は、今後も続くと予想される。
,,□,民間職業紹介機関（営業担当）,・世の中の景気は若干下向きとの見方もあるが、少子高齢化や働き方改革に伴う人材不足もあり、業界ごとの違いはあるが、新卒学生への需要に大きな変化はないと感じている。
,,□,学校［大学］（就職担当）,・一部の業界や企業は採用活動を縮小しているが、全体的には人手不足が慢性化しているため、当社にも仕事の依頼がある。
,,▲,人材派遣会社（営業担当）,・派遣業界は、同一労働同一賃金への対応で、取引先との価格交渉に動いている。この影響で企業側はコストアップとなるため、派遣活用の見直しが進みそうである。
,,▲,職業安定所（職員）,・窓口や事業所訪問での企業の話では、やや悪くなっているという意見が多い。今後良くなる要因も見当たらない。特に、急激には悪化しないが、徐々に下降していくという意見が多い。
,,▲,民間職業紹介機関（営業担当）,・同一労働同一賃金の問題で、交通費の支給交渉を進めているが、企業はなかなか受け入れてくれず苦戦している。派遣契約の終了が見込まれる企業も多い。
,,×,民間職業紹介機関（マネージャー）,・様々な指標の悪化ともあいまって、景気の悪化を肌で感じる。
,,,,
　９．中国（地域別調査機関：公益財団法人中国地域創造研究センター）,,,,
,,,,（−：回答が存在しない、＊：主だった回答等が存在しない）
分野,,景気の先行き判断,業種・職種,景気の先行きに対する判断理由
"家計
動向
関連

(中国)",,◎,商店街（代表者）,・危機的な状況が続いているが、今後は良くなる。
,,○,商店街（理事）,・新年を迎えたり、季節が変わったりと環境が変化することで、気分的に景気が上向いていく。
,,○,一般小売店［印章］（経営者）,・年末にいつもよりも年賀状の挨拶用の名刺の注文が多くあったことから、景気はやや良くなる。
,,○,スーパー（店長）,・冬のボーナスについて、企業ごとの格差は当然ながらあるとしても、全体として景気が上向いている。直近の購入商品の動向でも、高単価、購入数増加の様相が出ており、年末商戦の結果が大きく左右するものの、客単価の上昇と購入点数の上昇は確実なものになる。
,,○,スーパー（販売担当）,・ここ数か月、来客数は好調に推移しており、消費税の引上げの影響はほとんど見受けられない。今後、冬物処分から春商戦を迎えるに当たり天候不順等、特別な外的要因でもない限り、現状より悪くならない。
,,○,コンビニ（エリア担当）,・年末年始の９連休に期待が持てる。
,,○,家電量販店（販売担当）,・初売りや新生活需要に期待が持てる。
,,○,家電量販店（企画担当）,・消費税の引上げ後、売上は良くないが、２月以降は良くなる。
,,○,乗用車販売店（業務担当）,・１〜３月の大増販期を迎えるため、ある程度の販売量の回復が見込める。
,,○,乗用車販売店（営業担当）,・３か月後は決算期で、来客数が増え、販売台数やサービスの売上も増加する。
,,○,乗用車販売店（営業担当）,・商品ラインアップがいいので、今後は良くなる。
,,○,その他専門店［時計］（経営者）,・消費税の引上げの影響が緩和されていく。
,,○,観光型ホテル（営業担当）,・年末年始に来客数の増加が見込めるが、それ以降は例年どおり落ち込みがある。
,,○,競艇場（企画営業担当）,・２か月後の中旬には、Ｇ１競走が開催されるため、売上が確保できる。
,,○,住宅販売会社（営業担当）,・問合せも多くこれから販売量が増えていく。
,,□,商店街（代表者）,・商店街の各店は引き続き売上の確保が厳しく、景気の良さを感じていない。また、売上の減少並びにキャッシュレスによる販売で、月２回の入金で仕入先等への支払が難しくなる店舗も多く、商店街の脱退依頼が増えてくる。
,,□,一般小売店［食品］（経営者）,・先行きに対する不透明感がなくならない限り、生活防衛が更に強くなっていく。
,,□,一般小売店［洋裁附属品］（経営者）,・人の流れもさほど変わっておらず、今後も売上は増加しない。
,,□,百貨店（経理担当）,・消費税の引上げの影響で前年をやや下回る状況がしばらく続く。
,,□,百貨店（営業担当）,・消費税の引上げ前の駆け込み需要が少なく、消費税の引上げ後も買い控えが強くなってくる。
,,□,百貨店（購買担当）,・来春に大幅な改装を控え、２か月間、２フロアのシャッターが閉まるため、今までどおりの来客数を確保することが難しいが、売り尽くしセールや春物の訴求などで何とか現状を維持する。
,,□,百貨店（外商担当）,・消費税の引上げ後は食品や日用品といった生活必需品は好調を維持しているが、その他、特にぜいたく品や趣味し好の強い高額商品は今後も厳しい状況が続く。
,,□,スーパー（店長）,・来客数が半年以上前年の97〜98％で推移しており、この状況が続いていく。
,,□,スーパー（店長）,・客の購入数量の落ち込みが続き、良くならない。
,,□,スーパー（店長）,・特に良くなる要素がない。
,,□,スーパー（総務担当）,・行事ごとへの出費が控えられているが、今後は日常も必要以外の購買が控えられる。
,,□,スーパー（管理担当）,・上昇傾向を維持したいところだが、依然として節約志向は強く、今後も変わらない。
,,□,スーパー（財務担当）,・年末、年始の晴れの日需要の反動により、正月明け以降は節約で既存店売上の前年割れが続く。
,,□,スーパー（販売担当）,・消費税の引上げ後も景気に変化はなく、今後も変わらない。
,,□,スーパー（販売担当）,・景気が良くなる材料も悪くなる材料も見当たらないため、変わらない。
,,□,スーパー（営業システム担当）,・予約商品の動きが芳しくなく、ケーキは販売金額で前年を僅かに上回るものの、販売数量が減っている。年末年始の予約も前年を下回っており、客の節制が続く。
,,□,コンビニ（副地域ブロック長）,・年末年始の大型連休を控え、客の財布のひもが固くなっている。大きなイベントや新たな商品、サービスが必要である。今後、公共工事などが活性化してくるが、景気が良くなるかは未知数である。
,,□,衣料品専門店（代表）,・景気が良くなる要因がない。
,,□,家電量販店（店長）,・暖冬の影響で冬物の動きも鈍く、ボーナス商戦も終わり、東京オリンピック景気に期待するだけである。
,,□,家電量販店（店長）,・消費税の引上げ前の駆け込み需要の反動もなくなり、今後徐々に安定する。
,,□,家電量販店（店長）,・今後しばらくはパソコンやスマートフォンの落ち込みが予想される。東京オリンピック開催によるテレビ等の映像機器の需要も不透明で、家電業界は景気が良くなる要素が見当たらない。
,,□,乗用車販売店（店長）,・年が明けても客の動きは活発にならない。３月の決算を控え、不安要素しかない。
,,□,乗用車販売店（営業担当）,・新規の客の年末の来場も増加していないので、今の悪い状態が続く。
,,□,自動車備品販売店（経営者）,・何かカンフル剤になるようなことがなければ、今後も今と変わらないか、少しずつ落ちていくだけで、先行きを楽観視できない。
,,□,その他専門店［和菓子］（経営者）,・景気が良くなる要素が見当たらない。
,,□,その他専門店［土産物］（経営者）,・年末の売上がぱっとしないため、この先も見通しは厳しい。
,,□,その他小売［ショッピングセンター］（支配人）,・消費税の引上げ前の駆け込み需要の反動が落ち着き、東京オリンピック関連需要が期待される一方で、プレミアム付商品券が３月で終了、ポイント還元施策も頭打ちとなり、マンネリ化することから、景気は平行線をたどる。
,,□,その他小売［ショッピングセンター］（管理担当）,・消費税の引上げ後、経済的なてこ入れもなく、消費者マインドは低下したままの状態が続いている。一部、株価上昇など好材料のニュースが流れるものの、一般消費者には実感がなく、年末商材の購入もまとめ買いなどの意識が低いことから、今後も景気は変わらない。
,,□,高級レストラン（事業戦略担当）,・良くなるトピックスが出てこない。
,,□,一般レストラン（経営者）,・忘年会シーズンは終わったが、今後も、送別会、歓迎会、合格祝い会などの需要がある。ただ、職場での利用が減少しているため、売上が懸念される。また、アルコールを提供する宴会よりもノンアルコールの食事会が増加する現状があるので、１件当たりの単価が伸びず、前年から売上が変化しない。
,,□,一般レストラン（経営者）,・地方でのボーナスも例年どおり支給され、人手不足と重なり給与上昇の実感が客に出ているが、景気は変わらない。
,,□,一般レストラン（店長）,・大きく伸びることは期待できないが、消費税の引上げの影響も落ち着いてきており、客も戻ってきているので大きな落ち込みも起こらない。
,,□,スナック（経営者）,・何十年も景気の低迷が続いている業界で景気回復の要因が見当たらない。
,,□,都市型ホテル（企画担当）,・前年と比較して、宴会や宿泊の先行受注状況は良くない。受験シーズンや卒業、謝恩会等の需要は前年並みであり、市場環境での特需要素が全くない。個人消費においては、消費税の引上げの余波が継続する。
,,□,都市型ホテル（企画担当）,・浮上する理由がなかなか見当たらない。
,,□,旅行代理店（経営者）,・元気になる企業も少なく、インターネットでの申込みが多く、旅行業の本質が変わりつつある。
,,□,旅行代理店（支店長）,・年度末に向かっていくが、全体的な景況感が決して良くはないので、今と状況は変わらない。
,,□,タクシー運転手,・２月の料金値上げがタクシー業界にどのような影響を及ぼすかよく分からないが、今の良い状態から考えると、今後も急に悪くはならない。
,,□,タクシー運転手,・今後も余り期待できない。
,,□,放送通信サービス（総務経理担当）,・心配していた消費税の引上げの家計への影響もさほど感じられていないが、現状より景気が良くなる気配も感じられない。
,,□,通信会社（企画担当）,・消費税の引上げという暗い話題もあるが、東京オリンピック・パラリンピックが近づき、４Ｋや８Ｋも含めて前向きの感覚が出ている。来年に向け、好転ではないものの、悪くなることはない。
,,□,通信会社（経理担当）,・徐々に良くはなっているように感じるが、２〜３か月ではそれほど変化はない。
,,□,通信会社（工事担当）,・客の様子を見ると、景気は変わらない。
,,□,テーマパーク（営業担当）,・花の少ない時期であり、例年並みの入園者になる。
,,□,テーマパーク（管理担当）,・キャッシュレス消費者還元事業により景気は変わらない。
,,□,観光名所（館長）,・予約状況等から例年と変わらない。
,,□,観光名所（館長）,・景気が良くなる要素が見当たらない。来年開催される東京オリンピックが景気にどのような影響を与えるかを注意深く見ていく必要がある。
,,□,その他レジャー施設［温泉センター］（担当者）,・温浴業界は、冬の時期は利用者が増えるが、食事やリラクゼーションの利用がここ数年減っているので変わらない。
,,□,設計事務所（経営者）,・官の建物の長寿命化工事、民間のリフォーム工事等に動きはあるが、新年度以降の工事見通しが立っていないので、今後の景気上昇も見えていない。
,,□,設計事務所（経営者）,・来場の客の様子からしてもしばらくは伸びが見られない。
,,□,設計事務所（経営者）,・建築業界で景気が上向く要因は見当たらない。
,,□,住宅販売会社（従業員）,・東京オリンピックのある夏頃までは今の状態が続く。
,,▲,百貨店（売場担当）,・コートやブーツなど高単価な季節商材が定価で動かず、ブランドより価格中心の実需商品の動き一辺倒になっており、トレンドとしての動きが店頭で全く見えないことから、今後も厳しい状況が続く。
,,▲,百貨店（売場担当）,・地方の百貨店は消費動向より業態としての厳しさに直面している。商品群として化粧品のような好調部門はあるものの、全体ではマイナスのトレンドが続く。
,,▲,百貨店（外商担当）,・消費税の引上げの影響が大きく、特に婦人衣料の低迷が続いており、今後も回復の見込みが立たない。また、食品、特に生鮮食品の苦戦も続く。
,,▲,百貨店（営業企画担当）,・ここ数か月の状況からみても、今後、買上単価の低下から回復する見込みがない。
,,▲,スーパー（業務開発担当）,・消費税の引上げ前は、客が電子マネーに多めにチャージしていたが、最近のチャージ額は当日の買物に必要な3000円、2000円で、それ以上の買物をしておらず、客単価が低下しており、今後も客単価の低下傾向が続く。
,,▲,コンビニ（支店長）,・時間の経過とともに消費税の引上げの影響が出てくる。
,,▲,衣料品専門店（経営者）,・消費が上向く兆しがない。
,,▲,乗用車販売店（店長）,・車検該当客への販促で購入意欲の低さをはっきりと感じる。年度末だからという理由だけでは厳しい。
,,▲,乗用車販売店（統括）,・消費税の引上げ前の駆け込み需要の反動減が続く。
,,▲,住関連専門店（営業担当）,・景気が上向く好材料が全く出てこない。
,,▲,その他専門店［布地］（経営者）,・ボーナス支給月の12月でも客の買物に対する行動が慎重なので、今後も景気が良くなる材料が出てこない。
,,▲,一般レストラン（経営者）,・ボーナスの支給で一時的に景気は良くなったが、今後は悪くなる。
,,▲,観光型ホテル（支配人）,・これから冬本番となるが、山間部は雪が降ると、ふだんより客足が遠のいてくる。
,,▲,都市型ホテル（総支配人）,・前年はふっこう割による対策により底上げされたが、それに代わる対策が見込まれず、先行予約も低調なため、やや悪くなる。
,,▲,タクシー運転手,・２月に基本料金の値上げが予定されているため、客足が遠のく。
,,▲,通信会社（営業担当）,・節約志向が更に強まる。
,,▲,テーマパーク（業務担当）,・イルミネーションイベントも終わり、雪の多く降る時期となり、来園者が少なくなる。
,,▲,ゴルフ場（営業担当）,・閑散期は、国内は単価は下がりつつあるが、人数は確保できている。韓国からの集客が鍵となるため、悪くなる。
,,▲,美容室（経営者）,・消費税の引上げや働き方改革などで収入が減った人もおり、人によっては消費が冷え込む。
,,▲,美容室（経営者）,・今後も売上の増加の見込みがない。
,,▲,美容室（経営者）,・客が趣味や娯楽には金を使っているようだが、ファッションやおしゃれへの支出は必要最低限に抑えるので、やや悪くなる。
