II．景気の先行きに対する判断理由,,,,
,東京都,○,通信会社（管理担当）,・企業や官公庁の年度末にあたり、受注が多くなる。ただし、その先については、東京オリンピックの影響などで受注が減るものと予測している（東京都）。
,東京都,○,その他レジャー施設［総合］（広報担当）,・東京オリンピックの影響でイベントの開催が早まり、好影響が予想される（東京都）。
,,○,設計事務所（経営者）,・今後、仕事の内容が変わっていく可能性がある。
,,○,住宅販売会社（従業員）,・年が明けてどうなるかわからないが、景気が良くなる方向に行くのではないか。金融機関も３月に向けて数字を伸ばしたいと考えると思うので、仕入れ、販売共に順調に推移していく。
,,□,商店街（代表者）,・商店街の１日の通行客数は平日で大体２万〜２万5000人くらいあるが、やや減っているように感じる。買物袋を持っている客も少ない。商店街としてもいろいろ皆に聞いているが、飲食はまあまあだが、物販はやや思わしくないようだという意見が多いので、今後も余り変わらない。
,,□,一般小売店［和菓子］（経営者）,・近隣の競合店が２店舗退店したため、売上が伸びている状況がずっと続いている。
,,□,一般小売店［家電］（経理担当）,・業界的に余り期待できるような話がないが、テレビの入荷状況は落ち着いてくる。４Ｋ、東京オリンピックもあるので期待したい。
,,□,一般小売店［印章］（経営者）,・世間は低迷している感じを受ける。当店だけではなく、非常に厳しい経済環境となっている。
,,□,一般小売店［祭用品］（経営者）,・撤退する店舗も多く、先行きが不安である。
,東京都,□,一般小売店［米穀］（経営者）,・３か月後になると、年が変わり、東京オリンピックのムードも出てくると思うが、経済的なマイナス面とプラス面の両方が考えられるので、さほど変わらず、雰囲気だけが良くなる（東京都）。
,東京都,□,一般小売店［文房具］（経営者）,・ここ１〜２年の傾向から、年明けすぐに学童文具がよく動くとみているが、繁忙期と比較するとそれほど販売量は変わらない。ただし、毎年１月に行われている地域のイベント開催による街への集客力が年々上がってきているので、それに伴い当店の来客数も伸びる（東京都）。
,東京都,□,一般小売店［茶］（営業担当）,・これといった良い話がない。ただひたすら辛抱である。会社が潰れないのがせめてもの救いである（東京都）。
,東京都,□,百貨店（売場主任）,・12月のおせち料理も前年プラス３％ということで、非常に好調である。店頭の食料品については、11〜12月と何とか前年をクリアできる見込みである。年が明けて潮目がどうなるかはまだ不確かな部分があるので、注視していきたい。今度はバレンタインが大きな商戦になるので、そこに向かってやっていく（東京都）。
,東京都,□,百貨店（売場主任）,・消費税増税による消費減の影響はなお続く。１〜２月は天候不順の影響を受けやすいため、来店促進の仕掛けやＥＣ強化をしているが、不透明な部分もある（東京都）。
,東京都,□,百貨店（営業担当）,・年末のご褒美需要も厳しく、消費税増税以降の回復の見込みはない。都心店の免税実績も、来客数の減少により伸び率が低下し、前年の水準にとどまっており、厳しい冬物商戦が続くとみている（東京都）。
,東京都,□,百貨店（営業担当）,・クリスマスや年末商戦を経ても、消費税増税後の前年同水準までの回復には至っていない。前回の５％から８％への増税時は、前年実績までの回復に６か月掛かったが、同程度の期間が必要になる公算が大きい。初商の福袋と新春クリアランスのスタートダッシュがポイントとなる（東京都）。
,東京都,□,百貨店（営業担当）,・防寒用品、年末年始といった生活に欠かせない商材の購買はあるものの、それ以外に関しては財布のひもが固く、回復までは時間が掛かると想定している（東京都）。
,東京都,□,百貨店（販売促進担当）,・消費税増税前の駆け込み需要の反動減からは回復基調にあるものの、影響はまだ残っており、中間層の消費マインドの落ち込みは今後も継続する（東京都）。
,東京都,□,百貨店（販売促進担当）,・食品の動きは良いが、衣料品は不振である。年明けからのセールには一時的に期待できるが、２〜３月の消費契機がまだ見いだせない（東京都）。
,,□,百貨店（販売促進担当）,・衣料品等は１月のセール売上を見る必要があるが、現状を見ると良くなるとは感じられない。消費税増税の影響がない食品も、おせちの受注は好調に推移したものの、日々の買物に関しては、客は価格にシビアになっている。こうした状況から景気は変わらない。
,東京都,□,百貨店（販売促進担当）,・国内富裕層を中心に、消費税増税の影響から回復の兆しを見せているものの、国際情勢の不安定さによりインバウンド消費の伸びは期待できず、依然として楽観できない状況が続く（東京都）。
,東京都,□,百貨店（販売促進担当）,・消費税増税後の秋冬商戦の厳しさが継続している。春夏商戦に切り替わり、東京オリンピックを含む機運の高まりが見えるまでは、上向くことは難しい（東京都）。
,東京都,□,スーパー（販売担当）,・客の様子を見ていると、ポイントが何倍であるとか、広告初日の安売り商品、時間帯でのお買い得品など、お得な店や時間帯などをうまく利用して買い回り、お得な物を買うという買い方が目立っている（東京都）。
,,□,スーパー（店長）,・３か月後の景気の見通しは良いと答えたいが、大きな外的要因もないので、今と変わらないままいくのではないかと予測している。
,東京都,□,スーパー（店長）,・年末年始は出費がかさむ時期なので、一時的に良い方向に向かうかもしれないが、消費者には節約志向が依然として根付いているので、もうしばらくは同様の状態が続く（東京都）。
,,□,スーパー（総務担当）,・現状から大きく上向く要素はほとんど考えられない。大きな流行があるとか、可処分所得が増えたという実感が客にあればいいが、なかなか実感がない状態が続くと思われるので、３か月先についても、大きく数字を伸ばすことは厳しい。
,,□,スーパー（総務担当）,・消費税増税により外食の回数、質は下がっていく。その分、中食が拡大しそうなので、身の回りは変わらない。
,東京都,□,スーパー（営業担当）,・食品が中心のため、消費税増税による影響は限定的と思われるが、世界的な貿易摩擦の影響が景気停滞の大きな要因にもなっていると感じる（東京都）。
,,□,コンビニ（経営者）,・両サイドに同じコンビニエンスストアがオープンしてから１年たつが、その影響で単価、来客数共に前年を割っている。
,東京都,□,コンビニ（経営者）,・ここしばらくの来客数の動きをみると、変わらない（東京都）。
,,□,コンビニ（経営者）,・歳末商戦は低調で、正月も望み薄である。２〜３か月先も恐らく変わらない。
,,□,コンビニ（経営者）,・一見、東京オリンピックで建築などの景気が良くなりそうな気がするが、トータルではやはり景気は良くない気がする。
,東京都,□,コンビニ（エリア担当）,・前回の消費税増税時も２〜３か月は影響が続いた。今回は前回ほどのインパクトはないと感じるものの、少なからず影響はある（東京都）。
,東京都,□,コンビニ（商品開発担当）,・12月は前年のプレミアムフライデーやキャッシュレス決済キャンペーンに比べて目新しい販促がなく、正直なところ変わらない（東京都）。
,東京都,□,衣料品専門店（店長）,・大企業を中心に過去最高の冬季ボーナスと言われているが、実質的に国民全体に与える影響は少ない。残念ながら支出の大部分が生活防衛に回されている（東京都）。
,,□,衣料品専門店（役員）,・消費税増税の影響はそれほど感じないが、景気の低迷感がまだまだある。
,東京都,□,家電量販店（店長）,・東京オリンピック特需までは、家電の市況が良くなる経済的現象がない（東京都）。
,,□,家電量販店（店長）,・景気が良くなるきっかけがない。東京オリンピックは景気には影響がなさそうである。
,,□,乗用車販売店（経営者）,・自動車の整備は順調に入っている。販売は余り芳しくないが、１月以降は少しずつ良くなるのではないかと希望を持っている。
,,□,乗用車販売店（経営者）,・余り大きな変動もなく、前年並みである。
,東京都,□,乗用車販売店（販売担当）,・ここ数か月間ずっと同じような内容だが、やはり東京オリンピック景気で良い状態がまだ続いている。全国的に人手不足で、働き手が少ないなか、条件を上げて採用していこうという企業が増えているので、建設、製造分野についてはやや良い状態が続いていくのではないか（東京都）。
,,□,乗用車販売店（渉外担当）,・販売増につながる環境変化がない。
,,□,その他専門店［ドラッグストア］（経営者）,・１〜２月になるとインフルエンザや風邪がそんなにまん延するとは思えないので、前年と変わらないのではないか。
,東京都,□,その他専門店［ガソリンスタンド］（団体役員）,・需要減少の流れは変わらない（東京都）。
,東京都,□,その他小売［ショッピングセンター］（統括）,・消費を刺激するものがないと厳しいのではないか。将来不安と消費税増税の影響があるし、キャッシュレス決済の５％還元はタイムラグがあり、実感が得られにくい。節約志向の客には好評である（東京都）。
,東京都,□,その他小売［ゲーム］（開発戦略担当）,・海外でスタートしたサブスクリプションサービスも、スロースタートとなっており、市場的に大きなトピックとはならないと見込んでいる（東京都）。
,東京都,□,高級レストラン（営業担当）,・法人関連中心の宴会受注状況は、前年同日比100％で推移している（東京都）。
,東京都,□,高級レストラン（仕入担当）,・先々の法人予約状況をみても、ほぼ前年並みで、大きな変化はない（東京都）。
,,□,一般レストラン（経営者）,・３か月前と比べて非常に悪くなっている。３か月先も上向いているとは思えない。高齢化社会なので、年金や消費税の問題で、財布のひもが本当に固くなっている。
,東京都,□,一般レストラン（経営者）,・働き方改革で消費者の働く時間が減少し、休日が増えたが、収入も減少しており、財布のひもは固いままである。人手不足による人件費の高騰も相変わらずで、仕入原価の高止まり等、厳しい状況は続く（東京都）。
,東京都,□,一般レストラン（統括）,・今後は消費税増税による大きな影響はないと感じているものの、予断を許さない不安定な状況は続くと思われる。国際経済環境のちょっとした変化や天候の影響により、すぐに下振れするリスクはある（東京都）。
,,□,都市型ホテル（スタッフ）,・１月は例年どおりの予約状況で推移しているが、２〜３月は伸び悩んでおり、このままでは前年を下回る予想である。年末は何かと物入りなので感じないが、年明けより徐々に消費税増税の影響が出始めるのではないか。
,,□,旅行代理店（経営者）,・消費税が上がったが、給料は上がらないということで、客はとても外に出てリフレッシュするような気持ちにならないというのが現状のようである。
,,□,旅行代理店（従業員）,・例年に比べて特段の変化はない。
,東京都,□,旅行代理店（販売促進担当）,・２〜３か月後はいよいよ2020年東京オリンピックということで、その分野に関しては良いと聞いているが、他の教育及び一般団体旅行が伸び悩んでいるようなので、相殺して変わらない。個人も思わしくないと聞いている（東京都）。
,,□,タクシー運転手,・10月から消費税が上がり、いよいよ本格的に世の中が動き出したが、まだ慎重なところがある。来年の東京オリンピックが近づく春頃からは動きが出てくると期待を込めて、様子を見ている。
,,□,タクシー運転手,・タクシーの利用客が減っているとしか思えないくらい、売上、回数、無線本数が減っている。確かな利用者は病院送迎の高齢者と、降雨後になぜか多くなる利用者である。来年は令和２年、東京オリンピックイヤーを迎える。明るいニュースとともに景気が良くなるよう願いたいものである。
,東京都,□,通信会社（経営者）,・現在の経済の状況によほどの変化がなければ変わらないのではないか（東京都）。
,東京都,□,通信会社（社員）,・今年度の計画達成、例年どおりの見込みが見えてきている（東京都）。
,,□,通信会社（営業担当）,・景気や国際情勢が不透明な状態が継続しているため、大きく好転していくことはない。
,東京都,□,通信会社（局長）,・新サービスを投入しているにもかかわらず、契約数が伸長しないことと、前年の繁忙期より入退去情報数がやや減少していることから、現状のトレンドは変わらない（東京都）。
,,□,通信会社（営業担当）,・景気が上向くと思える材料がない。
,東京都,□,通信会社（営業担当）,・ここ数か月、客の動きや販売量に全く変化がないので、この先も当面景気は変わらない（東京都）。
,,□,通信会社（経理担当）,・世間一般の家計が良くなる要素が見当たらないため、テレビ、インターネット接続サービスに、より多くのお金を掛けることはない。
,東京都,□,通信会社（総務担当）,・自然災害、米中貿易摩擦や消費税増税等の影響が続く現状から、内外需に対する景気回復の材料が想定しにくい（東京都）。
,,□,パチンコ店（経営者）,・引き続き現在の低迷状態が続くと思うが、年が明け、近づく東京オリンピックに向けて、良い部分と悪い部分の綱引き状態が続くのではないか。
,,□,その他サービス［立体駐車場］（経営者）,・月極駐車場代や時間駐車を節約する客が出てきている。間違いなく消費税の影響である。
,,□,その他サービス［保険代理店］（経営者）,・自分の身の回りの景気が良くなる要因が見つからない。
,,□,設計事務所（経営者）,・仕事量に変化はなく、年度末に向けて景況感が変わる要素は見当たらない。新規の設備投資も、新年度にならないと期待できない。
,東京都,□,設計事務所（所長）,・良くなる要素が見当たらない。工事費の問題もあり、今の状態がこのまま続くのではないか（東京都）。
,東京都,□,設計事務所（職員）,・建築業界は良い意味で堅調だが、景気を左右するような変化はない（東京都）。
,,□,住宅販売会社（従業員）,・例年12月は来場者数が少ないが、これから１〜３月は受注数が安定してくる。
,,□,その他住宅［住宅管理・リフォーム］（経営者）,・年末は一般的に来年の仕事の話があるが、今のところ相談等がほとんどない。細かい小さな仕事はあるが、非常に心配である。
,東京都,▲,一般小売店［家具］（経営者）,・これから先も景気が良くなる要素が見当たらないので、このまま悪くなっていく（東京都）。
,東京都,▲,一般小売店［家電］（経営者）,・消費税増税の実感が出てくると、徐々に消費が減る（東京都）。
,,▲,百貨店（総務担当）,・春に近隣商業施設が改装オープン予定であることから、客の流れが変わることが考えられる。
,東京都,▲,百貨店（店長）,・全国的に消費税増税後の回復が遅く、マイナス５〜10％辺りで推移している。来年は東京オリンピック、パラリンピックのムードが高まるが、消費としてはモノからコト、季節マーケットのダウンサイジング化など、あらゆる部分で苦戦が懸念される。特に、東京オリンピック、パラリンピックは不安材料である（東京都）。
,東京都,▲,百貨店（計画管理担当）,・一部店舗の区画工事により、営業面積が減ることから、年明け以降、苦戦を強いられることが予見されている。消費税増税後の傾向として、食品関係は堅調に推移するものの、衣料関係はまだばらつきがあり、全体でみると低調となるのではないか（東京都）。
,,▲,スーパー（経営者）,・キャッシュレス決済の５％還元があるのにもかかわらず、販売量が増えない。
,,▲,スーパー（販売促進担当）,・免許返納又はガソリン価格の値上がりの影響か、高齢の来客数減少が拡大している。影響は子供衣料、玩具に大きく出ている。
,,▲,スーパー（仕入担当）,・消費税増税の不況感により、無駄な物は購入しないという消費者心理が働き、冷え込んでくると予想している。
,,▲,コンビニ（経営者）,・客単価が下がっている。まとめ買いの客が減少しているようである。
,,▲,衣料品専門店（経営者）,・天候次第だが、東京オリンピックムードに流されて、売上増は期待できない。
,,▲,衣料品専門店（経営者）,・年末という雰囲気が問屋街、商店街、街の様子をみても感じられない。正月以降もそういう雰囲気が出るかどうか分からない。また、キャッシュレス決済サービスの数が多いが、方式を統一した方が客も店側も助かるのではないか。
,東京都,▲,住関連専門店（営業担当）,・消費税率引上げ前後に需要の先食いがあったため、引き合い、売上共に徐々に減少傾向にある。次世代住宅ポイントという需要喚起策も、現状では浸透度が低く、売上のカンフル剤にはなり得ていない（東京都）。
,,▲,住関連専門店（統括）,・消費税が上がったことはそれほど影響はないが、買い控えがまだまだ続くのではないか。
,東京都,▲,その他専門店［貴金属］（統括）,・消費税率の引上げ後、駆け込み需要の反動減から回復してこない。商品の購入は一段落している様相である。消費税率の引上げによる影響が一回りするまでは、よほどのことがない限り景気が上向きになるとは思えない（東京都）。
,,▲,その他小売［ショッピングセンター］（統括）,・正月商戦を見る限り、力強さに欠ける。
,,▲,一般レストラン（経営者）,・今後２〜３か月先は今より悪くなる。３月は少し良くなると思うが、２月は年間で一番悪い月であり、人の動きもないので、売上は今より３〜４割は落ちる。
,東京都,▲,一般レストラン（経営者）,・和食の料理人が非常に人手不足で、当社でも２人欠員が出てしまい、現在はグループ内で人をやり取りして、月に２〜３回の定休日を設けて回している。この状況では、やはり売上を稼ぐにも厳しくなってくる（東京都）。
,,▲,一般レストラン（経営者）,・外食産業は消費税増税によって明らかに痛手を受けており、今後は減っていく。
,東京都,▲,その他飲食［居酒屋］（経営者）,・前向きな要素が見当たらないため、年明けはより景気が冷え込むと予測している（東京都）。
,,▲,都市型ホテル（スタッフ）,・消費税が上がり、しばらくは買い控え等で財布のひもが固くなる。
,東京都,▲,旅行代理店（従業員）,・東京オリンピック以降の先行きに不安がある（東京都）。
,東京都,▲,タクシー運転手,・客の様子から判断すると、景気が良くなっているという客の方が少ないようである（東京都）。
,,▲,タクシー（団体役員）,・例年に比べ、11〜12月は明らかに景気が悪化していると感じる。10月の消費税増税の影響が出ているのか、その他の要因によるものなのかは判断できない。
,,▲,通信会社（管理担当）,・消費税増税以降、落ち込みが加速している。
,,▲,ゴルフ場（経理担当）,・近年の異常気象もあり楽観視できない。大雪となると長期間のクローズを余儀なくされ、消費税増税による影響と重なり、経営に暗い影を落とすことになる。固定費回収のために単価を下げて稼働率を上げざるを得なくなり、デフレ傾向となり得る。
,,▲,競輪場（職員）,・工事関係者は売上が良さそうだが、遊びに来る客の大半が口をそろえて売上が悪いと話している。東京オリンピック景気があってもよい業界なので期待はしているが、春頃までは厳しいように感じる。
,,▲,その他サービス［学習塾］（経営者）,・生徒数が減少し、各塾の冬期講習の値下げも続いているので、単価がどんどん下がっている。人件費とは逆の反応が出ている。
,,▲,その他サービス［学習塾］（経営者）,・前年比で客単価が減少傾向にある。
,,▲,設計事務所（経営者）,・住宅や各企業の建物の設計については、東京オリンピックの影響があり、全てが遅れている。いろんな物価においても消費税の問題があり、遅れている。
,,▲,設計事務所（所長）,・都内に仕事が集中していて、地方にはなかなか良い影響が出ていない。
,,▲,住宅販売会社（経営者）,・以前のように、経済波及効果の大きい住宅が本格的に売れることを期待している。しかし、米中貿易摩擦や英国のＥＵ離脱問題、韓国との関係悪化など、海外経済の減速による下振れリスクがある。
,,▲,住宅販売会社（従業員）,・アパート建設の受注は微減が続いており、完工高も微減となる公算が大きい。
,東京都,▲,その他住宅［住宅資材］（営業）,・目立った物件情報がなく、年度末に向けて建築需要が回復することは予想し難い（東京都）。
,,×,一般小売店［家電］（経理担当）,・消費税増税以降、買い渋っている客が多い。一部の解体業、建設業関係の客は景気が良くボーナスも出ているようだが、他の業種ではボーナスも出ていないところが前年より多い。
,,×,一般小売店［食料雑貨］（経営者）,・店舗が過剰になっている。
,,×,コンビニ（経営者）,・人手不足が続き、ますます時給も上がり、厳しい状況となる。営業時間の短縮に向け、本部と話合いをしているが、先の見通しが立たない。
,,×,衣料品専門店（店長）,・消費税増税後、売上が前年比で10％落ち込み、影響が顕著に出ている。
