Ⅱ．景気の先行きに対する判断理由,,,,
,,×,一般レストラン（経営者）,・一般庶民、特に給与所得者は実質賃金が上がっていない。消費税増税に関しては、消費の冷え込みは確実である。
,,×,その他飲食［仕出し］（経営者）,・消費税増税による影響は、様々な施策によってぼやけている傾向があり、２～３か月後くらいから現れると見込む。世界のリスク要因が１つでも現実化したときに、連鎖する可能性がある。
,,×,観光型ホテル（支配人）,・10月の一般宴会は、祝賀会を数件受注することができて前年を超える見込みだが、２か月後は、一般宴会で恒常的にあった大型宴会の不開催が確定し、他部門では穴埋めできるものではないため大打撃を受けることとなる。
,,×,通信会社（営業担当）,・電気通信事業法の改正により、販売数量が減少する懸念がある。
,,×,理美容室（経営者）,・消費税引上げにより、段々と景気が冷え込んでいく。
,,×,理容室（経営者）,・消費税引上げにより、財布のひもが固くなる。
,,×,設計事務所（経営者）,・全く良い情報がない。
"企業
動向
関連

(東海)",,◎,－,－
,,○,化学工業（営業担当）,・ナフサ価格が下がり、プラスチック原料の価格も下がる。
,,○,窯業・土石製品製造業（社員）,・同業他社との話の中では、現状は景気が良くないが底を打った感がある、との声が多い。
,,○,電気機械器具製造業（経営者）,・年末にかけて業界で設備投資が期待できるのではないかということと、当社の新商品が出るため景気はやや良くなる。
,,○,通信業（総務担当）,・ラグビーワールドカップ、東京オリンピックというワールドワイドなイベントに酔うことで、景気につながる皆の心を明るくしてくれることに尽きる。
,,○,その他非製造業［ソフト開発］（経営者）,・中国経済は大幅なスローダウンに入っている。銅、鉄等の基本資材が大きく下がっているため、すぐに上昇に向かうとは考えにくい。一度底に入ってから、先行きの上昇が見込まれる。当社としては、新製品の更なる充実を図る。
,,□,パルプ・紙・紙加工品製造業（顧問）,・冬場は１年のうちで一番受注量、販売量が多い季節だが、消費税引上げ、米中貿易摩擦、日韓関係悪化等により、景気は余り変わらない。
,,□,化学工業（総務秘書）,・特段悪くなる理由がない。消費税の影響がどのように現れるかは注視する必要がある。
,,□,金属製品製造業（経営者）,・引き合いも低調で、引き続き良くない状況が続くと考える。
,,□,金属製品製造業（従業員）,・まだしばらくは忙しい状況が続く。
,,□,一般機械器具製造業（営業担当）,・北米での自動車部品製造設備の入替え需要が高まっているが、まだ、新規設備発注をするという情報が入ってきていない。
,,□,一般機械器具製造業（経営管理担当）,・受注量、販売量が現状維持の見込みである。
,,□,電気機械器具製造業（経営者）,・９～10月の秋口になればと希望をもっていたが、年内あるいは年度末まで現状を維持できるかという話に変わってきている。
,,□,電気機械器具製造業（総務担当）,・米中経済関係の影響を考えると、高速通信関連で海外からの技術を応用して製品やシステムを販売する業態にとっては不安感が大きくなるばかりであるが、現時点では、輸入量の減少や技術力提供にさしたる変化もないので、この先の業績に大きく影響することは考えにくい。
,,□,輸送用機械器具製造業（総務経理担当）,・思っていたほど円高には向かわず107～108円で安定しており、今のまま業績は推移する。
,,□,建設業（経営者）,・景気が良くなる理由、材料が見当たらない。
,,□,輸送業（エリア担当）,・日米の関税問題、英国のＥＵ離脱で先行き不透明なので、良い条件がない。
,,□,輸送業（エリア担当）,・大量に新規採用した社員が一時的には戦力になってないため、目先の収支は悪化している。しかし、次第にコストコントロールが進み、改善される。
,,□,金融業（従業員）,・建築業に関しては、今までと同様に比較的景気が良い状態が続くが、自動車産業は横ばいのため、数か月先はどちらともいえない。
,,□,金融業（企画担当）,・株価や為替に大きな変化があれば、個人投資家も動くが、当面は様子見が続きそうである。個人投資家以外の個人も、消費税引上げ後は早期には消費に向かいづらく、当面現状の景気が続くとみられる。
,,□,不動産業（経営者）,・今後も、例年同様に晴天の日が多くなるとの予報もあり、当面の景気は今月同様に良い状態が継続し、売上は前年同期100％以上で推移するとみている。
,,□,不動産業（経営者）,・受注量や価格を変動させる要因は見当たらない。
,,□,広告代理店（制作担当）,・今秋予定のイベント等も、消費税引上げによる影響はなさそうだが、売上の期待は見込めそうにない。
,,□,行政書士,・消費税の引上げにより１～２か月は暇になるという業者がある。
,,□,公認会計士,・中堅中小企業を取り巻く環境は、短期的には変わらない。
,,▲,食料品製造業（経営企画担当）,・消費税引上げ後の買い控え、消費マインドには冷え込みが予測される。
,,▲,食料品製造業（営業担当）,・受注量が前年実績よりも減少傾向にある。
,,▲,電気機械器具製造業（営業担当）,・消費税増税の影響で落ち込む。
,,▲,輸送用機械器具製造業（品質管理担当）,・消費税増税前の駆け込み需要の反動減で、景況は悪くなる。
,,▲,輸送用機械器具製造業（管理担当）,・消費税増税の影響で、景気低迷が続く。
,,▲,建設業（役員）,・当エリアの中心企業である大手自動車メーカー系企業で先行き不透明感が出ていて、住宅購入の自粛や不透明感がある。消費税引上げで一部贈与による購入客の動きはあるが、一般の客の動きは鈍い。
,,▲,輸送業（経営者）,・中国を中心に輸出入の減少に歯止めが掛からない。前年比で２割減に近づいている。
,,▲,輸送業（エリア担当）,・９月が多少上向きなのは荷主の上半期決算によるものが多かったからだろう。10月からは、また６月頃の状態になるのではないか。
,,▲,輸送業（役員）,・石油価格の上昇予想など、物流業界も不安要素が多く、景気が良くなる材料が見当たらない。
,,▲,輸送業（エリア担当）,・日米、日韓、日中の貿易摩擦、不協和音が払拭しきれておらず、この先どうなるのかという不安感がある。先行きの見通しが立たないところで、経済もそれを反映している。この状況が続くと、ますます景気が落ち込んでいく。
,,▲,通信業（法人営業担当）,・消費税増税で、企業だけでなく個人消費も落ちる。
,,▲,通信業（法人営業担当）,・現状の要因のほか、米中の対立による世界経済成長の鈍化、英国のＥＵ離脱による我が国の経済への悪影響、サウジアラビアの原油施設攻撃による原油高、ロシアや中国等による世界戦略構想の悪弊等、成長路線が見渡せず後退面ばかりが目立つ状況である。
,,▲,新聞販売店［広告］（店主）,・消費税引上げに伴い折込チラシの支払金額と印刷金額が上がるため、大手のチラシではなく小ロットの個人商店などのチラシが減ると見込まれる。
,,▲,会計事務所（職員）,・消費税率が５％から８％へ引き上げられた際の経済減退が、再び起こりそうである。政府の弱者対策も規模的には軟弱で効果は薄い。
,,▲,会計事務所（職員）,・最低賃金の改定で、扶養範囲内で収めようとしているパート主婦は、勤務時間を減らすようになる。求人を出してもなかなか応募はなく、ぎりぎりの人数で仕事を回している小さい会社は、仕事を断らざるを得ない。景気は縮小する。
,,×,鉄鋼業（経営者）,・東京オリンピックなどの大型物件が収束しており、世界情勢が不安定な中で先行きの設備なども話が出ていない。
,,×,輸送用機械器具製造業（経営者）,・東京オリンピック後まではこのまま下落すると見込まれる。その後の自動運転や５Ｇの盛り上がりに期待したい。種はあるけど、種がまだ発芽してない様子である。
"雇用
関連

(東海)",,◎,－,－
,,○,人材派遣会社（社員）,・忘年会等の予約状況は好調で、やや良くなる。
,,○,人材派遣会社（営業担当）,・多くの企業で上半期が終わり、次は来期に向けての採用計画を進める時期となる。人手不足が続くなかで、採用枠・予算を増やし派遣や中途採用の動きが出てくると見込んでいる。
,,○,アウトソーシング企業（エリア担当）,・求人募集再開の動きがみられ、下期の生産目標に向けた体制への上向きな動きがある。
,,□,人材派遣会社（経営企画）,・動向が読めない。
,,□,職業安定所（所長）,・管内事業所からは、米中貿易摩擦等による製造業への影響を懸念する声を聞くことはあるが、雇用への直接的な影響については聞かれない。
,,□,職業安定所（次長）,・日中貿易摩擦や日韓関係悪化の影響による受注減を懸念する中小企業の声を聞くものの、労働市場には大きな動きは見受けられない。
,,□,職業安定所（次長）,・求人求職の状況からは、業種により差はあるものの、全体的にはおおむね横ばいで推移しているものと見受けられる。
,,□,民間職業紹介機関（支社長）,・求人においては、大手企業と中小企業の採用数には大きな開きがあり、大手企業の採用数の減少を中小企業でカバーするのは難しい。
,,□,学校［専門学校］（就職担当）,・特に行政職員の採用で、2020年卒業者を対象とした医療職の二次、三次募集の案内がいまだに届いている。
,,▲,人材派遣業（営業担当）,・人材不足感は変わらず継続するものの、先行き不安から買い控えなどが起こり、やや後退すると見込まれる。
,,▲,人材派遣会社（社員）,・消費税引上げと同一労働同一賃金の施行により、派遣活用を各社が控える傾向がある。
,,▲,人材派遣会社（営業担当）,・予算削減は避けられなくなっており、３か月後には影響が出始めていると考える。エンジニアの稼働率が低下し、身の回りの景気は現状よりもやや悪くなっている。
,,▲,人材派遣会社（企画統括）,・消費税引上げ後の不透明感が色濃く、不安材料となっている。
,,▲,人材派遣会社（営業担当）,・工作機械の受注額が減っている。
,,▲,人材派遣会社（営業担当）,・大手企業ほど、同一労働同一賃金に向けたコスト上昇対策として、人員の抑制を検討している。
,,▲,新聞社［求人広告］（営業担当）,・東京オリンピックの需要が落ち着き、先行き不安の企業が増えている。
,,▲,職業安定所（職員）,・現状のままであれば、製造業を中心に中小零細事業所の事業縮小、倒産が引き続き起こる可能性がある。
,,▲,職業安定所（職員）,・新規求人に弱い動きが続いており、雇用調整助成金の相談をする事業所も出てきている。
,,▲,職業安定所（次長）,・米中貿易摩擦、消費税引上げ、原油高、日韓関係等、経済を取り巻く状況は不安定要素が多いことから、求人の伸びが期待できず、景気の後退が懸念される。
,,▲,民間職業紹介機関（窓口担当）,・現時点での求職者・求人数の推移は前月より右肩上がりであるが、ここがピークとなり、年末に向けて少し下降していくことが予想される。相変わらず正社員・直接雇用希望の求職者が多く、案件とのマッチングは変わらず厳しい状況である。
,,▲,民間職業紹介機関（営業担当）,・工作機械・装置・ＦＡ産業などの景況感をみると、設備投資の抑制が強まるなか、採用に投資をする企業は下降局面を今後迎えることも想定される。
,,×,新聞社［求人広告］（営業担当）,・企業が採用に掛ける費用は高騰しているにもかかわらず、新聞社にはそれに対応する能力がない。
,,,,
　７．北陸（地域別調査機関：一般財団法人北陸経済研究所）,,,,
,,,,（－：回答が存在しない、＊：主だった回答等が存在しない）
分野,,景気の先行き判断,業種・職種,景気の先行きに対する判断理由
"家計
動向
関連

(北陸)",,◎,－,－
,,○,商店街（代表者）,・９月に入り、高額商材も少しずつ動き始めている。とはいえ消費税の引上げ前の駆け込み需要かどうか判断できない。外国人観光客も国慶節で増え始めているので、期待している。
,,○,衣料品専門店（店舗運営）,・消費税の引上げ後は出費を抑える反動で、クリスマスや年末年始に向けて購買意欲が高まると考える。
,,○,観光型旅館（スタッフ）,・月間仕入数は前年並みを確保し、予約状況も少しずつ上向きである。予約保有率は前年比で８月は89％、９月以降３か月は91～97％で推移している。
,,□,一般小売店［精肉］（店長）,・９月は例年並みの推移で動いた。10月からの消費税の引上げで、食品は軽減税率なので税率は変わらない。他のものが高くなるところで、さほど影響はないのではないかと考える。
,,□,百貨店（売場主任）,・2014年４月の消費税の引上げ時並みの駆け込み需要には程遠かった。軽減税率などの施策があり、前回より冷静な人が多く消費意欲が上がらなかったことが要因と考える。したがって、楽観視はできないが、駆け込み需要が小規模であれば消費税の引上げ後の落ち込みも小さいのではないかと考える。
,,□,スーパー（総務担当）,・消費税の引上げが10％となるビールや雑貨など、駆け込み需要があった商品群は10月初旬は落ち込むとみている。しかし、他は特に変化はないと考える。
,,□,コンビニ（経営者）,・季節商材の売上が変わらない。
,,□,コンビニ（エリア担当）,・10月以降の消費税の引上げの影響が不透明である。食品については問題ないが、雑貨等の軽減税率対象外商品には影響があると考える。
,,□,衣料品専門店（経営者）,・10月の消費税の引上げがあり、消費者は慎重に買物をしているようである。
,,□,住関連専門店（役員）,・消費税の引上げ後は、消費マインドの低下が広がると考えるが、ポイント還元などの政策を含め、仕掛け方によっては余り大きな落ち込みはないと考える。
,,□,その他専門店［酒］（経営者）,・あくまでも希望的なものだが、現在が最低と考えており、変わらないと答えた。とにかく来月から不安が一杯である。
,,□,スナック（経営者）,・国内外の状況から、この悪い状態が継続していく気配である。
,,□,観光型旅館（経営者）,・地元企業の大型団体の忘年会が業績悪化のため中止になったり、10月以降の集客にも苦戦している。また、カニのシーズンを迎えてカニの仕入価格の上昇が見込まれる。
,,□,旅行代理店（所長）,・東京オリンピック観戦ツアーの発売が始まったが、抽選予約のため好景気は感じられない。また、消費税の引上げによる影響が出る可能性もあり、先行き不透明である。
,,□,タクシー運転手,・これから一段と節約傾向が強まり、利用客が減る傾向だと考える。
,,□,通信会社（職員）,・イベントの集客数が伸びてこない。
,,□,通信会社（営業担当）,・新商品が発売され来客数は増加しているが、完全予約商品のため販売に至っていない。しばらくこの状況が続きそうである。
,,□,通信会社（役員）,・現在、底辺近くにある新規契約件数は、消費税の引上げ月を超えれば回復してくるのではないかと考えている。
,,□,通信会社（営業担当）,・今と同じ状況がしばらく継続すると考える。
,,□,通信会社（役員）,・販売においては放送、通信共に悪化要因が少なく、引き続き堅調に推移するものと考える。
,,□,住宅販売会社（従業員）,・今後は消費税の引上げと同時にエコポイントや、住宅ローン減税の拡充があるので、その内容が客に浸透するまではこの状態が続くと考える。内容が徐々に浸透するとともに、販売量も回復していくとみている。
,,□,住宅販売会社（営業）,・良くなる要素が浮かばない。
,,▲,商店街（代表者）,・たかが２％、されど２％である。多少の売上の落ち込みは覚悟しておかなければならない。
,,▲,商店街（代表者）,・消費税の引上げ後しばらくは節約が続くと考えるが、キャッシュレス決済の還元ポイントへの反応が別の動きとしてあるようにみえる。
,,▲,一般小売店［事務用品］（店員）,・業界の閑散期と消費税の引上げによる買い控えが重なり、期待要素が薄い。
,,▲,一般小売店［書籍］（従業員）,・消費税の引上げの影響は大きく、販売量は当面落ちるだろう。
,,▲,百貨店（販売促進担当）,・消費税の引上げ後の影響で高額品の動きが鈍化し、まとめ買いの反動で化粧品や婦人衣料が影響を受ける。
,,▲,百貨店（販売担当）,・まとめての購入がやや多く、定番品を中心に消費税の引上げ後の反動を見込んでいる。さらに、心理的な状況を鑑みると悪化する方向だと考える。ただ、前年は暖冬で大幅に苦戦したコートやダウンが、今年は例年並みの気温であれば拡大する可能性があり、11月以降は期待が持てる。
,,▲,スーパー（店長）,・軽減税率や、キャッシュレス決済のポイント還元があるとはいえ、消費税の引上げの影響で買い控えはあるとみている。
,,▲,スーパー（総務担当）,・10月からキャッシュレス対応のいろいろなポイント還元セールがスタートするが、客にとって非常に分かりづらいため、消費が伸びるとは考えづらい。
,,▲,スーパー（店舗管理）,・消費税の引上げを控え、軽減税率により影響は少ないと考えるが、消費税の引上げ後のドラッグストアやホームセンター等の販促強化があるとみており、それが必ず影響してくると考える。
,,▲,スーパー（統括）,・スーパーは軽減税率対象品目をメインに販売しているが、消費者の生活において購入するもののほとんどが標準税率であり、節約志向が強まればおのずと食費にも強く現れる。そのためキャッシュレス決済のポイント還元策を含め、来客数確保のための競争環境が厳しくなるとみている。
,,▲,コンビニ（エリア担当）,・消費税の引上げがある。
,,▲,コンビニ（店舗管理）,・消費税の引上げにより、売上は微減となる。
,,▲,衣料品専門店（経営者）,・やはり消費税の引上げの影響はあると考える。
,,▲,乗用車販売店（経営者）,・消費税の引上げとなれば、個人客の買い控えが見込まれるので、しばらく販売は悪くなると考える。
,,▲,乗用車販売店（従業員）,・消費税の引上げ後は更に厳しくなるとみている。
,,▲,乗用車販売店（役員）,・消費税の引上げ後、更に消費の落ち込みが進むとみられる。また、海外要因等により経済全体が守りに入る局面が見込まれる。
,,▲,自動車備品販売店（役員）,・消費税の引上げ後の、キャッシュレス決済のポイント還元指定外企業のため恩恵は受けられず、厳しい状況になると考える。
,,▲,その他小売［ショッピングセンター］（統括）,・消費税の引上げに伴う反動が出るのに加え、周辺の競合環境に変化が発生するので、10月以降についてはやや停滞するとみている。
,,▲,高級レストラン（スタッフ）,・好調な９月の反動か消費税の引上げの影響か、夜の地元客の受注は例年並みだが、昼の県外団体旅行による会食が例年の75％しかなく、大苦戦となっている。
,,▲,一般レストラン（店長）,・消費税の引上げの影響もあり、明るい展望がない。
,,▲,一般レストラン（統括）,・消費税の引上げ後、外食産業は真っ先に支出を抑える対象になるが、駆け込み需要の少なさや軽減税率の導入、キャッシュレス決済のポイント還元事業などにより、前回の消費税の引上げほどの景気悪化や落ち込みはないとみている。
,,▲,都市型ホテル（役員）,・宿泊部門は、インバウンド関係では香港の逃亡犯条例や日韓の関係悪化による影響、レストラン部門では10月からの消費税の引上げによる個人消費の落ち込みの影響が懸念される。一般宴会部門はコンベンション関係が若干弱く、景気動向はやや悪くなっている。
,,▲,タクシー運転手,・観光の予約の上積みが少ない。
,,▲,テーマパーク（役員）,・先行きの国内の団体旅行をみても予約が鈍ってきている。また、香港からの客を中心に海外からの客も鈍くなっている。全体としては、やや悪くなる方向にあると考える。
,,▲,競輪場（職員）,・10月からの消費税の引上げの影響が少なからずあると考える。
,,▲,その他レジャー施設［スポーツクラブ］（総支配人）,・更に年内には、近隣に競合店の出店が３店舗決まっており、今以上に新規会員獲得が難しくなるとみている。
,,▲,美容室（経営者）,・ここ数か月、余りに国際情勢が悪い方向に向かっており、心情的に景気も悪くなると考える。
,,▲,住宅販売会社（従業員）,・数多くの政策によって駆け込み需要の反動は少ないとみているが、個人消費の減少により厳しい状況になると考える。
,,▲,住宅販売会社（従業員）,・10月から消費税の引上げが施行されると客の様子も変化し、動きが鈍くなると考える。
,,×,一般小売店［鮮魚］（役員）,・まず第１に消費税の引上げがある。破壊的な景気停滞を招くと考える。次に対外的な中国や韓国との問題で、中国相手の企業は悲鳴を上げており、韓国からの訪日客を当て込んでいたホテルなどは散々な状況である。さらに、根底にあるのは、老後資金2000万円不足の大問題である。今後、景気が良くなるとは考えられない。
