Ⅱ．景気の先行きに対する判断理由,,,,
,,▲,乗用車販売店（従業員）,・消費税の引上げ時期を迎え、客からも、いろいろなところで支払が増えるので車まで予算が回らないといわれる。実際どれくらい支出が増えたかを実感しなければ、商談に乗ってはくれないように感じられる。
,,▲,その他小売［ショッピングセンター］（経理担当）,・売上高は前年比0.5％のプラス、来客数は前年比0.9％のプラスで、共に久しぶりにプラスに転じたが、いずれも前年比１％未満の増加であり、腰の入った回復ではなく一時的なプラスと見込む。
,,▲,高級レストラン（経営企画）,・消費税の引上げを控え節約傾向となるが、販促などの強化により、横ばいから微減にとどめたい。
,,▲,一般レストラン（経営者）,・秋には消費税が引上げとなるので、少し売上は落ちる。
,,▲,一般レストラン（従業員）,・外食を控えるようになる。
,,▲,その他飲食［仕出し］（経営者）,・消費税の増税がいよいよ迫ってくる。買い増しより今回は買い控えの傾向になる。将来不安でますます金を使わなくなる。
,,▲,その他飲食［ワイン輸入］（経営企画担当）,・消費税増税による消費マインドの低下は避けられない。既に消費者の意識は、節約志向を強めている。
,,▲,観光型ホテル（経営者）,・９～10月は前年よりもかなり悪くなっている。９月に関しては前年の80％しか予約が入っていない。消費税の引上げで、法人客はその準備に追われていたり、消費意欲が減退しているのか、やや悪くなる傾向が目に見えて現れている。消費税増税に対する慣れが出てくるまでは、増税の影響は緩和されない。政府の抜本的な対策がないと、景気の下支えにはならないと懸念する。
,,▲,都市型ホテル（従業員）,・予約状況が増加していない。
,,▲,旅行代理店（経営者）,・消費税の増税でますます財布のひもが固くなる。水道光熱費等、削減できない消費を賄うために食費の抑制や、家電、洋服などの買い控えは今後も続く。既に夜の酒場でも低価格化が進み始めている。
,,▲,タクシー運転手,・参議院選挙も終わり、10月からの消費税引上げがどれくらい影響するかは分からないが、大手企業の人員削減や中国市場での不振という話題もあり、先行きは景気が少し悪くなると考える。
,,▲,通信会社（企画担当）,・業界では初期費用無料が当たり前になっているため、消費税増税前の駆け込み需要が期待できない。増税を控えて、節約志向が更に強くなってくるのではないか。
,,▲,通信会社（サービス担当）,・既存客にとって得になるようなサービスがないと、他社への乗換えが増え、解約が増加していく。
,,▲,パチンコ店（経営者）,・業界全体の利用者が減っている。
,,▲,理美容室（経営者）,・客との会話では、景気も余り良くならないし、段々と生活が厳しくなっていくように感じる。
,,▲,美容室（経営者）,・消費税の引上げが頭にあり、客は無駄な金を使わない。
,,▲,美容室（経営者）,・当地は、若い女性が大学を卒業すると就職で県外に出て人口減少となっている。先行きは更に厳しくなる。
,,▲,住宅販売会社（従業員）,・お盆の来場に掛かってくるが、その客は２～３か月後の契約になる。一旦はかなり冷え込むと見込まれる。
,,▲,その他住宅［住宅管理］（経営者）,・梅雨で仕事が遅れているだけで仕事が増えたわけではないため、この先景気が良くなるような雰囲気はない。
,,×,衣料品専門店（経営者）,・秋には消費税が10％に引き上げられるので、なじみ客以外は目的がなければ来店もしてもらえない状態になる。
,,×,一般レストラン（経営者）,・消費税の引上げがある。
,,×,一般レストラン（経営者）,・５月の10連休以降は全く状況が変わっている。消費マインドは完全に落ちている。これから日韓問題や中東情勢など世界の動きが非常に過熱するように思える。それに対応できる政策が全くみられない。さらに、消費税が10月から引き上げられるということで、一般市民にとっては精神的にも負担が大きいように思われる。
,,×,スナック（経営者）,・消費税の引上げも近づき、他人事ではないが、客の財布のひもはますます固くなり100％期待できない。
,,×,観光名所（案内係）,・良くなる理由が見つからない。
,,×,理容室（経営者）,・景気の良い話は全くない。また、老後資金の2000万円が響いている。
,,×,設計事務所（経営者）,・案件が激減しているなか、先が全くみえていない。
,,×,住宅販売会社（経営者）,・消費税引上げの関係で単価の高い不動産は先行き不透明である。
,,×,住宅販売会社（従業員）,・新築住宅の着工が減り、リフォームも一巡してくると、地方の小さな工務店の存続は更に深刻化しているように感じる。かといって、打開策も見当たらない。
"企業
動向
関連

(東海)",,◎,－,－
,,○,建設業（役員）,・当エリアでは当社を含め３社が大規模物件を供給する。通常の３倍の供給数が出るので、市場の活性化になり客が動くと思われる。ただし、競合激化となるであろう。
,,○,金融業（従業員）,・全体的に大きな動きがなく、景気は悪くはないというイメージである。建築関係の営業マン等から具体的な話を聞くと、仕事量が多く、この先数か月をみても忙しくてなかなか休みが取れないということである。
,,○,不動産業（経営者）,・今後は例年同様に晴天の日が多くなるとの予報もあり、当面の売上は良い状態となり、前年同期100％以上で推移するとみている。
,,○,その他サービス業［ソフト開発］（社員）,・年内はパソコンＯＳのサポート終了案件が継続して発生する。
,,□,食料品製造業（営業担当）,・受注量、販売量をみても例年どおりとなっており、気温に左右されるが、予測がしづらい状況である。
,,□,パルプ・紙・紙加工品製造業（顧問）,・米中貿易摩擦や消費税増税の影響で全般的には落ち込むが、秋の需要期とあいまって業況は余り変わらない。
,,□,化学工業（営業担当）,・現在の受注状況及び客の将来計画において増量の見込みがない。
,,□,化学工業（総務秘書）,・景気に強い影響を与えるトピックがない。取りあえず東京オリンピックまでは大きな落ち込みは考えにくいので、特別な事態が起こらない限り１年間は安定しているのではないか。
,,□,金属製品製造業（経営者）,・引き合いも増えておらず、引き続き低調に推移するものと考えている。
,,□,金属製品製造業（従業員）,・工場の対応能力を上回る仕事量がある状況はしばらく続きそうである。
,,□,一般機械器具製造業（営業担当）,・主力市場である北米で自動車製造が活発ではないため、しばらくこの状況が続く。
,,□,一般機械器具製造業（経営管理担当）,・受注量、販売見込みを維持する。
,,□,電気機械器具製造業（企画担当）,・国内では東京オリンピックに向け需要が拡大するだろうが、米中貿易摩擦の影響はまだ排除できないので、見通しを立てにくい。全体として中立の状態が今しばらくは続く。
,,□,電気機械器具製造業（総務担当）,・設備投資意欲は高いが、受注量はピークを迎えつつある。今後、極端な減速があるかというと、今はそうは感じられない。
,,□,輸送用機械器具製造業（品質管理担当）,・景気が上向く材料も下降する材料も特にない。
,,□,輸送用機械器具製造業（総務経理担当）,・消費税の引上げがあるが、駆け込み需要は余りなさそうであり、今のままで推移するのではないかと見込む。
,,□,建設業（営業担当）,・消費税増税に伴い現在仕事が急増しており、その反面、３か月後は価格面から新しい仕事は落ち着き、現状の仕事が中心になる。
,,□,輸送業（経営者）,・消費税増税を前に在庫の積み増しをしている荷主は多いが、具体的な販売計画が聞こえてこない。
,,□,輸送業（エリア担当）,・到着数は若干減少しているが、単価は維持しているために収支は悪くない。
,,□,輸送業（エリア担当）,・荷主の話では、余り変わらないようなので、同じペースである。
,,□,通信業（法人営業担当）,・大企業は利益が上がっているというが、その大企業も海外向けビジネスの動向の良しあしによる。国内での小さなマーケットで右往左往する中小企業がとう汰され、大企業も海外投資を横目に見ながらビジネスをするようになってしまっている。骨抜きの経営に対しては、将来的な成長や起死回生の一発など期待できない。
,,□,通信業（法人営業担当）,・経済が上向いているほどの実感はない。政治の安定によるリーダーシップで、経済を引っ張っていく力強さが求められる。
,,□,金融業（企画担当）,・利下げ等何かイベントがないと株価も為替も大きく動かないと思われる。個人の投資家や投資家以外の様子見は続くとみられる。
,,□,広告代理店（制作担当）,・客が秋の商戦に向けて広告予算を増やすという話はなく、横ばい状態が続く。
,,□,行政書士,・貨物に変化がない。
,,□,公認会計士,・中堅中小企業の事業承継等は少しずつ進んでいるが、まだまだ緒に就いたばかりで、承継後の成否がどの程度かは不明である。少子高齢化と低生産性に対して、政府は明確な指針を示せていない。
,,□,会計事務所（職員）,・例年、７月中旬から８月のお盆にかけて繁忙になるが、今年は繁忙期がなくてお盆休暇になりそうである。ただし、海外を含め旅行者は増える見通しである。
,,□,その他非製造業［ソフト開発］（経営者）,・米国経済は株価も高く好調のようだが、我が国の経済は好調には見受けられない。設備投資についても抑え気味に感じられる。為替相場が円高に向かい、何とも不気味に感じられる。
,,▲,食料品製造業（経営企画担当）,・消費税の引上げもいよいよ目前に迫り、消費マインドの低下は日用品にも影響してくると見込まれる。
,,▲,窯業・土石製品製造業（社員）,・客との話の中では、中国や韓国向けの電子部品関係の受注量が大幅に減っており、減産体制に入っていると聞いているので、今後は受注量の減少が予想される。
,,▲,鉄鋼業（経営者）,・季節要因もなく、東京オリンピック需要もそろそろ打ち止め感があり、先行きに明るい材料がない。
,,▲,電気機械器具製造業（営業担当）,・足元は時期的に良いだけで、長期的には余り良くない。
,,▲,電気機械器具製造業（経営者）,・中国向け等の輸出も復活せず、鉄鋼メーカーからの下期値上げ交渉が始まっており、価格面での競争力等に支障を来すため、景気は若干落ち込むことが見込まれる。
,,▲,輸送用機械器具製造業（管理担当）,・政策の動向をうかがうため、買い控えになると思われる。
,,▲,輸送業（エリア担当）,・米中の貿易摩擦が顕著になる動向が懸念され、我が国にも影響が出始めている。また、米国大統領がＷＴＯを非難し、世界経済秩序が混乱する兆しを見せている。東京オリンピックの効果も落ち着いており、世界の中での日本として景気を考えると、先行きに明るい要素は見当たらない。
,,▲,輸送業（役員）,・消費税のアップも当初の予定どおりに実施されそうではあるが、予想していたような駆け込み需要が乏しく、むしろ買い控えになりそうだ。一時的に下落に転じた石油価格も、中東の政情不安から高値にとどまる気配があり楽観視できない状況であり、今後の景気動向に水を差す様相である。
,,▲,輸送業（エリア担当）,・米中貿易問題や日韓政治問題の影響が貿易に出ている。
,,▲,通信業（総務担当）,・人々が感じる景気は世の中の雰囲気そのものなので、日銀短観の中小企業指標のポイント減などのニュースを聞くと、やはり世の中の景気は悪くなっていると感じてしまう。物流での荷動きは堅調であるが、やはり上昇傾向は感じられない。逆に悪化を予想している。
,,▲,不動産業（経営者）,・東京オリンピック後は停滞する。
,,▲,新聞販売店［広告］（店主）,・８月以降折込チラシが多くなるようなことがない。消費税の増税前だが住宅関係のチラシなどが増えていることもない。
,,▲,会計事務所（職員）,・年金不足2000万円の話題もあるし、消費税の増税も近い。ガソリンも高止まりしているし、消費税の引上げ後の物価も様子見ということで、消費は控えられるのではないかと見込まれる。
,,×,輸送用機械器具製造業（経営者）,・消費税のアップは必ず景気を押し下げるので、下がり具合を注視している。
"雇用
関連

(東海)",,◎,人材派遣業（営業担当）,・消費税増税を前に、駆け込み需要が増加することが見込まれる。
,,◎,人材派遣会社（営業担当）,・下期に向けての人材確保のため、各社、派遣・臨時社員にかかわらず採用意欲が高まってくると考える。既に派遣の依頼は増えてきており、在職者も転職時機をうかがっている状況である。
,,○,＊,＊
,,□,人材派遣会社（経営企画）,・今の傾向がしばらくは継続する見込みである。
,,□,人材派遣会社（社員）,・この先の予約状況は余り良くなく、例年に比べても良くないままである。
,,□,人材派遣会社（企画統括）,・消費税の引上げが景気変化の特段の材料になるとは考えにくい。
,,□,人材派遣会社（営業担当）,・ポジティブな要素が思い当たらない。
,,□,人材派遣会社（営業担当）,・求人件数は前年を上回っているが、年間での求職者の流動性が停滞期に入るため、９月までは状況の大きな変化はない。
,,□,アウトソーシング企業（エリア担当）,・例年この時期は下期に向けた人材募集を行うが、その動きがなく、通常募集の人員数で推移している。
,,□,職業安定所（所長）,・企業からは継続的に、人手不足や来春新卒の採用活動に苦戦しているという声をよく聞く。
,,□,職業安定所（職員）,・世界経済の動きが不透明だが、不動産業界からは、中古マンションの売行きが好調との声があった。
,,□,職業安定所（職員）,・前年と比較して20～49歳の窓口相談件数が激減している。60歳以上についても多少の増加にとどまっており、以前のような、景気の良いときに転職するという風潮はみられない。
,,□,職業安定所（次長）,・大きく景気が変動する動向は見受けられないが、業界により消費税の引上げ前の駆け込み需要と引上げ後の受注減が懸念される。
,,□,職業安定所（次長）,・一般求人、新規学校卒業者対象求人共に求人件数に大幅な減少は見受けられず、引き続き企業からの採用意欲は高い傾向が継続している。
,,□,民間職業紹介機関（営業担当）,・米中貿易摩擦を発端とした景気の動きをみると、大手企業での減益などの影響もあり、採用に慎重になり始めている企業もあるが、中小企業での採用決定においては、まだそこまでの影響は出ておらず、案件の人選依頼も継続的に発生している。
,,□,民間職業紹介機関（窓口担当）,・通常は秋からの需要が多い業界ではあるが、直接雇用による求人募集も多く、見込みよりも下回る可能性がある。
,,□,学校［専門学校］（就職担当）,・当地ではピークを過ぎた採用試験だが、関東地区の採用意欲は高く、現時点で前年以上の求人募集に関する資料が届いている。
,,▲,人材派遣会社（営業担当）,・足元で客からの引き合い残件数が減少していることに加え、主要客での予算縮小に向けた動きも耳に届いている。
,,▲,新聞社［求人広告］（営業担当）,・求人の動きが悪く、設備投資の動きが鈍い。
,,▲,職業安定所（次長）,・世界の経済情勢の不透明感から、製造業を中心に様子見感の広がりが懸念される。
,,▲,民間職業紹介機関（支社長）,・面接合格率がやや低下してきている。特に製造業の動きが鈍い。
,,×,新聞社［求人広告］（営業担当）,・人材採用方法に新規アイデアを出せない人材ビジネス企業は退場しかない。新聞広告の求人は、もう細々としても残れない。
,,,,
　７．北陸（地域別調査機関：一般財団法人北陸経済研究所）,,,,
,,,,（－：回答が存在しない、＊：主だった回答等が存在しない）
分野,,景気の先行き判断,業種・職種,景気の先行きに対する判断理由
"家計
動向
関連

(北陸)",,◎,－,－
,,○,一般小売店［事務用品］（店員）,・消費税の引上げ前の駆け込み需要に向けて、仕掛けた商談が受注につながり、販売量が増加する。
,,○,スーパー（店長）,・消費税の引上げ前の買いだめ需要が発生するとみている。
,,○,コンビニ（経営者）,・季節商材の売行きが例年より良い。
,,○,コンビニ（エリア担当）,・盛夏とキャッシュレス対応の拡大でやや良くなるとみている。
,,○,家電量販店（店長）,・消費税の引上げ前の駆け込み需要が見込まれる。
,,○,家電量販店（店長）,・消費税の引上げ前の駆け込み需要が出始めているのと、やっと季節商材が動き始めたため良くなってきている。また、消費税の引上げ前の住宅購入による新規家電購入が見込める。
,,○,乗用車販売店（経営者）,・消費税の引上げ前の駆け込み需要を期待して良くなると考える。
,,○,都市型ホテル（役員）,・宿泊部門はインバウンドが減少傾向にあるが、コンベンション関係の増加により堅調に推移すると考える。レストラン部門は、定休日による売上ロスがあるが、大きくは変わらない。一般宴会は大型コンベンション、慶事などの予約状況によると考えており、全館での景気動向はやや良くなるとみている。
,,○,通信会社（営業担当）,・９月に新機種が発売される予定があるので、販売数の増加が少し見込める。
,,○,通信会社（営業担当）,・10月以降に新商品の発表があれば、販売台数に影響するとみている。
,,○,通信会社（役員）,・ここ数か月契約数が好調に推移している。２～３か月先は通信サービスが例年好調な時期でもあり、マイナス要素が少ない。
,,□,商店街（代表者）,・駐車券の利用は例年と比べ25％ダウンしている。通行量もダウンしているようである。一過性のものかどうかは分からないが、近隣の大型ショッピングモールが秋に増築開店する影響を想像するに、危機感を持たざるを得ない。
,,□,一般小売店［精肉］（店長）,・デイリー商品はほぼ前年並み、若しくは少し弱いくらいで推移しているが、お中元ギフトでの落ち込みが大きく、今月は非常に落とす形となっている。要因が何か分からないが、参議院選挙等もあり、影響があったかと考える。来月以降はデイリー商品だけでみていかなければならないので、前年並み辺りで推移すると考える。
,,□,百貨店（売場主任）,・老後資金2000万円問題で消費者の財布のひもはより一層固くなった。消費税の引上げ前の駆け込み需要は小売側からみれば期待する部分はあるが、軽減税率などの施策により前回の消費税の引上げ時に比べ衝動買いは少ないと考える。
,,□,百貨店（販売促進担当）,・参議院選挙での与党の圧勝で市場は落ち着き感を取り戻しつつあるが、年金問題を含め将来への不安は払拭される気配がない。消費税の引上げ後は、個人消費の節約志向はますます強くなると考える。
,,□,百貨店（販売担当）,・消費税の引上げが決定しているが、客の購買動向は変化がない。高額商品などには一部動きが出ているようだが、一般商品、雑貨、衣料品など先行購入の兆しはみえず、大きな変化はないと考える。
,,□,スーパー（総務担当）,・10月からの消費税の引上げにおいて軽減税率があるため、食品の売上増加はほぼ見込めない。消費税の引上げによる景気の変動は少ない。
,,□,スーパー（総務担当）,・会社としては軽減税率を含む消費税の引上げの対応に追われているなか、客のスーパーでの動向に大きな変動はないと考える。８％から10％に税率が変わる雑貨類の駆け込み需要が推測される程度である。
,,□,スーパー（統括）,・10月の消費税の引上げにより、軽減税率やキャッシュレス決済のポイント還元制度などの施策がどう消費行動に影響が出るか、見込みが立てづらい。
,,□,コンビニ（店舗管理）,・消費税の引上げで消費マインドは更に冷え込む。
,,□,衣料品専門店（経営者）,・もうそろそろ底打ち感が出てきたかと思っていたところ、景気の先行き感は見通せず、天候は不安定で、客は慎重である。
,,□,乗用車販売店（従業員）,・新型車が発売され期待はしているが、厳しい状況が続きそうである。
,,□,その他専門店［酒］（経営者）,・３か月先には、今のままの状況であれば消費税の引上げがある。軽減税率というややこしい制度が始まり、その制度で大変な目にあう。苦労しても売上が上がらない状態が続くのではないかと考える。
,,□,その他小売［ショッピングセンター］（統括）,・リニューアルに向けた専門店の入れ替わりが発生しており一概にはいえないが、梅雨が明けて気温が上がる見込みのため、衣料品が動いてくる。消費税の引上げ前の駆け込み需要も含めて今月のような苦戦はないと考える。
,,□,スナック（経営者）,・客からは、消費税の引上げでなかなか来られなくなるとの声を聞く。また、海外における関係悪化も不安材料である。
,,□,観光型旅館（経営者）,・夏休み期間の予約状況が例年よりも悪く、９月以降も好転する兆しがみえない。10月の消費税の引上げの影響もあり心配である。
,,□,タクシー運転手,・今後秋口にかけて、今以上に観光客が増えると考える。週末を中心に繁華街の人出は変わらないとみている。
,,□,タクシー運転手,・暑くなったこの時期でも夜の繁華街の人出が、平年より少ないようである。
,,□,通信会社（職員）,・東京オリンピックを控えて新機器がラインナップされてきているものの、客側には様子見感が強く、買換えまでは至っていない。
