II．景気の先行きに対する判断理由,,,,
,,□,金融業（企画担当）,・個人投資家は、利益確定の売りもあるが一旦様子見で消費に向かっていない。個人投資家以外の個人は給与が上がっている実感がないと消費に向かいづらい。当面、現状の景気が続くと見込まれる。
,,□,不動産業（経営者）,・今後も例年同様に晴天の日が多くなるとの予報もあり、当面の景気は今月同様に良い状態が継続し、売上は前年同期100％以上で推移するとみている。
,,□,不動産業（経営者）,・少し価格の下落や引き合い案件の減少はあるものの、大きな変化は感じられない。
,,□,広告代理店（制作担当）,・新製品ＰＲ等の広告出稿依頼が少し出てきているが、一方でペンディング状態の事例もあるため、ほぼ横ばいの見込みである。
,,□,会計事務所（職員）,・使える金は増えるわけではない。限られた資金をどの方面に使うかだけである。消費先に選ばれなかった店が淘汰される。
,,□,その他非製造業［ソフト開発］（経営者）,・米国と中国の綱引きにより経済は大きく変動し、全体的にはかなりのマイナス局面が出てくる。当社としては新製品の完成を急がなければならない。
,,▲,食料品製造業（営業担当）,・受注量、販売量の前年割れ状況が長く続いている。回復の兆しがみえない状態である。
,,▲,食料品製造業（経営企画担当）,・原料価格は高値で安定し、引き続き収益を圧迫している。
,,▲,パルプ・紙・紙加工品製造業（顧問）,・来年に入ると消費税増税の影響がじわじわ出てきて、受注量も減少し景気が悪くなる。
,,▲,鉄鋼業（経営者）,・１〜３月の新規の話が非常に乏しい。建築業界も自動車業界も大きく上向く見通しなどはない。
,,▲,金属製品製造業（経営者）,・来年の引き合いの数が減少している。
,,▲,輸送用機械器具製造業（品質管理担当）,・燃料代等も上昇傾向になっている。
,,▲,建設業（役員）,・消費税引上げの影響で資材の値上がりもあり、建築コストがますます上がる。客が分譲価格の高騰についていけないことを懸念する。
,,▲,建設業（経営者）,・我が国の政治家の問題や国家公務員の行動をみると、景気が良くなるはずがない。
,,▲,通信業（法人営業担当）,・カード決済のポイント還元も期限付きで、限定的である。消費税増税でマインドは冷えており、東京オリンピック以降の景気が心配である。
,,▲,新聞販売店［広告］（店主）,・正月へ向けての折込チラシが少ない。年始を休む店も増えているので減っている。
,,▲,公認会計士,・自動車関連産業でのガソリンから電気への構造変化や、国内生産量の成熟化の流れは不可避である。中堅中小企業の事業承継問題は、短期的には解決ができない。
,,▲,その他サービス業［ソフト開発］（社員）,・小規模の打診はあるものの大きな規模の案件がないため、外部委託要員の調整が始まると見込まれる。
,,×,輸送用機械器具製造業（経営者）,・新規の目玉になるような材料が見つからない状態である。米中貿易摩擦の終結を早期に望む。
,,×,輸送業（エリア担当）,・この景気の悪さは世界貿易紛争、米中貿易摩擦、日韓の政治経済関係の悪化が影響している。それに加えて、我が国の政治に対する不信感、やり場のないむなしさが漂っている。
,,×,会計事務所（職員）,・消費税増税により、更なる消費の落ち込みが見込まれ、今後良くなる要素も今のところはみられない。
"雇用
関連

(東海)",,◎,−,−
,,○,−,−
,,□,人材派遣会社（経営企画）,・来年３月までの期中は、現状が続く見込みである。
,,□,人材派遣業（営業担当）,・人材不足はまだ解消されず引き続き景気は現状のままと想定する。
,,□,人材派遣会社（企画統括）,・来春の改正労働者派遣法に対する派遣先企業の動向が不透明である。
,,□,アウトソーシング企業（エリア担当）,・年度末に向けた自動車生産数の計画が、例年とは異なって余り増えていない。ただし、求人については、一部の業種を除いて若干だが増加傾向にある。
,,□,新聞社［求人広告］（営業担当）,・今が余り良くなく、客へのヒアリングでも良くない傾向は続く見込みである。
,,□,職業安定所（所長）,・事業所からは人手不足の声はある。米中貿易摩擦等の雇用への影響について心配する声は聞かれるが、直接の影響は聞いていない状況である。
,,□,職業安定所（職員）,・窓口での相談件数は前月比、前年同月比で減少しており、今月も11月と同様か減少する可能性もある。ただし、転職には踏み切らず現状の維持を希望しているのではないかと見込まれるため、大きな変化はないものと考える。
,,□,職業安定所（次長）,・人手不足と感じている企業の声が多い状況は変わっていないが、一部の製造業は、先行きを不安視し採用抑制を検討している。
,,□,職業安定所（次長）,・求人数の減少はあるものの、求職者数の増加又は就職者数の減少までには至っていない。
,,□,民間職業紹介機関（営業担当）,・１月中旬〜４月に入社を目指す転職希望者の流入が見込まれるが、厳選採用で慎重な姿勢の企業が増えている印象もあり、採用数増加につながるかは不透明である。
,,□,民間職業紹介機関（支社長）,・好転材料も後退材料も顕著には見受けられない。
,,□,学校［専門学校］（就職担当）,・現時点でも募集している来年３月実施予定の大学内企業説明会において、参加希望企業数が前年と変わりない。
,,▲,人材派遣会社（社員）,・今月が良かっただけにやや悪くなる。ただし、１月は法人関係の新年会や賀詞交換会での予約状況が例年より良い。
,,▲,人材派遣会社（営業担当）,・ポジティブな材料が見当たらない。
,,▲,人材派遣会社（営業担当）,・郊外での派遣受注の落ち込みが大きくなっており、都心部でも採用数は減少している。
,,▲,職業安定所（次長）,・求人数が減少するなかで、当地域においては好転する要因が見当たらない。
,,×,人材派遣会社（営業担当）,・自動車メーカーの主要客より、４月からの予算を10％削減すると通達を受けており、今月よりも景気は悪くなる。
,,×,新聞社［求人広告］（営業担当）,・世の流れの変化に全くついていけておらず、ついていくこともできなくなっている。
,,,,
　７．北陸（地域別調査機関：一般財団法人北陸経済研究所）,,,,
,,,,（−：回答が存在しない、＊：主だった回答等が存在しない）
分野,,景気の先行き判断,業種・職種,景気の先行きに対する判断理由
"家計
動向
関連

(北陸)",,◎,−,−
,,○,一般小売店［事務用品］（店員）,・年度末に向けて、官公庁案件による売上が期待できる。
,,○,乗用車販売店（経営者）,・新型車の発売が予定されているので、やや良くなるとみている。
,,○,旅行代理店（所長）,・１月以降に新たな東京オリンピック関連の旅行商品の発売情報があるので、期待したい。
,,□,一般小売店［書籍］（従業員）,・消費税の引上げの影響は一段落したが、良くなる要素はなく、現状が続きそうである。
,,□,百貨店（売場主任）,・暖冬予想のため、紳士、婦人、子供のコートなどの重衣料及び防寒用品は引き続き苦戦すると見込む。
,,□,スーパー（店長）,・天候次第だが、その他で大きく変動する要素がない。
,,□,スーパー（総務担当）,・政府のポイント還元事業が一旦終了し、景気が悪くなるのを防ぐため次の対策が打ち出されると考える。東京オリンピック以外は大きな変動はないとみている。
,,□,スーパー（店舗管理）,・来春は大型店舗の新規出店があり、一段と競争が激化し、買上点数増は見込めない。さらに、来客数への影響もあると考える。
,,□,コンビニ（店舗管理）,・好転の材料が見当たらない。
,,□,衣料品専門店（経営者）,・消費税の引上げ後であることに加えて、暖冬で売上が大幅に落ち込んでいる。回復の兆しがみえない。
,,□,衣料品専門店（店舗運営）,・ここ数か月の客単価の推移をみると、数か月後も大きな変化はないと考えている。
,,□,家電量販店（店長）,・新生活などの需要も年々下がってきており、消費税の引上げの影響が今期まで続くとみている。
,,□,乗用車販売店（従業員）,・暖冬が予想されており集客を期待しているが、しばらくは厳しい状況が続きそうである。
,,□,自動車備品販売店（役員）,・多少回復への期待感はあるが、クリスマス商戦や年末の客の動きからは、まだまだ厳しい状況が続きそうである。
,,□,住関連専門店（役員）,・過去数回の消費税の引上げ後の落ち込みを経験しているが、今回は回復も遅く、この先良くなる見通しが全く立たない。
,,□,その他専門店［酒］（経営者）,・とにかくこれ以上悪くなってほしくないということで、変わらないとする。
,,□,その他小売［ショッピングセンター］（統括）,・改装効果及び競合店環境が変化しているため、単純比較ができないが、天候の要素を除いて買い控え等は発生していない。今後も同様に推移するとみている。
,,□,高級レストラン（スタッフ）,・団体の新年会の受注は、例年並みのペースで予約が入っている。
,,□,観光型旅館（経営者）,・年末年始の予約状況は変わらないが、その後の集客に苦戦している。新年会の予約が減少傾向にある。
,,□,都市型ホテル（役員）,・宿泊部門、レストラン部門共に景気動向が悪くなるとみている。宴会部門において各種団体や企業の新年会は例年と同様の傾向にあり、全館での景気動向は若干悪くなると考える。
,,□,通信会社（職員）,・消費税の引上げの対応費用の負担は期末まで影響し、売上増の傾向は相殺といったところである。
,,□,通信会社（営業担当）,・ボーナス商戦にもかかわらず、例年と比べてみても販売量に大きな変化がみられない。
,,□,通信会社（役員）,・消費税の引上げによる影響が余り出ておらず、この後も大きな変化はなく推移するものとみている。
,,□,テーマパーク（役員）,・引き続き先行きの予約状況をみると、国内客の動きはやや鈍いものの、海外からの客の動きが比較的堅調なことから、全体的には前年並みの来客数の動きで推移するとみている。
,,□,美容室（経営者）,・10月以降、消費税の引上げの影響がほとんどなかったので、しばらくは現状のままで推移する。
,,□,住宅販売会社（営業）,・良くなる要素が見当たらない。
,,▲,商店街（代表者）,・キャッシュレスによるポイント還元が終了すれば、景気が停滞すると考える。
,,▲,百貨店（販売促進担当）,・個人は先行きの不透明感と消費税の引上げによる節約志向が増してきている。また、大手企業のお中元やお歳暮ギフトの受取辞退の影響により、法人関連のギフトの見直しが企業間で強まり、マイナス要素が更に強まる傾向である。
,,▲,百貨店（販売担当）,・セール期に入る１月は、12月よりは若干の改善を期待しているが、２月以降は再度苦戦を見込んでいる。特に客の中心年代である40〜50代の消費マインドの低下が要因である。バレンタインなどのイベントの影響も受けにくい年代であり、ギフト需要が低迷していることも要因である。祝日は増加するが、高単価衣料品の春物商材が先行して売れる見込みはなく、就職など必需品以外の購買行動は少ないとみている。ヒット商品が見当たらないことも、要因の１つである。
,,▲,コンビニ（エリア担当）,・大きな環境変化がない。
,,▲,一般レストラン（統括）,・12〜１月は年末年始の需要があり、12月の好調を１月もキープすると考える。年度末から新年度にかけては、外食以外に経費が掛かり、株価も現状は下がらずキープしているが、新年度に向けて下がる傾向になるとみている。
,,▲,観光型旅館（スタッフ）,・12月以降の予約保有は、月を追うごとに低下する傾向になっている。
,,▲,都市型ホテル（スタッフ）,・ホテルの過当競争が更に激化するとみており、土地があればホテルが建つ状況はホテルバブルを実感する。レストランも消費税の引上げの影響か、来客数、客単価共に減少しており、特に客単価は消費税の引上げ前より低い。
,,▲,タクシー運転手,・１年前に比べて観光の予約が減っている。
,,▲,通信会社（役員）,・放送サービスにおいて、競合他社のサービス開始が予定されており、契約獲得数や加入者数の減少を見込んでいる。
,,▲,競輪場（職員）,・消費税の引上げの影響や、寒い季節になることから外出を控える客が多いとみている。
,,▲,その他レジャー施設［スポーツクラブ］（総支配人）,・競合店の様子からも、当事業所への新規入会が当面見込めそうにない。
,,▲,住宅販売会社（従業員）,・家づくりをする家族構成は、今までは夫婦２人か夫婦と子供がいる世帯であったが、現在商談をしている家族構成は、本人１人で住むという客や、結婚が決まれば家を建てるという話が増えており、標準家族の建築は１巡した感がある。家づくりの来客数は明らかに減っていくと考える。
,,▲,住宅販売会社（従業員）,・消費税の引上げの影響から、景気はやや悪くなるとみている。
,,×,商店街（代表者）,・キャッシュレスの促進策でキャッシュレス決済が多く、小売店は手数料の負担が増え、消費税の引上げの価格アップ等を合わせると二重苦、三重苦の重荷を背負わされたような感じである。これでは景気が良くなるとは到底見込めない。
,,×,商店街（代表者）,・一時的な理由だが、人気スポットの美術館がメンテナンスのため２月まで休館し、人の流れが完全にストップする。北陸新幹線開業前の水準に逆戻りするといっても過言ではない。
,,×,スナック（経営者）,・業種によるが、工場関係などは暇になっているとのことで、先々悪くなるのではないかと考える。
,,×,タクシー運転手,・新年会の時期が終わると平常に戻る。また、12月が大変良かったことから、その反動で悪くなるとみている。
,,×,住宅販売会社（従業員）,・消費税の引上げの影響が出てきている。
"企業
動向
関連

(北陸)",,◎,−,−
,,○,＊,＊
,,□,食料品製造業（経営企画）,・現状より悪くなるとは考えないが、年が明けても引き続き低空飛行は変わらないとみている。
,,□,プラスチック製品製造業（企画担当）,・米中貿易摩擦、中東や朝鮮半島など海外情勢の不透明感、運送コストの上昇もあり、当面厳しい状況が続くものと考える。
,,□,金属製品製造業（経営者）,・２〜３か月先の受注の入り具合をみると変わらない。
,,□,一般機械器具製造業（経理担当）,・世界経済の不透明感は依然として強く、海外向けの輸出は伸び悩んでいる。国内の設備投資関連の産業用部品においても、新規の受注案件が計画ほど増えてきていない。
,,□,通信業（営業）,・見込み件数がここ数か月前と変化のない状態で、増える気配が感じられない。
,,▲,繊維工業（経営者）,・12月後半から先行きの不透明感が強く、相当悪くなるとみている。
,,▲,建設業（役員）,・来年度以降、現状よりも受注動向は厳しくなるとみている。
,,▲,金融業（融資担当）,・2020年３月に迎える今期決算では過去受注分の決算を反映し、売上や利益を維持できる取引先が多い。しかし、米中貿易摩擦等を要因とした製造業の受注減少は継続しており、来期決算予想は厳しい見通しとなる取引先が増加するとみている。
,,▲,不動産業（経営者）,・法人関係の問合せが少ないのに加え、個人客の問合せも少なくなってきているので、２〜３か月先になると、少し悪くなると考える。
,,▲,司法書士,・事業承継者が不在であるための会社の解散、閉店等が目立つ。駅周辺であっても閉店後が駐車場となっており、新規の事業につながっていない。
,,▲,税理士（所長）,・例年２〜３月は非常にものの動きが悪く、厳しい時期になることから、良いとは余り考えられない。また、中小事業者に対して、消費税の引上げ後の申告納税が始まることから、資金収支が少し厳しくなるのではないかと心配している。
,,×,一般機械器具製造業（総務担当）,・工作機械業界は、過去数年好調が続いてきたが、米中貿易摩擦や英国のＥＵ離脱問題などの外的要因が重なり、設備投資が動き出すまで時間が掛かると考える。
,,×,建設業（経営者）,・民間工事についてもほとんど発注されていないため、来年３月の年度末工事の予定が立たない。
,,×,金融業（融資担当）,・大手の業況が下降しており、中小の仕入先に対して値下げ圧力を強めている。
,,×,新聞販売店［広告］（従業員）,・12月も前年同月比でマイナスである。消費税の引上げ当初の10月から比べると若干上向きになってきている感はある。全体的に紙媒体から他媒体への広告の移行も向かい風になっている面が見受けられ、当面は上昇できないのではと考える。
"雇用
関連

(北陸)",,◎,−,−
,,○,人材派遣会社（社員）,・新しい年になり、東京オリンピックの活気や冬を乗り越えた後の高揚感により、勤労意欲が高まるとみている。
,,□,求人情報誌製作会社（編集者）,・大きな雇用の話が余りない。
,,□,新聞社［求人広告］（営業）,・各企業の話を聞くと、先行きに不安を感じているようである。
,,□,新聞社［求人広告］（担当者）,・政府には抜本的な経済のてこ入れ策がなく、景気の回復を期待できない。民間主導では強者のみが成長し、それ以外は置いてけぼりになっている。圧倒的多数を占める中小以下の事業者が成長しないと、その従業員は積極的な経済活動ができない。
,,□,職業安定所（職員）,・現状ではほとんどの産業で減少傾向であるが、特に建設業、製造業、サービス業において減少の幅が大きい。しかしながら、製造業では５Ｇの動きなどに対する関心が高く、今後の動きによっては業績が多少回復するのではないかという声を聞いており、しばらく様子を見る必要がある。
,,□,職業安定所（職員）,・年末に向け求人数は増加傾向にあるが、正社員の求人は低調なままであり、契約期間のある求人が増加している。求人の増加については一時的なものと捉えており、景気が良くなったとはいえない。
,,▲,民間職業紹介機関（経営者）,・同一労働同一賃金の導入により、新規雇用はしばらく抑制されるのではないかと危惧している。
,,×,−,−
,,,,
　８．近畿（地域別調査機関：りそな総合研究所株式会社）,,,,
,,,,（−：回答が存在しない、＊：主だった回答等が存在しない）
分野,,景気の先行き判断,業種・職種,景気の先行きに対する判断理由
"家計
動向
関連

(近畿)",,◎,家電量販店（店員）,・消費税増税の影響がようやく落ち着き、新生活に向けての需要も増えるため、景気は良くなりそうである。
,,○,一般小売店［呉服］（店員）,・入園や入学に向けた動きが出てくる。呉服に興味を持つ若い母親が増えており、低額の商品でも、ある程度は販売できそうな期待がある。
,,○,百貨店（売場主任）,・苦戦しているなかでも、婦人衣料は前年並みの売上を確保しているため、消費は徐々に回復することが見込まれる。
,,○,百貨店（営業担当）,・富裕層の優良客からは、家具や呉服などの引き合いが増えており、入荷待ちの商材もあるため、高額品の消費は上向きとなる。
,,○,百貨店（営業担当）,・世界情勢の先行きが少し明るくなってきたことで、消費税増税後の混乱は消えつつあるように感じる。もともと食品は軽減税率が適用されるため、増税後の消費の落ち込みは予想していなかったが、販売量は前年の水準に戻り、来客数も前年以上に増加している。
,,○,百貨店（販促担当）,・消費税増税の影響が終息すると予想され、冬物商材の動きが鈍い分、春物商材の早期の動きが期待できる。様々な色目の展開を強化することで、消費マインドの向上を図っていく。新生活や春の旅行など、生活シーンを組み合わせた提案を強化し、活性化を進めたい。
,,○,百貨店（販売推進担当）,・海外情勢は不安定であるが、国内需要は12月中旬以降、前年実績を上回る日が増えているので、回復基調にあると期待している。
,,○,百貨店（マネージャー）,・消費税増税後、時計や宝飾品、美術品などの高額品がようやく売れてきている。株高や米国の好景気なども影響し、緩やかな回復が予想される。
,,○,百貨店（営業推進担当）,・年明け以降の天候次第ではあるが、災害などがなければ、先行指標に悪影響を及ぼす材料は見当たらない。個人消費については、東京オリンピックなどのイベントに対する期待とともに、上向きに変化すると考えている。
,,○,スーパー（店員）,・近隣にオープンしたスーパーは、そこまで繁盛しているわけでもないため、これから盛り返していけば売上も増えてくる。
,,○,スーパー（企画担当）,・年末商戦では客単価がアップしている。キャッシュレス決済のポイント還元もあいまって、当社での購入動機が高くなっている。
,,○,スーパー（企画担当）,・消費税増税の影響が徐々に薄れてくる。
,,○,コンビニ（経営者）,・キャッシュレス決済によるポイント還元のセール期間中は、食品類を中心に、今の好調な売上が続きそうである。
,,○,コンビニ（経営者）,・年末から年明けにかけて、景気が良くなりそうである。
,,○,その他専門店［ドラッグストア］（店員）,・新年となり、東京オリンピックや大阪万博に向けて、海外からの訪問客も徐々に増える可能性があるほか、年始のバーゲンセールでの需要も見込まれる。
