Ⅱ．景気の先行きに対する判断理由,,,,
,,,,
　景気の先行きに対する判断の理由について、その主だったもの及び特徴的と考えられるものを取りまとめると以下のとおりであった。,,,,
,,,,
,,,,
　１．北海道,,,,
,,,,（－：回答が存在しない、＊：主だった回答等が存在しない）
分野,,景気の先行き判断,業種・職種,景気の先行きに対する判断理由
"家計
動向
関連

(北海道)",,◎,－,－
,,○,一般小売店［土産］（店員）,・夏期に観光を控えていた客が、夏は行かなかったので冬の雪のイベントは行きたいとの意向が出てきており、来客数が増加することが期待されている。
,,○,スーパー（企画担当）,・高額商品でも、客の趣味やライフスタイルに合致した商品であれば売上は好調であり、単価低下に歯止めがみられる。
,,○,一般レストラン（スタッフ）,・団体客、企業グループの利用は減少しているが、個人客の利用は増加しており、この先も需要増加が期待できる。
,,○,スナック（経営者）,・忘年会の予約が入っており、新年会にも期待したい。
,,○,タクシー運転手,・それほど多くはないが、業績が良い方向にあるという話が、タクシーの中の客との話題で出るようになっている。
,,○,観光名所（役員）,・財布のひもは固いものの、人の動きが上向いてきている。
,,○,美容室（経営者）,・売上が増加しており、近所の商店街における店の売上も増加していると聞いている。
,,□,商店街（代表者）,・中核店舗であるデパートの集客に変化がみられない。
,,□,商店街（代表者）,・本来なら、ボーナスシーズンや商店街の年末年始の大売出しに期待がかかる時期だが、ボーナスの上昇もあまり期待できず、郊外の大型店オープンや、札幌そごうの閉店セールなどのマイナス要因も多く、全体的には変わらない。
,,□,百貨店（販売促進担当）,"・婦人衣料品はトレンドを押さえた商品かどうかで、ブランドの優劣が明確になり、この傾向が春物商戦まで続く。
・紳士服についてもトレンド商品の開発が厳しいと考えられ、今後もこの傾向が続く。"
,,□,スーパー（店長）,・管内にある大型店が増床することから、価格競争が続き、景気自体の底上げとはならない。
,,□,スーパー（店長）,・販促チラシの価格に左右される客が多くなってきている。また、特にチラシを配布した初日にはふだん来たことのない顔が目立つようになっている。
,,□,コンビニ（エリア担当）,・客の買い方や販売促進に対する反応からみて変わらない。
,,□,コンビニ（エリア担当）,・クリスマスや年末年始の予約商品状況をみると、例年と大きな変化はない。
,,□,衣料品専門店（店長）,・客の買い方からみて、変化はない。
,,□,衣料品専門店（店長）,・集客力が低下したままである。
,,□,家電量販店（店長）,・市場が拡大しておらず、厳しい競争が続く。
,,□,家電量販店（店員）,・１つの商品を買うのに、各店の価格を調べて最も安い店で買う傾向がみられる。
,,□,乗用車販売店（従業員）,・高額車の商談が少ない。
,,□,乗用車販売店（従業員）,・今まで買い控えをしていたユーザーがやっと動き出した感があるが、大きな変化にはならない。
,,□,自動車備品販売店（店長）,・３か月後には夏タイヤ商戦の時期に入るが、ここ数年の傾向からみて上向きになるとは期待できない。
,,□,住関連専門店（統括）,・ヒット商品が出ておらず売上の増加は見込めない。
,,□,高級レストラン（スタッフ）,・湿原観光列車運行の効果が現れ、観光客の増加がみられるが、景気が上向くほどではない。
,,□,高級レストラン（スタッフ）,・旅行代理店からの予約状況が良くない。
,,□,スナック（経営者）,・忘年会や新年会もあり12、１月は今月よりはましであるが、例年と比べて大きな変化はない。
,,□,旅行代理店（従業員）,・先行受注についてみると、セクション別に特に良い部分も悪い部分もなく、総じて変化がない。
,,□,旅行代理店（従業員）,・法人関係の旅行需要があまり期待できないなかで、個人旅行の好調が売上を支えており、全体的には横ばいである。
,,□,通信会社（企画担当）,・オンライン書籍販売などのコールセンターが北海道の地理的メリットを利用して進出しているが、全体的な景気の底上げとはならない。
,,□,美容室（経営者）,・店内で客に対し口頭でセールスをしているが、乗ってこない。
,,▲,商店街（代表者）,・年内からのバーゲンが間延びし、客の購買意欲が低下する上に、単価も低下する。
,,▲,百貨店（売場主任）,・そごうデパート閉店セールの影響で、その反動が出ることが懸念される。
,,▲,百貨店（売場主任）,"・単品傾向、低価格志向が強く、高額商品の売上が芳しくない。
・ヒット商品がなく、お歳暮商戦の出足があまり良くない。"
,,▲,スーパー（企画担当）,・大型店の駆け込み出店が終了する来年１月までは乱売合戦が続き、来客数、客単価が低下し、来年の２、３月ごろに売上は底になる。
,,▲,その他専門店［医薬品］（経営者）,・必要ない物は買わない傾向が強く、どうしても必要な風邪薬についても最小限必要な分だけを買う。
,,▲,スナック（経営者）,・１月は新年会の流れによる利用があるが、団体客の期待は望めなく更に厳しくなる。
,,▲,その他飲食［酒卸］（店長）,・客の利用動向が合理的になっており、ススキノの飲食店向けの荷動きが悪くなっている。
,,▲,パチンコ店（店員）,・稼ぎ時の年末の状態が悪く、年明け以降も期待できない。
,,▲,住宅販売会社（従業員）,・客の動きが鈍くなってきており、受注がやや伸び悩んでいる。
,,×,商店街（代表者）,・大型店が出店し今月末から営業するため、長年続けた大売出しが中止となり、今後は大型店同士の戦いを傍観するしかない。
,,×,設計事務所（所長）,・例年は秋口から冬口にかけて受注があり、来春に客に引き渡すのだが、現状では全く話がない。
"企業
動向
関連

(北海道)",,◎,－,－
,,○,通信業（営業担当）,・資金的に余裕がなければ成り立たない事業だと考えていた情報システム関連の投資が活発であり、回線の申込が増加している。
,,○,その他企業［コンベンション担当］（従業員）,・忘新年会の予約状況は、例年と比べて大口は少ないものの、小人数の利用増加でカバーしている。
,,□,通信業（営業担当）,・設備投資に踏み切る客は確実に増加しているが、まだわずかであり、全体的にみると変わらない。
,,□,その他サービス業［建設機械レンタル］（総務担当）,・補正予算が成立し、上半期の談合問題も落着し、公共工事の未完了部分も出てくるが、全体的には変わらない。
,,□,その他サービス業［建設機械リース］（従業員）,・客からの設備投資に関する情報が少なく、３か月後は変わらない。
,,□,その他サービス業［建設機械リース］（営業担当）,・設備投資は、新年度になってから実行されるようである。
,,▲,出版・印刷・同関連産業（経営者）,・12月の商戦に向けての動きが盛り上がりに欠けているところからみて、３か月後も期待できない。
,,▲,輸送業（支店長）,"・住宅関連が不振であり、輸入木材、建設資材で物量の落ち込みが大きく、輸入商社や建材メーカーが心配している。
・農産物も物流面で例年以上に減少している。
・原油高騰によりトラック、フェリーの運賃が上がりコスト高が収益を悪化させている。"
,,×,＊,＊
"雇用
関連

(北海道)",,◎,－,－
,,○,求人情報誌製作会社（編集者）,・一般求人だけでなく、労働者派遣業の派遣社員の求人件数も伸びており、求人市場全体が拡大している。
,,□,求人情報誌製作会社（編集者）,・求人広告件数は増加しているが、雇用のミスマッチがかなりあり、繰り返しの求人が目立っている。
,,□,新聞社［求人広告］（担当者）,・雇用状態は大変厳しい状態であり現状のまま推移する。
,,□,職業安定所（職員）,・求人数は増加傾向にあるが産業別にみるとばらつきが目立ち、求職者数が横ばい状態なので、厳しい状態が続く。
,,▲,職業安定所（職員）,・冬場は建設関連事業の活動が縮小され、本道全体の生産意欲が落ち込むため、季節労働者の求人は減少傾向となる。さらに、札幌そごうの閉店などの雇用に与える影響が心配である。
,,×,－,－
,,,,
　２．東北,,,,
,,,,（－：回答が存在しない、＊：主だった回答等が存在しない）
分野,,景気の先行き判断,業種・職種,景気の先行きに対する判断理由
"家計
動向
関連

(東北)",,◎,－,－
,,○,百貨店（営業担当）,・主たるターゲットであるミセス層商品の売上が、郊外大型店の出店以降増加し、前年実績をクリアしている。
,,○,百貨店（売場担当）,・ボーナス支給によりＯＬや公務員など百貨店での購入者が増えている。
,,○,乗用車販売店（営業担当）,・低価格車や中古車が売れている。
,,○,乗用車販売店（企画担当）,"・自動車業界は新車発表が続き、特に春は需要期に当たる。
・今年の春は３年ぶりに需要が回復し、来年はそれを上回ると期待される。"
,,○,乗用車販売店（経営者）,・冬場は販売でも整備でもあらゆる面で売上が落ち込むが、春は新車の需要が増え、整備その他の販売が冬場の倍近くになる。
,,○,乗用車販売店（経営者）,・年末にかけ新機種が投入されることから、期待が大きい。
,,○,住関連専門店（経営者）,・年度末に向けての受注が追い込みに入り、やや良くなる。
,,○,スナック（経営者）,・忘新年会シーズンに入るため良くなる。
,,○,都市型ホテル（スタッフ）,・結婚式や宴会の予約状況が一昨年と同じレベルになっており、前年よりも若干良くなっている。
,,○,旅行代理店（従業員）,"・海外旅行を中心に先行受注状況が前年に比べて良い。
・特に年末年始は前年に比べて良くなっている。"
,,□,一般小売店［カメラ］（店長）,"・商品の動きが良くない。
・来店客も減少している。"
,,□,百貨店（企画担当）,・新世紀とクリスマス商戦次第である。
,,□,百貨店（広報担当）,・例年１月は初売りや冬のクリアランスセールなどのバーゲンセールで一時的な活況は生まれるが、その前後は確実に売上が落ち込む。
,,□,百貨店（総務担当）,・暖かい日が続けば冬物商材の売上は期待できない。
,,□,百貨店（企画担当）,・最大の商戦である12月も、衣料関係、ギフトなどに活力が感じられない。特にギフトは個人、法人ともに厳しい状況である。
,,□,百貨店（売場主任）,・年末年始を控え、客の購買行動が慎重になっている。
,,□,スーパー（店長）,・来客数は増えているが、競合店の出店予定があり、競争の激化が予想される。
,,□,スーパー（店長）,・客は１店舗で全ての必要品を買うのではなく、安い店を買い回っており、その傾向がさらに顕著になっている。
,,□,スーパー（経営者）,・競争激化は依然続いており、客の態度は従来どおりであることから変化はない。
,,□,スーパー（経営者）,・スーパーが一定の消費者を取り合っている。
,,□,衣料品専門店（店長）,・客は今後も、よりシビアな買い回りをする。
,,□,家電量販店（総務担当）,・ボーナス商戦の立ち上がりと初売りに期待している。
,,□,家電量販店（店長）,・購入時の支払方法を検討する客が多い。
,,□,住関連専門店（経営者）,・客の予算が少額になっており、慎重な買物をしている。
,,□,その他専門店［ガソリンスタンド］（営業担当）,・ホームセンターなど他業種との競争激化により経営環境の改善の見通しが当面立たない。
,,□,高級レストラン（スタッフ）,・予約状況からみて、今後の売上の上昇は見込めない。
,,□,一般レストラン（経営者）,・ボーナスが支給されない客が多く、生活のためにしか消費できないようになっている。
,,□,観光型ホテル（経営者）,"・１～３月の予約状況は前年と同様である。
・主流である官公庁の会議の減少が目立つ。"
,,□,通信会社（営業担当）,・顧客獲得の競争が激しくなっており、新しく始まるサービス次第である。
,,□,テーマパーク（職員）,・2001年の大型イベントが少なく、客の獲得に結びつかない。
,,□,競馬場（職員）,・客単価の低下や入場者数の低下傾向が鈍化していることから、そろそろ景気も底をつくと思う。
,,□,美容室（経営者）,・ニ八の法則の通り、特段のイベントもないため良くない。
,,▲,一般小売店［書籍］（経営者）,・新刊でも安く買える新古書店の利用が増えている。
,,▲,一般小売店［カメラ］（店員）,・大型店の出店により、厳しい状態である。
,,▲,スーパー（従業員）,"・来客数、客単価、買上点数の減少という状況は変わらない。
・クリスマス、お歳暮の商戦も先行きが不安であり、年を越したら景気は一層悪くなる。"
,,▲,スーパー（店長）,・必要な物を必要な量しか買わない傾向に加え、冬のボーナスが前年割れすることが影響する。
,,▲,コンビニ（エリア担当）,・依然大企業の倒産が頻発しており、リストラによる余剰人員の顕在化、それに伴う関連企業の倒産も続き、消費は悪化する。
,,▲,コンビニ（エリア担当）,・今月の頭から末にかけて、既存店の売上が下がっている。
,,▲,衣料品専門店（経営者）,・バーゲンラッシュでますます客単価が低下していく。
,,▲,衣料品専門店（店長）,・客がボーナスに対する不安を持っており、買い控え傾向が強くなっている。
,,▲,乗用車販売店（経営者）,・リストラで失業した客が増えている。
,,▲,その他専門店［呉服］（経営者）,・日々の必要品のみを買っている。
,,▲,一般レストラン（経営者）,・若いファミリー層などでは、100円セールでなければ子供に寿司を食べさせられない｡
,,▲,観光型旅館（経営者）,・首都圏に客の動きが出てきているが、どれだけそれを呼び込むことができるか不安である。
,,▲,都市型ホテル（スタッフ）,・金融不安の継続、地元商店街の老舗の倒産、株価の低迷、原油高で燃料の需要期に入ることから、消費は低迷する。
,,▲,住宅販売会社（従業員）,・来場者の中には、自己資金や年収などが十分でも、契約にまで前向きに進むような気力が薄れている。
,,×,一般小売店［雑貨］（企画担当）,・理由が分からないまま、各店舗の売上が低下している。
,,×,百貨店（売場主任）,・政局の不安定、株価の低迷、円安、米国の政治状況などいずれを取っても個人消費を冷え込ませるので、今後ますます厳しくなる。
"企業
動向
関連

(東北)",,◎,繊維工業（総務担当）,・前年同月比並の受注残高が予想されるが、今月との比較であれば、春夏物の生産が始まっているので、忙しくなる。
,,○,食料品製造業（経営者）,・品質、品目、価格設定など消費者ニーズに合った商品政策を取れば売上増は可能であるが、収益性の低下は避けられない。
,,□,食料品製造業（従業員）,"・お歳暮用品の動きが良い。
・消費者がシビアに金を使っており、使うときは使うが、その後は引き締める。"
,,□,電気機械器具製造業（経営者）,・依然として受注は、短納期、小ロットであり、小回りの効く企業体制の確立が急がれている。
,,□,電気機械器具製造業（企画担当）,・仕事は多く忙しいが、単価が低下している。
,,□,建設業（従業員）,・計画はあるが、前に進まない状況である。
,,□,輸送業（従業員）,・正月明けの反動で、荷動きは著しく落ち込む。
,,□,輸送業（従業員）,・12月末までは順調に貨物が動くと思っていたが、11月の伸びが悪かったので、先行き不安が出てきている。
,,▲,農林水産業（従業者）,・りんごは低単価商品であり、収入も少なく設備投資ができない。
,,▲,農林水産業（従業者）,・米作農家は、10月でほぼ収支決算が終わるが、収支が悪く年末に向けての購買が難しい状況である。
,,▲,建設業（企画担当）,・公共工事の量の縮小と工事費の引き下げが本格化しており、民間の設備投資にはその分を穴埋め、支える力はない。
,,×,－,－
"雇用
関連

(東北)",,◎,職業安定所（職員）,・今後も求人の増加傾向、求職者数の減少傾向が続く。
,,○,人材派遣会社（社員）,・今月は大手建設業から引き合いがあった。建設業からの引き合いは初めてであり、今後期待できる。
,,□,職業安定所（職員）,・求人数は多くなっているが、増えているのはパート求人であり、一般求人が増えなければ景気は良くならない。
,,□,職業安定所（職員）,・求人は今後も増加するが、一方でリストラも進ちょくする。
,,□,職業安定所（職員）,"・これから３か月は在職求職者及び雇用調整による求職者が増える。
・11月に出店した大型郊外店の影響が多少なりとも出てくる。"
,,□,職業安定所（職員）,・同じ業種でも、積極的に増員を進める企業と人員整理を行っている企業があり、好調、不調の格差が大きくなっている。
,,▲,職業安定所（職員）,・コンピュータ関連やホテル産業は景気が良いが、公共事業に依存していた事業所は民間ベースへの転換を迫られ、食品関係は厳しい経営を強いられるなど、求人動向にも影響を与えている。
,,×,－,－
,,,,
　３．北関東,,,,
,,,,（－：回答が存在しない、＊：主だった回答等が存在しない）
分野,,景気の先行き判断,業種・職種,景気の先行きに対する判断理由
"家計
動向
関連

(北関東)",,◎,－,－
,,○,乗用車販売店（営業担当）,・商品購入を控えている客が、現在積極的に検討しているため、３か月後はやや良くなる。
,,○,住宅販売会社（経営者）,"・モデルハウスへの来場や電話での問い合わせが増加している。
・契約を検討していた客が、決断の方向に向かっている。"
,,□,商店街（代表者）,・中心街の空き店舗の開店予定がいくつかあるが、新規店が集客に力を発揮するまでは時間がかかる。
,,□,百貨店（販売促進担当）,・お歳暮ギフトの立ち上がりが非常に悪い。年々後ろにずれ込む傾向があるが、このままの状態では前年並みの売上確保が難しい。
,,□,衣料品専門店（経営者）,・ボーナスが前年より少なくなっている。カードで購入する客のボーナス払いが減っている。どの程度ボーナスが出るか分からないので買物を控える、という客もいる。
,,□,乗用車販売店（従業員）,・先行きの不透明感が依然強く、年末ボーナスに期待できないため、個人消費が伸びない。
,,□,乗用車販売店（経営者）,・新型車の売行きは長続きしない。仮に販売台数が伸びても、利益が非常に少ない。
,,□,住関連専門店（店長）,・１人当たりの買上点数の減少や客単価の低下が続いている。
,,□,タクシー運転手,・年金が減った影響で、より一層客の財布のひもが固くなっている。
,,□,通信会社（営業主任）,・デジタル放送の開始によって、通信、放送業界は上向くが、開始直後の１、２月は厳しい。
,,▲,スーパー（統括）,・幕張の外資スーパーの進出に伴い、大手スーパー各社が価格的な対抗策をとるため、商品単価がダウンし、価格競争が激化する。その影響で、売上、収益が圧迫される。
,,▲,衣料品専門店（統括）,・大型のスーパーやショッピングセンターの郊外進出によって、街に客が流れてこない。
,,▲,衣料品専門店（販売担当）,・客から、パート先で勤務時間が短縮されたという話を聞く。収入が減ると、今後の消費動向に悪影響が出る。
,,▲,都市型ホテル（スタッフ）,・予約状況が悪く、団体客やリピーターが少ない。
,,▲,旅行代理店（従業員）,・受注状況が悪く、単価も低いので先行きが不透明である。
,,▲,ゴルフ場（支配人）,"・今後適用される冬期割引料金が先行し、年末の予約状況が悪い。
・会員券市場も値下がりが続いている。"
,,×,コンビニ（店長）,・大型店の開店予定があるため、周辺の商店街も含めて非常に悪くなる。
"企業
動向
関連

(北関東)",,◎,－,－
,,○,一般機械器具製造業（経営者）,・受注した新規部品の生産が急速に本格化している。
,,○,輸送用機械器具製造業（総務担当）,・受注が増加しており、来年度の設備投資も計画している。
,,○,輸送用機械器具製造業（経営者）,・親会社からの見積依頼や発注が、最近かなり増加してきている。
,,○,経営コンサルタント,"・新世紀への期待を込め、新規プロジェクトの立ち上げや人材確保を行っている企業がいくつかある。
・先見性の高い企業は従業員のスキルアップ教育導入の検討を行っている。"
,,□,輸送業（統括）,・クリスマスや年末年始の季節商材輸送量の受注見積が前年と変わらない。
,,□,新聞販売店［広告］（総務担当）,・印刷業界の年末受注状況は、例年になく良いと聞くが、悪い業界もあるので、平均すると変わらない。
,,▲,プラスチック製品製造業（経営者）,・国内の政治問題や世界経済の下降等の不安材料があるため、やや悪くなる。
,,▲,電気機械器具製造業（経営者）,・ＩＴ関連の設備投資についての１～３月の大手メーカー見積が９～12月の半分となっている。仕事は増えているが、全般的にＩＴ関連の受注が落ちてきている。
,,×,建設業（総務担当）,・知事選で公共事業の見直しを唱えている候補が当選し、公共工事中心の建設会社では、先行きに不安を感じている。
"雇用
関連

(北関東)",,◎,－,－
,,○,学校［短期大学］（就職担当）,・中堅の卸売業や小売業、サービス業等から求人の追加に関する問い合わせがある。
,,□,人材派遣会社（経営者）,・派遣需要は増加しているが、ＩＴ関連企業からの需要に偏っているため、全体としては変わらない。
