Ⅱ．景気の先行きに対する判断理由,,,,
,,▲,職業安定所（職員）,"・雇用保険資格取得者よりも、資格喪失者が多く、受給資格決定者数や受給者数も増加傾向にある。
・建設業、不動産業の求人が前年より少ない。"
,,×,－,－
,,,,
　４．南関東,,,,
,,,,（－：回答が存在しない、＊：主だった回答等が存在しない）
分野,,景気の先行き判断,業種・職種,景気の先行きに対する判断理由
"家計
動向
関連

(南関東)",,◎,－,－
,,○,一般小売店［ＣＤ］（営業担当）,・年末向けの商品が発売されて、まとめ買いをする客も増加している。
,,○,百貨店（売場主任）,・そごうの倒産により客が流れてきているため、引出物が好調であり、今後もしばらくこの状況が続く。
,,○,スーパー（統括）,・冬のボーナス支給が前年より増加し、若干購買意欲にもつながってきている。12、１月の商戦に期待している。
,,○,乗用車販売店（販売担当）,"・バブル時代に購入した商品が買換え時期にきている。
・節約してきた公務員の購買意欲が上向いてきている。"
,,○,旅行代理店（従業員）,・海外旅行の客を中心に、３か月先の先行受注が良くなっている。
,,○,その他サービス［語学学校］（総務担当）,・入校状況、クライアントとの話から、景気は少し上向いている。
,,□,商店街（代表者）,・依然として消費者の購買意欲が減退している。
,,□,一般小売店［茶］（経営者）,・商店街連合会、商工会議所が第３回プレミアム付商品券を発売したが、２、３時間で売り切れた。特に、主婦は２回並んで購入した。主婦が厳しい経済状況に非常に敏感になっている。
,,□,百貨店（買付担当）,・新世紀を迎え、新しいトレンドの春物商材に売上増加を期待する。しかし、無駄な物は買わない、安価な商品を選ぶという客の消費に対するシビアな行動はより強まっている。
,,□,百貨店（企画担当）,・必要な物だけを買う客が多く、まとめ買い、衝動買いが少ない。
,,□,百貨店（営業担当）,・来客数は増加傾向にあるものの、平均客単価は依然低く、低価格志向は続いている。
,,□,百貨店（販売促進担当）,・お歳暮シーズンであるが、法人需要は依然冷え込んでおり、苦戦が予想される。本格的な回復はまだまだ先になる。
,,□,百貨店（企画担当）,"・婦人用品の中で、特にカシミヤストールが比較的売れている。
・お歳暮ギフトのスタートは良くなく、２､３か月後も同じような状況で推移する。"
,,□,スーパー（経営者）,"・食品では、12月が終わり収入等が確定したら、その範囲内で支出する考え方が強い。
・現在売れているのは、納豆など低価格でも食事ができ、健康にも良いものであり、この点は今後も変わらない。"
,,□,スーパー（店長）,・客は冬物処分を待っている状況である。客は本当に必要な物しか購入しない。
,,□,スーパー（店長）,・客単価は前月同様に低下しており、この傾向は継続する。
,,□,コンビニ（店長）,・年賀はがき、贈答品の動きがあまり良くないので変わらない。
,,□,衣料品専門店（店長）,・商品の単価は下がっており、買上点数も増加していない。客の買い控え傾向が今後も続く。
,,□,衣料品専門店（経営者）,・メーカーからの仕入れで、非常に安価な婦人服が増加している。デパートからの返品が増えているということで、先行きが不安である。
,,□,家電量販店（店長）,・12月１日からデジタル放送が始まり、販売側として期待している。問い合わせも多いが、まだ値段が高く、消費者も様子をみている。
,,□,その他専門店［眼鏡］（店員）,・金枠、ジュエリー関係の高額品のフレームで、非常に動きが悪い。通常のフレームでも、単価は300円程度低下している。レンズだけ交換して欲しいという客も目立つ。
,,□,その他専門店［ガソリンスタンド］（団体役員）,・暖冬傾向が続いているため灯油の消費が落ち込み、悪い状態で変わらない。
,,□,その他小売［雑貨卸］（経営者）,・デジタルカメラが好調であるが、ピークに差しかかっている。フィルム、カメラは、長い低迷から脱していない。
,,□,高級レストラン（支配人）,・新規顧客が少なく、医薬業界のパーティー程度しかない。既存顧客の客単価も上昇しないので、平均すると変わらない。
,,□,一般レストラン（支配人）,・忘年会、新年会の予約が入り始めているが、前年と比べ宴会の小人数化、コース料理の低価格化現象がみられる。
,,□,都市型ホテル（スタッフ）,・景気の良い業種は、目立つことを避けてホテル利用を控えている。
,,□,通信会社（営業担当）,・ＣＡＴＶやインターネットの需要は堅調だが、競争激化と客の低価格志向が強い。
,,□,通信会社（社員）,"・個人客は安い物を求めており、通信会社を選ぶマイラインが今後選択されそうである。
・企業から経費節減の見積を要求されることが多い。"
,,□,その他サービス［学習塾］（経営者）,・毎月の入塾テスト受験者数が横ばいである。
,,□,住宅販売会社（従業員）,・住宅ローン減税の行方がまだみえない。
,,▲,スーパー（経営者）,・客の購買意欲が減少している。
,,▲,コンビニ（店長）,・多くの商品を買う客は少なく、ほとんどの客が３点以下の買物である。
,,▲,衣料品専門店（経営者）,・取引先メーカーでも最近は商品が少なく、売れないことを前提としている。
,,▲,住関連専門店（営業統括）,・ボーナス等の大幅なアップも見込めないなか、現金を持っている方が当面良いという雰囲気があり、消費の拡大が見込めない。
,,▲,一般レストラン（経営者）,・マスコミが消費不況を騒ぎ立てており、消費者心理に影響を及ぼしている。
,,▲,タクシー運転手,"・客の帰宅が依然として早く、他の交通機関で帰っている。
・会社の交際費が少ない。"
,,▲,住宅販売会社（従業員）,・新築を計画する新規顧客が落ち込んでいる。
,,×,コンビニ（経営者）,・確実に売上が落ちている。今のところ良くなってくる要因が周辺にない。
,,×,スナック（経営者）,・来客が少なく、ひまで遊ぶ日が多くなった。
"企業
動向
関連

(南関東)",,◎,－,－
,,○,輸送用機械器具製造業（経営者）,・アジアの景気も回復し、今後良くなる兆しがある。
,,○,通信業（営業担当）,・国の補正予算が成立すると、客からの受注が見込めるため、やや良くなる。
,,○,金融業（渉外担当）,・半導体関連の企業の中には新規設備投資の話も出てきている。業界によって差はあるが、今後は良くなってくる。
,,○,その他サービス業［情報サービス］（従業員）,・高速データ通信回線の要望など、企業の情報関連投資拡大の動きが多い。
,,□,出版・印刷・同関連産業（営業担当）,・年賀状の印刷、ゴム印の需要はないが、インターネット経由での通信販売部門の注文が増加している。
,,□,一般機械器具製造業（経営者）,・新規の受注も増加していないため、現在の状態が続く。
,,□,電気機械器具製造業（経営者）,・進行中の商談にはまとまった物件がなく、不安が常につきまとう。
,,□,不動産業（総務担当）,・業種によってオフィス需要にばらつきはあるが、特に金融系のテナントで、リストラ、統廃合によって賃貸スペース縮小への動きが若干みられる。
,,□,その他サービス業［情報サービス］（従業員）,・ｅコマースやウェブ関連の仕事は増加しているが、他の部分が伸び悩んでおり、やや元気をなくし始めている。
,,▲,金属製品製造業（総務担当）,・受注残が少なくなっている。
,,×,一般機械器具製造業（経営者）,・大手企業の受注額の減少が、リストラや外注費削減の原因になっている。
,,×,通信業（経営者）,・新しい受注の目途が立たない。
"雇用
関連

(南関東)",,◎,人材派遣会社（社員）,・派遣スタッフに対する求人需要が非常に多く、正社員でも採用したいという話が増加している。しかし、派遣スタッフを探してもなかなか人がいない。
,,◎,民間職業紹介機関（経営者）,・客は人事政策上の課題解決のために、多様な採用を考えている傾向がみられる。
,,○,職業安定所（職員）,・景気の見通しが立たない時期は期間雇用、臨時雇用という常用でない求人が増加するが、その割合が前年度比で10％以上低下し、常用の割合が上昇している。
,,□,人材派遣会社（社員）,・稼働日数の減少や時間の短縮、催事の減少に伴う依頼数の減少で求人の条件が良くない。そのため、広告費をかけても適格な人材が見つからないことがある。
,,□,職業安定所（所長）,・求人者数はこの３か月増減を繰り返しているが、求職者数、雇用保険受給者数は微増を続けている。
,,□,職業安定所（職員）,・求人は上昇傾向にあるが、生活費補充のためにパートを希望する求職者もいるため、全体では変わらない。
,,□,職業安定所（職員）,・情報関連産業を中心とした成長業種以外の従来型産業で、事業再構築への取組に依然活発な動きがみられず、これらの産業の人材需要は低迷している。従来型産業は、人材削減、製造拠点集約、業態の転換への取組を続けている。
,,□,学校［専修学校］（就職担当）,・どちらかといえば合理化をするための採用が多く、また採用形態を正社員からアルバイト、契約社員という話も非常に多い。
,,▲,－,－
,,×,－,－
,,,,
　５．東海,,,,
,,,,（－：回答が存在しない、＊：主だった回答等が存在しない）
分野,,景気の先行き判断,業種・職種,景気の先行きに対する判断理由
"家計
動向
関連

(東海)",,◎,－,－
,,○,一般小売店［土産］（経営者）,・無駄使いせず上手に金を使う客が増加している。
,,○,百貨店（売場主任）,・ランドセルの問い合わせが例年以上に多く、欲しい物はより早く確実に買おうとする傾向にある。
,,○,百貨店（販売促進担当）,・来客数が徐々に回復しつつある。
,,○,百貨店（販売促進担当）,・売上の前年比増減率が前年を下回っているものの、横ばいになっている。
,,○,家電量販店（店長）,・パソコンの価格帯が10万円前後から14～15万円へと徐々に上昇している。
,,○,乗用車販売店（従業員）,・無駄使いはしないが、自分の欲しい物は積極的に購入する。
,,○,乗用車販売店（営業担当）,・来客数が増加している。
,,○,住関連専門店（店員）,・客単価は低下しているが来客数に回復がみられ、売上が増加傾向にある。
,,○,一般レストラン（スタッフ）,・新世紀を迎えることにより、年明け以降の支出が見込める。
,,○,旅行代理店（従業員）,・個人客を中心に活発な動きが出てきている。
,,○,通信会社（営業担当）,・パソコンを利用したインクジェット年賀葉書が売り切れたことから、ＩＴ関連の動向が今後の景気に影響を与える。
,,○,通信会社（社員）,・通話料の値下げ、割引サービス拡大によりインターネット利用者が増加していく。
,,○,設計事務所（経営者）,・設計の相談件数は減少しているが、内容は確実なものが増加している。
,,○,住宅販売会社（従業員）,・マンションの竣工、引渡しラッシュを迎え、実物をみて購入する慎重派の需要もプラスされる。
,,□,商店街（代表者）,・必要以上の品物は買わず、来客数の増加も期待できない状況が続く。
,,□,商店街（代表者）,・郊外の大型スーパーの出店が終了したため、現状維持が続く。
,,□,百貨店（売場主任）,・慎重に品定めする客が多く、売上の低迷傾向は続く。
,,□,百貨店（企画担当）,・雇用問題など具体的な不安材料を持つ客が多く、消費マインドは向上しない。
,,□,スーパー（店長）,・消費者が景気の悪さに慣れてしまっており、財布のひもはなかなか緩まない。
,,□,スーパー（店長）,・低単価へのニーズが非常に強く、今後もこの状況は続く。
,,□,スーパー（店員）,・食料品にすら買い控えをする傾向が続いている。
,,□,コンビニ（エリア担当）,・客単価の伸び悩みは続く。
,,□,コンビニ（エリア担当）,・平均気温が高く、暖冬の予想のため、例年売れるカイロ、入浴剤、マスクなどが売れない状態が続く。
,,□,コンビニ（店長）,・来客数に変化がない一方で売上単価は低下し、競争の激化も続く。
,,□,衣料品専門店（企画担当）,・客単価の低下が続く。
,,□,家電量販店（経営者）,・大店立地法に伴い出店が過剰ぎみであるが、家電リサイクル法の施行による駆け込み需要が予想される。
,,□,乗用車販売店（経営者）,・ローンを避ける傾向に変化はなく、単価低迷は続く。
,,□,乗用車販売店（営業担当）,・チラシを出しても来客数が増加してこない。
,,□,住関連専門店（営業担当）,・全体的には安くて良い商品の追求が進んでおり、数量は増加しても売上や利益が伸びない状況が続く。
,,□,その他小売［総合衣料］（店員）,・低価格傾向に変化がみられない。
,,□,高級レストラン（スタッフ）,・法人客は忘年会を中止するところもみられ、個人客は忘年会を昼に開催するケースが増加している。
,,□,スナック（経営者）,・忘年会や新年会の予約が例年に比べて少ない。
,,□,観光型ホテル（スタッフ）,・予約状況は良いものの、宿泊は遠距離からの予約が少なく食堂も低単価志向で、全体としてあまり変わらない。
,,□,都市型ホテル（スタッフ）,・宴会の直前予約は増加しているが、将来の予約が減少している。
,,□,タクシー運転手,・チケット利用の法人客はまだ厳しいものの、無線の注文や高齢客が増えているという明るい材料はある。
,,□,通信会社（社員）,・インターネット利用は増加しているが、全体的にはあまり変化がない
,,□,テーマパーク（職員）,・来客数は多いが、売上は前年を下回っている。
,,□,パチンコ店（店長）,・以前の稼働時間、客単価に戻ってきており、今後数か月間はこのレベルで推移が続く。
,,□,住宅販売会社（営業担当）,・ゆっくり考えてから、住宅を建築する慎重な客が多い。
,,□,住宅販売会社（企画担当）,・購入希望予定者にも長期ローンには不安があり、なかなか成約には至らない。
,,▲,百貨店（売場主任）,・暖冬で衣料品を買う意欲が感じられない。
,,▲,スーパー（店長）,・暖冬傾向が続くと冬物のバーゲン時期が早まり、小売業にとっては利益が確保しづらくなる。
,,▲,コンビニ（経営者）,・必要な物を安く必要なときにしか買わない傾向が一層強まる。
,,▲,乗用車販売店（従業員）,"・来客数は変わらないものの、今まで商談のときに口を出すことが少なかった奥さんが、金額に対して非常にシビアになっているので、値引き要求が厳しくなっている。
・ボーナス時期の割に来客数が少ない。"
,,▲,都市型ホテル（スタッフ）,・正月の宿泊予約は順調に入っているが、それ以外の宿泊、宴会はともに予約が少ない。
,,▲,旅行代理店（従業員）,・個人の低価格志向が相変わらず続いており、企業の団体旅行は宿泊が減少し日帰りが多くなってきている。
,,×,百貨店（売場主任）,・一部の業種は好調が伝えられているが、企業倒産も増えており、消費へのガードがますます固くなっている。
,,×,住宅販売会社（従業員）,・金利動向よりも先行きの雇用不安の方が客に購入の決断を鈍らせる状況になっている。
"企業
動向
関連

(東海)",,◎,－,－
,,○,化学工業（企画担当）,・取引先企業では新規の引き合いが増え始めている。
,,○,電気機械器具製造業（経営者）,・取引先から悪くなる話は聞かない。
,,○,輸送業（エリア担当）,・来春に向けて、大型貨物の輸送計画が数件入ってきている。
,,○,経営コンサルタント,・事務所への入居が増加しており、今のうちに活動拠点を押さえておくといった動きがみられる。
,,□,食料品製造業（企画担当）,・消費者の根強い低価格志向に影響を受け続ける。
,,□,プラスチック製品製造業（従業員）,・仕事の良好傾向が予想される。
,,□,建設業（企画担当）,・マンション、医療・福祉分野に仕事が偏っているのが現状であり、各社のコストダウン競争が激しくなるだけで状況は変わらない。
,,□,建設業（総務担当）,・製造業の客から建設工事を受注する機会が多くなった等、他の業種は良くなっているが、建設業における工事量は少ない。
,,□,輸送業（エリア担当）,・引越しの問い合わせ件数が増加し取扱物量も前年より上回っている状況だが、収入が増加しているわけではない。
,,□,輸送業（従業員）,・原油価格の高騰により、燃料コストが高くなっているが、新世紀に向けイベントが増加するため、全体では変わらない。
,,□,税理士,・法人は予算の支出管理を徹底しており、個人事業主も経費支出は極力抑える傾向が続く。
,,▲,化学工業（総務担当）,・建設業界の落ち込みが受注量に影響してくる懸念がある。
,,▲,電気機械器具製造業（経営者）,・取引先で建設業関連の仕事がかなり減少しており、先行きを警戒している。
,,▲,建設業（経営者）,・住宅部門の受注状況に先行き不透明感が出ており、厳しい状況になっている。
,,×,食料品製造業（企画担当）,・需要の落ち込みのため、大手企業がなりふり構わず攻勢に出ており、今後その動きが加速する。
"雇用
関連

(東海)",,◎,－,－
,,○,人材派遣会社（社員）,・今後も高い人材派遣需要が続く。
,,○,民間職業紹介機関（エリア担当）,・自動車部品メーカーの求人が今後も増加する。
,,○,学校［大学］（就職担当）,・新規学卒者の定期採用や既卒者の求人のみならず、現３年生に対する求人が早くも出ている。
,,□,アウトソーシング企業（エリア担当）,・受注は旺盛だが、人手不足が深刻である。労働力が確保できないために受注が売上に結びつかない。
,,□,求人情報誌製作会社（編集者）,・大手企業の求人はまだ増加しているが、中小企業の採用は止まってきている。
,,□,職業安定所（所長）,・有効求職者や雇用保険受給者数が横ばい状態にある。
,,□,職業安定所（職員）,・有効求人倍率は改善傾向にあるが、子会社の解散、工場閉鎖などが見込まれている。
,,□,職業安定所（職員）,・新規求人が増加傾向にある一方で、人員整理も続いている。
,,▲,新聞社［求人広告］（担当者）,・雇用情勢はＩＴ技術者などの高度な求人とパート、アルバイトなどの求人に二極化する傾向にあり、求人は活発であるが求職者がいない状況にある。逆に専門分野以外の求職者は多いが、求人は採用手控えにあり、雇用のミスマッチが拡大している。
,,▲,職業安定所（職員）,・求人倍率は徐々に回復していくと思われるが求人条件は依然として厳しく、雇用状況の改善は認められない。
,,▲,職業安定所（職員）,・倒産や人員整備の企業情報がある。
,,×,－,－
,,,,
　６．北陸,,,,
,,,,（－：回答が存在しない、＊：主だった回答等が存在しない）
分野,,景気の先行き判断,業種・職種,景気の先行きに対する判断理由
"家計
動向
関連

(北陸)",,◎,家電量販店（経営者）,・情報商品の中でパソコンあるいは携帯電話の売行きが１、２か月前に比べて大変良くなっている。12月から始まるＢＳデジタル放送などを含めて情報関係の商品が将来的に大変期待が持てる。
,,○,家電量販店（店長）,"・ＢＳデジタル放送が徐々に周知されてくるので、関連の需要が出てくる。
・４月から始まる家電リサイクル法施行前の需要の前倒しがある。"
,,○,自動車備品販売店（従業員）,"・10、11月の需要のずれ込みに加えて、年末年始の必需品の取扱も多く、自動車の売行きの好調によるプラス影響も大いに期待できる。
・来客数、買上客数、客単価もアップし、高額商品の売行きも順調になる。"
,,○,一般レストラン（店長）,・2001年は良くなるという客の会話が多くなっている。
,,○,通信会社（社員）,・年末年始にかけて、インターネット関連の新サービスが受けられる携帯の新機種が発売されるので、需要が徐々に立ち上がる期待感がある。
,,○,住宅販売会社（従業員）,"・戸建て需要は少し増加しており、その建て替え需要は非常に安定している。
・正月に向けて中型又は小型のリフォーム工事が、例年以上に若干活発に出ている。"
,,□,商店街（代表者）,・大型ショッピングセンターに隣接した量販店が今月後半にオープンしたが、その影響を考えると良くはならない。
,,□,一般小売店［果物］（経営者）,・客に購買意欲がないため、買いたいのか、要らないのか、態度があいまいである。
,,□,百貨店（営業担当）,・必要な物しか買わない傾向があり、また高額品の売行きが悪い。
,,□,スーパー（店長）,・消費傾向は非常に落ち込んでおり、倹約するところは徹底して倹約していくという様子がうかがえる。
,,□,コンビニ（経営者）,"・同業者との競争も激しいが、最近はスーパーとの時間競争も激しくなっている店がかなりある。
・来客数、来客頻度、客単価も現状維持もしくは若干下がっている。"
,,□,乗用車販売店（経営者）,・新型車、人気車、低価格車が相変わらず売れている。
,,□,乗用車販売店（営業担当）,・毎年この時期に行う当社の客向けの調査によれば、「来年春に買換えたい」、「購買意欲がある」という回答が例年に比較して減少気味である。
,,□,住関連専門店（店長）,・チラシによる販促期間中でもそれほど売れなくなっている。
,,□,観光型旅館（経営者）,・消費者の将来に対する不安感は相変わらず厳しく、それだけに旅行などの増加はあまり期待できない。
,,□,都市型ホテル（経営者）,・宴会は、予約件数、来客数ともに前年と変わらない。
,,□,タクシー運転手,・客の話の中で、会社の飲み会でも２次会へは行かず、電車のあるうちに帰宅すると聞く。
,,□,テーマパーク（経営者）,・個人の来場客数が若干減少している状態が続く。
