Ⅱ．景気の先行きに対する判断理由,,,,
,,▲,その他企業［タオル］（団体職員）,・輸入数量がますます増加しており、産地のメーカーへの受注量の回復が全く見込めない。
,,×,繊維工業（経営者）,・連鎖倒産の不安があり、買い控えがかなり進んでいる。
"雇用
関連

(近畿)",,◎,人材派遣会社（社員）,・ＩＴ産業を中心にネット証券やテレホンバンキング等、業容を拡大している傾向がみられる。
,,◎,求人情報誌製作会社（編集者）,・特に製造業の求人件数が増加しており、他業界への波及も期待できる。
,,○,人材派遣会社（社員）,・周辺で起業が非常に活発である。
,,□,人材派遣会社（経営者）,・全体的には若干ながら上向きの兆しはみられるが、具体的な好調要因は見当たらない。
,,▲,＊,＊
,,×,－,－
,,,,
　６．九州,,,,
,,,,（－：回答が存在しない、＊：主だった回答等が存在しない）
分野,,景気の先行き判断,業種・職種,景気の先行きに対する判断理由
"家計
動向
関連

(九州)",,◎,家電量販店（企画担当）,"・今年は天候が良いようなので、エアコンが良く出ている。
・パソコンも好調である。"
,,○,商店街（代表者）,・ボーナス時期でもあるので多少期待はできるが、大きな伸びはないと思う。
,,○,高級レストラン（スタッフ）,・リストラは進むが、大企業では夏のボーナスが去年よりも良さそうであり、消費も増加する。
,,○,テーマパーク（職員）,・夏休みを迎え、プール等施設利用客の増加が見込める。
,,○,パチンコ店（従業員）,・全体的な景気対策の効果が出始め、夏に向けてボーナスも出るので、今より良くなっている。
,,○,旅行代理店（従業員）,・夏休み等で家族旅行が増える見込みであり、またＹ２Ｋ問題による旅行控えの反動で海外旅行が増加する。
,,○,住宅販売会社（従業員）,・業界では来年６月まで減税が続くことから、若干上向くとみられる。
,,□,商店街（代表者）,・来街者が少なく、なかなか人が戻ってこない。
,,□,商店街（代表者）,・小売業については、消費者側の雇用問題、介護保険の負担金の増加で、出費を最小限に抑えられている。
,,□,百貨店（売場主任）,・ボーナスの時期に入るが支給額も減少しているようであり、今後に期待はできない。
,,□,スーパー（店長）,"・目的外の物を衝動的に買わない傾向が続いている。
・価格や時期的な要因により当たる時もあるが、それ以外は苦しい状況が続いている。"
,,□,家電量販店（店長）,・パートの求人を行うと相変わらず新卒の応募が多い。
,,□,一般レストラン（経営者）,・サミットがあるが、波及効果は期待できない。
,,□,一般レストラン（スタッフ）,・常連客が減り、市内でイベントがある時以外は、客は減少している。
,,□,ゴルフ場（支配人）,・土曜日のコンペも非常に少なく、明るい材料は見当たらない。
,,□,競輪場（職員）,・客の所得が増えていない状況では、３か月先も良くなるとは期待できない。
,,□,タクシー運転手,・昼間の客は増加しているが、夜は閉店時間が早くなったため、12時ごろには客がいない。
,,□,住宅販売会社（従業員）,・展示会等の集客はかなりあるが、契約まで結びつかない。
,,▲,一般小売店［精肉］（経営者）,・一般消費者が出費を手控えており、消費する金額が減少している。
,,▲,百貨店（営業担当）,・３、４月は持ち直すように思われたが、急に悪くなってきている。株価の下落や更なるリストラ等で厳しい状況が続く。
,,▲,スナック（経営者）,・夏場に向かい日が延びるので客の出足も遅くなり、客数も減ってくる。
,,×,＊,＊
"企業
動向
関連

(九州)",,◎,－,－
,,○,電気機械器具製造業（経営者）,・半導体関連の引き合いが増えるなか、今後やや良くなると確信している。
,,□,一般機械器具製造業（経営者）,・半導体、情報通信関連分野がどれだけ景気を引っ張れるかが課題である。
,,□,電気機械器具製造業（経営者）,・今の景気の良い状態が続く。
,,□,精密機械器具製造業（経営者）,・新規の引き合いがまだまだ増えつつある状況なので、この状態が続くとみられる。
,,□,輸送用機械器具製造業（営業担当）,・設備投資をするまでもないが、現状のままフル稼働する仕事量が２、３か月先も続きそうである。
,,□,広告代理店（従業員）,・現在の状況が大変良いので、これ以上良くなるとは思えない。
,,▲,電気機械器具製造業（経営者）,・今月、来月がピークなので、３か月後は受注が減少している。
,,×,＊,＊
"雇用
関連

(九州)",,◎,－,－
,,○,求人情報誌製作会社（総務担当）,・新卒がどうなるかわからないが、中途採用及び派遣に関しては微増である。
,,○,新聞社［求人広告］（担当者）,・ＩＴ関連の事業を始めたいなど、周りに明るい話題が増えてきている。
,,□,＊,＊
,,▲,－,－
,,×,－,－
