Ⅱ．景気の先行きに対する判断理由,,,,
,,○,農林水産業（経営者）,・加工メーカーは在庫を持たない考えだが、４、５月は生産期で期待ができる。
,,○,輸送用機械器具製造業（経営者）,・依然単価としては厳しいが、受注量が増加している。原材料の入手が一部ではあるが困難になってきた。
,,□,一般機械器具製造業（経営者）,・景気は底入れしているようだが、仕事の波が激しい。
,,□,輸送用機械器具製造業（経営者）,・受注はあるが、金額的には非常に厳しい。
,,□,広告代理店（従業員）,・景気が良くなると新聞の折込チラシが増加するが、そうした兆しがみえない。
,,□,経営コンサルタント,・業務拡大の相談より、リストラに関する相談が多い。
,,▲,食料品製造業（経営者）,・４月から航空運賃の団体割引が廃止され、観光客向け商品販売の減少が見込まれる。
,,▲,その他製造業［窯業土石製品］（経営者）,・公共事業に頼った受注なので、終了後は仕事の発注もなくなるのではないか。
,,▲,輸送業［陸上貨物］（従業員）,・力を入れていなかった営業に社長が力を入れ出したが、それでもさえない。
,,×,＊,＊
"雇用
関連

(九州)",,◎,?,?
,,○,人材派遣会社（社員）,・顧客である企業からの問い合わせの中で、サービス等の徹底を行う社内教育にかなり金額をかけている気がする。
,,○,人材派遣会社（社員）,・求人も増え、採用を抑えていた会社も採用を始めた。
,,□,求人情報誌製作会社（総務担当）,・中途採用人数が横ばい。採用を行う会社と行わない会社の二極化がみられる。
,,□,新聞社［求人広告］（担当者）,・求人がＩＴ関連の業種に偏っている。
,,□,新聞社［求人広告］（担当者）,・３月決算期の企業が多いため、４月以降の景気の見通しがはっきりしない。
,,▲,－,－
,,×,－,－
