Ⅱ．景気の先行きに対する判断理由,,,,
,,▲,コンビニ（店長）,・来客数、客単価ともに落ち込んでいる。台風の季節となり、１年を通じて、ますます来客数が減少する。
,,▲,衣料品専門店（経営者）,・１年を通じて最も販売が増加するシーズンとなるが、夏の状況から来客数、販売数量ともに期待できない。
,,▲,一般レストラン（業務担当）,・予約は、前年比で５～10％程度下回っている。
,,▲,一般レストラン（経営者）,・来客数は、県外客、地元客ともに減少傾向にある。
,,▲,都市型ホテル（スタッフ）,・他店の新規出店もあり、婚礼、宴会の予約の入込が悪い。
,,▲,タクシー（経営者）,・夏休みの人出が悪く、盆時期も売上が低下しているため、このままいくと９月以降やや悪くなる。
,,▲,タクシー運転手,・駅に家族を迎えにくる車が増加している。深夜11時を過ぎると、以前は２、３台であった迎えの車が、今は20～30台待機している。タクシーの仕事は減る一方である。
,,▲,遊園地（職員）,・競合他社のオープンに伴い、業況はやや悪化する。
,,▲,その他サービス［自動車整備業］（事務長）,・客の町工場経営者が、経費削減のため、所有する11台の車輌のうち５台を廃車にする。
,,▲,住宅販売会社（経営者）,・モデルハウスやイベントへの来場者数は減少しており、今後もこの傾向が続く。
,,×,一般小売店［金物］（経営者）,・取引先や地元のＩＴ関連企業の廃業、倒産の動きが出てきている。
,,×,コンビニ（店長）,・客は商品ごとに店を選別しており、商品に対するコスト意識が高くなっている。
,,×,高級レストラン（経営者）,・同業者の状況、仕入先の倒産から考えて、悪くなる。
,,×,一般レストラン（店長）,・客に聞くと、リストラやボーナスカットなどの話が出ており、これから先も厳しくなる。
,,×,スナック（経営者）,・回復の兆しがみえず、状況は相当に深刻である。これほどひどい状況は初めてである。
,,×,観光型ホテル（スタッフ）,・ビジネス客が減少している。
,,×,都市型ホテル（スタッフ）,・客の業況は悪く、宿泊、会議、懇親会の全ての部門で、業績が低下しつつある。
,,×,ゴルフ場（支配人）,・取引業者のコンペ予約数は、前年実績には全く到達しない。特に、建設業者の予約が少ない。一度入った予約が、１週間前にキャンセルされることも考えられる。
,,×,住宅販売会社（経営者）,・不動産価格の下落で銀行の担保価値が上がらないのも、景気を悪くしている原因である。
"企業
動向
関連

(北関東)",,◎,－,－
,,○,一般機械器具製造業（経営者）,・新規製品の受注量が計画より多くなっており、やや良くなる。
,,□,食料品製造業（製造担当）,・主力の得意先向けの売上が低迷している。
,,□,プラスチック製品製造業（経営者）,・盆休みの影響で売上が大きく減少しているが、今後も悪い状況で変わらない。
,,□,電気機械器具製造業（経営者）,・これ以上悪くなったら、会社の存亡の危機にかかわる。仕事が人件費の安い中国に移行してしまうため、生き残りをかけて、必死で国内に残る仕事を探している。
,,□,輸送用機械器具製造業（総務担当）,・受注量は横ばいか、やや減少傾向にある。
,,□,建設業（経営者）,・受注量増加の見通しが全くない。同業者の倒産も更に増加する。
,,□,経営コンサルタント,・受注や売上が大幅に増加する要素がない。販売商品やサービス、事業内容を見直し、客のニーズに迅速、かつきめ細やかに対応することで、辛うじて業績を維持している。
,,▲,食料品製造業（営業統括）,・消費マインドは落ち込んでいる。ワイン等のし好品は、安物に移行、あるいは買い控える状況である。
,,▲,化学工業（総務担当）,・取引先２社が従来の仕事から撤退する。今後、他社でも製造中止から撤退への動きは増加する。
,,▲,金属製品製造業（経営者）,・企業の設備投資に関する特別償却廃止問題が具体化すると、親工場も大きく生産を見直すため、やや悪くなる。
,,▲,一般機械器具製造業（生産管理担当）,・例年受注量が伸びる時期であるが、今年は前年の３分の２程度しか受注が取れない状況である。
,,▲,その他製造業［宝石・貴金属］（経営者）,・展示会で新商品を提案しているが、秋冬の商材に対する関心度が低く、取引先はぎりぎりまで仕入れを調整している。
,,▲,その他サービス業［情報サービス］（経営者）,・年末に向かい、例年であれば販促経費を使う時期となるが、今年はどこも経費削減で、受注の先行きが厳しい。
,,▲,その他サービス業［放送］（営業担当）,・企業が広告経費の節減、見直しを行っており、コマーシャル価格の値引要望が強くなっている。
,,×,電気機械器具製造業（経営者）,・仕事量を確保するため営業努力をしているが、先行きがみえない。特に、決算期の９月には、生産計画を縮小している取引先が多い。
,,×,建設業（総務担当）,・当社も、リストラ計画を具体化しなければならない状況である。
,,×,その他サービス業［情報サービス］（経営者）,・中小企業が一段と冷え込んでおり、情報化投資に陰りがみられる。大企業では投資の意欲はあるため、格差が更に広がる。
"雇用
関連

(北関東)",,◎,－,－
,,○,人材派遣会社（経営者）,・衣料品関係で、購買力を高める販売員や人材の派遣要請がある。派遣先では、時給を下げて、人数を増やして対応しているところが多い。
,,□,人材派遣会社（経営者）,・製造業の一流企業で業況が悪く、派遣依頼がない。
,,□,求人情報誌製作会社（経営者）,・受注状況に変化がない。
,,▲,人材派遣会社（経営者）,・求人数、派遣の長期契約が減少している。
,,▲,職業安定所（職員）,・受注の減少や業績不振による解雇者が徐々に増加しており、雇用保険受給者実人員も増加傾向にある。
,,▲,職業安定所（職員）,・求人数は減少しており、求職者は増加している。学卒求人も減少しており、最近は求人の取消しもみられる。
,,▲,学校［短期大学］（就職担当）,・合同就職面接会が行われたが、各種設計、ソフト開発など技術者の募集がほとんどで、他の採用予定はないという企業が目立っている。
,,×,人材派遣会社（社員）,・派遣先の契約解除、契約金額削減の要求がかなり増加している。契約を増やす企業もあるが、契約全体では減少している。
,,×,職業安定所（職員）,・求人数全体の中で大きなウェイトを占める製造業が冷え込んでおり、求人件数は減少傾向で推移している。
,,,,
　４．南関東,,,,
,,,,（－：回答が存在しない、＊：主だった回答等が存在しない）
分野,,景気の先行き判断,業種・職種,景気の先行きに対する判断理由
"家計
動向
関連

(南関東)",,◎,－,－
,,○,百貨店（売場主任）,・８月後半のリニューアル以降、客の動きが良い。９月初旬の再度のリニューアルで客も戻り、売上も増加する。
,,○,衣料品専門店（経営者）,・秋冬衣料は、質、単価ともに向上する。
,,○,高級レストラン（経営者）,・客からの問い合わせがかなり増加しており、２、３か月後には予約が入ってくる。
,,○,都市型ホテル（スタッフ）,・10～12月は繁忙期であることに加え、イベントの開催も予定されており、客室は満室となる。
,,○,旅行代理店（経営者）,・団体旅行が増え、９～11月の予約が入ってきている。
,,○,ゴルフ場（支配人）,・秋口の予約状況が比較的良い。
,,○,美容室（経理担当）,・10月からダイレクトメールを発送するので、来客数が増加し、売上も伸びる。
,,□,一般小売店［衣料・雑貨］（経営者）,"・商店街の入口に家電量販店がオープンし、商店街が活気付いてきている。
・衣料品の秋物の立ち上がりは悪くない。"
,,□,一般小売店［茶］（営業担当）,・今年の秋はダイレクトメールを出し、顧客の来店を促す計画である。
,,□,百貨店（企画担当）,・暖冬の影響により、衣料品の売上維持は期待できないが、売場を改装している化粧品やハンドバッグ、婦人靴等の婦人雑貨に売上増を期待している。
,,□,百貨店（営業企画担当）,・秋冬商材へ関心を寄せる客が一部にいる一方で、セールの特別提供品以外購入しない客もいる。消費の二極化が進んでおり、総じて景気動向は変わらない。
,,□,百貨店（販売促進担当）,"・この数か月、客の低価格志向が続いている。
・商品動向の良し悪しも月ごとに異なるなど、不透明な状態が続いている。"
,,□,百貨店（販売促進担当）,・キャリアやヤング向けの婦人服では動きが早い分、後半の伸びに期待できないが、ミセス関係が伸びてくるため、全体では変わらない。
,,□,スーパー（店長）,・競争激化による値引きで、粗利益の確保が難しくなっている。
,,□,家電量販店（店長）,・ヒット商品となるような製品の発売予定がない。
,,□,乗用車販売店（販売担当）,・新型車が投入され、来客数は増加するが、即座に受注には結び付かない。
,,□,乗用車販売店（営業担当）,・新型車と特別仕様車の投入により、現時点での好調さを維持出来る。
,,□,その他専門店［燃料］（統括）,・市況は良くなっているが、粗利構成は変わらない。
,,□,旅行代理店（従業員）,・２、３か月先の受注状況が前年並みである。
,,□,その他サービス［フィットネスクラブ］（支配人）,・通常では来館者数が増加する時期であるが、現状では入会者の獲得もままならない。
,,□,住宅販売会社（経営者）,・リストラで社宅を追い出される客が、住宅の購入に向かっている。ただし、将来の収入や雇用に不安があり、大きく変動することはない。
,,▲,一般小売店［家電］（経営者）,・大型量販店の開業、得意先の購入前倒しの影響でやや悪くなる。
,,▲,百貨店（企画担当）,・来客数が減少傾向にあり、減少割合は大きくなっている。売上数量も減少している。
,,▲,百貨店（営業担当）,・婦人服、婦人雑貨が、徐々に低迷し始めている。
,,▲,百貨店（営業担当）,・客に購買意欲はあるものの、メーカー側に体力がなく、客の望む商品を瞬時に提供できない可能性がある。客の購買意欲を駆り立てるような、新しい品そろえ、展開が出来にくくなってきている。
,,▲,スーパー（店長）,"・紳士用スーツを１着7,500円から販売するなど、単価の低下傾向は今後も続く。
・100円、500円均一ショップの品そろえが充実しているため、家庭用品等の売上が大きく減少している。"
,,▲,コンビニ（経営者）,"・猛暑で販売量が伸びた制汗化粧品以外に、伸びているものがない。
・次いで買いの減少、客単価の低下が更に進む。"
,,▲,コンビニ（店長）,・客は、限られた収入の中で、購入点数を減らしたり、安い物を買い求めたりしている。
,,▲,衣料品専門店（経営者）,・品質の高い低価格衣料が増加し、従来と同じ数量を販売するだけでは売上が減少していく。トレンド商品を販売しない限り、売上の増加は見込めない。
,,▲,家電量販店（店長）,・消費をけん引していたパソコン関係が暗転している。
,,▲,家電量販店（店長）,・年末にボーナスが出ないところも多いという話を聞いている。
,,▲,乗用車販売店（販売担当）,・荷動きが悪くなり、運賃単価も低下している。共同配送など合理化を図っているので、運送業は悪くなっていく。
,,▲,高級レストラン（支配人）,・予約が入らず、周りの客からも予算がないという話しか聞かない。
,,▲,旅行代理店（従業員）,・国内の宿泊や海外旅行商品の価格に関して、細かく質問されると同時に、必ず値切られる。
,,▲,旅行代理店（従業員）,・旅行の中止や、１泊から日帰りへの変更が、特に団体旅行で顕著にみられる。
,,▲,通信会社（営業担当）,"・インターネットの利用料金が大幅に低下している。
・参入業者が多く、競争が激化している。"
,,▲,通信会社（営業担当）,・解約、滞納、ケーブルテレビのみの加入という客が増加し、このまま下降線をたどる。
,,▲,通信会社（営業担当）,・ＡＤＳＬの価格が低下してきており、ＣＡＴＶインターネットの新規加入は、今後しばらく伸び悩む。
,,▲,その他サービス［学習塾］（経営者）,・夏期講習の参加者数が、前年比１割減となっている。
,,▲,住宅販売会社（従業員）,・来場者数が減少しており、客の購入計画内容も縮小している。
,,×,コンビニ（経営者）,・大型店が休日削減や夜11時までの営業時間延長を行うなか、小規模商店が良くなる見込みはない。
,,×,衣料品専門店（販売担当）,・ミセスを対象とする当店では、季節を先取りした購入が見込めない。
,,×,スナック（経営者）,・今までの常連客が来なくなっている。
,,×,都市型ホテル（スタッフ）,・秋から新年にかけての予約が少ない。パーティー等の計画中止や規模縮小があり、来客数の減少がはっきり予想できる。
"企業
動向
関連

(南関東)",,◎,＊,＊
,,○,電気機械器具製造業（経営者）,"・秋から冬にかけて、病院や高齢者施設向けの商品が売れる。
・ビルのリニューアル関連商品が、今後売上に結び付く。"
,,□,化学工業（従業員）,・生産予定数量にこの半年大きな変化はなく、今後も変わらない。
,,□,金属製品製造業（経営者）,・取引先の業況は、しばらく回復しない。
,,□,金融業（渉外担当）,・前向きな設備投資をするとの話もなく、当面は現状のままである。
,,□,その他サービス業［廃棄物処理］（経営者）,・倒産や廃業が多いが、廃棄物処理に関する問い合わせもあるので、相殺してそれほど変わらない。
,,▲,出版・印刷・同関連産業（営業担当）,・印刷に充てる予算が縮小、削減されたり、なくなったりしているという話を客から聞く。
,,▲,建設業（経理担当）,・今後の受注が見込める大型案件が見当たらない。
,,▲,輸送業（支店長）,・主な取引先である電気業界でリストラの計画が出るなど、取引先も大変厳しく、荷物の動きも鈍くなる。
,,▲,金融業（審査担当）,"・建設業を中心に、資金繰りが極めて悪化している。
・景気の先行きに対する不安を持つ経営者が多く、設備投資の意欲は、依然として低い。"
,,▲,金融業（営業担当）,・小売業では売上が低下していて、今後も売上増が見込めない。製造業では親会社の受注が減少しており、銀行も融資を渋っている。
,,▲,税理士,・顧問先10社へのインタビューで、８社が今後の景気は悪くなると回答した。建設業の受注の落ち込みや小売店の売上減を考慮すると、状況はまだ悪くなる。
,,×,金属製品製造業（経営者）,・注文を受けても、採算割れの仕事が多く、一層苦しくなる。
,,×,電気機械器具製造業（経営者）,・取引先からの見積物件の予算見直し、キャンセル等が増加している。
,,×,輸送用機械器具製造業（経営者）,・大手メーカーが、過剰在庫で発注を落としている。海外生産へのシフトも進んでいる。
"雇用
関連

(南関東)",,◎,－,－
,,○,学校［大学］（就職担当）,・前年度に比べ、現時点での求人件数が約200件多く、８月の追加募集の件数も約３倍近く増加しており、今後もこうした傾向が続く。
,,□,人材派遣会社（社員）,・大手得意先企業において、派遣を含めた採用に関し、積極的な行動が全くみられない。
,,□,学校［専修学校］（就職担当）,・情報関連職種や企業で採用が進んでおり、それ以外の業種、職種についての求人数等は変わらない。
,,▲,人材派遣会社（支店長）,・周辺では企業倒産やリストラが増加しており、雇用情勢は悪化する。
,,▲,職業安定所（職員）,・大量離職の相談に来る企業が継続的にあり、在職中の人が相談に来る割合も上昇している。
,,▲,民間職業紹介機関（経営者）,・スキルと年齢の両方がかみ合わないと、就職が決まらず、決まるまでの時間が長くなっている。
,,×,求人情報誌製作会社（企画担当）,・求人広告のキャンセルが増加している。
,,×,職業安定所（職員）,・ＩＴ関連産業の元請け、下請の段階で、大量解雇が出ている。今後、本体のリストラが進めば、更なる悪化が予想される。
,,,,
　５．東海,,,,
,,,,（－：回答が存在しない、＊：主だった回答等が存在しない）
分野,,景気の先行き判断,業種・職種,景気の先行きに対する判断理由
"家計
動向
関連

(東海)",,◎,－,－
,,○,百貨店（販売促進担当）,・ブランド商品などの高額品に動きが出てきている。今後このような動きが一般衣料品に波及する。
,,○,その他小売［総合衣料］（店員）,・単一的な安い商品に消費者が飽きてきており、値段が高くても独自性のある商品が求められてきているため、当社のような企業でリスクを取って商売をしていくと、商売チャンスが増えていく。
,,○,通信会社（社員）,・インターネット利用者の増加に加え、ＩＳＤＮやＡＤＳＬなどの料金値下げから、利用者の大幅増加が見込まれる。
,,○,その他サービスの動向を把握できる者［劇場］（職員）,・団体客がかなりの数で入場している。
,,○,その他住宅投資の動向を把握できる者［室内装飾業］（経営者）,・住宅着工件数が増加している。
,,□,百貨店（売場主任）,・七五三の問い合わせがある時期であるが、今年は少ない。お金をかけてきちんと行事ごとをする家庭が減少している。
,,□,百貨店（企画担当）,・欲しい物は値下げするまで待つ客が増加しているため、秋物商材の動きが鈍い。メーカーも定番商品の価格を従来より下げているため、客単価の低下は続く。
,,□,スーパー（店長）,・商品単価の下落が依然続いており、客の購買動向が今後良くなるような様子は全くない。今の消費傾向に客が慣れている。
,,□,スーパー（店員）,・他店との価格比較をかなりしている様子である。競合店から安くチラシが出れば、同時に売出しをしたその日でも、競合店へ流れていってしまう。１店で買いそろえる行動は、価格が安定しない限りは、まだまだである。
,,□,コンビニ（エリア担当）,・売上の前年割れ店舗が増加しており、今後もこの傾向は当分続く。
,,□,家電量販店（店長）,・11月にパソコンの新しいＯＳが売り出されるものの、それ以外は買い回るような魅力のある商品の開発がないため、景気の上昇は見込めない。
,,□,乗用車販売店（従業員）,・東海地域はＩＴ関連企業に勤める客が多いが、リストラの報道が多く、これから車の購入を買い控える話がある。今後新型車が出てくるが、その効果を相殺する。
,,□,観光型ホテル（スタッフ）,・秋の行楽シーズンの予約が、家族客を中心にグループなどで前年同月比15％程度減少し、このままでいくと５～10％落ちそうである。現在の低迷状況は今後も続く。
,,□,都市型ホテル（スタッフ）,・11月の婚礼予約がかなり少なく、宿泊、宴会等の予約も少ない状態が続いており、今後予約数が伸びる見込みもない。
,,□,その他サービス［パチンコ機器製造販売］（エリア担当）,・パチンコ産業はレジャー産業であるため、サラリーマンの懐が暖かくならない限り、売上が増加する要素がない。
,,▲,商店街（代表者）,・家電店に客が魅力を感じるような商品が出てきていない。家電のネットワーク化が進んでいるが、操作が難しいなど利便性に問題があり、普及に拍車がかからない。
,,▲,一般小売店［酒］（経営者）,・店の収益や体力がかなり落ちてきており、商品構成や販売方法に柔軟な対応がなかなか取りにくい。それが客にも敏感に伝わっている。
,,▲,スーパー（経営者）,・売上がないために、各店は安い単価のチラシ合戦をするが、ますます単価の安い品物のバーゲンだけが増えて、利益の確保ができない。
,,▲,スーパー（店長）,・１品当たりの商品単価が低下しており、競合店との対策上や顧客ニーズの対応からは、くい止める事ができない。
,,▲,コンビニ（店長）,・ビールの落ち込みが大きく、低単価の発泡酒や酎ハイへの移行が顕著にみられる。
,,▲,コンビニ（エリア担当）,・おにぎりや弁当商品においても、低価格商品へと客が移行しており、買上点数の増加もなく客単価の低下が更に続く。
,,▲,乗用車販売店（経営者）,・客が動く指標である問い合わせ件数などが全く増加してこない。
,,▲,乗用車販売店（従業員）,・次々と新型車の発表や発売は続けられるが、既販車の落ち込み量が多く、全体の販売量は確保しづらい。
,,▲,高級レストラン（スタッフ）,・客の行動をみていると、日ごろは低価格の食事で節約し、家庭の記念日などで高級店を利用するといったように、選択がかなり厳しくなってきている。
,,▲,スナック（経営者）,・客から、接待費や給料、ボーナスなどのカットといった話をますます頻繁に聞かれるようになっている。リストラなども身近の人達が現実にさらされていることから、客にとっても私たちにとっても先行き不安であり、客単価の低下はまだまだ続く。
,,▲,旅行代理店（経営者）,・予約を受けている関係で、半年先の受注状況を的確に把握しているが、全体的な受注量や消費単価が、弱含みで推移している。
,,▲,タクシー（営業担当）,・現在はタクシーをどうしても必要とする人しか利用しない状況であるので、今後これ以上落ち込むことはないと思うが、少ない利用客を同業者間で奪い合う競争は激しくなる。
,,▲,ゴルフ場（経営者）,・９～11月の予約は、前年比で10％程度減少している。この状態は12月以降も変わらない。
,,×,商店街（代表者）,・まだまだ価格競争、安売り競争に入っていく。人員整理などで価格の維持はしているが、これ以上の価格競争にはついていけない。
