Ⅱ．景気の先行きに対する判断理由,,,,
,,,,
　景気の先行きに対する判断の理由について、その主だったもの及び特徴的と考えられるものを取りまとめると以下のとおりであった。,,,,
,,,,
,,,,
　１．北海道,,,,
,,,,（－：回答が存在しない、＊：主だった回答等が存在しない）
分野,,景気の先行き判断,業種・職種,景気の先行きに対する判断理由
"家計
動向
関連

(北海道)",,◎,－,－
,,○,商店街（代表者）,・客の秋物を求める動きがみられ始めている。今年の秋物はトレンドがはっきりしており、客の求める物が明確なので、商品の動きが良くなる。
,,○,百貨店（販売促進担当）,・依然として来客数、売上ともに増加している｡
,,○,住宅販売会社（営業担当）,・住宅金融公庫の民営化がニュースで取り上げられるようなってきている。２、３か月後にもっと具体的情報が出てきたとき、来年以降に家造りを計画している人が前倒しをして取り組む可能性がある。
,,□,百貨店（売場主任）,・婦人服、服飾雑貨関係で依然として来客数が低迷している。この数か月、食品の動きが目立っている状況からみると、必要以外の物の出費を抑える状況が続く。
,,□,百貨店（売場主任）,・身の回り品、コート関係の動きが昨シーズンよりも明確であり、秋物に期待をしたい。
,,□,スーパー（店長）,・客単価、１品単価の低下が依然として続いており、客が必要な物しか買わない傾向が今後も続く。
,,□,スーパー（店長）,・夏物衣料が不振なので、見切り価格で販売しても消化状況が良くない等、良くなる要素がほとんど見当たらず、先がみえない。
,,□,スーパー（店長）,・競合店と比較して買う傾向が強い等、消費者が購買に対し非常に慎重である。また、政府が補正予算をどの程度組むかが非常に大きなポイントになる。
,,□,スーパー（企画担当）,・客単価が低下している状況は今後も続くとみられ、この状況が普通だと思って取り組まないといけない。
,,□,コンビニ（エリア担当）,・秋以降も競合の出店が続き、価格競争を避けられない。
,,□,衣料品専門店（店員）,・３か月先は、秋物、冬物等、高単価の物が売れる時期だが、これらはコストも高い商品なので売上利益はそれほど変わらない。
,,□,家電量販店（店員）,・来客数は減少しており、今後も景気が良くなると思われない。
,,□,乗用車販売店（従業員）,・客の購買傾向に低価格車種への移行が依然としてみられ、ローンで購入する客も増加している。
,,□,高級レストラン（スタッフ）,・予約客の単価が低い。秋に名産品フェアを開催するが、現状維持が精一杯である。
,,□,旅行代理店（従業員）,・旅行の先行受注状況は増加していないが、締切り間際の申込が増加傾向にあるので例年と変わらないとみられる。
,,□,観光名所（役員）,・客は低価格に対する違和感が無くなってきており、価格に見合う価値、サービスに対する目が厳しくなってきている。
,,▲,商店街（代表者）,・先行き不安のためか買物がより慎重になっており、安い物しか売れない。
,,▲,スーパー（企画担当）,・お中元ギフト商戦も全般的には堅調に推移したが、これは他業界の客を取り込んだ結果とみられる。例えば、例年はビールのギフト需要が大きく伸びるが、今年は発泡酒需要の伸長が顕著であり、このような面からみても節約ムードはまだまだ続くとみられる。
,,▲,スーパー（企画担当）,・景況感の悪化、失業率の５％超過等の状況からみて、客はますます生活防衛に走る。具体的には１品単価の低下が続き、来客数を維持しても販売量や売上が前年を下回る。
,,▲,衣料品専門店（店長）,・中年層以上の客は、将来の年金等、生活に不安を持っているので、買い控えが進む。
,,▲,乗用車販売店（従業員）,・釧路地方の基幹産業があまり良くないので､これから先行き悪くなっていく｡
,,▲,住関連専門店（営業担当）,・夏期関連の在庫が多く、秋物商戦も出遅れている。また他店との競争で低価格が進展している。
,,▲,その他専門店［医薬品］（経営者）,・今必要な物をできるだけ安く購入しようとする客が増加しており、健康増進関連の高額商品は、店頭での動きが悪くなっている。また、化粧品については、利用率が低下している客が増加している。
,,▲,スナック（経営者）,・地域経済の状態が良くない中で、地元信用組合が破綻し、その受皿の見通しが立っておらず、飲食店がダメージを受けている｡
,,▲,観光型ホテル（経営者）,・構造改革がより具体化すると職を失う人が多くなり、観光マインドが徐々に冷え込むため、売上の減少が危惧される。
,,▲,観光型ホテル（スタッフ）,・予約の入り方が遅くなっている。また、単価の下落も今後懸念される。
,,▲,旅行代理店（従業員）,・先行受注の状況が悪い。
,,▲,通信会社（企画担当）,・携帯電話は若年層、ミドル層で相当普及しているが、ローティーンや主婦層、シニア層等の新規の獲得が難しくなっている。また、通話量も減少しており、将来の景気の悪い要因になる。
,,▲,美容室（経営者）,・商店街で廃業する店が出てきており、これが今後の売上にも影響が出そうな気がする。
,,×,スーパー（店長）,・破綻した地元信用組合の受皿が不透明であり、中小企業の倒産が引き続き多発する。
,,×,スナック（経営者）,・来客数が減少している。
,,×,旅行代理店（従業員）,・旅行の予約状況が、ここ数年来経験したことがない程度に悪化している。
,,×,設計事務所（所長）,・現状において非常に厳しい受注見込みであり、明るい話題がない北海道で今後受注が増加するという予想を立てられない。
,,×,住宅販売会社（従業員）,・住宅用土地価格の低下や、仕事等の先行き不安等で、長期ローンを組んで住宅や不動産を買う意欲が出てくる気配がない。
"企業
動向
関連

(北海道)",,◎,－,－
,,○,その他サービス業［建設機械レンタル］（総務担当）,・機械の動きが活発になってきており、公共工事の対前年発注指数もやや上昇傾向にある。
,,□,食料品製造業（経営者）,・価格競争が厳しく、１回当たりの受注量も減少している。
,,□,通信業（営業担当）,・ＩＴ化が叫ばれるなかで、システム再構築、イントラネット等にそろそろ取り組もうとする客も出てきている。ただし、どの業種も総じて売上が低調であり、システム投資に回せる余力は少ないという話を聞くので楽観できない。
,,□,その他企業［コンベンション担当］（従業員）,・売上を維持することが精一杯である。
,,▲,金融業（企画担当）,・構造改革が具体化する時期であり、経営者のマインドが更に冷え込むと予想される。また、業種を問わず、過当競争、それに伴う価格競争が激化しており、人員の抑制傾向も強く、前向きの投資が乏しくなる。
,,▲,その他サービス業［システムハウス］（経営者）,・同業の大手企業の受注状況が単価、量ともに厳しくなってきている。
,,×,輸送業（支店長）,・年度始めに計画された建築物件も参議院選挙後は、無期延期となっている物件が多発している。このため、道内の建築関連メーカーは道外の採算割れの物件も受注している。また、取引先からの情報によると、金融機関で貸し渋りや資金の引上げも一部で進んでおり、９、10月にかけて金融不安が増大する。
,,×,司法書士,・地元信用組合が破綻し、新しい信用組合設立も不調であり、資金繰りに困る企業が増加している。
"雇用
関連

(北海道)",,◎,－,－
,,○,－,－
,,□,人材派遣会社（社員）,・周囲で閉鎖した企業、来年の新卒者を採用しない企業が増加している。
,,□,求人情報誌製作会社（編集者）,・季節要因となる農業を除くと、パート、臨時職員、アルバイト等の需要は変化なく推移する。
,,□,学校［大学］（就職担当）,・学生の就職活動の状況からみて、例年と変わらない。
,,▲,求人情報誌製作会社（編集者）,・建設業、製造業、卸売業、運輸業の業績悪化が、小売業、飲食業、サービス業等の動きにマイナスに影響する可能性が十分あり、全般的に悪化していく。
,,×,新聞社［求人広告］（担当者）,・構造改革の進展により、土木・建設業を中心に厳しい状況になる。
,,×,職業安定所（職員）,・公共事業の減少や建設単価の低下等により、土木・建設業界で合理化の検討をしている企業が増加している。また、在職求職者の増加が著しい。
,,,,
　２．東北,,,,
,,,,（－：回答が存在しない、＊：主だった回答等が存在しない）
分野,,景気の先行き判断,業種・職種,景気の先行きに対する判断理由
"家計
動向
関連

(東北)",,◎,－,－
,,○,百貨店（売場担当）,・これから秋に向け、百貨店では催事関係や秋物の売れ筋商品をアピールして店頭に並べる計画であるため、来客数の増加が見込まれ、売上の増加も期待できる。
,,○,乗用車販売店（経営者）,・年末にかけ新型車が発売予定であり、後期に向けて販売戦略を検討中である。
,,○,都市型ホテル（スタッフ）,・選挙やワールドゲームズが終了したので、一般客がもっと気軽に来館してくれると期待している。
,,○,通信会社（営業担当）,・契約数が増加しつつあり、また経費削減の効果が浸透してきている。
,,□,商店街（代表者）,・これから年末にかけ各種イベントがあり、景気が悪くなるとは考えられないが、極端に良くなるともいえない。
,,□,百貨店（売場主任）,・店の売上が減少し、経費削減のためチラシの折込回数を減らし、店としては悪循環に向かっているが、客の動きに期待が持てるため、差引き変わらない。
,,□,百貨店（広報担当）,・最近は好調な月と不調な月の波があり、月によって消費傾向にバラツキが出ているため、８月が若干の回復基調であるとしても、持続性には疑問が残る。
,,□,スーパー（経営者）,・現在、自社でも店舗の縮小や人員の削減を行っているが、まだまだ、厳しい状況に変わりはない。
,,□,スーパー（店長）,・目玉商品しか動かない状況が続いている。客の買い回りは今後も続くので、客単価や店単価が上昇する見込みはない。
,,□,スーパー（店長）,・お盆は年末に次ぐ繁忙期であるにもかかわらず不発で、客の財布のひもはかなり締まっている。
,,□,衣料品専門店（店長）,・主力商品として扱っているスーツは、経済状況や世情の変化により購買人口の増加が見込めない。
,,□,家電量販店（店長）,"・客の購入予算が低くなっており、冬のボーナス払いやカードの分割払いなどが増えている。
・購入動機も今まで使っていた電化製品が壊れて、仕方なしにという場合が多い。"
,,□,その他専門店［家電］（経営者）,"・情報家電の単価が低い。
・買換え需要は期待できるものの、客の態度が慎重過ぎて、売上増に結び付かない。"
,,□,一般レストラン（スタッフ）,・ここ数か月の傾向として、来客数は確保しているものの単価が下落しており売上が増えない。
,,□,都市型ホテル（経営者）,・８月末から国体が始まるため関連業界は忙しくなるが、国体を除いた受注関係は悪くなっており、差引き変わらない。
,,□,都市型ホテル（スタッフ）,・ＤＭ発行やチラシの枚数を多くしているが、回収状況や客の反応は今一つである。いろいろな手段で集客を図っているものの状況は変わっていない。
,,▲,百貨店（売場主任）,"・２、３か月後に大きなイベントの開催を予定しているが、客の買上単価が非常に低い。
・売場での大口ギフトの減少がこれからも続き、客のシビアな買い方が定着している。"
,,▲,スーパー（企画担当）,・市内の同業他社の閉店が相次いでいる。利益を削って売上を確保する取組にも限界があり、低価格に追随ができず来客数の確保が困難になっていく。
,,▲,衣料品専門店（店長）,・競合他社に単価を下げる動きがあるため、当社も追随していかなければない。来客数が増えない時期に単価を更に下げれば、売上が厳しくなる。
,,▲,乗用車販売店（経営者）,・法定点検、車検に関しては受注数が減少し単価も低下している。これを補う臨時整備もできるだけ控える客の行動は年末まで続く。
,,▲,乗用車販売店（営業担当）,"・県内では大手進出企業の工場閉鎖並びに撤退が相次ぎ、夏のボーナスの支給状況も悪い。全般的ムードが悪いためか、客の車輌買い控えが発生している。
・車両の買換えサイクルが長期化しつつあり、また、新車から中古車への客の移行が目立ってきている。
・低価格の新型車やミニバンはある程度好調であるが、新型車効果の期間が短くなっている。"
,,▲,住関連専門店（経営者）,・客が欲しい商品をみつけて買おうかどうか迷っていても、接客しているうちに、結局、前に買った物で間に合わせることにし、販売につながらないケースが多い。
,,▲,その他専門店［ガソリンスタンド］（営業担当）,・低価格のセルフスタンド出店の影響により、価格競争に歯止めがかからず、マージンの圧縮が続いている。
,,▲,その他専門店［ガソリンスタンド］（経理担当）,・ガソリンではほとんど利益が出ないため、洗車や車検に力を入れている。個人の現金客のカード利用が増加して店の現金が減少し、法人客も節約志向が強く売上が伸び悩んでいる。
,,▲,高級レストラン（経営者）,・厳しい状況ではあるが競争相手の倒産などにより、多少は来客がある。
,,▲,一般レストラン（経営者）,・低価格に歯止めがかかったように思っていたが、牛丼店を始めコンビニやファミリーレストランが単価を下げてきており脅威である。
,,▲,観光型ホテル（経営者）,"・予約数では前年同様であるが、家族連れの割合が高く、館内消費などが望めない。
・観光地の大型ホテルは、団体客が入らなければどうにもならない。"
,,▲,通信会社（営業担当）,・安くないと客に選んでもらえない状況が続いており、今後も更にそういう動きが強まる。
,,▲,住宅販売会社（従業員）,・融資が受けられず、建築をあきらめる客が出てきている。
,,×,スーパー（総務担当）,・電気機械器具製造業でのリストラが始まっており、９月以降は更に失業者の増加が予想され、その影響は間違いなく小売業にも及ぶ。
,,×,衣料品専門店（経営者）,・ビジネス関係のスーツ等を作る顧客がほとんどの割合を占めているが、新しく買うよりリフォームする傾向が増えている。
,,×,その他飲食［そば］（経営者）,"・前年末にかけ、近隣の貸しビルのテナントが撤退し、活気がなくなった時期があり、現在それと同じような状況になっている。オフィスビルの空き部屋はあまり目立たないが、リストラが進んでいるという話をよく聞く。
・周辺ではコンビニが出店したり、小さな商店が撤退したりと、街全体の出退店の動きが激しく、来客数の減少は当店に限らず全ての商店についていえる。"
,,×,旅行代理店（従業員）,・秋に地元で国体が開催されるが、旅行シーズン中の地元開催であり、旅行代理店にとっては販売増には結び付かず、むしろ縮小気味となる。
,,×,タクシー運転手,"・３時間も空車で走る事もある。
・タクシーチケット利用者も激減している。"
,,×,競輪場（職員）,・競輪の客層の多くが、年金受給者であることから、来客数の自然減が見込まれる。
,,×,住宅販売会社（従業員）,・建売住宅の販売会を開催したが、年収、自己資金が十分な客の来場が少なく、この傾向は今後２、３か月続く。
"企業
動向
関連

(東北)",,◎,－,－
,,○,輸送業（従業員）,・国体により一時的でも、売上増が見込まれる。
,,□,農林水産業（従業者）,・農産物の収穫量は変わらないが、販売価格が低下し、収入が減少するため、設備投資が困難である。
,,□,電気機械器具製造業（総務担当）,・設備投資の見直しなど損益対策を行っているが、３か月先に効果が出るとは思えず、現状維持になる。
,,□,金融業（営業担当）,・取引先の資金需要の動向をみると、運転資金、設備資金ともに極めて慎重であり、停滞は当分続く。
,,□,その他企業［企画業］（従業員）,・定期受注物件であっても納入価格に対する値引要請が一段と強まり、安定収入が期待できない状況が続く。
,,▲,電気機械器具製造業（従業員）,・夏までに受注できると思われていた案件が、ほとんど秋以降にずれ込み、しかもめどがついていない。
,,▲,建設業（従業員）,"・公共事業が前年比マイナス10％である。小口発注の場合は地元の入札業者の枠が下方へ広がり競争が激化している。
・民間は需要低迷で設備投資を縮小しているため、今期の入札は前年比で20％近く減少する見通しである。"
,,×,一般機械器具製造業（経理担当）,"・為替が一時よりも円高で推移しているため、収益の柱であった輸出品の採算が悪化している。
・携帯電話向け部品の生産調整が長期化する見通しである。"
,,×,電気機械器具製造業（経営者）,・先の見通しが全く読めない状況のなか、取引先でかなりのリストラを始めている。かつてはアウトソーシングで製造していたパーツ等を、自社で抱え込んでいた余剰人員で製造するようになってきている。
,,×,電気機械器具製造業（企画担当）,・メーカーが操業度を大幅に縮小してきているので、先行きは極端な悪化が予想される。
,,×,輸送業（従業員）,・東北地域のＩＴ関連企業の工場閉鎖や生産の海外シフトが増加しており、今後ますます輸出の荷動きが鈍る。
"雇用
関連

(東北)",,◎,－,－
,,○,－,－
,,□,人材派遣会社（社員）,・スポーツクラブやアミューズメント施設のオープンに伴う求人などまとまった受注はあるが、既存企業の事務所の縮小などが多い。受注は減少しているわけではないが、楽観はできない。
,,□,人材派遣会社（社員）,・人員の削減を検討している企業が多く、派遣契約の更新をしない場合が増えてきているため、新規オーダーを取っても、現状維持がやっとである。
,,▲,人材派遣会社（社員）,・２、３か月先に派遣契約を打ち切るという話が多く、逆に２、３か月先の新規契約の話はほとんどない。
,,▲,職業安定所（職員）,"・常用の新規求人数が少なく、臨時やパートの新規求人数が増えている。
・企業整理による解雇人員が増加している。"
,,×,職業安定所（職員）,・求人数が新規、有効ともに連続して減少しており、特に電気機械器具製造業、精密機械器具製造業の求人数が前年比で70～90％の大幅下落である。
,,,,
　３．北関東,,,,
,,,,（－：回答が存在しない、＊：主だった回答等が存在しない）
分野,,景気の先行き判断,業種・職種,景気の先行きに対する判断理由
"家計
動向
関連

(北関東)",,◎,＊,＊
,,○,百貨店（販売促進担当）,・各部門の企画、販売体制を強化しており、９月以降には効果が出て、売上は若干上向く。
,,□,百貨店（販売促進担当）,・関連商品を勧めても、客は必要以上の商品購入はせず、財布のひもが固い。
,,□,百貨店（販売促進担当）,・来客数、客単価、売上伸び率等に変化はない。
,,□,スーパー（管理担当）,・ヒット商品がなく、客単価も低下傾向にある。来客数は前年維持である。
,,□,衣料品専門店（店長）,・秋冬の商品においても、価格低下や買上客数の減少が続き、悪い状況で変わらない。
,,□,衣料品専門店（統括）,・イベントや催物を行う計画であるが、街に人出が少なく、集客につながらない。
,,□,衣料品専門店（販売担当）,・通常であれば、秋の立ち上がりで売上は若干上向くが、客に活気がなく、ファッションを自分で取り込む感じではない。
,,□,乗用車販売店（経営者）,・イベントで集客はできるが、販売につながるとは言い切れない。
,,□,乗用車販売店（従業員）,・モーターショーの開催により、新型車に対する興味は盛り上がるが、購買にはつながらず、客の慎重さは続く。
,,□,自動車備品販売店（経営者）,・客は無料のオイル交換には来るが、財布のひもが固く、他の商品は購入しない。
,,□,その他専門店［ガソリンスタンド］（従業員）,・法人需要が回復しないと、販売量は増加しない。
,,□,旅行代理店（従業員）,・受注量、来客数、客の様子、他社の動きに変化がない。単価も現在の低価格のまま推移するので、競争は依然として激しい。
,,□,旅行代理店（従業員）,・前年の先行受注と比較すると、申込時期は遅くなっているが、受注量は前年並みで推移している。
,,□,通信会社（社員）,・携帯電話の販売数の伸びがそれほど期待できず、１契約当たりの通話料収入は減少する。
,,□,ゴルフ場（営業企画担当）,・秋のゴルフシーズンで入場者は増加するが、客単価が低下しているため、ますます厳しくなる。
,,□,その他サービス［自動車整備業］（経営者）,・客の財布のひもが固くなってきており、最低限の修理で車は走れば良いという雰囲気が強い。
,,□,設計事務所（所長）,・設計事務所を始めて26年になるが、これほど悪い状況は初めてである。
,,□,設計事務所（所長）,・受注につながる具体的な話や問い合わせが少ない。
,,▲,商店街（代表者）,・中心街の人通りは、土日でもなかなか増えない。このまま客の少ない状況が続く。
,,▲,商店街（代表者）,・商店街に人があまりいないため、来店した客が驚いて、どうなっているのかと聞かれる始末である。
,,▲,一般小売店［青果］（店長）,・単価の張る商品の動きは鈍い。
,,▲,百貨店（企画担当）,・来客数に変動はないが、売上が伸びない。客は必要最小限の買物にとどめている。
,,▲,スーパー（経営者）,・チラシの特売品掲載比が高くなっており、利益が減少している。
