Ⅱ．景気の先行きに対する判断理由,,,,
,,□,一般小売店［靴・履物］（店長）,・客単価、商品単価に下げ止まりの動きがみられる。
,,□,一般小売店［文房具］（経営者）,・客は安売りに殺到し、その補充程度にしか小売店に注文しないので、決して良くならない。
,,□,百貨店（売場主任）,・セールにより来客数と売上は増加しているが、依然として低価格志向が続き、定価商品には動きがない。
,,□,百貨店（営業企画担当）,・雑貨、食料品の売上は好調であるが、主力の紳士服、婦人服の売上が低迷している。
,,□,百貨店（企画担当）,・購買点数は増加しているものの、買上単価が低下している状況をみると、購買に対する消費者の目は依然厳しく、慎重な姿勢は今後も続く。
,,□,百貨店（売場主任）,・高額品の動きが悪く、客単価の低い状況が改善されない限り、景気の回復は望めない。
,,□,百貨店（広報担当）,・営業日数の拡大等が売上増加につながらない。雑貨は堅調に推移しているが、主力のファッション売上が増加する傾向にない。
,,□,スーパー（経営者）,・客は予算の枠内で買物をしており、買上点数が増加しない。
,,□,スーパー（店長）,・来客数の減少、客単価の低下など、厳しい状況は変わらない。
,,□,コンビニ（店長）,・近所にコンビニがオープンする一方、酒販店が休業に入るため、売上は変わらない。
,,□,衣料品専門店（店長）,・来客数は横ばい、あるいは減少傾向のまま推移する。
,,□,家電量販店（店長）,・他の商品を勧めても買い求める客は少なく、まとめ買いによる値引き要求も多く、利益を圧迫している。
,,□,乗用車販売店（営業担当）,・新型モデルの発売予定がない。
,,□,その他専門店［眼鏡］（店員）,・依然として低価格志向が強い。新製品全体でもカジュアル化したフレームが多く、価格もリーズナブルで代わり映えしないため、客の購入につながらない。
,,□,一般レストラン（店長）,・客のお金の使い方をみると、倹約して飲食している。
,,□,一般レストラン（経営者）,・大衆の食事の値下げ競争が激しく、厳しい状況は変わらない。
,,□,旅行代理店（従業員）,・店頭や外回り営業の受注状況は対前年並みで、今後も変わらない。
,,□,通信会社（総務担当）,・景気の先行きにまだ不透明感があるので、消費に関してシビアな状況はあまり変わらない。
,,□,その他レジャー施設［アミューズメント］（職員）,・10日間の休業後にもかかわらず、客の需要はあまりなく、今後も改善の期待はできない。
,,□,住宅販売会社（従業員）,・住宅展示場への来場者数は相変わらず前年を下回っており、受付中の住宅金融公庫の申込件数も思わしくない。
,,□,住宅販売会社（経営者）,・広告に対する客の反応が悪く、潜在需要がつかみにくい。
,,▲,商店街（代表者）,・店の前を通る消費者は若干減少しており、来店しても販売まで結び付かないケースが増加している。
,,▲,一般小売店［ＣＤ］（営業担当）,・商品価格の低下、競合店との価格競争もあり、売上はやや減少する。
,,▲,一般小売店［パン］（従業員）,・週末のファミリー層の来客が減少しているので、２、３か月先もそれほど期待できない。
,,▲,百貨店（副店長）,・低価格志向が目立ち、特にアクセサリー関係の動きが非常に悪くなっている。
,,▲,コンビニ（経営者）,・このまま少しずつ来客数が減少する。
,,▲,家電量販店（店員）,・安売り店等への一極集中が更に強まる。
,,▲,住関連専門店（統括）,・予約件数の減少は止まることがなく、２、３か月後の受注減少も避けられない。
,,▲,高級レストラン（支配人）,・この先の予約状況をみても、全体的に今月以上に厳しくなる。
,,▲,都市型ホテル（スタッフ）,・宴会等の予約状況が良くない。
,,▲,その他サービス［学習塾］（経営者）,・教育の価値観の変化で、塾の需要が減少している。
,,×,スナック（経営者）,・１か月のうちで客のない日が多くなっている。
"企業
動向
関連

(南関東)",,◎,－,－
,,○,不動産業（総務担当）,・テナントの業種の好不況により景気に対する見方に温度差があるものの、新内閣に対する期待の声は多い。
,,□,プラスチック製品製造業（経営者）,・受注量、販売量ともに増加する見込みが全くない。
,,□,金属製品製造業（総務担当）,・受注量が伸び悩んでいる。
,,□,輸送業（支店長）,・現在の売上や今後の予定をみると、さほど現在と変わらない。
,,□,その他サービス業［情報サービス］（従業員）,・情報通信関係の設備投資に関する契約がなかなか成立せず、先行きに明るさがみられない。
,,□,その他サービス業［廃棄物処理］（経営者）,・数か月後の仕入単価の上昇が確実で、客先の動向にも不透明感がかなり根強い。
,,▲,繊維工業（経営者）,・夏物の受注終了後の見通しが全く立っていないので、やや悪くなる。
,,▲,電気機械器具製造業（経営者）,・現状では新規の商談がない。
,,▲,輸送業（営業担当）,・仕事量増加のきっかけが見当たらない。
,,▲,金融業（渉外担当）,"・金利の先行き不透明感が強く、取引先は設備投資を手控えている。
・今後も商品単価が低下するのではないかと、取引先が不安を感じている。"
,,▲,不動産業（経営者）,・地価や賃料が依然として低下している。
,,▲,広告代理店（従業員）,・必要性の低いものは印刷の発注を控えたり、自分で作成するなど、個人や小企業向けの印刷物は減少傾向にある。
,,×,一般機械器具製造業（経営者）,・タイに工場を有する得意先に、国内生産の単価がタイで生産する単価より高ければ、タイの工場に発注するとの申出がきている。
"雇用
関連

(南関東)",,◎,－,－
,,○,＊,＊
,,□,人材派遣会社（社員）,・消費動向に少し動きがみられる割には、求人依頼が伸びていない。商社の新入社員が売場に立ち、販売員の依頼を行わないことが理由である。
,,□,職業安定所（職員）,・重工長大型産業のリストラは一段落したが、家電関係、特に箱物のリストラが始まっている。
,,□,学校［専門学校］（教務担当）,・コンピュータのＳＥ、プログラマーの求人は多いが、他の職種では変わらない。
,,▲,人材派遣会社（社員）,"・大企業の中に、いまだ組織の見直しやリストラを実施している企業がある。
・企業は欠員補充を考えず、業務の改革や現有戦力での対応を求めている。"
,,▲,求人情報誌製作会社（営業担当）,・短期の人材募集が多く、求人広告の長期契約を結ぶところが少ない。
,,▲,職業安定所（職員）,"・情報関連産業からの求人数の伸びに、かつてほどの力強さがない。
・従来型産業からの求人の動向に目立った動きはなく、引き続き人員削減、業務のアウトソーシング、業態転換等の事業再構築への取組を進めるものとみられる。
・新規求職者に占める非自発的離職者の割合が高水準で推移している。"
,,×,－,－
,,,,
　５．東海,,,,
,,,,（－：回答が存在しない、＊：主だった回答等が存在しない）
分野,,景気の先行き判断,業種・職種,景気の先行きに対する判断理由
"家計
動向
関連

(東海)",,◎,＊,＊
,,○,スーパー（総務担当）,・来客数がやや増加傾向にある。
,,○,コンビニ（エリア担当）,・売上、来客数が前年をかなり上回る日が増加してきている。
,,○,衣料品専門店（企画担当）,・同業の各小売店が進める販売戦略の見直し効果が期待でき、既に一部の店舗では効果が現れ始めている。
,,○,家電量販店（店員）,・家電リサイクル法施行前の駆け込み需要の反動による売上減少は、次第に収まりつつある。
,,○,乗用車販売店（従業員）,・高額商品が少しずつ売れるようになってきている。
,,○,旅行代理店（従業員）,"・大阪や東京で大型レジャー施設のオープンもあり、個人や法人の旅行意欲が戻りつつある。
・法人の海外視察や社員への報償旅行が復活しつつある。"
,,□,商店街（代表者）,・季節商材に動きがなく、自家消費用の商品が売れていない。
,,□,商店街（代表者）,・低価格商品が好まれる傾向が続く。
,,□,百貨店（企画担当）,・来客数は前年を上回ってきているが、客単価の大幅低下はカバーできておらず、前年の売上に届かない傾向が続く。
,,□,百貨店（企画担当）,・高額ブランド品はこれからも好調であるが、日用品は低価格品が好まれる傾向が続く。
,,□,スーパー（店長）,・客は特売に殺到するなど、依然として低価格商品を求める傾向が強い。
,,□,スーパー（店員）,・特に平日は目玉商品のある競合店に客が流れており、来客数の減少傾向は続く。
,,□,コンビニ（エリア担当）,・売上が前年割れする店舗割合は約52％と、横ばい状態である。
,,□,コンビニ（エリア担当）,・値引きキャンペーン商品から購買されていくなど、低価格志向は続く。
,,□,家電量販店（店長）,・来客数の増加や客単価の上昇は特にみられない。付加価値のある商品よりも、安い価格帯で実用性のある商品が中心である。
,,□,乗用車販売店（従業員）,・低価格志向が続いているが、価格を下げながら客を多く呼び込むことにより、売上を維持していく。
,,□,住関連専門店（店員）,・安ければ売れており、客単価としては下げ止まっているため、売上は現状の水準で推移する。
,,□,高級レストラン（スタッフ）,・誕生日や結婚記念日等、イベント向けの販売促進を企画しており、現状を維持する。
,,□,都市型ホテル（スタッフ）,・披露宴の予約が少なく、今後は企業研修の利用も見込めないため、厳しい状況が続く。
,,□,タクシー運転手,・病院への利用客は増加しているが、それ以外の法人、個人客がなかなか戻ってこない。
,,□,テーマパーク（職員）,・客の園内での過ごし方や買物状況に変化がない。
,,□,パチンコ店（経営者）,・客の可処分所得が増加していないため、これ以上の売上増加は困難であるが、これ以上の低迷も考えられない。
,,□,その他サービス［パチンコ機器製造販売］（エリア担当）,・来客数は増加傾向であるが、客単価が低下しているため、売上は前年並みである。
,,□,設計事務所（職員）,・今の仕事量からみて、好転の兆しはみられない。
,,▲,一般小売店［惣菜］（営業担当）,・普段の買物のみならず、お中元等贈答を手控える傾向も続いている。
,,▲,百貨店（企画担当）,・季節商材に目立ったヒット商品がない。
,,▲,コンビニ（店長）,・個人客だけでなく法人客も、ディスカウント店で購入している。
,,▲,通信会社（社員）,・マイライン開始の影響で、通話料収入は確実に減少する。
,,▲,テーマパーク（職員）,・電話による問い合わせ時に個々の遊具の利用料金まで尋ねる客や、遊具に子供のみ乗せて親は乗らないケースが増えており、客単価は低下し続ける。
,,▲,ゴルフ場（経営者）,"・３か月先の予約は前年同月比を下回っている。
・ゴルフクラブなどの購入も最近は減少している。"
,,▲,設計事務所（職員）,・現在の仕事状況でみると、これ以上悪くなることはあり得ないほど悪くなっている。
,,×,設計事務所（経営者）,・公共事業が期待できず、民間の設備投資も圧縮されている。
"企業
動向
関連

(東海)",,◎,電気機械器具製造業（営業担当）,・情報インフラ整備関連の物件が大幅に見込める。
,,○,＊,＊
,,□,建設業（企画担当）,・仮に工事量が増加しても、コストダウン競争が激しくなるだけで変わらない。
,,□,新聞販売店［広告］（店主）,・チラシ広告はかなり増加しているが、需要が見込めないため、売上に反映されていない。
,,□,税理士,・個人事業主から税理士の顧問料引下げを依頼されるケースが目立ってきている。
,,▲,化学工業（営業担当）,・仕事量が減少している。
,,▲,経営コンサルタント,・住宅着工件数が落ち込んでくる。
,,×,＊,＊
"雇用
関連

(東海)",,◎,－,－
,,○,人材派遣会社（社員）,・正社員の採用は手控えられているが、即戦力のある派遣社員の採用は増加している。
,,○,学校［大学］（就職担当）,・ＩＴ関連業種や機械、自動車、造船、マスコミ、流通関連での採用増加がみられ、事務系の採用もやや増加している。
,,□,人材派遣会社（社員）,・新卒の採用件数は増えてきているが、内容、条件は厳しい。
,,□,新聞社［求人広告］（担当者）,・最近ではパートの仕事も業務請負にゆだねるなど、企業のリストラは続いている。
,,□,職業安定所（所長）,・求人件数は増加しても条件は厳しく、就職に結び付かないケースが今後も増加する。
,,▲,人材派遣会社（社員）,・派遣契約の短期化が目立ち、各企業ともコスト削減意識が一層強くなっている。
,,▲,職業安定所（職員）,・地元中小企業のリストラは続いており、新規求職者も前年同月より増加し、雇用情勢は更に厳しさを増す。
,,▲,職業安定所（職員）,・地場産業であるアパレル関係業種の廃業や人員整理が続いている。
,,×,－,－
,,,,
　６．北陸,,,,
,,,,（－：回答が存在しない、＊：主だった回答等が存在しない）
分野,,景気の先行き判断,業種・職種,景気の先行きに対する判断理由
"家計
動向
関連

(北陸)",,◎,一般レストラン（店長）,・毎年各県の持ち回りになっている国民体育大会北信越ブロック大会が５年ぶりに開催されるため、県外客の増加が期待できる。
,,○,家電量販店（店長）,・家電リサイクル法対象４品目の買い控えが一段落し、客が再び戻ってくる。
,,○,乗用車販売店（総務担当）,・５月に人気車のモデルチェンジが行われるので、プラス効果が期待できる。
,,○,自動車備品販売店（従業員）,"・行楽、旅行シーズンに入り、新規客の増加等による需要の喚起が大いに期待できる。
・新製品、高額商品に対する関心度も高く、客単価上昇により売上が増加する。"
,,□,一般小売店［精肉］（経営者）,・依然として客に購買意欲が見受けられない。特売商品だけに人気があり、定価商品が伸び悩んでいる。
,,□,百貨店（営業担当）,"・相変わらず客は十分に吟味しないと商品を買わない。
・価格の安さだけに客の注目が集まっているため、財布のひもが固い状況は続く。"
,,□,百貨店（営業担当）,・来客数は依然増加する様子はなく、また試着のみで帰る客も相変わらず多い。
,,□,スーパー（店長）,・客は本当に必要な物しか買わず、極端に価格を安くしても敏感に反応しない。
,,□,スーパー（店長）,・特売競争、チラシ競争の激化により、安い物しか売れず、客単価が伸びないため、厳しい収益状況が続く。
,,□,スーパー（総務担当）,・客は無駄な出費を一層抑えており、価格の低下傾向が続く。
,,□,衣料品専門店（経営者）,・気候が良くなっても、売上が増加しない。
,,□,家電量販店（経営者）,・家電リサイクル法対象４品目を中心に売上の低迷が続く。特に夏場の最有力商品であるエアコンが苦戦する。
,,□,乗用車販売店（経理担当）,・夏までに数種の新型車が発売されるが、これらの車種は量的に期待できず、また最近の来客状況からみて上昇気流には乗れない。
,,□,高級レストラン（スタッフ）,・予約状況が厳しいため、フリー客の減少を食い止める販売促進策を行っているが、効果は期待できない。
,,□,都市型ホテル（スタッフ）,・宿泊、婚礼、宴会ともに予約はやや減少しているが、客の意思決定が遅くなっている傾向を考慮すると、前年並みが予想される。
,,□,通信会社（営業担当）,・携帯電話の新規登録件数はほぼ横ばいで推移する。
,,□,通信会社（社員）,・新商品や新料金プランが登場する見込みはない。
,,□,住宅販売会社（従業員）,・総合展示場の来場者のほとんどが、観光客のような雰囲気であり、来場者数の割には契約数があまり変化していない。
,,▲,商店街（代表者）,・前年秋にオープンした郊外の大型ショッピングセンターの影響が徐々に生じている。
,,▲,百貨店（営業担当）,・夏に向かって、「客が見に来る、買いに来る、試しに来る」という魅力的なヒット商品がない。
,,▲,コンビニ（経営者）,・企業の低価格戦略が終わらない限り、客単価の下落は続く。
,,▲,スナック（経営者）,・客の会話の中に、「仕事が底をついた、赤字を承知で仕事を取っている、先の見通しは立たない」などの話が多くなっている。
,,▲,観光型旅館（経営者）,・参議院議員選挙などによる旅行の手控えがある。
,,▲,観光型旅館（スタッフ）,・５、６月の予約件数が大幅に減少している。
,,▲,タクシー運転手,・夜の飲食街へタクシーを利用して来る人が少ない。
,,▲,競輪場（職員）,・車券売上高がますます減少している。
,,▲,住宅販売会社（経営者）,・雇用の先行き不安と政治不安等により、大型消費の決心がなかなかつかないためか、イベントを開催しても来場者数が増加しない。
,,×,テーマパーク（職員）,・来客数の判断指標となる近隣温泉地の旅館の予約状況は前年同月比で２けた以上の減少となっている。また、レストラン、大口団体の予約状況が悪化し、旅行代理店からの問い合わせ件数も激減している。
"企業
動向
関連

(北陸)",,◎,－,－
,,○,通信業（営業担当）,・ＡＤＳＬという新サービスも始まっており、ＩＴ需要はまだ伸びる。
,,□,プラスチック製品製造業（企画担当）,・受注単価が横ばいである。
,,□,通信業（営業担当）,・携帯電話市場の飽和化で、特に大口先の奪い合いが続く。
,,□,不動産業（営業担当）,・土地の需要は、購入よりも賃貸の比重が高まっている一方で、企業のリストラにより売却案件が増加しているため、価格が低下しても、需要と供給のバランスが取れない。
,,▲,輸送業（配車担当）,・あらゆる業種からの受注量が減少し、それに伴い輸送単価が低下している。
,,▲,新聞販売店［広告］（従業員）,・小売業、特にスーパーなどの量販店では手の打ちようがないという状況に入っており、小売業界に疲れが出始めている。
,,×,精密機械器具製造業（経営者）,"・現在の操業度が２、３割程度低下している企業や、３か月先の受注を確保していない企業は非常に多い。
・新商品の受注においても単価の低下が著しい。"
,,×,建設業（経営者）,・公共事業抑制の影響を受けて、４月に手形決済が出来ないため不渡りを出した業者も現れ、連鎖倒産の恐れもある。
,,×,建設業（総務担当）,"・元請企業のみならず、下請業者も仕事量が減少している。
・採算についても同様に悪化しており、現状の経営は更に苦しい。"
"雇用
関連

(北陸)",,◎,－,－
,,○,職業安定所（職員）,・多くの業種でアウトソーシングが進み、各企業の収益性は良くなっているため、全体的に業績は向上する。
,,□,新聞社［求人広告］（担当者）,・求人広告の掲載件数が横ばいである。
,,□,職業安定所（職員）,・例年４月は求職者が増加するが、現在の求人内容から判断すると、就職者は大幅には増えない。
,,▲,求人情報誌製作会社（編集者）,・製造業において先行き好転要因がみえないため、求人数は増加しない。
,,▲,職業安定所（職員）,・ハローワークでの求人数は減少傾向にあり、逆に求職者数は増加傾向にある。
,,▲,学校［大学］（就職担当）,・13年２～４月の３か月間の求人件数は、前年同期比で11％の減少で推移しており、当面各企業の新卒者採用は期待できない。
,,×,－,－
,,,,
　７．近畿,,,,
,,,,（－：回答が存在しない、＊：主だった回答等が存在しない）
分野,,景気の先行き判断,業種・職種,景気の先行きに対する判断理由
"家計
動向
関連

(近畿)",,◎,都市型ホテル（スタッフ）,・ユニバーサル・スタジオ・ジャパン関連の宿泊予約がかなりの勢いで入っており、５、６、７月は過去にない伸び率となっている。
,,○,商店街（代表者）,・ユニバーサル・スタジオ・ジャパンの集客効果に皆が期待している。
,,○,百貨店（売場主任）,・２、３か月後に挙式を予定し、現在ブライダル関連商品を買い求める客は、かける予算が今までよりも1.5倍ほど上昇しており、それにまつわる消費も起こるとみられる。
,,○,コンビニ（エリア担当）,・既存店平均日販が上昇している。
,,○,家電量販店（営業担当）,・４、５月は家電リサイクル法施行前の駆け込み需要の反動が考えられるが、６月あたりからは来客数が増加する。
,,○,乗用車販売店（営業担当）,"・新型車が出るので、前年よりも販売台数は伸びる。
・大阪地区のユーザーはユニバーサル・スタジオ・ジャパンの効果等で元気が出てきている。"
,,○,その他専門店［医薬品］（経営者）,・少しずつではあるが、買上点数や客単価が上昇している。
,,○,その他専門店［ゴルフ用品］（経営者）,"・全体的に買上点数が増加している。
・ゴルフコンペに行くという客の声が多く聞かれる。"
,,○,一般レストラン（スタッフ）,・ユニバーサル・スタジオ・ジャパンの効果がもっと具体的に出てくる。
,,○,観光型ホテル（経営者）,・ユニバーサル・スタジオ・ジャパン関連の宿泊は今のところ様子見だが、６月ぐらいからは関連要素がみられる。
,,○,都市型ホテル（支配人）,・ユニバーサル・スタジオ・ジャパンを核とした人の動きがあり、今後ともホテルには多くの客が予想される。
,,○,旅行代理店（店長）,"・７月出発の海外旅行の動向が前年を上回る。
・７月20日からの３連休とそれに続く夏休みがあり、国内旅行の動向は上向く。"
,,○,住宅販売会社（営業担当）,・全社的に客の動きが活発になっており、より活発で受注も増加している東日本の影響が西日本にも及ぶ。
,,□,一般小売店［酒］（経営者）,・企業の合併や統合が進むなか、消費者は先行きに不安を感じている。
