Ⅱ．景気の先行きに対する判断理由,,,,
,,,,
　景気の先行きに対する判断の理由について、その主だったもの及び特徴的と考えられるものを取りまとめると以下のとおりであった。,,,,
,,,,
,,,,
　１．北海道,,,,
,,,,（－：回答が存在しない、＊：主だった回答等が存在しない）
分野,,景気の先行き判断,業種・職種,景気の先行きに対する判断理由
"家計
動向
関連

(北海道)",,◎,一般小売店［土産］（店員）,・有珠山の噴火の影響も薄れ、観光客の動きも大分回復している。大阪のユニバーサル・スタジオ・ジャパンのオープンが北海道観光にどのように影響を及ぼすかが不安材料である。
,,◎,住宅販売会社（営業担当）,・４月に新しい展示場を２つオープンしたところ、春ということもあり大勢の客が来場している。冬期は住宅購入を検討する人は少ないが、これから２、３か月後は住宅契約に向けた話が期待できる。
,,○,百貨店（売場主任）,・天候による夏物商材の活発な動きが予想される。また、新内閣に対する期待感がある。
,,○,スーパー（企画担当）,・道内の失業率は依然として高い水準だが、小泉政権の誕生で消費マインドは上向く。
,,○,一般レストラン（スタッフ）,・５、６月の食事予約が少しずつ入ってきているので、売上の増加が見込めると期待している。
,,○,旅行代理店（従業員）,・旅行受注件数が個人客で上向きにあり、法人客でも若干ではあるが先行きが明るい状況になっている。
,,○,住宅販売会社（従業員）,・来客数が増加傾向にあるので、価格競争はあるものの営業展開によっては多少状況が改善される。
,,□,商店街（代表者）,・購買動向が消極的かつ慎重になっている。
,,□,商店街（代表者）,・依然として慎重な客が多く、必要な物を必要なときに買うという考え方が主流である。また、季節商材についても今後ますます価格競争が激しくなる。
,,□,スーパー（店長）,・地域の基幹産業である水産業で、漁獲量割当ての削減による低迷が続いている。
,,□,スーパー（店長）,・観光シーズンも本番に入り、有珠山噴火の影響もなく、観光客の増加も期待できるが、客単価の低下が利益を圧迫することが懸念される。
,,□,コンビニ（エリア担当）,・気候が良くなり来客数は増加しているが、全体として安い物に走るので売上は前年と変わらず、今後もこの傾向は続く。
,,□,コンビニ（エリア担当）,・来客数は回復基調にあるが、買上点数が変化しておらず、今後も客単価の上昇が期待できない。
,,□,衣料品専門店（店長）,・買い渋りが目立っている。
,,□,衣料品専門店（店員）,・最近は洋服にお金をかける客が少なく、小物、バック、帽子に目が行くようである。洋服を多く売るには来客数も多くしなければいけないがその見通しが立たない。
,,□,乗用車販売店（従業員）,・法人客で買換えが控えられている中で、個人ユーザーもこれに引きずられている。
,,□,自動車備品販売店（店長）,・売上は、この２か月間好調であるが、来客数については、前年をクリアするのがやっとという状況である。
,,□,住関連専門店（営業担当）,・競争が激しく価格低下が続いている。
,,□,高級レストラン（スタッフ）,・観光のオンシーズンに入り前年の悪影響も払拭され好調に推移するとみられるが、地域経済に明るい材料がなく今後も個人消費の伸びはあまり期待できない。
,,□,高級レストラン（スタッフ）,・低価格志向が続き、来客数が増加しても売上増加は見込めない。
,,□,タクシー運転手,・夜間や雨の日などタクシーの利用が増加するときに、利用が増加していない。
,,□,観光名所（役員）,・道外客は団体客から個人客にシフトしており、道内客の状況も先細りである。
,,▲,商店街（代表者）,・低価格志向が続いており、売上の増加が全く期待できない。
,,▲,百貨店（売場主任）,・単品買い中心であり、高額品の動きがない。
,,▲,スーパー（店長）,・当地域においては今年度の春闘ベースアップがほとんど上がらない状態であり、可処分所得も実質マイナスの状況である。
,,▲,スーパー（企画担当）,・春物衣料に動きが出たが、食品、日用雑貨については買い控えが続き、全体的に生活防衛の意識が薄らいでいない。今後は食品など買い回り頻度の高い物の買い控えが強まる。
,,▲,コンビニ（エリア担当）,・客単価の低下が続いている。天候が良くなっても、ビールや飲料水の伸びが悪い。
,,▲,観光型ホテル（スタッフ）,・連休中の宿泊状況は満室であるが、５月以降の予約状況は出足が非常に悪い。
,,▲,タクシー運転手,・観光客の入込は多いが、１人当たりの購買力は非常に鈍っている。
,,×,スナック（経営者）,・３、４月は歓送迎会需要があると期待したが芳しくなく、これからも明るい見通しはない。
"企業
動向
関連

(北海道)",,◎,－,－
,,○,金属製品製造業（統括）,・住宅の着工が始まるので、これに伴い受注が増加する。
,,○,通信業（営業担当）,・今月は、年度明けということで設備投資をする客が若干多く、このままいけば２、３か月先には、良い流れになっている。
,,○,その他サービス業［建設機械レンタル］（総務担当）,・今の状況は悪いが、仕事はたくさんある。15か月予算、特にゼロ国債関連の工事発注が予定され、順調な着工が期待できる。
,,□,食料品製造業（団体役員）,・加工原料である中国産の安価な原料が増加しており製品価格の競合が激しく製品単価が一段と低下している。企業間の経営体力にも格差があり小企業の倒産が増加している。
,,□,通信業（営業担当）,・通信業界に関しては、依然として投資意欲があるが、全体の景気をみると、先行きへの不安感が広がっているようである。
,,□,金融業（企画担当）,・中小企業に対する特別保証制度が３月末で終了して企業倒産件数も増加している。設備資金も現状のまま低水準で推移するとみられる。
,,□,その他サービス業［建設機械リース］（支店長）,・重機、車輌関係の動きが悪い。また、旭川地域は木材産業が不振で明るいニュースがない。
,,□,その他サービス業［建設機械リース］（従業員）,・設備投資が依然低調で３か月先もこの状態が続く。
,,▲,金属製品製造業（経営者）,・物価がますます低下していくような気配を感じる。道内で状況が良いという話も聞かない。
,,▲,輸送業（支店長）,・取引先の中には金融機関の融資条件が更に悪くなり資金繰りが困難になっているところがある。今後は第二分類の会社が倒産予備軍となるとみられる。製紙業の好調も頭を打ってきている。
,,×,－,－
"雇用
関連

(北海道)",,◎,－,－
,,○,求人情報誌製作会社（編集者）,・ゴールデンウィークが終わり、農業を含めた一次産業が動き出し、公共事業も継続しているという状況の中で、パート主導ながらも雇用が少し改善される。
,,○,求人情報誌製作会社（編集者）,・５月からのマイラインに伴い関連業種で、募集、出店、新店舗に伴う求人などの動きがみられる。
,,□,求人情報誌製作会社（編集者）,・アルバイトなどの求人は、増加する可能性はあるが、雇用全体の状況が良くなるとは考えにくい。
,,□,新聞社［求人広告］（担当者）,・新規求人数では、営業社員募集件数が若干増加したが、内勤事務系の募集は依然として少ない。
,,□,職業安定所（職員）,・新規求人の対前年度比の増加傾向が続き、就職件数も増加しているが、求職者数は依然として減少していない。
,,□,職業安定所（職員）,・新規求人件数は増加しているが、パートの割合が高く被保険者数は減少傾向にある。
,,□,学校［大学］（就職担当）,・就職状況は非常に悪く、企業の採用枠も増加していない。学生の意識としても、まだ景気は良くなっていないという感じである。
,,▲,＊,＊
,,×,－,－
,,,,
　２．東北,,,,
,,,,（－：回答が存在しない、＊：主だった回答等が存在しない）
分野,,景気の先行き判断,業種・職種,景気の先行きに対する判断理由
"家計
動向
関連

(東北)",,◎,タクシー運転手,・夜の街に活気が出てきて、人出も多く客待ちの時間が少なくなっている。
,,○,商店街（代表者）,・前年４月が最下点で一進一退が続き、今年に入ってからは前年より好転している。今年の５月から７月が山場であり動向を注意している。
,,○,商店街（代表者）,・今年は猛暑予想であり、夏物の売行きが期待できる。
,,○,一般小売店［書籍］（経営者）,・新年度、新たな体制により店頭商品に期待感が持てる。
,,○,百貨店（売場主任）,・母の日ギフトやブライダルギフトなどに期待している。
,,○,スーパー（店長）,・わずかであるが、特売商品以外の商品も動き出している。
,,○,観光型旅館（経営者）,"・６月の申込が先行して良くなっている。
・東北地方では、アジア、特に台湾からの客が増えているが観光対策が著しく遅れている。"
,,□,一般小売店［雑貨］（企画担当）,・来客数は増えているが、買上価格が低下しており、強弱どちらの指標も出ている。
,,□,一般小売店［カメラ］（店員）,・特別これといった行事もなく、このまま推移する。
,,□,百貨店（広報担当）,"・お中元時期の選挙は強い抑制が働くため影響が大きいが、夏のセールなどが早まり一時的な希望は持てる。
・厳しい状況の中で比較的好調を維持しているのは、輸入ブランド品、婦人靴、化粧品などであるが、紳士服やリビング関連は改善されていない。消費の二極分化と言われており、消費は単純に抑制傾向にあるのではなく、シビアになっている。この業界では、そうしたニーズに迅速に対応できるかで明暗が別れる。"
,,□,スーパー（企画担当）,・競合激化に伴い客単価が低下している。売上を増やすためには集客を上げるしかないが、現状打つ手がない。
,,□,コンビニ（エリア担当）,・単価に動きはなく、季節的なイベント次第で来客数が左右される。
,,□,衣料品専門店（経営者）,・夏物は天候次第であるが、現在の悪い状況から急に景気が回復するとは思えず、この悪い状態が続く。
,,□,家電量販店（店長）,"・天候次第ではあるが、ボーナスが出てみなければ分からない。
・必要な電化製品でも新製品が出なければ購入に結び付かず、厳しい。"
,,□,乗用車販売店（経営者）,・天候的に恵まれた４月の販売からみて、販売計画以上の売行きは期待できない。
,,□,高級レストラン（経営者）,・現在の景気の悪さは、客に金が無いのではなく、多分にマインドによるものである。将来に対する道が開ければ、回復していく。
,,□,一般レストラン（経営者）,・社会情勢からも先がみえず、ストレスを発散するために来客はあると思うが、これまで同様に低単価である。
,,□,一般レストラン（経営者）,"・客単価の低下に歯止めがかかっていない。
・リピーターの回数が減少している。"
,,□,通信会社（社員）,・客への各種提案には新規導入の話はほとんどなく、既存のコスト削減に重点を置かざるを得ない。
,,□,観光名所（職員）,・予約状況や問い合わせ状況から、改善の兆候がみられない。
,,▲,一般小売店［医薬品］（経営者）,・選挙が始まると、景気が悪くなる。
,,▲,百貨店（売場主任）,・カードでの買物が激減している。
,,▲,スーパー（店長）,・チラシ価格競争や一般食料品の主力定番商品の価格引下げが続いており、利益確保ができず一段と厳しくなる。
,,▲,スーパー（経理担当）,・工夫次第で来客数は維持できるが、客単価の下落は歯止めがかけられない。
,,▲,スーパー（店員）,・来客数の減少が続き、共同購入の利用者も減少している。
,,▲,衣料品専門店（店長）,・消費者マインドがデフレモードに入り、小売業は値を下げざるを得ない。これによって客数確保ができるか問題であるが、今のところ手ごたえがない。
,,▲,その他専門店［ガソリンスタンド］（経理担当）,・ガソリンなどの販売価格は落ち着いていたが、セルフスタンドが進出したため周辺スタンドは価格戦略で対抗せざるを得ず、厳しい状況である。
,,▲,観光型ホテル（経営者）,・５月はゴールデンウィークを含め前年並み、６月は10月に続く繁忙期であるが今年の予約状況は２割減。７月は参議院選挙と市長選挙があり見通しが立たない。今後３か月は厳しい状況が予測される。
,,▲,観光型ホテル（スタッフ）,・予約状況など良くない。
,,▲,観光型旅館（経営者）,"・先行きに不安を感じており、金は持っていても旅行や観光を自粛している。
・旅館業界では、潰れるべきところは潰れたが、中堅でも体力の限界に来ている旅館が多くなる。この業界は過去に大きな債務を抱えており、設備産業にとってはデフレの影響が大きく厳しい。"
,,▲,都市型ホテル（スタッフ）,・例年７、８月でも披露宴の予約はあるが、今年は例年の半分である。
,,▲,旅行代理店（従業員）,・５月以降の海外旅行の予約状況が悪い。
,,▲,住宅販売会社（従業員）,・住宅購入者層の40％近くを占めていた40歳台の客が減少し、20台後半から30歳台前半の客や50歳台後半の客が増えているため、総体的に来客数が減少している。
,,×,通信会社（営業担当）,・実質的な値下げにより収益構造が悪化している。
"企業
動向
関連

(東北)",,◎,－,－
,,○,電気機械器具製造業（経営者）,・今が底であり、引き合い状況から７月以降に本格的な回復が見込まれるものの、それまで資金的につなぐのが最大課題である。
,,○,金融業（営業担当）,・実際の資金動向に結び付いてはいないが、設備投資や運転資金などで前向きな企業が増えている。
,,□,食料品製造業（経営者）,・取引先では、商店街の小売店や酒販小売店などの零細小売店で体力を消耗し、今後も今まで同様に閉店が続く。
,,□,出版・印刷業（経理担当）,・印刷の受注価格が低下している中、前年は印刷用紙が値上がりし、今年はインクが値上がりするため収益が圧迫されている。
,,□,電気機械器具製造業（総務担当）,・半導体業界の市場価格回復は秋ごろとみており、３か月先では変わらない。
,,▲,食料品製造業（経営者）,・例年６月から８月は極端な閑散期となるが、今年は従来にない状況になる。
,,▲,建設業（企画担当）,"・活況感のあった一部製造業の設備投資が、大きく後退している。
・住宅投資も底打ち状態であり設備投資が上向く材料が見当たらない。"
,,▲,輸送業（従業員）,・荷主からの値引き要請が厳しい。
,,▲,経営コンサルタント,・ベンチャー企業の資金繰りが悪化し、倒産が増える。
,,×,繊維工業（営業担当）,・秋冬物の展示会を実施しているが、受注が大きく減少しており、売上と利益が悪化する。
,,×,新聞販売店［広告］（店主）,・地元ワカメが安い中国産に押され、売れずに困窮している企業や家庭が多く、新聞の解約が増える。
"雇用
関連

(東北)",,◎,－,－
,,○,人材派遣会社（社員）,・前月までの年度末需要で、現在一服感があるが、外資系企業の仙台進出があり、それに伴う派遣依頼が出ている。
,,□,人材派遣会社（社員）,"・雇用は横ばい状態が続いている。
・これ以上の採用中止は労務構成上から続けられない。"
,,□,人材派遣会社（社員）,・派遣社員からアルバイトへの切替えなど企業の人件費低減対策が続いている。
,,□,人材派遣会社（社員）,・派遣業界のニーズに変わりないが、同じパイの奪い合いとなっており、市場そのものに変化はない。
,,▲,職業安定所（職員）,・前年比で増加してきた求人数の伸びが止まり、増加する要素がみつからない。
,,▲,職業安定所（職員）,・当所管内の求人は９年から10年ほど前の高い水準に回復しているが、反面人員整理がかつてないほどの規模で行われつつあり、厳しい状況である。
,,▲,職業安定所（職員）,"・事業所閉鎖や解雇者の発生で、失業期間が長期化し求職者の増加が見込まれる。
・建設業を中心に先行きを不安視する事業所が多く、今までのような大量求人は期待できない。"
,,▲,職業安定所（職員）,"・雇用保険受給資格者の決定件数が前年比で30％増加している。
・企業整理による解雇者数が38％増加している。"
,,▲,職業安定所（職員）,・新規求人が減少に転じたことや、来月中旬に新潟第３位の銀行が営業譲渡することにより大量の離職者が発生するため、雇用情勢は予断を許さない状況である。
,,▲,職業安定所（職員）,・輸出不振の製造業や消費低迷の小売業でリストラが進む。
,,×,－,－
,,,,
　３．北関東,,,,
,,,,（－：回答が存在しない、＊：主だった回答等が存在しない）
分野,,景気の先行き判断,業種・職種,景気の先行きに対する判断理由
"家計
動向
関連

(北関東)",,◎,－,－
,,○,衣料品専門店（販売担当）,・前月に比べて、今月は買物に対する客の態度が良くなってきている。周りの状況を考えても今後良くなっていく。
,,○,一般レストラン（店長）,・客は単価の低い商品に集中していたが、高額商品にも若干流れてきている。
,,○,通信会社（営業主任）,・ＣＡＴＶ、インターネット、ブロードバンドなどの言葉が世間に出るようになって、需要が多くなっている。
,,○,通信会社（社員）,・携帯電話の販売数が伸びており、今後も増加傾向が続く。
,,○,住宅販売会社（経営者）,・広告等への反応が良く、来客数が通常より20％増加している。
,,□,商店街（代表者）,・イベントでは人出はあるが、単価の低い商品だけが売れ、高額商品は売れない。
,,□,百貨店（販売促進担当）,・売上動向のバロメーターである食品の売上が減少気味である。
,,□,コンビニ（店長）,・客は生活に困っているわけではなく、よほど欲しい物がない限り、購買意欲がわかない。
,,□,乗用車販売店（経営者）,"・新型車の登場という明るい材料はあるものの、それだけではこの先明るさは長く続かない。
・イベントを展開しても経費がかかるだけで、自らの首を絞めることになる。"
,,□,住関連専門店（店長）,・商圏内は店舗過剰気味で、この状況が変わる要素はない。
,,□,競輪場（職員）,・本場開催、場外開催ともに売上が減少している。
,,□,美容室（経営者）,・客は少しでも生活を節約するムードであり、来店間隔も拡大している。
,,□,設計事務所（所長）,・仕事量はあるが、収入増に結び付かない。
,,▲,商店街（代表者）,・来客数は減少している。来店しても見るだけ、覗くだけの客がほとんどで、実際に買物する客は随分減っている。
,,▲,スナック（経営者）,・先行きに不安感、不透明感がある。
,,▲,旅行代理店（従業員）,・例年と比べ、予約が非常に遅く、単価が低下している上、30名のグループ予約の予定が実際は20名になるという厳しい状況である。
,,▲,設計事務所（所長）,・前年度の決算では、売上は多少減少した程度だが、利益が出ず、仕事はあるが、利益が少ない状態が続いている。
,,×,－,－
"企業
動向
関連

(北関東)",,◎,－,－
,,○,その他サービス業［情報サービス］（経営者）,"・受注量が増加しており、納期調整がつかず、開発が間に合わない状態が続いている。
・協力会社も仕事量が一杯で、なかなかこなせない。"
,,□,新聞販売店［広告］（総務担当）,・取引先のレジャー施設、ホテル関係の話では、値下げをしても来客数は前年水準に達せず、若者の利用が減少し、食事もコンビニ等からの持込みですませている客が多い。
,,▲,建設業（経営者）,・民間、官公需とも減少傾向にあり、増加する見込みがない。
,,▲,金融業（融資担当）,・客から給料が減るという話を聞く。今後、消費の切り詰め等で支出も減少するとみられる。
,,×,輸送用機械器具製造業（総務担当）,・３か月先の受注予定は、前年比５％の売上減少となっている。コストダウンも響いてくるので、さらに悪くなる。
"雇用
関連

(北関東)",,◎,－,－
,,○,学校［短期大学］（就職担当）,・中堅企業からの来年３月の卒業生あて求人票が、例年と比較して増加している。求人票の出足も早く、求人数も増えている。
,,□,人材派遣会社（経営者）,・建設業や流通業など不況業種と言われる分野を除けば、世間で言われるほど景気は落ち込んでいない。派遣に対する求人需要は、引き続き堅調に推移している。
,,□,求人情報誌製作会社（経営者）,・発注状況、仕事状況に、明るい要素がみられない。
,,▲,職業安定所（職員）,・地域の大手企業で再編整理を実施する予定があり、その影響で求職者の増加が見込まれる。
,,×,－,－
,,,,
　４．南関東,,,,
,,,,（－：回答が存在しない、＊：主だった回答等が存在しない）
分野,,景気の先行き判断,業種・職種,景気の先行きに対する判断理由
"家計
動向
関連

(南関東)",,◎,＊,＊
,,○,商店街（代表者）,・小売店側の必死の販売促進努力に客が反応するようになっている。
,,○,スーパー（店長）,・今まで我慢していた必要な物、ぜいたくな物を少しずつ購入するようになっている。
,,○,都市型ホテル（スタッフ）,・客単価が徐々に上昇しつつあり、値下げ競争が底を打った感がある。
,,○,旅行代理店（従業員）,・宿泊申込が比較的顕著に増加している。
,,○,旅行代理店（従業員）,・個人客からの旅行パンフレットの問い合わせ等が非常に多いため、今後の申込が期待できる。
,,○,通信会社（営業担当）,・客の様子をみると、ケーブルテレビ放送、インターネットサービスへの需要は底固い。
,,○,住宅販売会社（従業員）,・住宅金融公庫の受付開始により業界全体の物件供給が活発になるほか、ゴールデンウィークのキャンペーン効果により契約数は増加する。
