Ⅱ．景気の先行きに対する判断理由,,,,
,,,,
　景気の先行きに対する判断の理由について、その主だったもの及び特徴的と考えられるものを取りまとめると以下のとおりであった。,,,,
,,,,
,,,,
　１．北海道（地域別調査機関：（株）北海道二十一世紀総合研究所）,,,,
,,,,（－：回答が存在しない、＊：主だった回答等が存在しない）
分野,,景気の先行き判断,業種・職種,景気の先行きに対する判断理由
"家計
動向
関連

(北海道)",,◎,－,－
,,○,商店街（代表者）,・ＳＡＲＳの影響で観光客が北海道に流れてきている。観光客は九州・四国・沖縄・中国・台湾などへはほとんど行かず、北海道に来ている。特に、道東地区は観光客の入込が昨年より多く、これからもそういう傾向で続くと思われる。
,,○,家電量販店（店長）,・プラズマテレビ・液晶テレビ・ＤＶＤレコーダーなどのデジタル家電商品が伸びると予測される。
,,○,観光型ホテル（経営者）,・ＳＡＲＳの影響がまだ残っており、海外旅行から国内旅行に振り替えた客の予約が例年に比べて多くなっている。
,,○,観光型ホテル（スタッフ）,・暑い関東地区からの避暑を兼ねて、北海道への観光入込も、今後、増加に転じるものと期待される。
,,○,旅行代理店（従業員）,・先々のハネムーン申込が増えてきており、ＳＡＲＳのニュースが減少してきたこともあって海外旅行の広告量が増加してきている。
,,○,通信会社（企画担当）,・カメラ付き携帯のラインナップがいよいよ充実し、100万画素を超える高機能商品が目白押しとなる。そうなれば個人のおもちゃであったカメラ付き携帯がいよいよビジネスユースとして本格的に導入される。
,,○,美容室（経営者）,・来店周期が短くなってきたため、若干だが売上が上昇し始めている。
,,□,商店街（代表者）,・先行きに不安のあるニュースが多いなど、消費に与える心理的な要素が強く、現在の状況が続くと思われる。
,,□,商店街（代表者）,・大手百貨店が８月に閉店するため、商店街への来訪者は大きく減少することが予想されるが、９月は逆の現象が表れると予想している。今月は新しい駅舎がオープンしたが、駅と地元住民との継続的なコミュニケーションをとる仕掛けがないため、駅前商店街の今後の活性化に寄与する具体的な要素はなく、期待はずれとの声が多い。
,,□,商店街（代表者）,・夏物セールの前倒しで、今月からセールが開始されているため、勢いのなさが予想される。
,,□,百貨店（売場主任）,・来客数が更に減っていることと、夏のボーナスが相当ダウンしているので、今後も引き続き期待できない。
,,□,百貨店（売場主任）,・夏のボーナスの一般的な支給から数週間がたったが、ボーナスを使っての買物が全くみられない。ボーナスを、この先の生活源にする状況であり、これからもそれほど消費が動く経済状況ではないと思われる。
,,□,スーパー（店長）,・大手百貨店の閉鎖が８月に決定し、大量解雇の話が飛び込んでいる状況下で、消費の拡大等の期待は薄いと思う。
,,□,スーパー（企画担当）,・運動会セールや行楽商品の売行きが今一つ盛り上がりに欠けており、足元の消費環境から判断すると、今後の盛夏商戦での巻き返しも厳しくなる。
,,□,コンビニ（エリア担当）,・海外旅行を控える分、道内観光が増えるかと思うが、客単価の減少は止まっていないため、全体としては変わらない。
,,□,コンビニ（店長）,・コンビニ業界で初の試みとなる新商品に期待はするが、状況としては変わらないというより、これ以上は落ちようがないというところと思われる。
,,□,衣料品専門店（店員）,・必要以外の物に対する買物に慎重なのは変わらないので、今と変わらない状況が続く。
,,□,家電量販店（地区統括部）,・依然として客単価は前年比で５～10％のダウン傾向にある。北海道の景気も低調で、消費者のマインドも冷えている。また、商品的に期待できる商品も特に見当たらない。
,,□,住関連専門店（営業担当）,・将来的に消費税率がアップするという話題やボーナスから引かれる保険料率の上昇などから、生活防衛型の行動パターンが取られ、消費行動を圧迫する。
,,□,スナック（経営者）,・旭川では７月から、地元航空会社が３往復することになり、少しは観光客が入るかと思うが、今の状態では変わらない感じがする。
,,□,スナック（経営者）,・企業としても経費を締めるところは交際費であり、接待なども少なくなっている。また、団体客の利用は多いほうであるが、個人的な利用が少なくなっている。客は飲み放題など、単価のはっきりしているほうが良いようである。
,,□,観光型ホテル（経営者）,・予約状況は、出足は良くないものの、情報のスピードアップのせいか比較的、直前の予約が増加傾向にあり、月内の仕上がりはまずまずといった状況にある。
,,□,旅行代理店（従業員）,・ＳＡＲＳ騒動は鎮静化しつつあるが、海外旅行の回復には時間を要する。２～３か月では回復しない。
,,□,タクシー運転手,・夜間のススキノの人出などタクシーを利用する客の増加が見込めない。
,,□,タクシー運転手,・ここへきて、大手フェリー会社の倒産があり、函館は青森からのフェリー客がかなり入っているので、それがどうなるかが心配で、先行きの見通しが全くつかない。
,,□,観光名所（役員）,・今後の観光客の入込の見通しはプラスとマイナスの要因で相殺され、横ばい程度が見込まれる。
,,□,住宅販売会社（従業員）,・客の様子からは、需要意識が非常に低下していることが根本的にある。その点から商品の販売量が増大するとは考えづらく、全体としては変わらない。
,,▲,スーパー（店長）,・可処分所得の低下が引き続いている状況であり、年金の減少も経済低下の重要な要因となっている。
,,▲,衣料品専門店（店長）,・たばこ増税、医療費負担の拡大などで買い渋りが発生していきそうである。
,,▲,その他専門店［医薬品］（経営者）,・ポイントシステムを導入したが、それでも前年比を上回れないと思うくらい、客の購買力が悪い。
,,▲,高級レストラン（スタッフ）,・数か月先の予約が減少しており、前年と比べて、かなりスロースタートとなっている。また、観光客が増えても、ホテルで夕食を取らないケースが多く、観光のあり方が様変わりしてきた。
,,▲,旅行代理店（従業員）,・海外旅行が上向きにならなければ旅行そのもののイメージが回復しない。国内旅行も同様で消費者の動向が読みにくい。
,,×,スーパー（店長）,・全体の傾向は大きくは変化してないが、競合環境の更なる激化を要因として、来客数の減少が今月に入り顕著となっている。食品部門では、前月からやや回復したが、傾向としては減少傾向にある。
,,×,コンビニ（エリア担当）,・地域経済が非常に厳しいなか、競合店が秋に向けてたくさん出店してくる。競争環境が更に厳しくなると考えている。
,,×,コンビニ（エリア担当）,・早朝の、工事現場に向かう作業員の来客数が減少している。これは予算削減によるもので、今後一年間は間違いなく継続していくと思われる。
,,×,旅行代理店（従業員）,・ＳＡＲＳの沈静化が期待できる状況だが、第一四半期の穴を埋めるために、更なる経費の節減などが求められており、良くなる要素に乏しい。
"企業
動向
関連

(北海道)",,◎,－,－
,,○,通信業（営業担当）,・通信、ＩＴに関する顧客の姿勢が以前よりは前向きになってきている感じはある。現状からは少し上向きに転じるのではないかと感じる。
,,○,その他企業［コンベンション担当］（従業員）,・新規ホテルや札幌駅の大型複合商業施設の開業、ＳＡＲＳの影響などで観光客、旅行代理店が道内に目を向けており、コンベンション需要が増加する可能性がある。
,,□,食料品製造業（団体役員）,・加工原魚の不漁から原料価格が高値となり、生産価格に転化しないと採算が合わない状況になってきている。
,,□,建設業（経営者）,・公共事業並びに民間工事の量的な落ち込みと競争の激化で、売上、利益ともに非常に厳しい状態であり、今後も好転は期待できない。
,,□,金融業（企画担当）,・夏期ボーナスの伸びは期待できないが、株価の持ち直しで個人消費は横ばいで推移する見込みである。観光関連もＳＡＲＳの沈静化で大きな落ち込みはないと思う。
,,□,その他サービス業［建設機械リース］（支店長）,・所有設備を売却して、事業を縮小する事例を良く聞く。
,,□,その他非製造業［機械卸売］（従業員）,・設備投資案件が極端に少なくなっており、あっても見積提出を何度もさせられ、価格ばかりどんどん安くなっている。
,,▲,金属製品製造業（統括）,・物件の見積金額の総量が、前年より大幅に少なく、今後の受注額の減少が予想される。
,,▲,その他サービス業［建設機械リース］（支店長）,・銀行の動向に懸念があり、取引スタンスが変わる恐れがある。
,,×,食料品製造業（経営者）,・政府の規制緩和が一向に進まず、企業のビジネスチャンスも拡大しないため、実質的な収入は目減りしている。そうしたなか、増税に対するアナウンスがあり、市民が消費を増やそうというマインドには程遠く、その分を食費の切り詰めでカバーしようとする動きは、更に加速する。
,,×,その他サービス業［システムハウス］（経営者）,・赤字決算の会社や、倒産する会社のニュースばかりが目につくなかで、設備投資意欲が出てくるとは思えない。また、必要最小限の投資をするにしても予算は厳しく、ソフト業界では、中国へ仕事を出すことでそのリスクを回避しようという流れは、さらに激しくなっている。
"雇用
関連

(北海道)",,◎,－,－
,,○,職業安定所（職員）,・今夏から秋にかけて商業施設の進出が予定されており、雇用需要が見込まれる。
,,□,人材派遣会社（社員）,・３か月後辺りには契約更新の時期を迎えるが、派遣料金の据置きや引下げ等の要望が相変わらずある。
,,□,求人情報誌製作会社（編集者）,・求人件数は減り気味になっているが、業種でみると、建築関連が一段と減り、ほかはスナック系が減っている状況であり、どちらも景気の影響というより、構造的なものと思われる。その他の業種では小売系がやや落ち着いた感がある。
,,□,求人情報誌製作会社（編集者）,・現在の所、インパクトのある雇用の創出要因が見当たらない。また、当地域では人口の伸びが鈍化していることから、地域全体としても、しばらくは雇用の拡大基調はないと思われる。
,,□,求人情報誌製作会社（編集者）,・建設業の下落に歯止めがかかっていない。飲食系も前年に比べて数％のマイナスとなっているが、それ以外の業種では大きな変化がなく、こうした状態がもう少し続きそうである。
,,□,職業安定所（職員）,・有効求人倍率は、11か月連続して前年同月を上回っているものの、前月より減少しており、全道平均より低い水準で推移している。
,,▲,職業安定所（職員）,・大手百貨店が８月に閉店されることから、大量の離職者の発生が予想される。
,,×,＊,＊
,,,,
　２．東北（地域別調査機関：（財）東北開発研究センター）,,,,
,,,,（－：回答が存在しない、＊：主だった回答等が存在しない）
分野,,景気の先行き判断,業種・職種,景気の先行きに対する判断理由
"家計
動向
関連

(東北)",,◎,－,－
,,○,一般小売店［カメラ］（店長）,・６月が恐らく最低であり、今後は伸びる。販売量は確かに減少しているが、そこそこの数量にはなっており、これから新製品も発売されるため、期待できる。
,,○,スーパー（店長）,・店舗周りの道路アクセスが、２～３か月後に良くなる予定で、この都市開発によって交通量が変化し、集客が見込める。
,,○,乗用車販売店（経営者）,・全国に比べ、需要の伸び悩む当県の状況に合わせ、低位安定した自動車販売においても、モデルチェンジがあることやボーナスの関係で、買換えの動きが若干ある。
,,□,商店街（代表者）,・７～８月には、大型イベントを計画しており、それなりの動員はあると思うが、８月に郊外に大型ショッピングセンターがオープンするため、どれだけの影響を受けるか分からない。
,,□,百貨店（売場主任）,・５月ごろから、婦人服の前年に対する売上ベースが極端に落ち込むことが無くなっており、しばらくこのままの状態が続く。
,,□,百貨店（売場主任）,・大型店の開店、他店のリニューアルなどを控えており、来客数の減少は免れないが、当店でも下期にリニューアルを控え、改装セールに入るため、期待できる。
,,□,百貨店（広報担当）,・外的要因となるが、厚生年金や健康保険の負担増などの将来への不安が払拭されない以上は、先行きは厳しく、悪くなる。しかし個人レベルでは、コト消費やスローライフなどが浸透しており、ここにビジネスチャンスとしての突破口を感じている。
,,□,百貨店（売場担当）,・全体的には、セールなどでは商品を安く提供し、実績を伸ばそうとしているが、実際にはお中元などでも安い商品を買っているため、あまり変わらない状態である。
,,□,百貨店（販促担当）,・セールの前倒し傾向が強く、月上旬や月中旬にセールの売上が集中すると見込んでいるが、先行商材である秋物や夏素材、秋色などが例年よりも多く展開することになっており、変わらない。
,,□,スーパー（店長）,"・ここ２～３か月の来客数は、前期比100％を維持しているが、買上点数の減少と単価の低下が続いている。
・競合各社で日替わり価格をディスカウントしているが、価格だけでは客は反応しなくなっており、集客に結び付いていない。これにより今後ますますディスカウントが強まり、価格が一段と下落する。"
,,□,衣料品専門店（店長）,・バーゲンの前倒しであり、後ろの需要が少し早く来ているだけの話であり、今後は厳しくなる。
,,□,衣料品専門店（店長）,・ビジネス関連商品が浮上しない上、カジュアル商品も客数が伸びないなどの不安がある。
,,□,衣料品専門店（店長）,・上向きになるポイントは、実需に捕らわれず、シーズン先行で商品を提供していくことがかぎとなるが、消費者の動向を見る限り、現状より大きく変化するとは思えない。
,,□,乗用車販売店（経営者）,・依然として新型の低価格車は好調であるが、それ以外の車種は大幅な前年割れで、オプション関係の需要も低下している。
,,□,乗用車販売店（経営者）,・以前は条件提示で即決も多かったが、報道機関などによる不況報道により、客が積極的な購入には動かない。当社では、見込み客一人ずつに当たるようなセールスをしているが、あまり良くはならない。
,,□,その他専門店［酒］（経営者）,"・全国的に店舗展開しているが、気温の上昇が例年とほぼ同様であり、西の方から発泡酒やビールの売上が順調に伸びてきている。
・株式市場の上昇などが心理的に好影響を与え、前向きな発言をする客が増えている。"
,,□,その他専門店［酒］（営業担当）,・お中元商戦に入るが、去年に比べて落ち込みが予想される。しかし、今期はどの店もお中元期間を長く取るため、落ち込み方は小さい。
,,□,高級レストラン（支配人）,"・宿泊は、前年同日の予約件数より多少増えているが、前年とほぼ同水準の売上が見込まれる。
・宴会は、７～８月は前年並みの予約件数を確保しているため、前年並みの売上が期待できる。
・レストランは、周囲の量販店や百貨店がバーゲンを開始するため、好影響を与える。"
,,□,観光型旅館（経営者）,・大手旅行エージェントのＳＡＲＳの影響は、一昨年の9.11の倍以上で、相当なダメージである。その分、国内のたたき合い、強引な利益確保が予想される。取りあえず、自力での夏休みの個人小グループ確保に全力を挙げ、秋口以降には忘年会の種まきをしながら、早めの固め作業を進める。大手旅行エージェントに頼らず、どこまで自力でできるかが、最大の防御と考えている。
,,□,通信会社（経営者）,・ＳＡＲＳなどの社会不安も解消され、ボーナス需要なども多少は期待できるが、大きく景気に影響を与えるようなものではない。
,,□,通信会社（営業担当）,・ＩＰ電話への急激な移行を予想していたが、それほど急激にはシフトしない。
,,□,通信会社（営業担当）,"・客はＩＰ電話や割引などでの安さばかりを求める傾向が続いている。
・投資意欲が感じられない。"
,,▲,商店街（代表者）,・通行量調査の結果にも出ているが、厳しさが続いている。地元店の撤去も予定されており、その跡には中央資本の店が入る予定である。地域を挙げての対策も限界に近づいている。
,,▲,百貨店（企画担当）,・ボーナスの手取り金額の実感として、消費に回せる余裕が無いことから、今夏のボーナスは消費需要を喚起しない。
,,▲,スーパー（経営者）,・既存店における、客単価は前年より３ポイント程度下がった状態であり、これに来客数が下がってくると、前年を割り込む数字が大きくなりそうである。
,,▲,スーパー（店長）,・たばこの増税の影響や、民間のボーナスに掛かる健康保険、年金保険料の料率変更などにより負担が増え、ますます買い控えとなる。
,,▲,スーパー（総務担当）,・既存店の来客数も、前年横並びになるまで減少している。客単価は2.6％低下しており、しばらくこの傾向は続く。
,,▲,スーパー（企画担当）,・競合店では集客力を高めるため、均一コーナーや均一企画を拡大している。また日替わり商品の価格強化の流れが強くなっている。こうした動きが落ち着かなければ、売上の安定も見込めない。
,,▲,コンビニ（店長）,・コンビニ間の過当競争だけでなく、スーパーの長時間営業は、コンビニにとっては、脅威であり、徐々に影響が出るため、先行きは厳しい。
,,▲,住関連専門店（経営者）,・これから夏物のセールが始まるが､メーカーの生産量が減少しているため、十分な商品供給が期待できない。
,,▲,高級レストラン（支配人）,・一般宴会の予約状況が悪く、前年実績を下回る見込みである。
,,▲,観光型ホテル（経営者）,"・向こう３か月間の入込は、前年比で５％ほど低いが、９、10、11月は、前年比を上回っている。
・ＳＡＲＳの影響か、一泊５万円の高級ホテルの方が、海外旅行や新婚旅行の振り替えか、多少成績が良い。
・前年７月から６月までの当ホテルの決算では、過去12年間続いてきた右肩下がりが、今年は前年をクリアしている。"
,,▲,都市型ホテル（経営者）,"・ＳＡＲＳの影響も、来月以降は改善される。ただし、婚礼の予約状況や一般宴会の予約状況が前年実績より悪い。各レストランの利用状況も良くない。
・地元では納税額日本一になったことのある人の会社が倒産し、関連業界や建設業界に多少影響が出る。"
,,▲,都市型ホテル（スタッフ）,・披露宴の入込の様子に、景気の動きが反映されているが、10月以降伸びておらず、この先やや悪くなると見ている。
,,▲,遊園地（経営者）,"・地域内のボーナスが低水準になっており、レジャー消費に結び付くかは楽観できない。
・夏にかけてのサーカス興行との競合も予想される。"
,,▲,住宅販売会社（経営者）,"・展示場来場者数が減少傾向になっている。
・今年度末までの住宅ローン減税を、関係省庁で見直すという情報が、マイナス効果をもたらし、年内入居にこだわらない客が増えてきている。"
,,×,スーパー（経営者）,・多分、どこかが破綻したり、方向転換をするまで、このまま競争が続く。
,,×,スーパー（店長）,・７～８月に、大手競合店が立て続けにオープンし、ますます競争が激化する。
,,×,スーパー（店長）,"・３か月以内に、ディスカウントで品ぞろえが豊富なスーパーセンターが出店する。
・買上点数は増えているが、１品単価の下落に歯止めがかからず、今後更に加速する。"
,,×,旅行代理店（従業員）,・夏休みは家族旅行を計画する時期であるが、社会保険料負担が増えたため、家族旅行を見直すという人が多く、悪い。
,,×,タクシー運転手,"・客との会話の中でも、景気が悪いことや、将来の見通しに明るさがないこと、いくら節約しても、現状で頑張っても、少しの光明も見えないという話が多い。
・当市は、タクシーの増車が相次ぎ、最悪の状態である。"
"企業
動向
関連

(東北)",,◎,－,－
,,○,輸送業（従業員）,・ＳＡＲＳも落ち着き、欠航便も回復し、航空貨物数量が回復する。
,,□,電気機械器具製造業（経営者）,・市場の絶対量が少なく、受注確保が難しい。また取引先も苦戦の状況で、海外への製造展開を前提とした動きであり、今後はあまり期待できない。
,,□,電気機械器具製造業（総務担当）,・更なるコストリダクションや新テクノロジーを立ち上げ、コスト競争力を付けていく必要がある。
,,□,電気機械器具製造業（総務担当）,・４～６月の受注量、売上の大幅減を７～９月でばん回する計画であるが、ここに来て、携帯電話の落ち込みが心配である。
,,□,建設業（経営者）,・企業の設備投資意欲に力強さがまだ感じられず、投資を渋る傾向がまだ残っている。
,,□,建設業（経営者）,・新築工事の受注や、問い合わせが増加している。
,,□,輸送業（経営者）,・イラク問題、ＳＡＲＳなどにより、受注価格の低迷は当分続く。
,,□,金融業（営業担当）,・国が主導している保証協会のセイフティネット保証が急増しており、今後相応の資金供給が図られる。
