Ⅱ．景気の先行きに対する判断理由,,,,
,,□,都市型ホテル（スタッフ）,・前年あった大口の宴席が今年はないが、他の商品の見直しや販売方法の変更、販促の実施により、前年並みの売上を確保できる見込みである。
,,□,都市型ホテル（スタッフ）,・イラク戦争、ＳＡＲＳ問題は落ち着いたものの、相次ぐ競合施設のオープンで、厳しい状況は続く。また、接待の縮小化等により、深夜のバーの売上は相変わらず良くない。
,,□,旅行代理店（従業員）,・繁忙期の需要は相応にあるが、全体的に単価が非常に低い。日本人はＳＡＲＳや戦争などに敏感に反応するので、現在は下降の要素しかなく、今後もこの状態が続く。
,,□,タクシー運転手,・客の話では、昇給のなかった会社もあり、ボーナスにも期待できないとのことである。また、医療費の３割負担により、老人が病院に行かなくなっているので、客の減少は続く。
,,□,タクシー運転手,・改正道路運送法の施行から一年余りが過ぎ、個人タクシー業界では、迎車料金の廃止と深夜早朝割増を３割から２割にする申請を行っているが、法人タクシーも追随すると予想されるため、変わらない。
,,□,通信会社（営業担当）,・需要を喚起できる材料が、当面見当たらない。
,,□,通信会社（営業担当）,・値下げ要求が強く、営業への反応は一層鈍くなっている。
,,□,ゴルフ場（支配人）,・３か月先の予約状況が思わしくない。
,,□,設計事務所（所長）,・民間の案件の決定率が非常に低い中、新年度が始まり３か月が過ぎたので、官庁の受注を期待していたが、受注がない。物件も小型化しており、景気は悪い状態で変わらない。
,,□,住宅販売会社（従業員）,・住宅ローン減税制度に伴う駆け込み需要がある。住宅金融公庫や銀行ローンの低金利の後押しもあり、底固い需要がある。
,,▲,百貨店（企画担当）,・ファッション関連に加え、今まで順調だった食品が、ここに来て厳しくなってきているので、今後はやや悪くなる。
,,▲,百貨店（営業担当）,・たばこの値上げ等も含め、消費は更に減退する。戦争、ＳＡＲＳは終息しつつあるものの、旅行需要は大きな回復が見込めず、関連商品の売上は伸びない。今後、地上デジタル放送など目新しい話題が増えるが、２、３か月後には影響が出ない。
,,▲,百貨店（業務担当）,・食料品以外の売上が悪い状況は、依然として続く。
,,▲,衣料品専門店（経営者）,・夏物セールの前倒しが多く、競争が激しいため、今後も最終売上高、粗利益高の減少が予想される。
,,▲,衣料品専門店（経営者）,・ボーナス時期であるが、どの会社でもボーナスが削減されているようで、景気は悪くなる。
,,▲,乗用車販売店（経営者）,・修理の客が非常に少ない。車検等の車が入庫しないので、今後もまだ悪くなる。
,,▲,自動車備品販売店（経理担当）,・一般整備工場よりも、ディーラーへ行くユーザーが増加しているので、先行きが懸念される。
,,▲,一般レストラン（店長）,・ボーナスが支給された後、短期間は多少良いが、その後は、消費者が財布のひもを固く締める。単価も低下し、来客数も減少すると考えられる。
,,▲,都市型ホテル（スタッフ）,・ＳＡＲＳの影響で、宿泊客の激減が見込まれる。
,,▲,旅行代理店（従業員）,・目立った団体客の話もなく、個人旅行についても２、３か月先の問い合わせがない。
,,▲,タクシー運転手,・一般の客が減少しているので、このまま引き続き悪くなる。
,,▲,美容室（経営者）,・たばこの値上げや、給料、ボーナスの削減などにより、消費が一層縮小する。
,,▲,住宅販売会社（従業員）,・住宅展示場やイベント会場などへの来場客が減少している。
,,×,旅行代理店（経営者）,・販売増の予定が全くない。
"企業
動向
関連

(南関東)",,◎,－,－
,,○,化学工業（従業員）,・８、９月に展示会等の販売促進計画があるので、生産量が多少増加する。
,,○,広告代理店（営業担当）,・取引先の広告宣伝予算が拡大見込みである。
,,□,繊維工業（経営者）,・衣料業界では、大手メーカーの民事再生法適用申請など、先行きの不安がある。
,,□,建設業（経理担当）,・銀行等から取引先の案件紹介が多少あるが、提案してみると、その取引先が尻込みして、計画が白紙になるなど、本格的に事業計画を立案する条件が整っていない。
,,□,輸送業（総務担当）,・排ガス規制等に伴う費用の増加分を価格に転嫁できる状況になく、値引き要請も依然として強い。厳しい状況は今後も続く。
,,□,通信業（営業企画担当）,・商品の品質での差別化は難しくなっており、価格面のウエイトが大きくなっている。今後は、サービスや保守等、営業力が重要になるが、状況がすぐに好転するとは思えない。
,,□,金融業（渉外担当）,・企業から２、３か月先の資金繰りの話を聞いても、借入れを増やす企業はほとんどなく、返済分の借り換え程度である。新規設備投資に充当する長期資金を借入予定の企業もほとんどない。
,,□,その他サービス業［廃棄物処理］（経営者）,・環境保全に対する関心は高く、問い合わせや相談は寄せられるが、全体的には物の動きが鈍く、低迷状態が続く。
,,▲,金属製品製造業（経営者）,・価格競争に歯止めがかからず、一段と厳しくなっている。更に安くしないと製品が売れない。中小企業の景気は、ますます悪くなる。
,,▲,電気機械器具製造業（経営者）,・新企画の話もなく、中小企業に流れる仕事が、徐々に減少する。
,,▲,輸送用機械器具製造業（経営者）,・コストダウンを要請しておきながら、親工場が海外への生産移転を行おうとしている。また、自動車関連で、約30％の仕事がなくなると嘆いている事業者が出てきている。中国進出、日本の空洞化が本格化している。
,,▲,輸送業（経営者）,・得意先の大手靴メーカーの生産が減少し、工場から運ぶ荷物が極端に少なくなった結果、専属車がキャンセルになっている。景気は悪くなるばかりである。
,,▲,不動産業（総務担当）,・テナントの奪い合いや、賃料の値引き合戦など、体力勝負の様相を呈している。
,,▲,広告代理店（従業員）,・取引先の新聞販売店では、折込チラシの件数は変わらないがサイズが小さくなっているため、単価が下がり、全体の売上が減少している。
,,×,繊維工業（経営者）,・衣料品店では在庫が残っているとのことで、秋物に期待できない。また、工賃分だけで全商品の仕入れができるため、中国から規格生産で輸入しており、日本の縫製関係は非常に厳しく、今後も悪化する。
,,×,金属製品製造業（経営者）,・新規の客先を訪問するが、売上の減少で、この先の発注予定がないという会社が多い。辛うじてＤＶＤ関係の金型が発注されている程度で、先行きの見通しが立たない。
,,×,輸送業（総務担当）,・今年の10月１日以降、古いトラックが走れなくなる。新車に替えるか環境対策の装置を付けるかのどちらかを選択しなければならないが、売上は上がらない、資金は必要、トラックは買えないという三重苦の中で、何とか資金をねん出するため、トラックを３台廃棄して１台新車を購入するといった厳しい対応を迫られる。
"雇用
関連

(南関東)",,◎,＊,＊
,,○,人材派遣会社（社員）,・中小企業６社の経営者に会ったが、そろそろ採用を始めたいという企業が４社あり、今後は若干良くなる。
,,○,求人情報誌製作会社（企画担当）,・中途採用活動が活発化しており、今後も求人件数が増加しそうである。
,,○,新聞社［求人広告］（担当者）,・秋に向けて、新事業の立ち上げや新商品の開発、販売等を計画している事業者があり、そのための募集が出ると予測している。
,,□,人材派遣会社（社員）,・若い人を育てる職場が少なく、即戦力に欠ける若い人たちは、なかなか長期の仕事に就けない。
,,□,人材派遣会社（社員）,・社員並みのスキルを派遣社員に求めるが、コスト削減のため料金は安くという企業が多く、派遣料金の低下が依然として続く。
,,□,求人情報誌製作会社（編集担当）,・大型店等のお中元商戦関連の求人に動きがなく、今後予想される夏期アルバイトの募集も進んでいない。どの業種でも活況がみられず、秋に向けてこの状態が続く。
,,□,職業安定所（所長）,・新規求職者が減少傾向で推移するなかで、新規求人数が大幅に増加しているが、これらの求人の就業地が全国を含む広範囲であり、労働市場圏で見れば改善につながらないと思う。
,,□,職業安定所（職員）,"・企業経営者は、依然として正規常用社員の雇用増に対して慎重であるが、正社員並みの雇用条件で処遇する期間雇用、パートタイム求人は堅調に推移しており、様子見の状況が続いている。
・製造業での求人増加傾向に底堅い動きがうかがえ、特に大手メーカー等の景況の影響を受ける小零細事業所の人材需要にプラス面が現れてきている。
・これまで堅調に推移してきた介護福祉関連事業所からの求人については、介護保険診療報酬の見直し、自治体の補助金の削減等により、業務再構築を求められていることから、求人内容が正規常用雇用からパートへと急激に移行しており、今後求人数の大幅な増加が見込めない。"
,,□,職業安定所（職員）,・求人倍率は上昇しているが、求人条件等はあまり良くない。人員整理を実施する事業所も相変わらず多い。
,,□,民間職業紹介機関（経営者）,・人材の不足感が出ても、契約社員や紹介予定派遣等で一定の期間を区切って採用することが多くなっている。
,,□,学校［専修学校］（就職担当）,・企業の求人数は、例年並みを維持できると予想され、６月以上の大きな落ち込みはない。
,,▲,－,－
,,×,－,－
,,,,
　５．東海（地域別調査機関：（株）ＵＦＪ総合研究所）,,,,
,,,,（－：回答が存在しない、＊：主だった回答等が存在しない）
分野,,景気の先行き判断,業種・職種,景気の先行きに対する判断理由
"家計
動向
関連

(東海)",,◎,旅行代理店（経営者）,・ＳＡＲＳ問題が終息して、今後は良くなっていく。
,,○,一般小売店［土産］（経営者）,・当地への観光客の増加は、ＳＡＲＳ問題の影響によって海外旅行から一時的に振り替えられたのではないと思われる。
,,○,百貨店（企画担当）,・店舗改装の予定があり、またイベントなども実施するため、かなりの集客が見込まれる。
,,○,コンビニ（店長）,・猛暑が予想されているので、ビールや清涼飲料の売上が増加する。
,,○,都市型ホテル（従業員）,・予約数が増加している。
,,○,旅行代理店（従業員）,・企業の海外出張や個人の観光旅行に動きが出ている。
,,○,その他サービス［パチンコ機器製造販売］（エリア担当）,・ＳＡＲＳ問題の影響により、パチンコが手軽なレジャーとして見直されてきている。
,,□,一般小売店［電気屋］（経営者）,・販売単価は下げ止まっているが、ボーナス支給に関して不安があり、全体的には変化がない。
,,□,一般小売店［薬局］（経営者）,・バーゲンセールの時期に入り客の動きも活発化するが、購入単価には変化がない。
,,□,一般小売店［わさび漬］（経営者）,・消費動向は底で安定推移している。
,,□,百貨店（売場主任）,・客からは購買意欲が感じられない。
,,□,百貨店（企画担当）,・来客数、客単価には下げ止まりの傾向が若干みられるが、消費者は所得が伸び悩んでおり、老後など今後の不安も大きいため、消費の拡大は難しい。
,,□,百貨店（経理担当）,・婦人服以外は継続して低い水準で推移している。
,,□,スーパー（経営者）,・商品はますます売れなくなっており、価格破壊的な金額を出さないと購入してくれない状況である。
,,□,スーパー（店長）,・客単価は低迷しており、バーゲン価格の商品だけがよく動く。それでも、余分には買わない客が多い。
,,□,スーパー（店員）,・目玉商品を用意したりチラシを入れるなど対策を打っているが、その時だけで長続きせず好転へのめどが立たない。
,,□,スーパー（店員）,・競争相手は各店とも、他店より１円でも安くといったチラシ合戦になっている。客もそのように流れている。
,,□,スーパー（仕入担当）,・低温の影響でアイスクリームの売上が前年比で15％減少している。しかし健康志向の定着から、ヨーグルトや梅、豆乳などは非常に売行き好調である。ＳＡＲＳ問題の影響で乳酸菌飲料も良く売れている。
,,□,コンビニ（エリア担当）,・来客数、販売量、客単価のどれをとっても改善方向にない。今後はたばこ増税前の駆け込み需要の反動も出てくる。
,,□,コンビニ（エリア担当）,・同業他社や量販店との競合は更に厳しくなっていき、売上の前年割れ状況は今後も続く。
,,□,衣料品専門店（店員）,・客単価には変化がなく、購買意欲は今後も上がらない。
,,□,衣料品専門店（企画担当）,・衣料の購買動向に変化が出る兆候がない。
,,□,家電量販店（経営者）,・デフレは今後も続く。
,,□,家電量販店（店員）,・社会保険料の負担増などもあってか、客の気分は萎縮している。
,,□,家電量販店（店員）,・ダイレクトメールに反応した来客が非常に多く販売効率も良いが、反動でその後の売上が減少する傾向がある。
,,□,乗用車販売店（従業員）,・来客数は増加していくが、客は商品の選択にますます慎重になる。
,,□,乗用車販売店（従業員）,・客はボーナスの支給金額に失望している。
,,□,乗用車販売店（従業員）,・新製品の投入といった変化する要素がない。
,,□,乗用車販売店（営業担当）,・ボーナス期が近いにもかかわらず財布のひもは固くなっている。
,,□,乗用車販売店（総務担当）,・客は自動車のような大きな買物にはかなり慎重になっている。
,,□,その他小売［貴金属］（経営者）,・よほどの明るい材料がない限り、この沈滞ムードは打開できない。
,,□,その他小売［総合衣料］（店員）,・ユーロ高によってヨーロッパからの輸入商品の販売量が減少する。
,,□,高級レストラン（スタッフ）,・来客数の動き、客の注文内容に変化の兆しは全く見られない。景気は底ばいする。
,,□,一般レストラン（経営者）,・客単価が著しく低迷しているため、来客数が増加するとしても前年に比べて売上が増加する見込みは薄い。
,,□,一般レストラン（スタッフ）,・来客数が増加する時間帯もあるが、全体的な販売量には変化がない。
,,□,スナック（経営者）,・客からはボーナスカットの話が多く、今後もあまり期待できない。
,,□,スナック（経営者）,・夜の街は相変わらず閑散としている。
,,□,都市型ホテル（スタッフ）,・予約状況があまり良くない。ボーナスの支給額をみても、個人利用は今後減少する。
,,□,都市型ホテル（スタッフ）,・ＳＡＲＳ問題の影響でアジアビジネスは厳しいが、国内企業の動きが活発で売上をカバーしている。
,,□,旅行代理店（経営者）,・宿泊旅行は来年３月まで前年を上回る勢いで予約が入っている。しかし秋以降はＳＡＲＳ問題の動向が大きく影響する。
,,□,パチンコ店（店長）,・個々の店舗の稼働率にばらつきは出ているが、全体として来客数の大幅な増加は見込めない。
,,□,住宅販売会社（従業員）,・低金利での固定金利化が進み、客も乗り気になってはいるが、景気が上向くまではいかない。
,,▲,商店街（代表者）,・魅力のある商品は購入するが、必要でなければ見ているだけという客が多い。客の買い方は厳しさを増している。
,,▲,商店街（代表者）,・大型店が増加しており、安売りについていけない。努力はしているが打開策はなく、経営はますます苦しくなっている。
,,▲,一般小売店［酒］（経営者）,・増税に加え、ボーナスが前年と比較して悪いという客が多く、お中元の時期にもかかわらず客の反応は鈍い。出費を極力抑えるという傾向は変わらない。
,,▲,百貨店（企画担当）,・客の購買意欲が硬直しているのに加えて、競争相手の大幅増床が予定されており、競争は激化する。
,,▲,百貨店（販売促進担当）,・気候の影響もあって重衣料の動きが良いが、気候に大きく影響されるようでは安定した売上は望めない。
,,▲,スーパー（総務担当）,・社会保険料の負担増とボーナスの減少が影響する。
,,▲,コンビニ（エリア担当）,・スーパーの営業時間の延長などが影響し、ますます厳しくなる。
,,▲,コンビニ（売場担当）,・いろいろな値上げがボディブローのように効いてくる。
,,▲,衣料品専門店（経営者）,・夏物の動きも少なく、明るい材料がない。
,,▲,自動車備品販売店（経営者）,・他店のチラシと比較して値引き要請したり、必要最低限の消耗品を購入したりといった客の買物動向は継続する。
,,▲,乗用車販売店（経営者）,・増税、所得減などの先行き不安から、客は消費を更に締め付けている。問い合わせ件数や来客数も少ない。
,,▲,その他専門店［貴金属］（店長）,・基本給が上がらずボーナスも目減りする状態が継続するなかでは消費は増えない。高額商品が売れる感触が、現在は少なくなってきている。
,,▲,観光型ホテル（スタッフ）,・夏の常連客、特にファミリー客の予約が減少している。
,,▲,都市型ホテル（スタッフ）,・不安定要素が多く不透明である。まだまだ厳しい局面に備えなければならない。
,,▲,旅行代理店（従業員）,・ＳＡＲＳ問題による影響はかなり重い。
,,▲,タクシー運転手,・タクシー運賃の自由化に伴い、激安メーターが増加しつつある。
,,▲,ゴルフ場（経営者）,・予約状況は前年を下回っており、回復の兆しがない。
,,▲,設計事務所（職員）,・安売りのマンションでも売れ残りがあり、人々は先行き不安からか大きな出費には財布のひもが固い。
,,▲,住宅販売会社（従業員）,・サラリーマン世帯では税金などの負担が増えており、戸建住宅や分譲マンションを所有するよりも、転居ができて負担が少ない賃貸住宅志向になってきている。
,,×,コンビニ（店長）,・来客数、１人当たりの買上点数ともに減少しており、底が見えない。
,,×,乗用車販売店（経営者）,・厳しい状況が続くため、販売戦略の立て直しが急務となっている。
,,×,一般レストラン（経営者）,・良くなる兆しは全く見えない。
,,×,設計事務所（経営者）,・悪くなる材料は多々あるが、良くなる材料は全くない。
,,×,住宅販売会社（業務担当）,・販売単価は安値で停滞している。また業界内で信用不安が発生している。
"企業
動向
関連

(東海)",,◎,－,－
,,○,電気機械器具製造業（営業担当）,・市町村合併に関連して、地方のＩＴ関連のインフラ整備が徐々に進む。
,,○,輸送用機械器具製造業（総務担当）,・北米向けの輸出が再開される。
,,○,建設業（企画担当）,・中部国際空港と愛知万博の本工事が計画に従って進んでおり、空港周辺を含めた関連工事情報が少しずつ動き始めている。
,,○,輸送業（エリア担当）,・ＳＡＲＳ問題が終息し、今後は回復してくる。
,,□,金属製品製造業（社員）,・仕事量の確保は見込めるものの、業界全体が回復する見通しはない。
,,□,一般機械器具製造業（販売担当）,・自動車産業の設備投資意欲は衰えておらず、受注や引き合いの件数も多いが、アメリカ景気の後退や取引先の信用不安といった懸念もある。
,,□,一般機械器具製造業（経理担当）,・国内の設備投資の仕事に期待が持てないため､海外輸出で売上を補っている状況である｡
,,□,電気機械器具製造業（経営者）,・ここ１年ほどの売上は完全な横ばい状態である。今後海外移管が進むが、当面はＳＡＲＳ問題の影響で様子見の状態であり、変化はない。
,,□,電気機械器具製造業（従業員）,・取引先によってばらつきはあるが、全体としては現状維持である。
,,□,輸送用機械器具製造業（工務担当）,・３か月先までは高い生産負荷が続く。
,,□,新聞販売店［広告］（店主）,・チラシの出稿数は不透明な状況にある。また夕刊紙やスポーツ紙の購読減少が止まらない。
,,▲,金属製品製造業（従業員）,・特に設備投資の受注が厳しく、現在の水準を維持できるかどうか先行き不透明である。
,,▲,一般機械器具製造業（経理担当）,・単価が厳しく利益が出ない状況である。
,,▲,電気機械器具製造業（従業員）,・国内アパレルメーカーの設備投資が減少している。
,,×,非鉄金属製品製造業［鋳物］（経営企画）,・引き合いも減少しており、ますます悪くなっていく。
,,×,公認会計士,"・都市銀行が貸出先に対して付加価値のあるサービスをしていない。
・企業のバランスシートは改善していない。"
"雇用
関連

(東海)",,◎,－,－
,,○,人材派遣会社（社員）,・新規顧客の需要が増加傾向にあり、その中でも営業関係の伸びが顕著である。派遣需要は上向いている。
,,○,求人情報誌製作会社（編集者）,・営業、サービス業での求人件数が戻ってきている。
,,○,職業安定所（所長）,・新規求職者のうち12.5％が事業主都合による解雇であるが、前年と比較すると20.7ポイント減少している。ここ数か月はリストラなどによる退職は減少している。
,,○,職業安定所（職員）,・薄利多売ながら企業の受注量は確保されており、倒産件数も減少しているため、以前のような不透明感は薄れつつある。
,,○,民間職業紹介機関（経営者）,・ＳＡＲＳ問題も落ち着き､中途採用が動き出す環境が整ってきている｡
,,□,人材派遣会社（社員）,・派遣就労を選択せざるを得ない求職者が明らかに増加傾向にある。若年層から中高年まで同一賃金水準であることが多く、可処分所得の上昇が期待できない。
