Ⅱ．景気の先行きに対する判断理由,,,,
,,▲,金属製品製造業（社員）,・中部国際空港のようなプロジェクトは動くが、受注価格が抑えられている上に、売上を回収するまでの資金の立替等も多い。
,,▲,電気機械器具製造業（経営者）,・販売単価が継続して低下しているにもかかわらず、得意先の半数以上からは、一層の価格協力を求められている。
,,▲,輸送用機械器具製造業（経理担当）,・需要の奪い合いで業績が良くなる企業があっても、マクロ的には、国内、輸出ともに上向く材料がない。
,,▲,輸送用機械器具製造業（工務担当）,・生産計画は、やや減少する。
,,×,鉄鋼業（経営者）,・企業の淘汰が進むと、信用不安から取引量が落ちる。
,,×,非鉄金属製品製造業［鋳物］（経営企画）,・引き合いも減少している。
"雇用
関連

(東海)",,◎,－,－
,,○,求人情報誌製作会社（編集者）,・求人件数は減少しているが、今夏以降は、地元有力企業による比較的大規模な中途採用予定がある。
,,○,求人情報誌製作会社（企画担当）,・アルバイト、パートに対する求人は、例年以上に旺盛になっている。
,,○,職業安定所（職員）,・公共工事の発注が頭打ちになっているが、今後は東海環状自動車道等の効果が現れる。
,,○,学校［大学］（就職担当）,・リストラによって業績を回復させた企業が、採用を増やしている。
,,□,人材派遣会社（社員）,・派遣ニーズは相変わらず高いが、一方で、各企業は正社員の採用を手控えている。
,,□,人材派遣会社（社員）,・派遣依頼の動きは前月並みであるが、値下げ要請や契約更新の中止は目立ってきている。
,,□,人材派遣会社（社員）,・失業者は静かに増加している。また、昇給も止み、労働時間も減少しているため、可処分所得は伸びない。
,,□,求人情報誌製作会社（編集者）,・全体的に求人が伸びている。とくに飲食業、派遣業や、アウトソーシング業界等で、求人が伸びている。
,,□,職業安定所（所長）,・企業の設備投資は若干増加しているが、人員の採用までには至らない。
,,□,職業安定所（管理部門担当）,・求人と求職のミスマッチが発生しており、求職者は依然として多い。今後も、就職率は低下する。
,,□,民間職業紹介機関（経営者）,・好調な業界は自動車業界のみで、今以上の回復は難しい。
,,▲,新聞社［求人広告］（担当者）,・イラク戦争やＳＡＲＳ問題の影響が求人広告市場にも現れており、全般的に手控えられている。
,,▲,職業安定所（職員）,・ＳＡＲＳ問題の影響によって、人員削減や中小企業では倒産も出始めている。
,,×,－,－
,,,,
　６．北陸（地域別調査機関：（財）北陸経済研究所）,,,,
,,,,（－：回答が存在しない、＊：主だった回答等が存在しない）
分野,,景気の先行き判断,業種・職種,景気の先行きに対する判断理由
"家計
動向
関連

(北陸)",,◎,－,－
,,○,百貨店（営業担当）,・客の購買意欲は３か月前に比べて良くなっている。３か月後は、夏物セールの最盛期になっているため、商品の打ち出しさえきちんとすれば、客を引きつけることができる。
,,○,観光型旅館（スタッフ）,・４～６月の予約保有状況は、大幅に前年割れとなっているが、７月以降はプラスに転じている。
,,○,通信会社（社員）,・今後各業者が積極的に営業展開するため、販売量は上向く。
,,○,競輪場（職員）,・５月下旬から競輪ファン待望の高配当が期待できる新方式が導入されるため、来場者数の増加が予想される。
,,□,商店街（代表者）,・商店街では、新しい若者向きの店は繁盛しているが、同じ業種の他の店は、全て伸びていない。
,,□,一般小売店［果物］（経営者）,・価格は低いまま推移しており、客にまだ元気がない。
,,□,一般小売店［鮮魚］（店長）,・発泡酒やたばこの増税により、客の買い控えが進み、売上が減少する恐れがある。
,,□,百貨店（売場主任）,・特に新商品がなく、商材は前年とほとんど変わっていない。また、ヒット商品も出ていない。
,,□,スーパー（営業担当）,・１品単価は下げ止まっているが、買上点数の増加見込みがないため、現状のままで推移する。
,,□,コンビニ（経営者）,・今が底だと思えば若干上昇する気もするが、売上の大幅な前年割れは確実である。
,,□,コンビニ（経営者）,・来客数は増加するが、単価がなかなか伸びない。
,,□,家電量販店（経営者）,・家電全体では前年同期の売上をクリアしている。しかし、客の買物に対する姿勢は慎重で、ＤＶＤやデジタルカメラなどのヒット商品がなくなれば、すぐに売上に影響する。
,,□,乗用車販売店（経営者）,・医療関係者を除いて、法人需要は低迷しているため、回復には時間がかかる。
,,□,乗用車販売店（総務担当）,・１～３月は新型車が登場したため販売台数もやや伸びたが、これから夏にかけて新型車の発売予定はない。また、３月の販売増加の反動もあり、４～６月は季節的に伸び悩む。
,,□,その他専門店［ガソリンスタンド］（経営者）,・客は大分不況慣れしているように思われる。当分は底ばい状態がこのまま続く。
,,□,その他専門店［医薬品］（営業担当）,・ドラッグストアの客層は主婦が中心であるが、家計の収入が増加しないため支出も増やせず、慎重な消費態度が続く。
,,□,都市型ホテル（スタッフ）,・宿泊とレストランの通常営業は、前年並みを見込んでいる。また、レストラン・ウエディングを含む婚礼宴会も、月により増減はあるものの、前年並みで推移している。
,,□,タクシー運転手,・客が夜の繁華街へ出かける回数は、依然として増えず、タクシー利用の客が目に見えて増加するとは思えない。
,,□,設計事務所（職員）,・製造業などの関連先からの照会や引き合いの中に少しずつ好転の兆しがみえる。しかし、一方では絶対量が少ないため、受注競争は一層激化する。
,,□,住宅販売会社（従業員）,・最近の客の出足は土、日の中でも日曜日が良い。特に今年は天候による影響が大きく、天候が良ければ来場者数は増加するが、悪ければ全く振るわない。
,,□,住宅販売会社（従業員）,・客の慎重な姿勢はほとんど変わらない。受注量や来客数にも変化がみられない。
,,▲,スーパー（店長）,・最近、ＳＡＲＳの影響のためか、中国産の食品の動きが非常に悪い。売場の客からも食品は大丈夫かという声が、少しずつ出始めている。
,,▲,スーパー（店長）,・ＳＡＲＳの影響で海外旅行が減少し、また大手企業の減益見通しで株価が低迷するなどのニュースが流れているため、消費者の財布のひもは更に固くなる。
,,▲,高級レストラン（スタッフ）,・受注状況は洋食店が横ばいであるが、和食店でとくに厳しい。和食は、半年前にオープンした新店だけが伸びている。
,,▲,一般レストラン（店長）,・久しぶりに来店した客に話しかけると、最近は外食費を抑えているという答えが多く返ってくる。
,,▲,スナック（経営者）,・イラク情勢に続き、ＳＡＲＳ騒ぎにより、海外出張をセーブしたり、仕事を引き延ばすなどの話を耳にするが、この影響が更に拡大していく。
,,▲,観光型旅館（経営者）,・ＳＡＲＳなどの影響で国内旅行の需要が増加するといわれているが、その傾向はみられず、予約数は伸び悩んでいる。
,,▲,都市型ホテル（スタッフ）,・婚礼の予約件数が前年比大幅に減少し、また単価の安い物件が多くなっている。宴会部門の予約は順調であるが、総体の売上は、前年に比べて減少が予想される。
,,▲,旅行代理店（従業員）,・ＳＡＲＳとイラク情勢の影響が根強く、さらに尾を引く。
,,▲,住宅販売会社（従業員）,"・新築、増築、リフォームに加え、最近は土地探しの客も増加し、堅調である。この大きな要因は、住宅ローン控除が15年12月末までとなっているためと思われる。
・先を読む客は、どうせ家を建てるなら、消費税の上がる前に踏み切ろうという考えを持っている。"
,,×,百貨店（営業担当）,・これから夏シーズンに向けての重点アイテムがまだ見つからない。また、夏の婦人サンダルの売上が前年同月の40％にとどまっている。
,,×,百貨店（営業担当）,・当初、春のファッション関係は、エレガンス志向が高まると予想していたが、実際の客の購入は、カジュアル志向が中心となっているため、単価の低下は免れない。
,,×,テーマパーク（職員）,・レストラン及び団体、グループの今後の予約状況をみても、前年同月比で２けたの減少となっている。ツアーの発生状況も非常に鈍く、旅行会社でも、団体、グループは非常に悪いと話している。また、ＳＡＲＳにより減少している海外旅行が国内に振り替わるのは、２割程度と聞いており、国内旅行が盛り上がるとも思えない。
"企業
動向
関連

(北陸)",,◎,－,－
,,○,電気機械器具製造業（経理担当）,・携帯電話関係は引き続き底固い展開が期待できる。さらに次世代携帯が広がることにより、景気は上向く。
,,○,通信業（営業担当）,・インターネットのブロードバンド回線、とくに光ファイバー回線が伸びている。また、各企業は情報化投資の重要性は認めつつも、膨大な費用の支払に警戒感が強い。
,,○,不動産業（経営者）,・不動産取引に関する契約の予約や問い合わせが、かなり入っている。
,,□,繊維工業（経営者）,・米国の景気状況やＳＡＲＳの問題もあり、先行きに明るさがみえない。
,,□,繊維工業（経営者）,・新たにＳＡＲＳ問題が発生し、国内の消費の動きが一層悪化する。
,,□,プラスチック製品製造業（企画担当）,・大型物件の情報がなかなか増加しない。
,,□,電気機械器具製造業（経営者）,・取引先の中には若干良くなっている企業もあるが、当社も含めて、総じて現状維持で推移している。
,,□,通信業（営業担当）,・携帯電話の新規ユーザーの獲得も難しく、現状は変わらない。
,,□,司法書士,・不動産登記や商業登記分野において、とくに新規の事業展開の相談が、全く来ない状態が続いている。
,,▲,化学工業（営業担当）,・依然として消費マインドの向上は期待できず、加えて受注時に値下げ要求が強くなる。
,,×,金属製品製造業（経営者）,・例年どおり、３月は年度替わりでかなり注文が入ったが、４月は例年に比べてはるかに悪く、悲観的な受注状況である。
,,×,精密機械器具製造業（経営者）,・３か月先の受注量が各メーカーともに落ちており、自宅待機やリストラを行っている企業が増え始めている。
"雇用
関連

(北陸)",,◎,－,－
,,○,職業安定所（職員）,・今のところ、大量離職者が発生する情報はない。また、低迷していた製造業の求人が回復基調にあり、当面は新規求人の上向き傾向が続く。
,,□,人材派遣会社（社員）,・従来は求人数にカウントできないような半受注の問い合わせがかなりあったが、最近はこれも少なくなっている。しばらくは厳しい状況が続く。
,,□,求人情報誌製作会社（編集者）,・新規の取引先や既存客からの求人依頼数に変化がみられない。
,,□,新聞社［求人広告］（担当者）,・今月の取扱件数は良かったが、これからのイラク情勢やＳＡＲＳの影響が不明である。
,,□,職業安定所（職員）,・求人数はほとんど変わっていない。
,,▲,－,－
,,×,－,－
,,,,
　７．近畿（地域別調査機関：りそな総合研究所（株））,,,,
,,,,（－：回答が存在しない、＊：主だった回答等が存在しない）
分野,,景気の先行き判断,業種・職種,景気の先行きに対する判断理由
"家計
動向
関連

(近畿)",,◎,一般小売店［酒］（経営者）,・地元ケーブルテレビで取上げられ、宣伝効果が出てきている。今後、役所の人事異動等で飲み会のニーズが出てくることも予想されることから、先行きに期待できる。
,,◎,コンビニ（経営者）,・前年と同じか、それ以上に暑くなる見込みなので、冷麺等の売行きが伸びると予想される。
,,○,衣料品専門店（営業・販売）,・買い控えしていた客が戻ってきていることから、先行きに期待できる。
,,○,乗用車販売店（営業担当）,・買得車による客へのアピールで、代替購入が望めそうである。
,,○,住関連専門店（経営者）,・まだ実需には結びついていないが、見積の依頼件数が最近徐々に増えつつあり、先行きに期待できる。
,,○,その他飲食［コーヒーショップ］（店長）,・ゴールデンウィーク中の内需拡大につながる国内消費の底入れや、在阪人気球団の好調による盛り上がりにより、今後に期待できる。
,,○,観光型旅館（経営者）,・海外旅行を控え、国内旅行に出向く客が増えると予想している。
,,○,観光型旅館（経営者）,・予約の問い合わせの数が前年より増えている。
,,○,都市型ホテル（経営者）,・現在の予約状況からみると、宿泊稼動、宴会利用は７月ごろにはやや持ち直しそうである。宴会場のリニューアル効果による婚礼組数の増加や、企業の研修の受注による長期宿泊客の増加が寄与することになりそうである。
,,○,旅行代理店（店長）,・先行受注は、国内外とも、よく入りだしている。
,,○,旅行代理店（広報担当）,・申込状況は少し戻ってきている。６～９月の夏休みにかけての申込が、少しずつ良くなってきている。
,,○,通信会社（経営者）,・新年度の予算で、新たな投資が見込まれている。
,,○,通信会社（社員）,・新機種がボーナスシーズンに向けて用意されていることから、先行きに期待できる。
,,○,競輪場（職員）,・土日開催という要因を考慮しても、グレード制の開催により、来客数の増加が期待できる。
,,○,美容室（店員）,・内部の商品開発が進められていることから、先行きに期待できる。
,,○,その他住宅［展示場］（従業員）,・住宅ローン減税の駆け込み需要と、相続時精算課税制度の特例による潜在需要の喚起効果の期待から、現状より良くなると予想している。
,,○,その他住宅［情報誌］（編集者）,・超低金利と優遇税制によって住宅購入環境が整っているなか、不動産各社の供給調整が進んでいるため、しばらくは需給バランスがとれたマーケット推移が期待できる。
,,□,一般小売店（経営者）,・ＳＡＲＳの影響が様々な業種へ徐々に出てくる。需要は冷え込む状況が続く。
,,□,百貨店（売場主任）,・季節商材の売上が減少傾向にあり、景気が上向くとは考えにくい。海外旅行の減少など、旅行等の消費が商品の消費へ変ればと期待している。
,,□,百貨店（売場主任）,・７月のクリアランスは上向く予想であるが、現状からは大きな変化はみられない。
,,□,百貨店（売場主任）,"・百貨店の主力商品である婦人服に回復の兆しがみられず、今後の売上回復は期待が持てない。
・イラク戦争による海外旅行の中止で、国内での高額品や輸入商品などへの消費のシフトを期待したが、ゴールデンウィーク前半では効果は全くみられないことから、厳しい現状が続く。"
,,□,百貨店（売場主任）,・販売の後倒しによる好転は期待できない。すでにクリアランス時期を見据えての品ぞろえの強化が必要になっている。
,,□,百貨店（企画担当）,・美術や宝飾といった高額商品の動きも悪く、株価の低迷等もあって当分苦戦が続く。
,,□,百貨店（売場担当）,・爆発的ヒット商品がないことから、上向くとは思えない。百貨店で買物をすることによる付加価値を提示できなければ、現状のまま変わらない。
,,□,スーパー（店長）,・需要が回復しても、出店の増加で供給も増え、厳しい競争が続く。
,,□,スーパー（経理担当）,・ゴールデンウィークが大型連休にならず、ＳＡＲＳの影響もあって近場のレジャーが増えると予想されるが、これは短期的プラス要因となっても、本格的回復の材料にはならない。
,,□,家電量販店（企画担当）,・何もしなければ、売上は下がるという一方で、何かイベントを開催すればそれなりに確保できるが、消費が上向くにはまだ時間がかかる。
,,□,家電量販店（営業担当）,・現状と同じ状態が続いているが、客の商品購入数が伸びないので、客単価も伸びない。現状を打開する要素がなく、エアコン等の季節商材に期待するしかないが、現状は壊れてから買うという状況が続いており、見通しは厳しい。
,,□,乗用車販売店（経営者）,・低料金の修理が多く、高額になると修理をしないため、売上は上がらない。今後も厳しい状況が続く。
,,□,乗用車販売店（経営者）,・ＳＡＲＳ、日米の景気悪化など悪条件が重なりすぎていることから、厳しい現状が続く。
,,□,一般レストラン（スタッフ）,・ＳＡＲＳの国内感染の報告がなされたら、景気に更に悪影響を与えることが懸念される。
,,□,観光型ホテル（経営者）,・先の予約状況をみても、今までより良くなる兆候はみられず、より悪い結果になるのではないかという不安が感じられる状況である。
,,□,観光型旅館（団体役員）,・イラク戦争、ＳＡＲＳ問題など、国内外旅行業界に与える影響は大きく、先行き不透明の状況のもとで予測が立ちにくい。
,,□,タクシー運転手,・規制緩和による運賃競争はますます泥沼化しており、規制緩和後２度目の割引運賃の導入に踏み出さざるを得ない状況にあり、営業収入が減少するのは避けられない。今後も厳しい状況が続く。
,,□,タクシー運転手,・梅雨時は乗車率も伸びるが、最近の状況をみると、現状と変わらないと予想される。
,,□,観光名所（経理担当）,・海外旅行のキャンセル分に期待しているが、１日滞在型の施設ではないため、客が大きく増えることはない。
,,□,その他レジャー施設［イベントホール］（職員）,・ホール自体の予約状況の先行きは良いが、未決定のものもある。ＳＡＲＳについては、今後の外国タレントの催事に影響を与える懸念材料であると考えている。
,,□,その他レジャー施設（企画担当）,・国内レジャー施設には追い風といえる状況だが、本質的な好材料はないため、現状のまま推移すると思われる。
,,□,その他レジャー施設［球場］（企画担当）,・在阪球団の公式戦は例年通りスケジュールに入っているものの、その他のコンサートや企業イベントなどが比較的少なく、来場者の増加があまり期待できないことから、厳しい現状が続く。
,,□,住宅販売会社（従業員）,・戦争も終わり、景気が上向くと思われたが、ＳＡＲＳによる消費動向への影響が必至である。
,,▲,商店街（代表者）,・お祝いの進物に割引セールの商品を買う客が多くなった。夏に向かって低価格商品を求める客が増えるので、厳しい。
,,▲,百貨店（売場主任）,・中国製品の多いアパレル業界では、今後ＳＡＲＳの悪影響が大きく出てくると予想される。
,,▲,百貨店（営業担当）,・海外旅行をやめて国内消費に向かうと思われたが、ブランド品も含め、消費に回らない。唯一、家具を中心としたリビング品の売行きは伸びると予想されるが、先行きの見通しは厳しい。
,,▲,スーパー（店長）,・イラク戦争後の処理問題や、ＳＡＲＳ問題など不安要因が多すぎる。このような情勢で株価の回復も全く見込めず、悪化の方向に向かっていることから、先行きが懸念される。
,,▲,コンビニ（経営者）,・増税、株価低迷、ＳＡＲＳ流行と明るいニュースもなく、外出する気さえ削ぐ閉塞感が漂っていることから、見通しは厳しい。
,,▲,コンビニ（経営者）,・コンビニ業界全体が売上の前年割れを続けており、様々な新サービスも直接的には売上増になかなかつながらないことから、先行きには期待できない。
,,▲,衣料品専門店（経営者）,・夏物衣料にお金をかけない傾向が２～３年前から続いている。４月でこの状況では、夏場は厳しい。
,,▲,家電量販店（店長）,・ＤＶＤ、ＰＤＰ、大型液晶テレビなどの新商品が貢献しているものの、買換え商品はサイクルが長くなっており、先行きの見通しは厳しい。
,,▲,乗用車販売店（経営者）,・株価の下落、ＳＡＲＳなど、マイナス要因ばかりが目立つことから、先行きの見通しは厳しい。
,,▲,乗用車販売店（経営者）,・テロやＳＡＲＳなどの不安から世界市場が低迷しているが、間接的に業界にも影響が出てくる。今後２～３か月は良くならない。
,,▲,乗用車販売店（営業担当）,・前年の４月と比べると３分の１の販売数であることから、先行きの見通しは厳しい。
,,▲,その他専門店［医薬品］（経営者）,・同業他社の出店が相次ぎ、競争も厳しくなっている。
,,▲,一般レストラン（経営者）,・物価、土地価格の下落、ＳＡＲＳ問題等、先行き不安要素が多すぎる。
,,▲,都市型ホテル（スタッフ）,・ＳＡＲＳの影響が懸念される。５月の連休でも海外への旅行を取りやめて、国内に振り替わるかと期待していたが、国内旅行の動きも悪いなど、全体的に先の宿泊の予約状況が非常に悪い。
,,▲,都市型ホテル（スタッフ）,・先の予約が滞っている。イラク戦争での先行き不透明感や業績悪化を理由に、受注済み宴会がキャンセルされたり、毎年利用のある客が経費削減で会合を中止するという動きもみられる。さらにＳＡＲＳ問題で観光客のキャンセルが続き、予約が全くない状態に陥っている。
,,▲,通信会社（経営者）,・将来の景気について具体的な事由は見当たらないが、戦争があり、ＳＡＲＳが流行るなど、悪くなることを予感させる事柄が多い。
,,▲,通信会社（社員）,・広範囲なエリア拡張に伴う多大な投資と、利用料の見直しによる収支の悪化が懸念される。
,,▲,ゴルフ場（経営者）,・これまでは、海外旅行が減少するとゴルフ場に好影響がみられたが、前年からはそのような影響は出てこない。このことから、先行きの見通しは暗い。
