Ⅱ．景気の先行きに対する判断理由,,,,
,,□,職業安定所（職員）,・製造業の一部の企業では生産が上向いているが、生産見込みは２～３か月程度の短期のものであり、シフトの組み替えや残業で対応している結果、雇用量の増加につながっても臨時、パート、アウトソーシング程度である。
,,□,職業安定所（職員）,・企業整備による解雇者がかなり出ており、新規求職者数が前月に続き伸びているのが気にかかる。
,,□,職業安定所（職員）,・求人数については、量的には増加傾向で推移しているが、内容や質などから就職者数の伸びにはなかなか結び付かない。
,,▲,新聞社［求人広告］（担当者）,・全国的にはやや回復傾向といわれているが、当圏ではそんなことはなく、メイン業種である流通業などでは先行き不安のため求人を控えるという話が出ているため、まだまだいい状況にはなっていない。
,,▲,職業安定所（職員）,・競馬場が廃止になり、大量の離職者が発生し、減少傾向にあった求職者が増加する見通しである。
,,×,アウトソーシング企業（社員）,・予算が厳しい市町村の中で、高品質は維持して欲しいと要求されるが、当然手間暇もかかり料金的に高くなるが、それを理解してもらえず厳しい状況になる。
,,,,
　３．北関東（地域別調査機関：（財）日本経済研究所）,,,,
,,,,（－：回答が存在しない、＊：主だった回答等が存在しない）
分野,,景気の先行き判断,業種・職種,景気の先行きに対する判断理由
"家計
動向
関連

(北関東)",,◎,住宅販売会社（経営者）,・プランニング、見積、契約の各段階に進む客が増えている。
,,○,百貨店（売場主任）,・ＤＭ等で客の来店を促しており、今までの客も戻ってきている上に、新規顧客も獲得しつつある。
,,○,コンビニ（経営者）,・９月以降、売上、来客数とも前年を上回っているので、期待が持てる。
,,○,コンビニ（経営者）,・工場関係の動きが少しずつ出てきているようで、来客数が良くなっており、今後も上向きになる。
,,○,コンビニ（店長）,・今年はクリスマス関連商品を前年の倍仕入れており、ラストスパートで勢いをつけたい。年末年始の参拝客も当て込んでいる。
,,○,家電量販店（店長）,・単価の上昇が続けば良くなる。低価格の商品より、高価な質の良い商品が動く傾向にあるので、若干持ち直す。
,,○,乗用車販売店（経営者）,・12月はこのまま変わらないが、新型車が出そろい、宣伝効果も出てくることや、新年になり客の購買意欲もわいてくることで、現在よりは多少良くなる。
,,○,乗用車販売店（営業担当）,・初売フェアなどの大きなイベントがあり、来場者数の増加が期待できる。
,,○,その他専門店［携帯電話］（従業員）,・年末年始商戦に合わせ、数々の新商品が発売となり、旧商品は価格を下げて販売する。大々的に広告も出すので、新商品、廉価になった旧商品への需要が見込まれる。
,,○,通信会社（社員）,・カメラ付き携帯電話への買換え需要が多く、第３世代携帯電話への移行も順調であることから、やや良くなる。
,,□,百貨店（販売促進担当）,・衣料品はクリアランスによる売上増を見込めるが、暖冬で冬物の動きはあまり良くない。
,,□,スーパー（経営者）,・依然として客単価が下げ止まらない。11月は買上点数も下がっているので、12月の年末年始商戦も大きくは期待できない。
,,□,スーパー（店長）,・競合店が１年前に開店して以来、外部与件に変化はないが、気温が今一つのためか、あまり良くない。寒くなれば青果の単価も上昇すると期待しているが、変わらない。
,,□,乗用車販売店（経営者）,・２～３か月後は新社会人対象の商戦となり、本来なら市場が活性化する時期となるが、この就職難では期待できない。
,,□,乗用車販売店（販売担当）,・毎年11月は自動車が一番売れる時期であるが、どのメーカーの車も売れていない。売れても小さい車なので利益が上がらず、同業者とも、今年はどうしたのかと話している。
,,□,その他専門店［携帯電話］（営業担当）,・11月の来客数から考えると、今後大幅に伸びるとは思えない。
,,□,旅行代理店（経営者）,・客はタンス預金などしているのか、買い控えの動きで申込が少ない。この状況は３か月後も変わらない。
,,□,旅行代理店（経営者）,・イラクの戦争関係で、日本でもテロがあるのではないかと騒がれており、ＳＡＲＳも今年の冬どうなるか心配である。いくらか日本の景況を押し上げていた貿易関係では、円高が心配で、公的負担が年々増していく傾向の中では、地方の景況は上昇するはずがない。
,,□,旅行代理店（営業担当）,・近隣の農家所得が上向かない状況なので、このまま推移する。
,,□,タクシー運転手,・料金が上がったこともあり、客数が減少している。選挙以降は半分とまではいかないが、減収である。
,,□,通信会社（事業担当）,・大手通信系の攻勢がどこまで続くのか分からないが、なるべく対策を打てば、現状と変わらない程度までは確保できると見込んでいる。
,,□,観光名所（職員）,・忘年会シーズンに入り、来客数は例年並みを確保できると予想しているが、客単価は低下する見込みである。
,,□,競輪場（職員）,・競輪全体の販売額、競争相手の様子に良い傾向がない。
,,□,設計事務所（所長）,・建設関連はまだ良くなる状況にはない。市町合併でどう変わるか、しばらくは様子見である。
,,□,住宅販売会社（経営者）,・不動産が少しも値上がりせず、下落が続いているので、良くならない。また、銀行が非常に厳しく、ローンでも土地の融資でもなかなかお金を貸してもらえない。
,,▲,スーパー（経営者）,・競合店の値引き競争、単価の下落傾向は続く。
,,▲,スーパー（統括）,・天候等を原因とする消費不振と、年金制度改革等のフィスカルドラッグによる消費意欲の減退により、情勢は依然厳しい。一方、食品の消費傾向は、一時期の価格一辺倒から、テレビの健康番組や健康テーマ本の影響による健康、品質重視のトレンドに変わってきている。
,,▲,スーパー（経営企画担当）,・今のままでは年末商戦もさほど期待できず、年が明けても大手の決算対策のチラシ攻勢で、売上はそれほど伸びない。
,,▲,コンビニ（経営者）,・正月、バレンタインは期待できない。今までと同じことをしていては良くならないので、新たなアイデアを立案しつつ、パート、従業員が全力パワーアップすることが必要不可欠である。
,,▲,乗用車販売店（販売担当）,・年内は展示会の開催で現状を維持するが、１、２月は降雪で客の出足が鈍くなり、展示会を行っても客が来ないので、新車、中古車ともに悪くなる。
,,▲,一般レストラン（業務担当）,・12月の忘年会、１月の新年会とも、前年と比べ予約が20％減である。
,,▲,観光型ホテル（スタッフ）,・スキーの時期となるが、暖冬で雪がなく、予約が全然入らない。
,,▲,ゴルフ場（支配人）,・隣接するゴルフコースを含め、一斉に冬季割引料金が出たが、中には対抗できないほどの低料金もある。当コースは全日を割引せず、スポット日を設けたり、年間来場の多い客へのお得意様料金を設定し、客単価をあまり下げずに運営する。
,,▲,ゴルフ場（副支配人）,・同業他社の価格破壊、低料金化が一層進行している。特に、法的手段を採ったコースが破格の料金を設定し、通常の経営をしているコースを圧迫し、存続を困難にしている。客は低料金のコースに流れており、懸命な獲得にもかかわらず、３か月後の予約は低調である。
,,▲,住宅販売会社（経営者）,・今までは現行の住宅ローン控除の適用を受けるために年内入居の駆け込み客があったが、来年の受注は激減している。
,,×,商店街（代表者）,・地元銀行の経営破綻は非常に厳しい。12月始めに北関東最大となる大規模ショッピングセンターがオープンするので、年末年始商戦の市場は荒れる。悪い要素が２つ重なり、今後の販売は悪化する見込みである。
,,×,コンビニ（店長）,・11月末から近所の大型店が営業時間を延長している。22時まで営業していた店舗は24時まで、24時までだった店舗は24時間営業となったことは、非常に大きなマイナス要因である。
,,×,コンビニ（店長）,・あちこちで増えている夜間営業の大型店に流れる客が今後更に増えることに加え、破綻した銀行の支店が近くにあることから、影響を受ける。
,,×,一般レストラン（経営者）,・例年なら年末に向けて忘年会予約が入る時期であるが、現時点での予約は少ない。コイヘルペスウイルス病による鯉料理への影響と重なり、先行きに期待できない。
,,×,その他サービス［自動車整備業］（経営者）,・年末年始にかけて廃業する会社が増えており、売掛金が回収不能となるケースが出てきているので、今後も厳しい。
,,×,設計事務所（所長）,・地元銀行が破綻した影響は非常に大きい。取引先もほとんどがメインの銀行としているところなので、いくつかある計画もこのままでは中止となる。当事務所への影響も大きいが、県内全体に必ず影響が出てくるので、良くなる要素は一つもない。
"企業
動向
関連

(北関東)",,◎,－,－
,,○,食料品製造業（営業統括）,・円高傾向も落ち着き、ボージョレーヌーボーが起爆剤となって、商品の動きも回復しつつある。
,,○,窯業・土石製品製造業（経営者）,・１年で１番忙しくなる時期となる上に、祭の開催年に当たることから、関係商品の動きが見込まれる。
,,○,一般機械器具製造業（経営者）,・自動車関連部品は高水準で横ばいとなっているが、建設機械関連部品は２月ごろより10％程度増加する見込みである。
,,○,一般機械器具製造業（生産管理担当）,・建機業界の仕事は中国向けを中心に増加傾向が続く。冬場に向け自動車の四輪駆動関連部品の伸びが見込まれることや、近隣の鉄工所でも仕事が減っているとは聞かないので、好調となる。
,,○,輸送業（営業担当）,・年末に向かい大幅な輸送量が見込めるが、排ガス規制の関係で、協力会社の車両が減少しており、車両確保が問題である。
,,□,化学工業（総務担当）,・新規物件が出てこない。年が明けたら何か出てくるという雰囲気はまるでない。
,,□,窯業・土石製品製造業（総務担当）,・需要期ではあるが、販売量や価格は低迷しているので、あまり良くはならない。
,,□,電気機械器具製造業（経営者）,・安定した長期の仕事の受注は少ない。
,,□,輸送用機械器具製造業（総務担当）,・12月は軽自動車のモデルチェンジがあり、量産効果でばん回となる。新車の売行きにもよるが、１月は休日が多いので総じて横ばいである。
,,□,建設業（経営者）,・競争が激化しており、受注は増加しない。
,,□,経営コンサルタント,・季節要因で動きが出ているものの、中小企業の厳しい経営状況は変わらない。
,,▲,その他製造業［宝石・貴金属］（経営者）,・クリスマスシーズンで商品の動きが活発化しても、低迷する市況を回復させるほどではない。10、11月と老舗の宝石卸店が倒産しており、年末商戦の結果次第ではあるが、更に倒産する企業が出てくる可能性もある。
,,▲,広告代理店（営業担当）,・年末年始需要が終わると、広告受注が著しく低下する。特にこの３年は落ち込みが激しく、１月以降に期待感はない。
,,▲,その他サービス業［放送］（営業担当）,・自動車、電機産業、官公庁からの売上は横ばいであるが、減少が続く商業、サービス業からのコマーシャルは更に３％程度減少する見込みである。
,,×,建設業（総務担当）,・前年と比べ、受注が大きく落ち込んでおり、ボーナス支給の大幅減も避けられない状況である。
"雇用
関連

(北関東)",,◎,－,－
,,○,職業安定所（職員）,・デジタルカメラや半導体等の生産が好調であることや、県外資本の大型スーパーの進出により、求人数、就職者数とも増加している。正社員採用には慎重であるが、やや良くなる。
,,□,人材派遣会社（経営者）,・年内は生産関連の求人、求職の伸びが続く。12、１月は現状維持である。
,,□,人材派遣会社（営業担当）,"・一部ＩＴ関連メーカーなどからの派遣要請は堅調である。電気、自動車関連のメーカーでは、工場など現場の求人はあっても、事務系はほとんどない。
・派遣の登録者は、英語力など特殊能力を生かせる職を求めるケースが比較的多く、将来正社員を希望する登録者も少なくないので、求人と求職のギャップが目立ち、結果として採用件数が伸びていない。この状況は今後も続く。"
,,□,職業安定所（職員）,・求職者が減少し、求人数は増加している一方で、減少傾向にあった企業の倒産、金融整理が、前年並みの件数になってきている。
,,□,職業安定所（職員）,・求職者数は減少傾向で、求人数は増加傾向にあり、この状態は続く。
,,□,民間職業紹介機関（経営者）,・製造業は全体的に上向きだが、建設業が低迷している。建設関連の業者は非常に多く、肥大化された公共事業のつけが、吸収できていない。
,,▲,求人情報誌製作会社（経営者）,・今年は周辺地域に大型ショッピングセンター、アウトレットがオープンし、更に12月には別の場所にもう１店舗ショッピングセンターが開店する。地域で１番の都市などはかなり影響を受けるので、開店してみないと分からないがやや悪くなる。
,,▲,職業安定所（職員）,"・10月の離職者が６か月ぶりに1,000名を超え、うち30％が会社都合で退職している。２～３か月はこの状況が続く。"
,,▲,学校［短期大学］（就職担当）,・県内企業と大学の情報交換会があり、首都圏を含む大学96校と企業66社が参加した。人事担当者の話では、技術、営業職への採用意欲は根強いものの、多くの学生が希望する事務、販売などの正社員採用には慎重である企業が多く、厳しい状況である。
,,×,人材派遣会社（社員）,・取引先の様子は現時点ではあまり変わらないが、地元銀行の破綻により、今までも厳しい様子であったホテル等が影響を受けるのはもちろんのこと、自社の取引環境についても悪化する見込みである。
,,,,
　４．南関東（地域別調査機関：（財）日本経済研究所）,,,,
,,,,（－：回答が存在しない、＊：主だった回答等が存在しない）
分野,,景気の先行き判断,業種・職種,景気の先行きに対する判断理由
"家計
動向
関連

(南関東)",,◎,＊,＊
,,○,商店街（代表者）,・カードの売上が良くなり、単価が上昇する傾向が続いている。今後も少しずつであるが、景気は良くなる。
,,○,百貨店（統括）,・上顧客層の購買は減少していないので、春物が入ってきた段階で、販売量は増加する。
,,○,コンビニ（経営者）,・この数か月、少しずつ来客数が増加している。今後もこの状況が続く。
,,○,家電量販店（店長）,・家電機器全体で、デジタルと省エネという二つの流れが明確になっている。地上デジタル放送の開始、省エネの進展で、買換え需要が予測できる。
,,○,都市型ホテル（スタッフ）,・今後の受注状況について、結婚式の件数は前年同期比で80％であるが、一般宴席の予約人数は120％となっている。16年上期は、15年上期よりも多少良いと予想している。
,,○,旅行代理店（従業員）,・海外旅行の先行販売状況が、前年水準まで回復してきている。
,,○,通信会社（経営者）,・12月１日より地上デジタル放送が開始されるのに伴い、ケーブルテレビの加入者も増加する。
,,○,観光名所（職員）,・来客数が順調に増加しており、12、１月も５％程度の伸びが予測される。
,,○,ゴルフ場（支配人）,・利用料金を下げたので、来年１～３月は集客が見込める。
,,○,設計事務所（所長）,・現在滞っている物件の計画が前に進むと考えられるので、多少は良くなる。
,,○,住宅販売会社（経営者）,・２～３か月後には、住宅が完成し販売可能になるので、現状よりはやや良くなる。
,,□,一般小売店［衣料・雑貨］（経営者）,・末端の小売業が厳しい状況は変わっていないが、冬物の売上は悪くない。年末にかけて高齢者向けの商品券の発行で、地域経済が活性化し、良い状況は続く。
,,□,一般小売店［医薬品］（経営者）,・11月は、イベントを開催したので良い結果となったが、世の中の景気全体は、急激には良くならない。
,,□,一般小売店［パン］（従業員）,・商品単価の構成を工夫しても、相変わらず低価格の商品が動いていることから、今後も変わらない。
,,□,百貨店（売場主任）,・客は必要最低限の商品を買うだけで、追加の商品を買うことは少ない。現在の購買行動が今後急に変わる様子は見受けられない。
,,□,百貨店（企画担当）,・良い月があっても、２か月以上続かない。一部の企業の業績は回復しているが、個人消費に関しては景気回復とは程遠い状況である。今後も、個人レベルでは消費に回せる金額の減少が予想され、良くなることは全く期待できない。
,,□,百貨店（営業担当）,・先行き不安感からか消費の動きに力強さが感じられない。単価、数量ともに伸び悩む。
,,□,百貨店（営業担当）,・小売業では値札の消費税総額表示問題等の大きな課題を抱えており、今後、高額品のシェアが高い百貨店は苦戦が必至である。取引先によっては、値札等作成機械の導入費用、導入時期の遅れ、納品の不備等により、売るべき時期に売れる商品がない状態になることも考えられる。
,,□,百貨店（営業企画担当）,・衣料は百貨店業界の主力商品であるが、今年の秋冬商戦でファッショントレンドが大きく変わる気配がない。
,,□,スーパー（店長）,・今後の天気予報からも、衣料品関係の苦戦が予想される。食品の強化を図り、全体的な底上げを図りたい。
,,□,スーパー（店長）,・天候、気温による波はあるが、婦人客の購買動向が上向いていない。ファッションの大きな流れもなく、年末商戦、春物商戦にも大きな変化はないと予想している。
,,□,スーパー（店長）,・客は安くても必要でない商品は購入せず、逆に必要であれば、値段が高くても購入するという傾向が明確になっているが、高単価商品の販売状況が、売上減をカバーし切れない状況は続く。
,,□,スーパー（統括）,・買物客の話から、年金等将来に対する不安から、自分のことは自分で努力して守らないといけないという意識が強まっていることがうかがえる。日常生活を極力切り詰めて、将来に備える動きが顕著になる。
,,□,コンビニ（経営者）,・大型店や同業他社の出店も一段落し、大きな天候の変更がなければ、現状のままで推移する。
,,□,コンビニ（店長）,・予約商品の受付状況が、11月末日で目標の４割程度の達成率となっており、今後が厳しいと予想される。
,,□,衣料品専門店（次長）,・来客数が下げ止まっているため、１人当たりの買上単価の上昇を図ることで、現状の売上を維持できる。
,,□,家電量販店（営業部長）,・このままの暖冬気候が続けば、かなり厳しい冬物商戦になる。地上デジタル放送も、今年はまだ盛り上がりに欠けており、起爆剤となるような力のある商材に乏しい。ハードディスク搭載のＤＶＤレコーダーも、期待ほどではなさそうである。
,,□,乗用車販売店（店長）,・新車購入のために来場する客が減少している。購入する人も、故障を原因に買換える場合が多く、良い車に乗り換えたいという積極的な客が減少している。今後もこの傾向は変わらない。
,,□,乗用車販売店（販売担当）,・企業による車両の台替の話は少しずつ出ているが、サイクルは一段と延びている。個人客も、購入に対する姿勢は慎重で、購入までには時間がかかる。
,,□,その他専門店［キャラクターグッズ］（従業員）,・クリスマス商戦を控え、新商品も随時投入しているが、客から前年ほどの反応がみられない。
,,□,その他専門店［眼鏡］（店員）,・来客数は全般的に戻ってきているが、外販等の催事による売上は厳しく、当面状況は変わらない。
,,□,一般レストラン（店長）,・ボーナス時期を迎えるが、客は金を消費ではなく貯蓄に回しており、外食の回数を増やすとは考えられない。３か月先も変わらない。
,,□,都市型ホテル（スタッフ）,・周りの経済環境は若干上向きであるが、消費者がサービス業にお金を使うには至らない。ホテルとしての景気回復には、まだまだ時間がかかる。
,,□,旅行代理店（従業員）,・海外旅行需要は、ＳＡＲＳ再発の有無にかかっている。国内旅行は、日帰り、スキー旅行の販売がポイントで、気象条件に大きく左右される。
,,□,タクシー運転手,・年末の一週間程度は若干利用客が増加するかもしれないが、ほんの一時でしかない。10月同様の売上を確保しようとすると、朝夜はかなり無理をして走らないと厳しい。
,,□,通信会社（営業担当）,・期待されている地上デジタル放送の商品投入が来年７月にずれ込み、ＩＰ電話も２台目の需要が不透明であるため、見通しとしては変わらない。
,,□,通信会社（営業担当）,・営業での獲得件数に大きな変化はないが、インターネットサービスでは低額商品へのシフトが目立ち、品質よりも価格を優先している傾向は明らかである。今後も、家計に余裕が生まれる可能性は低い。
,,□,競馬場（職員）,・全体の売上、１人当たりの購入単価とも横ばいである。景気が少し良くなっているとの声もあるが、当業種には当面現れてこない。
