Ⅱ．景気の先行きに対する判断理由,,,,
,,▲,ゴルフ場（経営者）,・単価に下げ止まり感がなく、安い物を探せばいくらでもある状況なので、予約があっても二股をかけられ、キャンセルされる状態であることから、先行きの見通しは厳しい。
,,▲,美容室（経営者）,・大手スーパーが閉店して半年が過ぎ、やっと落ち着いてきているが、先行きの見通しは厳しい。
,,▲,その他サービス［学習塾］（経営者）,・学習意欲が低下してきた上に、通塾には経済的な負担がかかるので、今後もそれほど期待できない。
,,▲,その他サービス［クリーニング］（経営者）,・７月ごろは衣料はもとより、寝具や小物に至るまでの春物関連の品物の集荷は、ほぼ終わりとなっているため、とくにプラス材料がない限りは、厳しい状況が予想される。
,,×,その他専門店［宝石］（経営者）,・イラク戦争、株価の暴落、ＳＡＲＳの恐怖が消費者マインドを冷やしていることから、先行きの見通しは厳しい。
,,×,都市型ホテル（副総支配人）,・宿泊、宴会予約状況は、イラク戦争、ＳＡＲＳ問題も影響して芳しくないことから、先行きの見通しは厳しい。
,,×,旅行代理店（営業担当）,・外的要因による影響が強く、客の出足を鈍らせている。夏にピークを迎える需要に関しては、先行予約が低迷し、６～８月に向けての予約状況は、前年同月比で60％台しか確保ができていない。
,,×,旅行代理店（営業担当）,・ＳＡＲＳの影響が日本国内に拡大すると、旅行需要は完全に冷え込み、倒産するエージェントが続出する可能性が大きい。危機的な状況も想定される。
"企業
動向
関連

(近畿)",,◎,出版・印刷・同関連産業（経営者）,・新規事業に取り組み出したが、パチンコ業界、病院その他の販売施設から前向きな問い合わせが多く、新規事業に対する注目が集まっていることから、先行きに期待できる。
,,○,広告代理店（従業員）,・大型ホームセンター、量販店の出店が盛んなため、出店に伴う広告宣伝費の増加が見込まれる。
,,□,化学工業（経営者）,・発注の小ロット多品種化がますます進んでおり、コスト削減に限界が見え始めているが、得意先の値引き依頼は依然として強く、良くなる要因が見当たらない。
,,□,化学工業（経営者）,・イラク、ＳＡＲＳと景気の不安要素が多く、消費者の購買意欲は上がらない。
,,□,建設業（社員）,・新しい不動産投資システムが構築されつつあるが、景気全体の底上げ感が感じられず、不動産への投資は引き続き低調であると予想される。
,,□,輸送業（営業担当）,・客からの価格引下げの要請も一段落し、受注量も低位ながら安定しつつあるが、この現状が上向いてくるという勢いは感じられない。
,,□,輸送業（営業所長）,・輸入貨物は、ＳＡＲＳの影響で香港便の飛行機が減便しているが、状況がすぐに良くなる兆候はみられない。
,,□,不動産業（経営者）,・現在、住宅における空室率は安定しており、大きく悪くなることはないが、良くなることも考えにくい。
,,□,不動産業（経営者）,・投資物件の購入意欲は旺盛であるが、銀行融資の姿勢が慎重で、価格が抑えられがちであることから、厳しい現状が続く。
,,□,広告代理店（営業担当）,・取引先の中小企業で今年度の予算がかなり減らされていることから、先行きが懸念される。
,,□,その他非製造業［衣服卸］（経営者）,・小売においては、売価低下や競争激化が広まる傾向で、回復材料に乏しい。ＳＡＲＳの心理的悪影響も悪い方向に作用していくことが懸念される。
,,▲,食料品製造業（従業員）,・ＳＡＲＳ関連では、原料に関する問い合わせがあるなど、この問題が深刻化すると大変なことになる。
,,▲,繊維工業（経営者）,・展示会での売上が主であるが、その肝心の催事が減っている。経費が負担になって、催事もできない状況である。
,,▲,化学工業（経営者）,・中国市場の動きにより、日系進出企業の状況が悪くなっている。今のところ、それが良くなるニュースが伝わってこない。
,,▲,金属製品製造業（経営者）,・ＳＡＲＳの影響で、アジア向け輸出を含む荷動きが一層悪くなるのではと懸念している。
,,▲,一般機械器具製造業（経営者）,・ＳＡＲＳの影響は、当社にとって、イラク戦争よりも直接的である。海外出張が自由にできなければ、確実に受注が延期される。５月中の商談は順調にはいかず、経済活動はここ数か月は停滞すると予想される。
,,▲,一般機械器具製造業（経営者）,・航空機の需要がすぐには回復しないことから、先行きの見通しは厳しい。
,,▲,建設業（経営者）,・地元の建設業界の先行きに明るい話題もなく、今以上に全体工事量の縮小が予想される。官庁関係は縮小傾向にあり、民間ではより厳しい価格競争になる。
,,▲,金融業（支店長）,・株価低迷の影響で先行きが懸念される。ＳＡＲＳの影響が今後注視される。
,,▲,経営コンサルタント,・ＳＡＲＳが日本の景気にどう影響するかという不安から、先行きの見通しは厳しい。
,,▲,コピーサービス業（従業員）,・イラク戦争による復興支援金の負担、ＳＡＲＳによる旅行業界への打撃及びそれらに起因する株価の世界的な下落等、回復の目途が立たない状況である。
,,×,不動産業（営業担当）,・賃貸マンションへの入居者の年収が下がってきていることから、先行きが懸念される。
"雇用
関連

(近畿)",,◎,－,－
,,○,民間職業紹介機関（支社長）,・前年の春に比べ、企業の採用意欲は間違いなく上昇していることから、先行きに期待できる。
,,□,職業安定所（職員）,・企業の倒産件数及び負債額は、前年比、前年同月比とも減少し、大口倒産もなかったが、倒産の要因は不況型が８～９割を占め、厳しい状況が続いていることから、先行きの見通しは今後も厳しい。
,,□,職業安定所（職員）,・有効求人倍率は増加傾向にあるが、大企業の雇用調整、希望退職者の募集が目立ってきている。今後も全体としては変わらない。
,,□,職業安定所（職員）,・雇用関連の数値は改善されつつあるものの、就職件数は前年比で減少となるなど、ミスマッチの傾向が依然残ると予想されることから、厳しい現状が続く。
,,□,民間職業紹介機関（職員）,・建設工事の工程上で、工事量や求人数の先行指標となる鉄筋工の求人がそれほど目立たないことから、現状のまま推移する。
,,□,学校［大学］（就職担当）,・大手企業の採用動向は、前年度に比べ、１週間ほど早く内定を出している企業と、時間をかけて選考している企業との二極化がみられる。新卒についても、質重視の採用が徹底されている。
,,▲,人材派遣会社（経営者）,・戦争後の復興資金負担とＳＡＲＳが世界経済に与えるマイナスの影響が浸透していくことから、先行きが懸念される。
,,▲,人材派遣会社（経営者）,・企業の資金繰りが悪くなっており、特にＩＴ業界においては倒産や支払期限を伸ばして欲しいという会社が増えている。この様子から、先行きの見通しは厳しいと考えている。
,,×,新聞社［求人広告］（担当者）,・戦争の余波が続き、ＳＡＲＳの影響もしばらく続くと思われ、とても良くなりそうには思えない。
,,×,新聞社［求人広告］（担当者）,・最近の広告料金は定価があってないようなもので、受注するためには、最初から思い切った低価格を提示しなければならなくなってきた。先行きの見通しは非常に厳しい。
,,,,
　８．中国（地域別調査機関：（社）中国地方総合研究センター）,,,,
,,,,（－：回答が存在しない、＊：主だった回答等が存在しない）
分野,,景気の先行き判断,業種・職種,景気の先行きに対する判断理由
"家計
動向
関連

(中国)",,◎,－,－
,,○,コンビニ（エリア担当）,・若干上向き傾向にあるため、よほどのことがない限り、上昇傾向は続く。
,,○,家電量販店（副店長）,・販売側の施策により、良い面で、多少客に動きが出てきている。
,,○,住関連専門店（営業担当）,・海外から新商品を大量に入荷したことで、客の注目を引いており、今後この商材を使って店舗展開を目指すことで、売上の増につながる可能性がある。
,,○,タクシー運転手,・戦争及びＳＡＲＳ等により海外の状況が良くないため、国内の方に客が回ることが予想され、観光客の需要が期待できる。
,,○,パチンコ店（企画担当）,・戦争及びＳＡＲＳ等のため、海外旅行等のレジャーが控えられることにより、近場のレジャー業界へ客が流れる。
,,○,美容室（経営者）,・新規開店により増客の見込みがある。
,,○,設計事務所（経営者）,・来客の動きが出てきている。
,,□,一般小売店［茶］（経営者）,・戦争やＳＡＲＳなどにより人の動きが止まっているが、その分、地元で多少動いているため、悪いなりに売上は落ち込んでおらず、この状況がしばらく続く。
,,□,百貨店（営業担当）,・ＳＡＲＳの影響があり、中国製品に疑いが持たれたり、中国からの納品に遅れが出てくる。
,,□,百貨店（売場担当）,・セールなどで客がつかないことが予想され、景気は上昇しない。
,,□,スーパー（総務担当）,・売上増が期待できる５月連休も曜日配列が悪く、現状は変わらない。
,,□,スーパー（店員）,"・売上は変わらないが、例年動いていた品物が、今年はゴールデンウィークに差しかかっている今でも、動いていないものもある。
・品物が動かないので仕入れ量が減少しており、今後も状況は変わらない。"
,,□,コンビニ（エリア担当）,・販促に対して顧客の反応が鈍く、改善の傾向がみえない。競合の有無に関係なく、来客数が増えない。
,,□,衣料品専門店（地域ブロック長）,・来客数は増えても単価が低いままなので、売上は減少傾向である。
,,□,衣料品専門店（店長）,・客の購買意欲に変化がなく、購入単価が低い。今後も売上は変わらない。
,,□,家電量販店（店長）,・状況は悪いままであるが、今後の見通しとして、デジタル関連製品の販売により、市場も動いてくる。
,,□,家電量販店（予算担当）,・客の買上点数が減少してきている。
,,□,乗用車販売店（総務担当）,・これまでの新型車の効果が薄れてくる。
,,□,高級レストラン（スタッフ）,・個人の利用はある程度はあるが、法人関係の利用が少ないため、予約状況はあまり上向かない。
,,□,旅行代理店（経営者）,・ＳＡＲＳの影響で先行きが不透明である。現状でも、受注量が例年より35％程度減っており、今後も、海外の受注見込みはほとんどない。
,,□,通信会社（社員）,・販売量の変化があまりないため、この状況は今後も続く。
,,□,通信会社（営業担当）,・客単価は更に減少傾向にあり、付加サービスやキャンペーンでアピールしても見通しが悪く、状況は変わらない。
,,□,通信会社（広報担当）,・９月ごろまでに新機種を順次発売する予定だが、短期間には契約者数を大きく増加できないため、変わらない。
,,□,テーマパーク（広報担当）,・イラク情勢やＳＡＲＳなど、世界情勢はいまだ不透明なことから、それが客の心理にどうかかわり、観光に作用するかが分からず、先が見えない状況である。
,,□,テーマパーク（業務担当）,・来客数の動きに好転の材料が見当らないとともに、晴天時でも客足が鈍いときがあり、今後の売上についても懸念が残る。
,,□,ゴルフ場（従業員）,・来客数の予約状況は例年並みでほとんど変わらないが、70歳以上の方に対するゴルフ利用税が課税対象から外れたため、今後客足が少し伸びる可能性がある。
,,□,競艇場（職員）,・来客数、発売金額ともに横ばいで、変化がみられない。
,,□,美容室（経営者）,・同業種の中で閉店するところが何軒かあること、最近売上が落ち込んで伸びないという悩みを持っているオーナーが多いことから、今後も変わらず、厳しい状況が続く。
,,□,設計事務所（職員）,・イラク戦争の早期終了により、原油アップ等の社会経済不安がなくなり、個人住宅の新築、改築の状況は現在とあまり変わることもない。
,,▲,コンビニ（エリア担当）,・競合出店の増加やスーパーマーケットの開店時間の長時間化が進むことで、来客数の減少につながり、ますます厳しくなる。
,,▲,家電量販店（店員）,・テレビ、洗濯機、冷蔵庫等の家庭用商品は売れているが、単価が低下しているため、売上はやや悪くなる。
,,▲,乗用車販売店（経営者）,"・商談で厳しい値引き攻勢にあったり、金額妥結までに時間を費やしている現状から判断すると、今後一段と厳しい状況になる。
・安い車、燃費の良い車へのシフトがますます強くなってきているとともに、大型車は依然として動きが鈍い状況であり、今後はやや悪くなる。"
,,▲,自動車備品販売店（店長）,・相変わらず高額商品が売れず、今後も売れる様子がない。
,,▲,住関連専門店（広告企画担当）,・単価が低下しているため、販売量を増やさねばならないが、現状では難しいので、見通しはやや悪くなる。
,,▲,その他専門店［時計］（経営者）,・客が店舗を何軒も回って比較し、購入決定までの時間が長い状況からみて、今後はやや悪くなる。
,,▲,一般レストラン（営業担当）,・来客数が減少傾向にあるとともに、生ビールの企画で売上回復を願っても、飲酒運転の罰則強化などで期待できない状況にある。
,,▲,都市型ホテル（経営者）,・婚礼関係で、競合施設の改装、新規開業による影響が少なくとも半年は続くことなどから、やや悪化する。
,,▲,都市型ホテル（スタッフ）,・客の財布のひもが固く、去年歓送迎会を行っても、今年は行わないところが、急増している。
,,▲,旅行代理店（団体営業担当）,・ＳＡＲＳの蔓延は止む気配がなく、先行きはやや悪くなる。
,,▲,タクシー運転手,・規制緩和による新会社の参入があるため、需給バランスが崩れてきており、先行きはやや悪くなる。
,,▲,通信会社（経営者）,・新規加入実績が例年の平均値を大きく下回っており、客の反応も更に厳しいままである。
,,▲,通信会社（企画担当）,・業界内での価格競争やキャンペーン競争が激化している。
,,▲,通信会社（通信事業担当）,・新規転入者の問い合わせなどが増える時期だが、客がサービス内容、料金などを吟味しており、契約に結びつかない状況にあるため、見通しが立てにくい。
,,▲,住宅販売会社（販売担当）,・展示場やイベントへの来客数が減少傾向にある。
,,×,百貨店（統括）,・例年、新ブランドの投入だけでも大きな売上のあった紳士服、子供服を中心に売上が悪く、さらに悪化する。
,,×,百貨店（売場担当）,・外商売上も伸びないうえに、経費が絞られているため、広告や人の投入ができない状況にある。
,,×,乗用車販売店（販売担当）,"・１、３月が年間最大の需要期であるため、前倒しで販促活動を行った反動が出ている。
・買替え期間が３年から５年へ、５年から６年、７年に、ますます伸びる傾向にある。"
,,×,乗用車販売店（営業担当）,・新規来場数が激減しており、客の購買意欲が低下している。
,,×,一般レストラン（店長）,・予約の件数が非常に減少している。
"企業
動向
関連

(中国)",,◎,－,－
,,○,金融業（業界情報担当）,・地元の自動車メーカーにおいて、収益面は低い伸びになるとみられるが、新型車の生産開始により、操業は一段と高まると期待できることから、景況感は改善する。
,,□,農林水産業（従業者）,・資源保護のため、大型底引き船が４月で休漁に入るものの、不漁が続いていた巻網船は、シケが減少傾向にあるので、出漁できる機会が多くなる。
,,□,食料品製造業（総務担当）,・一般市場は相変わらず物が動かない。和風の日配品は、零細企業製造によるものが多く、原料単価を下げると品質低下が懸念されるため、商品価格は下げられない状況にあり、ますます物が売れないという悪循環を生んでいる。
,,□,窯業・土石製品製造業（総務経理担当）,・需要の波はあるが、大手、大口納入先の鉄鋼業は、生産好調が継続する。
,,□,一般機械器具製造業（経営企画担当）,・北米市場に不安を抱えるものの、国内の受注量は若干ではあるが、増加傾向にある。
,,□,輸送用機械器具製造業（経理担当）,・主要顧客からの受注量の内示は、今後も好調を維持している。
,,□,建設業（経営者）,・周南合併による建設業への効果が見えにくく、他にも明るさがない。
,,□,輸送業（総務担当）,・販促活動でも、現行の料金より低ければ話を聞くが、そうでなければ話を聞かないといった客の反応が多く、状況は変わらない。
,,□,輸送業（総務担当）,・取引先企業の中で爆発的ヒット商品が見当たらず、状況は変わらない。
,,□,会計事務所（職員）,・業種間で勝ち組負け組が歴然としてきており、この傾向は変わりそうにない。
,,▲,食料品製造業（総務担当）,・従来の委託商品の製造だけでは売上が伸びないため、最近、自社製品を作り始めたものの、顧客のニーズをつかむことが難しく、状況はやや悪くなる。
,,▲,繊維工業（統括担当）,・ＳＡＲＳ問題による中国生産の不透明さ、株価の低迷、依然続く政治の混迷、首相のはっきりしない態度から、先は若干不安である。
,,▲,鉄鋼業（総務担当）,・半導体関連材料や堅調だった自動車関連材料の動きが鈍くなり始めており、先行き不安感が大きい。
,,▲,非鉄金属製造業（経理担当）,・販売量に関しては横ばい、若しくは若干回復傾向にあるが、販売価格に関しては下がる一方であるため、やや悪くなる。
,,▲,金属製品製造業（総務担当）,・現在の受注予定量から判断すると、先行きの仕事量は減少する。
,,▲,電気機械器具製造業（広報担当）,・米国景気の低迷、イラク復興、ＳＡＲＳ等、マイナス要因が多くあるため、景況感はやや悪化する。
,,▲,建設業（経営企画担当）,・引き合いの物件も減少しているので、先行きの景気が良くなるとは考えられない。
,,▲,金融業（営業担当）,"・大手企業の５月以降の設備投資が全くなく、中小においては仕事の受注が全くない。
・５月以降の資金繰りが全く立っていない状況で、入金が先細り、支払のみが残っている状況である。
・仕事の取り合いが更にひどく、原価割れ受注が多くなり、体力勝負の色合いがより濃くなる。"
,,×,－,－
"雇用
関連

(中国)",,◎,－,－
,,○,職業安定所（職員）,・製造業で新規求人の増加が見込める。
,,○,学校［大学］（就職担当）,・本学主催の企業説明会に、例年より多くの企業が参加している。
,,□,人材派遣会社（経営者）,・企業は生き残りをかけて良い人材を求めているため、人材派遣や人材紹介の需要は、依然堅調である。
,,□,職業安定所（職員）,・建設業を中心に、人員整理の動きが止まらないことから、新規求職が引き続き高水準で推移する。
,,□,職業安定所（職員）,・小規模ではあるが、人員削減をしている企業もあり、求職者数が大きく変化していない。
,,□,学校［大学］（就職担当）,・求人の早期化が目立つばかりで、実質の求人数が増えていない。
,,▲,新聞社［求人広告］（担当者）,・４月の新聞広告による売上は、３月に続いて前年をクリアできたが、ＳＡＲＳなどによる心理面への不安感から、景気動向には陰りがみられ、やや悪化する。
,,▲,民間職業紹介機関（職員）,・雇用状況においては、年齢が上がるのに比例して採用率が悪くなる傾向と、職務遂行能力が平均的な人の就職先が、年代を問わず、少ない傾向がある。
,,×,人材派遣会社（支店長）,・潜在的に雇用が過剰気味でリストラが進まず、不足感がある求人状況との関係では、求職者の雇用は難しく、状況は良くならない。
,,,,
　９．四国（地域別調査機関：四国経済連合会）,,,,
,,,,（－：回答が存在しない、＊：主だった回答等が存在しない）
分野,,景気の先行き判断,業種・職種,景気の先行きに対する判断理由
"家計
動向
関連

(四国)",,◎,－,－
,,○,乗用車販売店（従業員）,・同時多発テロ以降、減少していた売上が、最近、持ち直して来ている。
,,□,商店街（代表者）,・地方の商店街においては、イラク戦争、ＳＡＲＳの問題等の外的要因の影響は少なくなってきたように思う。
,,□,一般小売店［生花］（経営者）,・売上は減少したまま横ばい状態である。購買力のある消費者が減少している。
,,□,一般小売店［菓子］（販売担当）,・来客数は前年割れを続けており、一向に回復の兆しが見えない。
,,□,百貨店（営業担当）,・統一地方選挙中の来客数の減少は回復してきているが、相変わらず、紳士服、リビング関連商品の売上が低調で、全体を押し下げる要因となっている。
,,□,スーパー（店長）,・安価なものを買うという客の動向、買上点数には、変化がない。
,,□,スーパー（店長）,・ＳＡＲＳの影響で国内需要が高まるかもしれないが、景気にプラス効果を与えるほどの影響はない。
,,□,スーパー（企画担当）,・価格を見てから商品を買うという客の動向から、単価は底を打ったという感じはない。
,,□,コンビニ（代表者）,・前年比で販売量は５～６％減少、来客数は４～５％減少、単価は３％低下している。
,,□,衣料品専門店（経営者）,・ＳＡＲＳで海外旅行が減少し、その分、国内消費に回るのではないかと思っている。しかし、アジアの製造活動の悪化から、横ばいか、やや減少すると感じている。
,,□,家電量販店（店長）,・来客数は増加しているが、単価は低下傾向である。
,,□,家電量販店（営業担当）,・デジタルカメラ、携帯電話はよく売れており、冷蔵庫、洗濯機も明るい兆しが出てきたが、他商品の販売量が増加してこない。
