Ⅱ．景気の先行きに対する判断理由,,,,
,,□,電気機械器具製造業（経営者）,・需要はあるが、液晶や半導体の生産は海外、特に中国へ移転され国内の動きが絶不調である。空洞化に関係の薄い水処理分野も最終消費者が弱気で動きが鈍いなど、厳しい現状が続くと予想される。
,,□,輸送業（営業所長）,・ＳＡＲＳの鎮静化による秋冬物の衣料関係の輸入安定化に期待しているが、例年ほどは期待できない状況である。
,,□,不動産業（経営者）,・地価の下落から収益ビル等の利回りが高くなり、物件価格が上昇に転じるとの予測をする投資家も現れているものの、銀行に融資への慎重姿勢もみられることから、今の厳しい状況が続くと思われる。
,,□,コピーサービス業（従業員）,・ＳＡＲＳの終息宣言が出されると予想しているが、取引先である旅行業者の不振はまだ続くと思われる。一方で在阪球団の好調により、関連商品の販売やイベント企画等によるオーダーが増え続けていることは唯一の明るい材料といえる。
,,□,その他非製造業［民間放送］（従業員）,・在阪球団による盛り上がりは、ナイター中継などの高視聴率という意味で放送局にも恩恵をもたらしているが、一部の放送局を除いて試合の中継数は限られているため、その効果も一時的かつ散発的なものであり、先行きの盛り上がりには期待できない。
,,▲,繊維工業（団体職員）,・とにかく受注への動きがみられない。ごく一部に、国産の高付加価値商品の提案をしてほしいとの話は聞くが、実際の注文はないことから、先行きの見通しは暗い。
,,▲,広告代理店（営業担当）,・テレビのスポット広告の状況が前年よりかなり悪い売行きであるので、今後は厳しくなると思う。
,,×,不動産業（営業担当）,・不動産市場では取引の回転率が悪くなっており、売主の希望価格で売れなくなってきている。路線価もかなり下がっていることから、取引は更に低調になると思うため、不動産価格はまだ下がると思う。
"雇用
関連

(近畿)",,◎,－,－
,,○,人材派遣会社（経営者）,・かなりの企業が人員削減を行っており、もう限界に来ている様子が見受けられる。そのため７月以降は求人も徐々に明るさがみえてくるのではないかと思われる。
,,○,新聞社［求人広告］（担当者）,・求人広告の件数が前年を上回らないものの、減少の幅は縮小しており、もう少しで回復となる可能性があることから、先行きに期待できる。
,,○,職業安定所（職員）,・求人開拓等による事業所訪問時に、今後の採用について前向きな回答をしている事業所が増加してきている。現時点での採用には慎重であるが、秋以降での採用を計画しているとの回答が増加傾向にあるため、今後の景気回復への期待感がうかがえる。
,,○,民間職業紹介機関（支社長）,・中堅企業の採用意欲が、少しずつ増加してきていることから、先行きに期待できる。
,,○,学校［大学］（就職担当）,・今月になって内定報告に来る学生たちが増加傾向にあるほか、複数の内定獲得者が増加している。企業の採用意欲が少し上向きになった感があることから、先行きに期待できる。
,,□,人材派遣会社（社員）,・企業におけるコスト削減意識が根強く、新規受注の増加が見込めない。また受注職種に偏りがあることから、求職者の希望とのミスマッチ傾向が今後も続くと思われる。
,,□,求人情報誌製作会社（編集者）,・単純軽作業などでは時間給の低下がみられ、そういった募集に対しては応募の集まりが悪いことから、厳しい状況は続くと思われる。
,,□,職業安定所（職員）,・新規求職者は依然として減少し、新規求人数は増加傾向が続いている。雇用環境は好転しつつあるようにみえるが、ＳＡＲＳの影響が企業に出てくると予想されることから、予断を許さない状況である。
,,□,職業安定所（職員）,・新規求人数は相変わらず順調に増えていて、前年比で約２割増加している。しかしながら派遣や請負関係の求人が多く、就職に結びついていないことから、雇用環境の改善には至らないものと思う。
,,□,職業安定所（職員）,・今後２、３か月の間でリストラを行う企業からの相談等が目立っている。したがって先行きの見通しは厳しいと思われる。
,,▲,＊,＊
,,×,＊,＊
,,,,
　８．中国（地域別調査機関：（社）中国地方総合研究センター）,,,,
,,,,（－：回答が存在しない、＊：主だった回答等が存在しない）
分野,,景気の先行き判断,業種・職種,景気の先行きに対する判断理由
"家計
動向
関連

(中国)",,◎,－,－
,,○,都市型ホテル（経営者）,"・団体の宿泊の受注件数が例年を大幅に上回っている。
・競合施設の進出効果が薄らいだため、婚礼の受注も目標の件数を確保している。"
,,○,旅行代理店（団体営業担当）,・徐々にＳＡＲＳ、テロの影響が薄れてきて、更に来客数が増加する。
,,○,通信会社（企画担当）,・いまだ採算的には厳しいものの、主力商品の認知度も高まって、市場での普及が進み、スケールメリットが生じてくる。
,,○,通信会社（営業担当）,・低価格インターネットのサービスエリアを拡大するため、新たな需要が見込まれる。
,,○,競艇場（職員）,・８月に開催する盆を挟むレースで売上が見込める。
,,○,住宅販売会社（経理担当）,・新規発売物件への来場者が予想を上回っており、契約についても計画数値を上回る。
,,□,商店街（代表者）,・メーカーの生産調整がますます厳しくなり、夏物商戦用の商材が売れても欠品する状態にあるので、売るネタに困っている。
,,□,百貨店（売場担当）,・ショッピングセンター全体の来客数は増加しているが、セール待ちの傾向が見受けられ、購買には結びついていない。
,,□,百貨店（売場担当）,"・セールス期になるとミセス物が強いので、このあたりが伸びてくれば全体の数字も上がってくるが、伸びなければ若干苦戦する。
・例年よりサンダルの動きがさほど良くないので、非常に読みにくい流れとなっている。"
,,□,スーパー（店長）,"・たばこの増税や将来的な年金の心配からいったん冷え込んでいる需要も、ボーナス支給により若干上向く。
・その一方で、同業者の出店や競争の激化という厳しい状況が続く。"
,,□,スーパー（店長）,・来客数は例年以上だが、買上点数、客単価等は低迷しており、すぐには良くならない。
,,□,コンビニ（エリア担当）,・たばこの値上がり前の一時的な売上増加はあるが、その他の品物に関しては相変わらず売上が伸びず、３か月先もあまり良い状況にはならない。
,,□,衣料品専門店（店長）,・６月のバーゲン時期に入り、低価格層の客と、得意客を中心とした単価的に良い物を購入する客との差が両極端になっており、この状況はあまり変わらない。
,,□,家電量販店（店長）,・初夏にもかかわらずエアコンの売行きが鈍く、この調子でいくと値崩れ現象が早く起きてきて、ますます売上高の維持が難しくなる。
,,□,家電量販店（副店長）,・寝苦しい夜が続くようであれば、エアコン商戦に期待が持てるが、現状の天候が続けば期待薄であり、これといった上昇要因が見込めない状況である。
,,□,家電量販店（予算担当）,・エアコン等の季節商材の売行きにもよるが、現状の厳しい状況は変わらない。
,,□,乗用車販売店（総務担当）,・客が重視するのは単価のみである。修理も安いときか壊れたときしか依頼がなく、フェアをしても新しく出せる物がない。
,,□,自動車備品販売店（経営者）,"・最近になって、ナビゲーションやＥＴＣ等、一部商品の販売が活発になりつつある。
・ただ例年であれば７月から８月はボーナス商戦で活況が期待できるが、業績の回復している企業は結構あるものの、個人の景気に対する警戒感は根強く、消費マインドは簡単には上昇しない。"
,,□,その他専門店［贈答品］（店員）,"・秋のブライダルシーズンに入るが、特別に売上が伸びるという様子もなく、１人当たりの引出物の単価も低下する傾向にある。
・目的買いはあっても、一般的なギフトとして購入する客が相変わらず少ない。"
,,□,高級レストラン（スタッフ）,・引き続き予約が鈍い状況であるので、今後どうなるか見通しがつかない。
,,□,一般レストラン（店長）,・客の予約があまり多くない。
,,□,観光型ホテル（スタッフ）,・夏休みシーズンで、個人客がかなり確保できる。
,,□,旅行代理店（経営者）,・ＳＡＲＳが発生してから約３割程度受注が落ち込んでいるが、この影響がどのくらいで静まるか分からない。
,,□,タクシー運転手,・利用者、利用回数とも減少し、１回当たりの単価も低下しており、この傾向は短期間では変わらない。
,,□,通信会社（広報担当）,・新商品を投入するものの、さみだれ投入のため大きな起爆剤にはならない。
,,□,レジャー施設（営業企画担当）,"・割引低価格から定価高付加価値路線へ変更した日帰り温泉入館料が定着するには、まだまだ時間がかかりそうである。
・いったん下げた価格を戻す影響は大きく、今は付加価値サービスを充足させながら、我慢の営業を続けている。
・飲食部門、ホテル部門は予定通りの推移を示しているものの、日帰り温泉部門を見ると、とても楽観視できない。"
,,□,設計事務所（職員）,・土地区画整理事業が急ピッチで推進されつつあり、個人住宅、アパート、マンションの建築が続くので、今後とも景気は変わらない。
,,□,住宅販売会社（販売担当）,・展示場、イベント、分譲売出し等への来場者数が減少している。
,,▲,百貨店（統括）,・単価は上昇してきているが、来客数、販売量がそれぞれ低下しているので、この先単価がいつまでも維持できない。
,,▲,スーパー（店長）,・夏のボーナスも例年並みには期待できそうにないので、お中元を控え供給高で非常に苦戦する。
,,▲,スーパー（店員）,"・物が売れておらず、まわりの競合店などのチラシでも値段がどんどん厳しくなる。
・客は上手に買い分けをして、安く良い物を必要なだけしか買わない。"
,,▲,乗用車販売店（統括）,・新型車効果が薄れてくるので、今のような単価を維持できない。
,,▲,乗用車販売店（営業担当）,・客の購入に対する慎重さは変わらないうえに、盆休み等で稼働日数が少なくなり、販売総額が低下する。
,,▲,その他専門店［書籍］（店員）,・売場によっては例年を大きく上回る分野、大きく下回る分野半々であるが、トータルすると例年よりも若干売上が低下しており、この状況がしばらく続く。
,,▲,一般レストラン（営業担当）,・生ビールの安売り等、例年通りのサービス活動を行っているが、販売数や来客数も伸びておらず、良くなる材料がない。
,,▲,その他飲食［ハンバーガー］（エリア担当）,・若者の外食が多様化してきており、来店頻度が減少してきている。
,,▲,都市型ホテル（従業員）,・季節営業のビヤガーデンの前売りの販売量が伸びていない。
,,▲,タクシー運転手,"・今後もタクシー業界はまだまだ増車の傾向がある。
・給料が下がることを覚悟した客の会話が聞こえたり、以前には聞かれなかった飲み屋を閉鎖するといった話題が聞かれ、自分にとっても不安が募っている。"
,,▲,通信会社（経営者）,・新規加入実績が従来平均値を大きく下回っており、客の反応も厳しいままである。
,,▲,通信会社（通信事業担当）,・新サービスの追加後も反応は鈍く、思っていたほど伸びないが、次々と新しいサービスを打ち出さないと前年割れをしてしまいそうになる。
,,×,スーパー（店長）,・大手の競合店の出店が予定されている。
,,×,スーパー（総務担当）,・一向に単価の下落に歯止めがかからない。
,,×,ゴルフ場（従業員）,・ゴルフ客の高年齢化で来場者数が伸びず、客単価も下げないと売上が伸びない状態にある。
"企業
動向
関連

(中国)",,◎,－,－
,,○,輸送用機械器具製造業（経理担当）,・最も受注額の大きい製品がフルモデルチェンジされ、３か月後に本格量産となり、立ち上がりについては生産量の増加に期待が持てる。
,,○,金融業（業界情報担当）,・地場の自動車メーカーでは、コスト面で厳しいため、収益は低い伸びになるとみられるが、新型車の生産開始により操業は一段と高まると期待できる。為替も安定しており輸出も底固い。
,,□,化学工業（総務担当）,"・製品価格に上方修正の動きがあるが、見通しは極めて厳しく、固定費を削減するなど原価を下げる努力をしている。
・今後若干持ち直すという予想もある一方で、収益構造が悪く、見通しは依然として厳しい。"
,,□,化学工業（総務担当）,・ＳＡＲＳ問題が一段落したが、中国市場における製品需要が、いつ、どの程度回復するか分からない。
,,□,一般機械器具製造業（経営企画担当）,・展示会での客の反応や購入意欲からは回復基調が感じられるが、海外事業において依然厳しい状況であることから変わらない。
,,□,電気機械器具製造業（総務担当）,・試作案件が安定的に入っている。
,,□,通信業（社員）,・新規営業メニューの受注に向けて提案営業を展開しているが、ライバル社も多く、受注量がすぐに好転することはないので、地道に営業していくしかない。
,,□,通信業（営業担当）,・変化が激しい情報通信業界においては数年先を見通せる安定商品などなく、思い切った施策を打たずに顧客の反応をみながら小出しに試行錯誤を続けていくしかない。
,,□,会計事務所（職員）,"・今年４月より社会保険料の報酬の賦課方法が改定されたことにより、今後法定福利費の増加が予想され、経営状況は厳しいものになる。
・また銀行も業績の悪いところには金利の引上げを迫り、業績の良いところには引き下げを提示してきており、今後勝ち組と負け組との差はますます開く。"
,,▲,食料品製造業（総務担当）,・この景気の悪さから、今まであった取引がなくなる一方で、新たな取引先と契約しても、設備投資をしなければならず、固定費が増大する。
,,▲,食料品製造業（総務担当）,・市場は相変わらず動きが鈍い状態であることに加え、夏場を迎えて練り製品の動きがますます悪くなるため、今後は安売り等で売上を稼いでいかざるを得ない。
,,▲,窯業・土石製品製造業（総務経理担当）,"・第１四半期好調の反動があり、生産量は減少の見込みである。
・ただ一部の製品については需要好調で、当初８月予定の設備補修を年末に計画変更している。"
,,▲,鉄鋼業（総務担当）,"・エレクトロニクス関連材料に関して、東アジアに蔓延していたＳＡＲＳの影響を心配したが、予想外に早く終息に向かっており、受注も心配をしたほどの冷え込みはない。
・一方で、堅調だった自動車関連材料の動きにやや陰りが出始めており、先行きに不安を残すような受注傾向になっている。"
,,▲,鉄鋼業（広報担当）,"・タイ向けの薄板熱延材がアンチダンピングのクロ裁定を受け、加えてアジア全体の市況先安感が深刻化しているため、今後輸出は大幅減となる見通しである。
・国内においても薄板を中心に低迷が継続しており、厚板を中心とする鋼材や半成品でどこまでカバーできるかがポイントになる。"
,,▲,建設業（経営企画担当）,・今後大型物件を受注する予定が依然として少ないので、先行きが非常に不安である。
,,▲,金融業（営業担当）,"・土木建設業界では仁義なき戦いが続いており、受注価格は予定額の70％を切っている。
・仕事がないため業界の慣行に従わず、赤字覚悟の受注合戦が続き、体力の消耗が一段と激しくなっている。"
,,×,＊,＊
"雇用
関連

(中国)",,◎,－,－
,,○,人材派遣会社（経営者）,"・人材派遣需要は堅調さが続いていることに加えて、正社員の紹介も需要が増えている。
・優秀な社員を求める企業の意欲は今後旺盛になっていく。"
,,○,求人情報誌製作会社（統括）,"・ある程度好調な企業では、人を増やしていこうと考えている。
・業界での淘汰が一段落してきており、良いところはより良くなっていくので、全体としては少し景気が良くなる。"
,,○,学校［大学］（就職担当）,・年間を通しての求人数に増加の期待が持てる。
,,○,学校［大学］（就職担当）,・各企業の採用担当者に、若干でも多く採用したいとの意向がある。
,,□,職業安定所（職員）,・公共工事が大幅に縮小していることから、建設業での人員整理の動きが止まらず、新規求職は引き続き増加傾向で推移する。
,,□,職業安定所（職員）,・新規求人は増加しているが、新規求職者数も増加しているため、求人倍率は横ばいになる。
,,□,職業安定所（職員）,"・雇用調整助成金にかかる休業等の計画届は４か月連続で提出がない上、企業整理による解雇者数も減少傾向にある。
・求人の内容をみると、派遣業及び請負業からの募集が増加傾向にあり、求人を雇用形態別にみると、パート求人の占める割合が増加傾向にある。"
,,□,職業安定所（雇用開発担当）,・製造業関連の求人はやや増加しているが、ほんのわずかであり、あまり期待できない。
,,▲,－,－
,,×,人材派遣会社（支店長）,"・取引先の傾向では、減員はあっても増員依頼は減ってきている。
・優秀なスキルや経験が企業の戦略に合致すれば採用にはなるが、その分減員もあり、ゼロサム状態である。
・収益確保によるリストラも済み、次なる段階である残った人材の更なる入替えが多くなる。"
,,,,
　９．四国（地域別調査機関：四国経済連合会）,,,,
,,,,（－：回答が存在しない、＊：主だった回答等が存在しない）
分野,,景気の先行き判断,業種・職種,景気の先行きに対する判断理由
"家計
動向
関連

(四国)",,◎,－,－
,,○,衣料品専門店（経営者）,・家族連れ客の消費が底堅いことに加え、前年低調であった若者向け商品に動きが見られる。また、ＳＡＲＳの影響も終息してきており、明るさが感じられる。
,,○,家電量販店（営業担当）,・雨の日が多い影響で、冷蔵庫やエアコンは思うほど売れていないが、来客数は少し増加しており、客の購買意欲が多少出てきた感じがする。しかし、ボーナス商戦はあまり期待できず、大きく変化することはない。
,,□,百貨店（総務担当）,・株価が上がってきて、少し落ち着きを取り戻したように思うが、ボーナスのカットなどにより、基本的な消費者の姿勢は変わっておらず、景気が良くなる兆しは見えない。
,,□,百貨店（営業担当）,・商品、部門で業績にばらつきが目立つ。店頭販売は比較的好調であるが、法人販売及びギフト商品は低調であり、苦戦している。売上が前年を上回る商品数は増加しているが、不調商品の下落も大きい。
,,□,スーパー（企画担当）,・客は非常に節約志向で、必要な物だけしか買わない動向にあり、良くなるとは考えられない。
,,□,コンビニ（エリア担当）,・食料品、日用品は、特に目立った動きはない。ただ６月は、たばこの増税に伴うまとめ買いがあり、７月にリバウンドが来ると思われるが、長期的に見れば影響はない。
,,□,コンビニ（代表者）,・来客数、単価は減少している。特に、建設・土木関係の20代、30代の男性の来客が減少傾向にある。
,,□,家電量販店（店長）,・ボーナスカット等の影響で、客単価が減少する傾向にある。
,,□,乗用車販売店（従業員）,・販売台数は、８月、９月と新車投入で持ち直す見込みもあるが、市場に明るいニュースが少ないので、客の消費意欲は低下する可能性が高い。
,,□,乗用車販売店（営業担当）,・他社と比較しても商品に関しては自信もあり、ボーナスシーズンということで期待をしている。しかし、現時点ではユーザーの動きに変化が見られず、ボーナスシーズンもあまり期待できそうにない。
,,□,旅行代理店（従業員）,・個人旅行は全く不振であったが、ＳＡＲＳの影響も沈静化し、海外旅行への関心も出てきた。これから、夏休みの旅行シーズンに向け、沖縄や北海道はもちろん、海外旅行も含めて、個人旅行の回復に期待している。
,,□,タクシー運転手,・夏休みを迎え、高知ではよさこい祭りが開催されるが、客の様子から「忙しくなる」、「景気が良くなる」という兆候や言動がうかがえない。
,,□,観光名所（経営者）,・ＳＡＲＳの風評も一段落し、徐々にではあるが回復している。
,,□,住宅販売会社（従業員）,・将来の経済状況に不安を感じている客が多いので、住宅建築を計画する方がそれほどは増加しないと思う。
,,□,その他住宅［不動産］（経営者）,・今年に入って低調に推移しており、今後、買い需要が増加するとは思えない。こうした状況が普通の状態であると考えている。
,,▲,百貨店（営業担当）,・ボーナスシーズンを迎えるが、厚生年金の支払額が大幅に増えたことから、お中元商戦に悪影響が予想される。
,,▲,スーパー（営業担当）,・３か月後には営業時間の延長をしてから１年が経過するので、更に営業時間の延長をするか、新たな施策を講じないと、現在より悪化すると考えている。
,,▲,衣料品専門店（経営者）,・高級品に対する慎重な購入態度、単品買いの傾向などは、ボーナスその他で可処分所得が増えない限り、今後とも続く。
,,▲,一般レストラン（経営者）,・多くの子会社を抱えた県内の大手建設会社の倒産に伴い、連鎖倒産などの心理的要因から、先行きの不安、買い控えが一段と増加し、じわじわと景気を押し下げる。
,,▲,都市型ホテル（経営者）,・先行きの予約状況を見ると非常に悪いというのが実感である。景気の回復感、株価は上昇しているが、実態として全く見えてこない。まだまだ景気は悪くなる局面にあると思う。
,,×,＊,＊
