Ⅱ．景気の先行きに対する判断理由,,,,
,,,,
　景気の先行きに対する判断の理由について、その主だったもの及び特徴的と考えられるものを取りまとめると以下のとおりであった。,,,,
,,,,
,,,,
　１．北海道（地域別調査機関：（株）北海道二十一世紀総合研究所）,,,,
,,,,（－：回答が存在しない、＊：主だった回答等が存在しない）
分野,,景気の先行き判断,業種・職種,景気の先行きに対する判断理由
"家計
動向
関連

(北海道)",,◎,－,－
,,○,家電量販店（地区統括部長）,・オーバーストアによる淘汰が進み、競合店の閉鎖などにより売上が伸長している状況なので、今後についても良くなる。
,,□,商店街（代表者）,・街のイベントや大型店の改装効果により商店街への来訪者がやや増えたが、今一つ売上の伸びにつながらず、景気回復とはいえない。客は何かのイベントや催しには反応するが、それ以外は静かにしている状態である。
,,□,商店街（代表者）,・バーゲンの最初の盛り上がりはあるだろうが、その後、販売価格は一気に下がる可能性があるので、総合すると売上金額がそれほど増えるとは思えない。
,,□,一般小売店［酒］（経営者）,・底堅い動きはあるものの、販売量及び販売数量においても、上昇がなかなか見込めない。
,,□,百貨店（売場主任）,・店内の様子から、今の状況では本当に必要な物以外は買うのを辛抱すると感じられる。
,,□,スーパー（店長）,・来客数は前月をやや上回り、販売点数も若干伸びているが、全体としては、ほぼ横ばいで変わらない。
,,□,コンビニ（エリア担当）,・公共工事の減少がマイナス要因であるが、十勝沖地震の復興工事と降雪の遅れがプラス要因となり、全体としては変化はない。
,,□,衣料品専門店（店長）,・前月に引き続き良くなる要素がなく、ボーナス・年末商戦は消費が低下しそうである。
,,□,家電量販店（経営者）,・十勝沖地震の影響で、更に景気が冷え込んできていると感じる。
,,□,住関連専門店（経営者）,・インターネットでの販売が依然として好調なため、そちらの方はかなり期待が持てそうであるが、全体として良くなる要素が見込めないため変わらない。
,,□,一般レストラン（スタッフ）,・売上の減少に対処して、人員削減・経費の節約など、コスト管理を徹底してきたが限界であり、これ以上のコストの削減は無理である。
,,□,観光型ホテル（経営者）,・入込客数は、衆議院選挙の影響で少し減ったものの、特殊要因を除けば大きな変化はなく推移しているので、今後も同じように推移するのではないかと思われる。
,,□,観光型ホテル（スタッフ）,・札幌圏での需要が３分の２を占める定山渓地区が、道内景気の不振から大きく落ち込んでいる。今後は、インバウンドに期待するが、単価の低下は必至で、全体として売上は引き続き前年割れとなる。
,,□,旅行代理店（従業員）,・やはり海外旅行の需要が個人・法人とも全く伸び悩み、早急なる回復傾向が望めそうにない。頻繁に報道されているテロ情報も客足に影響を与えていると思われ、景気浮上がないまま進行しそうである。
,,□,タクシー運転手,・これから本格的な年末・年始の輸送繁忙期を迎える期待感はあるものの、ここ数か月の乗り控えを見ると、景気の大きな好転は望めない。
,,▲,一般小売店［土産］（店員）,・自衛隊のイラク派遣に伴って、２月の雪まつりがかなり縮小されると聞く。また、近年、冬場の客が落ち込んでいる状況から冬の商戦は厳しいと思われる。
,,▲,スーパー（店長）,・特に良くなる要素は見当たらないが、競合店の新規出店や地元スーパーの実質的な倒産による営業権譲渡が決定しているので、今後、競争がますます激化すると予想される。
,,▲,スーパー（企画担当）,・お歳暮ギフト商戦もスタートしたが、親しい者へのギフトに絞る傾向があり、付き合いでのギフトの減少傾向がみられ、そうした影響からか、出だしの状況は厳しいものがあり、今後の景気動向についても悲観的にならざるを得ない。
,,▲,衣料品専門店（店員）,・２か月先は春物の発売期だが、必要以上に衣類を買う人が少なくなっており、持っている衣類でつないでいく形が多いと思われる。
,,▲,高級レストラン（スタッフ）,・伸びた来客数も一時的なことで、地域的には全国チェーンの競合他社の開店などがあり、競争激化の感がある。
,,▲,観光型ホテル（経営者）,・選挙後の政局不安、円高、不祥事続発などの社会不安が影を落としている。表面には出ないが、十勝沖地震や熊の出没などの報道がボディーブローのように効いていることが、本州からの客との会話で推測される。自衛隊派遣のことも無縁ではなく、これにボーナスが出ないとなると、良くなる要因がなくなる。
,,▲,旅行代理店（従業員）,・国内旅行は前年並みに回復する傾向にあるが、ＳＡＲＳの再流行懸念やイラクの自爆テロによる海外旅行不安が広がり、旅行の取消や延期が増加してくる心配があることから、全体として景気動向は低下する。
,,×,スーパー（店長）,・今月に入り、来客数はやや回復傾向にあり、前月比で数％の増加となっており、とりわけ食品については、前年比でも上回っている。ただし、単価はやはり前年比を下回っており、売上が前年並みに回復するのは厳しい状況である。
,,×,コンビニ（エリア担当）,・税金が増えそうだということや、医療費など社会負担が増加するなか、先行きに対する不安から消費は減る。
,,×,コンビニ（エリア担当）,・酒の免許が自由化になり、競争が激化する。
,,×,コンビニ（店長）,・来月半ばに、わずか100ｍほどの距離に競合店がもう一店オープンするので、間違いなく売上は減る。
,,×,旅行代理店（従業員）,・１月以降の国内・海外の団体旅行の発生状況が依然として厳しいことが想定される。
,,×,住宅販売会社（従業員）,・総選挙が終わったが、年金制度・景気動向と将来が不透明なので、ますます大きな金額のローンは組まないようになっており、非常に厳しい状況である。
"企業
動向
関連

(北海道)",,◎,金属製品製造業（統括）,・関西、関東など道外の都市圏で、新規の市場開拓が成功しており、受注量が増える。
,,○,食料品製造業（団体役員）,・水産珍味製品といった食料品の消費動向は、高品質・高価格製品でも購入動向は強まっており、年末需要の反動落ち込みはあるものの、前年と比較するとやや良くなっている状況が想定される。
,,○,通信業（営業担当）,・新規問い合わせの数が復調傾向にある。
,,○,その他非製造業［機械卸売］（従業員）,・原子力発電施設の見積・積算が出回り、基礎工事系統を中心に明るさが見えてきた。実際の工事は雪解けからだが、一部の業者は受注を見越して、設備投資の検討を始めている。
,,□,食料品製造業（経営者）,・水産物の最大の需要期である年末ギフトの時期が終わり、例年、荷動きが悪くなる時期であるが、製品価格が安いことから安定した底固い需要が見込め、全体としては変わらない。
,,□,輸送業（営業担当）,・貨物の相対的な動きが、大きく変化する要因は見当たらないものの、輸出では紙パルプ、輸入では飼料原料の増加が期待される。
,,□,金融業（企画担当）,・冬のボーナスは低率にとどまる企業が多く、その後の個人消費はさほど期待できない。
,,□,その他サービス業［建設機械レンタル］（総務担当）,・災害関連工事の継続的な実施があると思うので、今の状況がしばらく続く。
,,▲,建設業（経営者）,・官・民とも新規の受注がほとんど見込めない。手持ち工事は徐々に完了してくるので稼動量も落ち込む。
,,×,広告代理店（従業員）,・民間企業はもちろん、行政関係も、例年付き合いのあった年賀広告を中心に減少している。
"雇用
関連

(北海道)",,◎,－,－
,,○,＊,＊
,,□,人材派遣会社（社員）,・地域要因ではあるものの、建設業従事者の冬季失業も例年のことといえ、影響は小さくないものと思う。また、来年の公共事業予算の削減は道内への影響は大きく、どのようになるのか予断を許さない。
,,□,求人情報誌製作会社（編集者）,・求人数は増加しているが、特定の業種・職種での増加であって、業種全体が伸びてはいない。
,,□,求人情報誌製作会社（編集者）,・求人件数を押し上げる要素が現在のところ見当たらない。むしろ、陸上自衛隊第５師団が旅団化されることによる人員削減が及ぼす地域経済への影響が懸念される。
,,□,職業安定所（職員）,・相変わらず、求人倍率が0.3倍台と低水準で推移している。
,,▲,求人情報誌製作会社（編集者）,・派遣・紹介・業務請負などの間接雇用の求人募集は増えているものの、全体としての求人件数は前年比で減っている。今後、期待できる業種は介護・病院系以外は今のところない。
,,▲,職業安定所（職員）,・新規求人は社会福祉サービス業で増加しているものの、主力の建設業・製造業で減少している。
,,×,－,－
,,,,
　２．東北（地域別調査機関：（財）東北開発研究センター）,,,,
,,,,（－：回答が存在しない、＊：主だった回答等が存在しない）
分野,,景気の先行き判断,業種・職種,景気の先行きに対する判断理由
"家計
動向
関連

(東北)",,◎,－,－
,,○,一般小売店［スポーツ用品］（経営者）,・サッカーワールドカップの予選も始まるので、多少は良くなる。
,,○,衣料品専門店（経営者）,・来客数の動きを見ていると、天候に左右されてはいるものの、客の心理の中に少しは景気が良くなってきて、年金問題が少しずつ改善されており、将来不安が少しは改善されているような雰囲気も出てきている。
,,○,観光型ホテル（スタッフ）,・予約状況が良くなりつつある。
,,□,商店街（代表者）,・年末の市中の動きがほとんど見られない。当地在住の客が少なく、遠方の客が一定量来店する状態である。当地を中心とした景況感が低下しているのが明確に分かる。
,,□,商店街（代表者）,・「変わらない」を選択したのは良くはならないという意味で、今までどおりいまだに悪いことを言いたい。近隣の店でもボーナスを出せる店はほとんど皆無と言ってよい状態。年金問題、イラク派兵問題、身近では競合大型店の開店など小売店にとっては消費の前途は非常に暗い。
,,□,商店街（代表者）,・全体の景気は、全国的には緩やかに上向いていると言われているが、地方経済においては、一部の製造業に限られており、全体的には良くなる気配や要因が見当たらない。個人消費の問題では、年金の不安や雇用の不安が払拭されなければ個人消費は回復しない。
,,□,一般小売店［茶］（経営者）,"・安物買いをしながら、高級ブランド品を通販で購入する人も多く、不況といいながらも高級指向は定着している。
・建築会社などの住宅はかなり厳しいという話であるが、自分の持ち物や衣類などについては多少財布のひもが緩みだしている。"
,,□,一般小売店［書籍］（経営者）,・この正月は元旦も営業し、売上のマイナスを少しでもカバーする予定である。
,,□,百貨店（売場主任）,・これからは、初売りやクリアランスなど来店機会が増え、入店客数も増えると思うが、買物自体はシビアな状態が続く。
,,□,百貨店（企画担当）,"・初売りの状況やヒット商品が生まれていない冬物衣料の状況の中で、クリアランスがどう推移するかを見れば、消費意欲の根底の部分が回復しているかを判断できる。
・販売する側の、景気が悪いという意識を払拭し、積極的な販売活動をすることによっても消費は活発化する。"
,,□,百貨店（広報担当）,・２～３か月先は人の動く時期で個人消費はある程度動くと考えられるが、期末、年度末に向けて企業が消費抑制に動くと考えられ、このバランス次第ではあるが、慎重な消費行動に変わりはない。
,,□,百貨店（売場担当）,・ボーナスが出て、年末に向け支出も増えるが、公的負担が多く、消費を控える傾向も出てきており、クリスマスセールの単価も低く設定している。
,,□,百貨店（販促担当）,・これからのお歳暮商戦は、目減りが予想されるものの、クリスマス商戦や冬のクリアランスセールに期待できる。
,,□,スーパー（経営者）,・一部には、今年末のボーナスが増えるという話題もあるが、基本的に当社の扱う一般食料品はそうした傾向に影響されず、消費動向は今後とも堅調に推移し、あまり景気動向に消費が左右される環境はない。一部に耐久消費財やテレビなどの新規需要は発生しても、一般食料品は現状から大きな振れも無く推移する。
,,□,スーパー（店長）,・当店を取り巻く競合状況は変わらず、低価格政策は依然続くため、景気は横ばいと推測している。
,,□,スーパー（総務担当）,"・先々月に比べ、前月はやや上向き加減であったが、今月は横ばいである。セール単価が安かったため１品単価が低下したものの買上点数でカバーしている。この状況は暖冬も含め当分続く。
・一部に倒産する企業も出ており、また若年層の雇用が回復しておらず、年末の買上点数が伸びないかもしれないという懸念がある。"
,,□,コンビニ（エリア担当）,・年末に向けて期待はしているが、天候の状況や年金、政局問題などの不安要因で財布のひもは依然として固いと予想している。こういった中にあっても活路を見出さなければならないが、明るい兆しが見えないため、変わらない。
,,□,乗用車販売店（経営者）,"・消費税駆け込み需要から７年、台替期待のユーザーからの買換えは依然慎重で販売は伸びない。
・競合も激しく、値引きに頼る傾向であるが、今後、最大需要期を迎えるに当たり、低金利クレジットのＰＲ効果も出始めており、横ばい程度の売上は期待している。"
,,□,その他専門店［酒］（経営者）,"・少し調子が良くなってきており、今後何か大きなことで崩れないことを期待している。
・当社が好調な反面、廃業や倒産する同業他社や、大手のライバルでも倒産するところが出てきており、勝敗が明確になってきている。"
,,□,その他専門店［ガソリンスタンド］（営業担当）,・地域経済が冷え込んでいて回復が遅れている。燃料販売も価格競争が激しく粗利の確保が困難な状況である。
,,□,高級レストラン（支配人）,"・宿泊の予約は、前年同日比でほぼ同件数であり、宿泊は前年並みである。
・宴会は、直近２～３か月後の婚礼件数がほぼ前年並みを確保できている。
・レストランは、プレステージレストランの予約状況が前年並みを確保している。"
,,□,観光型旅館（経営者）,・地震と冷夏の影響を心配したものの、小規模クラスの旅館では宴会などもやや平年並みに持ち直している。しかし大規模旅館では苦戦しているようである。今後どうなるかは分からないが、当面は上下変動は無い。
,,□,都市型ホテル（経営者）,"・レストランの夜の顧客数が減少しており、個人消費の回復の兆しが見えない。イベントを企画しないと売上が減少するのみである。
・近々、新規参入や同業他社に対抗すべく館外を一部改装する。今後急激な景気回復が望めないとすれば、生き残るため企業自身が前向きに、設備投資や適正人員の見直し、質の向上などの努力が必要となる。"
,,□,都市型ホテル（スタッフ）,・消費が低迷しているので、生産する側も生産能力を縮小せざるを得ず、生産に携わる人員の削減であり、当然少数精鋭が要求される。施設、料理、サービスが一体となって対応すべきであるが、少数精鋭部隊になってもサービスが低下しないような工夫が必要となる。
,,□,遊園地（経営者）,・ボーナスの水準や冬季の天候などで変動すると思うが、基調は変わらず、前年をキープできればまずまずである。
,,□,住宅販売会社（従業員）,・前月までとの比較において、どの項目においても変動の兆しが感じられない。
,,▲,スーパー（店長）,"・農家の収入減、公務員のボーナス削減など、ますます消費への影響が懸念される。
・野菜の相場安、競合店対策のチラシ増加による１品単価の下落など、売上にマイナスの要因ばかりで、年間最大売上月である12月の売上確保は厳しいと見ている。"
,,▲,スーパー（店長）,・開店、改装が続き、市内はオーバーストアの状態である。単価低下もあり、これは今後も続く。
,,▲,スーパー（企画担当）,・12月以降も、価格競争は一層激しくなることが予測され、合わせて営業時間拡大、元旦営業も含む休日削減は続くが、客数の維持はできても売上面では難しい。
,,▲,その他飲食［そば］（経営者）,・近くの居酒屋が改装中の張り紙を出したまま閉店してしまい、通りの活気がなくなっている。貸しビルの空室も埋まる様子がなく、オフィス人口が減少している。
,,▲,観光型ホテル（経営者）,・年内は忘年会というイベントで多少望めるが、新年に入ってからの入込については、例年の還暦などの人生の節目の行事などばかりで企業の新年会などは望めない。また地震の後遺症と農家の不況で、県内の宿泊業界はどこも厳しい。
,,▲,観光型旅館（経営者）,・予約状況は１月はまあまあだが２月は良くない。企画募集等の最終人数が読み難く、仮予約が前年より少ないのが気になる。
,,▲,都市型ホテル（経営者）,・２～３か月後は新年会、送別会の時期。新年会については、ほぼ例年並みだが、送別会については、全体として規模を縮小して行う傾向があるので、やや悪くなる。
,,▲,都市型ホテル（スタッフ）,・宿泊部門は、インターネットに低料金を提供すれば稼動率が上がるが、それは適正とはいえない。しかしそれは今後も続く。
,,▲,住宅販売会社（経営者）,・展示場来場者数はそこそこであるが、来年度以降は住宅ローン減税が延長されないため、ここのところの住宅ローン減税の影響が感じられる。
,,×,スーパー（経営者）,・客数は増加傾向であるが、販売個数と販売単価が依然として下落傾向にあり、この傾向は当分このままで、来年４月になれば若干改善すると見ている。
,,×,タクシー運転手,・現在の状況はみんなが金が無くて困っている。金銭苦で自殺未遂をした同僚が寝たきりになっている。金を稼がなくてはならないが、客がいない状態で試行錯誤している。これから年末を迎えるにも大変である。
"企業
動向
関連

(東北)",,◎,＊,＊
,,○,電気機械器具製造業（経営者）,・今年の12月ごろから医療機関連が増加傾向にあり、一時的かも知れないが年度末まで内示が出ている。しかし情報端末については変化が見られない。取引先では加工部品の受注が活発になっている。
,,○,経営コンサルタント,・製造業では、仕事量の増加に応じた利益を出す仕組みを考えているが、近い将来その効果が出ることを期待している。
,,□,輸送業（従業員）,・ＩＴ関連企業やヒット商品を扱う企業の輸出入数量が見込まれるが低価格競争が激しく利益増につながらない。
,,□,新聞販売店［広告］（店主）,"・業種によって良くなっているものもあるが、漁業中心の当地では、秋のサンマの漁価安が響いており、収入減となり財布のひもをしめている人が多い。
・当地方最大手のスーパーが、業界紙の購読を本社の指示でストップしている。"
,,□,司法書士,・新幹線八戸開業で、観光地は客足が伸びているが、求人動向に反映されるに至ってない。
,,▲,繊維工業（総務担当）,・海外品流入が依然続いており、スーパーの衣料に押され、デパートや専門店の売上不振が続いている。国内消費の高品質、中価格帯を狙うすみ分けがますます難しくなっている。
,,▲,木材木製品製造業（経営者）,・住宅減税に伴う部材などの駆け込み需要もあり、販売量も一定量を確保できたが、来年以降は需要がやや減少する見通しである。
,,▲,一般機械器具製造業（経理担当）,・当社は、輸出が売上の30％近くを占めており、今の為替レートがこの水準で推移するとなると、採算レートが悪くなり、引いては経営全般に大きな影響を与えることになる。
,,×,農林水産業（従業者）,・今年の夏の天候不順で、桃の収入が前年比40％程度である。この周辺の農家は桃の収入が全体の６～７割を占めているため、今後大きく影響が出てくる。
,,×,食料品製造業（経営者）,"・大手企業がリストラ効果で業績が好転した反面、そのしわ寄せで中小企業の経営が相当厳しくなっている。
・米の不作により農家経営が厳しくなったことにより県内の個人消費が冷え込んでおり、特に飲食業は相当な打撃を受けている。"
,,×,食料品製造業（総務担当）,"・11月がこのような状態で、２～３か月後が良くなるとは思えない。
・生産面では、酒造用米の品不足、価格高騰が原価に影響を及ぼす。"
"雇用
関連

(東北)",,◎,＊,＊
,,○,人材派遣会社（社員）,・製造への直接的な派遣は法律で制限されているが、設計や仕様書作成、又は内勤的な事務作業などの増員や引き合いは、今年度中は続く。
,,○,人材派遣会社（社員）,・工場内への派遣が、労働者派遣法の改正により可能となるため、業界として追い風となる。
,,□,求人情報誌製作会社（編集者）,・求人については、ここしばらく下げ止まっている感があり、この傾向は今後も続く。
,,□,職業安定所（職員）,・パート就職が増加しているが、常用希望者がやむを得ずパート求人に応募し採用となっているケースが増えている。
