Ⅱ．景気の先行きに対する判断理由,,,,
,,□,新聞販売店［広告］（店主）,"・購読をストップする会社がある一方、会社の新築移転も数件あり、プラスもあればマイナスもある。
・当店のチラシ折込も、３か月ほど安定しており、各社が商売活動を頑張っており、当面変わらずに推移する。"
,,□,その他非製造業［飲食料品卸売業］（経営者）,・依然として生活者の購買意欲は旺盛ではなく、生鮮ものは鮮度が良い国内産を選択するが、価格が天候に左右され、消費者の防衛型の購買である。
,,▲,繊維工業（総務担当）,・得意先アパレルの３月決算が軒並み芳しくなく、消費が徐々に回復したとしても、繊維業界は早期低迷、後期回復の業界であるため、今後相当の試練が待ち受けている。
,,▲,一般機械器具製造業（経理担当）,"・自動車の国内販売に陰りが出てきており、自動車部品の売上が減少する懸念がある。
・為替が不透明な動きをしており、現在の水準より円高に動けば輸出環境は更に悪化する。
・アジア、特に中国におけるＳＡＲＳ問題がやや終息しつつあるとはいえ、秋口から冬場にかけて再発する恐れもあり、中国での生産活動に大きな支障を来たし、現地法人の業績はもちろん、日本からの輸出にも大きな影響が出る。"
,,▲,建設業（経営者）,・全体工事量の減少に伴い、元請、下請などの各レベルでの価格競争が激しく、経費を確保するのが困難で、直接工事費も削らないと受注が困難である。
,,▲,その他企業［企画業］（経営者）,・取引している多くの住宅会社の受注価格を見ていると、値引き対応ではなく、ユーザーがデフレを理由として安くすることを強要しており、デフレの悪循環が蔓延している。
,,×,公認会計士,・新年度に入っても業績に好転の兆しがない。特に旅行代理店では海外旅行が全く不振で、電子部品製造業では需給が先細りで、人員の余剰が続いている。
,,×,コピーサービス業（経営者）,・価格競争はますます激しくなってきており、１～２年前の常識では戦えない状況になっている。客に購買意欲はあるが、利益が取れない現状である。
"雇用
関連

(東北)",,◎,－,－
,,○,人材派遣会社（経営者）,・ＣＡＤ設計関係の技術者の引き合いが多いため、工作機械や、デジタルカメラ、精密機械、通信、自動車関係の業種が盛り返してきている。
,,○,人材派遣会社（社員）,"・コールセンターの引き合いが出ている。
・県南地区において100人規模の、情報処理系の業務の引き合いがある。"
,,○,人材派遣会社（社員）,・特に営業職への潜在的ニーズは、各企業で採用意欲が強く、人を確保できれば、まだまだ伸びる市場である。
,,○,新聞社［求人広告］（担当者）,・大型流通の新規進出の動きもあり、求人の低迷状態は長くはないと見ており、少しは良くなる。
,,□,求人情報誌製作会社（編集者）,・夏場を迎えての時期的なものや、郊外型ショッピングセンターのオープンに伴う雇用ニーズで、景気的には上向きの様相もあるが、全般的には変わらずに推移する。
,,□,新聞社［求人広告］（担当者）,・タクシー乗務員や、パチンコ店従業員の求人が多く、パート・アルバイトが全体の９割を占めている。求人動向に好材料が無い。
,,□,職業安定所（職員）,・求人数は、前年比で増加を続けているものの、臨時、パート、請負、派遣の割合が高い。
,,▲,＊,＊
,,×,アウトソーシング企業（社員）,・今後、いろいろな意味で人余りの時代が来る。この人余りは新しい産業を生み出さない限りは景気は悪い。当業界は、人が全てであり、人余りということになれば、そこに過当競争がやってくる。
,,,,
　３．北関東（地域別調査機関：（財）日本経済研究所）,,,,
,,,,（－：回答が存在しない、＊：主だった回答等が存在しない）
分野,,景気の先行き判断,業種・職種,景気の先行きに対する判断理由
"家計
動向
関連

(北関東)",,◎,＊,＊
,,○,百貨店（営業担当）,・客は、気に入った物があれば、値段にかかわらずに買うという様子である。ニーズに合う良い品を揃えれば、消費意欲はある。
,,○,コンビニ（経営者）,・音楽祭や祭り、花火大会などイベントが続くため、良くなる。
,,○,その他専門店［携帯電話］（従業員）,・ボーナス商戦で需要の増加が見込める。新商品のラインアップが出揃い、チラシも投入するので、やや良くなる。
,,○,遊園地（職員）,・新規アトラクションの導入により、集客が期待できる。
,,○,美容室（経営者）,・今まで設備投資の実施を待っていた店主が、ここにきて動き出しているので、２～３か月先はやや良くなる。
,,○,住宅販売会社（経営者）,・ローン控除の条件が年内入居であることから、駆け込み需要を期待している。延長という報道が出ているので、思ったほどではないにせよ、受注の山がきて、やや良くなる。
,,□,商店街（代表者）,・地域でも９時閉店を11時にする大手スーパーがあり、大型店を中心として時間延長の動きがあることから、全体的に客、消費とも地元に戻ってきている。近隣にショッピングモールの出店が予定され、年末にかけては厳しくなる。
,,□,一般小売店［贈答品］（経営者）,・周囲に新たなスーパーが次々と建つので、競争が激しくなっている。
,,□,百貨店（売場主任）,・百貨店のメインイベントであるお中元時期を迎え、多くの来店が見込まれる。クリアランスセールも実施しており、シャワー効果を期待している。
,,□,スーパー（統括）,・ベアゼロ、ボーナスの低下など、消費マインドに与える負の要素が多く、消費者の財布のひもは固くなる一方である。デフレ基調が続いており、商品の仕入れ価格、店頭価格とも低下傾向にある。一方で、低価格傾向ながら堅実に伸びている生活基礎商材や、需要が大幅に増加している健康志向商品などもあることから、全体では変わらない。
,,□,コンビニ（店長）,・景気が悪いといっても、何も買えない人や餓死する人がいるわけではない。品物があふれており、価格が安ければ買うとか、変化があれば動くという状況は変わっていない。
,,□,衣料品専門店（店長）,・秋物立ち上がりの時期であるが、客の財布のひもは先行き不安感から固く、売上は厳しい。
,,□,衣料品専門店（販売担当）,・客の購買意欲、来客数など全体的に元気がなく、ボーナスが出る時期ということを考えても変わらない。
,,□,家電量販店（店長）,・可処分所得が減少しており、明るい展望がないので、お金があっても使わない。所得、ボーナスの増加など、未来に明るい展望が開けてこないことには、この厳しい状態は変わらない。
,,□,乗用車販売店（営業担当）,・軽自動車を中心とした低価格車の相談は出てきているが、高級車の商談はない。
,,□,高級レストラン（店長）,・空き店舗であったところが数か所埋まり、多少活気は戻ったが、景気の先行き不透明感から、売上に結びつかない状況は変わらない。
,,□,スナック（経営者）,・通行人が出てきて、先の予約がいくらか入っているので、それほど悪くはならない。宴会等の客単価も割合良く、明るい兆しも感じられる。
,,□,都市型ホテル（スタッフ）,・客室稼働率が50％台にまで落ち、３年前から２～３割は減少している。今後の予約状況についても信じられない数字で、いくら営業活動をしても結果が出てこない。
,,□,旅行代理店（経営者）,・例年であれば夏休みの受注が入ってくる時期であるが、客はＳＡＲＳ、イラク戦争の後遺症で海外旅行を控えている。秋の受注でも、いまだに海外の話はなく、国内にシフトしている。
,,□,旅行代理店（従業員）,・夏休みの家族旅行の予約が伸び悩んでいる。
,,□,タクシー運転手,・ビジネスや娯楽などの利用客が激減している。家計に組み込まれる買物や病院通いなどの利用では、節約対象となるので、厳しい。
,,□,通信会社（社員）,・新機種への取替え需要はそれなりに多いが、純増数の伸びは頭打ちとなっている。第三世代携帯電話への移行も微増にとどまり、一時期の活気はみられない。
,,□,観光名所（職員）,・旅館、ホテル、レストランの実績は依然として例年を下回るが、特色のある一部のレストランは実績を上げそうだ。
,,□,ゴルフ場（支配人）,・高原コースのため、夏のプレイ代の値下げは他コースに比べて少ないが、客が軽食しかせず、自宅からの自家製ドリンクを持ち込むので、客単価は伸びない。平日の大型コンペや、夏休みのジュニアの来場に期待している。県外来場者は減少傾向である。
,,□,競輪場（職員）,・ボーナスから保険料などで約10万円徴収される。残りの金額では消費に回ってこない。
,,□,その他サービス［自動車整備業］（事務長）,・車検の整備を全て任せる客や、確実に整備して欲しい個所を持ち込む客がほとんどいなくなっている。従来の料金に近づくには、相当の努力が必要である。
,,□,設計事務所（所長）,・今後２～３か月先は打合せ等の外回りが中心なので、このまま仕事が安定してくれれば、良い状態が続く。
,,□,設計事務所（所長）,・３か月後の受注量の見込みは立っていないが、現在の延長線上での仕事があるので、変わらない。
,,▲,商店街（代表者）,・不景気が人の楽しみまで持っていってしまうような状況で、パチンコ店、飲食店が閉鎖し、商店街から店が一つずつ消えている。
,,▲,商店街（代表者）,・土、日は商店街への来客数が少ない。客の足は郊外のショッピングセンターに向かっている状況なので、厳しい。
,,▲,百貨店（販売促進担当）,・夏休み中もボーナスカットなど明るい材料がなく、１品単価もダウンし、より景気は悪くなる。
,,▲,百貨店（販売促進担当）,・諸物価の引上げや、電力供給の不安があるので、やや悪くなる。
,,▲,スーパー（経営企画担当）,・当店が先行して行っている夜間営業に追随する競合店が、増加してきている。
,,▲,コンビニ（店長）,・７月のたばこ増税による駆け込み需要で、６月末の来客数、販売量がやや増加しており、その反動からやや悪くなる。
,,▲,一般レストラン（業務担当）,・７、８月の納涼会の予約が前年を下回っている。
,,▲,都市型ホテル（スタッフ）,・客は金を持っていても、支払にはシビアであることから、これ以上良くなるということはない。いろいろ対策をしても、現状維持が精一杯という状況であり、厳しい。
,,▲,美容室（経営者）,・客の金回りが悪く、回転数も減少している。今後の良い材料がない。
,,▲,住宅販売会社（経営者）,・地価の下落が続くと全体的な景気感が悪化し、消費が鈍り、お金を使わなくなる。
,,×,一般小売店［衣料］（経営者）,・明治15年創業の歴史ある取引先の問屋が民事再生法の手続を開始したと連絡を受けた。不安感で一杯である。
,,×,コンビニ（店長）,・スーパーが営業時間を延長し、夜12時までとか24時間営業するようになっている。店の売上、来客数が減少しており、更に影響を受け、悪くなる。
,,×,観光型ホテル（スタッフ）,・例年と比べて、夏休みの宿泊の問い合わせが少ない。
"企業
動向
関連

(北関東)",,◎,輸送用機械器具製造業（総務担当）,・５月以降、フル生産が続いている。通常の勤務に加え、夜間、深夜の勤務形態も導入しており、３か月後にも好況感が持てる。
,,○,化学工業（総務担当）,・国内はだめだが、韓国の大手電機メーカーの好調により、商社経由でそれなりの受注が見込まれる。また、台湾の半導体も好調であり、かなりの受注が期待できるので、忙しくなる。
,,○,電気機械器具製造業（経営者）,・８～９月の見積がいくつか出てきている。周りをみても、７月ごろから徐々に立ち上がり、８～９月から生産が上がるようである。
,,○,精密機械器具製造業（経営者）,・ＳＡＲＳ問題も一段落し、いくらか動きが出てきている。
,,□,食料品製造業（営業統括）,・酒税増税後の販売量減少の傾向は、しばらく続く。
,,□,一般機械器具製造業（経営者）,・自動車関連部品、建設機械関連部品ともに高水準で横ばい状況となる。
,,□,輸送用機械器具製造業（経営者）,・取引先や他社の仕事依頼、見積等が増加してきている。良し悪しを繰り返している不安定な状況は、今後も変わらない。
,,□,建設業（経営者）,・受注は増加せず、競争が激化する。
,,□,その他サービス業［情報サービス］（経営者）,・引き合い、受注量とも大きな変動はみられない。
,,▲,その他製造業［宝石・貴金属］（経営者）,・夏に向けて、シンプルラインのジュエリーの販売に期待してするしかない。
,,▲,金融業（融資担当）,・保険料の天引きにより、ボーナスの手取額が１割程度減少する。客のレジャー等への消費意欲をそぐことになるので、景気はやや悪くなる。
,,▲,金融業（経営企画担当）,・土木、建設、建築関係は、受注減により、資金繰り等で引き続き厳しい状況となる。
,,▲,新聞販売店［広告］（総務担当）,・夏物半額バーゲン中の大手衣料品スーパーは、売上が増加しているが、来客数は減少している。食料品スーパーでは、営業時間の延長等により、来客数は増加したが、客単価が低下し、前年並みの売上とのことである。店長は、前年並みの売上をこの時期に確保できるのは良い方だと言っており、消費者の慎重な姿勢が更に増してきているので、厳しい。
,,▲,その他サービス業［放送］（営業担当）,・７～８月の夏祭り等のイベント、スポットコマーシャルの受注価格の値引き要求が厳しい。
,,×,建設業（経営者）,・県の公共事業の値引き合戦が激しく、今後は悪くなる。
,,×,建設業（総務担当）,・情報収集と足で稼ぐ営業を継続していくが、工事受注金額が厳しいので、悪くなる。
,,×,経営コンサルタント,・現在の状況では、民間主導で企業経営を立て直すことは相当困難である。
"雇用
関連

(北関東)",,◎,－,－
,,○,人材派遣会社（経営者）,・３か月前と比べて仕事量が増加しているので、今後も良くなる。
,,□,人材派遣会社（経営者）,・ＩＴ業界が新製品の開発のために人手を必要としており、また自動車業界の好調が、下請部品メーカーの生産活動をやや活発にしていることから、派遣業界の売上は増加傾向にある。一方、地方の土木、建築が不振であり、小売関連で個人商店の閉店が目立つことから、総じて変わらない。
,,□,求人情報誌製作会社（経営者）,・春にオープンしたショッピングモール、アウトレットの動きも一段落しており、秋にオープンするショッピングモールが動き出すまでは、変わらない。
,,□,職業安定所（職員）,・前年同月比での有効求職者数は６か月連続減少、雇用保険の資格決定数は10か月連続で減少している。求人は新規、有効とも８か月連続で増加している。７月に大型百貨店の開店があるが、９月には別の大型百貨店が閉店するので、変わらない。
,,□,職業安定所（職員）,・947事業所に対し、来春３月卒業の高校生を対象とした求人受理、説明会を通知したが、参加するのは58社のみである。雇用、失業情勢の厳しい状況は変わらない。
,,□,民間職業紹介機関（経営者）,・年収を大幅に減らしてでも、とにかく働くようにしなければ、失業率は高まる一方で、活力が出てこない。
,,▲,人材派遣会社（社員）,・周辺企業も厳しいが、自社でも売上の先行きを下方修正している。夏のボーナスは大幅にカットせざるを得ない。取引先も危ない状況が続いているので、確実に支払をしてくれるかが不安である。
,,▲,職業安定所（職員）,・求職者が増加傾向で推移しており、企業整備は規模や業種を問わず今後も予定されているので、やや悪くなる。
,,▲,学校［短期大学］（就職担当）,・ハローワーク主催の平成16年３月卒業予定者対象の合同就職面接会が開催されたが、参加企業が前年並みの110社、求人数が前年の約70％である。情報科学系やメーカーなどでは、専門性の高い技術者の求人は根強いものの、管理部門や販売関係は前年の半分程度となっている。
,,×,－,－
,,,,
　４．南関東（地域別調査機関：（財）日本経済研究所）,,,,
,,,,（－：回答が存在しない、＊：主だった回答等が存在しない）
分野,,景気の先行き判断,業種・職種,景気の先行きに対する判断理由
"家計
動向
関連

(南関東)",,◎,－,－
,,○,百貨店（営業企画担当）,・夏のセール前であるが、定価商品の購入がこれまでになく目立つ。従来は、安くなるまで待ち、気に入った商品がなければ購入しないケースが多かったが、気に入った商品は売り切れになる前に購入する傾向がみられるので、客の消費意欲は高まっている。
,,○,衣料品専門店（店員）,・ＳＡＲＳやイラク問題により、今年は海外旅行が減少し、国内需要が増加する傾向にある。
,,○,家電量販店（営業部長）,・多機能、高付加価値商品が今後も数多く発売されると期待できる。
,,○,都市型ホテル（スタッフ）,・夏休みに海外旅行を中止した客が、国内旅行に切替えることに期待している。
,,○,旅行代理店（従業員）,・ＳＡＲＳの影響も終わり、夏の旅行需要が増加すると見込まれる。
,,○,旅行代理店（従業員）,・ＳＡＲＳの終息により、やや良くなる。
,,□,商店街（代表者）,・今年の梅雨は湿度が高く暑いので、衣料品関係が非常に悪い。また、商店街の一般小売店から、生鮮三品の売行きも伸び悩んでいると聞いている。来月、再来月と真夏に向かう中で、現状のまま推移する。
,,□,一般小売店［鞄・袋物］（従業員）,"・ＳＡＲＳに対する安全宣言が出たが、まだ不安が残る中で、夏休みや秋の行楽等に向けた旅行関連商品は、厳しい状況が続く。
・単価を下げたから売れるという状況ではない。単価は３割から４割低下しているが、来客数が増加していないので、売上は厳しい。社内では単価上昇の対策を講じているが、まだ厳しい状況が続く。"
,,□,百貨店（売場主任）,・６月末から夏のセールを開始しているが、衝動買いが非常に少なく、客は安くても不要な物は買わない。慎重な消費行動は今後も続く。
,,□,百貨店（売場主任）,・ＳＡＲＳ問題等のマイナス要因はなくなるが、様々な店を回ったり、時間をかけて高額品を選ぶなど、客の購買態度は依然慎重であり、厳しい状況はこれからも続く。
,,□,百貨店（企画担当）,"・先行きに対する不安から、消費を切り詰める客の動きが目立つ。今まで比較的堅調だった60代以上の客も、年金制度変更に対する不安などから、今後は消費に慎重になる。
・お中元ギフトも、客１人当たりの購入数の減少や単価の低下が続く。"
,,□,スーパー（店長）,・衣料品関連では、夏物を先行販売しているため、７、８月の商戦は非常に厳しい。住居関連も同様である。秋物商戦を早く展開することで、販売に結び付くかは不明である。食品については、売上がほとんど変わらない。
,,□,スーパー（店長）,・例年、夏に向かって売上が伸びるが、商圏内に大型店が出店する上、競合店が全て長時間営業や24時間営業に切替えているので、競争が一層激化する。
,,□,スーパー（店長）,・客の財布のひもは相変わらず固い。客は必要な商品や値下げ品を買っており、今後も景気が良くなるとは考えにくい。
,,□,スーパー（店長）,・衣料品の売上は前年を上回り、若干明るい兆しはあるが、食料品部門では来客数、売上ともに厳しい。ボーナス支給の状況を考えても、今後伸びる要因はない。現状と同様、前年比96～98％の傾向が続く。
,,□,スーパー（統括）,・売上回復のために様々な対策を講じているが、なかなか売上増には結び付いていない。この状況は当面続く。
,,□,スーパー（運営担当）,・ＳＡＲＳの動向が、依然として心配である。
,,□,コンビニ（店長）,・たばこの値上げに伴い、売上がかなり増加すると期待したが、それほどの動きがみられない。客が手元に十分な金を持っていない状況は今後も変わらない。
,,□,衣料品専門店（経営者）,・夏物の最終仕入れがあったが、メーカーが売れ筋品をほとんど手元に持っていないため、７、８月に販売できる商品が少ない。海外製の安い商品は氾濫しているが、良い商品は非常に少なく、売上増が難しい。衣料関係の大手メーカーが倒産したことも、不安材料である。
,,□,家電量販店（店長）,・パソコンの販売台数が増加することが見込まれる。また、ビジュアル関連では液晶テレビ、プラズマテレビ等の売上が伸びており、デジタルカメラも好調なので、年末まで今の状態が続く。
,,□,家電量販店（店員）,・10月からパソコンのリサイクル制度が始まるので、その前にパソコンの買換え需要が期待できる。ただし、他の商品の需要が伸びるとは考えにくく、依然として厳しい状態が続く。
,,□,乗用車販売店（販売担当）,・排ガス規制で、ガソリン車に乗り換える客が増加しているが、乗換えの時期が近づいても先延ばしする傾向がある。
,,□,その他専門店［眼鏡］（店員）,・６月の買上数量は増加しているが、買上単価に上昇の気配がみられない。特に、10万円以上の高額商品の売上が伸び悩んでいる。
,,□,高級レストラン（支配人）,・６月の来客数は前年比で７％ほど減少している。周辺にある企業の半数が別の場所に移ってしまったので、悪い状態はこのまま続く。
,,□,一般レストラン（経営者）,・価格競争は常態化するが、地下鉄開通の効果で、今まで交通の便の悪かった地域からの客が繰り返し来店するようになっている。
