Ⅱ．景気の先行きに対する判断理由,,,,
,,,,
　景気の先行きに対する判断の理由について、その主だったもの及び特徴的と考えられるものを取りまとめると以下のとおりであった。,,,,
,,,,
,,,,
　１．北海道（地域別調査機関：（株）北海道二十一世紀総合研究所）,,,,
,,,,（－：回答が存在しない、＊：主だった回答等が存在しない）
分野,,景気の先行き判断,業種・職種,景気の先行きに対する判断理由
"家計
動向
関連

(北海道)",,◎,－,－
,,○,商店街（代表者）,・商店街を中心としてハード面での環境整備が整ってくる。駅前の整備に加えて、商店街では販促活動を強化するためのイベント広場が完成するほか、フランチャイズの飲食店や地元居酒屋の開店に伴う効果が期待される。
,,○,家電量販店（経営者）,・これまで客が節約していた分、今後、夏場にかけて売上は幾分上向いていくだろうと予測している。
,,○,家電量販店（店長）,・ＤＶＤレコーダー、デジタルカメラ、次世代携帯電話などのデジタル家電が好調に伸びており、全体としては夏季商戦時には盛り返すと思われる。
,,○,高級レストラン（経営者）,・観光シーズンになることや、最近の選挙の影響で売上が減っていたため、多少は期待ができる。
,,○,その他レジャー施設（職員）,・季節要因に加えて、イベント開催に伴う入場者の増加など、来客数の増加が見込まれる。
,,□,商店街（代表者）,・夏物バーゲンの時期なので客足は出ると思うが、今年は札幌駅の大型複合商業施設の影響も含め、客が分散すると思われ、盛り上がりとしては期待できない。
,,□,スーパー（店長）,・中国等で発生しているＳＡＲＳの影響で、旅行関連業の不振が予測されることに加えて、社会保険料率の引上げなどを考えると、今後の景気好転は望めない気がする。
,,□,スーパー（企画担当）,・北海道内の失業率は依然として高止まりしており、また企業倒産も年明けから続発していることもあり、消費環境及び消費者心理に与える影響はますます悪化する傾向にある。
,,□,衣料品専門店（店長）,・客の立場からみて先行きが不安定であるため、商品を買う気が失われている気がする。
,,□,衣料品専門店（店員）,・２～３か月先には夏のボーナスが出る会社が多いと思うが、期待していない人が多いと思われ、それほど売上は変わらない。
,,□,家電量販店（地区統括部）,・雇用状況の悪化、賃下げと、ただでさえ北海道の消費マインドが冷え込んでいるのに、イラク情勢、ＳＡＲＳ、株価下落と暗いニュースが多く、急激な回復を見込めない。
,,□,乗用車販売店（従業員）,・収入が減っている家庭が多く、先行きを心配しているため、契約の伸びる可能性が少ない。
,,□,一般レストラン（スタッフ）,・特に良くなりそうな情報がなく、社会保険料率の改正、航空運賃の値上げなどの不安材料がある。
,,□,旅行代理店（従業員）,・ＳＡＲＳ問題の今後が全く不透明である。仮に治療法が解明されても、急には海外旅行者の増加につながるか疑問である。
,,□,タクシー運転手,・札幌市長選挙が再選挙となり、公共事業の発注が例年より遅くなり、ますます景気に影響が出てくることが心配である。
,,▲,スーパー（店長）,・商品購入は引き続き買い渋りの状況が続いていく。
,,▲,コンビニ（エリア担当）,・現状での週末の売上の減少に加えて、ＳＡＲＳの影響による観光の低迷等で行楽需要が望めない。
,,▲,コンビニ（エリア担当）,・公共工事が減少していることに加えて、今年度も予算が大幅に削減されたことにより、幹線道路沿いの店舗で売上の減少が続くと思われる。
,,▲,その他専門店［医薬品］（経営者）,・明日が予測できないほど、急激に購買感覚が変化しているようであり、本当に先が読めない日々となっている。
,,▲,高級レストラン（スタッフ）,・ＳＡＲＳの影響による外出の手控えなど、人の多く集まる場所を嫌う傾向が生じて、消費の低下が現れる。
,,▲,高級レストラン（スタッフ）,・現時点の予約件数は前年と比べてかなり減少している。また、たとえ客数が前年並みとなっても単価の上昇を見込める要素が見つからない。
,,▲,タクシー運転手,・ＳＡＲＳ問題で観光客の動きが不透明であり、先行きに不安がある。
,,▲,観光名所（役員）,・航空運賃のアップによる国内旅行の減少に加えて、ＳＡＲＳの影響によりアジアなど海外からの観光入込の大幅な減少が予測される。
,,▲,美容室（経営者）,・客単価が下がってきており、今後もこの傾向は続く気配がある。
,,×,一般小売店［土産］（店員）,・ＳＡＲＳの影響はイラク戦争よりも長引きそうな気配なので、今後も海外旅行者の低迷が続くと思われる。さらには、不景気による国内旅行の需要の低下も考えられ、旅行業界にとっては厳しい状況が続くのではないかと思われる。
,,×,コンビニ（エリア担当）,・企業倒産及びＳＡＲＳに伴うアジアからの観光客のキャンセルにより、景気が悪くなる。
,,×,スナック（経営者）,・良くなる理由が一つもない。ただし、これから夏場にかけて、ＳＡＲＳの影響で海外旅行が減った分、道内・国内旅行者が増えるとは思うが、あまり多くは望めない。
,,×,旅行代理店（従業員）,・ＳＡＲＳの回復が不透明である。
,,×,旅行代理店（従業員）,・当地区では、不景気のため、一前年の米国同時多発テロ以前から海外旅行が低迷しており、現在もなかなか回復していない。それに加えて、イラク戦争以上にＳＡＲＳが大きな要因となり、当支店取扱の海外旅行は、皆無に等しい状況になっている。海外旅行の減少分が国内旅行にシフトしているわけでもなく、未曾有の危機と考えている。
,,×,旅行代理店（従業員）,・イラク情勢、ＳＡＲＳ、統一地方選挙、飛び石連休と悪材料が重なり、第１四半期は非常に悪かったが、とくに海外旅行の回復は、当面望めないと思われる。
"企業
動向
関連

(北海道)",,◎,－,－
,,○,建設業（経営者）,・工事の引き合いや受注が、官・民及び土木・建築とも増加してくると期待している。ただし、競争が激しく、単価が下がっており、利益面では相変わらず厳しい。
,,○,通信業（営業担当）,・顧客の動向として、凍結されていた設備投資に関して、部分的ではあるが、再開される動きが出てきた。
,,□,食料品製造業（社員）,・アジア中心のＳＡＲＳが旅行の減退を招いている。当地方は、アジア地区からの観光客が多くなってきていた時期だけに、その影響は大きい。しかし、国内旅行の増加、とくに北海道への旅行の増加が発生しうると考えられ、ゴールデンウイーク時期とその後の夏までの時期にどれだけの流入があるかが鍵となる。
,,□,食料品製造業（団体役員）,・国内の中小企業及び当地の食品加工業界では、生産拠点を中国から他の東南アジア諸国へシフトした企業との間で、さらなる安価な商品との競合が起こってきており、当地の水産加工業でも、中国人の雇用を模索する企業が見受けられる。
,,□,輸送業（営業担当）,・大手取引先の新年度予算計画を見てみると、概ね前期並みとなっている。
,,□,金融業（企画担当）,・観光シーズンを迎えるが、ＳＡＲＳの影響で、中国、アジアなどからの観光客が激減することが懸念される。
,,□,司法書士,・統一地方選挙が終了し、行政や企業も本格的に事業活動を進めると思われる。
,,□,その他サービス業［建設機械リース］（支店長）,・信用不安の風評が増えてきた。
,,□,その他非製造業［機械卸売］（従業員）,・今まで償却金額相当の設備投資をしていた取引先で償却ができなかったり、中古品で間に合わせてしまったりする状況であり、新品の機械が売れなくなっている。
,,▲,金属製品製造業（統括）,・住宅の着工棟数が前年より減っているため、今後の受注量についても期待できない。
,,▲,輸送業（支店長）,・荷動きの低下に歯止めがかからない状況であり、これは物流業界はもとより、各業界の経済活動の低下を意味している。
,,▲,その他サービス業［建設機械リース］（支店長）,・どの業界でも淘汰が進んでおらず、価格がダンピングにより低下している。
,,×,その他サービス業［システムハウス］（経営者）,・仕事量の絶対量があまりにも不足しており、リストラを進めても、今後どれほど厳しい状況になるのか予想もつかない。また、体力のない中小企業の存続を危ぶむ話もかなり聞こえてきている。今後は、網の目のような連鎖倒産が危惧される。
"雇用
関連

(北海道)",,◎,－,－
,,○,求人情報誌製作会社（編集者）,・農作系の募集で、収穫時期に合わせた求人が出てくるのと、夏の短期のアルバイト募集が出てくるのを予想して、若干だが良くなるのではないかと考えている。
,,○,職業安定所（職員）,・今夏に商業施設の進出が２件予定されており、雇用需要が見込まれる。
,,□,求人情報誌製作会社（編集者）,・生産及び加工を含め、農業関連は堅調と考えられるが、建設関連及び自衛隊の再編に伴う人口の減少が心配される。
,,□,求人情報誌製作会社（編集者）,・今のところ、求人件数が大きく変化する要因は見当たらない。ただし、雇用形態の多様化がかなり進んでおり、求人件数と景気との関連性が見えにくくなっている。
,,□,職業安定所（職員）,・景気の先行きに不透明感があり、とりあえずは就職したものの、賃金や職場環境等に満足できず、在職中に再度職業安定所に来所するという傾向がみられる。
,,□,職業安定所（職員）,・有効求人倍率は９か月連続して前年同月を上回っているものの、全道平均より低い水準で推移している。また、パート求人が増加傾向にある。
,,▲,人材派遣会社（社員）,・イラク情勢、ＳＡＲＳの影響で航空関係、旅行関係の派遣先で影響が大きいとみられる。
,,×,＊,＊
,,,,
　２．東北（地域別調査機関：（財）東北開発研究センター）,,,,
,,,,（－：回答が存在しない、＊：主だった回答等が存在しない）
分野,,景気の先行き判断,業種・職種,景気の先行きに対する判断理由
"家計
動向
関連

(東北)",,◎,住宅販売会社（経営者）,"・客の動き、とくに展示場来場者の動きが良く、連休に期待できる。
・今年に入り、住宅金融公庫の金利が数度下げられており、現在2.15％と低いレートである。また公庫も活発に動いているため追い風となっており、好調が当面続く。"
,,○,コンビニ（エリア担当）,・高額ハイウェイカードの特需があったが、まとめ買いをした客が使い切り、少しずつ需要が出てきている。
,,○,衣料品専門店（店長）,・バーゲンに集中する商戦になる。安さで一気に集客を行い、そこに仕掛けていけば上向く。しかし、その前後は厳しいと考えている。
,,○,高級レストラン（経営者）,・景気は良くならないまでも、使うところは使うため、これ以上落ちようがなく、ほんの少しでも回復に向かう。
,,○,一般レストラン（経営者）,・世の中全体の景気が悪いため、レストランウェディングで小じんまりやることが流行しており、当店でも数件の予約を受けている。
,,○,都市型ホテル（スタッフ）,"・４月27日に開催したイベントでは、以前にも増してカップルでの来館が多い。多分イラク戦争が終わり、一時の悲観的な状況から、海外旅行に行けるというプラスの方向に動いている。
・４月は苦しかったものの、販売量の動きとしては、今後、若干ではあるが、明るい見通しが立っている。"
,,□,商店街（代表者）,・中心部商店街は、店舗の構成数には変化がないが、質的に企業形態が変わってきている。地元商店が中央資本に取って代わられており、危惧している。
,,□,百貨店（売場主任）,・民間の給料が上がっておらず、夏のボーナスも期待できないところに、５月からの酒税などの増税により、生活防衛意識はますます強まる。
,,□,百貨店（売場主任）,・入店客数の増加は期待できないが、入店者の傾向は、癒し系、嗜好系など自分自身に対する商品が売れている。従来の商品展開では限界がある。
,,□,百貨店（企画担当）,・競合店が閉店するが、当市でも郊外店への客の流出が大きく、売上は変わらない。
,,□,百貨店（広報担当）,・良い悪いを繰り返すジグザグな景気の状況は、しばらく続く。極めてイメージ消費の要素が強い個人消費は、政治経済の停滞感から抜け出さなければ、変わらない。
,,□,百貨店（売場担当）,・春物の動きも去年に比べ、あまり変わらない状況であり、ボーナス払いの客が減少している。
,,□,百貨店（販促担当）,"・当県では、景気のいくつかの数値が下げ止まっており、景気が極端に変化することはない。
・ヤングキャリア層が順調な反面、ミセスゾーンのＭＤが苦戦を強いられており、デコボコが生じている。"
,,□,スーパー（経営者）,・やや良くなる理由もなく、やや悪くなる理由もない。ＳＡＲＳに関する客からの問い合わせもあるが、今のところ大きな影響はない。
,,□,スーパー（経営者）,・今の客の消費動向や、消費に対する基本的な姿勢は、今後も変わらない。経済的に急速な回復などは見込めず、家計も変わらないため、シビアさは続き、１品単価は更に下がり、小売業は一段と厳しくなる。
,,□,スーパー（店長）,・価格競争も下げ止まりとなっており、１品単価が99.5％とほぼ前年並みになってきている。しかし、来客数は前年比100％と伸びが低下しており、この傾向は今後も続く。
,,□,スーパー（店長）,・来客数や買上点数はなんとか維持しているが、一点単価は依然として低く、必要で、かつ安くなければ買わないという傾向は今後も続く。
,,□,スーパー（店長）,・発泡酒増税に向けたまとめ買いはあったものの、この反動が来月以降に出てくる。
,,□,衣料品専門店（経営者）,・客の買物に対する考え方が変わり、不要、不急のものは安くても買わないという客が増えており、この状況では景気は良くならず、悪いままの状態が続く。
,,□,衣料品専門店（経営者）,・４月に入り、天候も春めいてきて、春物商材が活発に動き出している。商店街の中の百貨店の閉店セールにより、一時的に８年前ほどの通行量となったものの、それ以降の対応が、商店街、各個店の課題となっている。
,,□,衣料品専門店（店長）,・普段着、お出かけ着といったカジュアル化の波に沿って提案している商品の動きは、今後も期待できるが、ビジネス衣料の需要減を補うには至らない。
,,□,乗用車販売店（経営者）,・管理内のユーザーの受注ペースはそこそこであるが、新規の成約率が前年に比べ半減しており、この傾向は今後も続く。
,,□,乗用車販売店（従業員）,・とくに良くなる要素が見当たらない。投入予定の新型車は、高額車であり、販売に結びつくとは思えず、ここ数か月はこのままの状態が続く。
,,□,その他専門店［家電］（経営者）,・販売量があっても、単価が著しく低い。また、売れる商品と売れない商品の差が大きく、プラズマテレビは売れても、パソコンは低迷続きなど、全体的に伸びがなく、先行きが不透明で、今もって何ら変化が見られないため、今後良くなるという見通しは立たない。
,,□,その他専門店［酒］（営業担当）,・新年度が始まり、行楽シーズンに入るため、酒の動きが期待できる。とくに近場の国内旅行が増えると予想されるので、多少プラスになるものと期待している。
,,□,高級レストラン（支配人）,"・宿泊については、前年の予約件数とほぼ同水準である。
・宴会では、６月の婚礼予約が少ないものの、基本的にはほぼ前年並みである。
・レストランの予約状況も前年同様である。"
,,□,スナック（経営者）,・ちょっと上向きであり、リピーターの数が増えている。このままで推移するか、もう少しの上乗せがあるかもしれない。
,,□,観光型ホテル（経営者）,"・シーズンとともに、遠方からの客が増え始め、芸者なども入るようになり、館内に多少賑やかさが戻っている。また、ゴルフ客も増え始めているが、総体では並みである。
・また当社の高単価のホテルは、今月大変苦戦している。"
,,□,通信会社（営業担当）,・通信業界の動向では、固定電話から携帯電話への料金の引き下げがあり、IP電話の普及も本格化するため、売上は減少し、悪い状態が続く。
,,□,遊園地（経営者）,・この時期は、団体客と一般客の二本立てになるが、団体客については、少子化により長期的に弱含み、一般客については、同業者とのキャンペーンやカード会社との提携、販促により、下支えを図っているが、ＳＡＲＳ、株安、北朝鮮などと心理的に悪い要素に事欠かない状況である。
,,□,美容室（経営者）,・現在の膠着状態が、３か月、半年、下手をすれば年度末まで続く。控えるにも出すにも、ちゅうちょするような世相である。
,,□,住宅販売会社（従業員）,・ローン審査が依然として厳しく、逆に客の側から融資額を絞る動きが出ているため、当社から提示する価格と客の条件が合わず、契約に至らないケースが出てきている。また、二世帯住宅ではなく、自分の世代で終わらせる安価な住宅を購入する動きも出ており、需要は若干増えるかもしれないが、全体では相殺され、あまり変わらない。
,,▲,一般小売店［書籍］（経営者）,・新入学時期も終え、一般売り主力に戻るが、底上げになる商品が雑誌、書籍ともにない。
,,▲,スーパー（企画担当）,・年内は、さらに競合出店の増加が見込まれており、客の分散が続く。営業時間延長を含めた積極的な改善施策は続けるが、依然として厳しい状況が見込まれる。
,,▲,コンビニ（エリア担当）,・株安という問題があり、大手企業の決算が減益になっており、ＳＡＲＳや北朝鮮問題など、不安材料しか見当たらない。
,,▲,コンビニ（エリア担当）,・発泡酒やタバコの増税によって、一時的に駆け込み需要があるものの、長期的に見れば、売上は厳しい展開になると予想している。
,,▲,コンビニ（店長）,・イラク戦争は終結したが、ＳＡＲＳや北朝鮮問題など世界情勢は不穏な中、経済問題は小泉政権では後回しになっており、何も行われておらず、経済は悪くなる一方である。
,,▲,衣料品専門店（経営者）,・イラク情勢、ＳＡＲＳなどにより、先行き不安で購買意欲に影響が出る。
,,▲,家電量販店（店長）,・今までは、買い控えムードの会話であったが、最近では買い諦めといった雰囲気の話が増えており、２～３か月先になれば、それが顕在化する。
,,▲,乗用車販売店（経営者）,"・新車関係では、今後も低価格車両への移行が続くとともに、車両購入に係る客の金回りが悪くなる。
・中古車やサービス需要は、新車と異なり、上向く。"
,,▲,乗用車販売店（経営者）,・自動車販売において、３月までのグリーン税制の駆け込み需要の影響が予想以上に大きく、合わせてイラク戦争やＳＡＲＳなど、消費の冷え込みが、予想通りに大きく、来客数が大きく減少している。
,,▲,住関連専門店（経営者）,・隣のデパートが今月23日で閉店となっている。同じ駐車場を使っているため、車を駐車しにくくなっている。また、これからの当店の集客に問題が出てくる。
,,▲,住関連専門店（経営者）,・盛夏的商品が前倒しで売れているが、今後ヒット商品が出ない限り、夏物の売上増は望めない。
,,▲,その他専門店［ガソリンスタンド］（営業担当）,・例年、スタンド業界の夏場は思わしくないが、今年度は更に良くなる見通しが立たない。イラク戦争が終わり、価格下落を強めると見ている。
,,▲,その他専門店［ガソリンスタンド］（営業担当）,・イラク戦争も収束し、原油生産が増えており、価格低下を見越した、販売価格の先取り値下げが見られ、今後ますます小売店におけるマージンが圧縮される。
,,▲,高級レストラン（支配人）,・予約受注状況が、前年同日と比較して、非常に悪い状況であり、先行き不安である。
,,▲,観光型旅館（経営者）,・数的に多いわけではないが、インバウンドの台湾の客にＳＡＲＳの話題が出てきている。出入国検査とあわせて、緊急対策と強力な対外支援が必要である。海外へのアウトバウンドが減少している分は、決して国内に回ってはいない。株価対策を含め、経済対策を民間の言い分を聞いてしっかり実施してもらいたい。銀行と政府にこの惨状をしっかり見てもらいたい。
,,▲,観光型旅館（経営者）,"・予約状況は相変わらず直前予約のため、予約による景気の動向はつかめないが、このところの流れでは、宿泊よりも日帰りレジャーにシフトしている。
・金の使い方もますますシビアになっており、売上も人数ほどには上がらないという状況が続く。"
,,▲,都市型ホテル（スタッフ）,・新年度に入り、消費マインドがますます冷え込んでいる。当地においては、ホテル競争が一段と激化し、ここ１～２年が生き残りを賭けた戦いの様相である。当社においても、戦略的に他社との差別化を図っているところである。
,,▲,通信会社（営業担当）,・他社を含め、格安のIP電話サービスのメニューが多様化してきている。
,,▲,観光名所（職員）,・ＳＡＲＳが旅行動向に悪影響を与え、とくに外国人客の減少が大きい。
,,×,スーパー（店長）,・２、３か月以内に、近隣に競合店が出店予定であり、また、スーパーマーケットにとっては、脅威であるスーパーセンターの出店がある。小売業の淘汰の時代に入り、客も安い店を選ぶ傾向にある。
