Ⅱ．景気の先行きに対する判断理由,,,,,,,
,,▲,一般レストラン（経営者）,・大阪・関西万博関連で動いている業種は景気が良いが、それ以外は恩恵が少ないため、今後も続く物価の上昇や経済不安を含め、景気が良くなる要因は少ない。,,,
,,▲,一般レストラン（企画）,・大阪・関西万博への来場方法が公共交通機関に偏っているのか、ロードサイドの店舗では土日、祝日の客足に悪影響が出ている。材料費が増加するなか、米価格の高騰も収益に大きく影響している。今後は、夏季の営業に対する万博の影響も心配される。,,,
,,▲,都市型ホテル（スタッフ）,・宿泊部門の予約状況をみると、客足が少し鈍い様子である。海外の団体客の受注は好調であるが、国内客による高単価の予約が伸び悩んでいる。一方、食堂はディナーが苦戦しているが、ランチは企画商品の好調で席が埋まっている。また、婚礼には期待できないものの、一般宴会では前年並みの予約が入っている。,,,
,,▲,都市型ホテル（客室担当）,・高単価での先行予約販売が伸び悩んでおり、予約の進捗状況は前年を下回るペースとなっている。,,,
,,▲,都市型ホテル（管理担当）,・春のインバウンド需要の反動で、夏の需要が鈍化傾向にあり、客室単価、稼働率共に伸び悩んでいる。,,,
,,▲,旅行代理店（従業員）,・上向く要因がない。,,,
,,▲,通信会社（社員）,・新プランによる実質値上げへの客の反応は今一つであり、他社の価格との比較で、客が流出することが懸念される。今後については、キャリアとネット銀行との業務提携の内容にも左右される。,,,
,,▲,通信会社（営業担当）,・客がインフラを切り替える動きが鈍化するため、販売量が減少する。,,,
,,▲,テーマパーク（職員）,・現状は十分な政策が打ち出せていないなか、参議院選挙の結果で変化が生じることで、今よりも良くなる可能性はある。,,,
,,▲,ゴルフ場（支配人）,・予約状況がやや低調なため、それに応じて売上も減少すると予想される。さらに、人件費や食材などの仕入価格は高止まりするため、景気はやや悪くなる。,,,
,,▲,その他サービス［学習塾］（スタッフ）,・例年、無料体験のある時期は入会者も増えるが、今年は全く増えなかった。さらに、今月末で退会する生徒もみられるなど、しばらくは生徒数の減少が続くと予想される。,,,
,,▲,住宅販売会社（経営者）,・米国大統領の動きや地価の高止まり、投資家の動向などをみていると、全体的に停滞に向かうと予想される。一般消費者の需要にも減少の動きがみられる。,,,
,,▲,住宅販売会社（従業員）,・今後も郊外を中心とした販売不振物件は、回復の見込みがなく、最終的に値下げするしかない。懸念材料は集客の減少であり、価格調整が進んだとしても、在庫処分に要する期間が長期化する可能性がある。,,,
,,▲,その他住宅投資の動向を把握できる者［不動産仲介］（経営者）,・倒産件数の増加傾向が続くなか、物価の上昇による買い控えで消費は減少すると予想される。,,,
,,▲,その他住宅［展示場］（従業員）,・住宅ローン金利が上昇傾向にあるなか、住宅市場は今後ますます厳しい状況になる。,,,
,,×,一般小売店［ガラス細工］（店長）,・このままの状態では、良くなる要素が見当たらない。,,,
,,×,一般小売店［花］（店員）,・物価の上昇により、客の購買意欲は低下しており、今後も低下が続くと予想される。,,,
,,×,百貨店（売場主任）,・抜本的な物価上昇対策がなければ、現状の買い控えが続く。米国の関税引上げなどが落ち着けば、また違う動きがみられるかもしれないが、当面はスタグフレーション的な傾向が続き、景気は悪くなると予想される。,,,
,,×,スーパー（経営者）,・食品の値上げが続いており、消費は落ち込んでいる。,,,
,,×,スーパー（販売促進担当）,・備蓄米は放出されているが、当面は品薄の状況が続くなど、価格の高止まり傾向は変化が見込めないため、景況感の悪化が予想される。,,,
,,×,衣料品専門店（経営者）,・高齢者や主婦層に生活への不安があるため、洋服を買い控える傾向が続く。,,,
,,×,衣料品専門店（経営者）,・７月に予定されている参議院選挙の動向次第であり、それまでは我慢するしかない。,,,
,,×,家電量販店（店員）,・商品価格が高騰するなか、リフォーム商品は補助金があっても、余裕のある客が中心となる。一般的に故障などの理由がなければ、買換えには至らないなど、リフォームは日常生活での優先順位が低い。,,,
,,×,住関連専門店（店長）,・客単価の低下傾向が長らく続いている。商談の途中で内容や仕様を下げ、コストダウンを図る客の増加が顕著である。,,,
,,×,一般レストラン（経営者）,・大阪・関西万博の会場が盛り上がっている一方、商店街の人通りは減少している。今後もバス旅行で万博に行く人もいるため、しばらくは厳しい。,,,
,,×,その他飲食［ファーストフード］（店員）,・円安の影響で生活費の負担が大きくなり、アルバイトだけでは生活が難しくなっている。,,,
,,×,その他飲食［ジャズバー］（店員）,・物価の上昇ペースが速過ぎる。,,,
,,×,その他飲食［洋菓子］（管理担当）,・天候による悪影響が懸念される。,,,
,,×,観光型旅館（経営者）,・今月の傾向は更に強くなり、地域間での集客の２極化が目立ってくると予想される。,,,
,,×,観光名所（企画担当）,・あらゆるものが値上がりする一方、給与の増加が追い付いていない。そのなかでレジャーにお金を使う余裕がなくなると予想される。また、大阪・関西万博の開幕から１か月が経過したが、４月13日の開幕以降、来場者数が減少傾向となっている。,,,
,,×,住宅販売会社（経営者）,・社会や経済全体が混とんとしている。,,,
"企業
動向
関連

(近畿)",,◎,－,－,,,
,,○,木材木製品製造業（経営者）,・為替は相変わらず不安定な動きが続いているが、営業の成果もあり、新規事業を前に進められている。今後も成果が出るように努力していきたい。,,,
,,○,出版・印刷・同関連産業（企画営業担当）,・大阪・関西万博の終了までは、特需が続くと予想される。,,,
,,○,プラスチック製品製造業（経営者）,・原材料や人件費、ガソリン代、運送費など、仕事に関する費用の値上がりが続くなか、それらを含むサプライチェーンの再構築が始まっている。仕事の内容は同じ企業でも、今後はそのプロセスの違いによって淘汰される。,,,
,,○,輸送用機械器具製造業（経営者）,・５月が悪すぎたため、５月と比べれば良くなるしかない。,,,
,,○,輸送業（営業担当）,・５月のトラックの稼働台数は、全国で前年よりも僅かに増えており、計画では来月も増えそうである。,,,
,,○,その他サービス業［店舗開発］（従業員）,・やや減少傾向とされる訪日外国人も、駅構内をみる限り、回復基調が続いている。米国との関税関連交渉の結果や、米価格の値下がり状況次第となるが、大阪・関西万博の閉幕までは少し景気が良くなると予想される。,,,
,,□,食料品製造業（従業員）,・夏に向けて、気温がどの程度上がるのか分からないが、暑くなれば当社の製品も売れなくなる傾向にある。野菜の動きも今は例年並みに戻っているが、先行きに不安もあり、期待できない部分がある。,,,
,,□,食料品製造業（管理担当）,・大阪・関西万博が終わるまでは、比較的好調な推移が続くと予想される。,,,
,,□,繊維工業（総務担当）,・供給過多の状況が顕著となっている。単価が上がらない分、原価を下げるしかなく、結果として付加価値の低下につながっている。客にとって良い物は、コスト高を意味するため、材料などの見直しも含め、良い商品作りを進めることが今後は必要となる。,,,
,,□,パルプ・紙・紙加工品製造業（経営者）,・一部の取引先を除いて、増産の情報がない。,,,
,,□,化学工業（経営者）,・良くなる要素が見当たらない。,,,
,,□,窯業・土石製品製造業（管理担当）,・ガソリン価格が下がりつつあるほか、米の店頭価格も６月以降は下がる可能性がある。ただし、米国の関税引上げ問題などの懸念材料もあるため、３か月先の景気は一進一退で、変化はほとんどないと予想される。,,,
,,□,金属製品製造業（経営者）,・中小の製造業全体で荷動きが悪く、先行きが不安な状態が続いている。,,,
,,□,一般機械器具製造業（経営者）,・今後数か月は悪くならないものの、改善することもない。,,,
,,□,一般機械器具製造業（設計担当）,・個人の収入が増えたわけではないが、消費者は徐々に物価の上昇に対応している。,,,
,,□,電気機械器具製造業（経理担当）,・夏休みの時期は、以前は設備更新の実施や、集客を狙った設備投資もみられた。ところが、今は夏休みが各企業で分散されるケースも増えたため、投資の増加を見込んでいない取引先も増えている。,,,
,,□,電気機械器具製造業（宣伝担当）,・物価の上昇は止まる気配がなく、個人消費の抑制傾向は今後も続くと予想される。,,,
,,□,建設業（経営者）,・今後は熱中症対策への対応が始まるが、どうしても夏は生産性が落ちてくる。限られた工期内でのしゅん工は、更に厳しくなると予想され、慢性的な人手不足のなか、働き方改革への対応で厳しい状況となる。民間工事でも完全週休２日制を取引先に理解してもらい、余裕のある工期での発注を望みたい。,,,
,,□,建設業（経営者）,・仕事はあるが、人手不足と働き方改革により、仕事量を調整する必要がある。このままでは、賃上げをしたくても厳しいのが現状である。,,,
,,□,建設業（経営者）,・今の時点では、大きな変化はないと予想している。国内外の問題がある程度落ち着かなければ、良くはならない。,,,
,,□,輸送業（経営者）,・取引先の新規案件が無期限の延期となっている。これ以上の荷物量の落ち込みはないものの、増えるとも考えられない。,,,
,,□,輸送業（商品管理担当）,・毎年６月から８月は家具の売上が落ち、その代わりに酒の売上が伸びるが、今年は余り変わらない。,,,
,,□,輸送業（営業担当）,・家具が売れるようにならなければ、売上が増えない。,,,
,,□,金融業［保険］（経営者）,・足元の景気が大きく変動する要素は見当たらない。,,,
,,□,金融業（営業担当）,・消費者の生活の安定が優先事項となるなか、政策的にも現状は十分に対応されていないため、厳しい状態は今後も続くと予想される。,,,
,,□,金融業（営業担当）,・物価の上昇などが重なり、消費は引き続き低迷すると予想される。,,,
,,□,広告代理店（営業担当）,・６月頃までは低調な状況が続きそうである。,,,
,,□,司法書士,・物価の上昇が続き、節約が当たり前となっている今、景気が良くなる要素もなく、現在と同じような動きが続く。,,,
,,□,その他サービス［自動車修理］（経営者）,・全ての商品の価格が上がるという状況は、やはり厳しい。,,,
,,□,その他非製造業［機械器具卸］（経営者）,・今夏も気温が高くなるため、熱中症対策商材や夏物商材の販売が伸びる。,,,
,,□,その他非製造業［衣服卸］（経営者）,・大阪・関西万博関連や、ホテルといった好調な分野があるほか、プロスポーツやコンサートグッズといったイベント需要も堅調な一方、量販店での個人消費は低調な状態が続き、消費は明らかに分野ごとの格差がみられる。全体的に値上げの影響が大きく、市場全体は伸びていない印象があり、ゼロサムゲームの状況になっている。,,,
,,▲,繊維工業（総務担当）,・靴下業界では販売価格にコストを転嫁することが難しく、利益率の低下が著しい。,,,
,,▲,化学工業（企画担当）,・食品価格の高騰に伴い、消費マインドが低下している。,,,
,,▲,不動産業（営業担当）,・ネット通販などの成長により、物販店舗の撤退が今後も続いていく。賃料の値下げや空室率の悪化により、今後は景気が悪くなる。,,,
,,×,その他製造業［履物］（団体職員）,・個人の可処分所得の増加が限られるなか、米を始めとする生活必需品の価格が高騰している。実質増税に近いインフレが続く状況では、消費者マインドは良くならない。,,,
,,×,通信業（管理担当）,・米価格の高騰を始めとする、物価の上昇による大きな影響が出る。,,,
,,×,金融業［投資運用業］（代表）,・秋の参議院選挙の結果次第で、大きな変動が予想されるなか、少なくとも景気の回復による経済指標や相場環境の好転は期待できそうにない。,,,
,,×,その他非製造業［電気業］（営業担当）,・今後も物価の上昇が避けられない。,,,
"雇用
関連

(近畿)",,◎,－,－,,,
,,○,人材派遣会社（役員）,・求人数が高止まりするなか、数か月先の採用予定の求人が増えている。また、４月の採用時期を過ぎても例年以上に求職者の動きが活発であり、今後も継続することが予想される。,,,
,,○,新聞社［求人広告］（担当者）,・米国の関税引上げといった懸念材料はあるが、関西企業のプロモーション費の予算状況などを聞いていると、前年を上回る企業が少なくない。,,,
,,○,民間職業紹介機関（職員）,・夏休みに入る学校などの現場が増えると予想される。,,,
,,○,学校［大学］（就職担当）,・米国の関税引上げ問題が落ち着けば、３月以前の状況に戻る可能性があり、やや良くなると予想される。,,,
,,□,人材派遣会社（支店長）,・求人動向に改善がみられるのは、下半期以降ではないかと予想される。,,,
,,□,人材派遣会社（管理担当）,・大阪・関西万博が終了するまでは、現状のままと予想している。,,,
,,□,人材派遣会社（営業担当）,・今後は水道・光熱費などの料金引上げが決まっており、景気の好転は期待しにくい。,,,
,,□,人材派遣会社（営業担当）,・物価の上昇に合わせた賃金の増加とはなっておらず、飽くまでもスキルに応じた賃金の引上げを行う就業者しかみられない。,,,
,,□,求人情報誌製作会社（営業担当）,・新卒採用は中長期的な経営計画の下で実施されるものであり、米国の関税政策などの短期的な影響を受けるとは考えにくい。ただし、今後の動向次第では、半年から１年後に景気への影響が出るため、景気後退に陥りかねない。,,,
,,□,職業安定所（職員）,・求人企業の動向などから、変化はないと予想される。ただし、製造業では米国の関税引上げなどの影響を不安視する声が出始めており、状況を注視する必要がある。,,,
,,□,職業安定所（職員）,・企業の人手不足感が強いなか、求職者も増えると予想される。シニア層の求職者が多いため、マッチングが難しくなる傾向はあるが、求人、求職の動きから判断すると、就職件数や充足数に大きな変化はない。,,,
,,□,民間職業紹介機関（営業担当）,・短期的に大きな変化はないと予想される。,,,
,,□,民間職業紹介機関（営業担当）,・夏季インターンシップなどの広報が一旦落ち着く時期に入る。2026年卒採用の内定辞退の対応や、追加の採用でどれだけの動きが出るかが、注目すべき点となる。,,,
,,□,学校［大学］（就職担当）,・新卒の採用活動が早期化しており、一見すると景況感は上向いているが、病院以外の鍼灸整骨院といった医療機関では廃業の動きも出ている。最近まで就職説明会への参加もみられたが、雇用過多が原因ではなく、無謀な開業が原因とされる。こうした部分もあり、景況感の改善が実感できない状況である。,,,
,,□,学校［大学］（就職担当）,・中小企業を中心に人手不足は深刻であり、今後も活発な求人募集が続くと予想される。,,,
,,□,その他雇用の動向を把握できる者,・エネルギー価格や原材料価格の高騰が、利益を圧迫しているという声が引き続き多い。最近では、食品製造や飲食店、施設調理の業者からは、米価格の高騰による影響が大きいという声も多い。,,,
,,▲,新聞社［求人広告］（営業担当）,・７月に参議院選挙を控えているにもかかわらず、効果的な景気対策もみられないため、景気は悪くなると予想される。,,,
,,▲,職業安定所（職員）,・求人や求職の状況は、前年や前月と比べても大きな動きはみられない。米国の関税引上げに対する各企業の動きも、管内ではほぼみられない。ただし、今後は影響が出そうな情報もあるため、米国による関税政策に変更がなければ、徐々に悪くなると予想される。,,,
,,▲,職業安定所（職員）,・米国の関税引上げの影響で、関連産業やその下請企業に影響が出る可能性がある。,,,
,,▲,民間職業紹介機関（営業担当）,・例年、今の時期から夏にかけては、求人数が減るのに加え、人材募集の競争が激しくなり、労務費の高騰や採用の苦戦につながっている。,,,
,,×,－,－,,,
,,,,,,,
　９．中国（地域別調査機関：公益財団法人中国地域創造研究センター）,,,,,,,
,,,,（－：回答が存在しない、＊：主だった回答等が存在しない）,,,
分野,,景気の先行き判断,業種・職種,景気の先行きに対する判断理由,,,
"家計
動向
関連

(中国)",,◎,－,－,,,
,,○,商店街（代表者）,・最近、飲食関係の新規店舗が開店し、空き店舗への問合せもある。,,,
,,○,一般小売店［洋裁附属品］（経営者）,・波はあるが、来客数が少しずつ増加している。,,,
,,○,百貨店（広報担当）,・価格高騰に対する施策が実行されると期待する。,,,
,,○,百貨店（営業担当）,・競合店を含め、地域商業施設及び小売店での競争が激化している。それに伴い、地域マーケットや生活圏の変化が生じる。,,,
,,○,スーパー（店長）,・燃料油価格定額引下げ措置や備蓄米対応、賃上げなど、少しずつではあるが、景気回復への動きが見える。,,,
,,○,スーパー（販売担当）,・大阪・関西万博による経済効果が波及し、段々と良くなるとみられる。,,,
,,○,コンビニ（店長）,・季節は夏休みへと入り、ますます人の動きが活発になるとみられる。,,,
,,○,乗用車販売店（店長）,・販売可能車種が増え、販売促進先が広がる。,,,
,,○,その他小売［ショッピングセンター］（支配人）,・インバウンドが増えたことで来客数が増加しており、円安の影響で今後も増えることが見込まれる。,,,
,,○,高級レストラン（事業戦略担当）,・ターミナル駅の大型施設の影響が緩んでくると、期待を込めて予測する。,,,
,,○,バー（経営者）,・来客数を増やすように接客の改善をしている。,,,
,,○,タクシー運転手,・ゴールデンウィーク明けで動きがはっきりしないが、夏に向けて人の動きが良くなる。,,,
,,○,通信会社（工事担当）,・客からの問合せが多い。,,,
,,○,通信会社（総務担当）,・備蓄米の早期放出対応や燃料油価格定額引下げ措置等で、今月よりも景気は良くなるとみられる。会社としては、情報通信業界の競争環境が変わらない限り、顧客の獲得において厳しさを増していくと考えている。,,,
,,○,住宅販売会社（従業員）,・米を中心とした物価上昇が落ち着くことで、回復基調に入るとみられる。,,,
,,□,商店街（理事）,・備蓄米の流通で、米の価格が少し安定する可能性はあるが、他の商品の価格が上昇傾向にあるため、客の目的買いは続く。,,,
,,□,商店街（代表者）,・米価格の高騰や米国の関税政策問題など不安定な面があるため、先行きが不透明である。,,,
,,□,一般小売店［食品］,・客の節約志向は依然続いており、今後もその傾向は続くと予想される。,,,
,,□,一般小売店［印章］（経営者）,・材料の仕入価格が高騰している。,,,
,,□,百貨店（営業担当）,・今後は客が特定ブランド、特定の商品、特定のサイズ、特定の色というように、商品をより一層限定して購入するようになる。,,,
,,□,百貨店（外商担当）,・食品を含め、様々な商品の価格が上昇し、株価の動きも不安定であるため、客の購買意欲が湧かない。,,,
,,□,スーパー（店長）,・来月も値上げをするため売上は確保できるが、客が購入数量を減らしたり、安い商品を選ぶようになるため、厳しい状況になる。,,,
,,□,スーパー（店長）,・特売日に客が来店する傾向は続いており、必要最低限の買物で収めている様子である。,,,
,,□,スーパー（店長）,・値上げは今後も継続するとみられるが、収入面は伸長しない見込みである。食料品は必需品であるが、購入点数や客単価の低下など、更なる節約が進むとみられる。食以外のライフラインについても生活費を圧迫している。,,,
,,□,スーパー（販売担当）,・米価格がどのように変化するかによって、他の商品の販売量も変化するとみられる。,,,
,,□,スーパー（販売担当）,・物価高が続いており、客が衣料品は必要な物しか購入していないため、景気は余り良くならない。,,,
,,□,スーパー（営業システム担当）,・備蓄米の影響で米価格が下がったとしても、他の物価が上昇し続けている限り、消費が増加することはない。価格上昇もあって売上は上がっているが、販売数量は前年よりも少ない。,,,
,,□,コンビニ（エリア担当）,・来週、再来週と多くの商品の値上げが控えている。商品の価格が１～２年前と比べて３～４割上昇しているため、今後もかなり厳しい状況が続く。,,,
,,□,コンビニ（副地域ブロック長）,・前年度は猛暑で来客数が多かったが、その裏年で苦戦が予想される。物価高も続いており、来客数の増加は期待できない。,,,
,,□,コンビニ（支店長）,・大きな変更要因が見いだせない。,,,
,,□,衣料品専門店（経営者）,・商品の仕入価格が徐々に上昇しているが、販売価格は維持している。,,,
,,□,衣料品専門店（経営者）,・中小企業は景気が良くなっていくイメージが見いだせない。,,,
,,□,衣料品専門店（経営者）,・今まで景気が良くなる感覚を覚えたことがない。将来もずっとそうだろうと考えている。,,,
