I．景気の現状に対する判断理由等,,,,,
,,○,広告代理店（営業担当）,受注量や販売量の動き,・今月に入って、３月までの駆け込み広告の注文が増えている。
,,○,経営コンサルタント,取引先の様子,・取引先の再開発ビルの店舗ゾーンでは、従来は空き店舗が出ると、長らく空室のままであったが、最近は問合せが多く、すぐにテナントが決まる。しかも以前と比べて賃料が少し上がっている。
,,□,繊維工業（総務担当）,受注価格や販売価格の動き,・販売価格の値下げ要求が当たり前となっており、経費分の粗利益が確保しにくい。
,,□,パルプ・紙・紙加工品製造業（経営者）,受注量や販売量の動き,・従来どおり、月末になると在庫調整や納期の変更が多く出てくる。
,,□,化学工業（製造担当）,受注量や販売量の動き,・４月から７月の製造の予定が立っていない。
,,□,化学工業（管理担当）,受注量や販売量の動き,・電装品向け、家電向け共に、取引先の好不調のばらつきが大きいため、全体としては変わらない。
,,□,プラスチック製品製造業（経営者）,受注量や販売量の動き,・受注はできているが、生産量は減少気味である。
,,□,金属製品製造業（経営者）,受注量や販売量の動き,・半導体関連や電子部品などの特殊な製品を除いて、一般的な製品の荷動きが悪く、先行きに明るさもみられない。
,,□,一般機械器具製造業（経営者）,受注量や販売量の動き,・ここ数か月は業況が低迷しており、今後もこの傾向は変わらない。
,,□,電気機械器具製造業（宣伝担当）,受注量や販売量の動き,・エアコンや電子レンジの販売が前年を上回る一方、全自動洗濯機や冷蔵庫などの大型商品は前年を割り込む動きとなっている。
,,□,建設業（経営者）,受注価格や販売価格の動き,・建設資材価格や労務費などの価格上昇が続いている。計画時の予算と現状の価格の差が大きく、予算不足による工事の凍結や縮小も起きている。
,,□,建設業（経営者）,受注量や販売量の動き,・問合せや引き合いの状況に、変化はみられない。
,,□,輸送業（経営者）,受注価格や販売価格の動き,・運賃は一旦少し上昇したが、ここへきて値下げの要請がきている。得意先の荷物も増えているわけではなく、経費ばかりが上昇しているため、少しでも運賃の値下げをしてほしいという意向である。
,,□,金融業（営業担当）,取引先の様子,・輸送価格の高騰によって流通経費が大幅に増えており、物価の底上げにつながるほか、金利の引上げにより景気の回復にもブレーキが掛かる。
,,□,その他サービス業［店舗開発］（従業員）,受注量や販売量の動き,・ターミナル駅は相変わらずのにぎわいであるが、それ以外の駅は来客数の減少傾向が見受けられる。平時は節約しながら、週末を中心に繁華街に買物に出掛けるといった傾向が強まっている。
,,□,その他非製造業［機械器具卸］（経営者）,受注量や販売量の動き,・製品の値上げが続いている状態であり、値上げの通知や申請に時間が掛かるため、前向きな営業活動に時間が割けていない。
,,□,その他非製造業［衣服卸］（経営者）,受注量や販売量の動き,・コストの上昇で、店頭の販売価格を上げざるを得ない日用品が増えており、購買点数が減っている。１月以降は一段と動きが悪くなっており、売上は単価が上がった分だけ増える傾向にあるが、必ずしも価格転嫁はできておらず、利益は減少傾向にある。
,,▲,食料品製造業（従業員）,受注量や販売量の動き,・家庭向け商材の一部が、農産物価格の高騰で著しく出荷が減少している。業務用商品は安定しているが、家庭向けは使用する食材価格の上昇による影響を受けやすい。
,,▲,食料品製造業（営業担当）,受注量や販売量の動き,・２月は気温が低く、気候も良くなかったことで客の外出も減少し、飲料関連の売上は少し悪くなっている。
,,▲,窯業・土石製品製造業（管理担当）,受注量や販売量の動き,・依然として、物価の上昇やガソリン価格の高騰による買い控えが進んでおり、取引先からの受注量も減少傾向にある。それに伴い、毎月の売上がやや減少に転じている。
,,▲,その他製造業［履物］（団体職員）,受注量や販売量の動き,・市場の動きが鈍く、インフレが続いているため、消費者の価格への反応が敏感になっている。
,,▲,不動産業（営業担当）,取引先の様子,・アパレル店舗の撤退が止まらず、１階の空き店舗が増加している。家賃が下がり、空室率が上がるなど、景気が悪くなっている。
,,×,金融業［投資運用業］（代表）,それ以外,・インバウンドの受入れで一部の企業は潤っているが、増税への懸念により、働く意欲を失っている労働者は多い。
,,×,その他非製造業［電気業］（営業担当）,受注価格や販売価格の動き,・販売価格が下がらない。
"雇用
関連

(近畿)",,◎,－,－,－
,,○,人材派遣会社（営業担当）,求人数の動き,・大阪・関西万博の開催を控え、関連求人が増加しているほか、求人条件も比較的良い。
,,○,人材派遣会社（管理担当）,求人数の動き,・大阪・関西万博の開催が近づき、万博関連の求人、求職者共に増加している。
,,○,職業安定所（職員）,求人数の動き,・人手不足をどのように解消するかという問題はあるが、求人は３か月前よりも増加している。
,,○,民間職業紹介機関（営業担当）,周辺企業の様子,・２月に開催された2026年卒向けの合同企業説明会への出展企業は、前年比で1.3倍と増えている。ただし、参加学生が半数に減少し、2027年卒などの低学年による参加が増えるなど、就職活動の早期化が顕著となっている。2027年卒向けの夏のインターンシップは、５月から６月のイベント出展枠が早々に埋まり始め、既に大手企業の出展も多数決まっている。
,,□,人材派遣会社（役員）,求職者数の動き,・企業の採用意欲の高さを反映し、求人数が増えているほか、２月から３月は求職者の動きが最も活発になる。
,,□,人材派遣会社（支店長）,求人数の動き,・１年を通して関西の状況はほとんど変わらず、求人は微増となっている。
,,□,人材派遣会社（営業担当）,求人数の動き,・電話対応がなく、データ入力だけといった、簡単な事務の求人が減り、求職者に対する仕事の紹介がスムーズにできていない。
,,□,新聞社［求人広告］（担当者）,それ以外,・年度末にかけての新聞広告やデジタル広告の動きをみても、大きな変動はない。
,,□,職業安定所（職員）,求人数の動き,・１月の新規求人数は前年比で減少となった。一方、有効求人数は増加し、有効求職者数も増えたが、有効求人数の増加は限定的であったため、有効求人倍率は前月に続いて低下している。
,,□,職業安定所（職員）,求人数の動き,・新規求人数だけでなく、新規求職者数や就職数もほぼ横ばいとなっている。
,,□,職業安定所（職員）,求人数の動き,・１月は求人数が増えたものの、景気の回復を要因に挙げる声は少なく、現状は大きな動きがみられない。前年と比較しても、特に大きな差はない。
,,□,民間職業紹介機関（営業担当）,求職者数の動き,・求人数は増えているが、求職者が減っている状況であるため、景気に大きな変化はない。
,,□,学校［大学］（就職担当）,周辺企業の様子,・採用活動に苦戦する企業がある一方、人手不足を背景に、ルールを守らない企業の早期採用が加速している。そうした動きのなかで、特に景気の変化はみられない。
,,□,学校［大学］（就職担当）,それ以外,・取引先の求人意欲は旺盛で、引き続き堅調な推移となっているが、物価の上昇で消費者による買い控えの動きが増えている。
,,□,その他雇用の動向を把握できる者,周辺企業の様子,・単なる原材料価格の上昇だけではなく、燃料価格や人件費、使用料などの様々なコストが上昇しており、企業収益が圧迫されている。
,,▲,新聞社［求人広告］（営業担当）,それ以外,・物価の上昇が止まらないほか、米国による施策の影響もあり、３か月前よりも景気は悪化している。
,,×,－,－,－
,,,,,
　９．中国（地域別調査機関：公益財団法人中国地域創造研究センター）,,,,,
,,,,,（－：回答が存在しない、＊：主だった回答等が存在しない）
分野,,景気の現状判断,業種・職種,判断の理由,追加説明及び具体的状況の説明
"家計
動向
関連

(中国)",,◎,－,－,－
,,○,一般小売店［茶］（経営者）,販売量の動き,・インバウンドにより抹茶の販売が好調である。しかし、地元の消費はかなり厳しい状況である。
,,○,百貨店（広報担当）,お客様の様子,・３か月前と比較して、主に時計、美術品といった高額品の動きが良い。
,,○,スーパー（店長）,来客数の動き,・半年以上、来客数が前年割れとなっていたが、今月は来客数が前年を上回っている。
,,○,スーパー（財務担当）,来客数の動き,・野菜及び米の価格高騰の影響が大きい。これまでは１品単価の上昇により売上が前年を上回っていたが、来客数や買上点数も前年を上回り、既存店売上が前年を上回っている。ただし、１人当たり買上点数は若干前年を下回っている。
,,○,コンビニ（副地域ブロック長）,単価の動き,・キャンペーン効果で他店よりお買い得であれば来客数が増える傾向にあり、直近ではより効果が向上しており、セール品はまとめ買いがよくみられる。
,,○,その他専門店［和菓子］（経営者）,販売量の動き,・客単価が上昇しつつある。
,,○,都市型ホテル（総支配人）,来客数の動き,・宿泊予約ペースが前年と比べ２％良くなっており、料飲部門全体も前年と比べ約10％良くなっている。
,,○,通信会社（工事担当）,お客様の様子,・新型コロナウイルスの感染状況が落ち着いたことで、景気が良くなっている。
,,□,商店街（代表者）,単価の動き,・景気の悪化を身に染みて感じている。
,,□,一般小売店［食品］,販売量の動き,・野菜や米の大幅な値上がりにより、単価は上昇するものの、販売数量は客の節約志向のため減少している。
,,□,一般小売店［印章］（経営者）,販売量の動き,・これだけ生活物価が上昇すれば消費に影響するのは当然である。
,,□,一般小売店［洋裁附属品］（経営者）,来客数の動き,・寒い日が続いたため、客の出足が悪かった。
,,□,百貨店（営業担当）,お客様の様子,・最終セールやオケージョンなど、目的がある客は来店しているが、長引いた雪の影響もあり、前年実績を下回った。
,,□,百貨店（営業担当）,販売量の動き,・客が増加しているにもかかわらず、衣料品の購買につながっていない。
,,□,百貨店（売場担当）,来客数の動き,・今月については、度重なる様々な消費財の値上げに加え、週末を中心とした大雪等の天候要因もあり、非常に厳しい結果となっている。景気そのものに大きな変動はない。
,,□,百貨店（売場担当）,販売量の動き,・300万円の呉服や数十万円のブランドの洋服などが売れたが、来月もこの流れが続くかどうかは分からない。
,,□,スーパー（店長）,販売量の動き,・来客数は横ばいであり、ほぼ前年並みの状況であるが、買上点数は前年を下回る状態である。買上点数は減少しているが、値上げにより１品単価が大幅に上昇しているため、売上は確保できている。また、物価上昇に所得上昇が追い付いていないため、客の節約志向はより強まっている。
,,□,スーパー（店長）,販売量の動き,・直近３か月での販売数量は、前年を下回る状況が続いている。割引デーに客が集中しており、節約志向が続いている様子がみられる。
,,□,スーパー（店長）,お客様の様子,・米や野菜の価格が高くなったとの客の声が多く、１品単価は前年比105％と上がっているが、買上点数は前年比97％と伸びない状況となっている。
,,□,コンビニ（エリア担当）,来客数の動き,・３か月前と比較して景気に大きな変化はないが、来客数が前年を超えてきている。インバウンド需要で来客数が伸びているが、需要がない店舗は変化がない。
,,□,コンビニ（店長）,単価の動き,・物価の上昇幅が大きいため、売価は上がっているが、平均購買単価は余り上がっていない。
,,□,衣料品専門店（経営者）,単価の動き,・販売価格が上昇しているため厳しい。
,,□,家電量販店（店長）,来客数の動き,・寒い日が続き、来客数が少なく、客からの電話での依頼が増加している。
,,□,家電量販店（企画担当）,来客数の動き,・来客数が前年を下回っているが、商品単価が上昇し、販売量も多少増加しているため、何とか現状を維持している。
,,□,家電量販店（副店長）,販売量の動き,・家電売上は少し低迷しているが、携帯売上が好調なので全体では前年並みとなっている。
,,□,乗用車販売店（業務担当）,販売量の動き,・車両の生産台数が多少増加しているが、受注状況に余り変化はない。
,,□,乗用車販売店（統括）,販売量の動き,・２月の販売量は前年比98％となっている。
,,□,乗用車販売店（営業担当）,販売量の動き,・決算月が近づき、市場の動向が上向く時期にはなるが、例年の状況と比較すると、来客数、売上共に低迷している。３月上旬で市場の動きは止まってしまうので、それまでに決着をつけておきたい。
,,□,乗用車販売店（リース担当）,お客様の様子,・来店した小売業者から、仕入価格が上昇し、景気が厳しくなっている話を聞いた。
,,□,その他専門店［土産物］（経営者）,来客数の動き,・寒波の影響もあると考えられるが、野菜の価格が高止まりしており、安値で提供することができないため、来客数は増えていない。柑橘類やいちごの収量もやや少なく、価格は高騰しており、集客につながっていない。
,,□,その他小売［ショッピングセンター］（支配人）,それ以外,・既存店舗の売上の前年比は３か月前と変わらない。
,,□,高級レストラン（事業戦略担当）,来客数の動き,・景気が良くなる話題に乏しい。
,,□,一般レストラン（店長）,来客数の動き,・来客数はほぼ前年並みで、大幅に増減することがない状況になっている。
,,□,都市型ホテル（宿泊担当）,単価の動き,・今月は前月同様にレジャーの動きが鈍く、ビジネスが主体となり単価が上がりづらい状況であった。休前日においては高単価客室の販売ができる日もあったが、全体的に低調が続いた。
,,□,旅行代理店（支店長）,販売量の動き,・引き続き海外旅行需要の回復が鈍く、国内旅行も連動し春休み需要にも陰りを感じている。インバウンド需要は相変わらず好調に推移しているものの、三大都市圏へ行く傾向が強いため、地方へ分散させるための施策が必要である。
,,□,タクシー運転手,来客数の動き,・前年の12月以降、人の移動が非常に少なく、利用客も１日中少なくなっている。
,,□,タクシー運転手,お客様の様子,・景気としては好調な状況が変わらないとみられる。収支としては物価上昇、人件費の上昇により厳しい。また、若手社員との入替えができていないため、従業員の高齢化で仕事の確保が十分にできていない。
,,□,タクシー会社（営業所長）,来客数の動き,・今年に入り、夜間需要が減少傾向であるが、最近も需要が少ない。
,,□,通信会社（企画・総務担当）,販売量の動き,・高機能を求める層と節約志向を求める層に消費が２極化している。
,,□,放送通信サービス（総務経理担当）,お客様の様子,・利用料支払についての延滞率や延滞解消率にここ数か月大きな変化はみられない。
,,□,通信会社（企画担当）,お客様の様子,・身の回りの諸物価の上昇傾向が続いているため、当社においても一部料金の値上げを実施したが、想定よりネガティブな反応が少なかった。値上率によるのかもしれないが、消費志向に変わらない部分もあるとみられる。
,,□,テーマパーク（業務担当）,来客数の動き,・現在、オフシーズンのため、来客数が減っている。
,,□,競艇場（企画営業担当）,販売量の動き,・１日平均の売上がほぼ横ばいである。
,,□,美容室（経営者）,お客様の様子,・ガソリン価格や電気料金の上昇で、客の節約志向が続いている。
,,□,設計事務所,お客様の様子,・将来的な計画案件の相談は減っているが、しばらく続いている計画案件の多さに変化はない。
,,□,設計事務所（経営者）,お客様の様子,・コロナ禍で見合わせていた新築や改修の引き合いが続いている。
,,□,設計事務所（経営者）,来客数の動き,・客の問合せ等が多くないことに加え、資金的な余裕が余りない人も多く、全体的には低調である。
,,□,住宅販売会社（従業員）,お客様の様子,・客が様々な物価の上昇を受けて、生活防衛のために慎重になっている。
,,□,住宅販売会社（事業推進担当）,単価の動き,・依然として物価高騰が続いており、事業のための土地取得が困難になっている。土地の価格上昇に伴い建築コストも増加しているが、増加する建築コストに応じてくれるゼネコンの選定も大きな問題となっている。
,,□,住宅販売会社（住宅設計担当）,来客数の動き,・情報取得量に好転の動きはなく、横ばい状態である。
,,▲,商店街（理事）,お客様の様子,・いろいろな物の価格が上昇し、客に生活防衛意識が働いている。また、寒いため、客が買物に出掛けるのがおっくうになっている。
,,▲,一般小売店［眼鏡］（経営者）,来客数の動き,・寒波の影響で天候が悪い日が続き、出足が悪かった。
,,▲,百貨店（営業担当）,お客様の様子,・２月は気温がとても低いため、春物の稼働が弱く、集客にも響いている。
,,▲,百貨店（外商担当）,お客様の様子,・これまで好調だった高額商品の動きが悪くなっている。また、富裕層の購買も鈍化している。
,,▲,百貨店（総務・経理担当）,来客数の動き,・１月以降、寒波の影響で積雪日数が前年より増え、かなりの影響が出ている。
,,▲,スーパー（総務担当）,販売量の動き,・寒波等の天候が重なり、来客数、客単価、買上点数のいずれも大幅に落ち込んでいる。
,,▲,スーパー（業務開発担当）,販売量の動き,・米や野菜を筆頭に商品全般の価格が高騰しており、客が付いていけない。売上が８ポイント程度上昇しているものの、来客数や販売点数は前年並みとなっている。
,,▲,スーパー（販売担当）,販売量の動き,・節分の巻きずしやバレンタインデーのチョコレートなど、イベントは盛り上がるが、通常は客の節約意識が高い。
,,▲,衣料品専門店（経営者）,来客数の動き,・いろいろ来店を促す施策を講じても結果が出ない。
,,▲,衣料品専門店（代表）,来客数の動き,・食品、電気、ガソリンなどの価格上昇がしばしば話題になる。客の節約志向は今後も続くとみられる。
,,▲,家電量販店（販売担当）,来客数の動き,・来客数が減っている。
,,▲,乗用車販売店（経営者）,お客様の様子,・タイヤ交換をしないといけないのに、ギリギリまで使用したり、ネットで少しでも安く買ったりする客が増えている。
,,▲,自動車備品販売店（経営者）,販売量の動き,・食料品等生活必需品の値上げが続き、我々の業界は少なからずぜいたく品的要素もあるので、買い控えやレベルダウンによる販売総量の低下がみられる。
,,▲,一般レストラン（経営者）,それ以外,・寒さで人の動きがなく、物価高が続いている。
,,▲,観光型ホテル（副支配人）,来客数の動き,・例年にない降雪や積雪の影響で来客数が減ってしまった。
,,▲,都市型ホテル（総支配人）,来客数の動き,・２月は２回にわたり大雪の影響による予約キャンセルや月内の新規予約の伸び悩みにより落ち込みがみられた。インバウンドも今年は春節が１月となり、東アジアの動きが鈍い。
,,▲,旅行代理店（経営者）,お客様の様子,・グループ旅行がほとんどない。また、家計が厳しく、家族旅行に掛ける費用も現状ではなくなっている。
,,▲,通信会社（広報担当）,来客数の動き,・客は価格が安いかどうかでしか判断しない。
,,▲,通信会社（営業担当）,お客様の様子,・月次消費の縮減が継続傾向で、固定電話など毎月定額のものが、特に70歳以上で解約傾向にある。
,,▲,通信会社（総務担当）,お客様の様子,・会社としては、コンシューマ向けの販売件数が伸び悩み、横ばいの状況が続いている。個人的には、ガソリン価格の高騰や野菜の値上がり等で負担感が増している。また、当県では公共交通機関の運賃の値上げも行われている。
,,×,商店街（代表者）,来客数の動き,・２月に入り、来客数が前年から２割減少している。降雪など天候だけの問題ではなく、客の買い控えがあると予想している。
,,×,商店街（代表者）,来客数の動き,・いろいろな物の価格の高騰や雪の影響で、来客数が減少している。
,,×,商店街（代表者）,販売量の動き,・食品など諸物価がかなり高騰しているため、消費が完全に冷え込んでいる。
,,×,百貨店（営業担当）,販売量の動き,・商品を値下げしても売行きが悪く、売上が大幅に減少している。
,,×,コンビニ（エリア担当）,来客数の動き,・12月、１月は競合しているコンビニエンスストアが閉店していたので、そこそこ良い状況であったが、今月に入り、その店が営業を再開したため、来客数や売上が前年と比べ、大幅に減少している。
,,×,自動車備品販売店（経営者）,販売量の動き,・メーカーからの仕入単価が上がり、販売価格も引上げざるを得ないため、客の買い控えの声を聞く。
,,×,一般レストラン（経営者）,来客数の動き,・１年で１番寒い時期なので、来客数が非常に少ない。
