Ⅱ．景気の先行きに対する判断理由,,,,,,,
,東京都,□,百貨店（売場主任）,・インバウンドはさほど変わらないとみられるが、主力の購買層では原材料価格の高騰や為替の影響により買い控えがあるとみている（東京都）。,,,
,東京都,□,百貨店（総務担当）,・直近の備蓄米放出により、食料品の動きが出てくることは好ましいが、一過性にすぎず、価格は高止まりすると予想している。あらゆる物価の上昇は継続する一方で、経済の先行きが見通せないなかでの消費行動は鈍化するとみている。売上は一定程度の伸びはあるものの、購買数の減少、メリハリをつけた消費行動により、結果として現状と変わらないと推察される（東京都）。,,,
,,□,百貨店（総務担当）,・現状の消費に対する慎重な姿勢は継続することが予想される。,,,
,東京都,□,百貨店（総務担当）,・米に代表されるように、食料品関連の値上げが続いており、一般的な消費者の行動が、生活必需品中心となる傾向が強くなっている。経済情勢の先行きも不透明で、この先景気が良くなるという雰囲気はない（東京都）。,,,
,東京都,□,百貨店（広報担当）,・内需の個人消費に直接的な影響は発生しないものの、米国の関税引上げを起点として、先行きの不透明感が一定程度消費マインドにマイナスに働くと予想している。一方で、高付加価値消費に対する国内需要の底堅さを揺るがすほどのインパクトはなく、全体的には現状の基調から大きく変化はしない（東京都）。,,,
,東京都,□,百貨店（営業担当）,・首都圏の百貨店では、外国人客の来店及び購買が減っている状況にあるが、郊外型の店舗の状況は今後も余り変化はないとみている（東京都）。,,,
,東京都,□,百貨店（営業担当）,・大阪・関西万博の開催により、インバウンドの来客数は増えているものの、購買状況、特に購買単価下落の傾向は今後も続くとみている（東京都）。,,,
,東京都,□,百貨店（販売促進担当）,・６月からの値上げ品目が増え、消費が鈍化すると予測している（東京都）。,,,
,,□,百貨店（企画宣伝担当）,・米価を始めとした食料品の高騰が収まらないなか、消費マインドへの影響が懸念される。,,,
,東京都,□,百貨店（管理担当）,・今夏も暑くなる予報が出ている。外出を控えたり、衣料品も手持ちの物で済ます動きが増えるとみている（東京都）。,,,
,,□,百貨店（店長）,・近隣でマンション建設が進んでおり、新規の客が来店してくれるチャンスがある。,,,
,,□,スーパー（経営者）,・強力な競合店が近隣にできたので、影響を受けている。やや良くなると回答したいところだが、現状のまま変わらない。米不足の解消も不透明で、余り良くならないのではないかとみている。,,,
,,□,スーパー（経営者）,・当社はスーパーマーケットだが、何しろ客はお金がない。可処分所得が増えないことには、現状のやや悪い状態がずっと続くのではないかとみている。,,,
,,□,スーパー（店長）,・米価の動向もあるが、値上げがいまだ続いていることもあり、買上点数自体は減少傾向になっていく可能性がある。,,,
,東京都,□,スーパー（店長）,・消費者には節約志向が依然として根付いており、値上げの影響も大きく、日々必要最低限の買物しかしないのが現状である。物価の上昇と所得のバランスが取れるようになるまでは、同様の状態がしばらく続く（東京都）。,,,
,,□,スーパー（総務担当）,・物価の上昇が止まらない。,,,
,東京都,□,スーパー（営業担当）,・販売量、来客数の減少、単価の上昇傾向がしばらく続く（東京都）。,,,
,東京都,□,スーパー（食品担当）,・しばらくは競合店の状況を注視し、カテゴリーでの特売を実施するなど、影響を最小限にとどめるように努める（東京都）。,,,
,,□,スーパー（販売担当）,・値上げが続くため、変わらない。,,,
,,□,コンビニ（経営者）,・これから夏に向けて、来客数、冷たい商材の販売増加が見込まれる。,,,
,,□,コンビニ（経営者）,・天候が大幅に悪化しない限り、現状を維持できるとみている。,,,
,,□,コンビニ（経営者）,・新たな値上げによる買い控えが心配である。,,,
,,□,コンビニ（経営者）,・コンビニなので米を買うことは余りないが、全体的に米価が高く、２年前の２倍になっているため、来店客も購入する際はできるだけ買上点数を減らしたりしており、客単価は低下傾向になっている。米価や物価に関するニュースが毎日流れているため、消費行動も弱くなっている。,,,
,東京都,□,コンビニ（エリア担当）,・売上は好調なペースが続いており、大型の販売促進等で維持される見込みである。主力商材の値上げもあるため、動向を注視したい（東京都）。,,,
,東京都,□,コンビニ（エリア担当）,・夏季は売上が増加傾向になるものの、物価上昇による来客数、買上点数の減少が懸念されるため、上向きとはならない（東京都）。,,,
,,□,コンビニ（エリア担当）,・直近２～３か月でトレンドが変わっていないため、この先２～３か月も横ばいとみている。,,,
,東京都,□,コンビニ（商品開発担当）,・米価が大幅に下がらない限り、客の消費マインドが改善してこない（東京都）。,,,
,,□,コンビニ（従業員）,・景気自体は余り変わっていない。２～３か月先も大きく変動する要素はない。夏季はドリンクが多く売れる。その反面、暑い時期に買われにくい商材は減ってしまう。まだ米が高いが、コンビニをうまく利用して、ちょっとしたぜいたくをしてもらいたい。,,,
,,□,衣料品専門店（統括）,・今期に入って２か月連続で来客数が前年を下回っている。この状況が即改善されることは余り考えにくい。,,,
,,□,衣料品専門店（役員）,・やはり食料品等の価格上昇が止まらないと、衣料品業界は厳しい。,,,
,,□,家電量販店（店長）,・物価上昇がまだ収まらないため、現状のままである。,,,
,,□,乗用車販売店（経営者）,・自動車の整備は順調だが、販売が余り芳しくない。客の来場はあるものの、なかなか契約に結び付かない。,,,
,,□,乗用車販売店（経営者）,・来客数及び売上も前年並みになる見込みである。,,,
,東京都,□,乗用車販売店（経営者）,・自動車メーカーが新車ディーラー以外の自動車販売会社に卸したがらないため、販売機会が減っている（東京都）。,,,
,東京都,□,乗用車販売店（従業員）,・新型車が秋口以降に出るまでは変わらない（東京都）。,,,
,東京都,□,乗用車販売店（販売担当）,・基本的な生活にまつわる物が全て値上がりしている。それに加え、米国の関税政策の影響で今後どうなるかという不安があるため、現状のままだと景気は変わらない。ロシアによるウクライナ侵攻、イスラエルのガザ侵攻と戦争が続いていることの影響もある。そうしたなかで、減税なり消費税の廃止なりを行わないことには、消費は上向かないため、景気は変わらない（東京都）。,,,
,,□,乗用車販売店（総務担当）,・業界全体が先行き不透明な状況が続く。,,,
,,□,乗用車販売店（渉外担当）,・すう勢が変化する要因が見当たらない。,,,
,東京都,□,乗用車販売店（営業担当）,・車はし好品になってきているため、食料品などその他の物価が下がらない限り変わらない（東京都）。,,,
,東京都,□,住関連専門店（営業担当）,・今年度のリフォーム関連の国策補助金事業の認定要件が、前年以前と比べてハードルが上がったため、需要喚起効果が薄い。今後についても補助金効果は余り期待できないとみている（東京都）。,,,
,,□,その他専門店［ドラッグストア］（経営者）,・集客力のある大型店に客を取られてしまい、なかなか当店に来てもらえず、大分苦戦している。いろいろ考えてはいるもののうまくいかない。もう少し考えてみる。,,,
,東京都,□,その他小売［ショッピングセンター］（統括）,・米価高騰等により生活費が圧迫されて家計はゆとりを失い、将来不安から消費の鈍化傾向が続くとみている（東京都）。,,,
,,□,その他小売［ショッピングセンター］（統括）,・賃上げが進んでいるものの、物価高の影響もあり、業種によっての好不調が顕著になる。,,,
,東京都,□,その他小売［生鮮魚介卸売］（営業）,・今後の天候も不安材料である（東京都）。,,,
,東京都,□,高級レストラン（営業担当）,・宴会関連の受注状況から、全体として宴会規模の縮小化が顕著である（東京都）。,,,
,,□,一般レストラン（経営者）,・今も特段に良いわけではないが、暇な時期より多少は良くなっている。コロナ禍が明けて大分たつが、新型コロナウイルス感染症発生前よりも売上は多くなっている。ケータリングも順調に入ってきている。できる範囲のことはしているので、以前よりは良いものの、景気は余り変わらない。これから伸びることは考えにくいため、今のやり方で何とか維持していければと考えている。,,,
,,□,一般レストラン（経営者）,・３か月後は、米国の関税政策等の影響があり、物価が安くなるとか円安から円高になっていく兆しは見受けられない。今より悪化するとみている。,,,
,東京都,□,一般レストラン（経営者）,・景気動向は今のところ様子見である（東京都）。,,,
,東京都,□,その他飲食［カフェ］（経営者）,・ここ数年、インターネット環境を整備した新業種、新形態の店が増加している。各店、新規客の獲得に成功している（東京都）。,,,
,東京都,□,その他飲食［カフェ］（経営者）,・当社に関しては、新商品が売れているためそこまで悪くなることはないが、米価が上がった辺りから客足が落ちている。ゴールデンウィークも前年より悪く、卸先の外食産業や小売店にも影響が出ている。その上、コーヒー豆の価格が大幅に値上がりしており、コーヒー店も閉めるところが増えている。このようなことからマイナス要因が多く、先行きは不透明である（東京都）。,,,
,東京都,□,その他飲食［居酒屋］（経営者）,・新たに大きな経済政策が打ち出されない限りは、現状は変わらない（東京都）。,,,
,,□,都市型ホテル（経営者）,・売上は現状の好調を維持するとみているが、これから夏場に差し掛かり、水道光熱費の上昇が不安要因である。米価を始めとした仕入価格の高騰がずっと続いており、売上は変わらなくても収支バランスが悪化することを危惧している。,,,
,,□,都市型ホテル（スタッフ）,・米国の動き方等で貿易関係は相当影響を受けると考えられ、それが県内の各企業にも波及し始めるかもしれない。その動きを見定めてからでないと、景気動向は分からない。,,,
,,□,旅行代理店（経営者）,・米問題では備蓄米を放出するという話になっており、一時的には良いことだが、将来的にはどうなのか分からない。今現在皆が大変な思いをしているので、少しでも楽になればと考えている。,,,
,,□,旅行代理店（従業員）,・物価上昇は仕方ないと受け入れて旅行費用の上積みが可能な団体と、不可能な団体が出てくると想定している。,,,
,東京都,□,旅行代理店（営業担当）,・一般的なことになるが、全体として、売上等の増加に結び付くような要因が見当たらない（東京都）。,,,
,東京都,□,旅行代理店（営業担当）,・米騒動、物価高が収まらないと、レジャーにお金を回せない（東京都）。,,,
,,□,タクシー運転手,・物価の上昇が続いており、特に今は米を始めとして食料品の値上がりが一向に収まる気配がない。これが落ち着かないと、我々の商売はなかなか上向きにならないので心配である。もう少し様子をみなければいけない。,,,
,,□,タクシー（団体役員）,・良くなる要素が考えられない。,,,
,,□,通信会社（営業担当）,・低価格志向がより強まるとみられるため、今後数か月間もサービスの見直しや解約が増加していく。,,,
,東京都,□,通信会社（局長）,・世界の通信事業環境が新たな局面にはなっておらず、しばらくは現状のトレンドが続くと予想される（東京都）。,,,
,,□,通信会社（営業担当）,・良くなるような材料がない。,,,
,東京都,□,通信会社（営業担当）,・仕入価格と人件費の高騰が止まらない限り、変わらない（東京都）。,,,
,,□,通信会社（経理担当）,・原油相場は下がっているのに、なぜかガソリン代は下がらない。,,,
,東京都,□,通信会社（管理担当）,・自社の通信インフラの光ファイバー化が完了し、５月から提供が可能となったが、競合他社に対して劣後であった状況がようやく解消されたにすぎず、厳しい状況は変わらない（東京都）。,,,
,東京都,□,通信会社（営業担当）,・前年並みのペースのため、変わらない（東京都）。,,,
,東京都,□,観光名所（職員）,・前年同期と変わらない水準のため、今年も同じと考えている（東京都）。,,,
,,□,競輪場（職員）,・変動する要素が特にない。,,,
,東京都,□,その他レジャー施設［ボウリング場］（支配人）,・米騒動次第で趣味等への出費が変化するとみている（東京都）。,,,
,東京都,□,その他レジャー施設［ボウリング場］（従業員）,・物価高などマイナス面も多そうだが、現状は影響が出ていないようにみえる（東京都）。,,,
,東京都,□,その他レジャー施設［映画］（営業担当）,・米国の関税政策の影響が若干和らぎ、株価も戻しているためである（東京都）。,,,
,,□,その他サービス［学習塾］（経営者）,・生徒の家庭から、講習費用など塾に係る費用を抑えたいという意向が強くある。,,,
,東京都,□,その他サービス［フィットネスクラブ］（エリア統括）,・米価を始めとした物価上昇や所得など、景気が上向く要素がない（東京都）。,,,
,東京都,□,設計事務所（職員）,・世界的な社会背景、止まらない物価高など先行きが見通せない（東京都）。,,,
,,□,住宅販売会社（従業員）,・住宅ローン金利が据置きとなり、それほど急激には金利は上がらないだろうという雰囲気でいる客が多い。子育てグリーン住宅支援事業の後押しもあり、マイホーム購入希望の客が増えているが、現実的に考えて駅近物件よりも市街化調整区域の安価な土地の購入に踏み切る客が増えている。,,,
,,□,住宅販売会社（従業員）,・客の動きに変化がない。,,,
,,▲,一般小売店［酒類］（経営者）,・賃上げを上回る物価の上昇が依然として続いているなか、今後改善していく兆しがみられない。,,,
,東京都,▲,一般小売店［乳業］（経営者）,・仕入先メーカーの価格改定に伴い、当社も８月に改定を実施する予定である。様々な物やサービスが値上げされるなかで、客の選択肢に残れるか不安である（東京都）。,,,
,,▲,一般小売店［文具］（販売企画担当）,・世間の物価上昇に対して、賃金ベースが上がっていないという現実がある。食費はどうしても必要なため、食料品の価格が上がっている分、し好品である文房具などの出費は相当減らされる。そのようなこともあり、店頭販売はなかなか厳しい。景気は後退すると判断せざるを得ない。,,,
,東京都,▲,一般小売店［茶］（営業担当）,・売上が伸びず、新規の客も獲得できないなか、何とか現状を維持してはいるものの、どこまで持ちこたえられるか分からない。そのような状況のため、先行きは期待できない（東京都）。,,,
,東京都,▲,百貨店（総務担当）,・米国の関税政策の影響がまだ不透明であることや、国内産業において早期退職や工場撤退等のニュースが続いており、消費者心理へのマイナスの影響が続く（東京都）。,,,
,東京都,▲,百貨店（営業担当）,・原材料価格や物流費の高騰を受け、食品やサービス、電気、ガスなど幅広い分野で値上げの動きが広がっているなかで、消費の拡大は余り期待できない（東京都）。,,,
,東京都,▲,百貨店（営業担当）,・ラグジュアリー商材の購買減少等によるインバウンドの客単価下落は回復する気配がない。また、国内需要も物価高などの影響を受け、生活必需品以外の買い控え傾向が続く（東京都）。,,,
,,▲,百貨店（販売促進担当）,・４月にも増して米不足の報道が続いたこと、米国の関税政策に対して良い見通しが立たないことから、客は消費に対して更なる不安を感じているため、景気が良くなるとは考えられない。,,,
,東京都,▲,百貨店（販売促進担当）,・直近の傾向から、やや悪くなる（東京都）。,,,
,東京都,▲,百貨店（財務担当）,・継続的な賃上げがあっても、世界的な関税政策等の影響による物価高が個人消費にマイナスの影響を及ぼすと想定している（東京都）。,,,
,東京都,▲,スーパー（経営者）,・原材料価格の高騰により販売単価が上昇している。中小零細企業では賃上げが難しい（東京都）。,,,
,,▲,スーパー（仕入担当）,・物価の上昇に賃上げが追い付かないため、消費はますます萎んでいく。,,,
,,▲,スーパー（ネット宅配担当）,・今後は更に値上げが進み、節約志向がますます高まる。,,,
,,▲,コンビニ（経営者）,・近隣住民には高齢者が多く、体調が悪くなるなどで来店客自体が少なくなっている。また、来店しても本当に必要な物のみの購入で済ませている。,,,
,,▲,コンビニ（経営者）,・安価なスーパー等に客が流れており、客を呼び込む新たな施策を打ち出さないと厳しい。,,,
,東京都,▲,コンビニ（経営者）,・米価の高止まりが続き、政府が放出した安価な備蓄米は大手スーパー等に並ぶが、当店のような小さな店までは回ってこない可能性が高く、コンビニの客離れが起きる懸念がある。必要な物しか買わない傾向は更に強まるとみている（東京都）。,,,
,,▲,衣料品専門店（経営者）,・相変わらず原材料が高騰している。夏祭り関係では、コロナ禍で離職した職人が戻ってこないため、仕立て上がりの品がなかなかできず、いろいろな面で商材が足りずに困っている。また、地域の花火大会も中止になり、夏のイベント関連消費が若干落ち込むのではないかと危惧している。,,,
,,▲,衣料品専門店（従業員）,・この先も不安定な状況が見込まれる。物価高で景気の先行きもなかなか読めないため、客は消費に慎重になっている。,,,
,,▲,家電量販店（店長）,・米国の関税政策が大きな話題となっているが、物価上昇に賃上げが追い付かず、生活コストが上昇し、消費活動が活発になる未来がみえない。消費者が安心して消費できる心理状態にならないと経済がプラスにならない。,,,
,,▲,乗用車販売店（営業担当）,・金利の引上げや諸物価の上昇による負のスパイラルが収まらない。,,,
,,▲,乗用車販売店（営業）,・現状を考えると、この先変わるような兆しは余りない。,,,
,東京都,▲,その他専門店［貴金属］（統括）,・今後も慎重に購入する客は増加していくとみられ、現在の販売数量の減少傾向が続き、３か月後の景気はやや悪くなる（東京都）。,,,
,東京都,▲,その他専門店［ガソリンスタンド］（団体役員）,・燃料油に対して政府が補助金を出すものの、客の買い控え意識は続くのではないかと考えている（東京都）。,,,
,東京都,▲,高級レストラン（役員）,・米国の関税政策、株価不安定により、インバウンドを含む来客数や売上の増加があっても、利益的に厳しい状況が続く（東京都）。,,,
,東京都,▲,高級レストラン（仕入担当）,・米国の関税政策の動きが良い方向になることは難しいと捉えているため、景気は悪化する（東京都）。,,,
,,▲,一般レストラン（経営者）,・米だけでなく全ての食材が値上がりしているため、飲食店は相当に厳しい。それを全て価格に転嫁してしまうと客は来なくなるし、そうかといって放っておくと原価だけが上がってしまう。政府は米以外についても対策を打ってほしい。,,,
,東京都,▲,一般レストラン（経営者）,・４～５月は歓送迎会や総会などいろいろ開催されたが、６月以降は宴会の動きが大分落ち着いてくるとみている。１年を通して毎週土日が忙しいのは変わらないので、週末は頑張っていきたい（東京都）。,,,
,東京都,▲,通信会社（経営者）,・この先２～３か月の景気は現状からみて良くならない（東京都）。,,,
,東京都,▲,通信会社（社員）,・政治経済の不透明感から明るい兆しがみえない。夏休みの計画が始まり、久しぶりに海外渡航が増えそうな兆候があり、内需の引締めが国内経済を鈍化させそうである（東京都）。,,,
,東京都,▲,観光名所（職員）,・ゴールデンウィーク中の入場者数が前年を下回っている。特に、国内客の減少が目立っている。日取りの違いはあるが、米を始めとした物価上昇、米国の関税政策、インバウンドによる占有や宿泊費高騰に伴うホテルの取りにくさ、都内から大阪・関西万博への人の流れ等、要因は幾つかあるかとみられるが、消費マインド自体が落ち込んでいる（東京都）。,,,
,,▲,ゴルフ場（経営者）,・物価上昇がレジャー支出への足かせとなっている。ガソリンなどのエネルギー価格、衣食住に関する物価が安定しないことには、レジャー支出は抑えられる傾向にある。,,,
,,▲,ゴルフ場（経営者）,・今夏の暑さがどう影響するか未知数ではあるが、今のところの予報をみる限りでは、前年よりも酷暑予想のため、来場者数の減少は避けられないとみている。暑さ対策を考えているものの、そもそも屋外に出るには厳しい条件がそろい過ぎているため、集客に苦戦すると考えている。,,,
,,▲,パチンコ店（経営者）,・現時点では米国の関税政策という外的な要因が直接影響を及ぼしている状況ではないものの、先行きの景気後退への不安が今後の消費者の動向に影響してくることを懸念している。,,,
,東京都,▲,その他レジャー施設［ボウリング場］（営業担当）,・幅広い分野での値上げにより、消費者の節約対象がレジャーや娯楽にも及んできている（東京都）。,,,
