Ⅱ．景気の先行きに対する判断理由,,,,,,,
,,○,輸送業（エリア担当）,・変わらず軽貨物での輸送需要は多い。しかし、４月からの貨物軽自動車安全管理者制度は、２年間の猶予はあるが業界全体として法令を遵守できていない企業や個人事業主が多いため、法令遵守に対して受発注共に仕組みの見直しが必要になり、費用がかさむことになる。運賃の見直しが今後発生する見込みである。,,,
,,□,食料品製造業（社員）,・景気が好転する材料が見当たらない。,,,
,,□,パルプ・紙・紙加工品製造業（顧問）,・米国の関税や円安、物価高により景気はやや悪い状況が続く。,,,
,,□,化学工業（営業担当）,・ＡＩ向け電子材料薬液が引き続き好調な見込みである。,,,
,,□,化学工業（総務秘書）,・食品を始めとする物価高がこたえるが、ベースアップを実施した会社も多く、大きな流れとしてはデフレ脱却をめざす好循環の方向にある。今のところ大きな景気後退は起きない見込みである。,,,
,,□,窯業・土石製品製造業（社員）,・新規案件の話が少なく、新規売上の期待は持てない。Ｗｅｂからの問合せ件数は多いが、ほとんどが売り込みばかりで意味がなくなっている。ただし、客からは大きな落ち込みの情報はなく、横ばいの見込みである。,,,
,,□,一般機械器具製造業（経営管理担当）,・受注量、販売量の見込みから判断した。,,,
,,□,電気機械器具製造業（営業担当）,・良化する要素が見当たらない。,,,
,,□,輸送用機械器具製造業（管理担当）,・まだ続く値上げラッシュに加え、米騒動も落ち着くと思わせながら結局値段は下がらないのではと疑っている。ガソリン代も10円の値下げでは中途半端である。,,,
,,□,建設業（営業担当）,・材料費や人件費の高騰で見積額が上がっている。仕事が取れたとしても仕事の件数自体が減ってしまうと、１件当たりの単価は上がっても売上は減るため、景気が上がった実感は得られない。,,,
,,□,輸送業（経営者）,・長引く物価上昇に加え、取引の多い米国、中国の要因もあり荷動きの低迷は続く。,,,
,,□,輸送業（従業員）,・仕事量がやや減少気味であり、本当かどうかは分からないが同業他社からは暇だという声を聞く。毎年５月は少し落ち着く時期ではあるものの、夏場に回復するかどうか荷主に探りを入れても良い返事はない。,,,
,,□,輸送業（従業員）,・米国関税の影響が不透明である。,,,
,,□,通信業（法人営業担当）,・国を挙げて流通スキームの見直しや既得権益に切り込まなければ、消費が上向いたり安定するようにならないと考える。,,,
,,□,金融業（従業員）,・今の不安要素が取り除かれることは見込めず、景気は変わらない。,,,
,,□,金融業（従業員）,・物価の上昇に給料が追い付いておらず、生活が厳しい状況が続く。この先数か月で景気が良くなるとは思えない。,,,
,,□,金融業（企画担当）,・中小企業においては、特に従業員の給与引上げが大手ほど十分にできない。一方で相応に引き上げないと採用、雇用維持も困難であり、相応の引上げは不可避である。これら原価率の上昇を受注価格に転嫁できないと中小企業の経営も厳しく、景気は良くならない。,,,
,,□,不動産業（経営者）,・今後は前年と同様に曇りや雨の日が多くなる予報であるが、外出や遠出をする人は少しずつ増加していく。今後の売上は増加し、前年を上回る状況になると予測する。,,,
,,□,広告代理店（制作担当）,・夏に向けた屋外・屋内イベントの企画も、スタッフ等の人手不足や各材料の値上げにより、前年と比べ厳しい状況が予測される。,,,
,,□,新聞販売店［広告］（店主）,・物価は高騰しているが給与は横ばいで、スーパーなどでも買い控えの様子がみられる。,,,
,,□,公認会計士,・国際情勢によって変化する可能性はあるが、米国の関税やウクライナ問題などがすぐに解決するとは考えにくい。また、減税を期待する個人が消費を控えている傾向にあり、夏の参議院選挙の結果次第では変わる可能性もある。先行きが見えない状態がしばらく続くことから、企業も積極的な投資はしないと考えられ、景気は余り変わらない状態が続く。,,,
,,□,行政書士,・現状維持である。,,,
,,□,会計事務所（職員）,・ガソリン代や電気代、米の値段が補助を受けて幾らか下がるとしても、飲食店の定食の値段等は上がるばかりで、消費者は少しでも安い店を探すことになる。景気の改善にはつながらない。,,,
,,□,会計事務所（職員）,・自動車部品関連の受注量は減少しているが、そのほかの船外機、オートバイ部品等の受注量は特に減少しておらず、増えている物もある。現在のところ米国の関税の影響はまだ出ていないが、この先のことを考えると不安である。,,,
,,▲,金属製品製造業（従業員）,・秋口以降の仕事量に対する不安が各所から聞かれる。,,,
,,▲,電気機械器具製造業（企画担当）,・米国政策の影響が非常に強く輸出が減少しそうであるが、景気対策もなく内需拡大も期待できない。,,,
,,▲,電気機械器具製造業（経営者）,・輸出関連は関税の問題で若干の減少が見込まれる。また、物価が非常に高騰しているため、買い控え等で需要が減る。,,,
,,▲,輸送用機械器具製造業（品質管理担当）,・１度値上がりすると元の価格に戻ることはないため、上がり続ける一方である。,,,
,,▲,建設業（役員）,・国内自動車メーカーのお膝元としては、今後米国関税の影響を受けると厳しくなる見込みである。,,,
,,▲,建設業（経営者）,・政策の方向性は良いが実行力が求められる。このままでは我が国の将来がどうなるか分からない。,,,
,,▲,輸送業（エリア担当）,・米国の関税政策による受注の悪化が見込まれる。,,,
,,▲,その他非製造業［ソフト開発］（経営者）,・米国の関税により生産が停滞するため景気はスローダウンする。このようなときには逆転の発想が必要で、新製品の完成を１日も早く急ぐ必要がある。,,,
,,×,食料品製造業（営業担当）,・受注数、販売数共に減少している。,,,
,,×,鉄鋼業（経営者）,・例年であれば４月の受注が今月から出てくるものだが、今年はない。この状況であれば夏場以降は例年比では２～３割受注が減少する可能性もある。,,,
,,×,金属製品製造業（経営者）,・引き合いの減少が著しく、悪い方向へ大きな変化が起きている。,,,
,,×,通信業（総務担当）,・我が国だけの問題ではないものの、今は耐えるしかない。金を使っても、将来の収入に対する安心感が持てれば、購入意欲が湧く。,,,
"雇用
関連

(東海)",,◎,－,－,,,
,,○,民間職業紹介機関（営業担当）,・ボーナス支給明けを境に転職活動を始める人が増加する時期であり、採用決定数が増加する見込みである。ただし、地政学リスクに鑑み求人ストップなどの動きが出てくる可能性がある。,,,
,,□,人材派遣会社（社員）,・今月と同様くらいの予約状況で変わらない。,,,
,,□,人材派遣会社（営業担当）,・減税等大胆な施策の効果がない限り、景気回復がイメージできない。,,,
,,□,職業安定所（職員）,・求人数に大きな変動がみられない。,,,
,,□,職業安定所（職員）,・中小企業においては、原材料価格やエネルギー価格の高騰などを価格転嫁ができない状況が継続しており、賃上げなどへの対応も厳しい状況となっている。一部業種での人手不足感は継続しているものの、新たな求人提出を控え、今後の景気動向を含めて様子見をしている業種もあることがうかがえる。米国の関税政策に伴う自動車を始めとした各種製造業などへの影響が予測できない状況だが、現段階において大きな生産調整などの情報は把握していないことから、景気動向に当面大きな変化は生じないと判断する。,,,
,,□,職業安定所（職員）,・米国の関税の動きが不透明であり、企業側の不安が続く。ガソリン価格に対する国の施策も、全体的な物価高は解消されていないため、すぐに好転するとは予測できない。,,,
,,□,民間職業紹介機関（窓口担当）,・例年ゴールデンウィーク明けから落ち着く求人依頼が長期的に継続しており、業界に偏りはあるものの人手不足の状況が影響している。今後も景気の影響にかかわらず、企業のニーズは一定数が恒常的に続くものになりつつある。,,,
,,□,学校［大学］（就職担当）,・新卒採用に関しては長期スパンで動いていることが多く、２～３か月で状況が大きく変わることは考えにくい。,,,
,,▲,人材派遣業（営業担当）,・これまでの状況から劇的に上昇する可能性はなく、引き続き景気は後退する。,,,
,,▲,人材派遣会社（営業担当）,・足元は変化がなくとも、依然として米国関税の影響は軽視できず、北米向けの商流がある自動車関連メーカーからの引き合いは影響を受ける可能性がある。,,,
,,▲,人材派遣会社（営業担当）,・若手の求人案件は多いが、求職者は安定した正社員のポジションを希望する傾向が強くなり、スキルや年齢のギャップが拡大し、採用が更に困難になっている。,,,
,,▲,アウトソーシング企業（エリア担当）,・自動車製造業における労働者供給については可もなく不可もなくの状況が続くが、今後米国関税の影響による自動車製造や部品製造の落ち込みがどれくらいになるかが懸念事項である。,,,
,,▲,職業安定所（職員）,・物価高や米国関税政策による影響が不透明である。,,,
,,▲,職業安定所（職員）,・物価高が続くなか、米国の関税について予断を許さない状況が続いており、事業の先行きに不透明感が強く求人活動にも影響が出始めている。,,,
,,▲,職業安定所（職員）,・新規求人数が前年同月比で減少している。また、米国の関税に関して、求人事業所から現時点では影響はないが、今後影響が出てくるか不安であるという声が多数聞かれた。,,,
,,▲,学校［専門学校］（就職担当）,・前年同期と比べ、内定率はやや下回っている。同時に前年採用された法人の採用人数も現時点では減少しており、やや心配である。,,,
,,×,人材派遣会社（社員）,・求職者の動きのみならず、求人企業も採用に対し慎重な動きが見られるようになった。,,,
,,,,,,,
　７．北陸（地域別調査機関：一般財団法人北陸経済研究所）,,,,,,,
,,,,（－：回答が存在しない、＊：主だった回答等が存在しない）,,,
分野,,景気の先行き判断,業種・職種,景気の先行きに対する判断理由,,,
"家計
動向
関連

(北陸)",,◎,－,－,,,
,,○,商店街（代表者）,・天候次第で景気は変動するが、欧米を中心としたインバウンドは減る様子がない。,,,
,,○,スーパー（仕入担当）,・食料品価格の高止まりや米価格引下げにより家庭内需要が高まり、生鮮食品や調味料の需要が上がるとみている。,,,
,,○,乗用車販売店（総務担当）,・受注できる車種が増加するため、現状より良くなるとみている。,,,
,,○,その他小売［ショッピングセンター］（統括）,・食料品、日用品の価格上昇は継続しているものの、ゴールデンウィーク期間中に動きの悪かった服飾品の購買需要の反動が、８月のお盆を挟んだ長期連休に出てくるとみている。,,,
,,○,一般レストラン（統括）,・米価格を始め物価が上がり続けているが、今後米の供給不足や価格高騰、関税問題などが解消されれば、不透明感が薄れて景気も改善するとみている。,,,
,,○,競輪場（職員）,・ガソリン代の引下げや備蓄米放出等によって客の消費マインドが高まり、娯楽への出費が増えるとみている。また、６月からはボーナスシーズンとなり、臨時収入を得ることによって売上が増えると考える。,,,
,,○,美容室（経営者）,・国内大手鉄鋼メーカーによる米国大手鉄鋼メーカー買収の動向や米価格低下への期待など、僅かではあるが最近明るいニュースが報道されている。,,,
,,□,商店街（代表者）,・大阪・関西万博などの明るい話題があれば財布のひもも緩みそうだが、景気が上向くにはまだ時間が掛かりそうである。,,,
,,□,商店街（代表者）,・各店舗の来客数が少なく、商店街全体で買い控え傾向が続くとみている。,,,
,,□,一般小売店［精肉］（店長）,・この先も物価高が続き、販売量や売上は今月と同じような動きが続くとみている。肉はどちらかというとぜいたく品とみられているのか、購入を控える動きが徐々にみえている。,,,
,,□,一般小売店［事務用品］（店長）,・需要期以外の購入は余り期待できない。,,,
,,□,一般小売店［書籍］（従業員）,・景気が良くなる要素がなく、資材等の高騰もあいまって、景気は変わらないか若干悪くなるとみている。,,,
,,□,百貨店（売場主任）,・物価高の影響と米国の追加関税による先行きの不透明感、そしてインバウンドによる売上の失速などマイナス要因ばかりで、現状維持が精一杯と見込んでいる。,,,
,,□,スーパー（店長）,・今後も商品が値下がりする傾向はなく、ライフラインを含め生活コストが増えている。賃金上昇の影響は少ないとみている。,,,
,,□,スーパー（総務担当）,・ガソリン価格が若干下がっているが、米国の関税引上げの影響を受けて人員削減も目立ってきている。,,,
,,□,コンビニ（店舗管理）,・米の店頭価格次第ではやや良くなる可能性があるとみている。,,,
,,□,衣料品専門店（経営者）,・消費志向が高まる兆しはみられず、当面は現状のままと考える。,,,
,,□,衣料品専門店（経営者）,・今後３か月はセール期間であり消費マインドが高まるとみているが、物価高騰による買い控えで客単価が下がり、来客数増加も期待できないとみている。,,,
,,□,衣料品専門店（経営者）,・地域によって若干差はあるが、ゴールデンウィークの販売量がやや悪かったため、このままセール時期まで客の購買意欲が低いままで推移するとみている。,,,
,,□,家電量販店（店長）,・物価高により客は必要品以外は買わないとみている。,,,
,,□,家電量販店（店長）,・食品等の値上げが続いている影響か、主要商品における客の購入単価が下がっている。,,,
,,□,乗用車販売店（経営者）,・ガソリン価格の高騰が注目される状況がしばらく続き、景気状況は変わらないとみている。,,,
,,□,住関連専門店（役員）,・米や食品、日用品等の物価高騰に加え、世界及び日本経済の先行き不安もあいまって、客の買い控えや節約傾向がこれからも続くとみている。,,,
,,□,その他専門店［酒］（経営者）,・良くなる兆しが全くみえないことから、この先も景気は変わらないと考える。,,,
,,□,高級レストラン（スタッフ）,・県外からの団体客の受注が、例年の８割で推移しているため見通しは厳しい。大阪・関西万博の影響も考えられる。,,,
,,□,スナック（経営者）,・小売店や商店街でも売上が減少していると聞いており、先々もこの状態が続くと考える。,,,
,,□,観光型旅館（経営者）,・夏休みに入るまでは現状と同じような動きで、週末の予約はあるが平日の予約が弱くなるとみている。大阪・関西万博の影響を受けている可能性がある。,,,
,,□,観光型旅館（経理）,・能登半島地震の発生以降休業状態で、再開までにまだかなりの期間を要する。,,,
,,□,旅行代理店（従業員）,・旅行費用の上昇が収まらず、今後も不安である。,,,
,,□,タクシー運転手,・節約志向はあるが、観光客を含め、夏場に向けて好調が続くとみている。,,,
,,□,タクシー運転手,・観光客数を伸ばすためには県の努力が必要である。それが公共交通需要に直結すると考える。,,,
,,□,通信会社（営業担当）,・今は大きな変化の起爆剤がない状況である。販売数は前年と同様の推移になっている。,,,
,,□,通信会社（役員）,・契約数は前年と同レベルで好調に獲得できると考えている。ただし、解約対策については課題が残る。,,,
,,□,住宅販売会社（従業員）,・また少し材料価格が上昇していることから住宅価格も影響を受け、契約件数は伸びないとみている。しかし、１軒１軒の住宅性能を高めたり、より良い住宅設備の提案を行って販売したりすることで、契約件数は変わらなくても売上は伸びる状況にあると考える。,,,
,,□,住宅販売会社（従業員）,・良い月と落ち込む月があり受注が安定していないため、楽観はしていない。客の絶対数が少ないことが原因とみている。,,,
,,□,住宅販売会社（従業員）,・物価高騰や関税問題の影響を受け、客の動きに変化がみられない。,,,
,,▲,百貨店（販売促進担当）,・賃金上昇の気運が明らかに打ち消されている様子がうかがえる。,,,
,,▲,百貨店（販売担当）,・米など食料品の高騰により、生活必需品の売上がやや低迷し始めている。生活必需品以外の衣料品や装身具などの雑貨は優先度が低く、高付加価値商品の低迷が当面続くとみている。物価高騰が落ち着くまでは我慢の営業が必要である。客が買いやすい価格帯の商品やセール対応品の拡充が必要と考える。外商客などの富裕層にも節約傾向があり、資産価値のある商品や話題性のある商品には動きはあるが、購買には慎重になってきている。,,,
,,▲,乗用車販売店（従業員）,・物価高が続いている影響で、買い控えの傾向にある。,,,
,,▲,乗用車販売店（役員）,・米国による関税政策の行方が不透明で見通しを立てることは困難だが、徐々に影響が出てくるとみている。,,,
,,▲,都市型ホテル（スタッフ）,・予約の状況から見て勢いがない。,,,
,,▲,都市型ホテル（役員）,・引き続きインバウンド需要は期待できるものの、国内宿泊客の客室単価は横ばいに転じており、稼働状況に合わせた価格のコントロールが重要である。,,,
,,▲,通信会社（職員）,・米価格の高騰や米国関税の影響への見通しが立たず、閉塞感がある。,,,
,,▲,通信会社（役員）,・物価上昇に対する懸念が高まっている。,,,
,,▲,テーマパーク（役員）,・３か月先までの団体の予約状況をみると、前年との比較でやや悪化している。,,,
,,▲,パチンコ店（経理）,・諸物価高騰でパチンコに回す経済的な余裕はないとみられる。,,,
,,▲,住宅販売会社（営業）,・賃上げと原材料価格高騰への対処に加え、４月の改正建築基準法・改正建築物省エネ法の全面施行による行政の混乱に伴う業務負担の増大で周辺はかなり疲弊しており、結果として景気の押し下げにつながるとみている。,,,
,,×,コンビニ（店長）,・景気が良くなる要因が見当たらない。全国のコンビニチェーン店では自動レジ導入による無人化、省人化の計画が進んでおり、１～２年後には夜間や来客の少ない時間帯の無人化が実施できる見込みである。深夜時間帯勤務の従業員が削減されることになるが、最低賃金などの人件費が高いため、深夜時間帯勤務者をそのまま雇用することはできず、結果として雇用の機会が失われることから良い流れとはいえない。,,,
"企業
動向
関連

(北陸)",,◎,建設業（経営者）,・これから公共工事の発注が旺盛になってくる。,,,
,,○,金属製品製造業（経営者）,・２～３か月先の分の受注状況をみて、景気はやや良くなると考える。,,,
,,○,一般機械器具製造業（経理担当）,・海外からの二輪車用部品の受注が好調で、特に欧州向けを中心に受注が入っている。国内の設備投資に伴う産業用関連製品においても引き続き堅調な受注状況となっている。一方、自動車関連部品は中国向けが依然として低調ななか、米国の関税政策により北米向けは安定せず、先行き不透明な状況となっている。,,,
,,○,不動産業（経営者）,・個人客、法人客共に、少しずつ問合せが来るようになったことから、少し良くなるとみている。,,,
,,□,食料品製造業（経営企画）,・景気が上向く材料として、日本産水産物の中国向け輸出解禁に期待しているが、その時期はいまだ不透明である。,,,
,,□,プラスチック製品製造業（広報）,・景気が上向く要素が不足している。,,,
,,□,一般機械器具製造業（総務担当）,・今後米国の関税政策がどの程度影響してくるのか、先行きが不透明である。,,,
,,□,電気機械器具製造業（営業担当）,・新規の引き合いは多少増加傾向にあるが、量産化の日程が不透明である。また、客の新規案件着手の判断もなかなか明確にならない。このため、この先３か月程度の範囲では売上増加が見込めない。客も設備投資にかなり慎重になっている。,,,
,,□,建設業（役員）,・原材料費及び人件費が高騰するなかで、今後の受注量についてはまだ不透明感が強い。,,,
,,□,通信業（営業）,・来年の米国中間選挙に向けて、今後減税等の対策が打ち出されるとみているが、施策が明らかになるまでは株価の値動きが沈静化し、現状どおりとみている。,,,
,,□,司法書士,・３月決算の法人の事業報告では、今年は良いが今後は不安材料があるという内容が多く見受けられる。,,,
,,□,税理士（所長）,・これからボーナス支給の時期に入る。先行き不透明な状況のなかで、今後企業がどれだけ賃上げに踏み切れるか、踏ん張りどころとみている。,,,
,,▲,繊維工業（総括）,・米国政権による関税引上げの影響を受け、今後の受注の減少や取引先からの値下げ圧力を懸念する声が高まっている。,,,
,,▲,輸送業（経理）,・経費ばかりがかさみ、今以上に利益が出るとは思えない。,,,
,,▲,金融業（融資担当）,・物価高による個人消費の低迷や中小企業の利益圧迫など、国内情勢に回復の兆しがみえない。米国による関税引上げの影響も出ているなか、今後更なる追加関税の可能性もあり先行きは不透明である。,,,
,,×,－,－,,,
"雇用
関連

(北陸)",,◎,－,－,,,
,,○,新聞社［求人広告］（担当者）,・求人数の見込みが前月よりも増加傾向にある。,,,
