Ⅱ．景気の先行きに対する判断理由,,,,
,,□,設計事務所（所長）,・一向に進展がなく、建設投資が可能な状況になるには、まだ時間がかかると思う。
,,□,設計事務所（所長）,・今月成果があったおかげで受注の貯金もでき、今後２～３か月は今月と変わらず安定する。
,,□,住宅販売会社（従業員）,・株高による消費の回復がどこまで続くか不透明である。また、地方への波及効果は遅く感じられる。
,,□,住宅販売会社（経営者）,・現在は少し良くなっているが、その状態が上限であり、これ以上に良くなる印象は薄い。
,,▲,一般小売店［青果］（店長）,・近隣の大企業が合併により７月で整理され消滅する。その後の行方をみないと分からないが、今のところはリストラ、リストラ、リストラで景気は悪い一方である。
,,▲,衣料品専門店（販売担当）,・景気が良くなっているという判断が、至るところで報道されているが、やはり来店客は実感がないというのが本音だと思う。このところ幾分買物客に動きが出てきた感じだったが、その動きがまた少し小さくなりつつある。そういう様子をみていると今後もあまり期待できず、やや悪くなっていくと予想をしている。
,,▲,乗用車販売店（従業員）,・需要期も過ぎると販売台数が落ち込むのではないかと危惧している。消費税の引上げ動向によっては変わると思う。
,,▲,乗用車販売店（販売担当）,・３、４月は、恐らく卒業、入学、就職関係により、一過性で新車、中古車の販売が伸びる。当地域は観光地のため、２、３か月先の５、６月ごろに観光客は来るが、そこに勤めている人や商売をしている人は車に目がいかなくなる。そのため、当然２～４月と比べて販売台数が落ち、それほど良くなる要素はなく、やや悪くなる。
,,▲,高級レストラン（店長）,・当店がある商店街も、数か月以内に数店舗閉店すると聞いている。商店街の通りの半分以上が空き店舗になり、良くなる要素が見当たらない。
,,▲,スナック（経営者）,・４～６月の今までの動向をみてみると、毎年売上が減っているため、今よりは悪くなる。
,,▲,都市型ホテル（スタッフ）,・３か月先の６月は、今の時期より少し売上等が悪くなると思う。たまたま総会の時期ではあるが、会場関係においては３月よりは多少落ち込むのではないか。景気が１日も早く良くなってくれれば有難い。
,,▲,タクシー運転手,・同じ地域で競合他社が１社増える予定である。
,,▲,タクシー（経営者）,・利用客が少ないため、この先も悪いと思う。
,,▲,通信会社（経営者）,・円安による仕入価格高騰で利益がひっ迫している。デフレ慣れした消費者は価格高騰に敏感で、かえって値上げが難しい。デフレ脱却といっても現実には２～３年はかかるだろう。
,,▲,通信会社（営業担当）,・無理は続くことなく、再び将来に向けた蓄えに戻る。
,,×,一般小売店［衣料］（経営者）,・最近、近隣の飲食店などは外国人が来て結構にぎやかだと聞いている。しかし、そういったことがあっても、なかなか全体に回らない感じがする。このような状況のため、これからもあまり良い状況は生じないと思う。
,,×,タクシー運転手,・３、４月は歓送迎会の時期であるため、例年多少は動くが、それが終わるとがたっと減る。今年も悪くなると思う。
,,×,通信会社（経営者）,・地方都市の一零細企業が経営を維持していけない状況が続く。元本返済の滞る企業への貸出しは銀行も拒む。こういう時期こそ、本質の金融緩和が必要に思われてならない。
"企業
動向
関連

(北関東)",,◎,食料品製造業（営業統括）,・アベノミクスも徐々に効果が出始めているのか、ほかの酒類からワインへの移行がみられるようになっている。更に付加価値の高いワインに向かうと考えられる。
,,◎,その他製造業［環境機器］（経営者）,・太陽光発電の500キロワットの半メガソーラーが複数か所で立ち上がる予定である。
,,○,窯業・土石製品製造業（総務担当）,・アベノミクス効果は当業界にまだ及ばないが、大いに期待している。
,,○,金属製品製造業（経営者）,・取引先より連絡があり、４月から受注が多くなるため、これから良くなる見込みである。楽しみにしている。
,,○,一般機械器具製造業（経営者）,・中国市場に向けた油圧ショベル部品の生産が回復傾向にあることは明るい話題だが、現地生産、現地調達の動きがますます加速しているため、国内生産のボリュームが今後大きく戻ることは期待できない。しかし、自動車、油圧機器、航空機等の新規の動きも確実に出てきている。
,,○,輸送用機械器具製造業（経営者）,・大手銀行、大企業が良くなってきているため、我々中小企業もこれ以上は悪くならず、少しずつだが忙しくなるのではないか。
,,○,輸送用機械器具製造業（総務担当）,・大手自動車メーカーからの生産の３か月見通しによると、４、５月は６、７月の前倒し関係の発注がくる。そういう部分では伸びるが６、７月を調整しているため、その先がやや不透明になってきた。一方では、４月からのコスト軽減要請があるため、収益的には厳しくなってきている。全体的には上向きの状況に入っているが、３か月先以降になると不透明感がやや強まったという感じを受けている。
,,○,建設業（総務担当）,・補正予算の恩恵が数か月後には顕在化してくれると思う。
,,○,金融業（調査担当）,・経済対策の効果が少しずつ見え始める。
,,○,金融業（経営企画担当）,・製造業関連において、円安により輸出が伸びることへの期待感があるほか、建設業、建築業関連においても、政権交代による公共工事の増加や消費税増税に伴う新築住宅の駆け込み需要への期待感がみられる。また、サービス業関連において、観光地が観光シーズンに入ることや、高速道路のトンネル崩落事故に伴う通行止めが解除になったことなどによる期待感がみられる。
,,○,経営コンサルタント,・漠然とした消費マインドの高揚を期待する向きもあるが、食品など生活のレベルアップにつながるような消費の増加、それに伴って生産増加をもたらすような景気の好転には時間がかかるという見方が多い。
,,□,出版・印刷・同関連産業（営業担当）,・官庁関係については、相変わらず見積もかなり下げないと駄目な状況で、実際には変わらないと予想している。
,,□,化学工業（経営者）,・期末のため、駆け込みの注文も結構あり今は良いが、新年度からしばらくの期間は受注の動きが鈍くなってくる。
,,□,窯業・土石製品製造業（経営者）,・ソーシャル・ネットワーキング・サービスでのＰＲ効果が徐々に出始めている。クラフト体験のシーズンを前に、体験工房へのＰＲ等、地道に展開していく程度しか策がない。
,,□,一般機械器具製造業（経営者）,・現在の受注先については下げ止まりをしており、当分現状維持で推移するとみられるが、採算を割るところまできているため、非常に苦慮している。新規開拓の努力をしているが、結果が出るには半年以上かかりそうである。
,,□,一般機械器具製造業（経理担当）,・何社かやはり仕事が少なくて十分にないということを聞いている。
,,□,電気機械器具製造業（経営者）,・主要の客が６月分から仕事の約半分を中国生産に切替えるため、売上的に全体の約３割落ちてしまい、非常に厳しい状況になっている。今後も回復する見込みがなければ新規の開拓をするしかないのだが、状況としては非常に厳しい。近年にない厳しさになると思う。
,,□,電気機械器具製造業（経営者）,・来月から新機種の生産が開始予定であるが、厳しい単価の要請を受けている。また、新機種の生産数がまだ不透明である。
,,□,輸送業（営業担当）,・ドア・ツー・ドアの手軽さでインターネット通販などは今後も荷扱いは増えそうである。また、アベノミクスの景気誘導により、アパレルや高級化粧品などの荷扱いも増えてきそうである。しかし、円安による燃料費の負担が厳しく、利益は薄くなりそうである。
,,□,通信業（経営者）,・アベノミクスという言葉だけが独り歩きしており、実際、景気対策の効果が出ている感じは全くない。
,,□,金融業（役員）,・地方にはまだアベノミクス効果がほとんど届いていない。具体的には、公共工事、あるいは自動車関連などではまだ効果がない。したがって、成長戦略が出たあとどのくらいの数字が出るか、参議院選挙が終わったあとが一つの山場だと思う。
,,□,不動産業（管理担当）,・管理する建物の受注金額は、横ばいか少し値下げされており、その分を多少増える小修繕のスポットでカバーする。世で言われている好景気は、地方の当社のような業種にはすぐに影響がない。
,,□,新聞販売店［広告］（総務担当）,・物価上昇２％に見合う賃金改定が言われているが、商店主、企業主の多くは将来の不安が拭いきれず、とても上げられないと話している。
,,□,司法書士,・皆と話していて、景気回復の効果が数字に表れてくるのは秋の終わりぐらいというのが大筋のようである。
,,□,社会保険労務士,・多くの事業所で雇用保険の資格取得者よりも資格喪失者のほうが多い。今のところ、この状況が変わる雰囲気はない。
,,□,その他サービス業［情報サービス］（経営者）,・客の情報化投資の改善はみられるが、従来型の受託型の情報化投資は減りつつあり、モバイル系の活用やクラウド向け商材に客の投資意欲が出てきている。
,,▲,出版・印刷・同関連産業（経営者）,・今月は年度末で忙しさもあるが、利益、資金繰りなどの面では相変わらず大変である。
,,▲,電気機械器具製造業（経営者）,・期待はしたいが、仕事が減ってきた現状をみると先の見通しは厳しい。
,,▲,その他製造業［宝石・貴金属］（経営者）,・４月は展示会シーズンであるが、それに向けたオーダーは少ない。商品価格が高騰しているため、小売店からも先を見込んだ発注は少なく、回復には時間がかかる。
,,▲,不動産業（経営者）,・業種により景気の回復に差があるようである。回復しているとの話題はあるが、収益増までには至らず、備品類の補充等の必要経費で精一杯である。
,,×,食料品製造業（製造担当）,・今月は中国産が値上がりし、来月はアメリカ産の原料が７％ほど上がる。売上が落ち込んでいる状況での原材料の高騰は、財務内容を本当に厳しくさせる。
,,×,建設業（開発担当）,・３月は公共工事施工が忙しいが、４月以降は例年発注が少ない時期になってしまう。今期は補正予算が計上されたため期待したいが、当社に関わる工種はどうか分からない。今後は民間工事に力を注ぎ受注確保を目指したい。
"雇用
関連

(北関東)",,◎,人材派遣会社（営業担当）,・アベノミクス効果で消費意欲が旺盛であり、また、円安、株高が地域の製造業を中心に、活力を付けてきている。
,,○,人材派遣会社（経営者）,・４～５月にかけての連休に向けて、気温の変化はあるが比較的早くに暖かさが戻ってくると思うため、衣料品関係や、花見が大体終わってくるころだが北上すればかなり上向き傾向になり、食料品等と酒の伸びが期待できると思う。ただし、住宅関連や建設関連については、まだ今のところ不透明なところもある。
,,○,職業安定所（職員）,・相当数の求職者数はあるが、求人数の微増、就職者数の急増、事業所からの情報等から今後はやや良くなる。
,,□,人材派遣会社（経営者）,・仕事に安定感がなく、まだ忙しい感じではない。
,,□,求人情報誌製作会社（経営者）,・今後、円安と株価の安定が長く続くようであれば、中小零細企業の景気が上向いてくるが、それに伴う求人がすぐに増加するのはまだ大分先になる。
,,□,職業安定所（職員）,・景気回復に期待し、在職中の新規求職者数が増えている。また、新規求人数も復興関連の影響から、建設業、運輸業関係が増加しているが、有資格者や経験者を希望する求人が多くミスマッチとなっている。
,,□,職業安定所（職員）,・企業側の採用意欲の高まりは依然感じられず、正社員求人がもっと増加してこないと、厳しい雇用環境は変わらない。
,,▲,人材派遣会社（管理担当）,・クライアントによる直接の期間雇用等が増えて、派遣の要請が減少する。
,,▲,職業安定所（職員）,・ここ２か月の新規求人については、前年同月比でみると、１月は１割減、２月はほぼ横ばいとなっている。新規求職者数については、関連主要企業及びその関連企業で、現在、早期退職の希望者を募り12～３月にかけて実施しているため、３月の求職者数が増加してくる見込みであり、また、例年４月は新規求職者も増加してくる。有効求職者数も当然増加見込みであるため、やや悪くなると判断した。また、企業訪問時等において、管内の複数企業での合併で主要企業では一部事業が経営統合などもあり、そうした影響から県北地区の仕事量の減少を心配する声も聞かれる。新規求人関係は少し厳しい状況になりそうである。
,,×,－,－
,,,,
　４．南関東（地域別調査機関：（株）日本経済研究所）,,,,
,,,,（－：回答が存在しない、＊：主だった回答等が存在しない）
分野,,景気の先行き判断,業種・職種,景気の先行きに対する判断理由
"家計
動向
関連

(南関東)",東京都,◎,商店街（代表者）,・アベノミクスと私鉄の相互乗り入れのダブル効果により、更に良くなると思われる。景気が上昇軌道であることに加え、商圏が広がるという二重の効果は大きい。
,,◎,コンビニ（経営者）,・これからは暖かくなるため、買物客が相当多くなるのではないか。
,東京都,◎,家電量販店（営業統括）,・引き続き円安の後押しと、政府の取り組みによって訪日観光客は増加していくと考えている。メイドインジャパンの高額商品は東南アジア圏を中心に中国、台湾の客にも需要がある。日本人の国内消費は４月以降も株価が上昇し、実質的な給与増が実感されると、確実に消費行動が活発化する。高機能のエアコンも売れ筋になると思う。
,東京都,◎,その他小売［雑貨卸］（経営者）,・政府、日銀の打ち出す政策に期待が持てる。
,東京都,◎,旅行代理店（支店長）,・５月22日でスカイツリーは開業１周年を迎える。その関係でその企画やそれに付随したイベントの問い合わせもあり、また、実施が予定されているため良くなる。また、１周年ということで団体の問い合わせが多くなっている。
,東京都,◎,通信会社（経営者）,・政府によるデフレ脱却の意識が感じられる。
,東京都,◎,観光名所（職員）,・２か月後はゴールデンウィークとなり、トップシーズンを迎えるため、今月よりはかなり良い成績を期待している。
,東京都,○,商店街（代表者）,・２％のインフレ目標が現実化されれば、おのずから世間の景気も良くなると楽観している。
,,○,一般小売店［家電］（経理担当）,・実際の売上は良くないが、今月になり、見積依頼が増えて良くなりそうである。
,東京都,○,一般小売店［家電］（経営者）,・アベノミクスの効果が出て、上がってくるのではないかと期待している。
,東京都,○,一般小売店［家具］（経営者）,・気温が上昇しており、株価も上がっている。やはり一般消費者の心理的状況が、幾らか明るいほうに向いていくのではないか。
,,○,一般小売店［祭用品］（経営者）,・新年度、新たに増えるであろう顧客に期待する。
,,○,一般小売店［文具］（販売企画担当）,・まだ予断を許さないかもしれないが、客との会話のなかで、25年度中に買える物は買っておこうというような話が出ている。消費税が次年度上がることによる対応が求められてきており、期待できる。
,,○,百貨店（売場主任）,・円安、株高の傾向が今後も緩やかに続くと思われ、また、一般企業の給料等も上昇の兆しがあるとの報道から、徐々に景気の回復が想定される。
,,○,百貨店（総務担当）,・引き続き円安、株価上昇傾向が続く。
,東京都,○,百貨店（広報担当）,・ここ数か月でみると、このままの売上の増加傾向が続きそうである。日銀新総裁も景気浮揚策支持を発表しており、短期的な株式などの利益確定売りは出るかもしれないが、全体的には上昇傾向は維持される。ただし、参議院選挙後の消費税増税やＴＰＰへの関わり方など、中長期的には不確定要素が多く予断を許さない。
,東京都,○,百貨店（営業担当）,・街全体に人が流れているのは良い傾向である。私鉄の相互直通運転の影響もあり、流出の危惧もあったが、今のところは大きな影響はなく、しばらくは堅調な伸びに期待したい。
,,○,百貨店（店長）,・株価と給与の上昇による購買意欲の上昇が期待できる。
,,○,百貨店（販売管理担当）,・景気全体に持ち直し感が出ており、一部持ち直しがみられた高額品だけでなく、一般の衣料品にも同様の傾向がうかがえることから、広い所得層の間で消費意欲や購買意欲が回復傾向にある。
,,○,百貨店（副店長）,・高額品である宝飾、時計などの客単価は上昇傾向であり、今後高齢者にも景気回復感が反映してくれば売上が上昇傾向になると思う。外商の顧客層の動きは確実に良くなっている。しかし、百貨店からの不断な集客対策が奏功しないと一般顧客の回復は簡単ではない。
,,○,百貨店（営業企画担当）,・カード顧客向けの施策を実施したところ、反響が大きく、前年売上を大幅に上回っている。
,,○,百貨店（管理担当）,・大手企業による賃金アップへの積極的な取り組みや、年度末の株価上昇による景気回復への期待からである。
,,○,スーパー（店長）,・今後、流通に関しては消費税増税問題も控えているが、最近の企業の賃上げや株高等をみると、日本経済が好転をしてきていると思う。今後も景気が良くなっていくと思われ、景気が良くなれば客の購買意欲も高くなるため、今月と比べて更に良くなっていくのではないかと期待している。
,,○,スーパー（店長）,・競合店ができて今が一番底だと思っている。そのため３か月先は今よりも数字が改善されるという期待値を込めて、やや改善される。
,東京都,○,スーパー（営業担当）,・円安、株高の基調が継続している。継続している限り、消費意欲が徐々に増していき、今後の見通しは明るくなっていくのではないか。
,,○,コンビニ（経営者）,・季節的な要因だが暖かくなるため、客の動きも良くなると思う。今の景気の状況が一般にも普及するようになるのではないかと期待している。
,東京都,○,コンビニ（経営者）,・短期的には少し良くなると思うが、決して楽観できない。
,,○,コンビニ（経営者）,・幸福価値商品を求める客の流れは当分続くと思う。
,,○,コンビニ（経営者）,・気温が上がり、少しずつ上向いてくる期待と、客単価が高くなってきているため、改善方向に期待している。
,東京都,○,コンビニ（商品開発担当）,・各部門の達成率と予算から、やや良くなる。
,,○,衣料品専門店（経営者）,・新政権の景気対策が少しずつ効果が現れてきており、明るいムードになってきているため、これからに期待している。
,,○,衣料品専門店（営業担当）,・景気、売上等は上がるが、消費税増税により、そのあと２、３か月影響するのは明らかである。
,,○,乗用車販売店（経営者）,・自動車の整備と販売をやっているが、整備、販売共に今月は順調である。販売は前月まではあまり良くなかったが、消費税増税による前倒しだと思う。また、景気が回復してきているのではないか。
,,○,乗用車販売店（経営者）,・アベノミクス効果で株価も上がり、新車の販売台数も増えて景気が良くなってきている。
,東京都,○,乗用車販売店（販売担当）,・新車の需要も伸びているが、今まで成約率の悪かった中古車も高くなっている。特に建設関係ではダンプカー、ミキサー車、クレーン車は、非常に納期がかかるため、即使える中古車の価格が高くなり、成約率が上がっている。景気は徐々に良くなっている。
,,○,乗用車販売店（渉外担当）,・エコカー免税、減税は継続しており、ハイブリッド車や新型車は好調に推移している。東日本大震災やタイの洪水等の反動からＶ字回復した前年には及ばないが、前年比10～15％減でここ数か月推移しており、楽観視はしていないが消費行動も続くとみている。
,,○,その他専門店［ドラッグストア］（経営者）,・競合店がますます増加しているが、社内の体制変更により店舗が活性化してきているため、３か月後が非常に楽しみである。
,東京都,○,その他専門店［雑貨］（従業員）,・新規に出店した店が非常に好調であることから、まだまだ開拓できていない客層の店は、需要があると思う。
,,○,その他小売［ショッピングセンター］（統括）,・物販店の動きに着目すると、少し潮目が変わった感じがする。世間一般に気持ちが上昇方向であるように感じる。
,東京都,○,高級レストラン（支配人）,・今月に入り中国からの客も来店し始め、４月以降期待が持てる。
,,○,一般レストラン（経営者）,・新政権になり、アベノミクスが浸透してきて景気も少しずつ上向いてきたような気がする。道路も混んできており、平日でも客が結構入るようになっている。今後、少しずつ良くなるのではないかと思う。
,,○,一般レストラン（経営者）,・円安、株価上昇もあり、テレビ等の影響もあって景気が少しずつ良くなっているようにいわれているため、少しずつデフレを脱却して、景気が良くなってくると思う。不動産、建築等が良くなってくれば、飲食店も良くなっていくような気がする。
