Ⅱ．景気の先行きに対する判断理由,,,,
,,□,一般小売店［贈答品］（経営者）,・当店の主な客層は、地元の中小企業であり、中間層である。客の間ではまだ景気の回復感はなく、様子見の状況である。
,,□,一般小売店［果物］（店員）,・３か月ほどでは変わらない。
,,□,百貨店（売場主任）,・婦人物等の日常商品はあまり変わっていないため、今の好調は一過性であり、夏までこの好調が続くとは感じられない。
,,□,百貨店（経理担当）,・回復しつつある品目もあるが、全体的には、景気回復の動きは感じられない。
,,□,百貨店（経理担当）,・来客数、売上共に厳しい状態が続いているが、今月開催した宝石・時計等の展示会では、今までよりも良い動きが出ている。今後に期待したい。
,,□,百貨店（販売担当）,・客の様子を見ると、購買意欲はやや改善した印象もあるが、高級衣料品を販売しているためか、結果には出ていない。
,,□,百貨店（販売担当）,・季節が変わり、購買意欲は感じられる。しかし、値上げなどもあって、状況は簡単には変わらない。
,,□,スーパー（店長）,・製造業の景気回復は、食品等の購買回復にはすぐにはつながらない。毎日の食品に対しては節約が常態化しており、回復する兆しは見えない。
,,□,スーパー（店長）,・円安によって、今後はガソリン以外でも値上げが検討されている。それに伴い、低価格志向は一層強くなり、一部の商品の単価は下がってくる。それをカバーするほどの買上点数もない。今後も、色々な物の値上がりによって、大きく左右される。
,,□,スーパー（店長）,・円安によって、輸入食品やそれを原料とする物の値上がりが予測され、消費者の買い控えと売上の減少が予測される。
,,□,スーパー（店員）,・現状を見ると、良くなる要因はない。消費税増税を控えて、必要な物しか買われない状況になっている。
,,□,スーパー（店員）,・大豆商品などの値上がりに伴う価格転嫁を実施し始めてから数日が経つが、この影響がどこまで広がるか、少し様子見が必要である。
,,□,スーパー（店員）,・このところ、単価は同じように推移しており、良くなる要素がない。
,,□,コンビニ（エリア担当）,・売上の前年割れは、当面継続する。
,,□,コンビニ（エリア担当）,・単価が伸びていない。経済状況に明るい兆しは見られるが、まだ明確ではないため、様子見しているようである。今後、夏の暑さとボーナスの支給状況次第では、変動がある。
,,□,コンビニ（エリア担当）,・悪い状態は、今後も続く。ただし、単価は低下しているが、一部の店では来客数が回復しているため、このままではない。しかし、良くなる要素もないため、今のまま悪くなる。
,,□,コンビニ（商品開発担当）,・政権交代後、景気回復への期待や株価上昇などを通じて好転している様子が見られるが、来客数や販売量の増加には至っていない。好転の影響が及ぶのは、まだ先になる。
,,□,衣料品専門店（経営者）,・物価の上昇を日常生活で感じ始めると、洋服はよほどの目的がない限り、買い控えられる。
,,□,家電量販店（店員）,・映像家電の単価が低下している。高単価商品もあるが、良さを伝えにくい商品ばかりなので、伸び悩む。生活家電は底堅い。
,,□,家電量販店（店員）,・映像家電の売行きは、依然として良くない状況が続いている。今後に対する期待も薄い。
,,□,家電量販店（店員）,・物価が先行して上がっていくならば、景気は良くならない。
,,□,乗用車販売店（経営者）,・景気の高揚感はあるものの、具体的な形で表れてきていない。
,,□,乗用車販売店（経営者）,・良くも悪くもならない。
,,□,乗用車販売店（従業員）,・よほどのことがない限り、そこそこ維持できる。
,,□,乗用車販売店（従業員）,・今は景気回復に対する期待が膨らんでおり、以前と比べて客の雰囲気は違ってきている。しかし、新車の需要が大きく伸びるほどには感じられず、厳しい販売状況はまだまだ続く。
,,□,乗用車販売店（販売担当）,・在庫台数がほとんどないため、登録できない状態が続く。
,,□,乗用車販売店（総務担当）,・景気が良くなりそうな感覚はあるが、実際に給与所得の増加などに結び付かない限り、継続的な消費行動にはつながらない。
,,□,乗用車販売店（経理担当）,・給与が増えて消費に回れば、景気回復も感じられるが、まだそのような状況からはほど遠い。
,,□,その他小売［ショッピングセンター］（経理担当）,・売上は、前年同月比で1.1％減少している。来客数は、前年同月比で1.5％減少している。
,,□,スナック（経営者）,・アベノミクスの効果は、いつまで続くのか。株高で喜んでいる客が多いなか、財布のひもはどこまで緩むのか。皆が慎重であるため、期待しても実際にはどうなるか、といった感じである。
,,□,スナック（経営者）,・所得に反映されるまでには時間が掛かるため、景気はなかなか良くならない。ただし、ボーナスは増えることが期待され、マインドだけでも上向きになれば、繁華街はにぎわうのではないか。
,,□,観光型ホテル（経営者）,・アベノミクス、株高や、物が売れ始めたというニュースが流れることは良いことであるが、輸入インフレに伴う原材料価格の上昇分を販売価格に転嫁できるとは限らない。一進一退の状況が続く。景況感は変わらない。
,,□,都市型ホテル（従業員）,・予約数は変わらない。
,,□,都市型ホテル（支配人）,・様子見が続く。宴会需要が増えてくるかどうか、懸念される。
,,□,旅行代理店（従業員）,・大手企業では、ボーナスがほぼ満額で支給されるとのことであるため、その一部が旅行に回ってくる。
,,□,タクシー運転手,・年末以降、少しずつ良くなっている実感が、売上にも表れてきている。客からも、今まで認められなかった経費が少しずつ認められてきていると聞く。景気は上向いていると実感しており、このまま推移していく。
,,□,タクシー運転手,・長い間、同じような状況が続いている。人事異動が前年よりも多いという話題をよく聞くので、良くなることに期待したい。
,,□,タクシー運転手,・まだ、それほど良くならない。
,,□,通信会社（企画担当）,・新築の客が増えており、改善方向にある。ただし、全体的に見ると、良くなるとまではいかない。
,,□,テーマパーク（経営企画担当）,・日本経済は良くなってきているとの印象はあるが、実感できるほどではない。
,,□,観光名所（案内係）,・物の値上がりが、非常に多くなる。その影響が、必ず出てくる。
,,□,ゴルフ場（企画担当）,・２か月先の予約は、前年と比べても好調である。今後２、３か月間はゴルフシーズンに入るため、今の好調は続く。
,,□,美容室（経営者）,・例年ならば３月は寒く、客の出足は悪いが、今年の３月の売上は増加している。このまま４、５月も良くなる。
,,□,設計事務所（経営者）,・案件が少ない状態は、まだ続いている。純粋な設計の仕事ではない設計関連の仕事でも、選ばざるを得ない。
,,□,その他住宅［不動産賃貸及び売買］（経営者）,・地方が景気回復を実感できるまでには、まだまだ時間が掛かる。
,,▲,商店街（代表者）,・今は年度末で忙しいが、３か月先はそれほど動く状態にはならない。
,,▲,一般小売店［時計］（経営者）,・円安によって生活必需品の価格が上昇しているため、景気は良くならない。
,,▲,百貨店（営業企画担当）,・４月には大型ショッピングセンターのオープンが控えており、競争は激化する。また、桜の開花が早まったことで、花見需要の前倒しが考えられるため、来月以降は厳しい状況になる。
,,▲,スーパー（経営者）,・小規模小売店や飲食店では、悪い状態がずっと続いている。徐々に悪くなっていく。
,,▲,スーパー（販売促進担当）,・例年と同じイベントを開催しても、前年並みの数字は作れていない。目を引く新しい商品企画が必要である。来月は近郊に大型総合スーパーが出店するため、数字の伸びは期待できない。
,,▲,コンビニ（エリア担当）,・政府からの呼び掛けに応じて賃上げするなど、当業界の景気は良いと思われているが、実際には過当競争下にある。そのため、新店の売上は非常に厳しく、既存店では将来に対する不安をぬぐえない。
,,▲,乗用車販売店（経営者）,・軽自動車は確かに売れているが、４月以降は新型車などの起爆剤も特になく、低調に推移する。
,,▲,乗用車販売店（従業員）,・色々な景気対策によって、先々は良くなる印象を持っている。
,,▲,乗用車販売店（従業員）,・例年と同様に、４月からは市場は縮小し、販売台数は大幅に減少する。新型車等の導入も当分なく、厳しい状態になると見込まれる。
,,▲,乗用車販売店（従業員）,・物価が上がると、まず車の維持費を安くしようとする人が多い。そのため、新車に買換えず、車検を受けて乗り続けたり、普段の点検を受けない人も増えてきている。実際に、今まで入庫していた客が、価格を理由に安い店に動き始めている。こうした状況が続くと、しばらくは厳しいのではないか。
,,▲,その他専門店［貴金属］（店長）,・現時点では、消費は大きく伸びておらず、景気回復の実感はまだない。消費の改善には、まだ時間が掛かる。
,,▲,一般レストラン（経営者）,・政治と円安に対する不安から、支出を控える人が多いように見える。
,,▲,観光型ホテル（販売担当）,・景気は上向きと言われるが、一部の業種に限られたものであり、サービス業にはもう少し後に影響が出てくるのではないか。ただし、必ずしも良い影響とは限らない。実際、今後３か月間の収入予想は、前年同月比を下回っており、非常に厳しい。
,,▲,通信会社（サービス担当）,・引っ越しのピークは過ぎるため、販売量はそれほど伸びない。
,,▲,通信会社（営業担当）,・電気・ガスなど生活関連の値上げがあるため、今後の生活には不安定な要素が多く、景気は簡単には回復しない。
,,▲,通信会社（営業担当）,・全体的には、販売量も減少傾向である。
,,▲,テーマパーク（職員）,・周囲の土産物屋や観光施設の様子を見ると、やや悪くなる。
,,▲,パチンコ店（経営者）,・業界全体の低価格化が進んでいるため、今後はやや悪くなる。
,,▲,理美容室（経営者）,・客との会話では、株価は上昇しているが給与は増えておらず、生活は良くなっていないと聞く。
,,▲,美容室（経営者）,・３か月後はイベントも少ないため、レジャーや美容院を控える人が多い。
,,▲,美容室（経営者）,・景気が良くなるまでには、まだまだ時間が掛かる。
,,▲,その他サービス［介護サービス］（職員）,・大手の福祉用具貸与業者が、新商品の導入に際して、価格攻勢を仕掛けてきている。価格の下落が懸念される。
,,▲,住宅販売会社（経営者）,・消費税増税の問題がネックとなり、やや悪くなる。
,,▲,その他住宅［室内装飾業］（経営者）,・年度末需要が終わったが、見積依頼などの引き合いはほとんどない。
,,×,その他専門店［雑貨］（店員）,・新規大型店のオープンが目前であり、客は当面の間そちらに流れる。販売量、売上など、全て悪くなる。
,,×,理容室（経営者）,・マスコミは景気が良いことを言うが、まだ良くなるとは思えない。
"企業
動向
関連

(東海)",,◎,－,－
,,○,食料品製造業（経営企画担当）,・株高は、企業収益を押し上げる効果がある。これまでの減損によって苦しんできた反動から、今後は一挙に上昇気運が高まる。しかし、円安は今後、原材料や動燃費の高騰につながる可能性があり、今後も注視していく必要がある。
,,○,パルプ・紙・紙加工品製造業（総務担当）,・３月の景気は予想よりも悪いが、今後の景気は、円安や原材料値上げ等の要因があっても、良くなる方向に向かう。
,,○,化学工業（企画担当）,・政権に対する期待から、円安、株高が進む。また、米国の景気も堅調に推移していくことが予測される。欧州の債務危機も、危険水域を脱したと見受けられる。懸念材料としてはキプロスショックがあるが、影響は少ないと予測される。
,,○,化学工業（人事担当）,・一部の企業では、賃上げが実施される。ボーナス水準も少し改善するため、その影響も出てくる。
,,○,一般機械器具製造業（経理担当）,・企業の開発や試作案件等の予算は、更に増加している。そのため、今後は良くなる。
,,○,電気機械器具製造業,・全体的な雰囲気もあるが、情報インフラ構築のための政府予算が投入される動きがあるため、やや良くなる。
,,○,電気機械器具製造業（企画担当）,・欧州や中国などで不安要素はあるが、国内政治は安定しているし、今後も円安、株高基調が続けば、国内消費や輸出企業の業績改善も期待できる。
,,○,輸送用機械器具製造業（品質管理担当）,・生産計画上は、しばらく上向き傾向が続く。
,,○,輸送用機械器具製造業（総務経理担当）,・円安がこのまま続き、90円台で定着すると、輸出は堅調に推移する。
,,○,建設業（経営者）,・アベノミクス効果が、着実に出ている、ただし、キプロス問題など懸念事項もある。
,,○,輸送業（経営者）,・円安で輸入物量は伸びていないが、内需拡大に応じた荷動きの活性化が期待できる。
,,○,輸送業（エリア担当）,・株高、円安が進めば、輸出企業が活気付く。
,,○,輸送業（エリア担当）,・トレーラー等の車両の搬送が、非常に多くなっている。それと共に、他の荷動きも少しずつ良くなってきている。
,,○,輸送業（エリア担当）,・通販による荷物量の増加により、到着量は今後も一層増加すると予想し、計画している。
,,○,通信会社（法人営業担当）,・政府と日銀が一体となって、インフレターゲットの２％目標に向けて、あらゆる政策を実施しようという意気込みが見える。大手自動車メーカーも、売上目標を上げている。また、景気指標も景気の上向きを示している。地価も下げ止まり傾向にある。
,,○,金融業（法人営業担当）,・原油や原材料のコスト増などを意識する取引先の製造業が多いものの、先行きの受注量、販売量の増加に期待する意見が多い。
,,○,不動産業（開発担当）,・しばらくは、現状の動きが継続すると見込まれる。
,,○,行政書士,・貨物の動きが出てきそうである。
,,○,その他サービス業［ソフト開発］（社員）,・当面は、各企業の投資が続く。
,,○,その他サービス業［広告印刷］（従業員）,・問い合わせや見積が増えてきたため、多少良くなるのではないか。
,,□,紙加工品［段ボール］製造業（経営者）,・継続的に伸びる新規品は少ない。新規品が増加しても、価格競争が厳しいため、利益はあまり望めない。全体的に、製品価格は下がる傾向にある。
,,□,"出版・印刷・同関連産業（経営者）
",・年度初めの一般消費が不調であるため、夏場に向けての期待も薄い。
,,□,窯業・土石製品製造業（社員）,・自動車関連の取引先は堅調であるが、電子部品関連が全く不透明であり、回復する兆しは見えない。
,,□,金属製品製造業（従業員）,・金属材料の値上げは待ったなしであり、利益の圧迫につながる懸念が強い。
,,□,一般機械器具製造業（営業担当）,・円安で価格競争力は回復しているが、欧州の債務危機もあり、海外ユーザーは新規設備投資に慎重である様子がうかがえる。購入意欲はあり、引き合い件数も多いが、実際に発注する段階になると、待ったが掛かるケースが増えている。
,,□,電気機械器具製造業（営業担当）,・為替相場の先行きが不透明である。
,,□,建設業（営業担当）,・検査・清掃等の産業では、相互の連帯が鍵になってくるため、一年を通しての景気の変化を確かめる必要がある。
,,□,輸送業（従業員）,・政府が期待している物価高は、消費者は歓迎していない。しかし、消費税増税が決まっており、高額品を中心に駆け込み需要があるのではないか。
,,□,輸送業（エリア担当）,・サラリーマンにとって一番の息抜きの場である居酒屋での会合数が減っており、人々は外出せず消費していない。このような動きを見る限り、財布のひもはまだ固く、景気が上向くのはまだ先である。
,,□,金融業（従業員）,・自動車関連事業の中でも、部署や製品によって、繁閑に差があり、良くなるとも悪くなるともいえない。
,,□,金融業（企画担当）,・円安の動きが一服しており、現状は調整局面にある。一層の円安、株高が見られない限り、景気は本格的に良くなっていかない。
,,□,不動産業（管理担当）,・欧州の債務危機が再燃しているため、先行きは明るくない。もうしばらく様子を見たい。
,,□,広告代理店（制作担当）,・新年度の広告予算を増やさない企業が多々ある様子であり、まだ先が読めない。景気の回復もあまり期待できない。
,,□,新聞販売店［広告］（店主）,・どの新聞も購読しないという家庭が、徐々に増えてきている。賃貸住宅での購読率の低下が目立つ。
,,□,公認会計士,・アベノミクスの中期的効果が不明である。円安によって原材料等の値上がりは見られるが、中小企業の従業員の給与の上昇は期待できない。
,,□,経営コンサルタント,・富裕層を中心とする町では、景気は上向きである。しかし、庶民が多く住む地域では、アベノミクスの効果はまだ及んでいない。当面は横ばいである。
,,□,会計事務所（職員）,・中小企業では、今までのマイナスの埋め合わせが急務であるが、短期間ではなかなか実現できそうにない。少なくとも１、２年の期間を要するため、従業員には景気回復の実感は出てこない。
,,□,会計事務所（社会保険労務士）,・年度末で一時的に仕事が集中するかもしれないが、例年のことである。また、例年ピークを過ぎると、反動がある。建設関係では、消費税増税前に着工する動きが一部に見られるが、これも継続するとは言い難い。
,,□,その他非製造業［ソフト開発］（経営者）,・円安によって一時的に利益が出ても、仕事が発生しなければ経済は良くならない。新製品を世に問うしかなく、新製品の開発が一層求められている。少し経つと、円高になっていく。
,,▲,印刷業（営業担当）,・今のところ景気が良くなる材料はなく、このまま悪くなる。
,,▲,窯業・土石製品製造業（経理担当）,・新設住宅着工件数が減少している。
,,▲,金属製品製造業（経営者）,・引き合いが減少している。景気拡大の期待感だけが先行している。
,,▲,電気機械器具製造業（経営者）,・円安に伴う受注は考えられるが、素材等の高騰や現在の受注価格を考えた場合、決して良くならない。
,,▲,不動産業（経営者）,・中小企業金融円滑化法の終了後に、中小企業の不良債権が直ちに健全化するとは考えにくい。不動産等を安値で早期売買することにより、案件が増加しても、実体経済は低迷しそうである。
,,×,鉄鋼業（経営者）,・大手企業は景気回復への期待も含めて良くなっているが、中小零細企業の仕事量はまだ増えていない。それどころか、現状では目先の受注も見積も少なく、全体量は減少している。中小零細企業への直接的な受発注は、現在も２、３か月先も全く見えていない。
,,×,電気機械器具製造業（経営者）,・当業界では、取引先が２、３か月後に設備投資を増やすとは思えない。
"雇用
関連

(東海)",,◎,人材派遣会社（社員）,・正社員採用の求人案件が増加傾向にあり、企業の採用意欲は高まっている。
,,◎,人材派遣会社（営業担当）,・円安が継続することによって、輸出産業の業績に弾みがつく。株価も上昇していくことで、消費者心理にも影響し、消費は上向いてくる。
,,◎,人材派遣会社（営業担当）,・アベノミクス効果は、まだ継続する。
,,◎,職業安定所（職員）,・新規求職者数は落ち着いており、求人は増加傾向が続いている。
,,○,人材派遣会社（経営企画）,・新年度に入り、新規予算によって、取引先の開発活動が活発化すると期待される。
,,○,人材派遣会社（営業担当）,・まだまだ時間は掛かると思うが、政府の経済政策に期待している。
,,○,アウトソーシング企業（エリア担当）,・円安効果で、自動車の輸出も増加に転じる。
,,○,職業安定所（職員）,・前年同月比でみると、全産業で、求人数は平均的に増えている。製造業の求人は伸び悩んでいるが、景気はやや良くなってくる。
,,○,学校［専門学校］（就職担当）,・受講生の語学資格、検定スキルを生かしての就職は、前年よりも芳しくない。しかし、業種に固執しなければ、採用されている。雇用全体の裾野は、広がってきている印象である。
,,□,人材派遣会社（経営者）,・求人を出しているが、求職者は熱心ではないことがうかがえる。当社は年齢の高い層が多いが、取引先からは嫌われてしまうため、採用を断ることもある。
,,□,新聞社［求人広告］（営業担当）,・４月以降の動きは、まだ鈍い。
,,□,職業安定所（職員）,・太陽光発電などのエコロジー関連と、付随する各種工事では、人手不足になっている。アプリケーション・プログラム開発を除く設計開発エンジニアでは、業務が減少している。また、休業を検討している企業もあるなど、業種・産業によってばらつきがある。
,,□,職業安定所（職員）,・円安などの政策効果が、地元の中小企業には反映されていない。インフレを志向する政策のデメリットを危惧する声も多く、景気は変わらないかやや悪くなる。
