Ⅱ．景気の先行きに対する判断理由,,,,
,,○,化学工業（管理担当）,・アベノミクス効果による円安で輸出量が増加するほか、賃上げで消費も増加する。
,,○,プラスチック製品製造業（経営者）,・新規案件が出てきているので、順調に進めば良くなる。
,,○,金属製品製造業（経営者）,・全体的に良い方向に向かっているが、今のところ動きは変わっていない。
,,○,一般機械器具製造業（経営者）,・小口の受注が順調であるため、この推移が続けば大口の受注にも期待できる。
,,○,電気機械器具製造業（経営者）,・製造業の景況感は悪くない感はあるが、非製造業ほど急速には良くならず、２～３か月のうちに良くなってくる。
,,○,建設業（経営者）,・政府による金融政策に期待する。
,,○,建設業（経営者）,・例年、年度末以降は受注が減少するが、今年は消費税問題や再生可能エネルギーの固定価格買取制度などが追い風となる。
,,○,金融業［投資運用業］（代表）,・消費者が好景気に向かっていることを実感する。
,,○,不動産業（営業担当）,・賃貸相場は下がっているが、土地の相場は底を打って上がり始めている。そういった動きから、賃貸市場は悪いが、土地の売買状況は上向いている。
,,○,新聞販売店［広告］（店主）,・マンションや新築戸建物件などの不動産のほか、自動車関連の広告が目立って増えていて、月間の折込件数が増えている。
,,○,広告代理店（営業担当）,・ゴールデンウィークに向けて気温が上がれば、春夏物や行楽用品雑貨の動きも活発になってくる。
,,○,広告代理店（営業担当）,・広告の出稿を考えているという案件が増えてきている。
,,○,経営コンサルタント,・４月に入ると、季節的に小売業の売上が増える。
,,○,コピーサービス業（店長）,・大阪駅周辺の商業施設のオープンで再度活性化が促され、全体的な底上げが期待できる。ただし、立地などによる勝ち組、負け組がはっきりし始めるため、楽観視はできない。
,,○,その他非製造業［機械器具卸］（経営者）,・今年になってからは景気の底打ち感があるため、これからは上向いていく。
,,○,その他非製造業［衣服卸］（経営者）,・消費者のマインドが上向いていることが好調を下支えしているので、当面はこの状況が持続する。
,,○,その他非製造業［民間放送］（従業員）,・今年も猛暑となることが予想され、夏に関する産業のにぎわいが期待できる。
,,□,食料品製造業（経理担当）,・ベースアップや一時金の増額などの明るい話題はあるものの、景気回復の実感が全くない。
,,□,パルプ・紙・紙加工品製造業（経営者）,・大きく景気が変化し、製品の取引量が増加するとは思えない。
,,□,化学工業（企画担当）,・原料相場は種別による高低があり、全体的にはプラスマイナスゼロの状態である。今後はゴールデンウィークでの販売増が若干見込めるものの、全体的には大きな需要増につながるとは思えない。
,,□,一般機械器具製造業（設計担当）,・給与の増加が見込めない。
,,□,電気機械器具製造業（経営者）,・各国の政府、金融当局が金融緩和を進めているため、数か月という短期であれば海外経済の破綻は回避できる。円安についても、３か月ぐらいは崩れないと期待している。
,,□,電気機械器具製造業（営業担当）,・引き合い案件が減少しており、年度末以降の受注がみえてこない。
,,□,電気機械器具製造業（宣伝担当）,・今後の状況は、今とあまり変わらない。
,,□,電気機械器具製造業（営業担当）,・今の仕事が終われば、次の予定がない。
,,□,輸送用機械器具製造業（経理担当）,・海外受注といっても、国内企業の関連会社との取引がほとんどである。製造業を営む中小企業にとって、本来の意味での海外展開は今後欠かせないが、リスクが伴い、課題も山積している。
,,□,その他製造業［事務用品］（営業担当）,・受注量が増加する状況が今後も続く。
,,□,その他製造業［履物］（団体職員）,・アベノミクスの効果により、円安、株高傾向が続き、輸出企業を中心に景気回復が見込まれる。ただし、我々の業界では円安による原材料価格の高騰が続き、その値上がり分を価格に転嫁できずにいるのが現状である。
,,□,建設業（経営者）,・東日本大震災の本格復興や政権交代による公共工事の増加で、職人不足や賃金・建設資材価格の高騰が今後予想される。建設業は、景気回復後に企画や設計が増えてからの施工となり、回復がワンテンポ遅れるため、早い景気回復を望む。
,,□,輸送業（商品管理担当）,・４月から給料が上がるが、物価も上がるといわれているので、全体としては変わらない。
,,□,輸送業（営業所長）,・円安や株高が話題になっているが、景気に反映されるのはまだまだ先である。
,,□,通信業（管理担当）,・アベノミクスでしばらくは好調が続く。
,,□,金融業（営業担当）,・内需の拡大や景気の改善が今後望めるものの、物価の上昇が先行することが、どのように作用するかがかぎとなる。
,,□,司法書士,・期待感は高まるものの、具体的に景気の回復を実感できない状況であるため、当分の間は現状と変わらない。
,,□,その他サービス［自動車修理］（経営者）,・いろいろと手を打っているが、これという対策がないので難しい。
,,□,その他サービス業［店舗開発］（従業員）,・ＴＰＰへの交渉参加による効果は様々で、農林水産関連の生産は大幅に減るが、消費拡大は期待できる。いまだに未知の部分が多いが、全容がもう少し明らかになるにつれ、景気にも大きく変化が出てくる。
,,□,その他非製造業［電気業］（営業担当）,・実体経済が良くなっているとは思わない。
,,▲,食料品製造業（従業員）,・今後期待できる新製品もあり、そこそこ売れているが、既存の売上のベースとなる製品は他社との競合で廉価販売の対象となっており、売上が落ちている。既存品の売上に新商品分が加わればよいが、現状は新商品が既存品の売上を奪っているような状況である。デフレ脱却を図るような方策を業界全体で考えなければ、景気は良くならない。
,,▲,繊維工業（団体職員）,・前年末からの運送代の値上げ要請や、今後の電気料金の値上げなど、製造コストの増加要因があるなか、容易に価格転嫁はできず、先行きは不透明である。
,,▲,繊維工業（総務担当）,・まだまだこの円安の方向性は続く。
,,▲,繊維工業（総務担当）,・まだ景気の底上げ感が伝わってこない上に、加工代などが上がっている状況から考えて、それぞれの取引先で利益の確保が厳しい状態である。
,,▲,化学工業（経営者）,・円安による原材料の値上げに対し、それを販売価格にすぐには転嫁できない。
,,▲,窯業・土石製品製造業（経営者）,・ガラス瓶を作っているが、製品の動きが悪くなってきている。特に末端の消費者のニーズに左右されるほか、電気やガス料金の値上げを前にコストの削減も迫られているなど、景気が悪い方向に向かっている。
,,▲,金属製品製造業（営業担当）,・実需が出てくるのは少し先になる。
,,▲,電気機械器具製造業（企画担当）,・取扱商材の関係で、新年度の始まりは厳しい状況が予想される。一般的には新生活関連や、円安、株高による需要増で、良い方向へ向かう。
,,▲,輸送業（営業担当）,・燃料や材料の輸入価格が上がり、利益の出ない中小企業の工場は休業している所もある。
,,▲,輸送業（営業担当）,・繁忙期であるこの時期に売上が落ち込んでいるので、先行きは厳しい状況となる。
,,▲,広告代理店（営業担当）,・新年度の良い受注の話は聞こえてこない。しばらくは様子見の時期となる。
,,×,－,－
"雇用
関連

(近畿)",,◎,人材派遣会社（営業担当）,・アベノミクスに伴う円安による輸出企業の利益押し上げや、株高による富裕層の個人消費の活発化、日本銀行の新総裁の就任による量的緩和期待からの海外資金の流入など、景気回復の明るい材料が目白押しである。
,,◎,学校［大学］（就職担当）,・株価が上昇して、企業収益が改善されているため、求人数の増加が予想される。
,,○,人材派遣会社（経営者）,・円安効果か、今まで弱っていた家電メーカーのＩＴ部門が人集めをしており、４月から一段と良くなる環境がそろってきている。ただし、雇用情勢は改善されるとしても、相変わらず需給バランスが崩れているため、人集めには苦労する。
,,○,人材派遣会社（役員）,・正社員志向の流れは依然として大きなものがあるが、派遣を含め、事務系の求職者数も着実に伸びている。
,,○,人材派遣会社（支店長）,・このままの傾向がしばらくは続く。ただし、人材確保には苦労する。
,,○,アウトソーシング企業（社員）,・新年度から園児数が増える。
,,○,新聞社［求人広告］（管理担当）,・求人数が６か月以上にわたって上向いているほか、株価の上昇や円安の状況も続いており、悪くなる要素は今のところ見当たらない。
,,○,新聞社［求人広告］（担当者）,・４月にオープンする大規模事業が景気を押し上げており、関連の広告出稿も多い。
,,○,新聞社［求人広告］（営業担当）,・新年度の新聞に対する広告の申込状況をみると、年度始めは様子見状態であるが、引き合いの状況からいえば４月以降は徐々に回復してくる。
,,○,職業安定所（職員）,・求人数の増加傾向がみられるものの、主要産業別にみると製造業の動きがほかの産業に比べて非常に弱い。円安・株高などによる雇用面へのプラスの影響は見受けられない。
,,○,職業安定所（職員）,・円安や株価の上昇、景気回復の期待感もあり、輸出関連企業が今後緩やかに良くなっていく。
,,○,民間職業紹介機関（職員）,・建設労働者不足という問題はありながらも、公共事業の増加などの潜在的な圧力が強いため、当地の日雇い求人（多くは建設部門）も少しずつは増えていく方向となる。
,,○,民間職業紹介機関（大学担当）,・今後の経済は良い方向に向かっていく。
,,○,学校［大学］（就職担当）,・医療系大学の特性かもしれないが、就職志願者が倍増している。
,,□,新聞社［求人広告］（営業担当）,・経済全体が何か良くなるのではないかという兆しは感じるが、求人に直接影響するまでには少し時間がかかる。
,,□,職業安定所（職員）,・前月は株価の上昇や新政権による公共事業の増加への期待感からか、求人の動きが活発となっていたが、直近はその勢いが薄れてしまっている。採用数も伸びておらず、企業の採用意欲が高まっている感触もない。さらに、新規求職者数がやや増加傾向に転じているなど、今後の景気が良くなるかどうかは微妙な状況である。
,,□,職業安定所（職員）,・一時的な欠員補充のための求人が多い。
,,□,職業安定所（職員）,・政府は円安や株高効果で景気回復を宣伝しているが、この効果が雇用面に出てくるかどうかは、しばらく様子をみる必要がある。
,,▲,－,－
,,×,－,－
,,,,
　８．中国（地域別調査機関：（社）中国地方総合研究センター）,,,,
,,,,（－：回答が存在しない、＊：主だった回答等が存在しない）
分野,,景気の先行き判断,業種・職種,景気の先行きに対する判断理由
"家計
動向
関連

(中国)",,◎,乗用車販売店（副店長）,・自動車メーカーはおおむねボーナスが上昇するという報道により、その関連社員からの購入が見込める。
,,◎,自動車備品販売店（経営者）,・この調子で市場が盛り上がれば期待が持てる。給料とボーナスが上がれば景気も良くなり、気分だけでも明るくなる。
,,◎,その他飲食［サービスエリア内レストラン］（支配人）,・来客数、買上点数を見ると客の購買意欲が高くなっている。この雰囲気はボーナス時まで続く。
,,○,商店街（理事）,・日用品の売上に変化はないが、消費税増税前に買物をしようという気分になるかもしれない。
,,○,商店街（代表者）,・株高・円安で景気の見通しは明るい。しかし、可処分所得が上がって客が良いものを購入しようという気持ちになるにはしばらく時間がかかる。これが底であって欲しい、景気が上向いて欲しいと切に願っている。
,,○,商店街（代表者）,・当店に来る営業マンは皆、忙しくしている。肌で景気回復を感じているのがよくわかる。
,,○,一般小売店［茶］（経営者）,・新年度からの景気回復を期待している。
,,○,一般小売店［印章］（経営者）,・支店開設や会社設立に伴う注文があり、前向きな取組がなされている。
,,○,百貨店（営業担当）,・期待したほどは伸びなかったが、全体的に雰囲気が上向きつつあるように感じられるので、今後に期待したい。
,,○,百貨店（営業担当）,・「ひろしま菓子博」による来街者増を期待している。
,,○,百貨店（営業担当）,・高額商品が動き、販売量も安定しているので、この状況が続く。
,,○,百貨店（販売促進担当）,・３月の動きを見ると、若干ながら消費が上向きである。これからの夏商戦も主力のファッションの動きが持ち直してきているので、期待が持てる。
,,○,スーパー（店長）,・アベノミクスの影響で株価が上昇し、外的要因で明るい兆しがあり、少しずつ良くなる。
,,○,スーパー（店長）,・食料品や日用雑貨などの売上は伸びつつある。初夏に向かって期待できる。
,,○,スーパー（総務担当）,・安価な商品の購買が伸びる。
,,○,スーパー（販売担当）,・中高年の比較的ゆとりのある層は、消費が活発になってきているように感じるが、一方で学生などの低年齢層は、相変わらず消費活動が乏しい。ただ、総体的に見れば富裕層の消費が売上をけん引していくと予測している。
,,○,コンビニ（エリア担当）,・前月、今月ともに、来客数と売上は前年を上回っており、この調子でいけば、来月、再来月も前年比をクリアできる。ただし、ソーシャルメディア関係のカードがよく出ており、その売上がかなりの割合を占めている。将来のことを考えると、これでいいのかという気もする。
,,○,コンビニ（エリア担当）,・アベノミクスの影響で若干ではあるが、景気は良くなっていく。
,,○,コンビニ（地域ブロック長）,・世間の景気高揚感により、消費動向が活発になる。
,,○,コンビニ（副地域ブロック長）,・アベノミクスの影響により、消費者のマインド変化が期待でき、大手企業の給与増加により、消費意欲の向上が期待できる。円高による自動車業界の活性化で大手自動車メーカー関連企業の消費が増える。
,,○,衣料品専門店（経営者）,・株価が上がり、ニュース等でも明るい話題が増えると、消費者にも安心感が出て、購買意欲が増える。
,,○,衣料品専門店（地域ブロック長）,・アベノミクス効果を一般消費者が期待しており、景気が上向くことによって業績も改善する。
,,○,家電量販店（店長）,・太陽光発電システムの買取価格は低下するといわれるが、今や太陽光発電システムは商売の柱的な存在であり、販売目標達成に努めたい。エアコンの販売増加も目指す。
,,○,家電量販店（企画担当）,・株価上昇や円安など明るい話題が多いので、具体的な根拠はないもののやや良くなると思いたい。
,,○,乗用車販売店（店長）,・来場客数も多く、販売も順調に伸びている。
,,○,乗用車販売店（店長）,・客の動きは夏までは続く。客が買物をする動きが早い。
,,○,その他専門店［時計］（経営者）,・株価の上昇、地価の下げ止まりによる景気拡大が地方にも波及して欲しいし、景気上昇を信じたい。
,,○,その他専門店［布地］（経営者）,・アベノミクスがなんとなく本物になりつつあるようにみえる。
,,○,その他小売［ショッピングセンター］（支配人）,・株価や物価、賃金上昇の傾向が継続すれば、即効性はないが、消費に対する心理的効果が浸透し、徐々に景気上昇機運が高まる。
,,○,その他小売［ショッピングセンター］（運営担当）,・新政権への期待感があり、これまでの節約疲れも感じられるので、春以降は個人消費の伸びに期待できる。
,,○,一般レストラン（経営者）,・現在、動きが良くないのは、先に向いての期待感からの待機状態ではないかと思う。
,,○,一般レストラン（経営者）,・景気回復について前向きな情報が報道されることにより、個人消費では気分的に楽観視する状況は続く。
,,○,一般レストラン（外食事業担当）,・ＴＰＰ問題で、アメリカ産牛肉の30か月の輸入制限が変更されれば、牛肉の値段が下がる。市場でも明るい話題が聞かれるようになり、売りやすくなる。
,,○,スナック（経営者）,・アベノミクスによる効果が少しは効いてくる。
,,○,観光型ホテル（スタッフ）,・アベノミクス効果なのか、例年の来客数を上回っている。
,,○,観光型ホテル（支配人）,・宿泊、料飲、宴会部門とも、前年同期の来客数を超えている。ここ数年は行われていなかった新入社員の歓迎会等の予約も入ってきている。
,,○,都市型ホテル（スタッフ）,・広島では大型イベントが４月から始まるため、宿泊においてはファミリー客が少し増える。
,,○,都市型ホテル（総支配人）,・ゴールデンウィークの先行予約状況は各旅行会社とも好調に推移している。島根県においては出雲大社の大遷宮が５月から始まることも好要因となっている。
,,○,タクシー運転手,・客単価が伸びており、売上も前年に比べプラスになっている。
,,○,通信会社（企画担当）,・今年度最終四半期の上向きの感触は、新年度になっても継続していきそうである。
,,○,テーマパーク（業務担当）,・中国横断自動車道松江線開通に伴う道路利用者の増加が、来園者数にどのように影響するのか注視したい。山陰方面から山陽方面へのアクセスが容易になることから、中間にあたる本公園の来園者も増加することを期待する。
,,○,ゴルフ場（営業担当）,・速報値では前年同月より予約数が多い。
,,○,設計事務所（経営者）,・現在の購入意識の高さと積極さが続く。
,,○,設計事務所（経営者）,・公共事業への期待が大きいこと、また民間でも消費税増税までに契約をしておきたいといった動きが出てきている。
,,○,住宅販売会社（営業担当）,・時期的に需要が高まることもあるが、消費税増税の駆け込み需要を含め、当面は今の上向き傾向が続くと想定する。
,,○,住宅販売会社（販売担当）,・消費税増税に伴う駆け込み需要が見込まれる。ただし、購入側も予算には厳しくなると予想されるため、利益につながるかは不透明である。
,,□,商店街（代表者）,・暖かくなり通りを歩く人は増えているようだが、売上につながっていない。財布のひもが固いようで、来店者も必要以上の買物をしない。
,,□,商店街（代表者）,・新入学、就職シーズンの盛り上がりに欠け、当地域には円安株高の恩恵を受ける企業が少ない。
,,□,商店街（代表者）,・都会ではアベノミクス効果があるが、田舎への影響はまだ先である。
,,□,商店街（代表者）,・各種公共料金や輸入品の値上げにより、市場的には現状より良くなるとは考えにくい。
,,□,一般小売店［酒店］（経営者）,・ひな祭り、花見、歓送迎会などのイベントには期待しているが、景気は上向きではない。アベノミクス効果を期待したいが、まだまだ先の話のように思われる。
,,□,一般小売店［酒店］（経営者）,・景気回復の効果が本当に現れるのはまだまだ先だと思われ、この雰囲気がいつまで続くのか分からないので、景気は「変わらない」と判断した。
,,□,一般小売店［紙類］（経営者）,・来客数は増えるが、客単価は上がらない。
,,□,百貨店（売場担当）,・円安に振れることで、輸入中心の雑貨アイテムはコストが上がり、店側がより在庫効率を求められるようになり、投入在庫が減ると予測される。
,,□,百貨店（購買担当）,・現状で株価が上がったとしても、生活用品や食料品の値上げの影響でぜいたく品と言われる洋服や靴、バッグは買い控えられる。旅行やグルメなどには金を使うが、気候が良くなり客が外出して買物をしても、洋服を買うことは考えない。
,,□,百貨店（電算担当）,・前年比でわずかにプラスである。固定客がいる化粧品、新ブランドが順調な婦人靴が好調である。婦人衣料もわずかにプラスで、貴金属、呉服は２けたのプラスである。しかし、常設売場の生鮮三品が苦戦しており、競合店が多いので黒字化は厳しい。
,,□,百貨店（販売担当）,・一部ではあるが、高額商品の動きが以前より少しずつ良くなってきているので、今後に期待したい。
,,□,百貨店（営業推進担当）,・外部環境等を考えると、心理的には若干上向きではあるが、消費に直結するとは考えにくい。
,,□,スーパー（店長）,・２～３か月後に今より良くなる材料が見当たらない。
,,□,スーパー（店長）,・もっと長期的に見れば景気は回復するかもしれないが、地域の生活者の暮らしにはまだ変化がなく、２～３か月では何も変わらない。
,,□,スーパー（店長）,・消費税増税や商品の値上げ等があるので景気は変わらない。
,,□,スーパー（業務開発担当）,・競合店との厳しい価格競争や安い物しか売れないため収益が落ちている。安い価格で必要最小限を購入することが定着してしまい、なかなか販売増にならない。
,,□,スーパー（財務担当）,・消費者の低価格志向に対応するため、競合店との低価格競争とポイント販売促進がますます激しくなる。
,,□,スーパー（販売担当）,・客層が固定化しており、買上点数を伸ばすのは難しい。
