Ⅱ．景気の先行きに対する判断理由,,,,
,,□,テーマパーク（職員）,・施設内では、イベントや有料施設、飲食店、販売店が客の取り合いをしている。とにかく来場者が増えないことには、収益が増加傾向にはならない。
,,□,遊園地（経営者）,・来客数、売上共に、前年比では一進一退である。インバウンド効果も落ち着きつつあり、先行き不透明な印象が強い。
,,□,競艇場（職員）,・全国的に売上は横ばいで、大きな変化がみられない。
,,□,その他レジャー施設［イベントホール］（職員）,・催事全体としては、前年並みの稼働率を確保できると思うが、物販などの売行きには波があり、全体的に横ばいの状態が続くと予想される。
,,□,その他レジャー施設［球場］（経理担当）,・夏休み期間となり、８月にはプロ野球の公式戦が開催されるほか、人気グループのコンサートもあるので、前年並みの来場者を見込んでいる。
,,□,その他サービス［保険代理店］（経営者）,・多少の変化はあるとしても、先行き不透明感が強く、重苦しい経済環境となる。増収増益の企業についても、設備投資を控え、様子を見守る状況が続く。大企業は問題ないが、零細企業の間では倒産の動きが増えてくる。
,,□,その他サービス［マッサージ］（スタッフ）,・オイルマッサージは服を脱ぐため、暑い時期になると来客数が増える。２～３か月後はまだ秋であり、それほど変わらない。
,,□,その他サービス［ビデオ・ＣＤレンタル］（エリア担当）,・夏休みに入っても、リオデジャネイロオリンピックの開催などで、時間消費型サービスは売上アップがあまり期待できない。
,,□,住宅販売会社（経営者）,・当社は量販店ではないので、このところの状況が、周りの景気に改善によるものとは判断しにくい。他社の様子をみても、同じようには売上が伸びていないと感じる。
,,□,住宅販売会社（総務担当）,・先行きの不透明感はあるが、客自体は動いているため、大きな変化はない。
,,□,その他住宅［情報誌］（編集者）,・低金利やマイナス金利によって下支えされているものの、価格の上昇で実需層の動きが更に悪化する懸念がある。
,,▲,一般小売店［時計］（経営者）,・電池交換の価格に対して、人によって安い、高いなどと反応が異なる。持っている時計や、価値観によっても違うと思われるが、所得が平均的に上がっていないと感じる。
,,▲,一般小売店［珈琲］（経営者）,・中国からのインバウンド客は、中国政府の内需拡大策の発表があってから、減少が目立っている。大阪市内の商業地でも来客数の減少がみられる。
,,▲,一般小売店［精肉］（管理担当）,・参議院選挙が終わったが、何もなかったように変化がない。東京都知事選挙を控えているが、前向きには何も変わっておらず、雰囲気が重苦しいと感じる。世界的にテロの発生が増え、リオデジャネイロオリンピックもいろいろな問題を抱えてのスタートであり、活気が感じられない。
,,▲,一般小売店［花］（店長）,・涼しくなるまでは、売上、販売量は減る。
,,▲,一般小売店［酒］（社員）,・円高により、高所得者の購買意欲が下がっている。セールの打ち出しで回復を図っているが、特に目立った効果は出ていない。
,,▲,百貨店（営業担当）,・インバウンドによる高級品の購入は徐々に減少している。優良顧客においても、高額品の買上が増加する要素は見当たらない。
,,▲,百貨店（販売推進担当）,・百貨店では高額品の不振が長期にわたって続いている。さらに、インバウンド需要も、中国の関税引上げや円高などで日本離れが続き、その大半は欧州に流れている。また、若者の消費意欲は依然として低いため、急激に悪くなることはないが、良くなる兆候は全くない。
,,▲,百貨店（マネージャー）,・英国のＥＵ離脱問題、中国経済の失速といった外部環境の影響はあるが、国内の個人消費は慎重な姿勢が続く可能性が高い。中間層のモノに対する価値観が大きく変化してきている。また、徐々に高齢化が進んでいる団塊の世代の富裕層も、今後は消費意欲が減退していく傾向が強い。
,,▲,百貨店（マネージャー）,・参議院選挙後は株価が改善傾向にある一方、外食産業などを中心に、値下げを実施した企業の業績が回復する傾向がみられる。これまでは値上げに対する理解が浸透しかけていたが、大きく変化してきた。消費者の節約志向が強いという認識を企業も持ち始め、価格戦略を見直す動きが広がりつつある。今後、百貨店では厳しい商戦が避けられない。
,,▲,スーパー（店長）,・可処分所得が実質的に減っている状況で、日常の買物が増える要因が見当たらない。節約志向はまだまだ加速していくと予想される。
,,▲,スーパー（店長）,・前年に景気対策として実施されたプレミアム付商品券の影響が、８～９月に客単価の面で出てくる。また、円高、株安により、富裕層の間で買い控えが出てきている。
,,▲,スーパー（企画担当）,・農産物、水産物の不振が今後も続く一方、衣料品や住居関連ではカバーしきれないと予想される。
,,▲,スーパー（管理担当）,・すぐに悪化に向かうとは考えられないが、英国のＥＵ離脱問題を含めて、世界経済には良くないニュースが多く、景気の好転する材料が見当たらない。
,,▲,コンビニ（店長）,・お盆で出費がかさんだ影響で、買い控えが進む。
,,▲,コンビニ（店員）,・旅行シーズンが終われば、来客数もいつもどおりに落ち着く。
,,▲,家電量販店（経営者）,・客の財布のひもが非常に固い状況にある。所得の低下による将来不安が原因と感じる。
,,▲,家電量販店（企画担当）,・消費税率のアップが延期され、具体的な経済政策もみえてこないため、しばらくは景気の低迷が続くように感じる。
,,▲,乗用車販売店（経営者）,・世間では不確定要素が次々と増え、不安感が高まっている。
,,▲,乗用車販売店（経営者）,・参議院選挙は終わったが、落ち着くまでは時間がかかる。まだ東京都知事選挙が終わっていないため、政情が安定しているとは感じられず、消費が刺激される材料もない。それに伴い、今後しばらくは景気が落ち込む。
,,▲,住関連専門店（店長）,・毎年、夏のリゾートシーズンは受注が減るが、今年は例年よりも早めに受注案件が一段落したため、更に落ち込むことになる。今年に入って、春以降は受注が増えているものの、ただの前倒し受注の可能性があるため、楽観はできない。
,,▲,一般レストラン（経営者）,・商店街の人通りが少なく、残暑も厳しくなりそうなため、良くなるとは感じられない。
,,▲,一般レストラン（経理担当）,・為替の変動による、今後のインバウンドへの影響が読めない。大幅に良くなる要因も見当たらないため、現状のような、若干勢いの弱い傾向が続く。
,,▲,一般レストラン（店員）,・夏休みに入り、祖父母と来店する客が増えたが、２～３か月先は夏休みも終わり、普通の月に戻る。
,,▲,観光型ホテル（経営者）,・８月の先行予約は極端に悪くはないが、ここへきて伸び悩んでおり、９月は前年よりも大幅にダウンする見込みである。
,,▲,観光型旅館（管理担当）,・年金受給年齢が75歳まで引上げられる可能性があり、また、年金積立金の株式運用による損失が数兆円規模との話もあり、消費者の将来に対する不安から、消費は引き締められる。
,,▲,都市型ホテル（支配人）,・まだまだ景気回復とはいえない。為替や株価は不安定であり、企業業績も人件費の高騰や人材不足、食材の原価率アップなどが足を引っ張っている。景気回復にはもう少し時間がかかる。
,,▲,都市型ホテル（総務担当）,・国内観光客の節約志向が目立つ。大阪の中心部を避け、宿泊価格の低いホテルを求めて、大阪以外のホテルに宿泊する傾向がある。
,,▲,旅行代理店（支店長）,・これだけ頻繁にテロが起きているため、不穏な雰囲気があることは否めない。また、通常であれば、オリンピック後はその開催地への旅行が増える傾向にあるが、今回は期待できない。
,,▲,通信会社（企画担当）,・スマホゲームの台頭で、手の込んだゲームが売れにくい。
,,▲,ゴルフ場（支配人）,・災害などの影響なのか、客足が伸びない。
,,▲,美容室（店員）,・秋冬に向けて髪を伸ばしたり、ボリュームをアップする客が増えるため、来店周期が若干延びる。
,,▲,住宅販売会社（経営者）,・不動産市場では、しばらく供給過多の状態が続く。
,,▲,住宅販売会社（従業員）,・新築分譲マンションは、価格の高騰で投資やセカンドハウス需要が中心となるなど、住居としての需要が減ってきたため、販売状況は悪化してくる。
,,▲,その他住宅投資の動向を把握できる者［不動産仲介］（経営者）,・不動産価格が高騰しているため、金融機関の融資姿勢が変化し、取引件数は減少傾向となる。
,,×,衣料品専門店（経営者）,・お金が回っていない。政府の経済政策の失敗がボディーブローのように効いている。
,,×,衣料品専門店（経営者）,・３か月先も景気は悪くなる一方と予想される。良くなる気配がなく、ヒット商品も生み出せていないのが現状である。
,,×,乗用車販売店（経営者）,・同業者をみても暇な店舗が目立つ。客は必要がなければ、部品すら交換したがらない。予防整備なども、なかなか受け入れられないと感じる。
,,×,その他専門店［宝飾品］（販売担当）,・円高、株安が続き、コストも下がらないなど、販売環境が厳しい。
,,×,都市型ホテル（管理担当）,・８月以降、アジアからの予約は激減しており、特に団体客の決定率が悪化している。また、国内客ではブライダル関連が悪化しており、来客数が減少している。
,,×,競輪場（職員）,・例年悪くなる傾向にあり、この流れを覆す要素が見当たらない。
"企業
動向
関連

(近畿)",,◎,木材木製品製造業（経営者）,・受注量の増加に生産が追い付いていない。製品の増産体制を再構築し、受注量と供給量のギャップをなくすことで、売上、利益を増加させたい。
,,○,食料品製造業（営業担当）,・残暑が厳しくなる予想であるため、飲料水の売上はしばらく良い。
,,○,化学工業（企画担当）,・食品需要が低迷する季節が終わり、年末の最盛期に向かっていく。
,,○,プラスチック製品製造業（経営者）,・停滞気味であるが、受注量、販売量に月ごとの変化は少ない。新規案件の立ち上がりを加味すると、ややプラスの動きとなる。
,,○,金属製品製造業（営業担当）,・建築関係で少し動きが出てきたという報告が上がってきている。
,,○,輸送業（営業担当）,・例年７月に荷物が増えるのを見越した、社内のシステムや人員増加の準備がうまくいった。荷主からも高評価で、荷物がかなり増えている。
,,○,通信業（管理担当）,・レジャーなどが更に好調となる。
,,□,食料品製造業（従業員）,・秋になれば、食品関連の流れも変わってくると思うが、期待できる新製品もないので、先行きは厳しい状態が続く。
,,□,食料品製造業（経理担当）,・アベノミクスの手詰まり感があるなど、環境が良くならない。
,,□,繊維工業（団体職員）,・これまでと比べて大きな変化はなく、しばらくは消費税増税前の水準が続く。
,,□,繊維工業（総務担当）,・消費者の購買意欲が低下したまま、回復する兆しが全くみられない。
,,□,家具及び木材木製品製造業（営業担当）,・ここしばらくは状況に変化がない。
,,□,パルプ・紙・紙加工品製造業（経営者）,・顧客からは、季節要因以外の増産の情報がない。
,,□,出版・印刷・同関連産業（営業担当）,・１回の発注ロットが小さくなるなど、できるだけ在庫を持たず、必要部数だけを発注する傾向がより強くなってきている。
,,□,化学工業（経営者）,・ここ２年間、耐震工事に予算を取られていた分野は好調であるが、それ以外の分野では従来品の売上は大きく落ち込んでいる。新規案件の増加と相殺すると、今後もしばらくは景気に変化はない。
,,□,窯業・土石製品製造業（経営者）,・参議院選挙も終わったが、その結果として景気が上昇するようには思えない。アベノミクスの３年間の実績は、中小企業には影響が出ていない。
,,□,金属製品製造業（経営者）,・大きな変化はなく、横ばい状態が続いている。
,,□,金属製品製造業（管理担当）,・関西エリアでは建築物件情報が少なく、大手電機メーカー関連の今後の受注も不透明である。
,,□,一般機械器具製造業（経営者）,・石油関連の市場では、まだ長期の投資環境が良くない。受注残が多いので、短期的には景況も悪くないが、中期的に景気が良くなることはないと予想される。
,,□,一般機械器具製造業（設計担当）,・前月時点では悪くなると予想したが、受注量の減少はみられなかった。しばらくは現状が維持できそうである。
,,□,電気機械器具製造業（経営者）,・英国のＥＵ離脱問題による影響や、テロ、米国の大統領選挙など、世界の動きが不透明であるため、注意が必要である。　
,,□,電気機械器具製造業（営業担当）,・引き合い件数が増えてこないほか、いつもの取引先からの発注が減少している。
,,□,電気機械器具製造業（営業担当）,・周りでは景気の良い話が聞かれない。
,,□,電気機械器具製造業（宣伝担当）,・景気が良くなる要因がない。
,,□,輸送用機械器具製造業（経理担当）,・海外からの受注は少ないが、引き合いはあるため、今後に期待している。
,,□,建設業（経営者）,・８月もお盆があるため、９月以降にならなければ本格的に動かないかもしれない。
,,□,建設業（経営者）,・東京への一極集中や、熊本地震の復旧、復興で、監理技術者、技能労務者不足が深刻になると思われる。建設業界では二極化が進みつつある。
,,□,建設業（経営者）,・周りでは景気の良い話が聞かれない。
,,□,輸送業（商品管理担当）,・母の日や父の日などのイベントも終わり、年末まで大きく動くことはない。
,,□,金融業（営業担当）,・関東は東京オリンピック関連の動きもあり、条件は良いが、関西での景気回復は、もう少し時間が必要である。
,,□,金融業［投資運用業］（代表）,・もはや黒田バズーカには期待できない。政府主導で金融政策を実行してほしい。
,,□,新聞販売店［広告］（店主）,・折込収入は今が悪い状況なので、今よりも悪くなってほしくはないが、毎週２回入っていたスーパーのチラシが１回になったり、不動産関係の広告も減っているため、先行きは良くない。
,,□,広告代理店（営業担当）,・しばらくは大きな変動要素がない。
,,□,広告代理店（営業担当）,・今年に入って、売上は前年並みで推移している。
,,□,司法書士,・事件数は相変わらず少なく、案件もあまりないため、良くない状態が続く。
,,□,経営コンサルタント,・これまでの状況を踏まえて、政府も大型の経済対策を打ち出すようである。どのような影響が出てくるのかを見守りたい。
,,□,コピーサービス業（店長）,・やや低迷気味に推移するのではないかと予想する。問い合わせ件数も若干少なく、勢いがない。
,,□,その他サービス［自動車修理］（経営者）,・取引先も暇で、仕事が回ってこない。
,,□,その他サービス業［店舗開発］（従業員）,・中国人観光客の減少は否めないが、その一方で欧米のほか、タイやシンガポールなどの東南アジアからの観光客が増えている。　
,,□,その他非製造業［機械器具卸］（経営者）,・輸出関連の取引先が多いので、為替が110円まで上がれば景気が上向く可能性はあるが、105円から106円であれば下火になる可能性があり、心配である。
,,▲,繊維工業（総務担当）,・明るい材料に乏しく、外注先でも仕事量が減っている。
,,▲,電気機械器具製造業（経営者）,・国内ではどこからも良い話が聞かれない。ＡＳＥＡＮで利用が増えている当社製品は、実は日本企業の海外拠点からの注文が多く、その分だけ国内の仕事が減っている。ＥＵでは引き合いがあっても、関税が壁になっている。全体的にいえば、海外市場は成功しているものの、取引先の開拓には時間がかかる。
,,▲,その他製造業［履物］（団体職員）,・昨日、大手靴卸問屋が民事再生法の適用を申請し、その連鎖と思われる靴メーカーの適用申請も続いた。今後は業界全体への影響が懸念されるところである。
,,▲,不動産業（営業担当）,・米国の利上げの見送りで円高が進み、ますます神戸から事業所が撤退しているように感じる。今後もこの状態は続くと思われ、景気は緩やかに悪化していく。
,,▲,経営コンサルタント,・食品関連の業種は、例年８月と２月は需要が落ち込むため、余計に悪くなると心配している。
,,▲,その他非製造業［商社］（営業担当）,・開発中の新製品の販売が始まるころには、他社の競合品の価格が下がり、割高になると予想される。
,,×,化学工業（管理担当）,・円高、株安のほか、英国のＥＵ離脱問題によって先行きが不透明になっている。
,,×,その他非製造業［電気業］（営業担当）,・政府の景気対策が不透明である。
"雇用
関連

(近畿)",,◎,－,－
,,○,人材派遣会社（支店長）,・先の求人依頼の相談も増え始めている。
,,○,アウトソーシング企業（管理担当）,・８月に仕事が入る予定があるため、やや良くなる。
,,○,民間職業紹介機関（職員）,・熊本地震の復旧工事関連の日雇い求人が、いくらか出始めているとの声が、建設下請業者や日雇い労働者から聞こえてきている。
,,□,人材派遣会社（経営者）,・９月以降、下半期は例年よりも落ち着いた動きとなり、政府の補正予算の編成次第では８月下旬ごろから動きが活発になってくる。
,,□,人材派遣会社（営業担当）,・10月の行楽シーズンになれば、観光やホテル業界などで求人が出てきそうだが、求職者の動きを刺激するほどではない。
,,□,人材派遣会社（支店長）,・英国のＥＵ離脱問題やリオデジャネイロオリンピック、東京都知事選挙など、先行きは混とんとしており、しばらくはあまり期待できない。
,,□,新聞社［求人広告］（管理担当）,・前月は英国のＥＵ離脱問題による景気への大きな懸念から、悲観的な回答になった。今月になって、今のところは極端な株価下落や円高もみられず、求人数も安定しているため、２～３か月は景気に大きな変化はないと予想している。
,,□,新聞社［求人広告］（担当者）,・リオデジャネイロオリンピックと、その後の東京オリンピックに向けて、社会全体の機運がどうなるかを注視したい。
,,□,新聞社［求人広告］（営業担当）,・インバウンドの中心が団体客から個人客に移行してきており、爆買い現象も落ち着いている。しばらくはこの状況が続いた後、2019年のラグビーワールドカップ、2020年の東京オリンピック、2021年のワールドマスターズゲームに向かって上昇していくことが予想される。
,,□,職業安定所（職員）,・このところは求人数の増加が続いている一方、新規求職者数は減少が続いており、雇用・失業情勢は改善傾向で推移している。ただし、管内事業所への今後の展望に関するヒアリングでは、現状維持とする声が多い。
,,□,職業安定所（職員）,・影響があるとすれば円高によるもので、受注量が減少すると予想している。ただし、英国のＥＵ離脱問題の影響もないため、全体としては現状維持である。
,,□,民間職業紹介機関（営業担当）,・先行きには不確定要素があり、予測できない。
,,□,民間職業紹介機関（マネージャー）,・京都に関しては、大阪の大企業に求職者が流れる傾向がある。採用数という点では伸びが少なく、現状維持の可能性が高い。
,,□,学校［大学］（就職担当）,・気分的にも明るさが感じられない。
,,▲,人材派遣会社（役員）,・企業の採用意欲が前年に比べて後退している。求人も少ないことから、市場の縮小が続くような気がする。円高基調が早急に反転するとは思えず、今後は更に景気が悪化することが予想される。
,,▲,職業安定所（職員）,・企業にヒアリングしたところ、中国経済の減速や英国のＥＵ離脱問題による為替相場の変動などに伴い、先行きの不透明感が増している。
,,▲,民間職業紹介機関（営業担当）,・季節的な問題で、夏から秋にかけては求人が減る傾向となる。今年は企業からの要望が細かいため、人選に苦労している。
,,▲,民間職業紹介機関（営業担当）,・景気低迷の影響が徐々に出てくる。
,,▲,学校［大学］（就職担当）,・東京オリンピックのための設備投資は一段落しているが、結局のところ、関西までは波及してきていない。
,,×,－,－
,,,,
　８．中国（地域別調査機関：公益社団法人中国地方総合研究センター）,,,,
,,,,（－：回答が存在しない、＊：主だった回答等が存在しない）
分野,,景気の先行き判断,業種・職種,景気の先行きに対する判断理由
"家計
動向
関連

(中国)",,◎,通信会社（総務担当）,・大規模集合住宅への営業展開を進めているほか、加入料金を大幅に割り引くキャンペーンを予定しており、加入件数の増加が見込める。
,,◎,競艇場（職員）,・９月にＧ１競争の売上が見込める。
,,○,商店街（代表者）,・景気が良くなる話題がちらほら聞こえてくるようになった。
,,○,百貨店（人事担当）,・燃費不正問題の影響で止まっていた大手自動車メーカーの生産ラインが徐々に再稼動しており、少し期待できる。
,,○,スーパー（販売担当）,・夏休みに入って近くの観光地を訪れる人の数が増え、その影響で土日の来客数が増加しており、しばらくこの状況が続く。
