Ⅱ．景気の先行きに対する判断理由,,,,
,,▲,スーパー（商品開発担当）,・７月は売上が前年の99％、来客数は98％、購入点数が97.8％と、上期中で最も悪い数字となっている。競合店の出店が加速するなか、客足を取り戻す対策は思うように効果が出ず、苦戦はまだ続く。
,,▲,スーパー（営業企画）,・ここ数か月、売上には徐々に陰りが出ており、この傾向が一層強くなる。金融緩和政策追加の動きもあるが、かえって景気の停滞感を募らせるように感じられ、消費行動は慎重になる。
,,▲,スーパー（ブロック長）,・株価の下落や牛肉を代表とする食料品の値上げ等、マイナス要因が強い。
,,▲,コンビニ（企画担当）,・安定志向の人が増え、状況が良くなくても、こんなものかと肯定するムードである。変化の兆しがあるとすれば技術であり、新作スマートフォン向けゲームが国内から海外にまで広く拡大すれば、人の行き来が活性化する。
,,▲,コンビニ（エリア担当）,・客の購買意欲が回復する雰囲気が全くない。高い商品が全く売れなくなってきて、安売り商品も以前ほどは売上が伸びない。この先は更に悪くなる。
,,▲,コンビニ（店長）,・コンビニ以外のドラッグストア等、異業種との競合による影響が少しずつ出ており、その影響は今後も続く。
,,▲,衣料品専門店（販売企画担当）,・一時は売上も増加し、回復傾向とも見受けられたが、ここに来て、再び落ち込み続けている。
,,▲,乗用車販売店（従業員）,・新型車種の発表等、新車の販売増加につながる要素がなく、ここ２～３か月の状況から考えると、販売台数は更に落ち込む。
,,▲,一般レストラン（従業員）,・夏に消費した分、その先の財布のひもは固くなる。
,,▲,その他飲食［仕出し］（経営者）,・何らかの、これで景気が良くなると確信を持てるものがないと、なかなか景気は上向かない。
,,▲,都市型ホテル（従業員）,・予約数から先行きはやや悪くなる見込みである。
,,▲,都市型ホテル（経営者）,・不安定要素があり、景気の先行きが見通せない。
,,▲,都市型ホテル（支配人）,・競争の激化が見込まれる。
,,▲,都市型ホテル（経理担当）,・宿泊人員が伸び悩んでいる。
,,▲,パチンコ店（経営者）,・業界全体が薄利多売に移行しているため、競争が激化している。
,,▲,理美容室（経営者）,・客との話で、様々な物の値段が上がって給与は上がらないため、景気は段々悪くなる。
,,▲,美容室（経営者）,・客が高齢化してきているので、伸び悩んでいる。
,,▲,美容室（経営者）,・地域全体の景気が良くない。職場がなく、良くなる兆しがない。
,,▲,設計事務所（職員）,・輸出に関しては、基本的に円高が続きそうである。景気対策も具体的な時期等の話が聞かれず、安心材料がない。
,,▲,その他住宅［住宅管理］（経営者）,・材料の品質よりも価格に関心が向き、低価格の材料での受注が増えている。特に賃貸物件は低価格傾向となる。景気の良い話は聞かない。
,,×,一般小売店［酒類］（経営者）,・外食への支出をみると、財布のひもは固くなっている。外で夕食をとる時も、アルコール等の金のかかる飲料は控え、無料の水だけで済ませる客が増えている。
,,×,一般レストラン（経営者）,・世界の国々が急激な変化を迎えており、先行きの方向性が見えない。
,,×,理容室（経営者）,・周りでは、景気の良い話は、少しも出てこない。
,,×,住宅販売会社（経営者）,・先行きが不透明で、不安が広がっている。現在は不安要素が多く、先行きは一層悪くなる。
"企業
動向
関連

(東海)",,◎,－,－
,,○,電気機械器具製造業（企画担当）,・テロが続く等、国際社会情勢に不確定要素は残るものの、年末商戦に向けて、売上は徐々に伸びていく。
,,○,その他サービス業［ソフト開発］（社員）,・案件の１つが１年半かかる長期プロジェクトで、当面は新規案件を探す必要がない。
,,□,食料品製造業（営業担当）,・取引先の販売業や製造業では、来月以降の受注量、生産量共に例年以下で、人件費の問題から雇用の確保が難しくなるかもという声を多く聞く。残った人や企業には景気の変動はないが、職を失う人も多く出そうな状況である。
,,□,食料品製造業（経営企画担当）,・先行き不安からか、消費には勢いが欠けている。
,,□,パルプ・紙・紙加工品製造業（総務担当）,・例年は、需要が多くなる時期だが、天候不順や英国のＥＵ離脱問題等で、今年はあまり期待できず、景気は今と変わらず、あまり良くない。
,,□,化学工業（総務秘書）,・採用は売手市場の模様で、人手不足感があるということは、景気は悪くはない。しかし、所得格差は拡大しており、所得の低い層では景気が悪いと感じ、今後、社会が不安定にならないことを望む。今すぐに社会が不安定になることはないため、景気は横ばいである。
,,□,窯業・土石製品製造業（社員）,・新分野の製品はまだ伸びる可能性が高く、他の製品の売上が若干減少している分を、十分に補うことができる。
,,□,鉄鋼業（経営者）,・すぐに大型の物件や見積依頼があるわけではなく、夏場は落ち込む時期でもあるので、現状より上向く可能性は低い。
,,□,金属製品製造業（経営者）,・引き合いも減少しており、引き続き変わらない。
,,□,一般機械器具製造業（経理担当）,・受注状況に変動はない。
,,□,一般機械器具製造業（営業担当）,・円高が続くが販売価格を変更することはできないので、利益を確保できていない。米国の自動車部品製造者からの引き合いは多いが、親会社の都合で突然計画が中止や延期になることが増えている。
,,□,電気機械器具製造業（経営者）,・働く者としては、収入が増えたわけでもなく、アベノミクスの効果はさほど感じられないので、最終的に消費が増加するとは考えにくい。海外向けも、為替次第でどうなるかわからない。
,,□,輸送用機械器具製造業（品質管理担当）,・客先の生産計画では、横ばいの見通しである。
,,□,輸送用機械器具製造業（研修担当）,・受注量は増えているものの、熊本地震の振替的な要素が強く、今後も大幅な改善は見込めない。
,,□,輸送用機械器具製造業（総務経理担当）,・世界経済では、中国の景気減速や英国のＥＵ離脱問題等があるが、為替相場はいったん円高に向かったものの、円安方向に戻っているので、先行きも変わらない。
,,□,輸送用機械器具製造業（経理担当）,・円高の影響を受け、利益は引き続き低調な見込みである。
,,□,建設業（経営者）,・当地の主要産業である自動車産業では、円高に対する不安が現実となっている。現時点では大きな変化はないが、今後の消費者のマインドに、どのような影響があるかは未知数である。
,,□,輸送業（従業員）,・上昇していた原油価格がまた下降傾向となり、コスト面で物流業界には一服感がある。トラックは需要が多く、納車まで１年以上かかる状態である。バスは更に納車に時間を要し、業界によって景況感には差異がある。
,,□,輸送業（エリア担当）,・貿易関連の企業は、為替の動向を様子見である。
,,□,輸送業（エリア担当）,・主要荷主からは、明るい話が１つも聞こえてこない。
,,□,輸送業（エリア担当）,・今の日本経済は、購買意欲を刺激するような新製品が生み出せない。経済全体がこうした流れのなかで、起爆剤になるとすれば、政府主導による経済政策である。今のところそういう動きはみられないため、景気の先行きは、現状のままである。
,,□,通信会社（法人営業担当）,・28兆円の補正予算、電力会社の料金値下げ、有効求人倍率は全都道府県で１倍を超え、消費者物価指数が４か月連続で前年同月を下回る等、景気の上向き要因がどこまで個人消費を押し上げるかによる。英国のＥＵ離脱問題により為替や株価は、以前の水準に戻っているが、９月以降に離脱の動きが本格化するかは不透明である。
,,□,通信会社（法人営業担当）,・アベノミクスでは追加の経済対策が検討されているが、大企業から中小企業への浸透速度の問題なのか、取引先からは、なかなか景気の良い話は聞こえてこない。いつになったら経済対策の効果が、多くの企業や消費全体に広がるのかわからず、不安さえ感じる。
,,□,金融業（法人営業担当）,・地元自動車メーカーでは、当面の国内生産計画は前年並みであり、地域全体の生産も堅調に推移する。
,,□,金融業（企画担当）,・株式相場が好転しなくては、個人投資家の投資意欲も購買意欲も戻ってこない。
,,□,不動産業（用地仕入）,・景気を大きく左右する要因が見当たらない。
,,□,企業広告制作業（経営者）,・新作スマートフォン向けゲームが経済全体を押し上げるわけではない。一過性の社会現象に一喜一憂していても、ぜい弱な経済体制の本質は変わらない。関西の家電メーカーの例でも、再建は困難なことを印象づけられた。英国のＥＵ離脱問題の影響は、現段階ではみられないが、米国の大統領選挙の行方も不透明で、不安定要因が多い。テロ対策も打つ手を失っている。こうしたムードのなかでは、景気が良くなるはずはない。
,,□,広告代理店（制作担当）,・秋の商戦に向けて、特別な動きはまだなく、各企業とも様子をうかがっている状態である。
,,□,公認会計士,・政府の中小企業施策は、総花的で具体性を欠いており、中小企業の業績の実態を把握していない。
,,□,行政書士,・燃料価格が今年に入って下がっており、経営的には赤字の縮小が続いている。
,,□,会計事務所（職員）,・リオデジャネイロオリンピックや東京オリンピックに期待をしつつも世界経済が落ち着かない状況では希望が持てず、投資意欲も沸いてこない。
,,□,その他非製造業［ソフト開発］（経営者）,・景気の循環において、現在が底なのか更に下があるのか判断がしづらい。我が国の経済にとっては、１ドル100円程度ならば何とか対応できる範囲である。個々の企業としては新製品の開発が求められる。
,,▲,印刷業（営業担当）,・業種のためか、地方の事情なのか、周りも含めて景気に関する良い話は聞かない。
,,▲,化学工業（営業）,・原料価格が若干値上がりする見込みである。値上げ幅が小さく客への転嫁が厳しいため、７月と比べて収益が若干悪くなる。
,,▲,化学工業（人事担当）,・英国のＥＵ離脱問題の影響がどうなるか不明であるが、円高の進行やテロの懸念等、景気にとって悪い話ばかりでしばらく景気が良くなるとは思えない。
,,▲,金属製品製造業（従業員）,・今年度の仕事量に関しては、悲観的な声がよく聞かれる。
,,▲,電気機械器具製造業（営業担当）,・円高の影響が続く。
,,▲,輸送業（経営者）,・運転手や倉庫内作業員の不足が深刻である。多少の物量減では、必要な人手は変わらず、派遣人材の多用で大幅なコストアップが想定される。
,,▲,輸送業（エリア担当）,・人員不足を補うために、時給や外注単価を上げざるを得ないが、客からは適正な単価を得られる状況にはなっていない。
,,▲,金融業（従業員）,・自動車産業は現状もあまり良くないなかで、数か月後にも回復の見込みもなく、見通しはあまり良くない。
,,▲,新聞販売店［広告］（店主）,・客層の高齢化、若年層の購買力の低下、人材確保も困難なことから、先行きもやや悪くなる。
,,▲,会計事務所（社会保険労務士）,・客先の個人飲食店では、来客数、客単価共に下降気味である。ボーナスが支給されても、消費より貯蓄に回っている。
,,×,出版・印刷・同関連産業（代表）,・消費者と直接的に向き合っている客からは、先行きへの不安の声が強くなっている。将来への不安感がなくならない限り、見通しは暗い。
,,×,電気機械器具製造業（経営者）,・客先の業界では、監督機関による指導の影響で、設備投資が当社製品に関連する部分以外に流れるため、当社製品の出荷は減少する。
"雇用
関連

(東海)",,◎,人材派遣会社（支店長）,・契約開始の派遣労働者数と契約終了者数の差がプラスになっている。人材調達の環境が厳しくなっていることもあり、派遣先の意向で契約終了となるケースが前年より大幅に減っているため、稼働者数の増加に伴う売上増加は、しばらく続く。
,,○,人材派遣会社（営業担当）,・年度下期に向けて、転職希望者や求人も増えることによって、派遣市場は活発化してくる。
,,○,アウトソーシング企業（エリア担当）,・下期の生産体制を安定させるために、今から人材を確保し、採用した人材の定着率を上げようという動きがある。
,,○,職業安定所（職員）,・大規模な経済対策が予定されており、人手不足が厳しくなると見込まれる。
,,□,人材派遣会社（社員）,・この先の予約状況も良く、現状の好調さは変わらない。
,,□,人材派遣会社（営業担当）,・先行きにポジティブな材料が見当たらない。
,,□,新聞社［求人広告］（営業担当）,・変化する要因が見当たらない。
,,□,職業安定所（所長）,・ボーナス水準が前年より良くなったという企業はみられず、従業員の賃金等、待遇改善が進んでいないため、消費が活性化する材料が見受けられない。
,,□,職業安定所（職員）,・求人数、求職者数共に減少が続いている。
,,□,職業安定所（職員）,・求人、求職が悪化する要因は見当たらないが、今後、中国経済の減速や消費税増税の再延期等の影響が懸念される。
,,□,民間職業紹介機関（営業担当）,・雇用環境は好転する可能性はあるが、夏場を迎え10月転職を目指す人が増える時期であるため、先行きが見通しづらい。
,,□,民間職業紹介機関（窓口担当）,・足元の求人動向に変化はなく、人手不足の感が否めない。受注はあるが、業況が大きく上下する要因は考えにくい。
,,□,民間職業紹介機関（支社長）,・採用意欲も活発にみられ、求人数にあまり変化はないと見込まれる。
,,□,学校［専門学校］（就職担当）,・インターンシップに参加する学生が多い時期だが、前年以上の受け入れ企業、参加者数で、対象学年の拡大もみられる。
,,□,その他雇用［広告代理店］（求人広告担当）,・当分変化はない。
,,▲,人材派遣会社（営業担当）,・周りの製造業等の動きから、先行きの営業状況は不安定な見通しである。大手製造業の予算削減で影響を受ける企業は多い。徐々に他の製造業にも影響が広がり、２～３か月先には身の回りの景気は、現状よりやや悪くなる。
,,▲,新聞社［求人広告］（営業担当）,・参議院選挙も終わり、夏休みを挟んで少しは良くなるとの望みを持つが、良くなるための材料が少なすぎる。まずは、安心して金を使えるムード作りが必要である。
,,▲,職業安定所（職員）,・医療・介護分野では、慢性的な人手不足で引き続き求人が多いと考えられるが、製造業では、円高による影響が懸念される。
,,×,人材派遣会社（社員）,・慢性的な人材不足が続いているため、企業が予定した雇用を確保できず、生産性が低下する。
,,,,
　６．北陸（地域別調査機関：一般財団法人北陸経済研究所）,,,,
,,,,（－：回答が存在しない、＊：主だった回答等が存在しない）
分野,,景気の先行き判断,業種・職種,景気の先行きに対する判断理由
"家計
動向
関連

(北陸)",,◎,－,－
,,○,一般小売店［事務用品］（店員）,・季節商材の売上増が見込まれ、商談の引き合いが増え始める。
,,○,コンビニ（店舗管理）,・前年のプレミアム付商品券効果との対比差がなくなるため、前年比では良くなる方向である。
,,○,家電量販店（店長）,・前年は７月中旬から季節商材の売上ピークに入ったが、今年はピークが遅く８月度も伸びると見込まれる。オリンピック特需も緩やかではあるが、テレビ、レコーダーが売上を伸ばしているのでもう少し続く見込みである。
,,○,乗用車販売店（経営者）,・大手自動車メーカーの燃費不正問題が一段落したので、これからは軽自動車も含めて販売に対して動きが出ると考える。
,,○,乗用車販売店（従業員）,・月末から数週間、自社独自イベントの開催を予定しているので、来客数増加を期待している。
,,○,住関連専門店（役員）,・耐久消費財を扱う当社では、年間でも比較的動きがみられる時期に入ってくることと、来店数、販売数量が過去数か月は増加していることから、前向きな予測が立てられる。また、住宅着工件数などからも、これから動きが活発になると考えられる。
,,○,通信会社（営業担当）,・新型スマートフォンの発売を見込んで、総合的に販売数は増えるとみられる。
,,○,住宅販売会社（従業員）,・大型造成地の分譲が始まり、北陸新幹線延伸に向けての住宅需要が高まる。
,,□,商店街（代表者）,・大きな変化は期待できない。
,,□,一般小売店［精肉］（店長）,・ここ２～３か月の間に、集客が見込める商業施設がオープンする。それにより来客数は増えてくると思うが、今の状況では購買意欲がそれほど上がるとは思えないことから、差し引きであまり変わらないとみている。
,,□,百貨店（売場主任）,"・政府の経済対策で、2,200万人の低所得者を対象に１万５千円を給付し消費を喚起すると発表があり、経済の底上げを期待している。ただし、過去の実績から効果は日常の食料品などの日用品に限定され、百貨店が受ける恩恵は薄いと考える。"
,,□,百貨店（営業担当）,・個人消費は低迷していて、今後もプラスになる要因が無いことから変わらないと考える。
,,□,百貨店（営業担当）,・夏物衣料関係が猛暑で非常に売れているが、逆にメーカー側は生産を調整しており需要に供給が追いついていない。後半戦以降は苦戦が続きそうである。
,,□,スーパー（店長）,・この６～７月の流れをみても、この先で特に環境の変化も無いということを踏まえると、特に変わらないのではないかと考える。
,,□,スーパー（店長）,・現状のお中元や夏物商戦は今一つ売れていないのが実情であることから、これからのお盆商戦に期待している。また、来月からのオリンピック効果を期待している。
,,□,スーパー（総務担当）,・リオデジャネイロオリンピックがあることで、家庭内での食品の消費が増えるプラス要因はあるが、他は現状通りで推移するとみられる。
,,□,スーパー（店舗管理）,・前年のプレミアム付商品券などの影響を差し引いても、今年は競合店の出店があり、前年より来客数の増加は見込めない。
,,□,コンビニ（経営者）,・来客数の減少を客単価の上昇でかろうじてカバーしている。特に主力系の商品、お弁当やおにぎり、麺類が前年を割り込んでいる。それをカバーしているのが、暑さのせいかアイスクリームなどになっている。主力商品が現状で前年を割り込んでいる状況では、トータルの売上が上がっていくとは見込めず良い傾向ではない。
,,□,コンビニ（経営者）,・売上は、相変わらずイベント日の天候や気温に依存する状態であることから、売上の増減はあるとは思うが、そのほかの部分では大きな変化はみられない。
,,□,衣料品専門店（経営者）,・業種間で好不調があるのに加え、同業種でも好不調がある。また、大企業や役所にしか就職希望者が集まらず、今後、地方の小売はどうしたらいいか分からない。
,,□,家電量販店（店長）,・リオデジャネイロオリンピックによるテレビやブルーレイレコーダーの販売が先行した事で、年末までは変わらない状況が続きそうである。
,,□,乗用車販売店（役員）,・最近の受注状況は、計画分を確保しているので中間期末に期待している。
,,□,自動車備品販売店（役員）,・相対的に集客が落ちており、今年に入り変わらない状況。今後の不安要素である。
,,□,その他小売［ショッピングセンター］,・季節商材に期待したい。新製品、話題商品が見当たらず、厳しい状況が続きそうである。
,,□,高級レストラン（スタッフ）,・週末は観光客や個人の記念日などで賑わうが、平日の法人客の利用は、接待はもちろん会費制の会合も減る一方である。
,,□,一般レストラン（店長）,・観光入込客数と地方の飲食店、商店の景況感にはかい離があり、良くなっていく方向には考えにくい。
,,□,観光型旅館（スタッフ）,・７月以降の予約保有は、９月の92％以外の月は70～85％の保有となっている。北陸新幹線開業で予約が多かった前年と今年では大きく仕入れ環境は変化し、従来の様子に戻っている。また、九州ふっこう割の影響も出てきている。
,,□,都市型ホテル（スタッフ）,・８月の宿泊予約状況を見るとそこそこの予約が入っており、単価は下がると思われるが稼働は良く、今以上の落ち込みはないと考えられる。
,,□,旅行代理店（所長）,・特に大きな話題性がなく受注が伸びる要素が乏しい。
,,□,タクシー運転手,・観光客やビジネス客などで大きな伸びは期待できない。夏にお金を使い、財布のひもも少しずつ固くなると考えられる。
,,□,通信会社（営業担当）,・前年比で来客数はやや増えているが販売量は変わっていない。ボーナスの時期なので少し動きが出ることを期待したい。
,,□,通信会社（役員）,・８月のリオデジャネイロオリンピックを契機に、４Ｋや８Ｋなどの高解像度映像への関心が高まっていることから、多くの専門番組を有する放送サービスの契約が今後増加すると考えている。
,,□,通信会社（店舗統括）,・新機種発売の噂があるので期待したいが、大きな変化になるとは考えにくい。
,,□,通信会社（役員）,・ボーナスの時期で７月は好調であったが、４～５月の苦戦を考えると２～３か月先は楽観視できない。
