Ⅱ．景気の先行きに対する判断理由,,,,
,,▲,一般機械器具製造業（経営者）,・２～３か月後は受注が多少減少するという情報が入っている。
,,▲,輸送業（営業担当）,・猛暑となる予測だが、いまだに梅雨も明けず、天候不順が続いているため、夏物商材のエアコン、扇風機、飲料水等の輸送量が確保できるか心配である。
,,▲,通信業（経営者）,・仕事量が少ない。
,,▲,金融業（調査担当）,・当行の業況アンケート調査の見通しでは、４～６月期から景況感の更なる悪化を予想する企業が増えている。不安定な海外経済や為替の急変動など先行きの不透明感が増しており、慎重な見方をする企業が増加している。
,,▲,不動産業（経営者）,・若い客層のうち、収入の不安定な人が増えてきているようである。
,,×,出版・印刷・同関連産業（経営者）,・毎月のことだが、資金繰りが大変である。
,,×,電気機械器具製造業（経営者）,・前月と同様の状況である。
,,×,不動産業（管理担当）,・新築の建物管理受託もあったものの、既存取引先の管理コスト見直しの話を度々耳にするようになってきているので、減収が見込まれる。
"雇用
関連

(北関東)",,◎,＊,＊
,,○,人材派遣会社（経営者）,・公共事業や住宅、建築等は平均的に横ばいで、衣料や生鮮食料品なども、需給はほぼ横ばいだと思われる。生産関係は、来月お盆に入ると一部休みも予想される。電子関係は、新作スマートフォン向けゲームの影響で、携帯電話やスマートフォンの機種変更等の動きが出てくる。
,,○,人材派遣会社（管理担当）,・携帯電話のリペア等で検査業務派遣の増員を予測している。
,,□,人材派遣会社（社員）,・今のところ宿泊施設関係の稼働は、前年同月比で見ると落ちてはいるが、前年と同じくらいの稼働になる見通しである。年間契約ではなく１回ごとにお金をもらうような仕事もあるが、そちらも前年と変わらない見通しである。
,,□,人材派遣会社（営業担当）,・消費意欲が湧く材料が何もない。
,,□,人材派遣会社（支社長）,・求職者の動きは鈍く、稼働スタッフが動くことも少ない。動くにしても事情が絡むので汎用性はなく、マッチングするケースが少ないため、どうしても先付けオーダーを受注し、求職者の選択肢を広げるようなラインナップを完成させなくてはならない状態が続いている。必然的に当月での成果には結び付きにくい。
,,□,求人情報誌製作会社（経営者）,・景気が低迷したままなので、雇用も先行き不安定な状況が続く。
,,□,職業安定所（職員）,・業務量の減少で事業所を閉鎖するケースがやや増加しているため、求人が増加傾向といっても景気が良くなると楽観できない状況である。
,,□,職業安定所（職員）,・求人数は増加傾向を示しているが、円高や中国経済の影響など不安要素も多くあることから、変わらない。
,,▲,職業安定所（職員）,・人手不足感が強い産業においては、依然として人手不足が解消できず充足がなされないということで、求職数が減っている。良くなる要素があまり見つからない。好調な産業においても、人手不足感が深刻で人が集まらない状況で、企業のほうでも求人を手控えてくる動きがあるかと思う。
,,×,－,－
,,,,
　４．南関東（地域別調査機関：株式会社日本経済研究所）,,,,
,,,,（－：回答が存在しない、＊：主だった回答等が存在しない）
分野,,景気の先行き判断,業種・職種,景気の先行きに対する判断理由
"家計
動向
関連

(南関東)",,◎,スーパー（経営者）,・毎日の積み重ねにより、良くなる。
,東京都,◎,観光名所（職員）,・３か月後は秋の走りとなるが、当地は観光地のため秋はトップシーズンで、今月よりは良くなる(東京都)。
,東京都,○,一般小売店［家電］（経営者）,・英国のＥＵ離脱問題の影響から多少は回復してくると思われるため、期待している(東京都)。
,東京都,○,一般小売店［文房具］（経営者）,・法人客の商品購入はやや減少気味ではあるが、ここ数か月の個人客の購入額増加傾向や、８～９月は地域のイベントが活発に行われるため、景気はやや上向きになる(東京都)。
,,○,コンビニ（経営者）,・隣の空き地の建設工事が少しずつ始まるために、多少良くなるのではないか。
,,○,家電量販店（統括）,・金融政策と政府の経済対策により消費が高まると見ている。特に耐久消費財では、客単価や購買指数のアップが期待できる。
,,○,乗用車販売店（総務担当）,・決算や新車投入など好材料が豊富であり、客の動きがより活発化すると予想している。
,,○,その他専門店［ドラッグストア］（経営者）,・久々に新店をオープンするので、勢いに乗りたい。
,東京都,○,その他小売［雑貨卸］（経営者）,・売上と利益から判断している(東京都)。
,,○,高級レストラン（経営者）,・東京郊外の私鉄沿線駅というロケーションにある当店のような飲食店は、昼がマダムユース、夜がファミリーユースとなる。４月以降は前年並みの来客数、売上額であるが、客単価は若干上がっている。この数字では上向きとまでは言えないが、多少の期待はある。
,,○,一般レストラン（経営者）,・７～８月は年間を通して売上が落ち込むので、２～３か月先は少し良くなる。
,東京都,○,一般レストラン（経営者）,・インターネットという目に見えない存在が、新しいビジネスチャンスを作り、小さな商店街にも恩恵を少しずつ与えている。人件費削減にもつながり、先行きに対する期待は大きい(東京都)。
,東京都,○,一般レストラン（経営者）,・客単価の上昇と来客数増加傾向から、良くなっていると思うものの、ランチの来店頻度が減っている店もあるため、全体の価格帯が上がっているわけではない。サラリーマン層には値上げは厳しいと思われるため、リーズナブルな商品も出していく予定である(東京都)。
,,○,都市型ホテル（スタッフ）,・夏季シーズンは需要が高まるため、少し良くなる。
,東京都,○,旅行代理店（販売促進担当）,・２～３か月後は旅行業界にとっては、秋の旅行シーズンである。国内は順調だと思うが、海外がやはり団体を中心に伸び悩んでいるため、国内へのシフトが一層進む。そのため、多少は国内旅行のお陰で良くなる(東京都)。
,東京都,○,旅行代理店（営業担当）,・秋季旅行シーズンを迎えるため、販売量の増加が期待できる(東京都)。
,東京都,○,タクシー運転手,・希望的観測を含むが、世間は、選挙、リオデジャネイロオリンピックと浮かれており、実質的な好景気感とは全く関係ないかもしれないが、やや浮わついた景気感である(東京都)。
,東京都,○,通信会社（管理担当）,・法人向けソリューション設備投資への意欲は現状と変わらないとみるが、個人向けの携帯電話販売は夏季商戦期を迎え、やや良くなる(東京都)。
,,○,ゴルフ場（経営者）,・希望的観測で、やや良くなる。
,,○,ゴルフ場（企画担当）,・９月中旬過ぎの予約が例年以上に埋まっている。
,,○,その他レジャー施設［ボウリング場］（支配人）,・企業予約はいまだ低迷しているものの、個人利用が増加傾向にある。
,,○,その他サービス［立体駐車場］（経営者）,・近隣の大型商業施設が11月いっぱいの閉店に向けてセールを行うため、来客数が増える。
,,○,設計事務所（経営者）,・民間企業からの相談もあり、徐々に忙しくなりそうな気配を感じる。ただし、相変わらず利益率は低く、労働時間は長くなりがちである。経済状況が停滞している現在、仕事があることに感謝である。
,東京都,□,商店街（代表者）,・今年の天候をみると、あまり良くなるとは思えない。これから30度を超える日が続くと、大変になる。高齢者が動けるような天候になるのが一番で、暑すぎるのも、寒くなるのもいけない。なかなかそれが難しい(東京都)。
,東京都,□,商店街（代表者）,・選挙結果とこの夏の天候も大きく影響する。低調基調はしばらく続くように感じる。新作スマートフォン向けゲームの影響で街中の人出が増えるが、消費にはほとんどつながらない(東京都)。
,東京都,□,商店街（代表者）,・地域のプレミアム付商品券が発行されたものの、既存小売店での消費は不透明である(東京都)。
,,□,一般小売店［和菓子］（経営者）,・これからも暑さは続くうえ、今年９月の季節行事が重なってしまうため、売上も一緒になってしまい減少する懸念がある。
,,□,一般小売店［家電］（経理担当）,・夏商戦もこれからで、どこに頼んだらよいか分からないような困りごとなどの仕事依頼が増えている。どんなことでもこなしていかないといけないが、簡単な仕事は量販店に行ってしまうのだろう。
,東京都,□,一般小売店［家具］（経営者）,・小売店はこの悪い状態のまま変わらないだろうと感じている(東京都)。
,東京都,□,一般小売店［米穀］（経営者）,・３か月先はあまり良いイメージができない。今の政治の不安定さや社会の雰囲気から、それほど変わらないのではないか(東京都)。
,,□,一般小売店［文具］（販売企画担当）,・店頭においてこれから飛ぶように売れる商品が出るとか政策として補助金等あるということも特になく、外商も大きな案件が３か月後にはないので、あまり変わらない。
,東京都,□,一般小売店［茶］（営業担当）,・会社の販売量が伸びなければ、従業員は良くならない。新規の得意先も競争が厳しく、なかなか受注できない。特に夏から秋にかけては例年厳しい(東京都)。
,,□,百貨店（売場主任）,・円高傾向が続き株価も低調に推移する予想で、富裕層だけではなく、中間層も苦戦を強いられるとみている。
,東京都,□,百貨店（営業担当）,・例年に比べて梅雨明けが遅く、夏日の少ない影響もあり、夏物衣料、服飾雑貨等の動きが全般的に悪い。また、訪日外国人観光客の買上動向も変化しつつあり、ハイブランドの高級衣料や雑貨の動きが減速傾向である。景気は停滞気味と考える(東京都)。
,東京都,□,百貨店（営業担当）,・アパレル関連の苦戦や服飾雑貨の堅調な動きに、大きな変化は見られない。食料品は徐々に回復しつつあるが、全体的な傾向は変わらない。ただし、客単価の伸びがあまり見られないため、今後も大きな伸びは期待できない(東京都)。
,東京都,□,百貨店（営業担当）,・インバウンドや経済不安の状況はしばらく変化がない。今年は前年のような服飾の大きなトレンド変化もないため、消費意欲が促進されにくい(東京都)。
,東京都,□,百貨店（営業担当）,・訪日観光客は増加するものの購買額の減少は継続している。また、円高、株安が続くなかで、富裕層の購買も減少傾向にあり、現段階では明確な対策が見出せないため、当分は変わらない(東京都)。
,東京都,□,百貨店（営業担当）,・英国のＥＵ離脱問題による世界経済の停滞は落ち着きを取り戻しつつも、11月にアメリカ大統領選挙を控えており、しばらくは静観ムードになるのではないか(東京都)。
,東京都,□,百貨店（販売促進担当）,・先行き不透明感から国内消費マインドの落ち込みは、しばらく続く。更に外国人需要も、来客数の減少はないものの、高額品の買上は減少傾向にあり、今後の客単価の低下は避けられない(東京都)。
,,□,百貨店（販売促進担当）,・スタートが集中したことで出だしが良かったセール商戦も、２点買上でクーポン券進呈、よりどり企画など新たな施策を実施している。依然として、客の消費に対する意識は厳しいままであり、必要な物しか買わない傾向は今後も続くと感じている。
,東京都,□,百貨店（計画管理担当）,・大手取引先の経営不振など先行き不安の要因が多く、回復の見込みは低い(東京都)。
,,□,百貨店（店長）,・日本経済や将来に明るい兆候が１つ２つ出ない限り、状況を変えていくことは難しい。
,,□,百貨店（副店長）,・リオデジャネイロオリンピック開催後も世界経済の不透明感は継続すると感じている。秋物商材の動向も、明確に上向く材料があるとも思えない。
,東京都,□,スーパー（経営者）,・世界情勢が不安定である(東京都)。
,東京都,□,スーパー（販売担当）,・売出初日の目玉商品や、ポイント何倍の日、時間帯割引サービスなど、特典のある店や時間を上手に使い分け、少しでも安く買物しようという客の動きがまだまだ多く見られる(東京都)。
,,□,スーパー（経営者）,・やや悪い状態が続いているので、この状況は変わらない。時々良くなるのだが、次々に競合店が出てくるので、そのたびに影響を受けて、なかなか良くならない。
,東京都,□,スーパー（店長）,・本来なら３か月後の景気は良いと答えたいが、客の様子を見る限り、午前中は年配客、昼から夕方にかけては主婦、夕方から夜間は通勤帰りのサラリーマン、ＯＬというような状況で、買う物自体の点数はそれほど大きく変わらなくなってきている。値段の高い安いだけになっており、チラシを入れて特売をしたり、店内でプロモーションをかけても、なかなか思うように売上が上がってこない。３か月後も、現状のまま変わらない(東京都)。
,東京都,□,スーパー（店長）,・行楽シーズンに向かい、食費以外の出費が多い時期にさしかかるので、今後しばらくは同じような状況が続く(東京都)。
,東京都,□,スーパー（営業担当）,・現在、世界の景気に、日本が振り回されている。この状況が安定化しないと国内景気も上向きになってこない(東京都)。
,,□,スーパー（仕入担当）,・２月以降、チラシ掲載価格が下落傾向になっている。価格を下げて売上数量が増えれば良いが、従来価格の時と変わらない商品もあり、競合店との兼ね合いを考えると、非常に厳しい判断になってくる。
,,□,コンビニ（経営者）,・高付加価値商品のみが売れる時代で、客の目が厳しくなっており、予想がしにくくなってきている。
,東京都,□,コンビニ（エリア担当）,・価格に敏感な客層が増えている。スーパーなどと価格差のあるコンビニは厳しい状況が継続する(東京都)。
,東京都,□,コンビニ（商品開発担当）,・前年のような長期の連休もないため、来客数の上向く話題もなく、引き続き来客数に苦戦すると予想される(東京都)。
,,□,衣料品専門店（経営者）,・路面店のため、猛暑の８～９月の日中は、高齢者の来店が落ちる。全店で午前中１時間の前倒し開店を考えているが、ここにきて、最低賃金の値上げを通達されると全員の時給を上げなければならない。粗利の改善も厳しく、どのような手があるのか、値上げが通用するのか考えている。
,,□,衣料品専門店（経営者）,・衣料品にとって、季節を占う一番大事な時期に入るが、この数年、ファッションに対する価値観の減退が多々見られ、起爆剤となるような、景気の良くなる要素が感じられない。
,,□,衣料品専門店（統括）,・現状の客のマインドに、急に変化が起きるとは思えない。
,東京都,□,家電量販店（店員）,・量販店では現状のまま変わらないことが多い。飛躍的に伸びる要素もない(東京都)。
,東京都,□,家電量販店（経営企画担当）,・季節要因を除いても、現在の消費傾向に大きな変化は見込めない(東京都)。
,,□,乗用車販売店（経営者）,・自動車の整備と販売をしているが、整備は順調に入っているものの、販売があまり芳しくなく、２割減となっている。
,,□,乗用車販売店（経営者）,・軽自動車の減少分を小型車売上でなんとか補っているが、かなり厳しい。
,,□,乗用車販売店（営業担当）,・長期の休みがあるので、集客にも影響が出る。
,東京都,□,乗用車販売店（販売担当）,・やはり輸送業は全体的に停滞気味の感覚はぬぐいきれない。アベノミクスも順調ではないし、日銀がいろいろな対策を打っても、画期的な経済効果が出てこないだろう。当分の間は、今の踊り場的な状態のままで変わらない(東京都)。
,,□,乗用車販売店（渉外担当）,・登録車は前年比90％で推移している。新車受注は登録車より悪く、新型車の効果があっても総数では苦戦している。あまり良くない状態は今後もしばらく続く。
,,□,その他専門店［ドラッグストア］（経営者）,・周りを見ても景気が上向いているようには思えず、当店も変わっていない。
,東京都,□,その他専門店［貴金属］（経営企画担当）,・客の動きはあるものの、現在のトレンドから、今後の販売量の伸びが良くなるとは考えにくい(東京都)。
,東京都,□,高級レストラン（副支配人）,・法人の宴席予約状況から判断し、変わらない(東京都)。
,東京都,□,高級レストラン（仕入担当）,・販売単価、来客数、売上高いずれも前年並みと考えており、しばらくは様子見状態である(東京都)。
,,□,一般レストラン（経営者）,・３か月後も今の状況とあまり変わらない。いろんな試みをしているが、なかなか良くならない。人口が増減したのか、周りの企業の景気が良いか悪いかにもよると思うが、あまり変わらない気がする。
,東京都,□,一般レストラン（経営者）,・英国のＥＵ離脱問題による世界経済への悪影響が考えられる。円高や、当店のような零細企業には人手不足による営業への影響や人件費高騰で厳しい状況が続く(東京都)。
,東京都,□,一般レストラン（経営者）,・新しい安倍内閣で10兆円の補正額が組まれたり、いろいろと景気刺激策はあるが、現場にとっては人手不足で、売上をあげるのに厳しい状況になっている(東京都)。
,,□,一般レストラン（スタッフ）,・場所によって異なる。多くの人出があり良くなっている店舗もある一方、人の入っている店は当店ぐらいという場所もある。良い時と悪い時があるが、球団の効果や新作スマートフォン向けゲームをやっている人がうろうろしている程度である。
,,□,都市型ホテル（スタッフ）,・アベノミクスの次の手が、どれほど効果が出るのか、はっきりするまでは、分からない。
,東京都,□,旅行代理店（従業員）,・前年同期比で101～102％となっているため、変わらない(東京都)。
,東京都,□,旅行代理店（従業員）,・円高による、企業業績が不安定である(東京都)。
,東京都,□,旅行代理店（営業担当）,・円高基調が落ち着き、政府の景気対策も好材料がみられない(東京都)。
,,□,タクシー運転手,・治安が悪くなってきている。世界的にもそうだが、不安が加速している時代で、世の中が非常に暗い方向に動いているような気がする。不安のなかで生活しているので、我々の客も横ばい、値下がりの傾向にあるのではないか。
,東京都,□,タクシー運転手,・国内景気は足踏みが長期化し、輸出も中国、アジア向けや米国向けなどで減少している。英国のＥＵ離脱問題による円高株安など様々な報道を見ると、景気の先行き判断はしばらくは変わらない(東京都)。
,,□,タクシー運転手,・営業エリアには工業団地もあり、お盆前後は仕事が減り厳しい日が続くとみている。最近では、近場の居酒屋で飲む客が多く、長距離の客も減っているため、夜の売上が伸びない。まだまだ、この状況は続きそうである。
,東京都,□,タクシー運転手,・良い材料がない(東京都)。
,,□,タクシー（団体役員）,・夏季休暇に向け、国内、海外、遠方、近場への人の動きに大きく左右され判断は難しい。首都圏から人が流出するため、例年８月は収益が減少傾向である。
,東京都,□,通信会社（経営者）,・消費税増税や、軽減税率の導入議論があったものの、再延期となっている。これらは現在だけでなく将来の景気にも悪影響を与えている。やる時にはやり、将来不安を払しょくしなければ、景気はなかなか上向かない(東京都)。
,東京都,□,通信会社（社員）,・放送番組、イベントなどの引き合いがあまりない(東京都)。
,,□,通信会社（営業担当）,・景気の先行き不透明感が払しょくされなければ、大きな回復は見込めない。
,,□,通信会社（営業担当）,・他社との競争が激化しており、付加価値ではなく、価格面での攻防から抜け出せていない。
,東京都,□,通信会社（経営企画担当）,・上期の動きは鈍いが、下期に商談件数も増えるのではないか(東京都)。
,東京都,□,パチンコ店（経営者）,・今までの面白い機械がなくなってきている。そういう機械を好んで遊んでいる客は、店内を移動したり、当店から離れるかもしれない。ただし、遊び、娯楽という意味では、低単価であまり売れない機械や、１円パチンコなどに客が移行しているので、長い目でみたら良いことかもしれない。ただ、２～３か月後は今とあまり変わらない(東京都)。
,東京都,□,その他レジャー施設（経営企画担当）,・催事や、予約は堅調に獲得している。ただし、節約志向の強まりは既にレストランの売上などに現れており、この傾向はしばらく続くとみている(東京都)。
,東京都,□,その他サービス［福祉輸送］（経営者）,・景気に対するプラス要因は、参議院選で保守系、現在の政権与党の票がそれほど減らなかったため、安定した経済政策にさらに踏み込む内閣の方針が具体的な施策として出て、３か月後に良い影響を与えることもあるが、都知事選の結果や、今後生じる英国のＥＵ離脱問題、紛争地をめぐる経済状況がマイナス方向に働くこともあり、景気が上向くのか下向くのか、今後の進展次第といった状況なので、現在のあまり良くない状況が続くという意味で変わらない(東京都)。
,,□,その他サービス［保険代理店］（経営者）,・今後のメーカーの卸価格にもよるが、あまり変動がなく落ち着いた価格帯に収まり、販売量の増減はないとみている。
