II．景気の先行きに対する判断理由,,,,
,,▲,その他専門店［書籍］（店員）,・今年の秋は大型連休があるため、支出がレジャー費に流れ、書店にも多少は影響があると考えられる。
,,▲,一般レストラン（従業員）,・足元が年間を通して一番売上の良い時期で、特に今年は、過去最高を記録した。今後は、寒くなるにつれて需要が減る。
,,▲,スナック（経営者）,・孫の夏休みや連休で客の小遣いは減る。先の予約も少なく、あまり期待できない。
,,▲,その他飲食［仕出し］（経営者）,・例年、夏場は売上が減少するが、今月は売上が良かった分、そのしわ寄せがくる。
,,▲,通信会社（営業担当）,・現状は思った以上に客の動きが良いが、急な暑さなどの影響や時期的なものであり長くは続かないと思われる。
,,▲,パチンコ店（経営者）,・業界全体で、店舗の大型化と集約化が進み、中小店舗は厳しい。
,,▲,理美容室（経営者）,・客との話では、ボーナスもあまり良くなかったので、生活費に充てる金がだんだん減っている。
,,▲,美容室（経営者）,・客が高齢化している。車で来られる客はいいが、歩きの客は、暑い日が続くと来店しなくなる。
,,▲,設計事務所（職員）,・景気対策以前に、消費税増税の話が出てくるので、政策的には、あまり景気が良くなることは望めない。
,,▲,住宅販売会社（経営者）,・消費者は、住宅の購入を考えられるほどには、所得が上がっていない。先行きもわからない状況である。
,,▲,住宅販売会社（従業員）,・工事の受注残が減り、新規の受注見込みも少ないため、先行きは困難になるように思われる。
,,▲,その他住宅［住宅管理］（経営者）,・売上は確保できても、人件費や材料費等の経費が上がって、どの仕事でも利益が残らない。このような状況がまだ続く。
,,×,一般小売店［電気屋］（経営者）,・販売量が変わらず、販売単価が下がっている状況では、今よりも良くならない。
,,×,その他専門店［雑貨］（店員）,・海外の株式市場でバブルがはじけたら、消費マインドは低下する。
,,×,都市型ホテル（経営者）,・インバウンドによる良好な予約が、いつまで続くかわからない。
,,×,美容室（経営者）,・この先は消費税が再増税となるので、もっと悪くなる。
"企業
動向
関連

(東海)",,◎,−,−
,,○,パルプ・紙・紙加工品製造業（総務担当）,・秋に向けて、果実品や農産品等の関連製品の受注・販売が増え、今よりも業況は良くなる。
,,○,輸送用機械器具製造業（品質管理担当）,・現時点ではまだ企画段階の設備投資が、２〜３か月後には実施されている。
,,○,輸送用機械器具製造業（経営企画担当）,・下半期は、受注台数の増加が見込まれている。
,,○,輸送業（エリア担当）,・荷物の動きは順調に増加している。増加量が大幅すぎない分、経費を増加させずに対応できている。
,,○,通信会社（法人営業担当）,・ギリシャ財政問題も、当面は落ち着き、米国経済に引っ張られながら、消費税再増税までに着実な景気回復を期待する。
,,○,金融業（従業員）,・建築業や備品・部品等の製造流通に関連する企業からは、景気は良くなるという声を比較的多く聞く。
,,○,行政書士,・受注量の増加が見込まれる。
,,○,会計事務所（社会保険労務士）,・６〜７月に支払われた夏季ボーナスをみると、前年よりも増額している客が多い。
,,○,その他非製造業［ソフト開発］（経営者）,・原油価格は１バーレル当たり50ドル台で定着しそうで、これならば、日本が国際競争力を持てる。ただし、世界情勢はいつ大きく変動するかわからないため、企業としては、開発を続け体質強化をする必要がある。
,,□,食料品製造業（営業担当）,・取引先で大きい変動もほとんどなく、現状の良くも悪くもなく状況が、このまま横ばいで続くのではないかと思われる。
,,□,食料品製造業（経営企画担当）,・前年を上回る夏季ボーナスが支給されても、消費は思ったようには伸びない。海外からの旅行客の一過性の需要に頼っているようでは、先々不安を感じる。
,,□,化学工業（総務秘書）,・特段の良くなる要素も、悪くなる要素も見当たらない。
,,□,窯業・土石製品製造業（社員）,・全体的に受注量が減っている。先々急激に落ち込みそうな兆候はないが、回復の兆しもみられない。
,,□,鉄鋼業（経営者）,・海外からの格安なスクラップの流入や国内物件の減少を打開できる要因が、先行きにもみられない。
,,□,金属製品製造業（経営者）,・引き合い件数も減少しており、引き続き悪い状況のままであると考える。
,,□,金属製品製造業（従業員）,・工場の稼働状況は悪くないと思われるが、受注情勢はあまり良くないため受注価格が上がらない点が、気掛かりである。
,,□,一般機械器具製造業（営業担当）,・スマートフォン向けの設備投資には勢いがないが、産業機器向けの設備投資需要は底堅く、為替相場も円安なので、引き続き利益の確保が見込める。
,,□,一般機械器具製造業（経理担当）,・受注量の水準が変わらない。
,,□,電気機械器具製造業（企画担当）,・目先の好材料も悪い材料もない状態にある。業績には各企業の努力の結果が表れると感じる。
,,□,電気機械器具製造業（経営者）,・トランス関係の製品は、国内向けでは相変わらず受注時に価格交渉が実施されるが、輸出向けとみられる案件は、引き続き好調である。国内需要だけをみると悪くなる可能性もあるが、当社全体でみた場合は、バランスがとれており、先行きも横ばいが続く。
,,□,電気機械器具製造業（総務担当）,・リストラのようなネガティブな対応以外に、悪い環境を脱却できる方法が見当たらない。
,,□,輸送用機械器具製造業（経理担当）,・出荷量の変動や値引きに合理化の要請といった大きな変化がないため、為替の恩恵もあり、しばらくは安定した利益を確保できると考えられる。
,,□,輸送用機械器具製造業（総務経理担当）,・大手自動車会社の国内増産と、中国経済が下降に向かうことを合わせみると、今の状況が先行きも続くのではないかと考える。
,,□,建設業（経営者）,・零細企業にとっては、これから先に良くなる材料が全くない。政治の状況から、国民には不安感が広がり、新しく何かを始めようという気が起きない。
,,□,建設業（営業担当）,・大手企業の景気が上向いているからといって、当地域の景気が回復していくわけではない。取引先や同僚等からも、ムードが明るくなるような良い話は聞かない。
,,□,輸送業（経営者）,・人手不足による人件費や人材募集費の高止まりも影響し、国内向け、輸出入共に物量には大きな変化がないと思われる。
,,□,輸送業（従業員）,・天候によって購買意欲は大きく変わり、その影響で荷動きも大きく左右される。トラックの燃料となる軽油価格が安定し、経営にも寄与している。一方で、運転手は採用難で、これまで以上に採用経費をかけて募集活動を行っている。先行きには、依然として明るい兆しがみえないように思われる。
,,□,輸送業（エリア担当）,・円安基調は安定しているが、中国や米国の景況が不安定なため、堅実なムードでの取引が続く。
,,□,輸送業（エリア担当）,・軽油の価格が、１リットル当たり前年比で26.7銭安くなっており、大変助かっているが、荷動きは、今一つ緩慢な動きが続いている。
,,□,輸送業（エリア担当）,・これから景気が良くなる理由、要因が見当たらない。経済をけん引するような出来事が見当たらないことが、先行きを見通しづらい要因となっている。
,,□,金融業（法人営業担当）,・５月には実質賃金が前年同月比で横ばいとなったこともあり、現役世代の消費は回復傾向にあるが、高齢者は、実質支給額の減少で節約意識が高まりつつある。
,,□,金融業（企画担当）,・資産を持つ層以外の消費が増えてこないと、これ以上は景気が上向かない。
,,□,不動産業（経営者）,・実体経済の動きは活発でなく、先行きも変化はみられない。
,,□,不動産業（用地仕入）,・今後、景気に影響を与えるような材料が見当たらない。
,,□,広告代理店（制作担当）,・客からはこれといった引き合い話もなく、あまり先の見通しは具体的にみえず、横ばいが続きそうである。
,,□,新聞販売店［広告］（店主）,・特に悪い材料もなければ、良い材料もない。
,,□,公認会計士,・円安による原材料や電力料金の上昇が、中小企業の収益性悪化の要因となっている。円安によるコスト増加を電力料金に転嫁することは理解できるが、電力会社の経営改善が進んでいるかについては、疑問を感じる。
,,□,会計事務所（職員）,・ギリシャの財政問題、中国株式市場の情勢や新国立競技場の建設問題等、先行き不透明なことが多いが、現状のままであれば、景気にも大きな変化はないと思われる。
,,□,その他サービス業［ソフト開発］（社員）,・本年度の案件も出尽くした感があり、下期に向けて急激な案件増加は発生しないと思われる。
,,▲,出版・印刷・同関連産業（代表）,・価格競争が一段と厳しくなっており、粗利率は少しずつ低下する等、現段階ではプラス材料がほとんどない。
,,▲,印刷業（営業担当）,・良い話も景気が良くなる兆しもなく、むしろ悪くなる一方である。
,,▲,化学工業（営業）,・ナフサ価格が下がったことにより、販売先より値下げ要請がある。収益・販売額の減少につながる。
,,▲,化学工業（人事担当）,・海外情勢では、景気にとってプラスなのは、原油価格が安いことと為替レートが円安で安定していることである。今後のリスク要因としては、中国情勢、米国の利上げ、国際的なテロの問題等で、ギリシャの財政問題も完全に解決したわけではない。
,,▲,電気機械器具製造業（営業担当）,・売上がやや減少傾向にある。
,,▲,電気機械器具製造業（経営者）,・取引先の設備投資が一段落し、減少の方向に向かうため、３か月先にはあまり期待が持てない。
,,▲,建設業（経営者）,・建設業でも業種によっては、仕事が潤沢にあり好景気が続いている。業種間でのバラつきが、極端である。
,,×,＊,＊
"雇用
関連

(東海)",,◎,−,−
,,○,アウトソーシング企業（エリア担当）,・９月以降、新型車種の生産や海外向けの生産増加が見込まれるため、やや良くなる。
,,○,職業安定所（職員）,・プレミアム付商品券の発行や猛暑による個人消費の回復で、雇用の幅も広がりそうである、ただし、建設作業員や介護職等では、人手不足が厳しくなりそうである。
,,○,職業安定所（職員）,・２倍を超える求人倍率となるのは、保安職、建設職種、サービス職、輸送・機械運転職種、専門・技術職等で、これらの職種を中心に、引き続き人材確保への企業の意欲は続くと思われる。
,,○,民間職業紹介機関（営業担当）,・これから大手企業での新卒者の採用面接も進み、ある程度、内定を辞退される企業も出てくることが想定され、第２新卒者の採用が進む可能性がある。
,,○,民間職業紹介機関（営業担当）,・自動車業界が活況で、当地域の製造業では引き続き景気の回復が期待される。また、イベント出展希望企業も増加している様子である。
,,○,学校［専門学校］（就職担当）,・就職活動の日程変更に伴う学生の負担や混乱も現時点ではなく、影響は少ないとみられる。前年同様に売手市場といった印象である。
,,□,人材派遣会社（経営企画）,・先行きも特に変化の兆しはない。
,,□,人材派遣会社（社員）,・本国会での労働者派遣法改正案の動向が不透明である。
,,□,人材派遣会社（社員）,・有能な人材を求める企業の求人活動は活発化しているが、それに見合う人材の不足が、引き続き深刻である。
,,□,人材派遣会社（社員）,・来月にイベントを控えているが、予約状況は好調である。あまり大きくは変わらないが、年末に向けては良くなる見込みである。
,,□,人材派遣会社（営業担当）,・ポジティブな材料が見当たらず、大きな変化が期待できない。
,,□,人材派遣会社（営業担当）,・労働者派遣法に改正の動きがあり、状況次第では、派遣スタッフ活用について様子見となる企業が出るのではないかと思われる。
,,□,人材派遣会社（営業担当）,・現時点で客からは、中長期の先行きを見越した引き合いがある。また、この先も景気後退を示す要素は見当たらない。
,,□,新聞社［求人広告］（営業担当）,・求人関連では、一部のメーカーが増産に備えて、手当等の支給で人手確保に積極的に動いているが、そのような動きは限定的である。大手企業の採用活動が８月から本格化するが、中小企業はそれを受けて採用活動を仕切り直す必要もある。全体としては、景気が現状のまま停滞する可能性が大きい。
,,□,職業安定所（所長）,・景況感の回復は今が天井である。各企業とも先行きは横ばいであるとみているため、今後はその通りに推移するであろう。
,,□,職業安定所（職員）,・求職者の減少により、求人企業では人員確保が十分に進まず、業務増加にも即時対応が困難で、収益拡大につながりにくい。また、円安の長期化が収益を圧迫している面もあり、プラスマイナスが相殺される状況が、しばらく続くと考えられる。
,,□,職業安定所（職員）,・大手を中心にベースアップも実施されているが、当地は中小企業が多く、引き続き厳しい状態である。プラス要因は、国内では生産設備の投資の動きが一部に出てきている。好調な会社の中には、仕事をもらうのではなく獲得に行く事業所もあり、大変忙しい状況にある。マイナス要因は、大企業は好調だが、下請である中小企業では、仕事が減っているところもあり、円安に伴う材料費の上昇等、厳しい面もある。一部の製造業では、親会社から仕事がもらえず、廃止に追い込まれる事業所も出てきている。また、求人は増加傾向にあるものの、正社員よりもパートでの求人募集が目立つ傾向である。
,,□,職業安定所（職員）,・求人数は前年同期比で減少しているが、派遣・請負求人の減少に起因するもので、求人数は実態としては横ばいに近い。
,,□,職業安定所（職員）,・求人数は増加しているものの、人手不足が恒常化している建設業、医療・福祉業に加えて、卸・小売業でも今後の充足率は、横ばいで推移すると思われる。
,,□,民間職業紹介機関（支社長）,・景気は悪化するわけではないが、特に回復の兆しも感じない。
,,□,その他雇用［広告代理店］（求人広告担当）,・ここ半年ほど、状況に変化があまりないので、今後も同様と考えている。
,,▲,人材派遣会社（支店長）,・求人数は引き続き高水準で推移していることもあり、求職者の不足感が強まっている。募集コストの増加と競合の激化もあり、今後は、成約状況がやや悪化すると見込まれる。
,,×,−,−
,,,,
　６．北陸（地域別調査機関：一般財団法人北陸経済研究所）,,,,
,,,,（−：回答が存在しない、＊：主だった回答等が存在しない）
分野,,景気の先行き判断,業種・職種,景気の先行きに対する判断理由
"家計
動向
関連

(北陸)",,◎,高級レストラン（スタッフ）,・10〜12月はＪＲのデスティネーションキャンペーンの対象地域となるので、秋口からの受注が大幅に伸びることが予想される。
,,○,一般小売店［精肉］（店長）,・大型アウトレットモールの開店により来客数が減少するかと思われたが、それほど影響を受けることはなかった。９月には近隣に新しい商業施設がオープンすることから、こちらにも客の流れが戻ってくるように思われる。
,,○,一般小売店［鮮魚］（従業員）,・夏休み、お盆休み、９月の大型連休など観光客の入込増加が期待できる。実際の予約状況も順調と聞いている。
,,○,百貨店（売場主任）,・上海株の乱高下で景気動向については不透明な部分はあるものの、８月下旬に発売されるプレミアム付商品券が消費を刺激し、カンフル剤となることを期待したい。
,,○,百貨店（営業担当）,・７月は当地においては、大型のアウトレットモールやショッピングモールといった大型商業施設が２つできた。８月には食を中心とした大型ショッピングセンターが開業する。当地全体では消費が活性化されるような気がするが、消費人口は限られており既存店舗では当然シェアの取り合いになる。全体的には上昇するが、個々にみると優劣が出てくる先行きではないかと考えている。
,,○,百貨店（営業担当）,・プレミアム付商品券の発売を控えており、商品券を買い求めた分、客は消費をしてくれると考えられ、良くなると予測する。
,,○,衣料品専門店（経営者）,・先々に期待をしている。物価上昇、税金類の支払増など、一般消費者の環境は良くなっているとはいえないが、北陸新幹線の更なる延伸や、当地の駅前周辺の整備が進んでいることなど、明るい材料も出てきているようである。
,,○,家電量販店（店長）,・高単価商品の販売数量が伸びてきている。省エネ志向から暮らしにより良い商品の購入意識が高い。
,,○,家電量販店（店長）,・パソコン本体は、前年同期はまだ旧バージョンのＯＳを搭載した機器からの買換え需要が継続していたため、回復が遅れている。しかしほかの商品、特に季節商材は前年に比べて単価が高く、扇風機やエアコンの高性能のモデルが販売台数を伸ばしており、パソコン以外は単価が上がっている。
,,○,乗用車販売店（従業員）,・ディーゼル車が発売され、客からの問い合わせもあり、期待している。
,,○,乗用車販売店（役員）,・取扱車種の増加、高額車種のマイナーチェンジ、量産車種のモデルチェンジなどが予定されているので、後半期はかなりばん回できると思っている。
,,○,その他小売［ショッピングセンター］,・消費者は購買を工夫しているが、決して消費は萎縮しておらず、観光、ショッピング、話題性、感性の高い商品に引き続き興味を持っている様子である。
,,○,都市型ホテル（スタッフ）,・12月までは、ＭＩＣＥの予約を受注しており、堅調に推移すると考えている。その後、１〜２月の冬場の景況は今のところ分からない。
,,○,都市型ホテル（役員）,・宿泊部門は今後も堅調に推移すると見込まれる。レストラン部門では個人消費の低迷をプレミアム付商品券による利用増加で補ってくれると期待している。宴会部門は秋の大会、コンベンションが例年より増加傾向にある。全館では前年よりやや良くなると見込む。
,,○,タクシー運転手,・春先に来た観光客も再訪したいと話していることから、これから秋にかけても観光客が増加する。また、９月の大型連休もあり増える。
,,○,通信会社（役員）,・光通信サービスの提供エリアは継続的に拡大してきており、解約数の減少傾向の中で、純増数は今後とも増加すると考えている。
,,○,通信会社（営業担当）,・新商品の発売に伴い販売数は増加すると思われる。
,,○,住宅販売会社（従業員）,・省エネエコポイントも少なくなってきたので、駆け込み需要が出てくると思う。また、例年秋口は客の動きもよくなるので、お盆明け以降のイベント来場に期待したい。
,,○,住宅販売会社（従業員）,・消費税率10％へのアップ前の潜在的需要の掘り起こし及びエコポイントなどの政策による受注高の増加を見込む。
,,□,商店街（代表者）,・悪いままで推移すると思う。新しいアウトレットモールは、当分は魅力があると思う。
,,□,商店街（代表者）,・大都市では景気の回復感が強いようだが、地方ではまだまだそのような風は感じられず、むしろここ１か月ほどは悪化している。まだこの傾向は続きそうだ。
,,□,一般小売店［書籍］（従業員）,・定番商品の販売数を伸ばすのは非常に困難で、どうやって売上を維持していくか毎月頭を悩ましている。
,,□,スーパー（店長）,・夏場前のプレミアム付商品券の効果はあるものの、目立って買物需要が良くなっていないように思う。今後、暑さが例年より続けば違ってくるが、何とも見通しが分からない状況である。
,,□,スーパー（総務担当）,・８月は旧盆の帰省客などのため売上指数が高いが、ほぼ前年並みに推移すると考えられる。
,,□,スーパー（総務担当）,・一般家庭において、給与の増加額より食料品の値上げによる負担が大きいものの、横ばいと思われる。秋に最低賃金の見直しが行われ、一部低所得者にとっては朗報であるが、消費が増えるとは考えづらい。
,,□,スーパー（統括）,・未来の景気ということでは、現状は客の購買単価は好調なまま推移しており、今は変わる要素が見当たらない。その中で懸案材料としては、今後青果物の相場がどう動くかによって上下があると思う。
,,□,コンビニ（経営者）,・売上が好調なコーヒーなどはあるが、それだけを買っていく客が多く、忙しい割には売上につながっていない。主力商材であるスパゲッティや冷麺などの麺類に関しては前年割れしている状態が続いており、トータルでは良い方向ではなく悪い方向でもない状態である。
,,□,コンビニ（経営者）,・現在の状況が、大きく変わる要素は見当たらない。近隣のコンビニ飽和状態に変化がない限り、このままの状況が続くと思っている。
