II．景気の先行きに対する判断理由,,,,
,,○,建設業（開発担当）,・前政権では建設業は痛手を負い、10年以上不況業種であったが、公共工事は現政権のもと３年間前年比増で推移している。ただし、次年度予算では公共工事10％減が掲げられており心配である。
,,○,建設業（総務担当）,・現時点では全体の工事量が不足しているように感じるが、さすがに秋口にかけては動きが出てくるのではないかとみている。
,,○,金融業（調査担当）,・製造業は米国向け輸出の堅調さに加え、国内の設備投資需要が高まる。非製造業については夏季観光シーズンを迎え緩やかな持ち直しの動きが続く。
,,○,金融業（経営企画担当）,・ばらつきはあるものの今後の売上は増加と考えている製造業の取引先が多い。
,,○,広告代理店（営業担当）,・前年よりは秋の販促への積極的な立案依頼が来ている。春の動きが滞っていた分、動きが出てきている。
,,○,新聞販売店［広告］（総務担当）,・ホームセンターの店長は、プレミアム付商品券利用の買物が多く、売上も数パーセント増えていると話している。
,,○,その他サービス業［情報サービス］（経営者）,・受注量が多く、今後収益は改善されつつある。ただし、受注単価は上がらず、厳しい状況が続くとみている。
,,□,窯業・土石製品製造業（総務担当）,・どん底状態は続くとみている。
,,□,一般機械器具製造業（経営者）,・受注量は、微増しているがまだまだ生産能力に対して大幅に不足している。新規取引先との話も延期となり、困っているが、更なる営業努力を続けていくつもりである。
,,□,電気機械器具製造業（経営者）,・前年の同月期と比べて、まだ２〜３割低い状態が続いているものの、９〜11月になれば、前年の10％マイナス程度までは回復するような、受注内容になる。
,,□,電気機械器具製造業（経営者）,・特別な要因がない限り、大きな変化はない。今と同様、低水準で安定していくのではないか。
,,□,電気機械器具製造業（営業担当）,・民間の新規設備投資が少なく、活気がない。
,,□,輸送用機械器具製造業（経営者）,・２〜３か月前も、今後２〜３か月先も、非常に良い会社、悪い会社、勝ち組、負け組のように分かれている状況に変わりはない。当社は十数社取引先があるため、なんとかやっているが、良くなったり悪くなったりで、２〜３か月先は読めない。
,,□,その他製造業［宝石・貴金属］（経営者）,・８月に業界の大型展示会がある。地金価格が下落しており、現状での商売は厳しさを増しているが、新商品のサンプル作りはしやすいため、展示会の活性化、盛り上がりに期待している。
,,□,その他製造業［消防用品］（営業担当）,・しばらくこのままで推移すると考える。
,,□,輸送業（営業担当）,・夏休みに入り、バーベキュー、レジャー用品等の物量は増えそうである。また、暑い日が続けば飲料水の輸送依頼も一時的には増えそうであるが、全体的な物量は、前年並みの予定である。
,,□,通信業（経営者）,・景気が変化する要素は、見当たらない。
,,□,金融業（役員）,・ボーナス等、消費動向がまだ反映されていないため、もうしばらく様子を見ないと分からない。
,,□,不動産業（管理担当）,・業務受託先との関係が良くなってきている。受注できる仕事も今後増えるが、一方で見積合わせのための見積提出だけで受注できない業務も増える傾向にあり、総合的にみると変わらない。
,,□,司法書士,・一進一退の状況がまだ続く。
,,□,社会保険労務士,・ボーナスが支給された事業所では、支給額に変化はない。
,,▲,食料品製造業（製造担当）,・円安に向かい原材料の高止まりが続き、２割以上価格を上げることができない限りは、赤字かギリギリの状態が続くとみている。
,,▲,化学工業（経営者）,・現状維持することで精一杯である。出荷数量の落ち込みが続き、上向く要素も見当たらず、ずるずると悪くなるのではと懸念している。
,,▲,電気機械器具製造業（経営者）,・取引先からの受注は９月までは通常に戻り順調であるが、下期10月からは、取引先自体の生産が下降するかもしれないと言われている。
,,▲,不動産業（経営者）,・国内産業の衰退が理由である。
,,×,出版・印刷・同関連産業（経営者）,・資金繰りはいつも大変だが、今月は仕事量も減り、より一層大変だと感じている。
"雇用
関連

(北関東)",,◎,−,−
,,○,職業安定所（職員）,・一般求人も増加傾向にあるため、やや良くなる。
,,□,人材派遣会社（経営者）,・夏物商材、夏のレジャー産業などが旅行を含めて伸びる。それらに伴う個人消費は、食品関係、食料品、飲食がけん引するとみている。ただ、自動車関連、電子といった製造業が一進一退であり、変わらない。
,,□,人材派遣会社（営業担当）,・年収が上がらなければ消費に回るわけがないため、悪いまま今年度は終わるとみている。
,,□,人材派遣会社（支社長）,・求人数は変わらず、求職者数は少ないままで固定し、動きがない。年度末に向けて人の移動が始まれば、また盛り上がる。
,,□,求人情報誌製作会社（経営者）,・周辺の一部製造業で、多少景気の上昇があるものの、全体的にはまだ良くなっているとは言えない。正社員の募集は少ない。
,,□,職業安定所（職員）,・求人数は増加傾向だが、求職者数が約２年ぶりに増加しており、今後も求人倍率は現在の水準で推移していくことが予想されるため、変わらない。
,,□,学校［専門学校］（副校長）,・求人数は増えているが、職種に偏りがある。特に事務系の職種は非常に少ない。バブル崩壊前と比べ、間接職種は非常に少なく、再就職者向け求人で、各企業が賄っているようである。
,,▲,人材派遣会社（経営者）,・８月から30人くらいの仕事がなくなるので、今のところ、３か月先は悪い。
,,▲,人材派遣会社（管理担当）,・夏が終わり麺類の製造派遣が減少するため、やや悪くなる。
,,▲,職業安定所（職員）,・求人数及び求職者数は微減の傾向が続く。
,,×,−,−
,,,,
　４．南関東（地域別調査機関：（株）日本経済研究所）,,,,
,,,,（−：回答が存在しない、＊：主だった回答等が存在しない）
分野,,景気の先行き判断,業種・職種,景気の先行きに対する判断理由
"家計
動向
関連

(南関東)",東京都,◎,一般小売店［米穀］（経営者）,・株価の安定と希望も含めて良くなる。
,,◎,スーパー（経営者）,・良くなるように創意工夫しながら、一つ一つ進めているため、良くなる。
,,◎,コンビニ（経営者）,・気温が上昇していることと、周辺では夏祭りが非常に盛んに行われ、花火大会などの催し物もあり、全体的に消費が活発である。夏場の１〜２か月はまだこの状態が続く。
,東京都,◎,その他小売［雑貨卸］（経営者）,・政府の経済政策が的を得ている。
,東京都,◎,旅行代理店（販売促進担当）,・２〜３か月後は旅行業界においては最大の書き入れ時であり、特に、法人の教育旅行が中心になる。先の予約状況からもそれが読み取れるので、今月よりは良くなる。また、徐々に組織の活性化ができてきていることもプラス材料である。
,東京都,◎,観光名所（職員）,・９〜10月になると紅葉の走りとなる。また、９月はシルバーウィークで５連休となるため、今月よりは良くなると期待している。
,東京都,○,商店街（代表者）,・３か月先のイベントの仕込みを行っているが、スポンサー企業の動きが非常に良い。不景気の時はスポンサー獲得に四苦八苦していたのに、今は断らないといけないケースもある。確実に良くなってきている。
,東京都,○,商店街（代表者）,・当地域でプレミアム付商品券が発売され、ほぼ完売のなか、商店街等の小型店舗で利用できる商品券が今後、いくらかの売上増に寄与する。
,,○,一般小売店［家電］（経理担当）,・電気製品は壊れないとなかなか買換えないが、良い物を安く買う客が増えており、購入単価が上がっている。
,東京都,○,一般小売店［文房具］（経営者）,・前月、今月と客単価が微増しているため、やや良くなる。
,,○,一般小売店［茶］（営業担当）,・プレミアム付商品券による効果が少し出ている。
,,○,百貨店（総務担当）,・猛暑が和らげば多少は良くなると考えているが、来店促進策を様々な切り口から行う必要がある。
,,○,百貨店（総務担当）,・中国の株価暴落の影響を最小限に抑えた感があり、株式市場はしばらくの間は安定的に推移する。景気も年初からのトレンドに従ってやや良くなる。
,東京都,○,百貨店（広報担当）,・客による売上動向をみると、単価の高い物を含めて売上が比較的好調である。今後についてもインバウンド需要などもあり、好調に回復していく。
,,○,百貨店（店長）,・景気回復とインバウンドに期待している。
,,○,スーパー（店長）,・各チェーン店の情報からプレミアム付商品券の販売動向がすごく良いということなので、３か月後の景気についてもこの効果が期待できる。また、売上が予算に達していないとどういう状況だろうが景気が良いわけがない。今月は買上点数、客単価が前年を上回っているが、７月初めの降雨の影響で来客数が減少したため、３か月後については当然降雨の予想はないので、今よりはやや良くなる。
,,○,コンビニ（経営者）,・当店の近隣に工事現場が多く、客単価が上昇している。まだ１〜２年は工事があるため、やや良くなる。
,,○,コンビニ（経営者）,・単価が上昇しているので、客の購買意欲が上がっていると判断できる。
,東京都,○,コンビニ（経営者）,・今までの売上、来客数の動向から、期待も込めてやや良くなる。
,,○,衣料品専門店（経営者）,・景気は一気に回復しないが、行ったり来たりはしている。９月からのプレミアム付商品券の発行もあり、回復するのではないかと期待している。
,,○,衣料品専門店（経営者）,・プレミアム付商品券に期待している。
,,○,衣料品専門店（経営者）,・秋冬物が本格的に動き出す時期に入り、また、購買力に明るさがみえてきているので、大いに期待している。
,東京都,○,乗用車販売店（販売担当）,・オリンピックなどといった観光事業も含めて良くなっていると聞いており、特に、観光事業では我々トラック関係で製造しているバスについては１年待ちという話も出ている。ただし、ダンプカー、ミキサー車については飽和状態になって、若干下げ止まりというような状況である。全体的には良くなっている。
,,○,乗用車販売店（総務担当）,・上期の決算を迎えるため、需要が増えると予想している。
,東京都,○,住関連専門店（営業担当）,・景気の回復が賃上げやボーナス等、所得に反映されつつあると感じる。
,,○,一般レストラン（経営者）,・夏場はどうしても来客数が少ないが、９〜11月になると来客数が増え始め、各種イベントも多くなり、ケータリングも増えるため、３か月後の景気は今よりは少し良くなる。
,東京都,○,一般レストラン（経営者）,・景気上昇の要素は潜在的にあると思うが、プレミアム付商品券はまだ商店、客に浸透していない。
,,○,一般レストラン（経営者）,・２〜３か月後は多少は消費も落ち着き、段々と涼しくなるため、人が動いてくる。また、消費税増税がどうなるか、話題になるかどうかによって違ってくる。
,東京都,○,一般レストラン（経営者）,・国立競技場の建替えが一時中止になり、押さえられていた職人が大分仕事がしやすくなったような話を聞いた。人手があれば仕事が取れるという建築業が結構あるので、そういった現場が動き出す。
,東京都,○,一般レストラン（経営者）,・飲食店はニッパチが暇になり、お盆休みも挟むので当店ではそれほど見込めないが、プレミアム付商品券が来月から発行されるため、買物する人で街自体は活気付く。
,,○,一般レストラン（経営者）,・次の消費税増税まではというマインドがある。また、オリンピックについてもイメージが先行しているが、期待がうかがえる。不可抗力による障害が起きない限りは、上昇傾向にある。
,,○,都市型ホテル（スタッフ）,・客からの問い合わせは秋口を中心に増えてきており、予約も順調に推移している。直近での動きも多いことから不安な要素も残るが、トップシーズンでもあり、例年からすると集客の伸びに期待ができる。現状よりはやや良くなる。
,東京都,○,旅行代理店（従業員）,・シルバーウィーク前後の期間をはさみ、国内旅行の動きが良い。特に、沖縄、九州方面が好調である。
,,○,旅行代理店（従業員）,・アジア方面の販売量は伸びていないが、ビーチリゾートが多くなってきているので、販売額も上がっている。
,東京都,○,旅行代理店（従業員）,・期待も含めてやや良くなる。
,東京都,○,旅行代理店（営業担当）,・商品が充実しているので、販売が伸びる。
,,○,タクシー運転手,・まだまだ暑い日が続き、これから台風シーズンに入ることもあり、かなりの利用が見込める。悪天候を味方に付けて仕事をしているのは、タクシーぐらいかもしれない。
,,○,通信会社（管理担当）,・例年７月のトレンドは８〜９月に影響するので、やや上向きに推移する。
,,○,通信会社（管理担当）,・電力事業やＭＶＮＯ（仮想移動体通信事業者）といった新サービスとの組み合わせで、業界全体で新サービスが渦巻くまでのここ数か月については、引き続き好況と見込んでいる。年末や年度末については、業界内の奪い合いなのではないか。活性化が進むのかは、まだ判断できない。
,,○,ゴルフ場（支配人）,・秋口の予約はかなりの客数を確保できている。
,,○,住宅販売会社（従業員）,・今月が非常に悪かったため、これ以上は景気が悪くならないとみている。良くなる要因があるわけではないが、涼しくなる秋口から客の動きが出てきてやや良くなるのではないか。
,,○,住宅販売会社（従業員）,・資料数が上向きになっている。
,,○,住宅販売会社（従業員）,・アパートの販売はまだ伸びていく。ただし、在庫の確保が難しく、大分競合するようになってきた。今後、いかに仕入ていくかがポイントになってくる。景気はまだ良くなる。
,,□,商店街（代表者）,・商店街の人とよく話をするが、飲食関係のオーナーはまあまあ動いていると話しているが、やはり物販があまり良くないという答えの方が多いため、物販が苦戦していると感じている。
,東京都,□,商店街（代表者）,・長期の天気予報では、８月も前半はかなり暑いということなので、今後も客の出入りが悪くなるため、良くなるとは考えられない。
,,□,一般小売店［和菓子］（経営者）,・猛暑や天候不順がまだ続き、来客数が見込めないため、売上につながらないのではないかと思う。
,,□,一般小売店［家電］（経理担当）,・良くなる理由がみつからない。ただし、プレミアム付商品券の期限が10月まであるので、期待している。
,東京都,□,一般小売店［家具］（経営者）,・我々のような小売店ではどうしても客が選べる商品が少ないため、非常に難しい時代になっている。景気は良くなく、このままの悪い状態が続く。
,,□,一般小売店［印章］（経営者）,・新年度になってから現在まで、会社設立用の印鑑注文等がゼロである。会社設立は少なくなっているのかもしれないが、需要が非常に少なくなっていると感じる。
,,□,一般小売店［祭用品］（経営者）,・８月は台風等の災害がなければ、このまま続きそうである。
,東京都,□,一般小売店［家電］（経営者）,・秋になっても政治、経済共に明るい見通しがほとんどないため、今の状態のまま変わらない。
,,□,一般小売店［靴・履物］（店長）,・やはり年金受給者の客も多いので、なかなか良くなるのは難しいが、株価上昇なども考えると、景気の良い客もいるので、全体としてプラスマイナスゼロのままでいく。
,東京都,□,一般小売店［茶］（営業担当）,・個人と企業の売上を足しても、まだお茶の売上高は前年同月と比べて横ばいである。販売量をみると、まだ良くなるとは言えないが、売上額は下降傾向から少しではあるが良くなっている気もする。
,,□,百貨店（売場主任）,・買い方が二極化しており、高所得層は変わらないが、パイの大きい中間所得層は円安で商品が値上がりしているため、慎重になっている。
,,□,百貨店（総務担当）,・消費者の消費に対する慎重な姿勢は引き続き継続する。
,東京都,□,百貨店（広報担当）,・ギリシャ危機も回避され、政権も安定している。国内的にも雇用は活発で、景気が後退するような懸念材料は見当たらない。ただし、実態的には中間所得層の所得は今後も大幅な改善は見込めず、消費に余裕は出てこない。消費の二極化は解消されず、景気に影響を及ぼすような特に大きな変化は見当たらない。
,東京都,□,百貨店（営業担当）,・訪日外国人客購入の高級ブランド衣料品、服飾雑貨、化粧品は前年比で大きく伸びているが、一般客の売上動向は必ずしも良いとは言えない。景気の個人消費への波及はまだ先のようである。
,東京都,□,百貨店（営業担当）,・客単価もこのところ前年に対し微増で推移している。外国人観光客の需要も見込まれるため、しばらくはこの状態が続く。ただし、中国経済の減速が気になる要素としてあり、ただちに売上減にはつながらないものの、不安が残る。
,東京都,□,百貨店（営業担当）,・自分にとって価値のある欲しい商品は時期を問わず買ってもらえるが、必要だから買うという商品も、買うタイミングや量の判断基準が厳しくなってきている。
,東京都,□,百貨店（営業担当）,・化粧品、ラグジュアリー以外の婦人衣料、雑貨マーケットとしては、新しいシーズントレンドの目はいくつかあるものの、大きなうねりにはならない。
,,□,百貨店（販売促進担当）,・春闘による大手企業の夏季ボーナスの上昇等で景気が良くなる期待があったものの、自治体のプレミアム付商品券に対する反応や食料品の値上げが続く現状をみると、消費に対する防衛意識が強く働く消費者が多く、大きくは変わらない。
,,□,百貨店（店長）,・国内の政治やギリシャ、中国などの経済についての不安要素が大きく、心理的な影響を与えている。これが消費にお金が回らない大きな要因として今後も継続していく。
,,□,百貨店（副店長）,・今後の状況について、大きく変わることはないが、８月末に発売される地域のプレミアム付商品券を契機とした販売拡大に期待したい。
,東京都,□,スーパー（経営者）,・起爆剤となるような政策もないため、変わらない。
,東京都,□,スーパー（販売担当）,・競合との価格競争もあって平均単価が下がっており、客の買上点数は前年並みか前年以上ではあるものの、１人当たりの買上額がなかなか前年を超えることができない状況が続いている。
,,□,スーパー（経営者）,・今の状況は当分変わらない。競合店が近くにできた店舗は大分影響を受けている。それ以外の店舗も良い店と悪い店があるので、全体的には良くない状況である。この状況はまだ変わらないのではないか。もちろん変えなくてはいけないが、変わらない状況が続いていくような感じがする。
,東京都,□,スーパー（店長）,・価格に対してシビアな状態は続いており、来店頻度も過去に比べて落ちている。数円の安さを求めて買い回りをしている状況なので、元どおりに回復するまではしばらくの期間を要するかもしれない。
,,□,スーパー（総務担当）,・株価等が高いまま推移しているが、実際にスーパーで買物をする客の可処分所得はそれほど大きく変わっていない。ただし、賃金が下がっているということではないので、消費自体には変わらずお金が回っていると思うが、賃金が上がって消費にお金が回るという傾向にはないので、このままで推移する。
,,□,スーパー（仕入担当）,・円安による輸入品の値上げが続いており、秋の売場変更に向けて価格を上げざるを得ない商品が多数あり、消費の冷え込みが懸念される。
,,□,スーパー（仕入担当）,・消費税増税から１年以上経過しているが、客の声を聞くとまだ防衛意識が高い。店頭売価についても主力商品を中心に価格が下がっている。
,東京都,□,コンビニ（経営者）,・不安定な要素がかなり多いため、変わらない。
,,□,コンビニ（経営者）,・天候次第だが、売上、来客数に変化はさほどなく、当分は現況の数字のまま推移する。
,,□,コンビニ（経営者）,・暑くなると店の周りの人の流れが少なくなるが、最近、近隣で外装の大規模リフォームをしているマンションが立て続けにあるため、職人などの工事関係者の来店が多くなり、厳しい分を少しカバーしていけるのではないか。
,,□,コンビニ（経営者）,・様々な要因があるが、これから暑い時期が過ぎて秋口になると、また景気の後退が始まるのではないか。
,東京都,□,コンビニ（エリア担当）,・販売量のトレンドをみると、梅雨明けしても前年とほとんど変化がないためである。
,東京都,□,コンビニ（商品開発担当）,・来客数の増加につながる要素もなく、減少傾向が続くことが予想される。
,,□,衣料品専門店（経営者）,・このままずっと夏物バーゲンが盛り上がらない。また、晩夏の商材が難しそうである。
,,□,衣料品専門店（経営者）,・当地域ではプレミアム付商品券の販売がこれからだが、予定の倍以上の申込があり、抽選となる。プレミアム付商品券の利用で良い方向に向いてくれると有難い。それだけで景気が良くなるかは分からないが、起爆剤になればと期待している。
