Ⅱ．景気の先行きに対する判断理由,,,,
,,○,建設業（経営者）,・年度末の駆け込み需要なども含めて、やや良くなると予想している。
,,○,輸送業（営業担当）,・輸出の増加と原油安で海運事業が好調であり、来月も荷量が多いため、増便することになっている。
,,○,通信業（管理担当）,・統一地方選挙による影響は不透明な部分もあるが、今後は良くなると予想している。
,,○,新聞販売店［広告］（店主）,・近隣の事業所から、店に折込広告を直接持ち込む客が増えており、折込収入が伸びている。
,,○,広告代理店（営業担当）,・ゴールデンウィークに向けての企画が多く、効果が期待される。
,,○,その他サービス業［店舗開発］（従業員）,・消費税率の引上げから１年が経過し、徐々に影響は薄れてきたようにみえる。ガソリン価格の高騰もなく、今後は安・近・短の外出が増える。
,,○,その他非製造業［商社］（営業担当）,・５月の連休ごろから、補助金を活用した顧客の改修工事が始まってくる。
,,□,食料品製造業（従業員）,・全ての価格が高騰しているなかで、赤字覚悟で販売するのか、値上げによって収益を改善させるのかで大きく変わる。今のところは値上げできる状況ではないため、良くもなく悪くもない状況が続く。
,,□,食料品製造業（営業担当）,・前年の夏は冷夏であったが、今年は特に飲料水の動きに変化はないと予想される。
,,□,食料品製造業（経理担当）,・食品の値上げが続いており、賃金が上がっても追いつかない。
,,□,繊維工業（総務担当）,・現状の為替水準では、利益率の上昇が見込めない。国内生産への転換も検討しているが、それには時間がかかる。
,,□,繊維工業（総務担当）,・消費者のニーズを的確に反映したものづくりを考えていかなければ、低価格に頼った営業になり、販売が伸びない。
,,□,家具及び木材木製品製造業（営業担当）,・忙しいが、配達料に変化はみられない。
,,□,パルプ・紙・紙加工品製造業（経営者）,・受注量の増加についての話が、顧客から聞かれることがない。
,,□,出版・印刷・同関連産業（営業担当）,・今月は期末需要で受注量は増えたが、現時点では来月以降の新しい動きや案件の話があまり多くない。一部の企業では、新年度から組織変更となる特需もあるが、それほど大きな受注は見込めない。
,,□,化学工業（企画担当）,・原料コストの販売価格への転嫁が取引先に認められず、利益の出ない状態が続く。
,,□,窯業・土石製品製造業（経営者）,・３か月程度の短期間では変わらない。
,,□,金属製品製造業（経営者）,・年度末にもかかわらず荷動きは悪いため、新年度になってもあまり期待できない。
,,□,一般機械器具製造業（設計担当）,・まだまだ物価上昇に賃金がついてきていない。
,,□,電気機械器具製造業（企画担当）,・新規戸建住宅の着工の回復が見込めないため、大型商業施設の案件はあるが、市場環境は大きく変わらない。
,,□,電気機械器具製造業（営業担当）,・好調も３月末までであり、特に５月以降の受注が少ない。
,,□,電気機械器具製造業（営業担当）,・あまり景気の良い話はない。
,,□,輸送用機械器具製造業（経理担当）,・引き合いのある案件をいかに確実に受注に結びつけていくのか、企業努力が必要である。引き合い自体は増加傾向にあるが、価格競争が激しい。
,,□,その他製造業［履物］（団体職員）,・大手企業を中心に、春闘による賃金のベースアップへの満額回答が続いているが、中小企業は景気の回復を体感することができない。むしろ円安により原材料費が高騰するなか、販売価格に転嫁できず、経営が圧迫されている状況である。
,,□,建設業（経営者）,・新年度を迎えて季節も良くなるが、依然として顧客の所得は増えそうにないため、現状維持となっても仕方がない。
,,□,建設業（経営者）,・技術員や技能労務者の不足が慢性化している。今後、アベノミクスによる景気回復で各企業の設備投資が増えても、深刻な状況が続くと予想される。
,,□,輸送業（商品管理担当）,・入学や母の日、父の日関連で、少しずつ販売量は増えているように思うが、全体的には前年よりも悪化している。
,,□,金融業（営業担当）,・全体的に良くなってきているが、企業規模による格差が大きい。今後も大企業は潤う一方、中小企業はまだまだ厳しい状態が続く。
,,□,金融業［投資運用業］（代表）,・株価の今後の揺り戻しが心配である。景気判断が下降気味に推移していることも不気味である。
,,□,不動産業（営業担当）,・神戸から企業が出て行く動きは今後も続く。
,,□,広告代理店（営業担当）,・売上が前年を超えているものの、何とか超えている状態であるため、先行きの予測は難しい。
,,□,経営コンサルタント,・大企業はかなりの賃上げが実現しそうであるが、中小企業の賃上げのほか、人々の消費意欲がどう変わっていくかが重要であり、それによって大きく変わる。
,,□,司法書士,・今月は少し動きが良かったが、長続きするかどうかの判断が難しい。全体的には大きく変わらない。
,,□,コピーサービス業（店長）,・特に明るい話題はないが、注文の問い合わせは増加しており、しばらくこの流れは続く。
,,□,その他サービス［自動車修理］（経営者）,・周囲からも良い話が聞かれない。
,,□,その他非製造業［機械器具卸］（経営者）,・２～３か月ぐらい前から、値上げの話が各メーカーから出てきているが、得意先に認めてもらうまでに時間がかかるため、状況は芳しくない。
,,▲,金属製品製造業（営業担当）,・取引先がコストアップ分の価格転嫁をなかなか認めてくれず、ますます採算が悪化する事態が予想される。
,,▲,金属製品製造業（管理担当）,・太陽光発電の大手企業による事業撤退のニュースなど、不安要素が大きい。現在、太陽光関連で当社の売上の６割を占めている。
,,▲,輸送業（営業所長）,・じゅう器の搬入も落ち着き、事務所移転などの案件が数件決まっているが、年度末ほどではない。
,,▲,輸送業（営業担当）,・例年は机の品切れが発生し、納品が５～６月ごろまでかかるが、今年は品切れもなく納品できているため、配達量が減る。
,,▲,広告代理店（営業担当）,・年度初めは、広告の出稿を控える企業が増える。
,,▲,その他非製造業［電気業］（営業担当）,・景気回復の実感が得られない。
,,×,－,－
"雇用
関連

(近畿)",,◎,－,－
,,○,人材派遣会社（経営者）,・景気は右肩上がりになり、少なくとも消費税率が上がるまでは大きな変化はない。
,,○,人材派遣会社（支店長）,・消費税増税の影響がなくなり、統一地方選挙以降も需要が増える。
,,○,アウトソーシング企業（管理担当）,・夏物商材の加工に関する依頼が入れば忙しくなるので、期待している。
,,○,新聞社［求人広告］（担当者）,・このまま好調な動きが続く。新年度を迎えて、まずは投資などの意欲が高まると感じる。
,,○,新聞社［求人広告］（管理担当）,・求人件数の増加傾向が続いているほか、株価も堅調に推移している。円安で好調な輸出関連以外の企業も業績が堅調であるため、この先も景気は上向く。ただし、関西圏は明確に良くなると断言できる状況にはない。
,,○,職業安定所（職員）,・管内企業からの聴取によると、機械・電機関連の製造業を中心に、景況感はやや良いか、普通という企業が多い。今後の展望も、やや明るくなるか、現状維持という企業が多く、景気が良くなる兆しとみられる。
,,□,人材派遣会社（営業担当）,・物価の上昇による、一時的な消費の冷え込みがあると予想される。
,,□,新聞社［求人広告］（営業担当）,・円安が業績にプラスとなる業種は伸びるが、その逆もある。全体的な値ごろ感の水準が上昇してきているのは確かで、デフレからインフレに少しずつ移行している。ただし、全業種で社員の収入が伸びているわけではなく、偏りがある。求人も新卒に関しては活発化しているが、30代からの転職は停滞している。正社員化は進みつつも、特別契約の社員のウェイトが高い状態が続いている。
,,□,職業安定所（職員）,・新規求人数が増加傾向で、新規求職者数は減少傾向という状況は変わらないが、臨時パートタイマーや非正規社員の割合が高く、景気回復が実感できるほどではない。
,,□,職業安定所（職員）,・景気が良いと考えている事業所は多く、悪いという声は聞こえてこない。３か月先も今の状況が続くと予想される。
,,□,民間職業紹介機関（職員）,・建設需要は持ち直していくが、高齢化などによる地域の日雇い労働市場の縮小は止められない。関西では賃金も上がる方向にない。
,,□,民間職業紹介機関（営業担当）,・景気は現時点で良くなっているが、更に良くなる要素は見当たらない。
,,▲,－,－
,,×,－,－
,,,,
　８．中国（地域別調査機関：公益社団法人中国地方総合研究センター）,,,,
,,,,（－：回答が存在しない、＊：主だった回答等が存在しない）
分野,,景気の先行き判断,業種・職種,景気の先行きに対する判断理由
"家計
動向
関連

(中国)",,◎,競艇場（職員）,・３か月後には全国発売の最高格付け競艇レースが開催されるので、売上が期待できる。
,,○,商店街（代表者）,・季節的な要因もあるが、身のまわりの人の中にも景気は良い方向に向かっていると話す人が多い。
,,○,商店街（代表者）,・気候が良くなり観光シーズンに入るので、景気も良くなって欲しいという願いを持っている。ただ円安や物価高に今後どの時点で歯止めがかかるのか、不安である。
,,○,一般小売店［印章］（経営者）,・法人設立関係の注文が出始めており、企業に前向きな取組が感じられる。
,,○,一般小売店［酒店］（経営者）,・地方へのばら撒きという見方もあるが、プレミアム付商品券が発売されるなど、地方への景気対策が動き出す。大いに期待している。
,,○,一般小売店［紙類］（経営者）,・国内客に限らず海外の観光客も増えると考えられ、景気は良くなる。
,,○,百貨店（経理担当）,・今後を予想することは非常に難しいが、少なくとも売上は前年実績を達成しないといけない。
,,○,百貨店（販売促進担当）,・４月末に県から20％お得な商品券が20億円発売される。市の発売分と合わせると、プレミアム分を含めて36億円相当であり、この商品券が消費高揚の起爆剤になってもらいたい。
,,○,スーパー（店長）,・３月は久しぶりに来客数と客単価がともに前年を上回った。この状況は今後も継続する。
,,○,スーパー（店長）,・前年４～６月は消費税増税後の反動減で売上が非常に悪かったので、それに比較すれば今年は良くなる。
,,○,コンビニ（エリア担当）,・消費税増税から１年が経過したことに加えて、季節的にも消費が上向く時期である。現状より景気は良くなると思われるが、大きな伸びは期待できない。
,,○,コンビニ（支店長）,・最近の客数の動向から判断して、景気は良くなる。
,,○,家電量販店（店長）,・前年４月は消費税増税後の反動減で大きく落ち込んだので、今年はそれに比べれば景気は良くなる。
,,○,家電量販店（企画担当）,・今でも景気は良くないが、これ以上悪くなることはない。
,,○,乗用車販売店（統括）,・４月からは消費税増税の影響が弱まり、前年を上回る販売量が見込まれる。
,,○,乗用車販売店（営業担当）,・今まで消費を抑えていた客も、将来の消費税再引上げを見越して動き出す。
,,○,乗用車販売店（営業担当）,・来客数が増加し、客の購買意欲は上向く。
,,○,その他専門店［和菓子］（経営者）,・プロ野球が開幕し、地元球団を応援する人で街中が盛り上がる。
,,○,その他小売［ショッピングセンター］（所長）,・前年は駆け込み需要の反動減が大きかったが、今年は売上が回復する。特に影響が大きかった衣料品や住関連商品が回復する。
,,○,一般レストラン（経営者）,・プレミアム付商品券が発売されるので、今より景気は良くなる。
,,○,その他飲食［サービスエリア内レストラン］（店長）,・尾道松江線の開通に伴い、高速道路の交通量が増加する。
,,○,観光型ホテル（支配人）,・姫路城の再オープンが期待できる。また台湾や韓国からの季節定期便が復活するので、両国からの旅行客が増える。
,,○,都市型ホテル（スタッフ）,・賃上げ等を実施した元気な企業に利用していただけると期待する。
,,○,旅行代理店（営業担当）,・春闘のベースアップ効果と、国の補助金等の景気対策に期待する。
,,○,タクシー運転手,・今後は観光シーズンに入るし、花見や歓送迎会等のイベントも行われる。特に当地は学校が多いので、期待できる。
,,○,通信会社（企画担当）,・複数の大手キャリアが同時にモバイルやひかり商品について従来のサービス枠を一新する動きを始めている。消費者の関心が徐々に高まる。
,,○,通信会社（販売企画担当）,・ベースアップ実施等で賃金が上昇し、その効果から景気が良くなる。
,,○,テーマパーク（業務担当）,・天候が良くなり、春のイベントも始まる。また連休もあるので、行楽客が増える。
,,○,ゴルフ場（営業担当）,・予約状況をみると、３か月先も好調である。
,,○,住宅販売会社（従業員）,・８％への消費税率引上げから１年が経過するので、消費税増税の影響も薄れてくる。
,,○,住宅販売会社（営業担当）,・客は物件情報の取得がますます巧くなっている。あまり広告宣伝していない物件についても、客が自ら情報を仕入れて、問い合わせてくる場合が増えている。具体的に検討する客の増加を期待する。
,,○,住宅販売会社（営業担当）,・ボーナスの支給時期となるので、客に多少の動きは出る。
,,□,商店街（代表者）,・客の様子から、客は必要以上に商品を購入することもなく、財布のひもは固い印象を受ける。
,,□,商店街（理事）,・生活関連の日用品等が値上がりする一方、賃金は消費に結び付くほどは上がっておらず、消費者に不安感が残っている。悪くなることはないが良くもならず、景気は変わらない。
,,□,商店街（代表者）,・株価上昇や一部大企業のベースアップ実施等により、２～３か月先も３月同様に景気の堅調さが維持される。
,,□,商店街（代表者）,・客の買物に対する態度は２極化が進む。物価上昇の影響を大きく受ける低所得者が買い控える一方、所得が増えている客は商品を大量購入する。
,,□,一般小売店［靴］（経営者）,・年度初めは買物が増える時期であるが、４月以降も様々な値上げが予定されているので、今後も景気は厳しい状況が続く。
,,□,一般小売店［食品］（経営者）,・相次ぐ値上げで客の買い控えが起こり、また客の高齢化と人口減少により消費の低迷も続く。
,,□,百貨店（営業担当）,・アパレルは依然として低迷しているが、飲食、ヘアーサロンやエステ等は好調であることから、今後に期待している。ただテナントの空き区画の解消が喫緊の課題であり、景気回復を実感できるのはまだ先になりそうである。
,,□,百貨店（営業担当）,・外国人旅行客の来店も多少はあるが、テレビで見る爆買いは当地ではみられない。フリー客を呼び込むよう施策を展開しても客数は伸び悩んでおり、今後も常連客を大切にしていく。
,,□,百貨店（営業担当）,・大手企業のベースアップ実施等、景気回復が期待できるようなニュースも出ているが、地方では景気回復が感じられ消費意欲が向上するような材料は少ない。現状より景気が良くなるとは考えにくい。
,,□,百貨店（営業担当）,・景気が変わる要因がない。
,,□,百貨店（売場担当）,・円安による原材料高で衣料品、靴やバッグ等の価格が跳ね上がっている。客の買い方は非常に慎重であり、特に60歳代や70歳代の客は若い世代よりシビアに買物する。４月以降も急に景気が上向く様子はない。
,,□,百貨店（購買担当）,・来月から外商部門は客にお得なカードに切替える予定であり、外商の上得意客であっても３月は購入を見合わせる動きが出ていると聞く。客はポイント付与等の特典があるものには反応するが、それ以外には厳しい姿勢である。アパレルではヒット商品が生まれておらず、今後も試行錯誤が続く。
,,□,百貨店（売場担当）,・当県の地域性かも知れないが、景気の回復や伸長が感じられず、停滞感がある。
,,□,百貨店（営業推進担当）,・４月からは前年の消費税増税後に反動により減少した実績との比較になるが、現状も反動減から完全回復したとはいえず、厳しい状況は継続する。
,,□,スーパー（店長）,・３月より良くなることも悪くなることもなく、このままの状況が数か月は継続する。
,,□,スーパー（店長）,・景気が変わる要因が見当たらない。
,,□,スーパー（総務担当）,・商品単価等も落ち着いているので、景気はこのまま推移していく。
,,□,スーパー（財務担当）,・中小企業の賃金はまだ上昇していない。客は普段は節約しておき、ハレの日にプチぜいたくするような状況が続く。
,,□,スーパー（管理担当）,・景気の改善が続いていると発表されるが、景気は改善というよりも現状維持である。客数や客単価の推移をみると、この先しばらくは今の状態が続く。
,,□,スーパー（販売担当）,・来客数が減少する一方、客単価は上昇する状況が継続する。
,,□,スーパー（営業システム担当）,・商品の値上げが多いため、売上は増加するが、販売数量は減少する傾向になる。
,,□,コンビニ（副地域ブロック長）,・地元のプロ野球球団の応援者を町のあちこちで見かける。
,,□,衣料品専門店（経営者）,・少なくとも自分のまわりでは、景気が良くなるような動きはみられない。
,,□,家電量販店（店長）,・消費税増税の反動が今なお継続している。陽気はすっかり春であるが、客の財布の雪解けは遠い。
,,□,家電量販店（店長）,・販売増を期待できる商品はほとんど見当たらないが、節電志向の高まりにより冷蔵庫やエアコンの単価アップが期待できる。当店で取組を強化しているリフォーム関連商品の伸びを期待する。
,,□,乗用車販売店（業務担当）,・エコカー減税制度に関係した駆け込み需要で、３月の売上は最後になって多少好転した。４月以降も前年のような反動減にはならないと思うが、現状を超えるとは考えられない。
,,□,乗用車販売店（店長）,・自動車業界にとって４～５月は年間の中でも厳しい月である。また目新しい商品もないので、当面は現状維持が続く。
,,□,乗用車販売店（総務担当）,・主力車種のマイナーチェンジが近いため、商談を中断する客が出始めた。新型車の安全技術を比較検討する様子である。
,,□,その他専門店［時計］（経営者）,・地方では円安も株価上昇も、あまり経済効果はない。このままだと景気はもっと悪くなる。
,,□,その他専門店［布地］（経営者）,・当地でもプレミアム付商品券が売り出される。多少、消費が伸びるかもしれないが、一時的なものにとどまる。
,,□,その他専門店［ファッション雑貨］（従業員）,・売上を伸ばす方法として、割引等で客を呼び込む策しか思い浮かばない。客は我慢して待てばセールが開催されると考えるので、通常の日には客が少ない状況が続く。
,,□,その他小売［ショッピングセンター］（運営担当）,・現在は景気の好材料がない。
,,□,高級レストラン（スタッフ）,・個人利用の予約状況はあまり良くないが、全体では前年並みである。
,,□,一般レストラン（店長）,・外国人観光客は前年に比べて増えているが、一般客が減少傾向にあり、トータルでは客数はあまり変わらない。近隣市にできる大型ショッピングセンターが当店にはマイナスに影響する。
,,□,一般レストラン（外食事業担当）,・前年４月は消費税増税で買い控えが起こった。今年４月は統一地方選挙の影響が懸念されるが、前年実績はクリアできる。食材の値上がりを売価に反映させているので心配な面はあるが、全体としては景気に影響はない。
,,□,観光型ホテル（宿泊担当）,・客単価が上がらない。
,,□,都市型ホテル（企画担当）,・大型ショッピングモールの開業景気は納まった。一時よりは低調な景況であるが、天候が良くなるので市場の動きも活発になる。しかし前年は団体需要で特需があったので、その反動が出ると思われ、景気を楽観できる状況ではない。
,,□,都市型ホテル（企画担当）,・宿泊部門は現状が続く。レストラン部門は回復傾向にあるが、物価高騰の影響で客数の減少が考えられる。
,,□,都市型ホテル（総支配人）,・身のまわりでは景気に影響するような事象はみられない。
,,□,旅行代理店（経営者）,・３月決算の企業も多いが、今後の動きに大きな変化は見受けられない。個人消費はやや良くなる可能性がある。
,,□,タクシー運転手,・数か月前から景気に変化はみえない。
,,□,タクシー運転手,・企業は人事異動の時期であり、一時的には人の動きは良いかもしれないが、景気が上向くほどの材料ではない。統一地方選挙が行われ、行事の自粛ムードが出る。
,,□,通信会社（社員）,・販売量が増えるような問い合わせがみられない。
,,□,通信会社（総務担当）,・県内の景気はやや良くなる見込みである。当社の販売数はここ数か月増加しておらず、客の購買意欲も感じられない。
,,□,通信会社（広報担当）,・客は単価は低ければ低いほど良いという姿勢である。景気が良くなる見通しは持てない。
,,□,テーマパーク（管理担当）,・地方では都会ほど賃上げ実施という声を聞かず、個人消費についても消極的な傾向がみられる。
