Ⅱ．景気の先行きに対する判断理由,,,,
,,□,窯業・土石製品製造業（統括）,"・ＩＴ関連業界は在庫調整のより一層の進展で、引き続き生産が上向くものと想定される。
・鉄鋼業界は今後２～３か月先も市況低迷が続くものと想定され、受注量の回復はほとんど期待できない。"
,,□,金属製品製造業（総務担当）,・最近の受注動向をみると、２～３か月先の売上や仕事量が上昇する可能性はなく、むしろ低下する。
,,□,一般機械器具製造（企画経理担当）,・販売量が例年を下回る状況で低迷しており、今のところ回復の兆しがみられないため、現在のあまり良くない状況が続く。
,,□,輸送業（総務担当）,・アウトソーシングの仕事が入ってくる状況が当分続く。
,,□,金融業（営業担当）,"・３月決算企業のほとんどが減益で、納税額が減少しており、納税資金の借入れををしなくても良い状態である。
・例年どの業界も６月ごろまでは動きが鈍いが、今年は特にリストラ等も進んでおり、固定費削減により運転資金の需要も少ない状況である。"
,,□,広告代理店（営業担当）,・２月に倒産した大型総合スーパーを同業大手が買収し５月から営業を開始したが、一般の小売業の不振は目を被うものがあり、とても広告を打って出る元気なく、かろうじて中古車、輸入車と住宅からの広告でもっている状態である。
,,▲,食料品製造業（総務担当）,・夏場にかけては製造量も受注量も伸びがない。
,,▲,会計事務所（職員）,・クライアントの中小零細企業の動静は大手の意向にかかっているが、大手は自分の生き残りを計って、片っ端から中小零細企業に対して極端な値引きを要求してきているため、今後もこの傾向がまだまだ当分続き、良くなる見込みがない。
,,×,－,－
"雇用
関連

(中国)",,◎,－,－
,,○,求人情報誌作成会社（支店長）,・ＩＴ業界の先行きが良くなり、そこからの仕事が増加してきている。
,,□,人材派遣会社（支社長）,・民間企業を中心に外注を手控える傾向があり、上期中は企業の慎重な姿勢が続く。
,,□,新聞社［求人広告］（担当者）,・新聞広告の申込状況は、依然として例年の90％で推移している。
,,□,学校［大学］（就職担当）,・求人件数が４月、５月とも例年との比較で20％程度低下している。
,,□,学校［大学］（就職担当）,・求人数の低下が極端に強まることはない。
,,▲,人材派遣会社（支店長）,・正規社員、契約社員、派遣社員、パート・アルバイトといった雇用形態ではなく、業務のクォリティーに合致した賃金体系が早晩確立しない限り、先行き明るいことなどない。
,,▲,職業安定所（職員）,"・新たな雇用調整の相談があり、雇用調整をやっているところは、まだそれを打ち切る考えがない。
・求人ではパート、臨時雇用の割合が高くなっている。"
,,▲,職業安定所（職員）,・100人規模の事業所閉鎖が予定されている。
,,×,人材派遣会社（支店長）,・４月以降求職者数が増加している。
,,×,職業安定所（職員）,・製造業や建設業を中心に、事業縮小や一時休業などの情報が複数寄せられており、新規求職者数の一層の増加が懸念される。
,,,,
　９．四国（地域別調査機関：四国経済連合会）,,,,
,,,,（－：回答が存在しない、＊：主だった回答等が存在しない）
分野,,景気の先行き判断,業種・職種,景気の先行きに対する判断理由
"家計
動向
関連

(四国)",,◎,－,－
,,○,衣料品専門店（経営者）,・買上点数が増加し、家族連れ客の購買姿勢も積極的で、雰囲気も変わってきている。
,,○,乗用車販売店（従業員）,・新型車の人気がまずまず良い。
,,○,スナック（経営者）,・ワールドカップ関連と夏の暑さから、少しは良くなる。
,,○,観光名所（職員）,・地元では、ビヤガーデン等のイベントを企画しており、来客数の増加が見込まれる。
,,○,住宅販売会社（従業員）,・数年前に住宅展示場に来場された客の再来場が目立っており、住宅建築を計画している客が増えている。
,,○,その他住宅［不動産］（経営者）,・事業用、居住用ともに買い注文が増加している。
,,□,商店街（代表者）,・５月の連休は、例年以上の人出があったが、まだ、客の財布のひもは固い。リニューアルする店も増えてきているが、売上増加につながっていない。
,,□,百貨店（売場主任）,・夏物商材の動きは、低単価商品がよく動いているが、単品買いが多く、夏のセールにあまり期待できない。
,,□,百貨店（営業担当）,・有名ブランド商品は、ブランドにより好不調が現れてきている。高額商品及び大口購入は、前年よりも苦戦しているものの、比較的好調に推移しており、顧客の動向に大きな変化はみられない。
,,□,百貨店（販売促進担当）,・必要なものだけを買い足すということに止まっており、夏のバーゲンについても、客単価の上昇があまり期待できない。
,,□,スーパー（企画担当）,・買上点数が少ない状況が続いている。また、商品単価の下落も続いている。
,,□,コンビニ（エリア担当）,・ここ数か月、来客数、客単価ともに、ほとんど変化がない。天候にも左右されるが、今後、あまり期待できない。
,,□,衣料品専門店（経営者）,・夏季ボーナスが増えない状況の中では、高級品の購入に慎重な態度が続き、また、品物の選択も非常に厳しい。
,,□,衣料品専門店（店長）,・今まで２着買っていた客が、１着で済ませるなど、衣料品類も買い控え傾向が続いている。
,,□,家電量販店（店長）,・家電リサイクル法施行により、買い控えをしていた冷蔵庫を中心に期待が持てるが、なかなか見通しが立たない。
,,□,家電量販店（営業担当）,・生活必需品以外の動きが悪いため、全体的な数字がなかなか良くならない。しかし、単価については大きく下がることはなく、販売量によっては期待できる。
,,□,タクシー運転手,・暑くなるため、本来ならタクシーに乗る客は増えるはずであるが、飲みに出る客が増えるような要因が何もない。
,,□,設計事務所（所長）,・相変わらず大型物件が少なく、耐震や改修工事の物件が多い。
,,▲,コンビニ（店長）,・３月以降、極端に悪くなっており、今後も悪化が続く。
,,▲,設計事務所（職員）,・ここ数か月先まで、販売量、受注量の増加が見込まれない。当分は、仕事量が低迷する。
,,×,通信会社（企画担当）,・通話料が非常に落ちている。電話をあまり使わないという状況にある。
"企業
動向
関連

(四国)",,◎,－,－
,,○,家具製造業（営業担当）,・中国製品の流入がかなり進んでおり、コストダウン要求がかなり厳しい。しかし、荷動きはかなり良くなっているので、今後、やり方次第では良くなる。
,,○,化学工業（営業担当）,・受注量が上向きの傾向にある。
,,○,不動産業（経営者）,・取引先や客からは、以前に比べると明るいニュースが多くなっている。
,,□,パルプ・紙・紙加工品製造業（経営者）,・引合い、見積依頼等が、従来とほとんど変わらない。
,,□,電気機械器具製造業（経営者）,・見積依頼、発注量ともに、良い方向には向かっていない。底這いにある。
,,□,建設業（総務担当）,・公共工事の発注が減少しており、数少ない案件をめぐり、競争が激化し、安値受注が続く。
,,□,輸送業（支店長）,・同業他社の倒産や統合整理で、車両が300台ぐらい減少しているが、全く影響がみられない。全体として、輸送物量が落ち込んでおり、このままの状況が続く。
,,□,通信業（支店長）,・受注に応じてくれる企業が少なく、元気が出ている企業が見当たらない。
,,□,金融業（融資担当）,・取引先の決算内容をみると、減収減益が多く、資金繰りに行き詰まる取引先も出ている。
,,□,広告代理店（経営者）,・例年なら、サマーセールなど夏の広告プレゼンテーション依頼があるが、今年は遅れている。
,,□,広告代理店（経営者）,・広告出稿が多い通信事業会社が、効率化のため、各地域での広告出稿から東京や大阪からの一括出稿に変更してきている。
,,▲,一般機械器具製造業（経理担当）,・建設用クレーンの総需要は、依然として前年を下回っており、また、稼働率も低下していることから、もう一段の需要低迷が心配される。また、小型のクレーンについても、トラックの登録台数が前年同月比を大幅に下回っていることから、その影響を受けることが予測される。
,,×,－,－
"雇用
関連

(四国)",,◎,－,－
,,○,－,－
,,□,職業安定所（職員）,・良くなる要素が見当たらない。常に求職者で混雑している。
,,▲,人材派遣会社（支店長）,・企業の求人は、派遣利用よりも、パート、アルバイトの利用が増えている。
,,▲,人材派遣会社（支店長）,・主要取引企業の業績不振による契約の終了が増えており、この動きは続きそうである。また、派遣料も下落傾向にある。
,,▲,職業安定所（職員）,・卸小売業関係の求人のうち、８割がパート求人となるなど、パート求人の増加と求人の賃金水準の抑制傾向が強まっている。
,,×,－,－
,,,,
　１０．九州（地域別調査機関：（財）九州経済調査協会）,,,,
,,,,（－：回答が存在しない、＊：主だった回答等が存在しない）
分野,,景気の先行き判断,業種・職種,景気の先行きに対する判断理由
"家計
動向
関連

(九州)",,◎,－,－
,,○,商店街（代表者）,・客の流れが良くなっている。旅行用品等が良く売れている。
,,○,商店街（代表者）,・周辺地区の大型スーパー閉鎖の影響もやや一段落し、今後は街中に人が戻ってくる。
,,○,スーパー（店長）,・近隣に超大型店が出てきたのが先々月末なので、ここである程度の底を打ち客数が戻りつつある。買上商品も、安いもの一辺倒から多少付加価値のある高いものに変わってきている。
,,○,スーパー（企画担当）,・買上点数が若干増えており、来客数は大幅に伸びている。今後もこの傾向は続く。
,,○,コンビニ（店長）,・近くに大型商業施設がオープンしたため、今後は客の流れが良くなる。
,,○,衣料品専門店（店員）,・夏物衣料の動きが良くなり、旅行関連商品の動きも戻ってくる。また、セール待ちの客がたくさん来店しているので、セール時期の売上が期待できる。
,,○,衣料品専門店（総務担当）,・来客数が増えおり、婦人服や、中級、高級の宝石類の売上が好調である。今後もこの傾向が続く。
,,○,衣料品専門店（経理）,・来客数が増えており、客は今までより良いものを求めており、薦めれば２点、３点買っていく傾向にあるため、今後も買上単価が上昇していく。
,,○,家電量販店（企画担当）,・ここ１～２か月前から来客数が増えており、今まで売上が不振だったパソコン等が回復しつつある。また、新しいマイナスイオンの製品や住宅関連の生ごみ処理機、除湿機などがよく動いている。今後の売上が期待できる。
,,○,乗用車販売店（従業員）,・新型車が出て、形が良ければ来場も多くなっており、契約も増えている。よって、今後は徐々に良くなっていく。
,,○,その他専門店［ガソリンスタンド］（統括）,・今後は原油価格の安定と円安に向かうと思われる。元売仕切りも落ち着き、小売価格も下落し、需要が伸びてくる。
,,○,都市型ホテル（スタッフ）,・ワールドカップサッカーがある時期は、多くの人が家でテレビをみるためホテル利用は落ち込むが、２～３か月後は終了しているので、ある程度は上向いていく。
,,○,旅行代理店（従業員）,・米国テロの影響は、海外部門ではまだ若干あるものの、最近は７、８月の夏休み期間の旅行申込が増えている。特に、ヨーロッパなど長期旅行の需要が多い。
,,○,通信会社（営業担当）,・買上単価はなかなか上がらないが、販売量が少しずつ増えている。
,,○,通信会社（総務局長）,・新規契約数、来客数の状況から、今後の売上はかなり上向きになることが予想される。
,,○,設計事務所（所長）,・新しい企画や、新築、増築の相談事の持ち込みが多くなっているため、今後が期待できる。
,,□,商店街（代表者）,・当商店街には空調設備、冷暖房の設備がないため、夏は暑く、冬は寒い。また、個人的な商店であるため商品管理も難しくなっている。このような問題に商店街全体で早期解決を図っているが、金銭的な問題が含まれているので、解決されていない。厳しい状況は今後も続く。
,,□,商店街（代表者）,・来客数が増えているが、購入まで至っていない。
,,□,商店街（組合職員）,・来街者は車を所有していない病院帰りの高齢者が多いため、買物は専ら食品が多く、必要なものだけ購入している。今後もこの傾向が続く。
,,□,百貨店（売場主任）,・バーゲン商品に対する反応はあるものの、定価品に対する反応は依然として慎重である。
,,□,百貨店（営業担当）,・食料生鮮品、婦人雑貨、婦人靴、化粧品、婦人服は順調であるが、紳士服が売れていない。また、日常的なものは買うが、それ以外のぜいたく品は控えているという傾向である。今後もこの傾向が続く。
,,□,百貨店（営業担当）,・客の購買意欲が依然として盛り上がりを欠いている。
,,□,百貨店（営業担当）,・各百貨店がクリアランスを６月に前倒しすることが予想される。前倒しにより６月は若干潤うが、その分７月は前年比マイナスになる。
,,□,百貨店（売場担当）,・新たな競争相手の出現で、我が社に関するかぎりは依然厳しい状況が続く。
,,□,スーパー（店長）,・客数は増えつつあるものの、近隣店との競争が激化し、客単価の伸びが鈍化している。
,,□,スーパー（店長）,・現状はやや上向きの傾向であるが、さらにアップする要因が見当たらない。消費者は、価値と価格の一致した商品への購入欲は持っているため、販売点数も伸びているが、客単価、売上総額ともにあまり変動していない。
,,□,スーパー（総務担当）,・６月はワールドカップの影響で、消費は若干上向きになるかもしれないが、大きな伸びは期待できない。
,,□,スーパー（総務担当）,・ここ数か月、衣料品を中心に前年割れが続いており、夏物商材の売れ行きもさほど好調でない。今後も厳しい状況は続く。
,,□,スーパー（企画課長）,・今後、お中元商戦の時期に入るが、地場産業の不振により企業のボーナスがかなり削減されることが想定されるため、あまり期待できない。
,,□,コンビニ（経営者）,・客の様子をみると、やや購買意欲が上向いている人達がいる一方で、リストラ等により失業したという方もいる。
,,□,家電量販店（店長）,・レジ客数が前年より１割程度減っている。
,,□,家電量販店（店員）,・パソコンに関しては、ほぼ全メーカーで新製品が揃い、これから販売量が増えていくことが予想されるが、来客数の減少も加味すると現状は変わらない。
,,□,乗用車販売店（従業員）,・新車販売台数が伸びていない。
,,□,乗用車販売店（管理部長）,・新車が出たことで販売量は少しは上向くが、今年はこの１車種のみの予定であるため、長い効果は期待できない。地道な努力や、客のニーズに応じた仕事をやっていかなければならない。
,,□,乗用車販売店（販売担当）,・生活の中で景気が良くなったと感じられない以上、低価格商品ばかりが購入される。
,,□,都市型ホテル（スタッフ）,・宿泊や宴会場の予約状況を見ても、あまり変化がない。
,,□,タクシー運転手,・デパートに行っても、何も買わずに帰る客を乗せることが多い。また、夜の繁華街はタクシーの台数の方が人より多い、いわゆる提灯行列の状況にある。
,,□,タクシー運転手,・昼の客は増加傾向にあるが、夜の客が減少傾向にあるので、どちらかというと横ばいの状況となる。ただ、観光客がいくらか増加傾向にあるため、その面に期待したい。
,,□,通信会社（業務担当）,・新商品が出ると旧種類の価格が下がり、瞬間的に販売が伸びるかもしれないが、またしばらくすると落ち着いて販売が低迷するというサイクルが繰り返される。今後はサービス部門の強化で機械販売のマイナスを補うしかないという状態である。
,,□,通信会社（営業担当）,・夏のキャンペーンに突入したが、代理店を含め、客の食いつきが悪い。
,,□,設計事務所（社長）,・特に目新しい仕事や目標が見当たらない。
,,□,住宅販売会社（常務取締役）,・住宅業界は今後、より競争が激しくなる。
,,□,住宅販売会社（従業員）,・売上の大幅な増加は見込めないが、民間金融機関から安い金利の住宅ローンが出ているので、それにつられて客が動く可能性はある。
,,▲,百貨店（営業担当）,・非常に予想し難いが、今後はお中元等の法人需要がどこまで落ち込むか、また、個人がそれをどこまでカバーできるかにかかっている。ワールドカップ効果も、小売に対する規制がこれだけある中ではそう期待できない。
,,▲,百貨店（販売促進担当）,・価格競争が更に激化し、そのためにバーゲンの売上が２けたの伸びを示しているが、定価品の売上が前年を大きく下回るという結果になっている。今後はますますこの傾向が続き、売上が非常に厳しい状況になる。
,,▲,旅行代理店（業務担当）,・夏のボーナスの支給額が前年を下回る会社が多いので、レジャーに使う経費が前年より減少する。
,,▲,美容室（経営者）,・どうしても景気回復の材料が見当たらない。ワールドカップがあっても、末端まで効果は波及するとは思えない。
,,×,高級レストラン（経営者）,・以前は法人客と個人客が半々くらいの売上であったが、最近は法人客が激減しており、個人客が７割、法人客が３割くらいの割合になっている。どこまで売上が落ちるか想像できない。
"企業
動向
関連

(九州)",,◎,電気機械器具製造業（経営者）,・これからは製造業が中国へ資本輸出する動きが進む。よって当社では、輸出や輸入に関係ない人的部分の新規事業を目指したが、この事業が今後は着実に成長・発展していく。今、半導体はすごい勢いで伸びているが、当社ではせっかくリストラをして企業体質を再構築したのに、またバランスを崩してしまうため、困っている状況である。
,,○,家具製造業（従業員）,・家具製造業では、東京の民間需要がかなり旺盛であり、その影響がだんだん地方に出てくる。少し明るい兆しが見えてきている。
,,○,精密機械器具製造業（経営者）,・受注量や新規受注の引合いが増えており、また、取引先の営業情報もやや明るいものとなっている。
,,○,建設業（総務担当）,・見積依頼も増えてきており、順調に受注ができれば現在より良くなる。ただし利益が出るかどうかは別である。
,,○,建設業（営業担当）,・９、10月に発注予定の大型物件が官民各方面の職種に上がっている。
,,○,金融業（調査担当）,・株式相場の好転など、マクロ指標の改善に期待が高まっている。
,,□,農林水産業（経営者）,・食品の安全・安心に対するコストアップはかなりの負担になっているが、景気回復が今一つのため、あまり成果は期待できない。
,,□,一般機械器具製造業（経営者）,・業種的には底打ち感があるが、取引先全般からすると、凹凸が非常に激しい状態である。ただ、仕事の絶対量からすると、前年の同時期よりは確実に良くなっていく。
,,□,電気機械器具製造業（経営者）,・半導体の大手リードフレーム関連企業の動きが、６、７月は中だるみという話を聞いている。半導体関連商品の在庫調整がまだ先にずれこむという話も聞いている。
,,□,建設業（経営者）,・工事手控えの状態が続いている。
,,□,広告代理店（従業員）,・折込チラシの代理店に勤めているが、現在の受注状況は底打ち感はあるものの、悪いままずっと継続している感じである。取引先の話からも、しばらくは今の底打ち状態のまま続くことが予想される。
,,□,広告代理店（従業員）,・広告予算の節減状況は底を打っているとは言えない。単発広告の増加には明るい兆しが見られるものの、レギュラー広告の減少が続いている。
,,▲,一般機械器具製造業（経営者）,・製造業では根本的な対策がなかなか見えてこず、製造の中国移管に対する脅威がどうしても拭いきれない状態である。
,,▲,輸送用機械器具製造業（営業担当）,・今まで受注を受けていた主力品が外国での生産に切り替わり、枝葉の仕事が主力になりそうである。
,,▲,輸送業（従業員）,・消費者は安いというだけでは買わず、本当に必要な物だけを買うようになっている。そのため、メーカーが大量生産をせず、在庫、出荷を抑えるという最悪な状態が続いている。
,,×,農林水産業（従業者）,・農産物の生産者価格は一時やや回復したものの、長続きせずに下落を始めている。
,,×,繊維工業（部長）,・ここ２、３か月が生き残りの分岐点になると思う。縫製工場においては、どの工場も小ロット、低単価、クイック対応という苦しい対応ばかりを迫られている。
,,×,窯業・土石製品製造業（経営者）,・窯業界は例年、６～８月は受注量、単価、数量、出荷額ともに落ち込むが、今年は特にひどくなる。
,,×,不動産業（従業員）,・不動産の需給バランスがいまだ改善せず、価格下落に歯止めがかからない状況である。
"雇用
関連

(九州)",,◎,－,－
,,○,職業安定所（職員）,・今回採用意向アンケート調査を実施したが、これまでの調査では中途採用見込みと回答した事業所は10％台だったのが、今回は約52％となっている。
,,○,民間職業紹介機関（支店長）,・需要が前年同時期よりもやや増えている。
