Ⅱ．景気の先行きに対する判断理由,,,,
,,○,その他専門店［携帯電話］（従業員）,・携帯電話の新機種が発売され、ボーナス商戦も始まることから、やや良くなる。
,,○,その他専門店［ガソリンスタンド］（従業員）,・以前と比べ、一部ではあるが高額商品も売れてきているので、今後は徐々に上向いてくる。
,,○,一般レストラン（店長）,・既存のレストランの改装、並びに新規出店が目に付くようになっている。今後は競争が更に厳しくなり、景気も良くなっていく。
,,○,通信会社（営業主任）,・ワールドカップの開幕がケーブルテレビの視聴材料となり、短期的ではあるが、成長するものと期待している。
,,○,設計事務所（経営者）,・先行きが上向くのではないかとの期待感から、見積依頼、店舗建築等の相談が増加してきている。
,,□,商店街（代表者）,・６～８月にはイベントや祭りが多く、来客数、販売量の増加に期待している。
,,□,一般小売店［家電］（経営者）,・専門店は多角化が難しく、取扱商品の販売量減少を他でカバーできない。量販店の出店、消費の低迷や単価の低下が命取りになりかねず、経営努力、経費節約にも限界があることから、閉店するかどうか、継続か決断の時期にきている。
,,□,百貨店（売場主任）,・ファッション雑貨のトレンド品はベルトくらいしかなく、その他の普通の物を普通に売っている状況では、なかなか上昇しない。
,,□,百貨店（販売促進担当）,・バーゲン品を買い求めていた客が、正規価格商品を買い求めるようになってきている。以前より関連商品のまとめ買いも出始め、価格より質重視の傾向が強くみられる。
,,□,百貨店（販売促進担当）,・６月以降、ギフトの早期受注の買取などで、多少購買行動は活発になるが、全体的な冷え込みは続く。
,,□,スーパー（経営者）,・来客数が少しずつ増加傾向にあるものの、客単価は依然として低迷しているため、全体の売上は変わらない。
,,□,コンビニ（店長）,・何か新しい画期的な物がない限りは、変わらない。
,,□,衣料品専門店（店長）,・３か月後も、依然としてＴシャツなどの単価の安い物しか売れず、購入点数や来客数の増加もあまり望めない。
,,□,乗用車販売店（従業員）,・メンテナンス売上は安定しているものの、高額の新車販売が低迷しており、低価格車については現状維持が精一杯である。
,,□,乗用車販売店（営業担当）,・長年取引のある客の会社が倒産しており、自動車の販売はあまり期待できないが、車検、整備に期待したい。
,,□,住関連専門店（店長）,・倒産する会社が増え、来客数があるものの、あまり点数を買わない傾向は変わらない。
,,□,観光型ホテル（スタッフ）,・ビジネス客の予約が減少しており、厳しい状況は変わらない。
,,□,旅行代理店（従業員）,・個人客の買い控え、目的買いが一段と強くなっていることから、今後も価格重視の競争が続く。学校週５日制に伴う、個人客の増加を期待したい。
,,□,タクシー運転手,・利用客が、お年寄りか、仕事で外から来る人などに限られてきており、この何年か夜の仕事がない。この状況は変わらない。
,,□,通信会社（社員）,・普及率が６割に近い携帯電話市場は、成長率の鈍化が著しいが、映像やデータを送受信する非音声分野の開拓で成長の余地もある。
,,□,観光名所（職員）,・来客数はあっても、節約型の客が多く、レストラン、ホテル等の利用者は少ない。
,,□,遊園地（職員）,・フリーパスの購入割合は増加傾向にあるものの、売店単価が低下する等、全体としての単価の大きな上昇は期待できない。
,,□,ゴルフ場（副支配人）,・雇用環境が不安定なために、平日にレジャーを楽しむ人が少なくなり、平日の集客に苦慮している。この状況は変わらない。
,,□,競輪場（職員）,・今後２、３か月の間に、入場者、売上額が急激に増加するということは難しい。
,,□,設計事務所（所長）,・仕事は今のところ落ちついて変わらないが、計画中の物件が進めば２、３か月は安定するので、期待したい。
,,▲,商店街（代表者）,・学校週５日制により、学校関係の行事が取り止めになり、今まで毎年売れていたキャンプ用品等の商品が動かなくなっている。
,,▲,衣料品専門店（販売担当）,・ボーナスシーズンで幾分良くなるものの、来客数が少なく、消費行動がないという状況は変わらず、良くなる要素はない。
,,▲,一般レストラン（経営者）,・駅周辺に居酒屋チェーン、大手物販店等が出店し、既存の商店街とは全く違った商店街が形成され、若者等が流れてしまっている。既存の商店街を歩いている客はまばらで、今後、売上の減少も目にみえており、不安である。
,,▲,一般レストラン（業務担当）,・前年と比べ、３か月先までの宴会、コンベンションの予約数が２割、１件当たりの客数が15～20％減少している。
,,▲,都市型ホテル（スタッフ）,・第１～第２四半期の途中までの宿泊実績は、前年比２千名以上の減少、宴会、会議等も同様の状況であり、今後もやや悪くなる。
,,▲,旅行代理店（経営者）,・法人客が激減しているが、個人的に１年に何度か旅行しようという雰囲気にはなりつつある。大口の客がないのが、大きな痛手になっており、すぐには上向かない。
,,▲,ゴルフ場（支配人）,・梅雨のせいもあり、予約数が曜日にかかわらず激減している。現在、誘客のＤＭ、割引等で対応している。
,,▲,設計事務所（所長）,・３か月後の受注の目安が立っていない。
,,▲,住宅販売会社（経営者）,・公示価格、路線価、固定資産評価、全てのデータが下落しており、単価、販売量ともに悪くなる傾向はぬぐえない。
,,×,一般小売店［金物］（経営者）,・末端の商業者同士では、このままでは営業が先行かなくなると、危機感が強い。
"企業
動向
関連

(北関東)",,◎,－,－
,,○,輸送業（営業担当）,・取引先が繁忙期を迎え、仕事量が増加する。
,,○,金融業（融資担当）,・客の間に、今の商品価格がほぼ底値であるという考えがあり、今後の値上げを懸念して、数か月の間に買っておこうという動きにより消費が伸びる。
,,○,金融業（経営企画担当）,・製造業における在庫調整が進み、一部で受注増加による残業が出てきている。
,,□,プラスチック製品製造業（経営者）,・悪い部分として海外シフトがあり、良い部分としては半導体部門の上向きがあるが、全体としては横ばいである。
,,□,金属製品製造業（経営者）,・鋼材メーカーが、価格の値上げと在庫圧縮を表明し、各業界と価格を交渉中である。今後の状況、その結果次第である。
,,□,一般機械器具製造業（経営者）,・受注量が低い水準で安定してしまっている。
,,□,電気機械器具製造業（経営者）,・2002年度の設備投資などをみると、底を打った感じはするが、低迷状態は依然として続く。
,,□,精密機械器具製造業（経営者）,・景気は底を打ったと言われているが、現実は厳しい状態が続いている。特に製造業においては、ＱＣＤ（品質、コスト、納期）が厳しく、回復の実感はない。
,,□,輸送用機械器具製造業（総務担当）,・４月にコストを３～５％削減しており、その影響がある。車の販売価格が是正されることから、受注も今一つ変わらない。
,,□,その他サービス業［情報サービス］（経営者）,・情報化投資を含めた設備投資には、依然として新規投資が少なく、更新投資が多い。予算も絞り込まれていることから、厳しい状況は当面続く。
,,□,その他サービス業［放送］（営業担当）,・新規のスポットコマーシャルの引き合いが出てきているが、長期のコマーシャルの受注が少なく、伸びは見込めない。
,,▲,建設業（経営者）,・官公庁の発注が早期に行われない限りは、良くならない。
,,×,電気機械器具製造業（経営者）,・いくつかの取引先から、今後更に仕事量が減少する計画があると聞いており、悪くなる。
,,×,建設業（総務担当）,・受注単価は、２割減が当たり前になってきており、施工方法や作業効率の面で、更なる努力が強いられている。
"雇用
関連

(北関東)",,◎,－,－
,,○,－,－
,,□,人材派遣会社（経営者）,"・鋼材関係で生産調整がかなり進展しているが、現状のままの人数で少ない受注に対応している。プラスチック材関係も、平均的な在庫調整で稼動しているが、注文が増加するこの時期でも期待が持てない状況である。
・３か月先までの予測しか立てられない状況の中で、人数は抑えて、コストも削減するという状況の中で作業をしており、非常に厳しい。"
,,□,人材派遣会社（経営者）,・大手企業の仕事量が少なく、派遣の契約期間が短くなっている。
,,□,人材派遣会社（経営者）,・一部ＩＴ関連企業に求人の動きもあるが、製造業全般、公共事業が抑制されている土木建築、住宅産業などが活発にならない限り、求人情勢に変化はない。派遣業界も、営業、一般事務の求人が増加する見込みがない現状では、変わらない。
,,□,職業安定所（職員）,・管内の大手電機メーカー及びグループ企業からの離職者に加え、大手電線メーカー及びグループ企業のリストラ策による離職者が発生してきている。今後も、離職者の増加が見込まれ、雇用情勢の悪化は止まらない。
,,□,職業安定所（職員）,・引き続き、小規模事業所の人員整理による求職者の増加が見込まれ、求人数が多少増加しても、雇用状況の改善は見込めない。
,,□,学校［短期大学］（就職担当）,・今春卒業者への求人問い合わせの時期であるが、規模、業種間格差はあるものの、厳しい状況は変わらない。
,,▲,求人情報誌製作会社（経営者）,・仕事の発注量の見通しが減少傾向にある。
,,×,－,－
,,,,
　４．南関東（地域別調査機関：（財）日本経済研究所）,,,,
,,,,（－：回答が存在しない、＊：主だった回答等が存在しない）
分野,,景気の先行き判断,業種・職種,景気の先行きに対する判断理由
"家計
動向
関連

(南関東)",,◎,＊,＊
,,○,百貨店（売場主任）,"・今後、買い控えの目立つ夏物、盛夏物の動きが出てくる。
・ワールドカップ等のイベントによる特需が見込まれる。"
,,○,百貨店（企画担当）,・セール待ちの来客数の増加が見込まれる。ただし、売上を確保できるかは、売れ筋商品の手配次第である。
,,○,スーパー（店長）,・客の買上点数が若干増加しており、今後は盛夏商品や食品を中心に売上が増加する。
,,○,コンビニ（経営者）,・客にゆとりがみられる。ギフト商品に対する問い合わせが増加し、期待が持てる状況になってきている。
,,○,乗用車販売店（経営者）,・高級車のフルモデルチェンジの効果が現れる。
,,○,旅行代理店（従業員）,・１～３か月先の旅行に関する客の問い合わせが増加しており、申込も入っている。
,,○,タクシー運転手,・26台の増車により管轄地域が拡大され、従業員の教育、新規顧客の開拓につながる。タクシー待ち時間の短縮など、利用者へのサービスの拡大にもつながる。
,,○,通信会社（営業担当）,・放送サービス、インターネットサービスともに、販売量は増加し始めている。単価も下げ止まっているので、やや良くなる。
,,○,観光名所（職員）,・今年の来客数を、前年より３％増やすことを目標としているが、その目標に向かって順調に推移している。
,,○,その他レジャー施設［アミューズメント］（職員）,"・家庭用のゲーム機が売れている。
・ゲームセンターでは単価は下落しているが、来客数は増加しているので、見込みがある。"
,,○,その他サービス［語学学校］（総務担当）,・子供の来客数が多い７、８月に合わせ、夏期講座等のキャンペーンを開催するため、やや良くなる。
,,□,一般小売店［鞄・袋物］（従業員）,・低下し続けていた単価が下げ止まり、逆に上昇する傾向がみられるが、衝動買いはみられず、販売量の回復は厳しい。
,,□,百貨店（売場主任）,・カード優待セール中に購入が集中するなど、客の購買行動は依然としてシビアである。お中元商戦を控えているが、あまり期待できない。
,,□,百貨店（営業担当）,・この数か月好調だった婦人関連を始め、紳士服、子供服が低迷している。主な要因は天候不順と思われるが、ＢＳＥ、表示偽装等の影響で低迷している食品と合わせて考えると、個人消費の底上げにはまだ時間がかかる。
,,□,百貨店（営業企画担当）,・食品の売上は順調に推移する。お中元に関しても、客の反応が良く、売上に期待できる。ただし、衣料品が良くなる動きがみられないため、全体としては変わらない。
,,□,百貨店（副店長）,・買い渋り、特売志向が強まり、単価、利益の向上が難しい。今後もこの傾向は続く。
,,□,スーパー（経営者）,・好材料が見当たらない。客の購買行動は、必要な物は買うが、それ以外は節約するという最低限のものにとどまっている。
,,□,スーパー（店長）,・来客数は増加しているが、食品の精肉、鮮魚や婦人、紳士衣料等で、単価の低下に歯止めがかからない。今後は来客数の伸びも期待できず、単価の下落が止まらない限りは改善しない。
,,□,スーパー（店長）,・今後も不安定な天候と季節の変化が早まることにより、実際に消費者が認識している月と季節商材の最盛期にズレが生じ、販売に苦労する。
,,□,コンビニ（経営者）,・来客数は確実に増加しているが、客は必要品以外には支出せず、単価が上昇しない状態が続く。
,,□,コンビニ（店長）,・購買意欲を刺激する商材や要素がない。
,,□,衣料品専門店（経営者）,・無駄な物は購入しない消費者の購買行動は、景気が多少好転しても変わらない。
,,□,家電量販店（店長）,・ワールドカップ需要が落ち着いた後、成長商品が特別見当たらない。売上が減少することはないが、現状のまま推移する。
,,□,乗用車販売店（販売担当）,・高額車の購入を検討している客は、現金での購入を考えておらず、割賦にしてもボーナス併用が厳しいと話している。
,,□,住関連専門店（販売責任者）,・１人当たりの買上点数は上昇しているが、１点単価、客単価が低下の一途をたどっており、この傾向は変わらない。
,,□,その他専門店［眼鏡］（店員）,・10万円以上の高額商品が都心店舗を中心に順調に推移しているなど、一部では上向きになっているものの、全体としてはやや良くなっているとまでは言えない。
,,□,その他専門店［燃料］（統括）,・当分の間、原油高は進むが、市況販売価格は変わらない。
,,□,一般レストラン（経営者）,・ファーストフード店とスローフード店の使い分けが明確になっている。
,,□,一般レストラン（経営者）,・今後も来客数の増加が見込めず、同業者のつぶし合いが続く。
,,□,スナック（経営者）,・来客数の減少とともに、客が使うお金がシビアになっており、この状況は今後も続く。
,,□,通信会社（営業担当）,・加入獲得営業に関し、種々の方策を立てているが、明るさがみえない。
,,□,ゴルフ場（支配人）,・向こう２～３か月の予約状況は、ほぼ今月並みに推移している。
,,□,設計事務所（所長）,・民間の動きの悪さは４月と同じである。役所の業務も、新築物件はほとんどなく、改修設計が主体であり、発注物件も減少している。
,,□,住宅販売会社（従業員）,・客の購買意欲に特に変化がない。銀行も住宅ローン強化によって、良い金融商品を出してはいるが、特に状況は変わらない。
,,▲,商店街（代表者）,・通行客は減っていないが、買物袋を持っている人が少ない。買上の比率が下がる傾向は今後も続く。
,,▲,一般小売店［茶］（営業担当）,・百貨店では、お中元商戦の開始が前年よりも１週間早まるとのことで、当店もＤＭに加え、直接客に電話をする等の方法を取らないと、客が百貨店に集中してしまう。
,,▲,百貨店（営業担当）,"・お中元商戦は、土日が６月末に入り込んでいることで前年を上回ると思うが、７月に反動が予想される。
・セールに関しても、晩夏物企画などメーカー、小売りが新しい切り口で商品提案をしているが、売上の大幅な増加は期待できない。"
,,▲,百貨店（営業担当）,・ワールドカップ以降の動向が読めない。企画、イベント不足に加え、商品の同質化が顕著になり、売れ筋商品の確保も大きな問題となっている。来店に結びつく大型商品や企画がなければ、売上は悪化する。
,,▲,百貨店（営業企画担当）,・食品の安全性、衣料品のファッション性等、物やサービスに対する消費者の要求水準が、かつてないほど高い。来客数に占める買上客数の割合は減少し続けており、真に満足する商品しか購入しない傾向は、今後更に強まる。
,,▲,都市型ホテル（スタッフ）,・競合相手の新規開店があり、影響を受ける。
,,▲,美容室（経理担当）,・当社が入居している大手スーパーの集客率の低迷により、当社の売上も減少している。固定客の安定的確保に努力しているが難しい。
,,▲,設計事務所（所長）,・一般の客は、建築しようという意志を持っていない。多くのマンションが建っているため、新しくマンションを建てても価格が上がらず、非常に厳しい。
,,×,通信会社（総務担当）,・６月以降も解約者が増加する。
"企業
動向
関連

(南関東)",,◎,＊,＊
,,○,一般機械器具製造業（経営者）,・新規受注の話が入ってきており、今後何件か立ち上がる。
,,○,輸送用機械器具製造業（経営者）,・今後３か月の受注量が増加している。ただし、値引き要求が厳しく、仕事をしても利益が出ない状況で、明るい気持ちにはなれない。
,,□,食料品製造業（関連会社担当）,・食品関係の需要が今後数か月で大きく増加するとは考えにくい。
,,□,化学工業（従業員）,・２か月先の受注状況から、予定生産数量が現在と同じと決定している。
,,□,金属製品製造業（経営者）,・新年度の予算執行が開始される時期となり、見積、受注件数とも増加しているが、予算額が減少するとの声もあり、持続的なものではない。
,,□,一般機械器具製造業（経営者）,・売上が若干回復したように感じていたが、５月の受注量は４月より減少しており、今後にも期待できない。
,,□,輸送用機械器具製造業（経営者）,・今後のスケジュールに関して、親会社から全く指示がない。別分野にも進出しているが、大会社が動かず、仕事の進展が遅い。
,,□,建設業（経理担当）,・受注に向けた案件が相変わらず少なく、この先も景気が良くなる状況にない。
,,□,輸送業（総務担当）,・公共性が強い商品を扱っているので、後半に期待しているが、前半は採算割れしながらも、現状を維持するため、安い運賃設定で回転数を上げる等の企業努力を行うつもりである。
,,□,金融業（審査担当）,・各業種とも依然として借入金の負担が大きく、リストラ策も効果が弱い。
,,□,金融業（渉外・預金担当）,・取引先からは短期の受注しかなく、２、３か月先の受注が取れていない。
,,□,広告代理店（従業員）,・悪くはならないが、高額の仕事が見込めないため、現状維持が続く。
,,□,その他サービス業［情報サービス］（従業員）,・平成14年度の設備投資関係の予算は、一般的に削減傾向にあり、今後景気が良くなるような話が出てこない。
,,▲,輸送業（経営者）,・トラック協会の話を聞くと、入会者が減少する一方で、脱会者が増加し、脱会者の中には倒産、廃業も出ているとのことで、先行きに不安を感じる。
,,▲,不動産業（総務担当）,・大手テナント関連会社の統廃合によって、２、３か月後に事務所スペースの縮小が予定されている。
,,×,電気機械器具製造業（経営者）,・引き合いの数は増加しているが、実際に契約が成立する数は、逆に減少している。
"雇用
関連

(南関東)",,◎,－,－
,,○,人材派遣会社（社員）,・２、３か月先には良くなると考える中小企業経営者が増加し、下期に向かって体力をつけ、採用を検討する企業が急激に目立っている。
,,○,求人情報誌製作会社（営業担当）,・この数か月、事業拡大の中核となる人材採用を積極的に行っている企業の話を耳にしている。特に、飲食業での事業展開の話をよく聞く。
,,○,学校［専門学校］（教務担当）,・ＩＴ業界の採用担当者に勢いがある。他の業界についても、資格等を持った優秀な学生であれば、積極的に採用している。
,,□,人材派遣会社（社員）,・単発、短期的な派遣需要はあっても、固定費削減のため、社員の早期退職や組織の統廃合を行う企業があり、雇用の拡大が見込めない。
,,□,人材派遣会社（支店長）,・現在取引している会社の大半から、当面は派遣人員を増やす予定がないと聞いている。
,,□,職業安定所（職員）,・新規求人数は、11か月連続のマイナスから、前年比９％増加となっているものの、増加分はパート求人で占められている。パート求人の増加によって、求職者数が減少傾向に転じることはない。
,,□,民間職業紹介機関（経営者）,・派遣など非継続雇用の増加、公募による採用が好調であるが、このような雇用形態は、新規事業を立ち上げても目算に合わなければ撤退し、従業員を解雇する事業展開を可能にしており、雇用環境の改善や雇用吸収力に期待できない。
,,▲,新聞社［求人広告］（担当者）,・多少なりとも募集を出している企業でも、２、３か月後の募集は更に減少するという話が出ている。
,,▲,職業安定所（職員）,・雇用調整助成金に関する問い合わせが増加している。
,,▲,学校［専修学校］（就職担当）,・６月以降の採用予定企業で、採用実施を再検討している企業が増えている。
,,×,－,－
,,,,
