Ⅱ．景気の先行きに対する判断理由,,,,
,,□,職業安定所（職員）,・在庫調整が進み、一部製造関係で動きは出てくるが、反面資金的な部分での破綻もあり、一進一退である。
,,▲,職業安定所（職員）,・新規求職者は、製造業からの離職者の増加により、今後も増加が続く。
,,▲,職業安定所（職員）,・大手上場企業の会社更生法申請後、支援企業が決定してきてはいるが、更生計画の動向により、大幅なリストラの可能性があり、下請、関連企業も含め影響が出ることが予想される。
,,×,＊,＊
,,,,
　３．北関東（地域別調査機関：（財）日本経済研究所）,,,,
,,,,（－：回答が存在しない、＊：主だった回答等が存在しない）
分野,,景気の先行き判断,業種・職種,景気の先行きに対する判断理由
"家計
動向
関連

(北関東)",,◎,住宅販売会社（経営者）,・契約予定の客が、３か月前と比べて３割程度増加しており、今後も良くなる。
,,○,商店街（代表者）,・高校総体の開催による人出があり、ホテル、土産物屋、タクシー等を中心に、売上が見込まれる。
,,○,商店街（代表者）,・学校の５日制導入に伴い、野外でのスポーツ活動が盛んになり、各市町村でも活動が多くなるので、やや良くなる。
,,○,百貨店（販売促進担当）,・近隣百貨店の閉店で、ギフト中心の来客数が増加し、売上が拡大する。
,,○,スーパー（店長）,・競合店が出来てからの客の戻りが予想より早いので、このまま計画通り進めば、やや良くなる。
,,○,その他専門店［携帯電話］（従業員）,・携帯電話の新機種の発売予定がある。
,,○,その他専門店［ガソリンスタンド］（従業員）,・数か月前までは大きく前年割れしていた商品が、前年並み、あるいは一部で前年を上回っており、最悪の状況を脱したので、今後はやや良くなる。
,,○,高級レストラン（店長）,・少しずつではあるが、夜の来客数が増加傾向にあり、今後に希望が持てる。
,,○,一般レストラン（経営者）,・このまま家族客が増えていけば、店の活気も出て、今後は回復していく。
,,○,遊園地（職員）,・新規導入アトラクションのパブリシティ効果が期待できる。
,,□,一般小売店［金物］（経営者）,・農具等の需要は増加するが、工事全体は減少しているので、相殺して変わらない。
,,□,百貨店（販売促進担当）,・以前はショッピングバッグをいくつも下げている客が多かったが、最近ではあまり見掛けず、状況は変わっていない。
,,□,スーパー（経営者）,・競合店との競争が激化しており、客単価の低下傾向に変化はない。特売品のみを購入する客が増加し、利益への影響が懸念される。
,,□,スーパー（営業企画担当）,・夏物商戦がスタートする５～７月は、前年と比較して、来客数は横ばいで、単価は低下し、売上全体は70％前後になると想定している。６月にはワールドカップ等の効果を期待しているが、総じて現状と変わらない、あるいはやや悪くなる。
,,□,コンビニ（経営者）,・天候に左右される商品が主力になるため、冷夏になると厳しいが、平年並みであれば何とかなる。５月に銀行ＡＴＭを導入するので、単価の上昇につながると期待している。
,,□,コンビニ（店長）,・ゴールデンウィーク等、様々な販売ツールや販売促進を使って売上アップを狙っていくが、厳しい状況は変わらない。
,,□,衣料品専門店（経営者）,・前年と比べ、来客数、販売額ともに苦戦しており、この傾向はなかなか改善されない。
,,□,衣料品専門店（店長）,・客のカジュアル志向、客単価の低迷は依然として続く。
,,□,乗用車販売店（営業担当）,・来客数や商談件数が伸びず、１件の商談から成約までにかかる時間が長くなっており、厳しい状況は変わらない。
,,□,乗用車販売店（販売担当）,・観光地を控えた地域にある当店の売上は、観光地が良くならない限りは上向かない。セールスに行ったホテルで、３か月後の予約は単価の安い客ばかりだと聞いているため、今後も変わらない。
,,□,住関連専門店（店長）,・来客数は増加しているものの、必要な物以外は買わないため、買上点数があまり変わっていない。
,,□,その他専門店［ガソリンスタンド］（営業担当）,・今後、仕入れ価格が横ばいもしくは、下がる商品もあると懸念される厳しい状況で、変わらない。
,,□,観光型ホテル（経営者）,・春休み、ゴールデンウィークともに、家族連れの動きが大変鈍いため、夏休みも期待できない。
,,□,観光型ホテル（スタッフ）,・直前にならないと宴会、宿泊予約が入らず、見通しが立たない。
,,□,都市型ホテル（スタッフ）,・先行きに良い材料がない。ワールドカップ等の効果も期待できない。
,,□,タクシー運転手,・経費節約ムードが緩む様子がない。休日の人出は増加しているが、タクシーの利用には結びついていない。
,,□,通信会社（社員）,・携帯市場は飽和状態に近く、新規契約の伸びは期待できないが、携帯情報端末（ＰＤＡ）の売上数は、徐々に伸びている。
,,□,観光名所（職員）,・レストラン、ホテルの客数の伸びが期待できず、売上も望めない。
,,□,ゴルフ場（従業員）,・客の予約数が伸びていないため、変わらない。
,,□,その他サービス［自動車整備業］（事務長）,・車歴が10年以上の車が増加しており、特に貨物車ではその傾向が顕著である。入庫車両は若干増加しているが、売上は減少しており、この傾向は変わらない。
,,□,設計事務所（所長）,・特に目立った物件や動きはないが、仕事は途切れることなくあるので、２、３か月は安定する。
,,□,住宅販売会社（経営者）,・民間金融機関の融資が非常に厳しく、客が買う気になっても、ローンが組めずにキャンセルとなるケースがかなり出ている。銀行が慎重過ぎるので、不動産担保の掛け目が低く、審査が厳しい。不動産が動かず、動かないから値段が下がる悪循環が起こっている。
,,▲,百貨店（売場主任）,・当店の場合は、目的買いの客を重視し、固定客が多くを占めている。グループの郊外店は10％の伸びで推移しており、今後もフリー客は郊外店に行く。
,,▲,衣料品専門店（経営者）,・４月末日に駅前百貨店が閉店するため、その影響は計り知れない。
,,▲,乗用車販売店（販売担当）,・来客数は変わらないが、販売量が徐々に減少しているため、今後はやや悪くなる。
,,▲,都市型ホテル（スタッフ）,・前年は65～70％であった客室稼働率が、今年は52～60％前後と１割程度低下している。今後、伸びる可能性は低く、厳しい。
,,▲,美容室（経営者）,・同業者が多く出店しているので、今後はやや悪くなる。
,,×,商店街（代表者）,・平日の商店街は閑散としており、催し物をしても、動員数が以前より少ない。
,,×,コンビニ（店長）,"・当店の近隣に、大型スーパーを核とした150店のショッピングセンターと2,500世帯の団地ができる予定で、今後はその影響を受けて、悪くなる。"
"企業
動向
関連

(北関東)",,◎,－,－
,,○,窯業・土石製品製造業（経営者）,・新社屋オープンに伴い、店舗及び当社主催の教室の利用が見込まれる。
,,○,一般機械器具製造業（生産管理担当）,・連休明けに立ち上がる新規受注品が軌道に乗り、新規設備、勤務体制の変更等を検討している。ただし、受注単価の下落に歯止めがかからない状況である。
,,○,金融業（融資担当）,・金利の底ということもあり、上昇する前に家を建てようという動きがみられるので、やや上向く。
,,○,司法書士,・県内の同業者の状況をみていると、一部地域で受注量が増加している。
,,□,金属製品製造業（経営者）,・悪いままで変わらない。量産の仕事は、中国への生産シフトや中国での調達が主流になってきている。多種少量の仕事は、系列を越えた見積合戦による仕事の取り合いで、仕事のないところが採算を度外視した見積を入れてきている状態で、単価の厳しさは問題外である。
,,□,金属製品製造業（経営者）,・建築関連業界では、首都圏の大型プロジェクトが一段落している。新規物件は秋口からの立ち上がりとなり、４～９月には仕事量の少ない状況が続く。
,,□,電気機械器具製造業（経営者）,・世間一般や大手が動いてきても、自社の受注量が増加するようになるまで、半年くらいは低迷状態が続く。
,,□,電気機械器具製造業（経営者）,・地元の大手企業で、仕事が少し忙しくなってきていると聞いているが、自社の得意先は良くなっていない。
,,□,その他製造業［宝石・貴金属］（経営者）,・現在の低迷が続く。良くなるという判断材料が見当たらない。
,,□,新聞販売店［広告］（総務担当）,・チラシは前年並みであるが、新聞本紙の広告は20％台のマイナスとなっている。２万部発行のミニコミ紙の広告も、同様の数字となっている。
,,▲,化学工業（総務担当）,・仕入れ金額が少額になっているので、従来、手形で払っていたものが、現金払いになっている。
,,▲,その他サービス業［放送］（営業担当）,・製造業の工場の統廃合、大型店の閉店等の影響により、受注契約が落ち込んでいるが、新規のスポットコマーシャルの引き合いが出てきている。イベントの受注は依然として悪い。
,,×,一般機械器具製造業（経理担当）,・海外生産によって、大変な空洞化が起きている。
,,×,建設業（総務担当）,・民間工事受注は、今後ますますの価格競争を強いられる。
"雇用
関連

(北関東)",,◎,－,－
,,○,＊,＊
,,□,人材派遣会社（経営者）,・生産活動がかなり活発にならないと、派遣者数の増加に結びつかない。半導体がやや忙しくなってきているが、全体的には低迷している。
,,□,人材派遣会社（社員）,・受注できる物件数が若干増加しているが、条件が厳しいので利益が出ない。今後、それほど好転はしない。
,,□,求人情報誌製作会社（経営者）,・周辺企業の状況、取引先等の仕事の発注量が変わっておらず、支払が滞る場合が多い。
,,□,求人情報誌製作会社（経営者）,・営業が各地区の企業、店舗を訪問しているが、広告数の伸びが今一つ足りない。
,,□,職業安定所（職員）,・管内の大手電機メーカー及びグループ企業からの離職者に加え、大手電線メーカーとそのグループ企業でも、今後半年～１年間に余剰人員の削減が予定されている。新たな離職者が予想され、求職者、雇用保険受給者とも増加し、引き続き雇用情勢の悪化が見込まれる。
,,▲,人材派遣会社（経営者）,・明るい兆しは見当たらない。有効求人倍率をみると、求職者にとって大変厳しく、この状況はまだ続く。
,,▲,学校［短期大学］（就職担当）,・４月に４回開催している来春卒業生対象の就職合同説明会では、参加企業、求人数とも、前年の70％程度となっている。職種も、専門的な技術職が多く、事務的な仕事は３分の１程度であり、今後も厳しい。
,,×,－,－
,,,,
　４．南関東（地域別調査機関：（財）日本経済研究所）,,,,
,,,,（－：回答が存在しない、＊：主だった回答等が存在しない）
分野,,景気の先行き判断,業種・職種,景気の先行きに対する判断理由
"家計
動向
関連

(南関東)",,◎,家電量販店（営業統括）,・インターネットを通じて、商品を選択、購入する客が増加しており、今後もこの傾向は続くと考えられる。
,,○,商店街（代表者）,・ワールドカップ開催が近づくにつれ、関連商品の販売等で盛り上がり、街の商店主の間に楽観的な見通しが出ている。
,,○,百貨店（売場主任）,・３、４月は、入店客数、売上とも前年を上回り、活気を感じる。ワールドカップの影響で、良い状況が続く。
,,○,百貨店（営業担当）,・購入した商品に合わせ、コーディネートする商品の需要が見込まれ、今後、婦人服の売上は多少増加する。
,,○,スーパー（店長）,・来客数が相当増加しており、この状況が続く。
,,○,コンビニ（経営者）,・今年は、例年に比べて気温の高い日が続いており、夏に向けた動きが活発になると予想される。
,,○,家電量販店（店長）,・徐々にではあるが、商品に動きが出てきており、売上につながる。
,,○,乗用車販売店（経営者）,・５、６月には新型車の発売があり、需要を刺激する。
,,○,都市型ホテル（スタッフ）,・観光施設の新規オープンで、集客に期待できる。
,,○,旅行代理店（従業員）,・来客数が増加する傾向がみられる。個人で旅行に行きたいという意欲が客に出てきている。
,,○,その他レジャー施設［アミューズメント］（職員）,・既存店の売上が好調な状況は、夏までは続く。客単価はさほど上昇していないが、来客数が増加している。
,,○,住宅販売会社（経営者）,・住宅購入者の予算は変わらず、低額物件が売れている。中古マンションの動きも活発化しているので、中堅サラリーマン層の戸建て新築への買換えがやや増加する。
,,□,商店街（代表者）,・商店街の通行者は多いが、足取りが速く、買物袋を持っていない。今後も懸念している。
,,□,一般小売店［家電］（経営者）,・プラズマハイビジョンなどの付加価値商品に対して、客の引き合いが多く、単価が上がるため、やや良くなっている現状が継続する。
,,□,一般小売店［衣料・雑貨］（経営者）,・夏物の展開が早い分、客が気に入る上質な商品であれば、今後に期待ができる。
,,□,一般小売店［パン］（従業員）,・店のリニューアルオープンに多少期待するが、客単価は変わらず、極端に良くなることはない。
,,□,一般小売店［茶］（営業担当）,・新茶の予約が例年通りであり、それほどの落ち込みにはならない。
,,□,百貨店（企画担当）,・イベントや催事の仕掛けを行い、売上を維持するのが精一杯である。何もしなければ、売上が下がる傾向は変わらない。
,,□,百貨店（企画担当）,・割引や、食品、催事が好調であるが、ファッション関連の正規価格品は不振なので、大きくは変わらない。
,,□,百貨店（広報担当）,・個別のヒット商品はあっても、関連商品に広がらないため、迫力に欠ける。バーゲンセールなども、初日には爆発的に売れても長続きしないため、特に７、８月の夏物クリアランスでは、短期決戦が想定される。
,,□,百貨店（販売促進担当）,・最近の来客数並びに売上状況からみて、現状がしばらく継続する。購買商品をみると、高額品が動いてきており、中単価、低単価のものの動きが非常に悪い。
,,□,百貨店（営業担当）,・全般的に気温が高いこともあり、ファッション関連が普通商品を中心に良く売れており、特に、婦人関連は好調である。その反面、ＢＳＥや表示偽装問題で、食品が低迷している。売上の回復には、まだ時間がかかりそうで、景気に悪影響を与えていると考える。
,,□,スーパー（店長）,・ゴールデンウィーク、母の日関連商品の売行きは良い。母の日関連では、従来の衣料関係よりも、健康、花、お茶などが売れており、客のニーズをとらえられたら、今後もやや良い状態で推移する。
,,□,スーパー（店長）,・婦人衣料は、現状を多少上回る水準で推移するが、紳士、子供、雑貨、食料品については、現状をやや下回る。
,,□,スーパー（店長）,・季節や気温の変化が早まり、季節商材の動向、見切りの判断がつき難い状況は今後も続く。
,,□,スーパー（総務担当）,・食品に対する消費者の不信感があり、今の状況が続く。
,,□,コンビニ（経営者）,・この数か月、来客数、客単価ともに、改善する傾向がみられない。
,,□,コンビニ（経営者）,・１人ひとりの買上金額が少ない。来客数が増加する様子もなく、変わらない。
,,□,衣料品専門店（経営者）,・大きな流行商品がない等、急激に好転する要素がなく、自店舗を含め、前年比維持が目標となっている。取引先メーカーも過剰在庫を避けるため、商品の供給を抑える傾向にあり、一部百貨店やブランド直営を除き、業界の苦戦は続く。
,,□,衣料品専門店（販売担当）,・給料日後の来客数が相変わらず増加しない。
,,□,家電量販店（店長）,・ワールドカップの開催、パソコンの新商品販売に期待しているが、客が財布のひもを緩める雰囲気にはならない。
,,□,乗用車販売店（総務担当）,・単価が低下し、売上が増加しない傾向に変化はない。
,,□,乗用車販売店（販売担当）,・定期点検に金を出す客が減少し、高額車が売れない状況は、今後も変わらない。
,,□,その他専門店［ドラッグストア］（経営者）,・この数か月、来客数、買上点数は若干増加している一方、単価が低下し、売上が変わらない状況が続いており、今後もこの傾向は続く。
,,□,その他専門店［眼鏡］（店員）,・高級ブランド品の動きは好調であるが、ファッションによって掛け替えて楽しむという複数購入にはならない。
,,□,スナック（経営者）,・今年の４月は団体客も少なく、歓送迎会も少ない。歓送迎会があっても、客単価が低い。
,,□,都市型ホテル（スタッフ）,・婚礼については、３か月後の予約が入っており、一般宴会も取り止めを予定したものが、急に決行になるなど、明るい材料はある一方で、直前に予約し、短期間のうちに準備をするものもあり、今後も変わらない。
,,□,旅行代理店（従業員）,・３か月先の夏に向けた予約は良くなく、現状のまま推移する。
,,□,タクシー運転手,・地元密着型のタクシー会社にとって、規制緩和による減収は避けられない。
,,□,通信会社（企画担当）,・５月は連休があり、多少の不安もあるが、良くなっている状況に変わりはないと予想している。
,,□,観光名所（職員）,・来客数も伸びず、客単価も低下する状況が変わらない。
,,□,美容室（経理担当）,・業者の回転が予想以上に早い。新規顧客の獲得も難しく、固定客の維持に専ら努力している状態である。
,,□,その他サービス［語学学校］（総責任者）,・１～４月の累計販売量及び顧客訪問者数からみて、相応の売上が見込まれるが、楽観はできない。業界そのものは収益をあげているが、全般的な景気はまだ悪いので、足を引っ張られる可能性はある。
,,□,設計事務所（所長）,・この数か月、将来入る仕事がほとんどみえず、現状のまま推移する。
,,▲,百貨店（営業企画担当）,・重衣料が動かず、単価の下落傾向に更に拍車が掛かる。トレンドのピークも短くなっている。
,,▲,スーパー（経営者）,・客は、低予算で毎日の食生活を考えている。高い物が売れないわけではないが、価値があれば買うという購買行動は、しばらくの間は控えられる。
,,▲,コンビニ（経営者）,・３月に周辺の店舗が閉店し、地区に活気がなくなっており、この状況は今後も続きそうである。
,,▲,衣料品専門店（経営者）,・ファッション性よりも、実用的で安い商品に客の目が向いている。
,,▲,一般レストラン（経営者）,・店舗数の増加により客は分散され、つぶし合いの競合状態が続く。
,,▲,タクシー運転手,・ゴールデンウィークに消費した分の反動が、２、３か月後に現われる。夜も官庁の利用が相応にあるだけで、駅から家へのタクシーの利用はほとんどない。
,,▲,タクシー（団体役員）,・組合本部で把握している仕事の内容、集計表から、景況は悪くなっている。組合の賦課金等も、この２、３か月、滞納が急増している。
,,▲,美容室（経営者）,・例年は、暖かくなると消費意欲が高まるが、今年は明るい見通しがない。
,,×,百貨店（営業担当）,・春夏物の整理期を迎える今後、商材不足、ヒット商品の不在などにより、苦戦が予測される。
,,×,自動車備品販売店（経理担当）,・今まで集金ができていたところも、滞納するようになっており、今後に不安が残る。
,,×,通信会社（総務担当）,・１年間の総決算を行った数字をみると、良くなるとは思われない。
"企業
動向
関連

(南関東)",,◎,－,－
,,○,金属製品製造業（経営者）,・新規顧客からの見積件数が増加し、成約も２件出ている。従来からの部品でも、ロットは小さいが、受注件数は増加しつつある。
,,○,電気機械器具製造業（経営者）,・今年に入り、売上実績が前年同月比を上回っており、景気は底を打った感がある。
,,○,税理士,・取引先の金属加工業の一部に、受注が若干増えてきたという声がある。
,,□,食料品製造業（関連会社担当）,・季節要因で多少明るい面も出ているが、大きくみると受注量が大きく増加することも見込まれず、当面現状のまま推移する。
,,□,繊維工業（経営者）,・中年の婦人服は、柄物が動いている。無地物は輸入品に押されるので弱く、柄物に力を入れるつもりであるが、３か月先の全体の見通しに、大きな変化はない。
,,□,出版・印刷・同関連産業（営業担当）,・コストよりも納期を優先する客が多くなっており、受注単価の底打ち感が出ている。
,,□,プラスチック製品製造業（経営者）,・先の注文が全く入っておらず、悪い現状と変わらない。
,,□,輸送用機械器具製造業（経営者）,・トラックメーカーは生産量が20～30年ぶりの低水準であり、仕事が少ない。他分野の仕事も難しく、悪い状況のまま推移する。
,,□,建設業（経理担当）,・今後の受注につながるような案件が、なかなか見当たらない。
,,□,輸送業（総務担当）,・当社の取扱品は公共性の高いものであるが、公共事業が動かず、輸送量も少ない。得意先の出荷も増加しておらず、計画や荷動きが出てくる８月までは、苦しい現状のまま推移する。
,,□,通信業（営業企画担当）,・各社による競争が激化しているＩＰ系サービスについては、サービスの品質及び低価格化の傾向が依然として続き、景気の上昇は見込めない。
,,□,不動産業（従業員）,・仕入れ価格、売却価格ともに、今後とも下落が続く。
