Ⅱ．景気の先行きに対する判断理由,,,,
,,○,鉄鋼業（総務担当）,"・４月に入ってからエレクトロニクス向けの材料に動きが出ており、受注も活発になっている。
・客の話からも半導体を中心に回復している状況がうかがえる。"
,,○,非鉄金属製造業（経理担当）,・主力製品である電池の材料は、今後上向いてくるが、販売価格は低迷したままであり、それほど大きくは伸びない。
,,○,電気機械器具製造業（総務担当）,・開発、試作の商談が活発化している。
,,○,輸送用機械器具製造業（経理担当）,・新製品向けの部品の生産が予定よりも大幅に増加する。
,,○,輸送用機械器具製造業（総務担当）,・受注量に改善がみられる。
,,□,化学工業（総務担当）,・一時的に稼働率が上昇しているが、原料価格の高騰もあり今後については不透明である。
,,□,化学工業（総務担当）,・近隣企業も含め経費節減で非常に厳しい状況にあり、今年一杯は製品の需要が伸びる見込みが立たないので回復しない。
,,□,窯業・土石製品製造業（統括）,"・鉄鋼業界は今後２、３か月先も市況回復をほとんど期待できない。
・一方、ＩＴ関連業界は在庫調整の進展で、引き続き生産が上向くものと想定され、今後の受注量の増加にわずかながらも期待できる。"
,,□,鉄鋼業（広報担当）,・市中の在庫レベルもまだ高めであるため、今後も引き続き減産対応が続く。
,,□,通信業（営業担当）,・大量のリストラを伴う体質改善を進めてきた顧客企業等が、急激に積極的姿勢に転じるとは言えず、個人消費も低迷のまま、当分スローペースの景気の動きにならざるを得ない。
,,□,金融業（業界情報担当）,・受注量の回復は期待できるが、単価の厳しさから採算難は続くとみられ、景気反転までは至らない。
,,□,コピーサービス業（管理担当）,・先の予定、計画等の話が商談の中で上がってこない。
,,▲,＊,＊
,,×,－,－
"雇用
関連

(中国)",,◎,－,－
,,○,＊,＊
,,□,人材派遣会社（支社長）,・年度末で企業からの引き合いが減少したり、契約終了が多かったことで、若干悪くなっておりこの状態が続く。
,,□,職業安定所（職員）,・窓口を訪れる求職者の数が減少していない。
,,□,民間職業紹介機関（職員）,・欠員補充での採用は生じているが、先行投資型の採用が少ない。
,,□,学校［大学］（就職担当）,・新卒者に対する求人は長期化しており、２、３か月後の求人数は例年を上回らない。
,,□,学校［大学］（就職担当）,・現在の状況が特別悪くなる前兆はないため、３か月後も現状並みの求人が見込まれる。
,,▲,職業安定所（職員）,・製造業において雇用調整の相談がある。
,,×,職業安定所（職員）,・製造業や建設業を中心に、事業所閉鎖、事業縮小、一時休業などの情報が複数寄せられており、新規求職の一層の増加が見込まれる。
,,,,
　９．四国（地域別調査機関：四国経済連合会）,,,,
,,,,（－：回答が存在しない、＊：主だった回答等が存在しない）
分野,,景気の先行き判断,業種・職種,景気の先行きに対する判断理由
"家計
動向
関連

(四国)",,◎,住宅販売会社（従業員）,・来客数が増加しており、具体的な商談も増えていることから、受注増加が見込まれる。
,,○,商店街（代表者）,・商店街にある大型店のリニューアルオープン、新規オープン、改装等があり、人通りが増えている。
,,○,スーパー（店長）,・今年は気温の上昇が早く、夏物商戦に好材料である。
,,○,スーパー（企画担当）,・花見需要、初夏物の動きが３月に前倒しになったため、今月は若干の落ち込みがあるが、客の購買意欲に好転がみられる。
,,○,家電量販店（店長）,・ワールドカップの需要、家電リサイクル法の影響による買い控え傾向の落ち着きが期待される。
,,○,乗用車販売店（従業員）,・今後発売される新型車に期待される。
,,○,通信会社（営業担当）,・買い控えの我慢も限界が来ていることから、春夏物、ブランド物が売れ出しており、購買意欲が旺盛になっている。
,,○,観光名所（職員）,・築城400年祭のイベントがあり、多少の増員が見込まれる。
,,○,その他住宅［不動産］（経営者）,・住宅関連、事業用の土地の引き合いがやや多くなっている。
,,□,一般小売店［菓子］（販売担当）,・来客数の低迷が続いており、また、購買を刺激する材料も見当たらない。
,,□,百貨店（売場主任）,・これから夏物シーズンを迎えるが、客の購買意欲があまり感じられない。また、単品買いの客が増えており、客単価も厳しい。
,,□,百貨店（営業担当）,・ファッション関連は、コーディネート購入が続いている。また、有名ブランド商品も一部に翳りが見られるが、購入意欲は高水準を維持している。しかし、目的買い商品以外に対する購入意欲は低い。
,,□,百貨店（営業担当）,・客単価は大きくは落ち込んでいないが、来客数が減っている。必要な物以外は買わないという傾向が続いている。
,,□,スーパー（財務担当）,・売上は回復してきているが、客単価は前年10月以降、毎月下落しており、過去最低となっている。
,,□,衣料品専門店（店長）,・必要な物は買うが、衝動買いは全くなく、選ぶのも慎重である。
,,□,乗用車販売店（従業員）,・新型車の投入が当分なく、購入者が増えるとは思えない。
,,□,乗用車販売店（営業担当）,・目新しい商品がなく、厳しい状況が続く。
,,□,旅行代理店（経営者）,・２、３か月先の見積、受注は、前年同期とあまり変わらない。
,,□,ゴルフ場（従業員）,・来場者数は、前年を上回って推移しており、今よりは悪くならない。
,,□,設計事務所（所長）,・分譲マンションの勢いに翳りがみえる。
,,□,住宅販売会社（従業員）,・受注価格の低下傾向と客の慎重な考えはあまり変わらない。
,,▲,スーパー（店長）,・来客数は２けたの増加をしているが、単価、購入点数ともに伸びていない。
,,▲,乗用車販売店（従業員）,・現段階で良くなる要素が何も見あたらない。
,,▲,設計事務所（職員）,・今年度の公共事業の減額率が確定しており、地方自治体から受注が減ってくる。今年１年はかなり悪くなる。
,,×,コンビニ（店長）,・売上の減少が続いているが、今月は落ち幅が大きい。特に酒類は、完全にビールから発泡酒に切り替わっている。
,,×,通信会社（企画担当）,・通話料が非常に少なくなってきている。客の財布が固くなっている。
"企業
動向
関連

(四国)",,◎,－,－
,,○,家具製造業（営業担当）,・４月実績、５月の出荷見込みを見ると、今が底である。得意先の状況から、６月後半以降、少々持ち直す気配がある。
,,○,パルプ・紙・紙加工品製造業（経営者）,・投入した新商品が少しずつ受注につながっている。
,,○,一般機械器具製造業（経理担当）,・得意先の仕事見込みが好転してきたためか、買換えによる受注が増えている。また、複数台の受注も出てきている。
,,□,食料品製造業（従業員）,・売上は多少上がっているが、単価が低下しており、利益を圧迫している。
,,□,一般機械器具製造業（経理担当）,・クレーンの総需要は３か月連続で前年を下回っている。クレーンのチャーター料金の回復が見込まれない中では、新車の販売意欲は出てこない。
,,□,電気機械器具製造業（経営者）,・見積件数は、例年と変わらない。また、こちらから提案してもあまり反応がない。設備投資は、慎重である。
,,□,輸送業（配車担当）,・荷動きは、若干動いているようにも取れる。しかし、景気が良くなると感じるほどではない。
,,□,広告代理店（経営者）,・新聞、テレビなどマス媒体の出稿量が低迷しており、今後の見込みも厳しい。
,,□,公認会計士,・取引先の倒産の噂が絶えない。取引先の決算数値を見ても、急激に景気が良くなる兆しはない。
,,▲,＊,＊
,,×,＊,＊
"雇用
関連

(四国)",,◎,－,－
,,○,－,－
,,□,求人情報誌製作会社（従業員）,・リストラなど暗い話は聞かなくなったが、企業の採用意欲は弱く、人材確保より仕事量の確保に必死である。
,,□,職業安定所（職員）,・求職者の増加が止まらず、高水準で推移している。求人については、臨時契約、雇用期間など、不安定要素のある求人が多く、正社員の増加が見られない。
,,▲,人材派遣会社（支店長）,・取引先企業の業績悪化による派遣契約の終了、あるいは、基幹支店への業務集約による派遣契約の終了というケースが出ている。また、料金の安い派遣会社への移行が見られ、人件費にシビアになっている。
,,▲,職業安定所（職員）,・求人数の減少とあわせて、パートや賃金水準の抑制傾向が強まっている。
,,×,－,－
,,,,
　１０．九州（地域別調査機関：（財）九州経済調査協会）,,,,
,,,,（－：回答が存在しない、＊：主だった回答等が存在しない）
分野,,景気の先行き判断,業種・職種,景気の先行きに対する判断理由
"家計
動向
関連

(九州)",,◎,－,－
,,○,商店街（代表者）,・来客数、売上高共に顕著に伸びており、今後もその傾向は続く。
,,○,コンビニ（店長）,・近くに大きな商業施設が出来たために、県内各地からの客が来て、街が活性化していく。
,,○,衣料品専門店（店員）,・ゴールデンウィークはかなり旅行客が多く、４月は旅行用の衣料品等を買う客が多かった。３か月後は夏なので、単価は低下するが、出かける客のニーズが見込める。
,,○,衣料品専門店（総務担当）,・４月はヤング、ミセスともに、売上、単価、客数が増加しており、これまでとは違う力強さを感じている。
,,○,衣料品専門店（経理）,・高額品を買う客が増え、買上点数も増えている。
,,○,家電量販店（企画担当）,・全体的に商品の動き、回転が良くなっており、販売量も前年をやや上回るようになってきた。全体的に上向きつつあるので、夏場にかけてもっと良くなる。
,,○,乗用車販売店（従業員）,・新車販売台数が増えてきている。
,,○,テーマパーク（職員）,・これから会社で新しいプランが発表されてくるので、来客数が増える。
,,□,商店街（代表者）,・地場大手企業が倒産し、良い材料があまりない。
,,□,商店街（組合職員）,・街の中心地やバスセンター、バスターミナル近辺での空き店舗が徐々に増加しており、厳しさは変わらない。
,,□,一般小売店［青果］（店長）,・人の流れが減少している状況は変わらない。
,,□,一般小売店［生花］（店長）,・大型店舗オープンによる効果も、２～３か月先は薄れる。
,,□,百貨店（営業担当）,・紳士服の動きが依然として低調であるが、婦人雑貨は前年を確保し、食品は生鮮部門を中心に若干の伸びを見せている。ただ、売上全体からみると店頭売上が伸び悩んでいる。この状況はまだ続く。
,,□,百貨店（営業担当）,・個人向けの商品は良くなるが、法人需要は低迷しており、特に６、７月のお中元商材を見極めなければ判断しかねる。
,,□,百貨店（営業担当）,・バーゲンセールなどでの客の買い方が、依然慎重である。
,,□,百貨店（売場担当）,・客の財布のひもはやや緩くなっているが、景気を底上げするほどのパワーがあるとは思えない。
,,□,百貨店（売場担当）,・来客数は増えていないので、客単価と購買単価がどれだけ上がるかが売上を左右する。
,,□,百貨店（業務担当）,・大手小売業の破綻のニュースなど、消費を喚起する側が低迷しているため、厳しい状況は今後も続く。
,,□,スーパー（店長）,・すぐ近くに超大型店がオープンしたが、その影響もそう受けなかった。客はやはり、ファッション性の高いもの、付加価値の高いもの、美味しいもの、健康関連商品であれば多少金を使ってもよいと考えているようだ。
,,□,スーパー（店長）,・客数の伸びはあるものの、客単価が上がらないため、売上が増えない。
,,□,スーパー（企画担当）,・チラシによる客の動き、販売量は若干改善しているものの、不安要素がまだ多くある。
,,□,コンビニ（エリア担当）,・客の動き、客数、客単価を考えると、売上は上がらない。
,,□,コンビニ（店長）,・周囲の状況も厳しく、客の反応も鈍い。良くなるような要素がなく、今後もこの状況は続く。
,,□,コンビニ（販売促進担当）,・最近はどこでも値段を下げているため、客は、２～３割くらいの値下げでは買わず、半額ぐらいにならないと飛びつかない。
,,□,家電量販店（店長）,・レジ単価は上がってきているが、レジ客数が10％ほど低下している。
,,□,家電量販店（店員）,・単価の高いデジタルテレビや大型冷蔵庫等が動くようにはなってきたが、家電リサイクル法施行前の駆け込みの反動でほとんど物が動かなかった前年に比べ、伸び率が少なくなっている。
,,□,家電量販店（店員）,・パソコン販売では、製造原価が上がったことにより販売単価も上がってきたおり、そのため買い控える客が出てきている。今後もこの状況は続く。
,,□,乗用車販売店（従業員）,・形の良い車を導入すると客の動きは良くなるが、いざ商談してみると、高い車は売れない。
,,□,乗用車販売店（管理部長）,・ＤＭ、ＣＭ広告をどれだけ打っても、その効果は非常に薄い。
,,□,その他専門店［ガソリンスタンド］（統括）,・石油業界では、セルフスタンドが多くなってきており、価格自体も下がり気味である。セルフスタンドにすると従業員数も少なくなり、雇用の面ではでも厳しくなる。
,,□,その他小売［雑貨卸］（総務担当）,・大型連休に入っても売上が伸びず、みな買い控えをしている。
,,□,都市型ホテル（スタッフ）,・宿泊、宴会レストランの予約状況にあまり変化がない。
,,□,都市型ホテル（スタッフ）,・ワールドカップで若干の効果は期待できるが、基本的な回復にはならない。
,,□,都市型ホテル（副支配人）,・客の動きはやや良くなっているが、団体や顧客の単価から見ると状況は変わらない。
,,□,旅行代理店（従業員）,・ワールドカップ開催のため、サッカーファン以外の人の動きが鈍くなる。６月の旅行の申込が非常に悪く、厳しい状況は変わらない。
,,□,旅行代理店（従業員）,・客に金と暇がないと旅行が増えないため、ここ何年かは期待できない。
,,□,タクシー運転手,・郊外に大型店が開店したせいもあるが、自家用車で行動する客が多く、タクシーを利用することが少なくなった。
,,□,タクシー運転手,・サービス業などの倒産で求職者が増え、人の動きが少なくなっている。
,,□,通信会社（業務担当）,・携帯販売も需要の低迷と価格の高値安定により、限られた顧客を他競合店と囲い込み、奪い合うという状況である。今後もこの状況は続く。
,,□,観光名所（職員）,・ゴルフ場については、依然として客単価が下がったままであるが、もし多少でも高くしてしまうと客は別の方にいってしまうのではないかという危惧がある。建設業関係の不振で客が減っているのも事実である。
,,□,パチンコ店（店員）,・店舗存続のために各店一生懸命に営業努力をしているが、その上で現状維持という状況である。
,,□,美容室（店長）,・まだ高校を卒業したばかりの客で、就職がなかなか決まらないという話を聞く。
,,□,設計事務所（社長）,・新しい仕事の物件が将来的にあるわけでもなく、今の悪い状態が続く。
,,□,住宅販売会社（常務取締役）,・供給・需要ともに低調である。
,,□,住宅販売会社（従業員）,・客のニーズに合わせたものを作るのだが、ニーズが多様化し、値段等の設定が難しい。
,,□,住宅販売会社（従業員）,・公募の融資条件に適合しない客が出てきている。また、公募の受付に人が来ない。
,,▲,百貨店（売場主任）,・1人当たりの買上単価が伸びる兆しがなく、来客数も近隣スーパー閉店の割に微増にとどまっている。
,,▲,百貨店（総務担当）,・客の考え方が、生活レベルを上げたいという気持ちより、今のレベルを維持したいという方向にあり、余分な物を購入しなくなっている。
,,▲,衣料品専門店（商品担当）,・客数の減少と単価のダウンで景気はやや悪くなる。
,,▲,一般レストラン（スタッフ）,・周りの競合店の様子をみても、来客数が増える傾向にはない。
,,▲,観光型ホテル（支配人）,・客と話をするが、まだまだ会社を縮小したり、倒産するところが増えてくると聞く。
,,▲,パチンコ店（店員）,・月ごとに客の使用単価が減少している。
,,▲,住宅販売会社（従業員）,・新築住宅の着工戸数が減少している。
,,▲,住宅販売会社（従業員）,・近いうちに住宅金融公庫が廃止になるが、それに代わる受け皿がはっきりと出ていない。
,,×,高級レストラン経営者,・予約状況からみて、前年より悪くなることははっきりしている。例年、長崎地方では６月は厄入り、厄払いなどを料亭でしていたが、近年はそういう機会が少なくなっている。
,,×,スナック（経営者）,・最近の客の様子を見ていると、目に力がなく、以前のように仕事について活発な意見を交わすことがない。ただ毎日を無事に過ごせたらよいという感じの客が増えている。また、退職をいつするかという話題が増えている。
"企業
動向
関連

(九州)",,◎,電気機械器具製造業（経営者）,・全般的に半導体関連は、底打ちされたと認識している。リードフレーム関連と液晶関連、半導体装置関連も平行してやや上向いてくる。
,,○,食料品製造業（経営者）,・全体の売上を底上げするには至らないが、営業部門においては部分的な売上の増加を見込める情報を得ている。
,,○,一般機械器具製造業（経営者）,・引合い件数が少し増えているが、まだ完全に回復したという感じはない。
,,○,電気機械器具製造業（経営者）,・本業の製造業は半導体を中心として良くなっていくと思う。また、新規に立ち上げた保育事業やカルチャーセンターも良くなっており、攻めの経営ができるようになる。
,,○,精密機械器具製造業（経営者）,・最近、新規見積や取引先の状況からみると、ＩＣ関連を中心に景気が少し良くなりつつある。また、受注が今までより増加している。
,,○,輸送用機械器具製造業（営業担当）,・輸出用機械器具（特にアメリカ向け）が６～８月にかけて多くなる。
,,○,建設業（総務担当）,・上半期の公共工事の発注や、民間の見積依頼が出始めたため、今よりは良くなる。
,,□,輸送業（従業員）,・従来の価格と量では消費の向上は望めないため、各メーカーはおまけを付ける、単価を下げる、大口発注をした人に特典をつける、など試行錯誤している。その結果、売上は現状維持できている状況である。
,,□,広告代理店（従業員）,・チラシの枚数、件数等を考えると、ここ何か月かは悪くなる傾向にあったが、最近は底を売った感がある。
,,□,広告代理店（従業員）,・広告取扱量を増やすクライアントもあるが、総じて単発の注文が少なくなっており、好転は望めない。
,,□,経営コンサルタント,・企業の経営体質の強化がまだ終わっていない。
,,▲,窯業・土石製品製造業（経営者）,・同業者間の競争が激化し、市場単価、取扱量が急激に下降している。今後も業界では厳しい状況が続く。
,,▲,窯業・土石製品製造業（経営者）,・連休中に陶器市があったが、前年より客の商品選びが慎重になっており、価格が安い方へに流れているようだ。また、陶器市の人手も前年と比較して少なく、今後の受注に対しても心配している。
,,×,繊維工業（部長）,・周辺の縫製工場の閉鎖がまだ続く。品物によって閑散期が違うが、その閑散期に耐え得る力がなくなっている。
"雇用
関連

(九州)",,◎,－,－
,,○,人材派遣会社（社員）,・夏の商戦に向けて動き始めた企業が多く、販売促進のために人を増やそうという試みがある。
,,○,人材派遣会社（社員）,・業界にとらわれず長期派遣の依頼が増えている。
,,○,職業安定所（職員）,・ＩＴ関連企業の在庫調整が終息の状況にあるため、若干求人が増える。
,,○,職業安定所（職員）,・３月の新規求人数、５人以上の企業整備状況、企業訪問状況などから判断すると、やや良くなっている。
,,○,民間職業紹介機関（職員）,・半導体業界の求人が活発化しているため、業界によっては見通しが明るいが、他業界はまだ低迷が続くと思われる。
,,□,人材派遣会社（社員）,・いろんな求人や求職の状況を見ていて、良くなっている傾向もあるが、まだまだそれが今後良くなるという確信的なものではない。
,,□,人材派遣会社（社員）,・派遣の需要が少なくなってきている。景気の回復を雇用が引っ張るのではなく、景気が良くなって雇用が生まれるという、今までとは逆の傾向にある。新しい雇用を誘発するような起爆剤が無い。
,,□,求人情報誌製作会社（総務担当）,・企業のヒアリングや調査等をみて、新規求人を増やす動きが感じられない。新卒、中途ともに慎重である。
,,▲,職業安定所（職員）,・地場大手スーパーが民事再生法の手続中であり、今後どのように進むか非常に懸念される。また、ある製造業では、200名程度の解雇が６月末に予定されており、まだ油断を許さない状況である。
,,▲,学校［専門学校］（就職担当）,・今後、地方では特に男性の40代・50代の方のリストラが増加する。
,,×,職業安定所（職員）,・今後もリストラが進み、就職は難しい状況になる。
,,,,
　１１．沖縄（地域別調査機関：（財）南西地域産業活性化センター）,,,,
,,,,（－：回答が存在しない、＊：主だった回答等が存在しない）
分野,,景気の先行き判断,業種・職種,景気の先行きに対する判断理由
"家計
動向
関連

(沖縄)",,◎,＊,＊
,,○,一般小売店［衣料・雑貨］（店長）,・観光客数の増加に伴い、来客数が増加する。
