Ⅱ．景気の先行きに対する判断理由,,,,
,,□,職業安定所（職員）,・依然として小規模なリストラが継続している。新規求職者数は一進一退であり、雇用保険の被保険者数の減少傾向も継続しているため、好転するきっかけが見当たらない。
,,□,職業安定所（職員）,・新規求人数は増加しているが、その大半はパートなど身分の不安定な求人である。また雇用保険被保険者数は今年３月から前年同月比で減少を続けている。先行きは不透明とする事業主がほとんどである。
,,▲,人材派遣会社（経営者）,・６、７月に多少明るさが見えたと思ったが、ここに来て急激に求人数が減少しており、先行き不安である。
,,▲,人材派遣会社（社員）,・一部サービス業で採用を増やしているが、これは長続きするものではなく、それに変わる業種もない。
,,▲,人材派遣会社（社員）,・取引先の事業所撤退の話が数件出ており、先行きは不透明である。
,,▲,新聞社［求人広告］（担当者）,・ここに来て、製造業や建設業で、倒産や工場閉鎖などが増えてきており、雇用情勢はますます悪くなる。
,,▲,職業安定所（職員）,・主要産業である製造業では、ここ数年来、生産拠点の海外シフトや受注減、単価切下げなどに耐えてきたが、今になって限界となり人員整理を進める動きが出始めている。求人の回復とは裏腹に再び雇用情勢が悪化する可能性がある。
,,▲,職業安定所（職員）,・雇用調整も小康状態で、大口の解雇も無いが、賃金支払が遅れる企業の情報が増えている。
,,×,＊,＊
,,,,
　３．北関東（地域別調査機関：（財）日本経済研究所）,,,,
,,,,（－：回答が存在しない、＊：主だった回答等が存在しない）
分野,,景気の先行き判断,業種・職種,景気の先行きに対する判断理由
"家計
動向
関連

(北関東)",,◎,その他専門店［携帯電話］（従業員）,・新機種の発売やチラシの効果により、来客数が増加する。また、ボーナス、お年玉などお金が入る時期ということもあり、販売数の増加が見込まれ、良くなる。
,,○,百貨店（売場主任）,・11月に入ると、最大の山場であるお歳暮商戦が始まることから、来客数の増加が見込まれる。
,,○,スーパー（店長）,・この２～３か月、販売量、来客数がわずかながら安定した伸びを示している。前年水準にかなり近い数字が望めるようになっているので、年末年始を迎えるに当たり、販売量の伸びを期待している。
,,○,コンビニ（店長）,"・年賀状印刷の予約のリピート注文が、かなり入ってきている。日本人としての節目の意識、早目の準備が売上につながっていく。
・思い切って売場を変えたので、年末年始に向けて効果を期待している。"
,,○,乗用車販売店（従業員）,・11月に新型車が発売となるので、多少良くなる。
,,○,スナック（経営者）,・予約状況はそれほど変わらないが、常連客もよく来店し、フリー客の動きが良くなってきているので、期待している。
,,○,通信会社（社員）,・携帯電話市場では、カメラ付き携帯電話への取替需要が中心ではあるが、取扱件数は着実に伸びている。
,,□,商店街（代表者）,・一般に物があふれ、客が買う気配がみられない。特に、服飾、雑貨では、ブランド物やどこにもない物を求める傾向が顕著である。
,,□,一般小売店［精肉］（経営者）,・公務員の給料が下がる影響は一般の会社員にも出て、家計は一層引き締めに向かう。景気が上向く見込みはない。
,,□,百貨店（営業担当）,・来客数は低調に推移する。客単価は若干上昇しているが、来客数のマイナス部分をカバーできていない。
,,□,百貨店（販売促進担当）,・10月は例年になく夏日が多く、防寒のセーターなどの動きが大変悪い。接客をしていて、客の消費マインドが低下していることを感じる。
,,□,スーパー（経営者）,・来客数は依然として多少伸びているが、前年を上回る売上を確保するのは厳しい。暮れに向かって来客数を伸ばさないと、売上維持は難しい。
,,□,スーパー（統括）,・来客数が増加して、単価が低下する傾向は依然として続いており、単価はまだ完全に下げ止まっていない。
,,□,コンビニ（経営者）,・景気が良くなる要素がない。客の様子、買上点数が一つも改善しておらず、足踏み状態が続く。
,,□,コンビニ（店長）,・周囲でも、下向きの話ばかりが聞こえる。客はお金がないわけではないが、支出する機会がない、あるいはあえて支出しない状況であり、この傾向は今後も続く。
,,□,衣料品専門店（店長）,・来客数、販売量の動き、単価、いずれの動きも芳しくなく、これといってファッションのヒット商材がないので厳しい。
,,□,衣料品専門店（販売担当）,・暖冬という長期予報に加え、良くなる要素が見当たらないことから、このままの悪い状態が続いていく。
,,□,家電量販店（店長）,・年末商戦で動きが出ると期待しているが、現状は冷えているので、あまり良くならない。
,,□,高級レストラン（店長）,・年末に向けての予約は徐々に入ってきているが、忘年会等の宴会規模が年々小さくなってきており、販売促進イベント等の営業努力により、現状を維持する状況が続いている。
,,□,旅行代理店（従業員）,・客の取り合い、単価設定の面で、今後も一層競争が激化する。
,,□,観光名所（職員）,・土日の観光客の入込は例年並みであるが、平日は例年を下回る状況は今後も続く。
,,□,競輪場（職員）,・３連単という新しい賭式を導入しているが、どれほどの売上の伸びにつながるか分からない。
,,□,その他サービス［自動車整備業］（事務長）,・業界全体で安売りが続く限り、入庫が増加しても売上の増加にはつながらない。
,,□,住宅販売会社（経営者）,・モデルハウスや現場見学会の来場者数の中で、具体的に購入を決定する客の数はほぼ変わらない。
,,▲,商店街（代表者）,・12月はボーナス時期であるが、貴重な収入源であるボーナスの額が不安であることから、景気はやや悪くなる。
,,▲,商店街（代表者）,・スポーツ衣料の動きが悪く、秋物の衣料品がほとんど売れない。11～12月にかけて更に厳しくなる。
,,▲,百貨店（販売促進担当）,・早期ギフトの承りや大型売り込み企画で、11月に多少売上が回復しても、全体の消費回復にはつながらない。
,,▲,スーパー（経営企画担当）,・暖冬の見込みから、高単価のなべ商材等の販売が落ちるので、売上に期待できない。
,,▲,コンビニ（経営者）,・街のスーパーが、全て深夜24時まで営業するようになったため、影響を受ける。
,,▲,衣料品専門店（統括）,・各地で秋祭りが終わり、歳末にはあまり期待できない。学園祭のバザーでは、値段の安い商品でも100円ショップの品物の方が良いという客もいた。
,,▲,自動車備品販売店（経営者）,・身の周りでは倒産やリストラが増え、お金を使うことを警戒している状況で、良くなる要因がない。例年、これから１月ごろまでは、車の動き等が低調になる時期であり、やや悪くなる。
,,▲,一般レストラン（経営者）,・飲食店も単価を安く抑えて、客の確保を図っているが、更に単価を低く設定しなければならない状況になってきている。
,,▲,観光型ホテル（経営者）,・団体客が増加する兆しはみえず、12月の忘年会等の予約も前年比で落ち込んでいる。１月からの新年会も減少しそうである。
,,▲,タクシー運転手,・仕事以外では父親が家におり、自宅にマイカーがある時間が増えたことで、家族のタクシー利用は減少している。企業もタクシー利用を制限しており、我々は四面楚歌の状態である。
,,▲,設計事務所（所長）,・３か月後の受注の目途は立たず、周囲の状況から受注が増加する要素は少ない。
,,▲,住宅販売会社（経営者）,・金融機関は、一部の安定企業、公務員にしか融資しない。
,,▲,住宅販売会社（経営者）,・デフレが進んでいるが、良い物件は相場並みの価格でも取引されている。
,,×,一般レストラン（業務担当）,・忘年会、新年会の予約数が前年より減少している。リピート客でも、宴会１件当たりの客数、単価は前年より低下している。
,,×,都市型ホテル（経営者）,・この５年ほど市内の宿泊客数は、前年比で落ち続けている。加えてダンピングが始まっていることから、悪くなる。
,,×,都市型ホテル（スタッフ）,・景況が更に悪化し、企業は忘新年会も行うかどうか分からない状態であり、宴会部門、飲食部門は先行きが真っ暗である。
,,×,都市型ホテル（スタッフ）,・売上が、前年比で月７～８百万円ほど減少しており、全体的に11、12月は最悪の数字となる見込みである。宿泊、宴会、割ぽう、各レストラン関係の全ての部門で厳しく、人員削減はもちろん、給与にまで響いてしまう状況である。
,,×,その他サービス［自動車整備業］（経営者）,・代金の集金を行い、どの程度回収できるか不明で、運転資金が集まるかも不安である。
"企業
動向
関連

(北関東)",,◎,－,－
,,○,窯業・土石製品製造業（経営者）,・体験教室等の開催により、徐々にＰＲの効果が出てきている。材料の問い合わせや客に変化が出始めており、年末にかけて、受注の増加が見込まれる。
,,○,一般機械器具製造業（経営者）,・総加工高の75％を占める自動車部品の受注が、やや増加している。さらに、15％を占める建設機械部品も増加している。
,,○,金融業（経営企画担当）,・取引先全体では、業況は依然として厳しいが、電子部品関係の製造業の受注増、中国のオリンピック関連施設用の鉄鋼輸出が好調であることなど、一部の取引先において改善の兆しがみられる。
,,□,電気機械器具製造業（経営者）,・次第に前年並みの水準に戻りつつあり、11、12月の見通しは良いが、それ以後は不透明である。
,,□,その他製造業［宝石・貴金属］（経営者）,・11、12月は各種売出しの企画があり、成果を期待する一方、市場の予想以上の冷え込みに、危機感をもっている｡
,,□,金融業（融資担当）,・消費者は、低価格で物を買うことに慣れてしまっている。
,,□,新聞販売店［広告］（総務担当）,・カレンダー等の発注は、ほとんど10月にピークを迎えるが、発注量を増やしているのは全体の２～３％で、前年並みが２割、その他多くが発注量を減らしており、ゼロというところもかなりある。良くなる要素はない。
,,□,その他サービス業［情報サービス］（経営者）,・特段の変化はみられず、現状維持である。今後の金融政策の方針によっては、急激に設備投資が鈍化する不安がある。
,,▲,食料品製造業（製造担当）,・いくら商品を安くしても、必要でなければ買わないので、やや悪くなる。
,,▲,化学工業（総務担当）,・仕事量が増加している取引先が全くない。設備投資をする企業がないためか、銀行が低金利で金を貸したがり、接近してきている。
,,▲,精密機械器具製造業（経営者）,・依然として、中国へのシフトが続いており、受注量が減少しつつある。
,,▲,輸送用機械器具製造業（総務担当）,・12月は前年比で10％、１月には15％の受注減少を見込んでおり、今後も減少が続く。
,,▲,建設業（経営者）,・官需、民需とも、大幅にダウンしているので、やや悪くなる。
,,▲,広告代理店（営業担当）,"・求人広告の出稿数は前年比でやや増加しているが、リストラにより早期退職を余儀なくされた中高年、中間管理職、人件費の安い若年層、アルバイト、パートを対象としたものが中心である。
・家計支出の減少が続けば、サービス、販売業への悪影響は避けられない。"
,,▲,その他サービス業［放送］（営業担当）,・新規のスポットコマーシャルの引き合いは出てきているが、長期的な大口コマーシャルの受注見込みはなく、売上、利益の伸びは期待できない。
,,×,一般機械器具製造業（経理担当）,・海外生産が増加しており、受注量が増加しない。
,,×,その他サービス業［情報サービス］（経営者）,"・同業各社で、採算に合わない値引きが既に始まっている。勝ち組、負け組の差がはっきりしてきている。
・年末に向けて、出版ばかりではなく印刷も含めて、用紙の大幅な値上げが決定しており、足を引っ張られる可能性がある。"
"雇用
関連

(北関東)",,◎,＊,＊
,,○,求人情報誌製作会社（経営者）,・アウトレットモール以外に、寿司やラーメンなど外食の大手が続けて進出してきている。全般的に景気は良くないが、来年にかけては上向いて、人の動きが出てくる。
,,□,職業安定所（職員）,・大手電線メーカーやグループ企業がリストラを実施しており、離職者が発生している。更なる求職者の増加が見込まれ、雇用環境が厳しい状況は続く。
,,□,職業安定所（職員）,・建設業や関連卸売業を中心として、倒産、人員縮小が相次いでいる。廃業に追い込まれるアパレル企業などもあり、小規模企業が引き続き厳しい状況にある。
,,□,職業安定所（職員）,"・経験者を望みながら賃金を低く抑え、使い勝手の良いパート、アルバイトに対する求人が増加している。一方、生活を支えるため、あくまでも安定した職を求めようとする求職者が歩み寄ることができず、採用者数の増加は見込めない。
・職業訓練修了者においても就職が厳しく、企業側の強気の姿勢は当分続く。"
,,□,民間職業紹介機関（経営者）,・製造業では海外部門が忙しく、国内は開発、試作で忙しい会社が目立つが、製造部門の落ち込みに歯止めがかからない。
,,▲,人材派遣会社（経営者）,・７、８月ごろと比較して、派遣依頼は減少傾向にある。派遣スタッフが自己都合で契約解除した場合に後任要請はなく、企業内で処理しているケースや、フルタイム派遣をパートタイムに切替えるケースなど、企業の自己防衛策が強められている。
,,▲,学校［短期大学］（就職担当）,"・大手電機メーカー２工場が生産を海外シフトする影響で、1,700名の大規模な人員整理が今年末までに進められており、他のメーカーでも人員整理が予定されている。職安は企業に離職者を再雇用するよう求め、11月に合同就職面接会を行うため、新卒求人への影響が懸念される。"
,,×,人材派遣会社（経営者）,・中高年の採用は非常に狭き門である。一方、20～30代は募集をかけても集まらず、集まっても能力面で線引きされる傾向がある。８月に実際起こったことであるが、不良品が出ると大幅に人員削減をされてしまう。先行きは非常に悪い。
,,,,
　４．南関東（地域別調査機関：（財）日本経済研究所）,,,,
,,,,（－：回答が存在しない、＊：主だった回答等が存在しない）
分野,,景気の先行き判断,業種・職種,景気の先行きに対する判断理由
"家計
動向
関連

(南関東)",,◎,＊,＊
,,○,家電量販店（営業統括）,・新規顧客数が全体の20％程度で、新しい客が増加している。
,,○,乗用車販売店（営業担当）,・９、10月に受注した注文の売上が入る。引き続いて注文が入る予定もあるので、今後２、３か月は上向く。
,,○,その他専門店［キャラクターグッズ］（従業員）,・来客数が増加傾向にあるなかで、クリスマス、年末商戦を控え、新商品投入を予定しており、売上増加に期待できる。
,,□,百貨店（売場主任）,・冬の到来で秋冬物が売れるが、10月に売れなかった防寒物の売上を回復することは見込めない。
,,□,百貨店（売場主任）,・お歳暮商戦が始まり、来客数の増加は期待できるが、最多売上価格帯のコートの動きが鈍いので、３か月後も今と変わらない。
,,□,百貨店（販売促進担当）,・秋物商戦に続き、冬物商戦でも主力のアパレル商品が苦戦を強いられ、回復の兆しが見受けられない。在庫調整もあり、商品が潤沢に入ってこない可能性もある。
,,□,百貨店（営業企画担当）,・紳士、婦人衣料ともに、冬服、特にコートの売上が思わしくなく、冬物の売上増加に期待できない。
,,□,スーパー（店長）,・今年の冬は暖冬と予測されており、コート等の衣料品の不振は覚悟している。イベントやセールを実施し、店としての集客力を強化し、来客数の増加につなげたい。
,,□,スーパー（店長）,・食品は今後も好調に推移する。
,,□,スーパー（統括）,・売上低迷に対策を講じているが、消費マインドが冷え込んでいるため、即効性はなく、小手先の対応には限界がある。
,,□,コンビニ（経営者）,"・ボジョレ・ヌーボ等の予約が多少入っている。
・クリスマス商品、年賀はがき等の販売に力を入れており、相応の売上は達成できる。"
,,□,コンビニ（経営者）,・来客数はそれほど変わらないが、売上が増加しないので、品ぞろえや単価の面で努力しているが、なかなか客に買ってもらえない。この状況は、このまま変わらない。
,,□,コンビニ（店長）,・先行きが不透明で、消費者の購買意欲が低い。客は必要最小限の物しか買わないままで、横ばいの状況が続く。
,,□,乗用車販売店（経営者）,・整備は順調であるが、販売は芳しくないなかで、12月のボーナスにも期待できない。
,,□,その他専門店［眼鏡］（店員）,・遠近両用レンズ、補聴器等の高齢者向け商品は順調に伸びており、今後更に市場は広がると思われるが、その他商品の単価が低下しており、しばらくは変化がない。
,,□,高級レストラン（支配人）,・地区内のビルに入っているレストランの人気が続き、客がそちらに流れている。このまま人が集まらない状況は、２、３か月続く。
,,□,高級レストラン（宴会予約担当）,・販売量を増やすために、様々な特典を付けるなどの対策を講じているが、全く先が見えない。
,,□,都市型ホテル（スタッフ）,・売上増が見込める要因もあるが、テロ事件のあった前年とは異なり、今年は年末年始に海外旅行客が増加すると思われる。明るい材料が決して多いわけではない。
,,□,旅行代理店（従業員）,・先行受注の状況に変化がない。
,,□,タクシー運転手,・どうしても必要な時以外は、タクシーを使わないようにしていると話す乗客が、非常に増加しており、厳しい状況は今後も変わらない。
,,□,通信会社（社員）,・売上を維持するには、相応の追加コストもかかるので、結果としてあまり変わらない。
,,□,ゴルフ場（支配人）,・最盛期を迎えても、客が増加していないので、今後にも期待できない。
,,□,住宅販売会社（経営者）,・２、３か月先も、消費者は住宅の買い時だという感覚を持てない。自分がリストラにあうのではないかと不安に思っている客が、少なからずいる。
,,□,住宅販売会社（従業員）,・地価の下落や低金利から、住宅購入意欲は底堅いが、先行きが不透明で、様子見の人が増加している。
,,▲,一般小売店［茶］（経営者）,・商店街では、毎年実施している12月のクリスマス福引セールの販売額が、前年より２～３割減少すると予想している。
,,▲,一般小売店［雑貨］（経営者）,・最近は、売れる商品がなかなか生まれない。
,,▲,一般小売店［印章］（経営者）,・年末恒例の年賀状印刷の注文が、年々減少傾向にある。
,,▲,百貨店（営業担当）,・売上の不振で、処分し切れない過剰在庫を今後も引きずる。メーカーも含め、売れ筋を読み切れず、売れ筋の確保も難しいことから、売り逃しの増加は必至である。
,,▲,百貨店（営業企画担当）,・百貨店の主要顧客である40～50代向けの婦人服の売上が、軒並み大幅な減少となっており、気温の低下による冬物の動きにも、力強さが感じられない。百貨店の客層への株価下落の影響は大きく、先行きの不安感がぬぐえない。
,,▲,スーパー（経営者）,・客は、低単価の商品で日常の食事をやりくりしている。価格重視の傾向がみられ、単価が安くなっていく。
,,▲,スーパー（総務担当）,・食品の売上がかなり低迷している中で、競合店が一層増加し、年末年始にかけての価格競争では、売上が更に厳しくなる。
,,▲,コンビニ（店長）,・今まで飲み物を購入していた一部の人が、家から飲み物を持参するようになるなど、買い控え傾向が強まる中で、11月から本格化する予約活動に期待できない。
,,▲,衣料品専門店（経営者）,・暖冬予測の中、冬物商材の値下げが早く、売上の低迷と粗利益の縮小が予測されるため、冬物セールに大きな期待はしていない。業界全体でも、消極的な商品戦略がデフレ傾向を加速させている。
,,▲,家電量販店（店員）,"・冷蔵庫、掃除機、洗濯機、調理家電など、生活に必要な商品は売れているが、その他の商品は非常に悪い状態が続いている。
・招待会を行う場合、その日は売れるが、その前後の売上が芳しくない。"
,,▲,乗用車販売店（店長）,・高額の新車が売れなくなっている。新車への代替促進をしているが、車検を選択する客が多いため、今後も厳しい。
,,▲,一般レストラン（経営者）,・天候不順により、食材の旬がずれ込み、仕入先の買い控えで食材のバリエーションが例年よりも少ない。
,,▲,スナック（経営者）,"・接待費が削減されたり、廃止されている。
・暮れのボーナスも、削減が当たり前で、出ない客が多い。
・これまでは３回程度あった忘年会も、２回や１回になり、大幅な売上減となる。"
,,▲,都市型ホテル（スタッフ）,・結婚式場が新たにオープンし、競争が激化している影響もあり、結婚式の組数が伸びていない。それを埋めるべき一般の宴席も、単価が低下する一方である。
,,▲,旅行代理店（従業員）,"・ボーナス商戦が始まるものの、ボーナスの減額で、先行きに良い傾向が出ていない。
・固定客による利用以上のものには期待できない。
・価格競争の中で、どこまでも低廉化が進んでいる。"
,,▲,通信会社（営業担当）,・９、10月と引き続き契約件数が激減しており、今後も下降線をたどる。
