Ⅱ．景気の先行きに対する判断理由,,,,
,,□,レジャー施設（営業企画担当）,"・温泉・ホテル部門は毎月120％で伸びていたが、今月は114％の伸びに鈍化している。
・日帰り部門が苦戦している中で、宿泊部門が伸びるという相反した状況があり、この先も大きく変わらない。"
,,□,設計事務所（職員）,・ボーナスや年末年始シーズンとなり、売上が増える要因はあるが、例年と比べて大きな変動はない。
,,▲,一般小売店［靴］（経営者）,・商店街の中で新規の店が１、２店出てはいるが、同業他店との競争になっており、各店の売上は減少する。
,,▲,一般小売店［印章］（営業担当）,・町自体に活気がなく、例年に比べて落ち込む。
,,▲,百貨店（営業企画担当）,"・客は今必要としていない物は買わず、衣服は去年の物を着る傾向にあり、冬のボーナスも期待できない。
・８月末で閉鎖した店舗跡に開設した新会社も、目玉商品だけが売れるのみで、財布のひもは更に固い。"
,,▲,百貨店（営業担当）,・来客数の減少、買い控えの雰囲気がある。特に紳士関連と婦人向けの高額商品の動きが極めて悪く、これまである程度の購買力があった客も買い控えている。
,,▲,コンビニ（エリア担当）,"・受注は例年並みで、売上を伸ばしても利益が出ない状況が続く。
・ボーナスなども厳しい様子なので、消費者は消費財でも節約をする。"
,,▲,コンビニ（エリア担当）,・ボーナス金額のダウンも予測され、買い控えが更に増加する。
,,▲,スーパー（店員）,・年末を控え、客の財布のひもはますます固くなり、例年に比較してもボーナス額も厳しいことから、その傾向は食品に対しても波及する。
,,▲,乗用車販売店（所長）,・11月以降は明るい材料もなく、例年を上回ることができる根拠がない。また車の買換え時期を客がある程度計画しており、働きかけても買換えるという話にはなかなか乗らない。
,,▲,乗用車販売店（総務担当）,・新型車が出たものの、その効果的はまだ出ておらず、来客数も伸びていない。
,,▲,乗用車販売店（営業担当）,・客に購買意欲はみられるものの、購入にはつながらない。
,,▲,自動車備品販売店（店長）,・客の財布のひもは固く、値の張る商品は全く売れない。
,,▲,一般レストラン（営業担当）,・10月に１店舗、12月に２店舗目を更にオープンし、一見非常に景気が良いようにみえるが、忘年会や新年会などに向け競合各店舗の競争が激しくなっている。
,,▲,都市型ホテル（従業員）,・レストランで直前の予約が多くなり、単価も下がる。
,,▲,都市型ホテル（スタッフ）,・忘年会の単価や人数も減少傾向で、例年来ていた客も今年はやめるところがある。
,,▲,通信会社（企画担当）,・商品単価は下げ止まりの段階にきているが、販売量が増加していく要因がなく、停滞感も大きい。
,,▲,ゴルフ場（従業員）,・単価を安くしないと客が来ない厳しい状況となっている。
,,▲,設計事務所（経営者）,・客の動きが悪いため販売量が伸びない。
,,×,百貨店（売場担当）,・客の賃金カットの動きがある一方で、お歳暮商戦等の大きな催しでは早くから値引き競争の様相を呈しており、売上額が伸びそうにない。
"企業
動向
関連

(中国)",,◎,－,－
,,○,電気機械器具製造業（総務担当）,・同業他社も忙しく人材不足の感があり、試作開発も引き続き好調である。
,,○,金融業（業界情報担当）,・当面フル操業が続くと期待され、増収増益で臨時工を増やすメーカーが増える。
,,□,化学工業（総務担当）,・製品価格に上方修正の動きがあり、若干持ち直すと予想されるが、下期の見通しは依然として厳しい。
,,□,鉄鋼業（広報担当）,・輸出を中心に引き続き堅調に推移するが、アジア方面での緊急輸入制限や米国経済の不透明感などが懸念材料である。国内経済も混沌としており、立ち直りの遅さにも懸念が残る。
,,□,非鉄金属製造業（経理担当）,・受注増が見込まれる製品もあるが、全体的には全く不透明で、本格的な販売量の回復は見込めない。販売価格が回復する見込みも全くない。
,,□,コピーサービス業（管理担当）,・同業者の設備を遊ばせるよりは、赤字でも仕事量を確保するという方針に変化はなく、単価の落ち込みは依然として止まらないため、仕事量が確保できても売上金額の増加には貢献しない。
,,▲,鉄鋼業（総務担当）,・エレクトロニクス材料の受注の動きが大変悪く、基幹の工具工の動きもやや鈍ってきている。
,,▲,金属製品製造業（総務担当）,・現在の受注量が減少傾向のため、２、３か月先の仕事量は更に減る。
,,▲,電気機械器具製造業（広報担当）,・液晶の値段は急激ではないが今後とも下がり続け、下げ止まりの見通しがつかない。
,,▲,輸送用機械器具製造業（総務担当）,・受注状況の悪化傾向が続く。
,,▲,輸送用機械器具製造業（経理担当）,・受注量は増加傾向であるが、主要顧客からの非常に大きな値引き要請がある。
,,▲,輸送業（総務担当）,・受注量はあるが単価が低いため、仕事を取れば取るほど赤字幅が広がる傾向にある。単価減をカバーするため、受注量の確保を行っても、収入よりも経費が上回り、非常に苦しい状態にある。
,,×,金融業（営業担当）,・９月決算の企業はいずれも減収減益で、減収幅も30～40％減である。役員報酬のカットでは追いつかず、リストラと人員削減が更に続く。
"雇用
関連

(中国)",,◎,－,－
,,○,人材派遣会社（支社長）,・現在は例年並みの景気の悪さで、これ以上の悪化の様子はうかがえないため、今後は良くなる。
,,□,求人情報誌作成会社（支店長）,・新卒採用等の動向が少し上向く。
,,□,職業安定所（職員）,・製造業では一部休業があるが、サービス業ではパートなどの活発な求人活動がみられ、年末までこの状態は続く。
,,□,職業安定所（職員）,・欠員補充の求人が多いが、経験者を募集しているため、経験のない者への求人が少なくなっている。
,,□,職業安定所（職員）,・求人は増加傾向にあるが、雇用調整助成金等に関する問い合わせも増加傾向にある。
,,□,民間職業紹介機関（職員）,"・就業能力が平均的なレベルにある求職者の就職希望者が多い。
・求人数は底をはったままである。"
,,▲,人材派遣会社（経営者）,・企業収益の回復が遅れ、人件費削減による所得の低下が確実になりつつある。
,,▲,職業安定所（職員）,・製造業で事業縮小や閉鎖などの情報が複数寄せられており、新規求職が再び増加傾向となる。
,,▲,学校［大学］（就職担当）,・企業からの求人増加があまり見込まれず、求職活動そのものにも活気がなくなってきている。
,,×,人材派遣会社（支店長）,・中高年を軸とした早期退職が増えているが、受け皿はほとんどない。
,,,,
　９．四国（地域別調査機関：四国経済連合会）,,,,
,,,,（－：回答が存在しない、＊：主だった回答等が存在しない）
分野,,景気の先行き判断,業種・職種,景気の先行きに対する判断理由
"家計
動向
関連

(四国)",,◎,スーパー（営業担当）,・営業時間の延長により、前年に比べ売上が増加すると推測している。
,,○,商店街（代表者）,・歳末商戦、各種イベントによる売上の増加を見込んでいる。
,,○,一般小売店［酒類］（経営者）,・年末年始は、景気が悪いながらも通常月より物が動く。
,,○,百貨店（売場主任）,・今月が一番底である。10月は秋季国体で、購買意欲が非常に少なかった。２、３か月先は、気温が下がり購買意欲も出てくる。
,,○,衣料品専門店（経営者）,・１年で最も大きな受注期に入り、それに応じたセールも用意しており、手ごたえは十分あるものと期待している。12月、１月までは良いが、それ以降は少し不透明である。
,,□,商店街（代表者）,・商店街への来街者数も一向に良くならず、空き店舗も増えている。客の動向も商品単価の安いものは売れるが、まとめ買いはしない。良くなる可能性はないと感じる。
,,□,一般小売店［菓子］（販売担当）,・数か月間、買い控え状況が一向に改善されないため、今の状況が今後も続くと見込まれる。
,,□,百貨店（営業担当）,・下げ止まり感はあるが、あまりにも長すぎてこれから先もその状況が今後も続くと推定している。
,,□,スーパー（店長）,・販促費を相当使って、やっと前年を上回る状況であり、販促費によるポイントサービスの政策が無ければ、売上はほぼ横ばいである。
,,□,スーパー（企画担当）,・10月の来客数は４％減少、単価は1.5％減少しており、消費は冷え込んだ状態が続いている。
,,□,コンビニ（店長）,・全体的な地域の動向を見ても、同業者の売上は前年に比べて少し減少している。
,,□,衣料品専門店（経営者）,・客の動向は、購買することに対して非常に慎重である。
,,□,衣料品専門店（店長）,・衝動買いは少なく、必要以外の商品は販売につながらない。
,,□,家電量販店（店長）,・新しい家電製品が多数出ており、客の関心は非常に高いが、購入意欲や販売量が増加するということが期待できない。
,,□,乗用車販売店（営業担当）,・新モデルが発売されたが、期待していたほど販売量は増加してない。
,,□,その他専門店［ＣＤ］（店員）,・景気が底を打った感じがあるが、良くなる要素がない。
,,□,通信会社（営業担当）,・販売量は、ボーナス商戦で少し増加すると思うが、１月になるとまた元に戻るのではないかと推測している。
,,□,ゴルフ場（従業員）,・来客数は回復しつつあるが、予約状況に変化がない。
,,□,設計事務所（所長）,・来年の新しい物件が非常に少ない。
,,▲,一般小売店［生花］（経営者）,・業界の売上は、減少しており現状でも値段を安くしないと販売量の増加はできない。値段をもとの定価に戻すと、全く売れない状態が続きそうな感じがする。
,,▲,百貨店（営業担当）,・小口売上の件数は、前年比１割減少となったが単価は増加した。来客数は、大型物産展の開催により増加したが、月間でみると来客数は減少した。高ファッション商品の売行きは、前年並みを維持しているが、その他の衣料品、雑貨、リビングは前年割れしており顧客の商品選品は厳しい。
,,▲,スーパー（店長）,・単価、売上、来客数ともに６月以降、減少傾向にあり、３か月後も同じようにまだ下がっているように思う。
,,▲,コンビニ（店長）,・季節的に売上が減少する時期で、年末にかけて買い控えが多くなる。
,,▲,観光型旅館（経営者）,・３か月先までの予約状況をみると、前年のこの時期より少し減少している。
,,▲,都市型ホテル（経営者）,・先行きの予約状況があまり良くない。販売価格の低下がずっと続き、なかなか歯止めがかからない。
,,×,商店街（代表者）,・不況とオーバーストアー現象が重なる限り、出口が見えない。
,,×,通信会社（企画担当）,・携帯電話の販売量の頭打ち状況の中で売行きが鈍っており、急激に回復することはないと思う。
"企業
動向
関連

(四国)",,◎,－,－
,,○,電気機械器具製造業（経営者）,・見積依頼が前年比の1.5倍ぐらい増加している。
,,○,通信業（営業担当）,・歳末商戦が始まり、全体の消費が伸びる。
,,□,パルプ・紙・紙加工品製造業（経営者）,・デフレスパイラルに入ったような状況で価格も低迷しており、売上が増加しない。
,,□,一般機械器具製造業（経理担当）,・中国や中近東の対外市場の引き合いは活発になっているが、国内市場は相変わらず低迷している。中古建機の需要が堅調で、新建機需要につながるには時間がかかる。
,,□,通信業（支店長）,・客の購買意欲が低下したままで元気な企業が出てくる様子がない。
,,□,広告代理店（経営者）,・市場規模の縮小により、同業者が１社解散しており、依然と厳しい状況が続いている。
,,▲,繊維工業（経営者）,・輸入の増加と、消費全体の冷え込みが続いており、価格競争が熾烈化している。
,,▲,不動産業（経営者）,・賃貸物件に対する客の低迷に加えて、売買物件に対する客が激減している。
,,×,公認会計士,・自己破産、整理、民事再生法の質問や年末の手形決済ができないなどの相談が非常に増加している。
"雇用
関連

(四国)",,◎,－,－
,,○,＊,＊
,,□,求人情報誌製作会社（従業員）,・新たな雇用を各企業とも見出せず、求人広告も定期的にではなく、スポットで入れている。正社員の雇用を減らし、パート、アルバイトで賄う状況に変化がない。
,,□,職業安定所（職員）,・一般求職者の増加傾向が改善されず、製造業における雇用関係にも変化がない。
,,□,職業安定所（職員）,・パートを含む有効求人倍率は４か月連続で若干改善しているが、求職者の増加傾向は続いており、新規求人もパート求人が４割を占めるなど、改善の兆しが感じられない。
,,▲,人材派遣会社（支店長）,・受注が増える時期であるが、例年どおりの受注が見込めない。
,,▲,学校［大学］（就職担当）,・求人数は落ち込みながらも一定数は確保できているが、内定がなかなか進まず、今後も急速に伸びると期待できない。
,,×,＊,＊
,,,,
　１０．九州（地域別調査機関：（財）九州経済調査協会）,,,,
,,,,（－：回答が存在しない、＊：主だった回答等が存在しない）
分野,,景気の先行き判断,業種・職種,景気の先行きに対する判断理由
"家計
動向
関連

(九州)",,◎,一般小売店［生花］（経営者）,・開業３年目で少しずつ伸びていて、ネット販売も伸びている。
,,◎,一般レストラン（経営者）,・ケータリングで宴会のサービスをしているため、年末年始にかけてかなり需要が見込める。
,,○,コンビニ（エリア担当）,・朝夕の気温の変化で、肉まん、おでん等の売れ行きが良くなっている。これから年末にかけて、少しずつではあるが、客の財布のひもが緩むと思われ、売上が上昇すると期待している。
,,○,スナック（店長）,・鹿児島の焼酎が本物の時代でブームになり、県外の客が多く訪ねてくるようになった。
,,○,旅行代理店（従業員）,・旅行予約発生が遅くなっている中で、年末年始の動きは非常によく、定番であるハワイ等においては予約がいっぱいであるほか、スキーや宿泊も順調に入っている。
,,○,設計事務所（職員）,・新築物件の着工が何件か予定されている。
,,□,商店街（組合職員）,・イベント会場でフリーマーケットを見たが、驚くほど安くても必要なものを必要なだけ買うという大変シビアな買い方をしていた。
,,□,家電量販店（店員）,・パソコンは10月に各社新製品が出たが、今までのような注目度はなく、非常に低調だった。そのためいつもの年末商戦のようには行きそうにない。
,,□,乗用車販売店（従業員）,・給料、ボーナスが下がってこの先不安に思っている45～50歳以上の方が多くなった。
,,□,その他専門店［ガソリンスタンド］（統括）,・ボーナスが支給されるかどうか不安視する声が聞かれる。
,,□,タクシー運転手,・リストラされてタクシー会社に職を求めてくる人はまだまだ多い。また、年末年始に向けて、客が明るい話をしない。
,,□,通信会社（担当者）,・システムに関する依頼が極端に減っている。それがここ３か月で急転するとは思えず、しばらくは今の状態が続くと思われる。
,,▲,商店街（代表者）,・今年は暖冬と予想されており、衣類、電化製品の売行きに期待が持てない。
,,▲,商店街（代表者）,・今が最悪ならば変わらないだろうが、さらに落ち込む恐れがある。
,,▲,百貨店（総務担当）,・消費を回復させる材料が全く見当たらず、ボーナスの減少、雇用不安など消費環境が悪くなる要因が多い。
,,▲,百貨店（営業担当）,・買物券の手持ち額が前倒しで使用されているので、これがなくなる11、12月は非常に厳しい。不安感により商品の買い控えが見えるので厳しい状態が続く。
,,▲,百貨店（販売促進担当）,・所得減で消費者の購買意欲が失われている。
,,▲,百貨店（業務担当）,・年末商戦に入るが、ここ数年ギフト需要もパーソナル化しており、総量は減るだろう。よって、売上も減少する。
,,▲,スーパー（店長）,・単価の下落が止まらず、単価を下げても、客の反応が良くない。
,,▲,コンビニ（販売促進担当）,・コンビニ自体の売上が１割減という基調にあるなかで、量販店やスーパーが先々月あたりから営業時間を延長しているために売上が落ちている。これからクリスマス、年末商戦となるが、厳しい状況が続く。
,,▲,家電量販店（企画担当）,・給料が上がらない状況が今後も続くと、買物も控えるようになり、だんだん悪くなっていく。
,,▲,住関連専門店（経営者）,・最近傷物家具のチラシが良く入り、通常商品の売れ行きが悪くなる。
,,▲,観光型ホテル（スタッフ）,・大手造船所の事故の影響で、100社以上ある下請企業など、これから年末にかけていろいろな面で影響が出てくる。
,,▲,都市型ホテル（総支配人）,・競合ホテルが価格競争で、料金を下げてくる。
,,▲,旅行代理店（業務担当）,・イラク情勢やバリ島でのテロなどで世界的に不安感が広まっており、先行きに安心感がない。
,,▲,通信会社（業務担当）,・年末商戦を前に価格低下や新商品等による需要を喚起しようとしているが、これまで以上の不況でボーナスが出ない企業も多く、販売は伸び悩む。
,,▲,住宅販売会社（従業員）,・景気の先行きが不透明で、雇用不安もあり、住宅購入に対しては皆まだまだ用心する状況が続く。
,,×,衣料品専門店（店長）,・景気の良い話が一向に聞こえず、客の購買意欲も冷え切っている。このままでは、自分の店もいつまで続くか非常に不安である。
,,×,高級レストラン（経営者）,・例年10月になれば忘年会の予約があるが、毎年入る団体も大手造船所の事故以降、気兼ねして中止された。他にも増えそうな気配はない。
,,×,スナック（経営者）,"・もし飲みに行くとしたら、2,000円程度で２時間飲み食べ放題で１次会、その後カラオケボックスで1,000円ほど使い、合計3,000円で済ませるパターンが多いと客から言われた。これではスナックへの来客数が増えるわけがなく、潰れるところが多く出てくると思う。"
,,×,観光型ホテル（支配人）,・黒川温泉、由布院温泉はかなり景気がいいが、その他では大きなホテル、旅館がたくさん潰れている。
,,×,タクシー運転手,・ボーナスはどのくらい支給されるか分からないし、年が明けると倒産やリストラが更に出てきて悪くなりそうである。
,,×,パチンコ店（店員）,・長崎の店舗では、造船所関係の客が多く、先日の事故で自宅待機をさせられている方もいるようで、その方達の来店が今後減りそうだ。
,,×,競輪場（職員）,・日本経済の将来ビジョンが全く見えないし、マスコミの対応も悪いのかもしれないが不安を煽るようなこともある。それで、一般客の消費動向が非常に制限され、それが売上に反映されている。
"企業
動向
関連

(九州)",,◎,－,－
,,○,農林水産業（経営者）,・加工メーカーも10～12月は最需要期であり、前年のようなBSEや食品偽装の問題がない限り、総じて順調だろう。居酒屋向けについても、忘年会シーズンに入るので好調である。
,,○,通信業（職員）,・今後受注が見込める案件が、若干増えている。
,,□,精密機械器具製造業（経営者）,・企業の中で勝ち組と負け組が明確になっているが、これが顕著になりそうだ。また、景気が良くなっても海外への発注が増えるため、現状のままだろう。
,,□,建設業（従業員）,・汚職事件が発生し、業界を取り巻く環境が一層厳しくなる。
,,▲,電気機械器具製造業（経営者）,・各企業とも生産のムラが生じており、先行きの見通しがたちにくい。大手ユーザーの話では、装置機械部品も同様で、ますます不透明さが増してくる。
,,▲,輸送用機械器具製造業（営業担当）,・12月中旬頃から海外現地生産に切り替わるものが出てくるため。
,,▲,建設業（総務担当）,・原料となる生コンの単価が原価割れを起こしており、生コン組合から価格の引上げを迫られている。それがコストに反映されるため、受注が非常に厳しくなる。
,,×,繊維工業（営業）,・国内工場ではとても太刀打ちできない価格になっている。安いものしか売れなかったが、今は安いものでも売れなくなっている。
"雇用
関連

(九州)",,◎,－,－
,,○,民間職業紹介機関（職員）,・現在は上期決算後の影響で、求人数の動きが非常に鈍っているが、年末にかけて活発になる予想がついている。今後は、求人数、求職数ともに上向きである。
,,□,職業安定所（職員）,・求人開拓の際、今後の景気の見通しを聴取しているが、先行き不透明という回答が多い。
,,▲,人材派遣会社（社員）,・通常、この時期になると、年末商戦、キャンペーンなどでの需要が増えてくるが、今のところそういう動きがない。
,,▲,職業安定所（職員）,・企業等に今後のことを聞くと、見込みがたたないか、不透明というところが多い。また、人員も過剰感があるという回答が多い。
,,×,求人情報誌製作会社（編集者）,・年末商戦で例年臨時雇用が発生するが、今年は活発に動きそうにない。
,,×,学校［専門学校］（就職担当）,・新卒者の就職が始まるのに伴って40～50代の就職がなくなりそうである。父親、母親はリストラをされ、子どもの高校生は就職がないというひどい状況になってくる。
,,,,
　１１．沖縄（地域別調査機関：（財）南西地域産業活性化センター）,,,,
,,,,（－：回答が存在しない、＊：主だった回答等が存在しない）
分野,,景気の先行き判断,業種・職種,景気の先行きに対する判断理由
"家計
動向
関連

(沖縄)",,◎,－,－
