Ⅱ．景気の先行きに対する判断理由,,,,
,,□,印刷業（営業担当）,・景気が上向く気配は全くない。取引先も同様である。中小企業に関しては、景気の落ち込みが続き倒産する会社が増える。
,,□,化学工業（総務秘書）,・来春の新卒採用や常勤のパート採用において、内定を辞退する人の割合が高く、売手市場であると強く感じる。景気が悪くなる要因は、特に見当たらない。
,,□,窯業・土石製品製造業（社員）,・客先を回った感触では景気の後退感はないが、受注額が大きく落ち込んでいる。新製品も成約にはなかなか結び付かず、景気の本格的な回復は難しそうである。
,,□,金属製品製造業（経営者）,・引き合い状況は横ばいから減少傾向のため、先行きはほとんど変わらない。
,,□,金属製品製造業（従業員）,・足元の仕事の取り合いという傾向は変わらない。他社の安値対応が悩ましい。
,,□,一般機械器具製造業（営業担当）,・大型案件や増設の話がある一方、生産量の半減により設備投資を中止したり延期をする客もあり、まだまだ先行きは不透明な部分も多い。
,,□,一般機械器具製造業（経理担当）,・今後も高い水準での受注量の維持が見込まれる。
,,□,電気機械器具製造業（営業担当）,・業況が良くなる見込みがない。
,,□,電気機械器具製造業（企画担当）,・受注状況は順調に推移しており、数か月以内に急速に悪化することはない。
,,□,電気機械器具製造業（経営者）,・今のところ工作機械関係や自動車関係の製品が非常に好調で、秋ごろまではこの状況が見込まれる。
,,□,電気機械器具製造業（総務担当）,・システム構築案件の増加に対応するため、専任の工事監理技術者の確保が必要であるが、人手不足のため積極的な受注活動を展開できない。
,,□,輸送用機械器具製造業（品質管理担当）,・しばらくはこのまま悪い状況が続く。
,,□,建設業（経営者）,・個人レベルでは好景気という実感はないが、公表されているデータをみる限りは、景気は良いものと見込まれる。ただし、少しの要因で大きな変化が起きかねない不安定な状況であることは間違いはない。
,,□,建設業（営業担当）,・新規業務の成果が出てくるのはまだ少し先である。減少分と増加分がバランスすれば良いが、投資しただけで終わることもあるので、まだ何ともいえない。
,,□,輸送業（従業員）,・物流業界では、人手不足が依然として解消されないが、ガソリン等の石油製品は値下がり傾向にあり、経営的にはプラスにある。
,,□,輸送業（エリア担当）,・配送単価の引上げはまだ先のため、当面の状況は厳しい。
,,□,輸送業（エリア担当）,・燃料の軽油価格が前年同期比で大幅に値上がりしており、この先がとても心配である。
,,□,輸送業（エリア担当）,・為替の状況が変わらなければこのまま推移する。
,,□,通信会社（法人営業担当）,・景気の上昇を肌身では感じられない。欧米等の経済的な影響をかなり受けており、このまま変わらない状況が続く。
,,□,通信会社（法人営業担当）,・案件数は増えているものの、ＡＩ等の新技術を駆使したシステムの導入といった案件ではなく、過去のシステムの更新にとどまっている。
,,□,金融業（企画担当）,・株価は天井感があり、為替も円安方向にはないため、個人投資家は動きにくい。含み益が出てくると消費拡大に向かうが、様子見の個人投資家が多く、当面は現状のままの景気が続く。
,,□,不動産業（経営者）,・天候の長期予報からは、売上は前年同期比100％以上での順調な推移が見込まれる。
,,□,不動産業（経営者）,・不動産需要には活発な動きは期待できない。
,,□,広告代理店（制作担当）,・出稿量や見積依頼は前年同月比でほとんど増えておらず、しばらくは景気の回復を実感できない状況が見込まれる。
,,□,公認会計士,・中堅・中小企業を巡る状況が好転するような要因が見当たらない。
,,□,行政書士,・秋口までは、一部を除いて貨物の動きが少なくなる。
,,▲,化学工業（営業）,・容器の原料であるポリエチレンの供給制限がある。
,,▲,鉄鋼業（経営者）,・例年の季節要因で夏場にかけては受注量の減少が見込まれるが、現状よりも更に減少すると、全くの不採算状態になってしまう。
,,▲,新聞販売店［広告］（店主）,・折込チラシ配布料の値上げの影響で、売上の増加よりも受注量の減少が大きい。
,,×,建設業（経営者）,・現政権に関する様々な話題が続き、政治に対する不信感で、良くなる要素が全くない。我が国の未来が全くみえない。
"雇用
関連

(東海)",,◎,－,－
,,○,人材派遣会社（社員）,・お盆明けからは、下半期からの就業に向けて求人や求職の動きが活発となる。
,,○,人材派遣会社（営業担当）,・求人数の増加に伴い、今まで二の足を踏んでいた転職希望者が動き出し、転職市場はこれから活発になる。
,,○,アウトソーシング企業（エリア担当）,・自動車生産分野においては、下期に向けて雇用者数を増やす動きが出てくるため、やや良くなる。
,,○,民間職業紹介機関（窓口担当）,・求人数が増え、求職者が選択をできる状況が続いているが、就業可能な人材は少なく、求人ニーズに対する供給が不足している。
,,□,人材派遣業（営業担当）,・企業の進出による地域への効果は、長期的な部分での成果につながるため、直近での変化としては小さい。
,,□,人材派遣会社（営業担当）,・2020年に向けては緩やかに景気が良くなるが、直近３か月の比較では目に見えて大きな変化はうかがえない。
,,□,新聞社［求人広告］（営業担当）,・人手不足が急激に改善されるとは考えにくい。新入社員が慣れてある程度の戦力になれば生産性は上がるが、それでも充足できず、企業としては中途採用を続けていくことになる。
,,□,新聞社［求人広告］（営業担当）,・設備投資や景気を刺激するような話題が見当たらない。
,,□,職業安定所（所長）,・管内及び隣接地域においては、大型倒産等の情報もなく経済面での大きな変化もない。人材確保についても、現状と同様の状況がしばらくは続く。
,,□,職業安定所（職員）,・求人数は増加しているが、正社員での求人は前年同月比で２か月連続して減少となっており、条件面での改善は進んでいない。
,,□,職業安定所（職員）,・中小企業では、仕事が増えても利益が伸びないなかで人手不足が続いている。従業員に利益が還元できないため、景気は足元と特に変わらない状況が続く。
,,□,民間職業紹介機関（営業担当）,・求職者数は横ばいであり、求人数に対しての採用決定者数も、それほど劇的には変わらない。
,,▲,人材派遣会社（社員）,・足元の業況が良かったので、先行きはやや落ち込む。予約状況も現時点では例年よりも悪い。
,,▲,人材派遣会社（社員）,・正社員採用での求人は相変わらず多いが、マッチする人材が枯渇して採用が進まず、停滞感が漂う。
,,▲,人材派遣会社（支店長）,・求人数が減少している原因は、はっきりとはわからないが、改正労働者派遣法による無期転換の動きや、同一労働同一賃金等への動きが少なからず影響していると考える。
,,▲,職業安定所（職員）,・５月の新規求人倍率は1.99倍と高いが、４月からはわずかに減少している。新規求人数についても約２割減少している。
,,▲,民間職業紹介機関（支社長）,・６月下旬から株価が下落傾向にある。
,,×,－,－
,,,,
　６．北陸（地域別調査機関：一般財団法人北陸経済研究所）,,,,
,,,,（－：回答が存在しない、＊：主だった回答等が存在しない）
分野,,景気の先行き判断,業種・職種,景気の先行きに対する判断理由
"家計
動向
関連

(北陸)",,◎,－,－
,,○,一般小売店［事務用品］（店員）,・働き方改革の職場環境改善商品や季節商材の販売に動きがみられ、微増ながらも期待できる。
,,○,一般小売店［書籍］（従業員）,・景気の底から脱し、来客数が増えて購買動向が良くなってくると期待している。
,,○,一般小売店［鮮魚］（役員）,・７～８月は連休や夏休みで人が動くので、それに期待したい。
,,○,コンビニ（経営者）,・店の認知度が上がり、販売量が上がると見込んでいる。
,,○,家電量販店（店長）,・有機ＥＬテレビの販売に期待が持てそうである。
,,○,乗用車販売店（従業員）,・今月は他社との合同開催の中古車フェアに参加しており、新規客の増加に期待している。
,,○,その他小売［ショッピングセンター］,・猛暑予想が出ているので、不振が続いている盛夏衣料や暑さ対策品、飲料に期待したい。
,,○,タクシー運転手,・観光の予約や、そのほかにも見積などの問い合わせが入っている。
,,○,タクシー運転手,・夏休みに入れば、レジャーなどでタクシー利用が増えてくると見込んでいる。
,,○,通信会社（役員）,・競合事業者への契約移行件数が、やや減少傾向にある。夏のボーナス支給によって消費者心理が刺激され、契約件数が増加することを期待している。
,,○,その他レジャー施設（総支配人）,・夏休み期間限定プログラムの募集が、ほぼ予定どおりに進んでいる。しかし、新規入会の見込み客獲得につながらない。前年より単価の安いクラスへの問い合わせが多く、期間限定プログラム実施後に入会に結び付くかが不安である。
,,○,住宅販売会社（従業員）,・住宅販売の大型イベントで、来場者数が前回の５割増しとなり潜在客は増えている。今後、来場者からの契約が増えると考えているので、景気は良くなる。
,,□,商店街（代表者）,・特に良くなるような環境にない。
,,□,一般小売店［精肉］（店長）,・お中元ギフトの序盤戦は、売行きが軒並みダウンしている。７～８月もこのままの状態が続くのではないかと心配している。
,,□,百貨店（売場主任）,・中間層の可処分所得が増えず、衝動買いやまとめ買いが減っている。そうしたなかで日経平均株価が２万円を超えたため、一部の富裕層の購買行動が多少活発になると見込んでいる。全体としてはあまり変わらないと考える。
,,□,百貨店（営業担当）,・催事で一時的に来客数が増加しても客単価が低い。現状は客の買い方がシビアなままで、ここ最近ずっと変わらない傾向である。この状態はずっと変わらないと考える。
,,□,百貨店（販売促進担当）,・株高は一部の富裕層だけの経済効果であり、中間層に影響がない。消費改善の兆しはないと考える。
,,□,スーパー（店長）,・良くなる要因が見当たらない。
,,□,スーパー（総務担当）,・雇用状況は有効求人倍率が高いまま推移している。採用が難しい状況は変わらない。夏に向けて観光客数が増えることにやや期待感はあるものの、変動はないと考える。
,,□,スーパー（総務担当）,・気温の変動による日々の売上高増減はあるが、月間では前年並みの売上に推移しそうである。
,,□,スーパー（統括）,・消費動向が変化する見込みがない。
,,□,コンビニ（経営者）,・特需というわけではないが、夕方の来客数が増えて客単価が上がっている。この状況に間違いないのだが、これが更に上振れする要因は特に見当たらない。
,,□,コンビニ（店長）,・改装した転換店舗は良くなり、既存店は前年を割る状況であるため、トータルで考えて現状は変わらない。競合他社から売上を獲得できていると考えると上向く可能性はあるが、あくまで本部事情による売上の上昇であるため、景気という意味では実感しにくい。直感的に変わらないと感じているので変わらないと回答した。
,,□,コンビニ（店舗管理）,・ビール等の値上げにより、ディスカウントストアやドラッグストアからの客の流れを期待していたが、影響は見られなかった。そのほかに思い当たる好材料がない。
,,□,衣料品専門店（経営者）,・製造業では景気が上向いているという話をよく聞く。確かに、北陸新幹線延伸や人手不足とか、にぎやかになっている。飲食店は好調だと聞いており、そろそろ小売業にも来るだろうかと期待している。
,,□,家電量販店（本部）,・季節要因を除けば大きな変化はない。
,,□,自動車備品販売店（役員）,・９月までは車検需要、車販売が好調に推移すると見込んでいる。しかし、その後の落ち込みが不安である。また、人手不足が続いている中、良い賃金を求めて転職者が例年以上に増えている。事業運営自体が厳しくなっており、今後の見通しは厳しい。
,,□,住関連専門店（役員）,・前年と比較して買上客数及び買上単価の減少が継続している。単価のダウンからもわかるように、消費者の低価格傾向がより一層強まっていると考える。
,,□,その他専門店［酒］（経営者）,・この先、景気が良くなる様子は全く感じられない。７月はお中元や商店街の夏祭りなどのイベントのため忙しくなるが、景気が良くなるとは感じられない。
,,□,一般レストラン（店長）,・週末を中心にフリー来店客の動きが良い。持続を期待したい。
,,□,一般レストラン（統括）,・客のニーズに対する新規の取組など、売上、来客数アップにつながる課題は多くある。しかし、人手不足が原因ですぐに対応できない、機会ロスの状況である。外国人労働者の起用、人材育成のスピードアップが最優先課題となっており、売上や来客数を増やす施策が打てない状況にある。
,,□,観光型旅館（経営者）,・７月以降も個人客の動きが悪い。予約状況は前年や一昨年を下回っている。
,,□,観光型旅館（スタッフ）,・当月の予約状況は前年並みを確保出来たが、この先６か月の予約保有は北陸新幹線開業前の水準で推移しており、まだ回復には時間がかかる。
,,□,都市型ホテル（スタッフ）,・イベントがある特定日はほぼ満室になるが、なかなか安定して客室稼働率が上がらない。夏休みにファミリー層を取り込むための商品開発をして客離れを防ぎ、来客数増を図っている。レストラン、宴会部門共に単価アップは期待できない。
,,□,都市型ホテル（役員）,・宿泊部門では、山岳観光のハイシーズンが過ぎて、これからはインバウンド客が減少傾向となる。レストラン部門においては、店舗により異なるが、個人、法人共にまだ回復傾向にはない。一般宴会の申込状況をみると、全館としては景気動向は変わらないと考える。
,,□,旅行代理店（所長）,・夏休みなどでの旅行需要に動きがみられない。
,,□,旅行代理店（支店長）,・現在より良くなる、あるいは悪くなるような具体的根拠がみられない。
,,□,通信会社（職員）,・新サービス商材が早くても９月の投下となり、現状維持でいっぱいである。
,,□,通信会社（役員）,・夏休みは閑散期となるので、契約獲得数が厳しくなると考える。
,,□,通信会社（営業担当）,・しばらくは現状維持となり、10月以降に発売される新商品によって販売が伸びると見込んでいる。
,,□,通信会社（営業担当）,・客の動向をみても大きな変化が感じられない。前年比で同じような推移である。
,,□,テーマパーク（役員）,・２～３か月先の予約状況をみると、国内の団体客は好調に推移するものの、インバウンド客の動きがやや鈍く、全体としては横ばいに推移すると考える。
,,□,競輪場（職員）,・公営競技の業界全体が停滞気味であり、良くなる気配も悪くもなる気配も見受けられない。
,,□,美容室（経営者）,・既にボーナスが支給された企業はあるようだが、景気のいい話が聞こえてこない。
,,□,住宅販売会社（従業員）,・下半期にかけて受注棟数は前年同様と見込まれる。
,,□,住宅販売会社（従業員）,・受注に関して、伸びる要因が見つからない。過去に取引があった関係先からの受注が多く、飛び込み客が少ない。
,,▲,商店街（代表者）,・近隣に大型ショッピングセンターがオープンした影響がありそうだが、まだはっきりとはわからない。徐々にパンチが効いてきそうである。
,,▲,スーパー（店舗管理）,・依然として競合店との集客の競り合いが続く。更に旧盆セールに影響しそうである。
,,▲,衣料品専門店（経営者）,・衣料品の売上については、底打ち感が全く感じられず、依然として厳しい状況が続いている。
,,▲,家電量販店（店長）,・前年に比べて季節商材の動きが悪い。今後の気温上昇に伴って季節商材のピークに偏りが出て、取付工事の集中や商品在庫の不足のため販売機会のロスが発生する懸念がある。
,,▲,乗用車販売店（経営者）,・例年は夏場に入ると来客数が減るので、販売は苦戦するとみている。
,,▲,その他小売［ショッピングセンター］（統括）,・前年に好調だったシネマの反動が引き続き影響するため、来客数は前年比を下回ると考える。また、衣料品のトレンドも前年割れから改善しないため、雑貨、食物販、サービス、アミューズメントの売上に頼る傾向が続く。
,,▲,高級レストラン（スタッフ）,・夏場は団体旅行客や法人接待、法人宴会が一年で最も少ない時期である。個人利用を促すため７～９月末までポイント倍増のキャンペーンを行うが、今のところ受注ペースはよくない。
,,▲,スナック（経営者）,・祝日などが多いと、普段の日も静かになる傾向があり期待できない。また、内外的な要因によりマイナスになることもありえる。
,,▲,住宅販売会社（営業）,・客の動きが限定的になっている。
,,×,－,－
"企業
動向
関連

(北陸)",,◎,－,－
,,○,プラスチック製品製造業（企画担当）,・主力の建築資材では、高齢者住宅や宿泊施設等での伸びを期待している。また、産業資材では引き続き自動車関係の堅調な伸びを見込んでいる。
,,□,食料品製造業（経営企画）,・良くなるにしても悪くなるにしても、これといった変動要因が見当たらない。
,,□,繊維工業（経営者）,・輸出関係の受注状況が、今一つである。
,,□,繊維工業（経営者）,・自動車関連の資材やユニフォーム関連の受注は堅調だが、百貨店での衣料消費の低迷に象徴されるように、衣料関連はスポーツ向けも含めて今後とも苦戦する。
,,□,金属製品製造業（経営者）,・２～３か月先の受注の入り具合をみて、変わらないと判断した。
,,□,一般機械器具製造業（総務担当）,・引き続き、国内、欧米市場からの受注量が安定してくると見込んでいる。
,,□,一般機械器具製造業（経理担当）,・依然として海外向けを中心に受注状況は好調を維持すると考える。個人消費が活発になってきているようにも感じられるため、今後は更なる受注増を期待する。
,,□,精密機械器具製造業（役員）,・今後３か月は数量的には多少増産の計画となっているが、大きく変わるレベルには至っていない。
,,□,建設業（経営者）,・北陸新幹線が一昨年開通し、関連事業がほぼ一段落している。今後、新たな目玉になる事業は多く見込めない。
,,□,金融業（融資担当）,・前向きな投資の話は出てきているが、更なる景気上昇につながる生産、販売拡大のための投資というより、効率化のための投資が多い。人手不足の中、ＩＴ等を活用しながら少ない人員でオペレーションを行うニーズが強い。
,,□,金融業（融資担当）,・建設業者の話では、工事が発注されても人手不足で施工に支障を来すとのことである。
,,□,不動産業（経営者）,・同業者の話だが、最近個人からの問い合わせが増えてきているという情報と、法人からの問い合わせも出てきているとのことであった。
,,□,新聞販売店［広告］（従業員）,・引き続き売上は前年を上回った。ただし、１か月限定の特需的な広告が入ったおかげである。注意すべきは大型ショッピングセンターのチラシ出稿量が落ちていることである。
,,□,司法書士,・事業用資金の借り入れはあまりないが、居住用住宅地の購入や住宅の新築は堅調である。
,,□,税理士（所長）,・一番の問題は、地方での人手不足である。特に当地ではなかなか人が採用できず、昔ほど仕事がこなせていない。また、熟練技術者の高齢化による廃業が見られ、身の回りでも徐々にそうした生産力が失われつつあると感じる。何となく社会の働き場所が限られ、需要があるが人手が足りないという状況は、将来的な伸びしろが薄いのではないかと感じさせる。さらに、給与が上がらないことも影響している。中小企業では消費につながるような給料が従業員へ出ていないと考える。
,,▲,輸送業（配車担当）,・大手物流業者が打ち出した乗務員の週３日の休日運用の影響により、今後は乗務員の賃金が上昇して利益を圧迫すると考えられる。
,,▲,通信業（営業担当）,・今年度に入って売上がガタ落ち状態となっている。理由は不明である。
,,×,－,－
"雇用
関連

(北陸)",,◎,－,－
,,○,新聞社［求人広告］（担当者）,・求人動向が一回りしているので、給与を受ける人数が安定してくれば消費に安定感が出てくるのではないかと考える。
,,○,職業安定所（職員）,・製造業や建設業を中心に、企業の設備投資の高まりによって求人の増加がみられる。しかし、人手不足や海外経済の動向、為替相場の先行き不透明などで懸念がある。
,,○,学校［大学］（就職担当）,・継続募集や新規募集の案内が５月末から続いており、人材確保の厳しい状況がうかがえる。求人件数は前年の件数を超えた。
,,□,人材派遣会社（役員）,・専門技術者の求人が増えているが、経験者が少ないためマッチングしない。
,,□,求人情報誌製作会社（編集者）,・大きな雇用につながる話が出てこない。
