Ⅱ．景気の先行きに対する判断理由,,,,
,,▲,人材派遣会社（支社長）,・引き合いは続くものの、中身に目をやれば難しい要件の物ばかりが目立ってきている。エントリーしにくいオーダーが残っているため、今後マッチングスピードは衰え、決定数も減る。年末の繁忙期までこの流れは変わらない。
,,×,－,－
,,,,
　４．南関東（地域別調査機関：株式会社日本経済研究所）,,,,
,,,,（－：回答が存在しない、＊：主だった回答等が存在しない）
分野,,景気の先行き判断,業種・職種,景気の先行きに対する判断理由
"家計
動向
関連

(南関東)",,◎,スーパー（経営者）,・良くなるように、日々努力している。
,,◎,一般レストラン（経営者）,・３か月後は今よりも、徐々に景気が良くなり、客が増えてくると思う。物価がいくらか下落してくれば、もっと良くなる。
,東京都,◎,観光名所（職員）,・６月は梅雨のはしりで、旅客はそれほど多くない。また、２～３か月後は、８～９月の夏休み期間、秋のはしりとなるため、６月よりは良くなる（東京都）。
,,◎,住宅販売会社（従業員）,・特に今月は悪いが、情報が入ってきているので、今後は良くなる。
,,○,一般小売店［家電］（経理担当）,・来客数が少しずつ増えてきている。商品の問い合わせも増えており、購入意欲が見受けられる。
,,○,一般小売店［祭用品］（経営者）,・どれだけイベント、祭事があるかによるが、街のにぎわいを取り戻そうとする動きがある。
,,○,一般小売店［傘］（店長）,・今年は猛暑と聞いているので、季節商材の需要を期待したい。
,東京都,○,百貨店（営業担当）,・国際情勢や国内政治状況は安定しているとは言えないが、経済面では大きな落ち込みもなく、安定した状態が続いている。個人消費も徐々に伸びていくのではないか（東京都）。
,,○,百貨店（店長）,・大きな競合出店などの環境与件もなく、売上をけん引している各テナントの状況が非常に良い。
,,○,コンビニ（経営者）,・当店近くの工事現場の人数が徐々に増加してきたため、来客数と売上が増加している。
,,○,コンビニ（経営者）,・来月は、最初の週から高温注意報が出ているため、飲料水等を買う客が大幅に増加する可能性もある。ただし、あまりに猛暑だと客が外出しないので、その心配もある。コンビニエンスストアは７～８月と売上、来客数がピークになる。今年の夏、どのように天候が推移し、災害等はないのか、その辺も心配であるが、今までの経緯からすると、順調に同じような動きをしている。
,,○,コンビニ（経営者）,・梅雨が終わり天候が安定すれば、来客数も伸びてくる。
,,○,コンビニ（経営者）,・コンビニは夏に売上のピークを迎える。今年は猛暑と予報が出ているので期待している。
,,○,コンビニ（経営者）,・今年の夏は前年よりも猛暑になると予想されている。コンビニは天候にも左右されるため、売上、来客数も伸びていくものとみている。ただ、業界自体は飽和に近付いており、個店ごとの売上が厳しい状況は変わらない。
,東京都,○,家電量販店（店長）,・季節商材のずれと、テレビ市場における有機ＥＬが単価を押し上げていく（東京都）。
,,○,家電量販店（店長）,・ボーナスを見込んだ購買も見受けられ、全ての客ではないが、回復している感はある。
,東京都,○,乗用車販売店（販売担当）,・経営者の話によると、運送業、建築業共に人手不足のなかで、忙しいようである。募集をしても人が来ない、そのため賃金を上げざるを得ない、賃金を上げても実際の受注価格が上がってこないという状況で、景気は良くなりつつあるが、利益は増えていない状況のようである（東京都）。
,,○,乗用車販売店（渉外担当）,・販売量は前年並みに推移しているが、新型車効果もあり、来客数が増加している。
,,○,乗用車販売店（総務担当）,・ボーナス月、夏のフェア、９月需要月と活発化してくるので、景気は上向いてくる。
,,○,その他専門店［ドラッグストア］（経営者）,・今年の夏は酷暑だということなので、夏物商材の売行きを期待している。
,東京都,○,その他小売［雑貨卸］（経営者）,・政府の打ち出す手立てが、正確に当たっていると思うからである（東京都）。
,東京都,○,その他小売［ゲーム］（開発戦略担当）,・夏以降は有力タイトルが出そろうため、活気が出る（東京都）。
,,○,一般レストラン（経営者）,・２～３か月先は８～９月だが、８月は一番店の売上が落ちる時期である。しかし、６月がかなり落ちており、これ以上悪くなることはないと思うので、少しは良くなるのではないか。
,東京都,○,一般レストラン（経営者）,・近隣にマンション、ホテル、専門学校を建設しているため、回遊者数の更なる増加は期待できる（東京都）。
,東京都,○,一般レストラン（経営者）,・豊洲市場移転問題も、正式に移転が決定し、都議会議員選挙の争点もぼやけてきたので、大方の予想どおりの結果となるとみている。その結果を受け、政治が安定して景気がやや良くなっていくという期待感が膨らむ（東京都）。
,東京都,○,その他飲食［居酒屋］（経営者）,・夏に向けて外で飲む機会が増える（東京都）。
,東京都,○,観光型旅館（スタッフ）,・東京オリンピックがあるので、やや良くなる（東京都）。
,,○,都市型ホテル（スタッフ）,・夏期の行楽シーズンは、景気の上昇がある程度見込める。
,東京都,○,旅行代理店（従業員）,・ボーナス商戦時期であることや訪日外国人の消費、夏休みの旅行シーズンで航空機やホテルなどの空席が少ないことから、やや良くなる（東京都）。
,,○,旅行代理店（営業担当）,・夏季の繁忙期を迎えるため、やや良くなる。
,東京都,○,タクシー運転手,・先行きを展望すると、米国大統領の政権運営など海外の政治、経済動向に不透明感は残るものの、製造業の在庫復元に伴う生産増、世界的なＩＴ需要の拡大や設備投資の回復を受けた輸出の増加、都心部での再開発など非製造業の建設投資、人手不足を背景とした雇用所得環境の改善、が下支えすることで、景気回復基調が続く見込み等の報道から、景気は多少上向きとみている（東京都）。
,,○,通信会社（営業担当）,・新サービスを中心に販売していくことで、販売実績も向上していくものとみている。
,東京都,○,通信会社（管理担当）,・法人企業向けのソリューションは横ばいかと感じているが、個人向け携帯電話やその周辺機器の需要は、夏の商戦期に向け上向くとみている（東京都）。
,,○,ゴルフ場（企画担当）,・夏以降の予約は例年以上の予約数となっている。
,,○,競輪場（職員）,・インターネットでの広告告知、10月まで実施する大規模なキャンペーン、イベントを盛り上げるための協賛金募集、プロレスなどの新規イベント等を同時多発的に行うため、やや良くなる。
,東京都,○,その他レジャー施設［ボウリング場］（支配人）,・消費拡大の手ごたえを感じる月となっている。ファミリー、ジュニア、大人、全ての層の来場数が増えてきている（東京都）。
,,□,商店街（代表者）,・最近、商店街の方々といろいろ話すが、物販はあまり思わしくない結果になっているようである。前年の数字を取ることは大変難しく、努力してもなかなか届かない。飲食のほうがまだ少しは良いのではないか。
,東京都,□,商店街（代表者）,・これから先、７～８月はかなり暑いという予想が出ている。30度を超えると人出が途端に少なくなるので大変である。気候が変わってきているので仕方がないと思うが、商売としてはなかなか難しい（東京都）。
,東京都,□,商店街（代表者）,・都議会議員選挙の影響もある。東京オリンピックに向かって追い風となる結果であれば良いが、逆の場合、商店街などの単位ではやや影響が出るのではないかと懸念される。ラグビーワールドカップもあるし、このビッグイベント２つを利用しようという機運が欲しいところである（東京都）。
,東京都,□,商店街（代表者）,・景気が浮揚する要因を見い出せない（東京都）。
,,□,一般小売店［家電］（経理担当）,・暑い夏になると期待したいが、メーカーに希望の商品がそろっていないようで、繁忙期を控えて心配である。
,東京都,□,一般小売店［家具］（経営者）,・ここ２～３か月、来客数、販売量とも良くもなければ悪くもないという状況である。これから先良くなるかと言われると、変わらないような感じである（東京都）。
,,□,一般小売店［印章］（経営者）,・業種にもよるが、客の購買ルートが全く変わってきている。個店にわざわざ出向くというより、今は通信販売やパソコンでの販売高も膨大なものになっている。次第にそういうものに移行しているのではないか。
,東京都,□,一般小売店［家電］（経営者）,・客からの問い合わせもあまり増えてこないし、新聞、テレビ等の報道でも良くなるようなニュースが出て来ないので、現在の状況が継続する（東京都）。
,,□,一般小売店［文具］（販売企画担当）,・数か月後に予定される大きな案件も特にないが、全く案件がないわけでもない。店頭部門も、極端に良くも悪くもなく、来客数や売上も天候によっては安定しているため、この先の景気は横ばいである。
,東京都,□,一般小売店［茶］（営業担当）,・世間ではボーナスの話などが出ているにもかかわらず、ここのところずっとボーナスが出ていない。とても良くなるとは思えない（東京都）。
,,□,百貨店（売場主任）,・７月はクリアランスで動員があり、前年並みと推測している。クリアランス後から９月前半までは天候に大きく左右される。株価や社会状況に大きな変動がないことが前提条件だが、天候が大きく崩れなければ前年並みで推移できる。
,東京都,□,百貨店（売場主任）,・今の店舗に来て４か月で動きがまだ読めないが、入店と数字が大体前年100％位できていることからして、今後大きく跳ねていくことは非常に難しいため、前年を維持していく動きとなる（東京都）。
,,□,百貨店（総務担当）,・客の様子、販売の量の動き等をみても、消費をこれ以上押し上げるような状況にない。
,,□,百貨店（総務担当）,・ボーナス支給等の追い風はあるものの、消費に対する慎重な姿勢は継続することが予想される。
,,□,百貨店（総務担当）,・消費傾向として、必要なもので付加価値の高い商品を厳選して購入する傾向が継続するとみている。
,東京都,□,百貨店（広報担当）,・来月にクリアランスセールを控え、また、７～８月と高気温が続くとの予報もあることから、夏物を中心に衣料品が動くことを期待したいが、足元では、前年に届くかどうかという水準で推移しており、この先の動向も慎重に見ている（東京都）。
,東京都,□,百貨店（営業担当）,・雨の日が少なく、天候も安定しているが、衣料品の動きが良くない状況が続いている。化粧品はインバウンド需要で大きく前年を上回っている。景気が個人消費を押し上げている実感はない（東京都）。
,東京都,□,百貨店（営業担当）,・アパレル業界の不振が続くなか、晩夏～秋物の動きが大幅に改善する見通しはない。インバウンド需要として、化粧品の好調がしばらく続くと思われるが、以前の爆買いほどのインパクトはなく、全体としては厳しい状況が続くのではないか（東京都）。
,東京都,□,百貨店（営業担当）,・経済環境において好条件がないなか、前年同様に猛暑や台風の影響など不安材料のほうが多い（東京都）。
,東京都,□,百貨店（販売促進担当）,・商品カテゴリー別の売上推移を見ても、傾向はほとんど変わらず、今後消費が活性化されるような材料も特に見つからない（東京都）。
,東京都,□,百貨店（販売促進担当）,・ボーナス増の与件もあるが、目的購買に特化し、消費動向全体のけん引にはつながらないのではないか（東京都）。
,,□,百貨店（販売促進担当）,・現状は、好調な食料品を中心とする消耗品に加え、衣料品の動きも良くなりつつある。今後、クリアランスセールに入ってからの衣料品の動きや、ボーナス支給後の客の様子を見る必要があるが、先行きも変わらないとみている。
,東京都,□,百貨店（計画管理担当）,・今の状態が一過性のものか、今後も継続するか不透明である（東京都）。
,,□,百貨店（店長）,・さまざまな不安要素は取り除かれていない。株価の上昇など、やや明るさも垣間見えることが長い低迷期との差であるとは思うが、それがすぐに回復に直結するということではない。
,,□,百貨店（副店長）,・現時点では、安定的な株価推移などで、客の消費動向も堅調だが、今後の見通しについては不明瞭な部分もあり、楽観視できない。
,東京都,□,百貨店（営業企画担当）,・政治、外交、気候変動等、消費にはさまざまな要因が簡単に影響してしまうため、先読みは困難である（東京都）。
,東京都,□,スーパー（経営者）,・競合店の安売りが激しくなっており、粗利が取れにくくなっている（東京都）。
,東京都,□,スーパー（販売担当）,・競合店との価格競争もあり、平均単価が下がる傾向にある。客の買上点数は前年を上回っているものの、平均単価が下がっている分、１人当たりの買上金額が前年をなかなかクリアできない状況が続いている（東京都）。
,,□,スーパー（経営者）,・競合が出ているため、なかなか厳しい状況が続いている。また、先週の大雨も一つの大きな理由である。それ以外はあまり雨は降っていないが、大雨の日は全く売れていない。いろいろな要因が絡んでいると思うが、一番大きいのは競合が大きいことである。
,,□,スーパー（経営者）,・売上、来客数共に変化はあまりない。
,東京都,□,スーパー（店長）,・来客数が減少している理由が、なかなか店では判断出来ないところがある。３か月後の景気は、本来であればやや良くなるという回答をしたいが、現段階では今と変わらない形で推移していくのではないかと考えている（東京都）。
,東京都,□,スーパー（店長）,・節約志向が依然として根付いており、必要最低限の物を買い回っている。しばらくは現在の状況が続く（東京都）。
,,□,スーパー（総務担当）,・客の購買に対する力強さが見えてこない。これから先、明るい兆しがなく、特別なことがなくなっていることが大きな心理的要因である。ギフト物の売上も良くなく、天候与件も、梅雨又は酷暑で、売上は厳しい状況が続く。
,東京都,□,スーパー（営業担当）,・夏物商材の動きが早く、現在も活発に推移している。販売量は伸びているものの、今のところ買上単価は前年並みであり、販売量の分が上乗せされているという状況である（東京都）。
,,□,スーパー（仕入担当）,・生鮮品の動向が不安定である。食肉は輸入牛、豚肉、鶏肉の動向は良いが、相場が上がり、価格が上昇することが懸念される。
,東京都,□,コンビニ（経営者）,・ここ数か月、あまり大きな変化を感じない（東京都）。
,,□,コンビニ（経営者）,・天候の変化などがない限り、客の動向に変化の兆しはない。
,東京都,□,コンビニ（経営者）,・近隣に店舗が増加する予定のため、悪い方向にいく（東京都）。
,東京都,□,コンビニ（エリア担当）,・施策の投入を継続しているものの、来客数の伸びが追い付いてきていない現状があり、トレンドは大きく変わらない（東京都）。
,東京都,□,コンビニ（商品開発担当）,・来客数は改善せず、今後も改善につながるようなきっかけが見当たらない（東京都）。
,,□,衣料品専門店（経営者）,・この先も暑いとの長期予報があるため、夏物衣料は善戦するとみているが、客の安さへの要望は依然として強く、大幅な売上増は期待できない。
,東京都,□,家電量販店（店員）,・このままの状態では変わらない（東京都）。
,東京都,□,家電量販店（経営企画担当）,・レジ通過客数は堅調に推移するとの楽観的な見方もあるが、生活防衛的な動きとして、単価の動き、特に単価低下にも注目している。このあたりは政局を含めた不安定さ等があり、自信を持てない（東京都）。
,,□,乗用車販売店（経営者）,・自動車の整備と販売をしている。整備は順調に入っているが、販売があまり芳しくない。今年いっぱいは景気が悪いのではないか。
,,□,乗用車販売店（経営者）,・新車の売上は急激には伸びないが、整備部門で補い、前年並みになる。
,,□,乗用車販売店（営業担当）,・ボーナス商戦とは言いつつ、財布のひもは固く、必要に迫られての買換えや新規購入が多く、車が欲しくなって購入する客は少ない。
,東京都,□,住関連専門店（営業担当）,・基本的にはリフォーム需要は堅調に推移するとみているが、今年は生活必需品などの値上げが相次ぐため、消費マインドに影響を与えることが懸念される（東京都）。
,,□,その他専門店［ドラッグストア］（経営者）,・先行きについても、販売量はさほど変わらないのではないか。
,東京都,□,その他専門店［貴金属］（経営企画担当）,・業界全体の景気動向は、悪い方向を向いたまま進む。また、現在好調な企業も、いつ不調に転ずるかわからない状況にある。しかし、景気に大きな変化が表れる外部要因は見当たらないため、変わらない（東京都）。
,東京都,□,その他小売［ショッピングセンター］（統括）,・プレミアムフライデー特需も期待したほどの反応はなく、市場マインドも、導入当初と比較すると低下傾向にあるように見受けられる（東京都）。
,東京都,□,その他小売［生鮮魚介卸売］（営業）,・アニサキス報道の影響による売行き低迷の状況がすでに１か月続いている。これからは食中毒を警戒しなければならない季節でもあり、心配である（東京都）。
,東京都,□,高級レストラン（副支配人）,・法人関連の宴席、予約状況は、ほぼ前年並みの数字で推移している（東京都）。
,東京都,□,高級レストラン（仕入担当）,・販売単価を上げられるほどの勢いは感じられない。先々の予約状況からもほぼ前年並みと見込んでいる（東京都）。
,東京都,□,一般レストラン（経営者）,・依然として人手不足が続いている。豊洲市場移転問題の影響もあると思うが、仕入原価の高騰等、経営的には厳しい状況が続いている。客の財布のひもは、ほんの少しだけ緩んできているように見受けられる（東京都）。
,,□,一般レストラン（経営者）,・景気が良くなるような状況が全く見えないため、変わらない。
,東京都,□,一般レストラン（経営者）,・好転する要素が少ない。仕入値が上がっているのに対し、売価の値上げができていない（東京都）。
,東京都,□,その他飲食［給食・レストラン］（役員）,・取引先と話していても、業況が改善しているという話は全く聞いたことがなく、海外進出等の前向きな話も立ち消えになってしまう傾向にある（東京都）。
,,□,都市型ホテル（スタッフ）,・ここのところ景気が良いのか悪いのか判断しにくい状態が続いているので、この状態がしばらく続くのではないか。
,,□,都市型ホテル（スタッフ）,・今月は復調傾向にあるが、２～３か月先のホテル全体の予約状況を見ると、受注が例年をやや下回っており、厳しい状況である。夏休みなどがあるため、宿泊とレストランは好調を維持できそうだが、婚礼、宴会は夏枯れの時期を迎え、伸びが期待できないことから、景気は変わらない。
,,□,都市型ホテル（総務担当）,・物価や賃金が上昇傾向にあるため、将来のコストアップが懸念され、売上が伸びても、収益は楽観視できない。
,,□,旅行代理店（経営者）,・客の決定がなかなか難しい状況であるため、これ以上は回復は望めない。７～８月はお盆時期に入ってしまい、客自体があまり動かない。
,,□,旅行代理店（従業員）,・繁忙期に入っているが、例年どおりの見込み客以外の新規客の申込がほぼない。あっても単価が低く、海外旅行の販売は著しく少ない。
,東京都,□,旅行代理店（販売促進担当）,・２～３か月後は夏休みで、個人旅行の最需要期になるが、法人関係、また海外団体も含めて動かない時期に入る。個人が増え、団体のＭＩＣＥ関係がなくなることで、ほぼ同じような感じがする。ただし、個人についても、最近は先取感の強い傾向があるため、１か月前になってキャンセル等になると、数字が動く可能性があり、その点は懸念をしている（東京都）。
,東京都,□,旅行代理店（営業担当）,・景気が変化する大きな材料が見当たらない（東京都）。
,,□,タクシー運転手,・ゴールデンウィークが終わり、今度は夏休みに向けて、動いている。今はちょうどその谷間の状態で、夏休みを控えて出費のことを考えると、我々の商売はあまり良くはない。
,東京都,□,タクシー運転手,・タクシー業界は明るい材料が見当たらない（東京都）。
,東京都,□,タクシー運転手,・景気の良し悪しがタクシー利用に反映されなくなっている。以前はよく利用してくれていた新聞、雑誌、広告代理店、コンピュータ関係の客が利用を控えている。景気に関係なく、深夜の客が減っている（東京都）。
,,□,タクシー（団体役員）,・夏季休暇を控え、現状の景気が継続するかは不透明である。
,東京都,□,通信会社（経営者）,・何となく明るい話題が少ない。経済関係に限らず、明るい話題があると消費にも活気が出てくる（東京都）。
,東京都,□,通信会社（経営者）,・加入促進の手立ては画策中で、まだ時間が必要である。取材や広告出稿は季節変動以外に大きな予定はない（東京都）。
