Ⅱ．景気の先行きに対する判断理由,,,,
,,▲,観光型旅館（管理担当）,・海外事業の不振などによる、大企業の赤字が取りざたされるなか、大手自動車部品メーカーの倒産など、不安要素が増えている。また、政治に対する不信感も増しているなど、プラス材料が見当たらない。
,,▲,旅行代理店（役員）,・最繁忙期の夏場においては、インバウンドの激増による在庫不足もあり、実績が伸びない。
,,▲,その他レジャー施設［イベントホール］（職員）,・賃金の伸び悩みや、値上げによる消費の減退、売上の停滞などで、お金が消費よりも貯蓄に回っているため、景気回復の実感がない。
,,▲,その他サービス［学習塾］（スタッフ）,・退会の話が徐々に出てきている。夏休み前に更に増える可能性もある。
,,×,スーパー（経営者）,・価格競争が厳しくなってきていると感じる。大部分の消費者が低い価格を求めているので、資金力が大きく、システムの整ったディスカウントストアに集中しつつある。
,,×,スーパー（店長）,・商品単価や買上点数が悪化している。
,,×,衣料品専門店（経営者）,・公共料金の上昇が生活を直撃している。
,,×,衣料品専門店（経営者）,・前年に比べて売上が10％落ち込んでいる。
,,×,競輪場（職員）,・今月の客単価が上がった反動で、例年はやや悪くなる。
"企業
動向
関連

(近畿)",,◎,木材木製品製造業（経営者）,・現在は商品の需要と供給のバランスが取れておらず、効果的に売上、利益を得ることができていない。今後は両方を改善することで、早く良い結果につながるようにしたい。
,,◎,輸送業（営業担当）,・人手不足解消策として、９月の運賃値上げがほぼ決定したが、今月も荷物量が増え続けている。
,,○,食料品製造業（営業担当）,・梅雨が明けると、一気に気温上昇が見込めるため、飲料水の売上は伸びる。
,,○,化学工業（管理担当）,・受注量が好調なため、やや良くなる。
,,○,プラスチック製品製造業（経営者）,・試作関連の注文も増えている。量産を見据えた試作も含まれているので、徐々に量産品の受注につながる。新規受注の案件も増えているなど、机上の話にとどまらず、実際に物を作るための予算が増えているため、しばらくはこの動きが続く。
,,○,金属製品製造業（経営者）,・地域によっては、災害の復興需要や、東京オリンピックなどの新規需要が動き出している。
,,○,建設業（経営者）,・今の受注や問い合わせの状況からすると、今後は少しずつ良くなる。特に、下半期に向けて良くなることが予想される。
,,○,建設業（営業担当）,・土地の売却情報が少ない状況が続いている。建築用地さえあれば、新たな設備投資を行うニーズは継続的に出てくる。一方、土地のニーズに比べると非常に少ないが、資金調達のために不動産を売却したり、有効活用する情報もあることから、当面は建築需要の安定した状況が続く。
,,○,輸送業（商品管理担当）,・来月、再来月はお中元の時期となるため、販売量が増加する。
,,○,金融業［投資運用業］（代表）,・現政権になって、株価は2.5倍となっている。このままの勢いが続けば好調が期待できる。その一方、勝ち組と負け組の格差が開くことによる悪影響も懸念される。
,,○,広告代理店（営業担当）,・クライアントからの問い合わせが増えてきている。
,,□,食料品製造業（従業員）,・この先は猛暑になる予想であるが、どちらかといえば、当社の製品は夏場には消費が落ちる傾向にある。ただし、夏場には辛口の製品が受けるので、関連する商品を増やして売上を伸ばしたい。
,,□,繊維工業（総務担当）,・特殊な付加価値商品は問題ないものの、売上の中心を占めるボリューム商品は低迷しており、売上が減少している。
,,□,繊維工業（総務担当）,・従来の商品開発や提案では、消費者のニーズや購買意欲が高まらない。若者向けの商品をリサーチしていく必要があり、情報が下流から上流に素早く還元されなければ、メーカーが対応できず、在庫の元になる。
,,□,家具及び木材木製品製造業（営業担当）,・配達量には変化がない。
,,□,パルプ・紙・紙加工品製造業（経営者）,・顧客からは、増産計画に関する情報がない。
,,□,化学工業（経営者）,・新規の案件が少なく、良くなる要素は見当たらないが、これ以上悪くなるような話も出ていない。しばらくは、景気があまり良くない状態が続く。
,,□,化学工業（企画担当）,・市場での商品価値の低下が顕著であり、高機能な製品よりもコストパフォーマンスが最優先されるため、利益の出ない状況が続く。
,,□,窯業・土石製品製造業（経営者）,・中小のガラス瓶製造業者は、数字上は良くも悪くもない。新聞紙上では景気が良いといわれているが、その実感はない。社員のボーナスを増やすなど、対応は進めているが、生活が苦しいとの声が聞かれる。
,,□,金属製品製造業（営業担当）,・鋼材価格の転嫁はなかなか進まない。
,,□,一般機械器具製造業（経営者）,・市場の方向性が不安定なため、思い切った投資ができない。投資意欲があっても決断に至らないようで、今後も迷走すると感じる。
,,□,一般機械器具製造業（設計担当）,・受注量の増加が見込めない。
,,□,電気機械器具製造業（経営者）,・海外との取引は、成果が出るまでに時間がかかる。海外取引を担えるスタッフの育成は困難で、不足しているため、景気が良くなることは期待できるものの、２～３か月では時間が足りない。
,,□,電気機械器具製造業（経営者）,・世界の政治情勢は混とんとしており、経済面にも影響が出てくる。
,,□,電気機械器具製造業（営業担当）,・大型案件もなく、やや悪い状態が続く。
,,□,電気機械器具製造業（営業担当）,・この先は景気の良くなる要素がない。
,,□,電気機械器具製造業（宣伝担当）,・今年は猛暑の予想であるため、エアコンなどの夏物商材は活発な荷動きが期待されるが、季節要因によるものであり、景気が良くなるわけではない。
,,□,輸送用機械器具製造業（経理担当）,・自動車産業以外の引き合いを、いかに受注に結び付けるかが課題である。中小企業の設備投資は相変わらず鈍い。
,,□,その他製造業［事務用品］（営業担当）,・夏休みに入るため、少しは売上が増えると思われるが、全体としては例年どおりと予想される。
,,□,その他製造業［履物］（団体職員）,・個人消費の低迷により、衣料品関係の売上が伸びない。靴メーカーの受注量が伸びず、苦戦する状態が続いている。
,,□,建設業（経営者）,・問い合わせや来場数は増えていると感じる。予算が厳しく、成約に至る確率は低下気味である。
,,□,建設業（経営者）,・今後も東京一極集中の動きが続くと予想される。技能労務者、監理技術者共に、東京に引き寄せられているように感じる。
,,□,輸送業（営業所長）,・新規案件が乏しい。
,,□,通信業（管理担当）,・しばらくはボーナスの影響で好調が続く。
,,□,金融業（営業担当）,・中小企業がもっと活気を取り戻さなければ、景気は変わらない。
,,□,金融業（副支店長）,・外部要因をみても、米国大統領や北朝鮮などの問題は流動的であり、景気が右肩上がりで推移するとは予想しにくい。
,,□,不動産業（営業担当）,・神戸からの企業の撤退は、今後も続くと思われる。現状、神戸では土地の値段が上がり、収益物件の利回りは下がるなど、土地の動きは良いが、実体経済は全く良くなっていないため、将来的にも景気は悪いままとなる。
,,□,新聞販売店［広告］（店主）,・購読数は維持できているものの、折込件数がかなり落ち込んでいる。少々上向いても、良いといえる水準にはならない。
,,□,司法書士,・起業や業務の拡大といったような案件がなく、現在と同じような状態が続く。
,,□,経営コンサルタント,・人材不足で、社員の個々の能力を強化する必要がある。各社の要求は継続的なものであり、今後も教育訓練によって管理職を強化したい。
,,□,コピーサービス業（店長）,・特別なプラス材料もないため、今の状態がしばらく続く。
,,□,その他サービス［自動車修理］（経営者）,・今の状況が変わる要素はない。
,,□,その他非製造業［機械器具卸］（経営者）,・今の状況からみて、今後も大きな変化は起こらない。
,,□,その他非製造業［衣服卸］（経営者）,・当面は特に景気が刺激される材料もなく、ほぼ現状どおりの販売の地合いが続く。
,,□,その他非製造業［電気業］（営業担当）,・今後の経済展望が見通せない。
,,▲,繊維工業（団体職員）,・ギフト需要が低迷しているとの声があるため、７月の動きが懸念される。
,,▲,出版・印刷・同関連産業（営業担当）,・今後２～３か月で大きな需要は見当たらず、伸びる傾向の業種もない。毎年夏は売上が落ち込む時期であるが、今年は例年を下回る見込みである。
,,▲,金属製品製造業（管理担当）,・材料費の値上がりが止まらないが、販売価格に転嫁できず、１つの工場で毎月100万円以上の損失が出ている。今後は、販売価格を仕入金額に合わせなければならないが、それに伴う顧客離れが懸念される。
,,▲,広告代理店（企画担当）,・セールが終わった後も猛暑が続くと予想され、外出機会の減少を懸念している。商業施設では、セール後の失速が例年よりも大きくなる可能性がある。
,,▲,広告代理店（営業担当）,・今のところは良い材料が見当たらない。
,,×,その他非製造業［商社］（営業担当）,・新製品の開発や販売ができていない以上、淘汰されることになる。また、今の状況が続けば、ターゲットとする業界を取捨選択する時期が、そう遠くない段階で訪れる。
"雇用
関連

(近畿)",,◎,－,－
,,○,人材派遣会社（支店長）,・しばらくは今の動きが続く。
,,○,職業安定所（職員）,・直近の有効求人倍率が1.49倍と、昭和48年５月以来の高水準となり、雇用失業情勢は着実に改善が進んでいる。また、前年比で求人数が増加している一方、有効求職者数と雇用保険受給者数は減少傾向が続いている。管内事業所への今後の展望についてのヒアリングでは、現状維持とする事業所が約７割で、明るい、やや明るいとする事業所が２割を占めている。
,,○,学校［大学］（就職担当）,・インバウンドの動きが活発になっているように感じられる。都心部のターミナル駅では、最近また観光客が増えている。
,,□,人材派遣会社（経営者）,・今後も当分の間、企業は慎重な姿勢となる。採用に関していえば、世間でいわれているような力強さが全く感じられない。右肩上がりのトレンドには変わりないが、例年はゴールデンウィーク明けに大きな案件が出てくるものの、今年は全くみられなかった。今後、当分は緩慢な採用の動きが続く。
,,□,人材派遣会社（営業担当）,・これから夏にかけて、求職者、求人数共に、別の月に比べて減少傾向となるため、９～10月までは現状のままとなる。
,,□,人材派遣会社（役員）,・このまま人手不足の状況が続けば、経済活動に支障が出る可能性がある。
,,□,アウトソーシング企業（社員）,・雇用の正社員化が進まない。
,,□,アウトソーシング企業（管理担当）,・季節商材の仕事が入ると思われるが、それ以外は期待できない。
,,□,新聞社［求人広告］（管理担当）,・新聞求人をみる限り、景気が良くなるとは考えにくい。決算発表のシーズンを迎え、輸出企業を中心とした大企業の好決算が新聞をにぎわせているが、中小零細企業が多い関西が、大企業の好決算による恩恵を受けているとは、残念ながら感じられない。
,,□,新聞社［求人広告］（担当者）,・このまま、上振れすることもなく推移していく。
,,□,職業安定所（職員）,・景気回復や人材不足の傾向は変わらず、求人の伸びは続くと思われる。その一方、大手自動車部品メーカーの倒産に伴う下請企業の雇用動向や、中国景気の減速懸念など、注意すべき点もみられる。
,,□,民間職業紹介機関（職員）,・建設日雇求人での社会保険加入の義務化と、雇用保険の適用厳格化の影響により、現場の混乱と雇用の抑制が続いている。また、人手の確保が困難なことから、新規の事業に手を出すことができないといった声も、事業所からは聞かれる。
,,□,民間職業紹介機関（営業担当）,・現在の好調さは、世の中の景気が良いからではなく、就活時期が理由であるため、いつまで続くのかは分からないが、２～３か月は今の状態が続く。
,,□,民間職業紹介機関（営業担当）,・季節的な要素もあり、紹介依頼件数、求職者数共に、あまり動きがないと思う。例年は、９月ごろから徐々に良くなる傾向となる。
,,□,学校［大学］（就職担当）,・人材不足に変化はなく、求人の勢いは前年並みである。
,,▲,人材派遣会社（営業担当）,・求職者の動きについては、８月ごろまでは転職活動が落ち着く。
,,▲,学校［大学］（就職担当）,・中小企業の採用意欲は高いものの、本当に必要な人数を採用しようとしているのか、周辺企業の影響なのかが分からない。企業が必要な人数を採用できる手段を選び、適正な規模の採用活動をすれば、過当競争がなくなり、採用関連ビジネスは縮小する。
,,×,－,－
,,,,
　８．中国（地域別調査機関：公益社団法人中国地方総合研究センター）,,,,
,,,,（－：回答が存在しない、＊：主だった回答等が存在しない）
分野,,景気の先行き判断,業種・職種,景気の先行きに対する判断理由
"家計
動向
関連

(中国)",,◎,一般小売店［靴］（経営者）,・単価の高いオーダーメイド靴を購入する客の周りには高級品を購入する客層が一定数ある。
,,○,一般小売店［眼鏡］（経営者）,・土木建築業の景気が良くなる。
,,○,スーパー（店長）,・梅雨明けになり晴天が増えれば季節商材の動きが良くなり、レジャーなどでの需要も伸びる。
,,○,コンビニ（エリア担当）,・来客数の伸びにまだまだ期待できる。
,,○,コンビニ（副地域ブロック長）,・日常生活に必要な商品群が高い伸びを示していることから、今後も客の購買の頻度は低下しない。また、今年は猛暑が予想されるため、前年と比べて飲料や酒の販売量が増える。
,,○,家電量販店（店長）,・来客数が前年の102％で推移しており、今後も現状が続く。
,,○,家電量販店（販売担当）,・エアコンの需要に期待が持てる。
,,○,家電量販店（企画担当）,・季節商材の動きが良くなる。
,,○,乗用車販売店（業務担当）,・新型車の投入があるので、しばらく好調が続く。
,,○,乗用車販売店（営業担当）,・現在が景気の底であり、新型車が出れば来客数は増える。
,,○,乗用車販売店（営業担当）,・夏にかけて客の動きが良くなる。
,,○,その他専門店［土産物］（店長）,・８～９月にかけて花畑にはヒマワリが咲き、ブドウやイチジクなどのフルーツのイベントも行うとともに、広告等の販売促進にも力を入れるため、来客数と売上が共に増加して景気はやや良くなる。
,,○,その他小売［ショッピングセンター］（管理担当）,・６月に新たな施設がオープンしたことで集客効果が期待できる。
,,○,一般レストラン（経営者）,・最近商工団体での会合で今年の夏ボーナスの話が多く聞かれるため、期待が持てる状況になりつつある。
,,○,一般レストラン（店長）,・予約状況から現状の売上は前年と同程度になると見込んでおり、先行きで増加となることは確実である。また、前年に比べてインバウンド予約も増えているので、それに伴った売上も増加する。
,,○,一般レストラン（外食事業担当）,・前年は再開発の影響で駐車場利用が不便になって集客が良くなかったが、それが解消されて競合店とのすみ分けも一段落している。予約は前年の160％を超え、平日売上は前年の105％となり、今後も来客数は順調に推移していく見込みなので、暑い時期や夏休みに対応した活動を展開していく。
,,○,観光型ホテル（営業担当）,・夏に向けて来客数は増加する。
,,○,都市型ホテル（総支配人）,・前月同様に観光客、学会絡みの先行予約は順調に推移しており、デスティネーションキャンペーンなどによる観光客の増加に期待が持てる。
,,○,タクシー運転手,・ボーナスが出るところが次第に増え、観光地も混むようになり、梅雨の影響もあることに加えて新卒の新人もそろそろ戦力になるので状況はやや良くなる。
,,○,タクシー運転手,・気温が上がればタクシー利用の客が増え、ビヤガーデンが始まれば夜の客も増えるので７～８月は忙しくなる。
,,○,通信会社（工事担当）,・客の様子から景気は上向く。
,,○,テーマパーク（業務担当）,・台風等の天候の心配も増えてくるが、夏休みから秋の行楽シーズンが続く時期となり、多くの集客が期待できる。
,,○,競艇場（職員）,・８月初旬の本レース、下旬のＧ３競争で売上が確保できる。
,,○,住宅販売会社（営業担当）,・引き合い案件が多くなってくる。
,,□,商店街（理事）,・収入に大きな変化はなく、客の生活防衛本能は強まり、景気は良くならない不安感と堅実な消費行動とが継続する。
,,□,商店街（代表者）,・商店街に出店したいとの話はあるが、出店予算の関係で計画のみにとどまっている。
,,□,商店街（代表者）,・消費者の購買意欲の低下で景気の停滞は続く。
,,□,商店街（代表者）,・大都市部では景気が上向いているようであるが、地方都市では業種によって状況が異なり、客の動向がつかめない。
,,□,商店街（代表者）,・客の買い控え姿勢は続く。
,,□,一般小売店［印章］（経営者）,・会社設立用の印鑑注文などの前向きな注文が減少している。
,,□,一般小売店［食品］（経営者）,・平均単価の低下と来客数の減少傾向に変化はない。
,,□,百貨店（経理担当）,・前年売上を達成できるかどうかの状況が続く。
,,□,百貨店（営業担当）,・衣料品は前年以上の施策を行わないと前年売上をクリアすることは難しい。
,,□,百貨店（営業担当）,・必要な物だけを購入する客の購買動向に変化はなく、８月の最終セール、９月の秋物立ち上がりも現状から大きく好転することはない。
,,□,百貨店（販売促進担当）,・お中元商戦、夏のセールが本格化してくる一方で、アパレルの生産調整が進んでおり、品ぞろえが良くなく、大きな期待はできない。
,,□,百貨店（購買担当）,・以前であれば土日や売出し開始日に来客数は増加したが、現在それほどの集客力はない。駅周辺部にドーナツ化現象がみられ、隣の専門店にも空き店舗が増えているので来客数は減少する。
,,□,百貨店（売場担当）,・地域性や経済動向に大幅な変動はなく、現状維持が継続する。
,,□,百貨店（外商担当）,・前年の売上ベースは保っているものの、それを上回る様子はなく、このまま推移する。
,,□,百貨店（売場担当）,・クリアランスセールが前倒しになっており、７月はセールの勢いが早く収束する。
,,□,百貨店（人事担当）,・地元産業の景気は少しずつ上向いているが、今夏のボーナスは前年度の成績が反映されているので、今の景気が反映されるのはもう少しあとになる。
,,□,スーパー（店長）,・客の消費動向が上向きになる要因がなく、必要最低限の購買行動が続く。
,,□,スーパー（店長）,・景気を判断する材料はない。
,,□,スーパー（店長）,・国際問題などの不安要素が多く、これといった明るいニュースや具体的な政策が乏しい。株価は上がっているが恩恵を受けるのは一部で、ますます格差が広がる。
,,□,スーパー（店長）,・競合店が２店舗出店しており、客単価、来客数、販売点数が前年を下回る状況は続く。
,,□,スーパー（店長）,・梅雨が明ければ夏物の動きが活発になり、景気は回復してくる。
,,□,スーパー（総務担当）,・来客数、客単価共に伸び悩む。
,,□,スーパー（販売担当）,・前年よりも父の日の商品の動きは悪いが、単価が上昇したことで今後の売上にそれほど影響はない。
,,□,コンビニ（エリア担当）,・前年よりも天候などの条件が良ければ前年の数字をクリアできる。店のメンテナンスや接客の見直しをして前年数値クリアを目指している。
,,□,コンビニ（支店長）,・来客数は回復状況であり、現状のまま推移する。
,,□,衣料品専門店（店長）,・４月から来客数が減少し続けており、回復する手段がない。ボーナス時期になれば何か動きがあるかもしれない。
,,□,家電量販店（店長）,・猛暑になってエアコンを中心とした夏物商材が動かないと景気に変化はない。
,,□,家電量販店（店長）,・景気が良くなる材料が何もない。
,,□,乗用車販売店（統括）,・新型車効果が弱まるので、販売量は伸びない。
,,□,乗用車販売店（店長）,・景気が良くなる要因はない。
,,□,乗用車販売店（営業担当）,・４月以降苦しい販売状況が続いており、客も出費に対して厳しくなっている。
,,□,乗用車販売店（総務担当）,・今年度に入って徐々に販売成績は良くなっているが、商談件数はまだまだ伸び悩んでいるため、現状維持が精一杯である。
,,□,自動車備品販売店（経営者）,・大手メーカーは利益を末端の販売店や社員に還元して金を循環させようとは考えておらず、メーカーの体質、法律を変えない限り景気は良くならない。
,,□,その他専門店［和菓子］（経営者）,・来客数が増加する要因がない。
,,□,その他小売［ショッピングセンター］（所長）,・空き区画は現状のままなので厳しい状況は続く。
,,□,高級レストラン（宴会サービス担当）,・新商品の投入などで来客数は順調に推移し、予約状況も前年並みである。
